13675	 многий аналитик предсказывать развитие событие принцип домино разрушение договор 
38622	 бесконечно крутить стол смешивать кость домино 
38622	 там полутьма играть домино перегородка арматура запрыгать 
38622	 там они причесывать мокрый волос играть домино красноперов опять замечать 
38622	 играть карта играть домино рассказывать друг друг разный история 
38622	 хотеть сыграть домино сказать андрей михайлович дружелюбный разглядывать 
38622	 я никогда жизнь играть домино убеждать великий мудрость 
38622	 однажды вечерний уборка заканчиваться санитар садиться угол играть домино застучать костяшка 
38622	 он быть преступник он быть парикмахер город керчь никто никогда думать он дурно родные сосед двор мастер работа приятель который он пить вино есть копченый кефаль играть домино 
13675	 он вызывать принцип домино региональный гонка вооружение мочь 
13675	 наконец потребоваться удержание рынок корпоративный облигация эффект домино блокирование важный канал инфицирование финансовый 
13675	 во-вторых срабатывать эффект домино сланцевый революция сша 
38622	 мужик сидеть там вечер играть шахматы домино 
38622	 он слушать свертывать угол пропадать вид я вдруг захотеться оставаться здесь садиться лавочка смотреть просыпаться город разгружать хлеб поливать улица продавать газета клеить объявление пятый слой старый весь одесса объявление продавать покупать торговаться меняться знакомиться жениться разводиться идти работа работа играть шахматы домино пить пиво балаболить так 
13675	 далеко все быть валиться принцип домино 
13675	 его столкновение работать аппарат также фрагмент мусор себя приводить лавинообразный риск новый инцидент подобный род свой род эффект домино сталкиваться два достаточно крупный объект 
38622	 существовать также целый направление занимательный математика который главный действующий лицо шахматный доска она фигурировать кость домино шахматы 
38622	 избегать тихий безжизненный шахматы шумно греметь костяшка домино час выкладывать замысловатый схема какой-то 
13675	 ход событие эффект домино становиться вовлекать орбита начинаться 
13675	 я старый я серьезный проблема здоровье я все равный умирать рано они я добираться горький торжество заключать вильям эффект домино падение фондовый показатель наносить еще 
38622	 каптерка казенный помещение охрана солдат играть домино 
38622	 полностью исключать подготовка стоять тогда шахматы превращаться домино 
38622	 гарри я вчера прогуливаться бульвар любоваться каспий обращать внимание лавочка многие играть нарды домино шахматы почти никто 
38622	 один ствол сбивать другой костяшка домино 
38622	 помешать наличие шахматы шашка продажа иметься их походный вариант домино карта 
13675	 то эрозия то хрупкий доверие банк мочь обертываться массовый уход долларовый гавань возникновение эффект домино 
13675	 быть передача принцип домино там онколог говорить то 
13675	 во-первых недавний расширение евросоюз это прецедент открывать перспектива продолжение такой процесс принцип домино 
13675	 мой семья большой стирка окно принцип домино много другой программа работать 
13675	 например реальный шоу стекло последний герой фабрика звезда ток-шоу окно большой стирка принцип домино т п 
13675	 сбой все один электростанция возникать эффект домино секунда 
13675	 то самый кольцо американский блокада фактически сомкнутый кнр быть разрывать что эффект домино неизбежный серьезный перемена средний 
13675	 действие сша давать толчок эффект домино большинство страна становиться вводить ограничение 
38622	 они начинать посещать лечебный трудовой мастерская мужчина столярный цех женщина швейный помогать подсобный хозяйство вовлекаться культурно просветительский мероприятие чтение журнал газета совместно персонал просмотр кинофильм телепередача последующий их обсуждение играть шахматы шашка домино осваивать прикладной искусство вышивание выжигание 
13675	 стоить один сказать заснуть потерять сознание принцип домино валиться все 
13675	 карточный схватка ник шедоу мы видеть рейкуэл воображать себя новоявленный проповедник белый хитон длинный волос интриговать черный очки тип какой-нибудь виссарион который сначала вести себя выстраивать ряд одинаковый манекен манкурт потом безжалостно вышагивать он низвергать один его пренебрежительный жест принцип домино 
13675	 он она прочерчивать прямой эфир принцип домино киевский русь советский 
13675	 это елена ханга ищеев принцип домино борис берман ильдар жиндарев 
13675	 начинать самый ясный случай два елен ханга ищеева их принцип домино 
13675	 принцип домино другой программа выходить она 
13675	 обыденный сознание который лежать основание такой программа мой семья хотеть женщина большой стирка принцип домино свой род планктон начало начало 
38622	 шахматы нарды бридж уно замок призрак табу отель книга джунгли шах дама домино победитель открывать новый земля 
38622	 полка отделывать иранский стиль магазин красивый удобный настольный лампа тарелка чашка блюдце рюмка стопка домино шахматы поднос 
13675	 нтв быть такой ток-шоу принцип домино 
13675	 курить запираться квартира принцип домино 
13675	 я свой рука это слышать принцип домино 
13675	 эфир нтв передача принцип домино вспоминать минувший день былой 
38622	 человек двадцать сидеть шашка шахматы домино 
13675	 стоить кто-либо поскальзываться крутой склон срабатывать принцип домино падать уже несколько человек 
13675	 большевистский верхушка подумывать поход индия избавление она английский владычество должно быть вызывать эффект домино 
13675	 убежденный ельцинист справедливо напоминать проигрывать борис николаевич м немедленно срабатывать принцип домино нестабильный российский экономика рухнуть 
38622	 подумать тяжелый год серьезный человек заниматься игрушка этот раздел математика описывать собственно игра например шахматы домино так различный ситуация возникать 
38622	 играть спектакль весь театр держаться напряжение кулиса говорить шепотом ходить коридор мягкий поступь стучать дверь игра домино шахматы прекращаться 
38622	 открывать я дверь порог спокойно я говорить я выходить замуж заходить хотеть сыграть домино мой муж любить играть 
38622	 заходить хотеть сыграть домино мой муж любить играть 
38622	 мания величие лилипут считать себя самый маленький мир что домино спорт чисто ваш шахматы 
38622	 стол быть рассыпать белый костяшка домино который никто здесь 
38622	 задымить прокуривать бытовка где коротать нелетный погода старый молодой технарь обсуждать житейский дело пересказывать старый анекдот перестук костяшка домино я пространный объяснять горяев 
38622	 еще лэард уэйн вудруфф ухитряться выстраивать сложный конструкция костяшка домино 
38622	 теперь мы уже коммунальный дворик забивать козел крепко пристукивать оно костяшка домино забивать всенародный площадь 
38622	 немецкий профессор полагать механический прообраз цепной реакция мочь быть падение костяшка домино поставлять затылок друг друг 
38622	 они играть домино кошка мышка 
38622	 шашка домино ничто оставаться весь слопать 
38622	 он начинать неудержимо рвать рвать шахматный пешка костяшка домино 
38622	 заключение торжество состояться опять-таки ночной митинг который весь участник стоя исполнять гимн общество слово припев жизнь наш рука друг черный костяшка домино текст быть переводить 
1	 спина участковый пилипенко прихотливый воля случай опять образовываться густой пустота зиять провал который отдельный костюм домино стоять людмила гасилов третий женщина 
38622	 сестра сделать укол выходить свой дело кажется впервые целый день ион овсеич оставаться один коридор больной стучать костяшка домино хлопать дверь женский туалет чей-то 
38622	 палата постукивать костяшка домино забивать козел обеденный стол 
1	 обычай новый год открываться великолепный маскарад дама кавалер домино проходить царский покой 
1	 прекрасно костюм домино пустяк находить 
1	 филарет быть первый раз маскарад тогда видать домино прежде 
1	 получать телеграмма быть благородный собрание маскарад воскресение подпись голубой домино 
1	 немецкий маскарад убогий роскошь наряд трепаный домино замарьяживать бульвар пьяный гость 
1	 это быть маскарад художник юон святки я закутывать красный шелковый домино вызывать удивление 
1	 так приблизительно одевать маскарад молодой человек провинциальный костюмер который все уже разбирать шестеро желать оставаться костюм офелия розовый домино два рыжий парик 
1	 этот маскарад николай аполлонович чрезвычайно довольный лицо убирать обратно кардонка сперва красный домино он черный 
1	 легко гримасничать танцевать идти вы маскарад пара сплетаться вихор вальс диадема алмаз блестеть кто-то сорвать она маска лицо просиять промчаться красный домино хохот слышаться тамбурин звенеть скрипка 
1	 там можно быть видеть веселый старик наружность отставной унтер черный сюртук дядя император окружать всегда разноцветный домино 
1	 наш встреча клуб происходить время маскарадный бал она быть маска домино аристов представлять я фамилия маска 
1	 этот маскарад дама должный быть являться домино баут быть 
1	 однажды немецкий клуб помещаться дом челюсткин время маскарад я подходить неизвестный я стройный маска черный домино 
1	 я послушаться облекаться домино первый маскарад 
1	 бенкендорф другой мочь он прощать выходка столкновение он голубой розовый домино маскарад дворянский собрание 
1	 раз он я потащить маскарад дворянский собрание взять княгиня одоевский ее маска домино накинуть он гусарский 
1	 мы быть удивленный зрительница сестра играть тот роль год рим маскарад тогда мой отец взять ложе герцен мы захотеться посмотреть маскарад близко мы надевать маска домино сходить зала где 
1	 другой теперь известный генерал доходить то являться бюргерский маскарад костюм адам прикрывать черный домино становиться кружок дама 
1	 месяц два уже николя весь маскарад постоянно ходить один женский маска черный домино сам быть 
1	 оно прежде так быть я замечать этот постоянно увлекать собственный мысль теперь маскарад кончаться домино быть снимать венок попадать 
1	 признаваться откровенно ты ровно ничто я знать подходить я пошлый вопрос который маскарад каждый домино быть каждый женщина предлагать 
1	 военный генерал офицер прежний время мочь являться публичный маскарад шпага домино венециан мундир 
1	 оба этот маскарад доставлять я удовольствие красивый зрелище то веселиться маскарад надобно быть действующий лицо я быть инкогнито домино маска иметь личный 
