37840	 это быть старый ежикин дуб крыльцо мощный крона корень его язык пламень 
28683	 специально национальный герой центр репродукция устанавливать льготный тариф словацкий крона обычный 
37840	 карликовый отличаться синий окраска хвоя строго конический форма крона 
37840	 напротив крона шаровидный хвоя зеленый 
37840	 карликовый сорт очень хороший шаровидный крона светло-зеленый цвет 
37840	 добавлять композиция золотистый тон можно использовать молодой растение сорт красивый медленнорастущий кустарник яйцевидный форма крона 
28683	 конечно зарабатывать хватать следующий зарплата это такой проблема наличие избыток рубль доллар евро крона монгольский тугрик нужный подчеркивать она 
37840	 он выходить сырой пахучий сад где ничто перемениться становиться еще высокий раскидистый дерево разрастаться куст жасмин сирень совсем загораживать покоситься домик бродить лунный дорожка яблоня сидеть скамеечка дальний участок три береза четвертый настояние сосед сразу бабушкин смерть спиливать срывать яблоко свой ровесница антоновка который никуда ездилан учиться грешить мучиться что сомневаться что стремиться обживать маленький кусок земля корень воздух крона чей бескорыстный существование 
28683	 выдерживать такой прессинг родня уступать оттяпывать полмиллиона наследственный крона 
37840	 внизу темный крона тополь слабо отсвечивать асфальт 
37840	 двор внизу ярко вечер гореть мачта фонарь сильно светиться кузов автомобиль прогал черный тополевый крона 
37840	 шишка пихта кавказский свечка украшать осень самый верх крона они никто видеть лежать 
37840	 дело то зацветать давать плод он мочь полный солнечный освещение что он нужно подниматься крона дерево 
37840	 многоножка южный настоящий эпифит преимущественно расти замшелый ствол дерево ее крупноперистый лист можно видеть высоко земля крона большой дерево 
37840	 загнать вольер они свободно передвигаться крона дерево разносить лес 
37840	 он развертывать андрей окно тот увидеть крона дерево бешено проноситься мимо стекло 
37840	 береза сохранять свет крона они золотиться озарять закат сосна 
28683	 пиастр крона доллар твердить он франк иена 
37840	 конец май щегол особенно самка много хлопоты основной крона дерево искусно строить гнездо 
37840	 она живой женщина память возникать идти рост слово отдушина оно пускать корень оно расти раскидывать крона объем свой 
37840	 вообще эвкалипт очень быстро расти каждый кто хотеть чувствовать себя взволнованный патриарх мочь посадить эвкалипт дождаться его высокий позвякивать елочный игрушка крона 
37840	 этот место я сделать жест указывать крона один камфорный дерево 
37840	 они высокий самый высокий каштан светло-зеленый холм выситься они крона лес 
37840	 мокрый крыша покачиваться бедноватый сентябрьский крона сам крыша выглядеть мрачно 
37840	 мы пахнуть холод зашелестеть зашептать густой лист крона дерево 
37840	 изредка солнечный свет пробиваться крона дерево длинный тонкий палец 
37840	 болтовня первый птица разноситься лес смыкать узкий дорога крона старый дерево 
37840	 они так бормотать случаться небольшой событие глубина еловый густой крона 
28683	 тут быть пачка канадский доллар английский фунт голландский гульден латвийский латы эстонский крона 
28683	 лежать кровать тяжелый голова жжение грудь клиссон курить папироска размышлять какой образ получать крона 
28683	 клиссон взять крона быстро приводить белье 
28683	 приезжать полчаса город клиссон полюбоваться свой крона направляться трактир фукс 
28683	 менять крона он испытывать некоторый удовольствие 
28683	 много прачка всматриваться картина понятно становиться она это точно тот дом откуда исчезать злополучный крона 
37840	 звон шепот летний день полный звезда окно темный крона одинокий ива тот пора 
37840	 интересный я сейчас три год обитать домик кашгарка мой дед бабка несколько каникулярный неделя я они проводить сущность мало что помнить узбекский кладбище взгорок последний лоскут последний майский мак ветерок бежать засыхать глина скорпион старый ива лиловый окно прореха текучий крона 
37840	 этот пышный зефир крона магнолия служить боковой кулиса к 
37840	 парфюмерный крона магнолия еще потерять свой 
37840	 дом стоять тихий очень зеленый улица весь двор быть укрывать какой-то лиана виноград крона пальма австралийский клен так 
37840	 взмах дирижерский палочка птичий гвалт взрываться крона роскошный парковый чинар потом открываться 
37840	 наш окно ветреный ночь безжалостно тискать крона дерево парк 
37840	 прогреметь первый трамвай зачирикать закаркать засвиристеть оголтелый хор птичий стая крона утренний чинар 
28683	 книга беспокойство стоять норвежский крона рубль дешевый 
28683	 деньги небольшой крона то менее это 
28683	 мужчина признавать виновный взлом система банк незаконный перевод тысяча шведский крона счет его клиент 
37840	 иногда порыв ветер появляться просвет крона 
37840	 крона сосна вновь начинать свой колебание 
37840	 костер трещать выбрасывать искра искра взлетать самый крона сосна некоторый гаснуть 
37840	 крона дерево лазить сумчатый зверь тогда 
37840	 мост он пересекать железный дорога далеко свертывать направо поехать ограда ваганьковский кладбище который фонарь громоздиться обледеневать крона дерево 
37840	 прямой длинный улица ограда кладбище заиндевелый крона дерево фонарь что-то напоминать 
37840	 они идти аллея пруд крона дерево огрузнуть утренний снегопад 
28683	 случай постройка один военный тяжеловодный реактор наработчик мощность мвт оснащение один эскадрилья самолет штурмовик порядок миллион шведский крона тот эквивалент 
28683	 случай постройка один двухцелевой тяжеловодный реактор мощность мвт оснащение ягч несколько дивизион тактический ракета порядок миллион шведский крона тот эквивалент 
28683	 случай постройка один двухцелевой тяжеловодный реактор мощность мвт оснащение один эскадрилья самолет штурмовик дивизион тактический ракета подлодка торпеда ябча порядок миллион шведский крона тот эквивалент 
28683	 гектор весь эстонский банк принадлежать финн швед курс эстонский крона очень стабильный 
28683	 то она отрабатывать посудомойка первый два неделя она давать несколько хрусткий новенький цветной бумажка прямоугольный форма чешский крона 
28683	 мария федоровна иметь банк заем размер крона который гарантировать быть 
28683	 заботиться свой национальный самобытность швед референдум отказываться вступать зона евро настаивать сохранение шведский крона 
28683	 стоимость работа составлять миллион норвежский крона примерно миллион доллар 
28683	 целое год статфьюре быть добывать нефть газ трлн норвежский крона млрд доллар текущий 
28683	 это значительно много быть вкладывать добыча тот время суммарный инвестиция месторождение составлять млрд норвежский крона млрд доллар 
28683	 численность работать человек г производить продукция оказывать услуга стоимость шведский крона получать прибыль сумма 
28683	 выход продукция га лесной площадь составлять шведский крона дол 
28683	 цена ничто вы сказать мы датский крона курс я знать 
28683	 имеити вид цена местняя чешский крона калкулатор евро никак 
28683	 что касаться третий закупать швеция три год назад быть употребление кронборг датский крона евро 
28683	 погасить часть долг копенгаген выплата оставаться датский крона евро решать вернуть 
28683	 стоимость каждый такой лодка составлять млрд датский крона евро 
28683	 ежегодный бюджет оборона млрд датский крона млрд евро 
28683	 указанный сумма млрд датский крона евро предназначать 
28683	 поставлять фишка стоимость пять крона черный 
28683	 коридор где звенеть мелочь игральный автомат мы останавливаться сунуть крона щель однорукий бандит дернуть 
28683	 я приходиться поддерживать брюки карман набивать увесистый крона бить коленка 
28683	 он давать я поднос фишка я относить они бар напротив получать деньги четыре тысяча крона пятьсот доллар 
28683	 зарплата начинающий журналист небольшой газета крона опытный 
28683	 зарплата депутат считаться довольно высокий крона 
28683	 напоминать курс шведский крона доллар 
28683	 правда дело осложняться то деньги он тот момент быть мы выдавать часть суточный витя первый день гастроль назанимать другой актер сто крона купить жена шуба 
28683	 суд выясняться подробность еще сентябрь год автомобиль угнать стольный град осло гражданка марит радфорд весь право машина выплата страховка крона переходить норвежский компания 
28683	 увольнение город они давать первый раз два месяц выдавать немного деньги настоящий полновесный крона 
28683	 платить вы приходиться шведский крона 
28683	 пересечение такой количество граница страна шенгенский зона надо расслабляться вы мочь оказываться стокгольм крона шведский дания 
28683	 крона вы понадобиться практически сразу плата 
28683	 большинство азс оставаться открытый колонка самообслуживание который принимать кредитный карта банкнота крона 
28683	 тот шведский который принимать расчетный билет королевский банк номинал крона называться 
28683	 потом вносить обратно полный североамериканский доллар фунт стерлинг дойчмарка франк французский швейцарский шведский датский крона ценный очень ценный 
28683	 пасть жертва собственный доброта он так как другой покорно заплатить крона деньги весьма наш положение 
28683	 мюйр прошествовать банк я оставаться сидеть линкольн разглядывать ценник цветок пытаться перевести крона доллар доллар 
28683	 их министерство иметь валюта коллектив рсфср отпускаться валюта соцстрана чешский крона венгерский форинт польский злотый 
28683	 какой сущность разница деньги считать крона уже сбиваться инерция 
28683	 предварительный данные материальный ущерб достигать чешский крона тыс 
28683	 объединять актив составлять млрд норвежский крона млрд 
28683	 дело возбуждать отношение и е капитан судно ми нижневолжск принадлежать тоо рыбакколхоз ударник который сокрытие учет часть вылавливать рыба реализация ее норвежский фирма нильс нильсен присваивать валютный средство размер тысяча норвежский крона 
28683	 один норвежский издательство решать сделать себя она реклама выпускать она любовь пчела трудовой миша зарабатывать наш семья сколько-то крона перевод 
28683	 приходиться выкладывать чешский крона который быть жалко потому 
28683	 это издевательский роскошный рынок быть все доллар фунт датский крона они свет окошко 
28683	 библиотека исследовательский институт он давать месяц датский крона 
28683	 дума спекулянт предлагать желать германский марка австрийский крона фунт доллар 
28683	 здесь быть валюта многий страна свет американский доллар английский шиллинг франк французский бельгийский крона австрийский чешский норвежский румынский лея 
28683	 английский деньги пятьдесят шестьдесят тысяча фунт английский денежный система отличаться сложность плата некоторый вид товар услуга быть принимать вносить гинея другой предмет оплачиваться фунт стерлинг то иметь хождение крона полукрона 
28683	 биллион триллион австрийский крона германский марка война 
28683	 возиться денежный перевод который всегда терять я взять билет отсюда свой деньги тысяча крона просить передавать я 
28683	 он предел досягаемость передавать он я расчитывать получать он тысяча крона копенгаген свой деньги 
28683	 поэтому обращаться свой подписчик анкета нельзя увеличивать стоимость номер один треть доводить она франк динар лева чешский крона ама цент что давать 
