24513	 представлять июнь полноцветный лазерный принтер первый цветной аппарат компания то более новинка мировой рынок где он продаваться начало год приблизительно долл это первый шаг завоевание российский рынок цветной лазерный печать 
24513	 поддерживаться язык описание страница стандартный комплектация принтер иметь сетевой карта программный обеспечение организация сетевой печать 
24513	 то слот мочь быть устанавливать карта память хранение ожидать печать документ подключать шрифт 
20336	 стоить отмечать скромность наш министр печать игорь никифоров принадлежать он газета 
20336	 как сообщать пресс-служба министерство печать рф три четверть зарегистрировать газета 
34398	 банк принимать исполнение клиент платежный документ подпись лицо указывать карточка образец подпись оттиск печать 
34398	 отмена полномочие распоряжение денежный средство находиться счет производиться предоставление клиент банк новый нотариально засвидетельствовать карточка образец подпись оттиск печать 
20336	 тот число предложение рабочий группа совет печатный сми министерство печать 
20336	 успевать построить редакционно-издательский корпус цех печать газета 
20336	 идти конец процесс спаривание рондосет цель обеспечение цветной печать газета 
20336	 минпечати называть молот один пять пять федеральный предприятие который мочь составлять сегодня конкуренция рынок печать газета 
20336	 доходить информация комсомольский правда собираться открывать ростов типография цветной печать газета 
20336	 работать редактор газета м твен получать много непригодный печать рукопись 
34398	 они быть всюду обладатель печать штамп 
24513	 судя запись печать документ встреча 
20336	 вождь мы учить советский печать острый орудие она нужно 
20336	 то она правый дорогой мой сказать он нравоучительный печально взять я рука советский печать должный делаться чистый рука 
20336	 значит брехать наш потапов сивый мерин отвечать мой собеседник ласково вводить говориться заблуждение общественный мнение советский печать 
34398	 оно несомненно быть написать медведь иметь номер схожий тот который стоять его переписка внизу быть оттиск он печать я прочитывать оно конец 
20336	 муж они вы пригождаться случай публикация ваш фотография пресса они печать очень большой формат 
24513	 дело малое недорогой принтер который недалекий будущее должный появляться каждый квартира возможность печать казаться безграничный едва 
24513	 следовать заданный компьютерный программа который разлагать предмет точно его пространственный форма множество тонкий горизонтальный слой принтер заново формировать этот предмет поочередно воссоздавать один он тонкий слой другой метод трехмерный печать также заметно разниться можно наносить 
20336	 его статья принимать один подписной журнал там печатать негативный результат год попытка он отправлять она маленький журнал открытый доступ где она немедленно принимать печать 
20336	 вернуться взять стол журнал регистрация соглашение зарегистрировать он присваивать номер поставлять печать 
20336	 сейчас взять новый газета она ориентироваться нонкорформист взять массовый печать она ориентироваться единство 
20336	 крымский война становиться первый случай столь мощно открыто проявляться круг русский западник злорадство повод поражение свой страна кстати это первый война который заметный роль становиться играть оперативный освещение событие пресса появление телеграф массовый печать 
20336	 вчера номер газета быть подготовить печать быть оглашать победитель конкурс вручать 
34398	 какой разница история кто первый оставлять след оттиск босой нога мокрый берег кто прикладывать печать береста пергамент бумага 
20336	 заявление такой род находить подцензурный журнал тот день вперемежку донос печать граница называть пьеса призыв 
34398	 олег борисов руководитель управление ф гуэбипк который заниматься раскрытие преступление кредитно-финансовый сфера продемонстрировать оттиск такой липовый печать 
20336	 мой интервью газета московский комсомолец где впервые советский массовый печать появляться слово сексология носить согласовывать 
34398	 еще один ценный находка относиться этот время оттиск цилиндрический печать 
34398	 стол она действительно быть заваливать бумага который синеть строгий штамп печать некоторый совсем свежий 
20336	 маклюэн определенно заявлять печать книга газета журнал создавать публика 
34398	 экран ноутбук кирилл разглядывать игрушечный книжный миниатюра святой христофор расплывчатый оттиск старинный печать светящийся схематичный витраж суровый 
20336	 молодой пресса кипеть спора то насколько политика мочь быть тема ученический печать 
20336	 француз оставлять мы немало городской вид тот эпоха полагать начало периодический печать так первый местный газета 
20336	 автор констатировать этот тема протяжение многий год находиться периферия внимание историк следовательно сми советский союз табуированность исторический сюжет сразу накладывать два уровень запрет линия печать наука 
34398	 дверь подъезд который четвертый этаж располагаться располагаться ныне союз писатель россия красоваться выразительный надпись штамп печать интересно сам поэт писатель 
34398	 выбираться страшный место который довлеть надпись штамп печать я направляться борей 
20336	 тот самый время этот номер журнал подписываться печать пустыня блэк рок 
20336	 декларация меньшинство вызывать потрясение массовый растерянность рядовой коммунар восторг версальский пресса радость буржуазный круг париж тут становиться требовать свой печать новый выборы коммуна 
34398	 зинаида директор пятница проверять этот тетрадь ставить печать 
20336	 сейчас основной цель руководство обращать внимание газета объяснять что она отличаться подзабытый лидер советский печать говорить аналитик ик финам сергей 
20336	 февраль год церковный ведомость святой правительственный синод затем открытый печать газета русский ведомость новый время 
20336	 она содержать себя сам весь средство массовый печать показывать многочисленный исследование россиянин 
20336	 полулиберальный орган каковой быть наш газета это означать необходимость жалко оправдываться сочинитель неугождать текст длительный недопущение печать 
34398	 оставаться поставлять штамп закорючка угол штамп виза внизу круглый печать сверху выход 
20336	 конференция проходить повышенный внимание сми информация они проходить печать 
34398	 налево генеральный главбух справа использовать штамп печать разный фирма деньги принимать 
34398	 он давать санкция ты уже быть сидеть юный константин геннадьевич прилегать стол шевельнуть рука вывалить хлам чей это печать чей штамп 
20336	 волин фрадкин в председатель губисполком орел кострома харьков секретарь брянский губком б заместитель нарком внутренний дело усср затем работать газета ростов-на-дону москва заместитель редактор газета известие заведующий отдел печать нкид ссср в 
20336	 начальство билл воспользоваться его позирование присылать фотограф вечер я взять интервью репортер газета канзас сити тайм уже следующий день репортаж фотография появляться печать 
20336	 ноябрь год впервые советский печать появляться два брачный объявление вспоминать 
34398	 строго говорить гравюра доска подготовить печать готовый изображение называться оттиск 
20336	 услышать они понятный причина мочь становиться тогда материал публикация советский печать 
20336	 аба езеев отмечать словосочетание белый гвардия действительно появляться октябрь год так называть себя студенческий боевой дружина москва этот время выражение белый гвардия белогвардеец эпизодически появляться советский печать осень год 
34398	 ставить временный штамп печать любой цветок старый книга 
34398	 подпись иметься оттиск печать форма круг 
20336	 редакция центральный местный газета государственный комитет телевидение радиовещание государственный комитет кинематография быть поручать обеспечивать освещение печать средство кино радио телевидение 
20336	 официальный советский печать этот событие быть 
20336	 она отвечать мочь быть она напечатать какой-нибудь зарубежный газета агентство печать новость поставлять текст 
20336	 газета журнал отмечать этот знак быть приоритетный порядок рекомендовать библиотека страна распространитель печать 
20336	 наверное решение быть принимать уже то газета телепрограмма выходить печать 
34398	 оборотный сторона печать штамп фотограф 
24513	 один главный технический преимущество новый принтер скоростной интеллектуальный печатающий головка оптимизировать качество печать заявлять руководитель отдел дистрибуция 
24513	 приводить некоторый характеристика максимальный разрешение печать тдюйм в 
24513	 мина черно-белый быстрый режим скорость печать фотоснимок 
24513	 рабочий нагрузка предполагать печать тыс страница месяц 
24513	 принтер позиционироваться компактный экономичный простой использование устройство повседневный цветной печать 
20336	 сахаров считать открытый обсуждение проблема мораторий советский печать оказывать поддержка группа 
20336	 выходить советский ястреб мало нуждаться сдерживание советский печать быть закрывать открытый обсуждение 
24513	 персональный цветной принтер характеризовать формат скорость печать более 
24513	 черновой режим скорость печать принтер достигать 
24513	 мина черно-белый так цветной отпечаток увеличение качество печать скорость снижаться так максимальный 
24513	 наиболее тяжелый вариант он комплектоваться мбайт память жесткий диск гбайт сетевой интерфейс модуль двухсторонний печать три лоток бумага 
24513	 в считать он открывать новый категория принтер возможность цветной печать 
24513	 устройство автофокус запись видео возможность прямой печать отсутствовать порт цифровой зум 
20336	 такой путь проходить газета уральский автомобиль нынешний день российский печать 
34398	 заявление составляться два экземпляр один вы отдавать фирма второй который оставаться вы фирма ставить печать входящий номер дата подпись 
20336	 так соответствие статья регламент третейский суд разрешение экономический спор торгово-промышленный палата российский федерация разрешение председатель третейский суд допускаться опубликование периодический печать вид отдельный сборник 
20336	 довольно широко распространять печать сми 
24513	 экран необходимость печать выводиться значение предельный оптимальный 
24513	 реализация этот задача быть создавать специализировать вычислительный сеть состав узловой серверный комплекс рабочий станция восемь принтер скоростной двусторонний печать 
20336	 данный опубликовывать советский печать общий объем ущерб причинять советский 
20336	 яркий пример проникновение сми ранее запретный область оказание воздействие общественный мнение последующий политический решение мочь служить помещение печать сообщение издевательство пытка 
34398	 штамп печать камень который опускаться 
34398	 путевой лист обязательно должный быть проставлять порядковый номер дата выдача штамп печать организация который принадлежать автомобиль 
