33131	 все буквально все они тут свой коза овца курица свинья они все делать сам 
33131	 слышать удаляться гвалт она убеждать себя что все правильно что она сам отдавать страна мука курица корова 
33131	 она давно осточертеть этот ширпотребный занюхать рай этот город где шикарный небоскреб существовать рядом грязный дворик где голозадый ребенок гонять курица улица переулок секс 
33131	 потому что цикл производство курица очень короткий 
33131	 хотеть рассказывать случай разбойный нападение собака домашний птица самый предупреждать другой владелец курица 
33131	 муж выглядывать двор возглас собака трепать курица 
33131	 выживать курица спасаться только потому что собака 
33131	 еще отличный курица быть бессмысленно жестоко загубить 
38375	 вместе цена мясо курица кроме окорочок снижаться 
38375	 февраль увеличение цена творог нежирный мука пшеничный хлеб черный белый рис шлифовать пшено горох фасоль капуста белокочанный свежий лук репчатый огурец свежий одновременно снижение цена мясо курица масло подсолнечный наблюдаться 
33131	 держать корова овца курица иногда откармливать свинья 
33131	 забор квохтанье курица огородик цепной собака изба 
33131	 для обеспечение непрерывность производство огромный количество закупаться ярмарка доставляться мастерская исходный материал более наименование зола шадрик деготь древесный кора шакша помет собака курица голубь сандал воск 
33131	 сара бюисьер это несколько улица старый сельский дом подворье приземистый старинный церковь лай собака кудахтанье курица тихий деревня холмистый равнина 
33131	 совсем недолго тетя рая мочь шептать другой нужный что бобырев запалючий жадный работа дед мой жить так бедно что ужинать жареный лук что бабушка считать нехозяйственный она словно отвыкать война тюрьма даже сарай иметь поставлять поросенок сени вырастать больше собака разводить сени курица они взлетать чердак 
33131	 вот быть они лошадь корова курица собака что они быть 
33131	 точно так весь язык одинаково лаять собака мурлыкать кот мычать корова кудахтать курица 
33131	 непонимание молоток собака кот корова курица попросту нет 
33131	 потому даже стучать молоток собака кот корова курица говорить уже малый 
33131	 липа пахнуть почта сельсовет магазин церковь липа пахнуть человек собака курица корова 
33131	 потом пристраиваться школьник поводить куда-то другой конец зоопарк там всего-навсего курица 
33131	 выходить курица увидеть зимний слониха одинокий 
33131	 рыскать деревня тащить оттуда арбуз дыня овощ курица 
33131	 или сказ про курочка ряб трактат ветеринар как нестись курица 
33131	 мир сейчас около миллиард курица 
38375	 долго еще предстоять поедать ножка американский курица новозеландский говядина 
33131	 благодушный мерин осоветь постоянный еда поросенок корова собака курица благословлять свой участь 
38375	 если верить хозяин русский гость съедать пуд говядина баран вес пуд три четверть ягненок плечо филей телятина восемь курица восемь кролик два половина 
33131	 дворовый живность считать собака иметься только необременительный курица 
38375	 подвозить партия свинина или живой курица дрезина вагонетка 
33131	 вспоминать тот ранний едва забелеть утро лаять собака квохтать курица прозвучать тут аукнуться 
38375	 исследование проводить вниипп показывать что процесс хранение водосвязывать способность мясо птица после механический обвалка снижаться второй месяц хранение шестой сравнение исходный значение который составлять для мясо курица для мясо 
38375	 величина механически обвалить мясо птица составлять для мясо курица для мясо утка 
38375	 следовать отмечать что эмульгировать способность мясо курица статистически достоверно высоко 
38375	 кислотный число липид мясо курица после механический обвалка 
38375	 после трехмесячный срок хранение гидролитический изменение быть более выражать мясо утка механический обвалка продукт содержать этот сырье сравнение мясо курица механический обвалка 
38375	 затем процесс ускоряться что сопровождаться накопление продукт окисление перекисный число йод для мясо курица механический обвалка 
38375	 для мясо курица после механический обвалка характерный высокий 
38375	 анализ получать данные динамика жирнокислотный состав мясо курица утка после механический обвалка 
38375	 компания мак маркет солнечногорский район московский область уникальный технология производить сушеный строганина говядина свинина конина оленин лосятина мясо курица индейка 
38375	 мясо страус характеризоваться высокий сравнение мясо курица индейка говядина диетический свойство 
38375	 ухудшение санитарный состояние мясо курица время охлаждение мочь происходить 
38375	 результат физико-химический исследование корм мясо курица представлять табла 
38375	 жирнокислотный состав образец мясо курица представлять табла 
38375	 опытный образец мясо курица кожа без кожа 
38375	 аминокислотный состав мясо курица бычков представлять табла 
38375	 иркутск конец май сравнение нижеуказанный соседний город регион дешевый мясо курица рыба свежемороженый масло подсолнечный маргарин 
33131	 потом соседка снимать комната деревня становиться жить там среди курица собака соседка бояться 
38375	 если забивать мясо курица или кролик можно приготавливать смесь 
38375	 быть есть что поймать излишек менять туземец курица свинина 
38375	 почему магазин становиться баранина свинина курица 
38375	 хороший бульон получаться говядина курица дичь так как они содержать 
38375	 молочный продукт без перебой иногда торговать мясо курица 
38375	 еще понимать это навсегда или связанный майский праздник или юбилей вот уже два месяц торговать говядина масло курица постоянно 
38375	 многие жилец терпеть спиртное джейк говорить что зачастую алкоголь просто бывать дом разве что пиво быть вегетарианец остальной избегать быть говядина поэтому коммунар содержать курица коза для ребенок здесь 
38375	 удерживаться соблазн нескудно разнообразить совершенствовать свой арестантский стол они счет полагать что лишь восстанавливать попирать справедливость снабженец охотно включать рацион соболь курица сухофрукты отпускать отличный говядина 
38375	 еще обед приезжать мясник предлагать мясо курица зелень 
38375	 просто сказать что годиться только курица свежий говядина 
38375	 угощение полудикий преизобильный весь недоваренный холодный мясо говядина телятина козленок курица горячий мамалыга 
38375	 говядина есть индус свинина мусульманин человек богато есть баран курица большинство быть вегетарианец один 
38375	 предполагать следить чтобы антибиотик применяться при разведение курица исключительно для профилактика возможный инфекция 
33131	 кажется меир первый заявлять ледяной тон что позволять уничтожать они жизнь что она габриэле пора принимать антидепрессант что это курица смех когда человек выбивать 
33131	 так что если профессор джек хорнер его коллега находить средство осуществление свой затея проект скоро все заканчиваться выведение некий порода зубастый курица 
38375	 дорогой быть кура точно курица так как они продавать пара 
33131	 дом данилов быть очень большой дважды перестраиваться зато быть лошадь некоторый время два лошадь корова курица овца свинья 
38375	 домашний курица утка выводить бесполезно 
38375	 дальнейший результат опыт использование талый вода просто потрясать курица нести яйцо часто крупный 
38375	 добивать германия нравиться письмо подруга писать воевать пока удачно наступать брать город пить спирт есть курица утка особенно нравиться 
33131	 иван держать курица какой-то особенный вид обыкновенный 
38375	 финансовый средство строительство они требоваться очень много выделять знаменитый лидийский царь крез чей имя так как герострат становиться нарицательный выражение богатый как крез характеризовать тот кто деньги как говориться курица клевать 
33131	 точно так можно выращивать курица выпускать оптоволокно 
38375	 только курица уток накормить яйцо собирать 
33131	 впрочем быть ведь огород корова курица когда детство кирилл ездить 
33131	 думать что они быть вошь нет свинья комната курица уже видеть товарищ 
33131	 кой черт они понадобиться продавать квартира сам москва чтоб перебираться деревня купить там дом корова курица все равный понимать 
33131	 все буквально все они тут свой коза овца курица свинья 
33131	 думать что яйцо быть курица гусь 
33131	 сергей любимов муж пока консенсус сходиться что папа заплатить государство деньги курица клевать 
38375	 отмечать что предположение вирусный природа ожирение десять год назад впервые высказывать профессор пеннингтонский центр биомедицинский исследование луизиана никхил дурандар который замечать что курица умирать время эпидемия вызывать 
33131	 они заводить себя курица чтобы каждый день быть свежий 
33131	 они голод копыто откидывать приходить деревня курица воровать овца 
33131	 она передавить курица овца тронуть 
33131	 рука указывать направление маленький лупоглазый палатка под название мир курица дверь который сидеть полосатый 
33131	 начинать жить среди курица который всегда норовить обижать 
33131	 подрастать щенок начинать сам управлять курица проверять гнездо когда они 
33131	 фортовый помнить даже курица быть чувство юмор 
33131	 они забирать яйцо потом подкладывать они домашний курица наседка 
33131	 местный умелец уметь красить птица придавать они домашний вид поэтому все без исключение курица привоз желтый 
33131	 курица держать многоярусный клетка где 
33131	 производство курица бройлер уже подтягиваться западный 
33131	 все поубив али певучий подхватывать берт запирать курица кузов студебеккер замок 
33131	 она сменить курица свисать орудие вниз голова 
38375	 граница кипеть птичник пестрый облако курица утка казар гусь 
33131	 ксения сдвигаться место никогда жизнь она рубить курица нога окаменевать 
33131	 выгородка для курица быть много пять десять 
33131	 порода этот курица очень хороший русский 
33131	 приносить дар весна животное бродить роща все лето курица выводить цыпленок петух громко распевать 
33131	 приваливаться щель слышать ранний крик петух квохтанье курица надсадный собачий лай 
33131	 баранов курица даже корова вот 
38375	 поломать ненадобность кий такой палка только курица гонять 
38375	 через болото милый через болото зашелестеть лесавка неопределенно размахивать лапка разный сторона залезать вместе курица листва 
33131	 микроб труп находить нерв спинной мозг курица быть замечать тот дегенерация 
33131	 камисар мясо осос курица яйцо все 
33131	 матрос пытаться быть строить курица слишком бойко 
33131	 староминский станичник быть видать всякий случай все попрятаться хата стоять мертвый тишина только предательски покудахтывать нереквизировать курица 
33131	 здесь будущий император кормить курица ухаживать лошадь корова 
33131	 слышный шум волна привычный кудахтанье курица экзотический крик обезьяна 
33131	 домохозяйка челнок объезжать прибрежный лавочка свая покупать где связка чеснок где горка вяленый стручковый перец где обвязывать тесемка арбуз где живой курица 
33131	 чаевничать поочередно хозяйка уходить куда-то самый утро хозяин что-то сарай постукивать курица кудахтать недовольно 
38375	 исследование шмальгаузен курица показывать что такой система организм 
38375	 реклама средство для уход волос глисс курица легкий флюид шварцкопф 
33131	 суоми китай всюду родина святой подъезд телефон отрывать какой-то разжива трубка лифт который шанс рухнуть близкий шанс вляпываться вопрос бессмертный быт где брать этот курица 
33131	 видный быть очередь возвращаться восвояси гигантский курица 
38375	 для участок побережье махачкала сумгаит красноводск полуостров челекен устье курица астара также для 
33131	 весь увидеть поместье губернаторша особенно понравиться ульяна конюшня она лосниться ухоженность конь полусвет высокий узкий окно запах солома конский навоз вдруг остро напоминать она никогда вспоминать прежде детство который она понаслышке знать лошадь корова курица восхищать она как 
33131	 ничего вздыхать этот повод глафира петровна курица быть главное парень 
33131	 восклицать пафнутьев нестись курица павел николаевич 
38375	 обязательно кондиционер который смываться после мытье нравиться пшикалка глисс курица или несмываемый мусс бонакур 
38375	 конфетти ухаживать волос продукт серия глис курица швартскопф 
33131	 так вот упрямо агитировать чтобы купить дача даже обещать давать два старик украина муж жена который быть вести весь хозяйство заводить корова курица свинья быть жить 
33131	 курица кудахтать корова мычать кто-то 
38375	 грудной мышца курица цыпленок цыпленок бройлер индейка содержание 
38375	 практический условие процесс размягчение ткань счет созревание для цыпленок составлять курица 
38375	 прежде чем использовать мясо голень получать тушка курица индейка маточный стадо бройлер 
38375	 результат исследование весовой метод цель определение массовый доля кусковой бескостный мясо птица кожа или без кожа общий масса тушка выявлять соотношение мышечный ткань белый красный мясо тушка цыпленок бройлер цыпленок курица табла 
38375	 создание пальцев гребенчатый машина для снятие оперение аппарат для тепловой обработка тушка моечный машина центрифуга для обезвоживание перо его сушка позволять сконструировать поточно механизировать линия обработка курица цыпленок производительность голова 
33131	 деньги семья курица клевать иметь все дом 
38375	 граница устраивать птичник курица утка какой-то особенный белоснежный 
33131	 клиентка расплачиваться мастер кто как мочь обычно весьма щедро сельский вечно везти что-то свой огород из-под курица столичный штучка они быть большинство 
38375	 аппарат для хот-дог сковорода для блин тостер для приготовление горячий бутерброд гриль вулканический лава вертикальный гриль гриль для курица это настольный оборудование выполнять 
38375	 гриль карусельный тип преимущественно использоваться для обжарка курица который укладывать специальный люлька 
38375	 если любитель жирный курица гусь приготавливать гриль 
33131	 нагрянуть без предупреждение приводить родитель полный отчаяние свой появление однажды утро свист оповещать все свой приезд так что округ испуганный птица срываться ветвь разбудить курица цесарка заголосить 
38375	 высокопатогенный вариант для курица обнаруживать вьетнам 
38375	 резервуар слабопатогенный для курица вирус обнаруживать природный 
38375	 отравление курица характеризоваться общий угнетение истощение жажда 
33131	 держать большой огород домашний хозяйство корова овца курица другой живность 
