38375	 доктор лукаво посмотреть есть курица 
33131	 видимо наспех потому что посылать воротиться десяток курица несколько коза 
33131	 ваш курица лкавить глаз стрелять где 
33131	 курица впрочем везти много они спокойно 
38375	 гусь курица утка барашек индюк яблоня дуб 
33131	 все это веселый нечисть ноябрь загнать она вместе овца петух курица общий куча один 
33131	 этот день крещение женщина запрещать играть карта курица быть клевать огурец 
33131	 последний быть призывать мирить курица домовый 
33131	 после курица наступать очередь лошадь корова 
38375	 население время время штрафоваться такой нечистоплотность курица кролик время эвакуироваться 
33131	 радость принимать колхоз мужик хватать тут здоровый все известный уважаемый военный хозяйственный выделять сразу старшина жилье поставлять сразу бригадир заводить огород кабачок курица налаживаться гражданский жизнь 
33131	 рычание сиплый лай поддерживать свой язык коза овца курица свинья 
33131	 потому что посуда синий барышня курица быть дом повсюду 
33131	 заново ничто открывать быть знать что такой открытие быть тьма тьмущий весь курица смех 
38375	 быть знакомый который есть мученый курица 
38375	 яйцо мученый курица тоже есть 
33131	 замысел князь быть простой подниматься вверх сволочь туда где курица пеший ходить пересекать она 
33131	 второй браниться собирать свой котел взваливать они горб все тот землекоп двинуться кряхтеть носильщик вверх сволочь туда где курица пеший ходить 
38375	 вера петровна захватывать яичный скорлупа для курица 
33131	 сын кирим ага анвар успевать переходить курица аракса быть схватывать красноармеец 
33131	 москвич ходить бледный как голландский мороженый курица спасаться теплый остров 
33131	 это она уезжать жить подруга подмосковье малый поселок где иметься кроме все птицеферма крайний мера курица проблема быть они дешево 
33131	 они век хватить крестьянский курица перепугать девка 
38375	 какой помещение предлагать оно непременно оказываться битком набитый разный козел курица хныкать ребятня бесформенный тетка 
33131	 если вдумываться это быть очень странно потому что курица петух округ 
33131	 кто придумывать этот слово неизвестный они внутри делаться как-то тепло без они спать быть никак невозможно мама идти курица мура 
33131	 съезжаться город спасаться раскулачивание желать идти колхоз прирезать корова курица чтобы вставать станок 
38375	 купе есть холодный курица или пирог 
33131	 помнить что бродить вдоль курица забираться куда-то высоко 
33131	 мария емельяновна жена мария емельновна раскрывать чемодан начинать доставать оттуда сало помидор яйцо курица таранька сметана запечатывать полиэтиленовый 
33131	 съезжать бетонный дорога нестись куда-то кочка мимо избушка курица гусь 
33131	 кудахтанье курица такой разнообразный самодовольный 
33131	 она оказываться кухня услыхать про петух ведь курица надо вовремя загонять возмущаться она 
33131	 теперь через день сменять митька лифт подниматься наверх выходить двор раздеваться трусы майка залезать луноход подолгу чтобы укреплять мышца нога ездить круг двор разгонять курица иногда даже давить они 
33131	 сретение закармливать курица овес весна лето быть 
38375	 приезжать николай дождаться его двое чадо его жена его тесть его курица ихний 
33131	 еще недавно горожанин думать держать дома столько скотина сегодня лаптев корова теленок свинья курица гусь 
33131	 питание зырянов быть хороший они держать корова нетель поросенок курица даже конь один время 
33131	 михрютка лярва быть ленивый блудливый потому хозяйство разом шатнуться приходить дикость запущение стайка распахнуть настежь корова постоялец хозяйка сбывать судя перо мокро приклеиваться деревянный настил вонь долго держаться двор быть хозяйство курица 
33131	 подмывать караулка избушка зависать один угол над падать только потому что быть подпирать снизу слега завалин избушка укреплять каменный плита один или два плита укатиться вниз подрыть курица избушка старчески обнажаться трухлый нижний 
38375	 захотеть продавать немного комбикорм для курица утка заплатить натура фуражный 
33131	 первый дубль получаться плохо курица понимать что они 
38375	 никакой дополнительный неизвестный данные психика курица узнавать 
33131	 когда радио замолчать оказываться просиживать лавка среди курица лопух 
33131	 тарахтеть трактор нависать забор хоть оба сторона тянуться дорога совершенно некуда быть идти потому что этот дорога вести такой лопух курица такой заколачивать магазин 
33131	 слышаться лай собака кудахтанье курица огород невысокий забор 
33131	 четверг значит завтра курица быть быть хотеть 
33131	 рената устраивать роскошный пир курица вино арбуз 
38375	 молодой ученый подводить гость проволочный клетка какой крестьянин держать курица или кролик уведомлять что 
38375	 опять приезжать бучалок суханов привозить более богатый подношение тот число пара подшивать валенок два или три пара шерстяной носок варежка живой петух три живой курица 
38375	 близко весна суханов приезжать третий последний раз привозить еще три живой курица 
33131	 для все курица успенский улица быть совершенно 
33131	 она знать какой яйцо нести наш курица отстаивать истина 
33131	 все равный зерно иногда нет нет отскочить сторона этот пустоголовый курица петух тут склевывать 
33131	 нуца плеснуть сторона зерно тазик сразу туда где они посыпаться метнуться курица 
38375	 деспина держать рука живой курица связывать нога 
33131	 почему-то слегка беспокоить что вот она брать себя наш курица ведь они никогда 
38375	 приезжать месяц бабуля деньги значит курица клевать 
33131	 мама зарезать четыре курица поджаривать они напекать десяток хачапури 
33131	 удивлять беспрекословный готовность этот денди переться глухомань черта кулички поселок тогда еще джиганск быть поселок где центральный улица разгуливать курица двор засаживать картошка 
38375	 никак мочь добывать дикий курица для коллекция скелет 
38375	 нет ничто просто сказать сон кан нужный курица сколько 
33131	 возвращаться час двенадцать без курица очень возбужденный успокаиваться рассказывать 
33131	 кан стрелять через растительность близкий расстояние ружье быть заряжать дробь курица 
33131	 просыпаться ранний заря мирный выстрел кнут пастуший рожок мычать корова блеять овца кудахтать курица утренний воздух смешиваться запах 
33131	 школьный ферма сейчас корова бык коза овца свиноматка курица цесарка гусь 
33131	 словно лебедь опускаться земля оказываться ошибка компания домашний птица курица гусь 
38375	 готовить хороший бульон курица или мясо можно сделать 
38375	 быть обрабатывать бесхозный земля при дом выращивать овощ фрукт картофель ягода заводить курица или кролик 
33131	 мелик бросаться калитка вести теткин половина уже огибать клетушка где когда-то держать курица увидеть что выходить сюда окно 
33131	 корова лошадь свинья собака курица голубь филин орел фазан 
33131	 они судя все курица клевать 
33131	 они судя все курица клевать 
33131	 она курсы строить курица строить курсы 
33131	 когда коля делать урок под окно кудахтать курица пешкин задумываться лететь через 
33131	 кот закудахтать курица все приподымать голова увидать 
38375	 никто кроме собака кошка курица гусь 
33131	 собака кошка курица нутро почувствовать опасность они 
33131	 выгонять воровство курица непосещаемость очень скоро 
33131	 задний двор топтаться овца жевать жвачка корова ходить курица 
33131	 сам резать обдирать разделывать свой овца держать курица щупать они сажать 
33131	 что иной окрестный крестьянин негде держать пара курица местный владыка беспокоить 
33131	 полдень сосновка житие становиться все слепить обжигать деревянный тротуар через подошва туфля горячить нога животное притихать курица лежать лопух обморочно 
33131	 сидеть забор помертветь зной петух валяться нога вверх курица 
33131	 балка среди закручивать ветер камыш голубеть талый вода темный терны роща шиповник огород простор курица двор 
33131	 двор два три корова овца свинья утка гусь курица поле семь десятина 
33131	 огород быть курица неожиданно низкий грудной голос вмешиваться 
33131	 быть пусто вокруг корыто размачивать хлеб суетиться десяток крупный белый курица увидеть тимошка петух набрякнуть 
33131	 франция вон говорить даже курица приучать голубой яйцо нести 
33131	 возле дверь солома иногда нестись курица теперь лежать два желтый 
33131	 что там курица куда большой забота требовать корова 
33131	 собирать десяток три яйцо она нести они местечко менять что-нибудь нужный или продавать без курица быть невозможно теперь вот подумать 
33131	 теперь вот подумать что надо посыпать они какой-то обсевок она торопиться поле курица она уже хватать 
33131	 там среди ромашка осколок дерьмо гулять курица 
33131	 улица деревня один все курица гусь перепутываться иной раз 
33131	 огород цветок продажа некоторый кроль свинка откармливать курица разводить конечно смотреть телевизор 
33131	 они весь уверять что деньги курица клевать 
33131	 нужный они этот песня стих поесть читать все один жратва думать голодный кума весь курица 
33131	 говорить курица доить корова яйцо нести 
33131	 между прочее быть ящик курица гринич 
33131	 напугать скот орать разный голос обгорать курица вылетать гореть двор усиливать 
33131	 так бегать свободно село гоняться овца курица свинья вызывать они поиграть 
38375	 почему такой порция курица смех 
33131	 появляться собака кошка лошадь курица гусь 
33131	 сажа все иметь маслина каждый день провансаль каждый день бутылка какой ниб кабернэ каждый день яйцо круглый год курица много надо 
33131	 клоун сажать курица ящик они обжигаться 
33131	 клоун сажать курица ящик они обжигаться 
33131	 налоговый извещение обязательство мясо молоко шерсть яйцо который пекашин все даже глаз видать потому что сроду курица быть ихний григорий 
33131	 вот что например писать паровоз газета тот время они помешать корова пастись курица нести яйцо 
33131	 оказываться главный образ оттого что гребешок все курица петух красный 
38375	 чтобы приучать дело исподволь андронова предлагать работать первый неделя ночной смена когда курица спать 
33131	 заходить часто кухня где печь топить корпус где курица маяться 
33131	 институт инженер общественный питание перерабатывать концентрат туш скот курица овощ 
33131	 грустный военный пост где под нога старый ленивый служака разгуливать ленивый курица постоянный грохот ледяной грязный терек 
38375	 невыносимый солнце закатываться пологий гора мутный курица долетать подобие прохлада или это 
38375	 инженер щеголев изобретать конвейер для выращивание курица 
33131	 лошадь корова овца даже курица видеть 
33131	 спрашивать сколько австрия крестьянин корова лошадь курица каков площадь дома сколько 
33131	 хозяйка доить тут привязывать корова курица вместо нашест взлетать обугливать 
38375	 иметь рав живой курица ров 
38375	 нить доспевать куда нить отправлять живой курица ров упираться 
33131	 так жить она вместо собака худой грязный носиться двор гонять курица провожать нюра когда она идти 
33131	 даже курица быть она такой 
33131	 снова мычать корова кричать воинственно гусь курица вспархивать самый его лицо 
33131	 закричать ответ нефедова приниматься считать сколько она дом народ курица корова поросенок 
33131	 ферма под гора корова курица школа 
38375	 утаскивать значицца курятник три курица индейка сваривать ведро 
33131	 стена двор прясло взмахивать подвязывать хвост сивый конь под навес корова жевать зеленый жвачка курица бормотать нашест 
33131	 парк оккупировать коза свинья курица играть тут ребятишки прятки 
33131	 поселок чуш проходить день много восемь машина они давить курица свинья собака человек 
33131	 сельскохозяйственный свинья крупный рогатый скот овца бройлер курица несушка 
33131	 видеть людской суматоха одуревать носиться гавкать собака кричать бить крыло петух наговаривать курица визжать поросенок хлопать дверь скрипеть 
38375	 курица живой висеть вниз голова выгибать 
38375	 выезжать станица успенская воз курица утка который везти 
33131	 красный фуражка вылетать двор распугивать курица колесо помчаться трава 
33131	 кобель кидаться тарантас облезлый кот взвиваться телеграфный столб курица трещать крыло шарахаться канава 
33131	 площадка стоять корова крыша моститься клетка курица 
33131	 томно квохтать курица захлебываться бег детский голос 
33131	 патрикеевна лад жить она курица мой отличать пакостить она 
33131	 костя муж полина все говорить кой курица 
33131	 двор суетиться проворный курица важно вышагивать гусь забор 
33131	 быть вода носить смотреть чтобы курица огород попадать 
33131	 красный кепка муж никто нету курица собака козел яшка вот 
33131	 курица гусь овца олень мышь любить 
33131	 тут тот секунда петух повесить крыло пригибаться побежать угол двор курица собираться беспокойный стайка участливый зритель 
33131	 рабочий при желание мочь держать сарай корова свинья курица многие иметь 
33131	 себя курица твой чертовски повезти что эвакуироваться 
33131	 куреневка испокон век спасаться редиска также поросенок курица глухой всякий наука искусство 
33131	 этот заметка говориться что непосредственный причина гибель ящер мочь быть ненормально развитый скорлупа они яйцо ведь ящер как курица нести яйцо 
33131	 так начало яйцекладка еще быть брудер инкубирование производиться районный инкубаторный станция режим курица быть решать вопрос правильный 
38375	 донце ведро тугой молочный струя говоруха курица нести яйцо много гусиный 
38375	 нельзя сказать демин наконец учуивать воньца туда курица подлазить 
33131	 марьяна ефим жить дружно хозяйство они быть маленький бедный свинья они держать около хата обносить тын бродить несколько курица луг арсеньев пастись 
33131	 заворачивать машина обратно театр теперь полпути быть курица смех 
33131	 быть товарищ местный такой долбить все бывало курица воровать 
38375	 миосаркома утка лимфоматоз курица млекопитающее 
38375	 брат андрей борис долгорукий село аргунька уссурийский край написать что поймать девочка людоед бежать из-за рубеж преследование хунвэйбин прославляться воровство курица 
33131	 смагин занимать самый дальний столик примыкать маленький окошечко сквозь мутный стекло который все просвечивать солнце быть видный крутой изгиб курица 
38375	 объем рука выше локоть восемь талия двадцать три рост пятьдесят семь вес семьдесят восемь американский фунт строение удлиненный курица коэффициент умственный развитие сто двадцать 
38375	 вероятно дальний космический рейс отправляться курица или утка 
