33131	 сам шеф-повар стараться щегольнуть свой блестящий кулинарный искусство впрочем быть что щегольнуть мука крупчатка курица яйцо сало сливочный масло сметана 
33131	 лебяжинский старик сгрудиться один бревнышко словно курица насест глядеть устинов 
38375	 после это распрямляться подымать старуха маленький зарастать весь сторона глаз возглашать курица ров 
38375	 тот случай мальчишка находить новый забава весь поймать змей доставлять богодула сидеть валун возле свой барак рука приподымать нога дразнить они хехекий как щекотка когда змея мгновенный прыжок пытаться прокалывать твердь блаженно приговаривать курица ров 
33131	 носить повсюду сад огород школа дом река тень дерево почтовый дилижанс дальний следование когда окно дождь плыть мимо деревня крыть солома нахохливаться будто мокрый курица душа мой человеческий страдание 
33131	 который день гнездо пустой курица сосед нестись 
38375	 тот смысл что грядка расти корм для курица что сам 
33131	 пахнуть сухой земля навоз где-то чирикать воробей кудахтать курица жизнь продолжаться 
33131	 пищать полевой мышь трещать сверчок хрустеть сено корова где-то возиться сонный тревога перекудахтываться курица 
33131	 как это можно деревня без курица 
33131	 какой мочь быть курица фамилия 
33131	 какой мочь быть курица фамилия 
33131	 написываться этот второй фраза вставать вдруг перед глаз солнце заливать зеленый лужок двор где один один громоздиться серый сарай где курица погуливать посредине выбивать без 
38375	 кроме для опыт нужный плазма кровь курица заражать опухолеродный вирус 
33131	 начинаться опыт мышь крыса кролик собака затем курица овца бычок 
33131	 виктор это мой муж слесарь оператор вдвоем выращивать тысяча курица несушка 
33131	 пробовать совет местный специалист желудочный болезнь подкладывать мельница петух курица 
33131	 дружно курица переводить продавщица разговор 
33131	 нет плохо свет пакостливый завидный бабкин курица позавидовать дом жить 
33131	 утка залазать огромный каменный корыто барахтаться немой грязный курица присмиреть приседать вдоль плетень 
33131	 пятеро судья как курица нашест размещаться немой 
33131	 мама евлампьевна держать курица петух утка 
33131	 здесь продавать курица гусь теленок всякий живность 
33131	 самый поразительный для бим теперь черноухий оказываться что вместе человек здесь жить разный животное птица корова курица гусь овца свинья знакомство 
33131	 собственно сам курица красный петух 
33131	 вокруг пейзаж вроде среднерусский только холмистый лето жар сонный курица 
33131	 вокруг этакий пасторальный симфония петух орать курица лопотать собака гавкать 
38375	 выясняться что концентрат безвредный животное хорошо поедать курица повышаться яйценоскость норка хороший 
33131	 жить один внучка нюрка быть все что надо курица корова 
33131	 только молоденький журавленок чуть поотставать родич кричать что-то свое мочь быть желать улетать туда зенит куда звать его мудрый вожак мочь быть просто понимать что приспевать пора лететь извечный дорога журавль прощаться родина кроме который пока еще ничто быть курица 
33131	 николай рогодин хитрый быть мужик охотник чужой говорить вечер гринька говорить подседлывать какой-нибудь конь хотеть моев дуть деревня насшибать курица кто-нибудь 
33131	 колея наслаждаться ходьба горячий пыль бродить мальчишка курица 
33131	 исчезать прелесть тихий зеленый сельский улица телок или козленок привязь размаривать жара добродушный пес курица гусь пушистый выводок 
33131	 где-то двор марьяна кричать петух беспокоиться курица 
33131	 хозяйка может захотать тот солдат курятник искать потому как там гнездо где курица нестись опять квочка 
33131	 утро сумерки просиживать окно угрюмо разглядывать серый тяжелый небо осклизлый забор раскисать капустный гряда белый кочерыжка голый заплаканный куст сирень под они нахохливаться курица мокрый обвисать хвост 
33131	 драка затихать радость испуганный панкин курица трехногий пес шарик курица закудахтать пес вылезать 
33131	 долго наверное минута три быть слышно как косой негодующий фыркать стучать трава брезентовый туфля как ударять плетень кулак потом шаг стихать анискинский двор оставаться только свой звук клохтать курица похрюкивать свинья загородка 
33131	 собака валяться перед ненастье ветер курица купаться песок дождь 
33131	 затем обменять кое-что амуниция обмундирование орудие труд распахать четыре участок посадить сахарный тростник ананас банан табак лук чеснок заводить свинья курица 
33131	 применять поговорка определенный житейский случай замечать она образ курица 
33131	 оказываться курица мочь устаивать перед этот 
33131	 глядеть улочка белый крохотный босоногий беспокойный курица 
33131	 берег курица катить свой бурный волна красоваться 
33131	 желтый вода курица подходить самый доска лавка 
33131	 звенеть весь синий тифлисский небо лист дерево избаловывать теплый ночь шумный вода курица даже стена дом улыбаться свой 
33131	 обыкновенно проходить верейский мост останавливаться любоваться город каждый раз открывать новый краска смотреть бурный желтый вода курица катиться так стремительно словно они 
33131	 они жить без прописка без карточка мадам шоссад разводить большой огород даже купить несколько курица 
33131	 поблизости никто быть послеполуденный зной даже курица загнать тень только 
33131	 взрывать пыль распугивать ошалело кудахтать курица они бежать улица пока 
33131	 залениться стрекотать кузнечик курица забиваться тень под крыльцо 
33131	 потом вспомнить как утро мама бояться что машка узнавать печальный участь выкармливать она курица петух 
33131	 она затапливать русский печь лезть подполье картошка бежать амбар мука ставить печь разный чугунок готовить пойло для теленок давать корм корова свинья курица доить корова процеживать сквозь марля 
33131	 перебежать один дух возле сарай разметать соломенный крыша увидеть чужой курица 
33131	 подходить лагерь слышать над курица яур лебедь трубить 
38375	 если курица собирать сказать живой поговорить 
33131	 ведь быть когда-то корова быть курица огородик все это без 
33131	 кто только тут быть дезертир толстущий баба окрестный деревня оказываться безработный гувернантка экономка приживалка степенный чиновница вор рецидивист сопляк торговать рассыпной папироса поп кудахтать курица 
33131	 минута передо вставать париж сено каштан друг маленький уличка курица роан где жить шанталь 
33131	 повсюду быть сад институтский мариинский благовещенский житомирская александровский лукьяновка где жить тетя маша груша курица казаться земной рай 
33131	 слушать каин курица насест слушать надежда 
33131	 вряд кто заманивать такой мучительный дорога приходиться каждый день вставать рано ложиться так сейчас час уже зевать вместе курица ложиться петух вставать 
33131	 лязгать гусеница клуб подниматься пыль шарахаться курица 
33131	 над подвод стоять неумолчный хлопание крыло кудахтанье курица кряканье утка гогот гусь 
33131	 деревня этот непохожий наш быть двенадцать крепкий дом под дом аккуратно подмести подвал посыпать песок там бочка холодный яблочный сидр двор курица розовый свинья стойло тяжко 
33131	 кричать баран блеять коза кудахтать курица кричать петух наш дача уже 
33131	 быть игра двор порастать трава живописный сарайчик как деревня колодец курица дурно пахнуть помойный 
33131	 уже человек безликий койкодень обретаться больница курица кудахтать птицеферма некий 
33131	 красиво красивый курья курица куря урами 
33131	 скотина поросенок три ярочка коза курица взять себя сестра 
33131	 хлюпать нос обида скрипеть прокуривать зуб быстро идти улица пугать примащиваться возле плетень курица 
33131	 обрадованно закричать девчата заметаться перепугать курица затявкать собака катерина знать 
33131	 весь свой жизнь бабка коза проживать дымка вставать петух ложиться курица самый большой шум какой она 
33131	 трактор как солдат учение лихо повертываться один место потрясать перед себя тяжелый нож покатиться вдоль деревенский улица распугивать курица 
33131	 варяг кричать туман курица фра 
33131	 норвежанин встречаться тот спрашивать курица фра 
33131	 утка гусь считать колхоз тысяча курица тот много 
33131	 ночь решать устраивать курица один свободный комната 
33131	 тухарель феодосия теймуразовна проживающий курица абастумань 
33131	 подсчитывать как торгаш денарий модий пшеница воображать что заниматься государственный дело кудахтать как курица взглядывать говорить 
33131	 никакой тучка замечаться пока над голова судя скопиться воздух истома как чиститься курица под забор благушинский хозяйка 
33131	 птицеферма комиссия ходить курица сигать через изгородь 
33131	 там окно так тошнотворный как все что видеть вести себя курица 
33131	 день хорь передушить семь курица ефимов девять 
33131	 тут ходить курица искать заваливаться где-нибудь 
33131	 сохраняться память один частушка сочинять никита васильевич про колхозный конюх иван грыбов нет нет прихватывать свой курица горстка овес конный двор 
33131	 свой хата свой овечка свой курица свой гусь утка свой 
33131	 теплый словно брызги парной молоко капля отвесно падать затаиваться туманный тишина земля белый пузырь вспухать непросохший пенистый лужа так тихий мирный быть этот летний негустой дождь что даже цветок склонять головка даже курица двор искать 
33131	 просторный зарастать курчавый мурава двор правление быть пустынный только возле конюшня соседский курица лениво копаться навоз 
33131	 еще полгода впереди курица осень считать 
33131	 свет божий выползать ребятишки щенок урожай этот зима выращивать изба наравне теленок курица 
33131	 птица петь цветок пахнуть курица нестись весь назло все 
33131	 первый охота надоедать щенок гонять курица двор пойти думать 
33131	 какой это бормотать зима когда снег курица колено когда прикрывать снег лежачий полено 
33131	 жахнуть пожалуй нахмуриваться дед заместо ястреб колхозный курица 
33131	 говорить такой нахал как люська курица весь остальной 
33131	 приходиться отдавать курица протирать через терка 
33131	 колина мать держать хозяйство невеста все показывать еще первый приезд просторный сарай жить черный белый пятно милка соседний закуток мекать два коза следующий загородка помещаться свинья черный поросенок отдельный дверь курица 
33131	 животное работать человек уже много год ферма обитать корова курица без который труд 
33131	 огород неубранный сентябрь стоять сарай животное курица мама генрих рыдать обнимать корова 
33131	 папа даже становиться подозревать что мама ценить какой-то глупый курица корова больше папа 
33131	 ярослав иванович разумеется кришна допускать горелов или копытов или даже разумейко пусть уже быть кришна раз так хотеться быть пастух невинный курица рождаться вырастать крайний 
33131	 межгалактический контора твой мокша объявлять длительный перерыв пообещать ученица первый второй ступень такой крышесносный третий недалекий будущее что ментальный тело так заливать сладкий сироп предвкушение хотя автор понятие иметь откуда курица ментальный тело 
33131	 еще здесь торговать настоящий курица петух как впрочем 
33131	 спохватываться понимать что меченый марганцовка розовый курица давно отправлять далекий плавание 
33131	 здесь словно глупый беззащитный курица один метить зеленка бертин курица который видно километр куда 
33131	 дедушка только отвечать знать добавлять тупой курица уходить 
33131	 зато появляться возможность отдавать свой досуг всякий прочий птичка индюк курица павлин цесарка гусь каролинка мандаринка 
33131	 пестренький потом зарезать сказать потапиха задумчиво глядеть прыгать около баня курица 
33131	 курица который она заводить совет 
33131	 почему-то крайне редкий свинья вообще нет птица курица утка гусь 
33131	 крестьянин только отнимать все что выращивать колхозный поле больший часть что непосильный труд заиметь свой личный хозяйство молоко корова яйцо курица мясо шерсть шкура 
33131	 притом никакой снобизм постановка сцена разгуливать курица ослик надо золушка 
33131	 тьфу тьфу отплевываться отряхиваться кикимора это курица лесавка общипывать они этот 
33131	 кафе уют где подавать два вид второй котлета маленький котлета особый вкус точно такой как первый больший шоссе сонно бродить курица здесь вообще много всякий птица 
33131	 как-то вечер собираться покормить двор курица 
33131	 курятник отгораживать пристройка возле дом жить курица там весь время кипеть 
38375	 размещать этот сайт статья слеплять словно под копирка разъясняться что основной причина хронический болезнь плохой настроение человек снижение удой молочный скот яйценоскость курица заключаться именно геопатогенный зона 
33131	 житель предместье гордость потчевать гость яйцо собственный курица 
33131	 сеть американский ресторан жареный курица кентукки настолько беречь 
33131	 курица огород черта город сочный 
33131	 стоять блин помнить примерно рублик странно раз видеть еще флюид раз видеть глиз курица где продавать блин 
33131	 ничто услышать очевидный курица золотоносный резать 
33131	 курица несушка содержать особый рацион 
33131	 земля тянуть холод перед крыльцо похаживать поскучнеть курица тетя галя поливать дальний конец 
33131	 зато сейчас благодаря наш правительство американец продавать этот пищевой мусор делать немой бешеный деньги наш птицеферма умирать потому что продавать наш курица цена американский окорочок невыгодно 
33131	 жизнь этамп быть веселый большой камин часто жарить курица как-то даже быть приглашать преподаватель 
33131	 для украшение оберег глина или гипс делаться разный фигурка человек казак казачок скоморох берегиня животное птица корова коза поросенок курица петушки аист гусь 
33131	 кроме дом предел садовый кольцо коттеджный поселок они территория москва около существовать еще третий случай дом окраина деревня печь коза курица случай экзотический почти сказочный 
33131	 кумачовый скатерть оплетать бутыль красный вино настоящий бутылка шампанское выражение стол ломиться яство годиться вполне жареный курица гусь кабаний судя 
33131	 дальний конец деревня медленно брести корова тревожить ослепительно белый курица уступать дорога недовольный кудахтанье 
33131	 получаться случайность преступление хитроумие который никак вязаться тишина утренний деревня негромкий разговор курица жужжание пчела теплый душистый 
33131	 памятный детство неукоснительный обряд воскресный завтрак втроем под воскресный радиопередача мажор венгерский курица продуктовый заказ раз 
