33131	 однажды домработница наш сосед зысин который заводить себя курица сваривать работать ряд заключенный сразу 
33131	 свой келья ухитряться устраивать нечто вроде вечеринка который строить курица смазливенький охранница женбарак 
33131	 быть бесподобный веселый остроумный салон отставной шляхтянка буквально таять его умение строить курица 
33131	 даже такой благополучный процветать пословица как деньги курица клевать курица представать 
33131	 весь это попадать как курица никита втягивать 
33131	 покормить курица тихо чем давеча сказать она 
33131	 большой породистый петух массивный сизоватый отлив клюв важно вышагивать просторный кухня среди пестрый суетиться курица 
33131	 велеть содержать кормить отдельно другой курица 
38375	 хвойный паста влиять яйценоскость курица 
33131	 один миг рушиться весь мой хрестоматийный представление курица как самый безобидный существо 
33131	 знать что кто-то уже снимать отсюда неважный отношение курица главное неумение уживаться 
33131	 вот забывать почему-то весь жизнь что курица звать никогда 
38375	 садиться покуль самовар совсем остыть курица ров снова выкрикивать как каркнуть 
38375	 она спасибо сказать курица ров 
38375	 они что курс что происходить курица ров высовываться богодул 
38375	 потоп курица ров человек иметь 
38375	 катер рина гореть курица ров 
33131	 вид это какой-то колючий страшилище вкус хорошо курица куропатка 
33131	 между прочее курт случайно знать курица удивляться нюра 
33131	 агитбригадовец мочь строить курица только друг друг 
33131	 один акция воровство курица принимать непосредственный участие 
33131	 только один иннокентий иванович деревня дотягивать этот цифра иннокентий иванович всякий знать деньги курица клевать так 
33131	 говорить москва курица доить верить 
33131	 говорить громко пафос словно выступать трибуна попадать как курица ощип обращаться 
33131	 спор гамлет критика делиться два лагерь один огорчать кадр символ другой курица кстати спор символ многозначительность 
33131	 костя муж обед давно без этот курица готовый давно садиться нет 
33131	 лот заорать гусь закудахтать курица жалобно замычать теленок 
33131	 человек можно сказать деньги курица клевать жаться 
33131	 они приходить гоготать весь деревня мочиться посреди улица курица ловить 
33131	 вон человек даже курица нету жить 
33131	 гришка который прибывать полк июль год число первый офицер сразу попадать как курица ощип 
33131	 как относиться другой животное курица гусь овца олень мышь 
33131	 мало приятно попадать как курица кобель задница 
33131	 обращаться взор присутствовать курица тронуть восторгаться алеша 
33131	 старость становиться страшно вздорный тайком обрывать соседский груша свешиваться через забор его земля убивать палка соседский курица если они забредать 
33131	 они бедняга попадаться как курица ощип обходиться 
33131	 это быть ирония злой насмешка над курица раскудахтаться после драка некрасивый гротескный 
33131	 наплывать сарай где корова курица телок живой теплый дух 
33131	 белосток вайс выходить вокзал куда устремляться весь пассажир скупать курица яйцо сдобный булка колбасный изделие 
33131	 как-то сказать один преуспевающий доктор что тот деньги курица клевать быть очень 
33131	 как-то сказать один преуспевающий доктор что тот деньги курица клевать быть очень 
38375	 более сухой пивной отстой входить рацион птица настолько благоприятно влиять они что яйценоскость курица повышаться 
38375	 отец дрожать рука будто курица воровать 
33131	 ходить ограда созывать курица цып цып цып 
33131	 взглядывать этот пробор этот ехидный взор взглядывать светлый брюки прочий разный штука взглядывать вкрадчивый манера этот морской инженер прошлое строить ледокол теперь строить курица что доводить тяжелый 
33131	 взглядывать этот пробор этот ехидный взор взглядывать светлый брюки прочий разный штука взглядывать вкрадчивый манера этот морской инженер прошлое строить ледокол теперь строить курица что доводить тяжелый 
33131	 там курица нырять пыль встряхиваться ошалело 
33131	 широкий двор бродить курица важно шагать три гусь 
33131	 тревожно прокричать петух курица хор закудахтать мгновенно смолкать 
33131	 озеро это быть известный человек под имя курица яур 
33131	 они полетать еще садиться озеро курица яур далеко водопад 
33131	 юноша обращаться также озеро курица яур 
33131	 про какой-то доктор большой говорить присутствие митя что деньги курица клевать 
33131	 это быть воспринимать как несчастие паче что накануне музо выдавать курица 
38375	 устанавливать что при добавление рацион птица микродоза ростовой вещество живой вес они увеличиваться яйценоскость курица повышаться 
33131	 звонкий лай обертываться анна кормить курица 
33131	 санаторный весельчак хлестать вино грызть курица 
33131	 некоторые держать курица другой поросенок коза 
33131	 пасека похерить пчела видеть невыгодный курица похерить 
33131	 нюшка критически оглядывать лошадь заявлять что такой лошадь дядя вася никуда поехать только человек даже курица засмеивать 
33131	 деятельный курица раскапывать улица зады искать 
33131	 разве курица это птица удивляться миша 
33131	 словом все хороший петух только курица топтать 
33131	 что касаться собственный приусадебный хозяйство благодаря отмена весь налог овца шерсть мясо полкожа деньги поросенок мясо полкожа деньги корова молоко мясо деньги курица фруктовый дерево гусь 
33131	 потом курица гусь утка запрашивать овца новый 
33131	 сейчас здесь иметься тысяча голова птица главный образ курица 
33131	 мужчина интересный интеллигентный интеллигент варвара весь жизнь быть неравнодушный быть пекашин учитель который она строить курица 
33131	 забор иногда взлетать соседский курица петух 
33131	 политика это сарай где гадить копошиться там курица петушки говорить артист 
33131	 как следствие ферма птицефабрика разводить помимо курица свинья корова еще 
33131	 глеб весь это иван поощрять развивать курица целебный вода купание 
33131	 этот ночь под заунывный вой хамсин мария долго думать анастасия михайловна она сын который быть достаточно тактичный чтобы вербовать она английский агент доктор франсуа который наверняка попадать история как курица ощип загадочный танк 
33131	 рука ксения краснушка вдруг замирать словно оцепенеть весь другой курица петух ефрейтор отходить 
33131	 адрес простой под наманган кишлак катт курица 
33131	 подходить они называть нужный кишлак нужно катт курица один сносно говорить по-русски знать 
33131	 дорога кишлак катт курица сливаться один слепящий лента 
33131	 куда надо напоминать спрашивать шофер катт курица тогда через джумашуй надо ехать 
33131	 замечать только что весь народ эспланада быть радостно изумлять сабра олим галут трепетный фалаш русский атеистический циник дать хабад патрульный агент штатское обвязывать динамит хамазник забывать для что сюда приезжать попадаться как курица ощип быть перехватываться 
38375	 счастливый невеста это глисс курица лореаль эльсев 
38375	 это глисс курица лореаль эльсев 
33131	 немногочисленный корова курица коза большой прибыль 
33131	 качество объект исследование использовать перо пуховой отходы переработка курица порода русский белый рис 
33131	 сан сор нести курица тот 
33131	 петух уже подходить курица разглядывать они интерес 
33131	 многие они так никогда покидать черта оседлость везти себя всякий случай кошерный уже курица который ощипывать туалет венский 
33131	 утро ярко светить солнце который разогревать асфальт особенность покрытие автодром манья курица состоять что 
38375	 елена воронин мать двое малолетний ребенок арестовывать хищение пряник печение год кража три курица год три блок 
38375	 конечно никто утверждать что тюрьма колония сидеть только кража три курица пять килограмм пряник 
33131	 главный напасть виноградник карабах тамошний курица 
33131	 аглая курица взять знать как 
33131	 человек входить этот партия союз движение объединение или блок отличаться друг друг много чем долговский курица метить чернила разный цвет 
38375	 для межвидовой типирование необходимо иметь вид что интенсивно образовывать бляшка культура клетка эмбрион морской свинка меньший степень вплоть отсутствие зависимость штамм фибробласт эмбрион курица 
33131	 крикнуть впрыгивать машкин двор ужас давно готовый смерть курица борзая поросенок влетать 
33131	 пообедать разогревать свч печка копченый курица готовый овощной салат 
33131	 курица становиться взлетать инжировой дерево 
33131	 она слушать блеяние коза загон мычание корова уже загнать скотный двор кудахтанье взлетать дерево курица 
38375	 стеречь курица лиса покаяться пробурчать плоскыня 
33131	 сейчас опять вылезать гусь свинья тут друг друг окончательно добивать огненный курица закричать весь свет верить 
33131	 прощай огненный курица случаться забывать что 
33131	 бродить курица пустынный улица рыться 
33131	 осипнуть лично приготавливать курица по-чилийски мой духовка хитро 
33131	 тата кормить курица индюшка разбрасывать ведерко 
33131	 бурнашов бранить себя что открываться священник сразу пойти обман нерешительность скрытность свой натура вот угождать как курица ощип 
33131	 илья послушать как курица тревожить свинья загон 
33131	 стараться попадать птица курица тихо блуждать кустарник или 
33131	 говорить что москва курица доить привоз день 
33131	 тетка попадать тоже как курица вопить ругаться врать 
33131	 весь деревня два курица петух 
38375	 что отец курица воровать что 
33131	 кролик курица исчерпывать ассортимент съедобный живность 
33131	 говорить попугай курица гусь утка 
33131	 еще вылупливаться бабочка махаон так что хозяйство помимо курица прибывать 
33131	 говорить проходить время говорить что курица доить 
33131	 выпивать или здесь или задний двор устраиваться чурбак отгонять курица закуска 
33131	 еще лыжа они черный рамка рой как говорить болеть глазок говорить что курица доить прислушиваться распространенный мнение 
38375	 что курица воровать что что рука 
33131	 начинаться буйный застолье тост поедание копченый курица ветчина пельмень 
33131	 проходиться послушать что сегодня говорить одесский привоз курица 
38375	 работа использовать первичный культура фибробласт эмбрион курица перевивать культура клетка 
33131	 восьмеро это во-первых обезьянка сафи во-вторых в-третьих среди курица взять для еда опять как 
33131	 лишь два курица зарезать лиса убегать успевать 
33131	 очнуться утро деревня курица петух крепкий общий хозяйство 
33131	 нашествие курица батальный сцена два человеческий 
33131	 два курица обед быть мало три 
33131	 закричать забрызгать искра страшный огненный курица налетать черный поганец опаливать 
33131	 огненный курица похаживать трава выдергивать приглянуться 
33131	 два курица лишать жизнь один раздирать 
33131	 сломать замок курятник снимать насест два курица индюк весь правило 
33131	 курица индюшка индюшонок топор прислонять 
33131	 дед переключаться курица тот мол ходить грестись 
33131	 быть милосердный упрашивать король чтобы покарать граф вернуть жак поросенок два курица 
33131	 решать взять для мишина диета два курица 
33131	 участие отец советский водородный бомба домашний хозяйство сводиться основной два вещь рубить дрова тот инструмент лишать жизнь курица 
33131	 во-вторых когда-нибудь слышать чтобы бразилия курица разводить 
38375	 для изоляция использовать первичный культура фибробласт эмбрион кролик курица человек диплоидный клеточный линия часто 
33131	 как весь деревня дом быть голос звук среди амбарчик стайка клетушка звенеть комариный тишина зарыться песок млеть курица стоять один нога петух 
33131	 намеривать ссориться граф жизорский из-за поросенок два курица 
33131	 заканчивать некого петь что курица некого говорить что 
33131	 гражданин свой квартира пытаться разводить курица мужик соседний дом решать 
33131	 баев тут добавлять еще чтобы расстраивать бабулька понестись деревня распевать пугать курица гусь поросый 
33131	 наш пенсионер хотеть тишина покой лежать диван смотреть кривой зеркало ворчать что рано трава быть зеленый молодежь нравственный курица толстый 
33131	 когда чинить быть нечего пас овца или продавать рынок яйцо свой курица 
33131	 ответ письмо еще добираться там вроде что-то нечленораздельный стиль райкин весь курица передохнуть высылать телескоп 
33131	 валек пошептаться курица они откликаться настороженно 
33131	 залезать ящик где курица нестись там солома постилать приходить 
33131	 последний вагон вдруг просыпаться пшено приходить курица поклевать приходить гусь пощипать 
33131	 ход дело один волчица залезать овчарня там курица быть 
33131	 улица петь птица разговаривать курица хвастаться петух качаться дерево хлопать 
33131	 под пианино любить прятаться солнце курица черный полировать спина 
33131	 сдыхать весь курица жаль еще столько 
33131	 курица шарахаться крыса взлетать танцевать 
33131	 ширван сравнение вход персия влажно теплый реликтовый заросль гиркан пустой место ладонь который древний русло курица метаться тень рельеф сторона 
33131	 далеко спускаться плавни курица спугивать джейран водопой делать 
33131	 фарцевать пластинка обувь ездить свой запорожец браконьерский село вдоль курица привозить рюкзак безголовый порубить пополам 
33131	 доить ходить свинья курица круглый как колобок горластый 
33131	 если кто-то позволять себя изредка обращаться мысль источник мясо яйцо молоко представлять скоро все идиллический картинка корова мирно пастись луг под надзор играть дудочка пастушка курица индюшка важно расхаживать 
33131	 прошедший недавно выборы штат калифорния улучшение условие жизнь курица проголосовать избиратель 
33131	 переглядываться раскатистый движение плечо они выплескивать ведро мостовая помои мутный поток бежать булыжник вниз догонять спарцмен словно тщетный стремление сливаться вод такой мутно кофейный буг тот другой держать курица берта держать они ржавый 
33131	 берта красить свой курица она красить зеленка 
33131	 однако любой случай все идти неплохо курица нестись запах становиться 
33131	 так растить сам свой бараболить порося курица тот качок доить свой корова 
33131	 женщина потрошиться они как курица вот минск 
33131	 ужик курица охаживать смело зажимать клюв 
33131	 они гадать появление небо птица крик как клевать священный курица 
33131	 так исторический фильм про опереточный колхозник экстрасенсорный чувство вовремя подсказывать справедливый экспроприатор что перед никакой товарищ как простодушно полагать мгновение назад масон оккультист международный вражина владелец два курица 
33131	 курица круг клевать зернышко благодаря 
33131	 курица сегодня экономически выгодно разводить только 
33131	 они сортир хоздвор где лето жить курица 
