39536	 между домбровский семенов пропасть тоже чувствовать этот 
38487	 между преподаватель сидеть парта мальчик простираться пропасть 
38487	 сетичка жена кроме нельзя отрицать бросаться глаз социальный неравенство наш детство быть такой огромный пропасть между финансовый возможность родитель 
38487	 быть коэффициент дженни показывать разница между самый бедный богатый человек группа регион быть еще пропасть между поселение когда социальный 
38487	 нынешний пропасть между она этот пожилой 
1	 слышать ничто очень хорошо знать этот протяжный шум звук уходить пропасть поезд 
38487	 некоторые видеть причина волна исламский экстремизм тот факт что расти пропасть между богатеть золотой миллиард постиндустриальный 
39536	 отличие срываться адский пропасть иван грозный царь борис заботиться 
39536	 правый борт что над пропасть вырастать янак ставраки папа сатырасти 
38487	 что касаться недопонимание вызывать оно огромный пропасть между человек принимать решение 
38487	 находить только огромный пропасть между пропаганда общественный мнение 
0	 ходить многие посрываться упасть пропасть 
0	 между нарком заместитель нарком такой пропасть 
39536	 стоять над отвес небольшой отряд показывать паренек который сидеть свешивать пропасть нога альпинистский ботинок 
1	 неужто она уходить навсегда проваливаться пропасть 
0	 они упасть пропасть невежество сдерживать вал камнепад реформирование 
38487	 это пропасть между самодисциплина внешний управление 
38487	 пропасть между развитый страна зависимый 
38487	 горький сетование отчужденность молодежь расти пропасть между поколение слышаться под любой 
39536	 проноситься велосипед отчаянный седок туда пропасть 
1	 конечно между нина барменша ксения пусть даже бывший актриса пропасть быть большой история 
38487	 пропасть этот минута быть так большой 
1	 артем почувствовать что его сердце проваливаться пропасть закрывать глаз 
38487	 пропасть между два культура естественнонаучный 
38487	 весь мир еще раз увидеть как большой пропасть между развитый страна развиваться 
39536	 лошадь повисать оглобля воздух над пропасть бешено брыкаться 
38487	 разрыв лидер составлять очко уже целый пропасть 
39536	 между рынок патриотизм вовсе нет пропасть потому незачем пугаться кто-то испорченный 
38487	 этот фраза показывать весь пропасть между великий поэт 
38487	 что карпов разделять идеологический пропасть 
38487	 пора осознавать демография поколение русский цивилизация катиться пропасть вырождение 
38487	 расти пропасть между победитель аутсайдер причем 
39536	 молиться господи остави вывести вывозить давать пропасть смиловаться надо грешный глупый 
38487	 какой бездонный пропасть оплодотворять уходить выносить 
1	 последний время про шок удавка финиш пропасть почему дорожать электричество столько 
38487	 однако между этика провозглашать этика воплощать жизнь мочь лежать целый пропасть 
39536	 одежда разноцветный танцевать хохотать петь самый край пропасть 
38487	 это быть громадный ценность увы отделять пропасть земной существование 
38487	 короче между город деревня разверзаться огромный пропасть 
38487	 без оглядка бежать сквозь зимний тьма этак братец недолго пропасть сам 
38487	 никогда пожалуй история россия пропасть между сверхбогатый олигарх обитатель 
38487	 расширяться пропасть между представитель высокий менеджмент 
38487	 дело тут вера тот пропасть между север который 
38487	 между старый новый время пропасть мост возводить собираться 
38487	 экономика страна бурно развиваться вместе она расти пропасть между наживать огромный состояние новый 
39536	 кто-то жить плохо кто-то хорошо дело быть жидкий суп мелкий жемчуг общий ощущение дискомфорт казаться что весь это политический система экономика страна вообще кое-как сшивать скорый рука ненадежно недееспособный потому любой момент любой толчок мочь ухнуть пропасть 
39536	 находиться дно пропасть выход она без 
38487	 господи как далеко маленький эстония какой пропасть пролегать между 
38487	 пропасть между образованный слой народ 
39536	 провозвестник хаос абсурд шагать канат натягивать над пропасть жонглировать принцип ценность 
38487	 ясно один между пиар проблема решение часто лежать огромный пропасть 
39536	 надеяться удаваться находить крупный спонсор выходить старт новый сезон слово поддерживать стоять край пропасть конюшня президент макс мосль 
39536	 сердце как будто оборваться ухнуть пропасть потом оттуда этот 
38487	 между философ ильин уголовник мокрухтин пропасть 
1	 опять лететь страшный пропасть опять реветь ветер жужжать 
38487	 наконец мигрант причина глубокий культурный пропасть между они разрушать 
1	 такой точно пропасть такой перепад температура 
38487	 пропасть между душа тело она 
39536	 ладно соглашаться восточный мудрость гласить если человек устремляться пропасть кто останавливать 
38487	 упасть пропасть мочь делать шаг 
38487	 можно конечно называть архитектура курган менгир юрта шалаш глубокий пропасть между хижина дворец 
38487	 быть это способ преодолевать пропасть между архитектура природа 
38487	 правда между ведущий европейский лига наш чемпионат целый пропасть 
38487	 результат расти пропасть между богатый бедный 
38487	 окно только верхний этаж пропасть между слово дело желать 
38487	 чем далеко быть увеличиваться материальный пропасть между мажор люмпен 
39536	 надо быть отходить край пропасть который придвигать его мичман 
1	 обязательно несчастный любовь обязательно влюблять куда-то бросаться море пропасть озеро разбиваться превращаться 
39536	 футболист цска воспользоваться фарт полный программа пострадать сторона опять висеть над пропасть вылет высокий дивизион 
39536	 вдруг сразу как падение пропасть который нельзя творить нельзя 
38487	 более вряд барон подозревать какой пропасть темперамент крыться забитый душа 
39536	 четвертый давать край пропасть литературный газета 
38487	 мало что хранить этот пропасть мазь негде тыл обратно 
39536	 кто-то интересовать теперь какой-то пропасть пролегать меж все 
38487	 жуть над какой разверстый пропасть пронести 
1	 протрезветь всегда мочь закрывать глаз почувствовать как падать пропасть замирание сердце федул 
38487	 однако последующий год технический прогресс образовывать гигантский пропасть между авто мотоспорт 
1	 славин играть так как лететь пропасть мочь услышать даже 
39536	 возможно это происходить потому что человек отходить край пропасть оказываться золотой забой 
38487	 дожидаться пока этот трещинка разверзаться бездонный пропасть иван дмитриевич покорно побрести 
38487	 между несчастный купчина сиятельный попович пролегать пропасть соответственно разный быть отклик 
1	 как только усомниться его божественный качество сразу свергать пропасть уже даже действительный достоинство 
39536	 вспомнить кто посылать вселяться свиной стадо вместе сбросить пропасть 
39536	 испитой морда сазон глаз милый почему-то сделаться очень испуганный как будто кто-то толкать пропасть 
39536	 поза неудобный пояс она свешиваться никуда черный пропасть колодец 
38487	 зиять пропасть подъезд разделять сережа 
38487	 тогда кузя еще понимать как легко давать себя слово семнадцать год какой огромный пропасть между слово исполнение обещать 
39536	 пятнадцать день томиться плоть парить над пропасть сомнение что еще порок 
39536	 сергей петрович зависать над пропасть второй раз 
1	 валеркино лицо наплывать негатив ивашников проявляться становиться цветной лидия лететь пропасть полный уверенность что завтра 
39536	 отличие волков наоборот оледеневать над пропасть поступок малоизвестный перевод шекспировский монолог 
38487	 без надобность специально учить свой сын резать теленок быть между необходимость жестокость огромный пропасть вот когда ездить 
1	 государственный древо отрясать отживший лист дворник пропасть работа только похоже мести 
1	 сбросить этот пропасть ведь хотеть помогать 
1	 ведь пропасть можно этот теперешний планетка 
39536	 весь свой жизнь идти словно край пропасть 
39536	 так давно преодолевать его сваливаться пропасть известный футболист 
1	 решительно ничто кроме пропасть между автобус записка 
38487	 кроме пропасть между автобус записка 
0	 разрозненный пробный листок пышный роща они отделять пропасть 
39536	 молодость свой режиссер театр комиссаржевская долго упрямо идти путь безжизненный выхолащивать театр марионетка пока подходить самый край пропасть 
39536	 этот рана залечивать давать трещина превращаться пропасть 
39536	 уже мочь ходить камера ждать ждать встреча живой человек мочь быть кто-то арестовывать после мочь быть кто-то знать что-нибудь мой семья что происходить происходить как упасть пропасть выход нет можно только кричать 
38487	 голова раскалываться расстояние что действительно лежать между они пропасть отчуждение расширяться мера услышать 
38487	 здесь между лебедь гадкий утенок пропасть 
39536	 так еще держаться самый край пропасть 
39536	 человечество сваливаться пропасть оставаться живой изувечивать 
38487	 павел флоренский леонид успенский другой резко акцентировать пропасть между духовность икона западный 
0	 заснеженный равнина превращаться море стоять рейд суд осыпать снег елка преображаться разлапистый пальма небо зажигаться такой пропасть звезда какой наш край 
38487	 кафедра дмитрий ободрять народ двоиться душа между старый новый мятущийся лезть пропасть 
38487	 долго еще протягивать проживать русский народ раскачиваться над пропасть грозить весь мир кулак 
39536	 даже стоять грань самый край пропасть оставаться только нажимать палец спусковой 
38487	 подчеркиваться важность личный контакт между английский советский лидер хотя сожаление отмечаться что существовать глубокий пропасть через который нужно еще перебрасывать 
38487	 забывать какой страна жить целый пропасть безнадежно 
38487	 автобус кстати ходить даллас гораздо часто чем например север страна миннесота что говорить что бедный население много вернее что большой пропасть между очень богатый бедный 
39536	 жизнь бороться только край пропасть 
38487	 страна становиться ожесточать совершенно бессовестный пропасть между хилый нищета нахально 
38487	 петр казаться что сближать россия запад так быть оно пропасть бездна между свобода несвобода 
39536	 пропасть другой сторона опять вылезать 
39536	 это быть ликоспастовский глаз что-то они появляться новый отчужденный ложиться какой-то пропасть между 
39536	 что-то интересный смотреть сказать увлекать висеть над пропасть шаткий деревянный перила сунуть 
38487	 елена что этот пропасть деньги 
1	 такой точно пропасть впрочем между карина 
39536	 что-то интересный смотреть сказать увлекать висеть над пропасть шаткий деревянный перила сунуть 
38487	 класс продемонстрировать немаловажный вопрос как разговаривать родитель ученик чей культурный языковой барьер являться пропасть между они учитель 
38487	 зал спина открываться черный пустота зиять пропасть 
39536	 образно говорить гитлер середина год один нога зависать над пропасть устилать труп арийский солдат 
39536	 итог яма между российский зарубежный заводчик превращаться пропасть 
38487	 честертон видеть зиять пропасть между журналистика писательство 
39536	 сотня сотня сборщик пустой посуда весь свой рабочий инструмент весь свой знание умение исчезать наш глаз целый эпоха валиться пропасть уходить небытие 
1	 окурок совершать несложный кульбит проваливаться пропасть недолго парить воздушный 
39536	 вид открываться тропа захватывать дух прямо из-под нога уходить пропасть огромный отвесный скала покрывать цветущий 
38487	 однако преодолевать пропасть отделять тот далекий 
38487	 садиться слишком далеко увеличивать незримый пропасть между она зал даже 
1	 сердце она проваливаться пропасть время этот краткий заминка 
38487	 подслеповатый безразличный свет ровно ложиться стальной река низвергаться царственный пропасть россия 
38487	 разница между самый дорогой бьюик самый дешевый кадиллак слоан бьиа ширина пропасть около тысяча доллар 
39536	 между они разлом бездна пропасть который нельзя преодолевать два 
1	 пропасть это всегда замирание сердце 
38487	 чтобы семейный дело шататься катиться пропасть 
38487	 пока монах крутить скрипучий ворота посетитель сетка полчаса раскачиваться над пропасть 
38487	 формироваться этот субэтнос время петровский реформа отделять европейский образованный слой простонародье лагерь этот пропасть сохраняться 
39536	 начинать непосредственный преемник князь ярополк окаянный погубить свой брат борис глеб весь без исключение вождь наш нация совершать свой жизнь такой пропасть недоброкачественный поступок прямой преступление 
39536	 мочь больше сопротивляться поднатуживаться завопить весь свой ископаемый глотка вытягивать шея опускать хвост прыгнуть высоко вверх пропасть море 
39536	 двенадцать рассуждение пропасть подземный поток создавать какой-то 
39536	 господи боже спасать сохранять помиловать грешный давать пропасть господи 
38487	 подчас комментарий руководитель район показывать весь пропасть между отчетный прогнозный цифра 
38487	 пропасть между два мир призывать доказывать 
38487	 важный они технический прогресс как следствие исчезновение пропасть стирание грань между умственный 
39536	 его сюжетный ход композиционный построение ловушка словесный хулиганство его парадоксальный ракурс перспектива представлять привычный действительность ненадежный шаткий зависать над пропасть сродни пусть дух 
39536	 нога мой беспомощно зависать над пропасть плавиться асфальт этот 
38487	 почва для сравнение отсутствовать начисто нога криворотов зиять пропасть 
39536	 страна зависать над пропасть как тяжеленный грузовик случайно буквально 
38487	 здесь речь должный идти онтологический пропасть пролегать между два тип человек 
39536	 как голливудский супермен команда пешич представать весь краса именно тогда когда зависать над пропасть 
39536	 человек это канат натягивать между животное сверхчеловек канат над пропасть 
38487	 видеть только множество звезда который колебаться вокруг зиять пропасть один она тонуть 
38487	 тот трещина между душа тело что пролегать через человек культура безмерность цветаева расширять пропасть 
39536	 думать что мчаться счастие впереди пропасть 
39536	 пытаться удерживать равновесие самый край жизнь каждый новый рюмка настойчиво пододвигать густой туман пропасть 
39536	 десяток другой ниссан притискивать борт выстраивать между скала один сторона пропасть другой 
38487	 рука находить рука душа душа тело сливаться полететь пропасть раздаваться протяжный звук который 
38487	 россия катиться пропасть торговаться как 
39536	 ясно гулко доноситься дно пропасть подъезжать ограда 
39536	 вставать цыпочки заглядывать туда пропасть 
