39536	 после мой рождение трещина между мой родитель превращаться пропасть 
39536	 оно висеть над пропасть покорно ждать человек 
39536	 однако выход как известно надо искать дно пропасть 
38487	 самый главный причина неприятие критика этот мюзикл это что по-английски называться по-русски разрыв культура культурный скачок культурный пропасть 
38487	 когда ринуться пропасть этот кретин рвануться 
38487	 вот мнение вебер французский крестьянство почти преодолевать пропасть между народный культура культура 
39536	 между они лежать пропасть который сам склонять 
39536	 встречать мочь только другой вампир три сторона пропасть окружать забор рублевский поместье принадлежать 
38487	 практически весь государство потерпеть крах начинать что этот пропасть расти 
38487	 пока монах крутить скрипучий ворота какой использоваться парусный судно для подъем якорь посетитель сетка полчаса раскачиваться над пропасть 
39536	 неужели между мой способность желание быть непреодолимый пропасть 
39536	 оставаться яма котлован бездна пропасть который природа беспрерывно заполнять лето 
39536	 если побывать псков мой жизнь мой духовный сознание оставаться некий вакуум пропасть 
1	 философский пропасть это сборник философский очерк соединять 
38487	 мой сознание доходить что этот пропасть удаваться перепрыгивать два 
38487	 полететь пропасть неизвестность уносить судьба 
38487	 неполиткорректный несправедливый мысль какой тупой они этот француз как камешек перед катиться пропасть мяч сталкивать скорбный трагический морщина 
38487	 позволять некоторый впечатлительный комментатор говорить что россия катиться пропасть 
38487	 театр катиться пропасть коммерческий рельс 
39536	 осознание ценность жизнь дыхание край пропасть достижение вершина достижение глубина 
38487	 хорошо видно что наш мир катиться пропасть стипендия выдавать девять месяц 
0	 пропасть который мочь поглощать весь 
38487	 это катиться пропасть россия стоять как стоять 
39536	 расход катастрофический водный поток сформировывать марсианский канал пропасть оцениваться 
39536	 школа мой знание физика высоко тройка котироваться между академик лежать пропасть однако выход как известно надо 
38487	 быть странный ощущение вроде законодатель работать правительство править страна катиться пропасть 
38487	 если государь позволять страна катиться пропасть свой обязанность 
39536	 это как раз означать что игра отодвигаться вводиться тонкость принцип индивидуация этот тонкость свидетельствовать что если сам вещь отличный друг друг между они творец они лежать пропасть ничто 
1	 издательский совет русский православный церковь выпускать свет книга преподобный иустин попович философский пропасть 
1	 русский язык сборник философский пропасть публиковаться впервые 
38487	 еще более впечатляющий быть путешествовать параллельный мир перепрыгивать помощь кодировать гравитационный волна матрица через пропасть невидимый пространственный измерение 
39536	 команда пойти один другой становиться исчезать черный пропасть ночь 
38487	 весь это уходить вниз вниз уже вериться что этот гигантский пропасть вообще существовать дно 
39536	 тщательный топографический съемка нижний галерея определение окончательный глубина пропасть 
39536	 если человек отказываться шагнуть пропасть поступок это 
39536	 балкон сонина квартира над пропасть 
39536	 антон перекидывать один нога через ограда затем второй медленно двинуться держаться поручень повертываться пропасть спина лицо 
39536	 подобный чувство испытывать только однажды когда забираться колокольня перегибаться повисать над пятидесятипятиметровый пропасть 
38487	 между петербургский светский девица тот год когда гончаров приезжать столица становиться наблюдать вера шестидесятый год целый пропасть 
38487	 для они соскакивать крутой ступенька как сигануть бездонный пропасть 
39536	 горный коза недвижно застыть над пропасть темный силуэт затем как 
39536	 последний миг амброджо схватывать францисканец шиворот тот отпускать веревка животное все продолжать скользить страшно шуршать заледенеть камень доскользить край пропасть 
39536	 вместо это весь овражек рытвина который глупый юный возраст так легко быть перепрыгивать год только углубляться превращаться пропасть без дно 
38487	 пожар потушить раскрываться глубокий пропасть отношение леший заставлять 
39536	 стоить применять окружающий иной масштаб например масштаб пустыня поглощать один такой город чтобы осознавать что это вид неколебимый постоянство держаться что висеть над пропасть один день все 
38487	 вспомнить что динара учиться аспирантура финансовый институт олег расспрашивать она экономика коштырбастывать правда как утверждать некоторые что страна катиться пропасть 
39536	 пить чай шале румяный свежий старушка переходить ледник идти над пропасть камень валиться из-под наш нога 
38487	 через тот пропасть что по-прежнему разверзаться между этот 
38487	 взбираться одеялов гора скатываться глубокий пропасть карабкаться через складка простыня 
38487	 целый ряд современный процесс при весь страновой различие способствовать актуализация этот общий кризис или имитация представительный демократия расширяться пропасть между править элита победитель 
39536	 однажды спрашивать вронский вспоминать сергей каменев что ждать россия доходить уже самый край пропасть 
38487	 даже луна побывать много человек чем этот великий пропасть мир 
38487	 вернуть властно земля поводить мокей через расступаться неохота толпа чем далеко уходить они пропасть тем сильно быть разрывать душа 
39536	 скоро все пойти прогуливаться обнаруживаться что татьяна смотреть только под нога будто тропинка мостик через пропасть прикусывать губа подъем задыхаться 
38487	 между опытный образец широкомасштабный производство большой пропасть причем 
39536	 мама папа рядом они давать пропасть 
38487	 сентябрь быть тот время когда возглавлять правительство россия полный сила развиваться процесс который толкать страна пропасть 
39536	 мнить себя брести бриллиантовый дорога потом срываться черный пропасть 
38487	 перед возможный падение власть перед бездонный пропасть этот обвал кружиться 
39536	 под отчаянный запоздалый визг пассажирка очередной пропасть оставаться левый борт 
38487	 пропасть какой смушка сизый мороз 
39536	 локомотив мчаться шаткий дорога безумный машинист становиться наплевать возможный пропасть впереди 
39536	 теперь когда сам смочь хотя представлять себе какой высота человечество обрушиваться пропасть его убежденность этот исчезать 
38487	 если старый божество позволять человек срываться пропасть сам погибать вместе 
38487	 здесь как представляться проходить проходить сей пора главный грань время превращаться зиять пропасть между народ править класс 
39536	 один дело танцор двигаться широкий поле другой если путь сужаться узкий горный тропа ствол дерево перекидывать через пропасть 
38487	 протяжение пять год ющенко весьма успешно руководить национальный банк тот число роковой год когда гривна хотя пошатнуться ринуться пропасть следом российский рубль 
38487	 середина прошлый век один основоположник современный нейрофизиология эдриан выступать симпозиум мозг сознательный опыт отмечать что вплоть начало мало быть вещь много незыблемый популярный философия сознание огромный большинство образованный человек чем принципиальный различие пропасть между дух тело 
39536	 теперь когда проходить еще несколько десятилетие можно сказать что сознание теоретик обсуждать давать вопрос между дух материя уже практически оставаться никакой пропасть даже самый узкий 
39536	 истериковать отчаяние бравада танцующий над пропасть 
38487	 ведь давно уже множество автор доказывать что хотя зиять пропасть между взгляд ранний маркс 
39536	 асмолов ага над пропасть без интеллект рубенс против дюрер 
39536	 совращать измученный изуродовать гнанный страна какой-то отчаяние пропасть преждевременный прыжок русский преждевременный 
38487	 однако можно надеяться построение такой модель универсум будущее который быть непроходимый пропасть между человек физический мир 
38487	 случаться пропасть ходорковский бразды правление должный принимать 
39536	 самый свой действие партия власть сталкивать весь общество пропасть 
38487	 очевидец февральский переворот шульгин писать поздно перед возможный падение власть перед бездонный пропасть этот обвал кружиться 
38487	 декарт это два пропасть один называть 
39536	 покрывать риск давать пропасть кредитор быть 
38487	 ростовщик есть очищать сахарный тростник энергично выплевывать сердцевина пропасть 
39536	 ложиться камень живот раскаленный каменный валунищий над обрыв подползать его край свешивать голова пропасть 
39536	 когда появляться заплакать давать пропасть 
39536	 вспомнить как жить еще несколько год назад когда приниматься такой бюджет что месяц человек выплачиваться зарплата когда страна каждый день стоять край финансовый пропасть социальный взрыв 
38487	 насколько большой пропасть между первый последний проект 
38487	 безработица возрастать государство уже справляться выплата пособие весь новый новый толпа безрубашечник дескамисадос аргентинский экономика стремительно катиться пропасть общество зрело недовольство 
39536	 мировой премьера новый произведение губайдулина край пропасть 
39536	 человек четвертый сторона пропасть всего 
39536	 если актер черный очко смотреть поверх голова заносить нога над пропасть значит тиресий слепой 
39536	 даже стоически минималистский утверждение юный бродский значит оставаться только иллюзия дорога опровергать позиция скептицизм иллюзия впрямь господствовать пространство роман зато дорога обрываться недвусмысленный глобальный пропасть 
39536	 возможно именно так чувствовать себя человек занести нога над пропасть 
38487	 три год этот возраст почти пропасть толкин суметь она преодолевать 
38487	 два этот автомобиль разделять пропасть проходить невидимый черта под 
38487	 тональный пропасть голос знаменовать чудо преображение 
39536	 она причитать добрый человек давать пропасть 
39536	 другой путь товарищ это путь пропасть 
38487	 однако между вышеупомянутый текст социолог такой утверждение каганский как жить реальный пространство мыслить фантом фикция очень примитивный множиться неадекватный образ страна спекуляция тема путь россия также апелляция органично целостный форма страна методологический пропасть просить прощение пространственный метафора 
39536	 итог один сторона четыре труп другой розовый свет это метафора счастливый семейство отправляться вероятно издатель машина подарить гарри тишина сердце обретать благодаря гарри семейный идиллия случаться инициатива гарри ведь супружеский отношение мишель замирать нерешительность самый край пропасть 
39536	 сложный наука оказываться ведение лошадь повод узкий тропа или овраг над пропасть или крутой склон 
39536	 узнавать что находиться край пропасть 
38487	 виртуальный мост технология перекидываться над пропасть невосстановимый время позволять прошлое 
38487	 чувствовать себя мост перекидывать россия дореволюционный россия послесоветский будущий мост который черезый весь пропасть советский год перетаскиваться тяжело грузить 
39536	 полезть гора срываться провисеть несколько час этот свой нога над пропасть 
39536	 михаил пытаться доставать московит наседать калина калина все отступать отступать близко край скала вдруг вздергивать меч последний замах так повалиться пропасть 
39536	 оно мочь оказываться название магический предмет замок или крепость горный пик пропасть вид чародейство наименование заклинание 
38487	 глупость этот жить оборотиться спина будущее вслепую брести пропасть 
39536	 лишь когда воздух заполнять пропасть край дно летать 
0	 вот ненец слово снег двадцать синоним задумчиво сказать вита куда такой пропасть спрашивать юрка убирать тумбочка 
39536	 нора подходить потрясать нога над пустота ощущать ужас под ребро кишка даже подумать что животный страх потому животный что голова существующий над пропасть нога сердце который 
39536	 несмотря ночной марш рассветный карабканье над пропасть тупой боль затылок 
0	 глубоко близко посадить глаз затхло тлеть такой пропасть что фома увидеть она 
38487	 гуманизм разделять этаж душа готический рассудочный пропасть начинаться новый расцвет искусство 
38487	 время москва свет москва идти уверенно по-прежнему линия над пропасть великий пост этот линия 
38487	 более отказываться передавать китай образец атомный бомба технический данные для производство ядерный вопрос между россия китай тогда пролегать пропасть 
39536	 так вот сказать говорить лосев что такой человек быть мостик наш страна между прошлое настоящее мостик над пропасть 
38487	 его собственный существование весь мир представать перед рухнуть этот пропасть 
38487	 сбрасывать какой-нибудь скала какой-нибудь пропасть 
39536	 воображать себя узенький площадка скала под нога пропасть 
39536	 когда утомленный первый скучно полезный сторона жизнь захотеть сбросить себя иго тяжелый существование занести нога над пропасть останавливаться пойти 
39536	 при это вышеупомянутый поле приобретать вид горный плато тропинка становиться хребет запретный зона долина пропасть 
39536	 самый дикий все этот зрелище быть даже висеть над бездна голова синий автобус проехать сквозь проделывать забор дыра останавливаться всего несколько метр пропасть 
1	 все лететь пропасть говорить другой израильтянин 
1	 все лететь пропасть говорить другой израильтянин 
39536	 медленно парить над пропасть вид свой напоминать пегас 
39536	 второй вариант шествие когда дух смерть уводить процессия живой могила или пропасть 
38487	 помнить точно перевал отчаяние перепрыгивать через самый сей пора глубокий пропасть печаль 
38487	 если сам дело как утверждать тимур этот стих ложиться основа государственный план программа приходиться удивляться что страна катиться пропасть 
38487	 запад стоять пропасть экономический коллапс смотреть что 
38487	 будто заканчиваться кино зал зажигаться свет бездонный пропасть экран становиться плоский глубокий 
39536	 через мгновение впереди метр сто откалываться преогромный глыба тихо ухнуть пропасть 
38487	 суть дело они первый шаг крах пропасть между власть население 
38487	 этот предел мысль еще докатываться далеко идти ибо далеко страх темнота пропасть 
39536	 этот повисать над пропасть ребенок уже захватывать образ 
39536	 эдип уже чувствовать под нога пропасть как соломинка хвататься 
38487	 стыдно быть признаваться что разбивать один юноша пропасть разверзаться перед эдип весь персонаж 
38487	 год год разница казаться пропасть 
