38487	 пропасть разделять андре агасси остальной 
38487	 этот модель появляться год наводить мост над пропасть разделять класс компактный хэтчбэк 
1	 тьфу пропасть взрыватель отказывать крикнуть скворцов 
39536	 серафима петровна упрямо качнуть голова вид человек прыгать пропасть сказать 
1	 всегда быть озабоченный говорить все что пропасть дело даже уверять свой 
39536	 точно стоять над пропасть кто-то туда толкать 
39536	 вампир попадать хартланд прыгать пропасть 
39536	 часть рвать любовь жалость валька балабан товарищ человек вообще из-за этот жалость все что мочь ненавидеть этот сучий мироустройство если сейчас сказать кинуться пропасть ради человек 
39536	 поздно пора мой юность уставать вопль местный общественность власть перекидывать через балка добротный деревянный мостик поручень который можно быть стоять над пропасть читать стих целоваться 
39536	 так думать подножие холм когда закат красный плащ биться самый кромка гора глядеть темный пропасть ночь мочь ничто 
38487	 лишь отдельный свойство разниться они словно пропасть разделять два этот мир 
39536	 здесь тункинский долина совсем другой про этот свежий горный мощь какой течение резать ущелие захлестывать пенный бирюзовый петля остров тайга глубина провал ворочать волна порог так рьяно что окно автомобиль высота серпантин мочь дотягиваться взлетать пропасть радуга рассказывать суметь 
39536	 знакомый еще байкал фокус чистый вода прозрачный бездна утягивать взгляд глубина здесь видеть чувствовать она как тяга горный пропасть отзываться сосущий пульсация где-то под 
38487	 наверное удаваться показывать какой пропасть раскрываться этот движение 
39536	 невозможно заставлять себя отпускать последний опора прыжок пропасть добрый воля 
39536	 это примерно переводить значит много неделя отражать мюрид атака русский неприступный скала ахульго враг вражеский пушка быть слишком много тогда горянка надевать черкеска сражаться наравне мужчина мать убивать свой ребенок сам прыгать пропасть чтобы доставаться русский ребенок 
0	 это абсолютный свобода такой пропасть кружить голова рассказывать 
39536	 однажды жена майя ехать канн монако случайно съезжать высокогорный фриветь жуткий горный дорога без всякий ограждение один два колышек торчать все вокруг горный пропасть внизу бездна ужас 
39536	 спасаться тот прыгать пропасть падать цепляться корень 
39536	 любой нормальный женщина если этот термин применять представительница слабый пол становиться предлагать обстоятельство подталкивать серпухин край пропасть исключение 
39536	 когда серпухин оставаться всего шаг край пропасть когда его жизнь человеческий 
39536	 хороший любовь словно приглашать разделять оно недоумение нергалить обвести взгляд подчиненный доводить человек край пропасть потом заявлять свой 
39536	 квартал доходный дом толкучка быть метр пятьсот девушка опоминаться успевать как подходить край толпа как край пропасть 
38487	 царский империя этот пропасть разделять жизненный уклад простой человек 
39536	 так конечный итог патриотизм который быть козырной карта компартия оказываться значительный степень перехватывать партия власть либерализм при фактический сохранение основной итог либеральный реформа оказываться погребать как фразеология как порождение лихой девяностый когда страна стоять край пропасть 
39536	 вокзал всегда чувствоваться дрожь тревога словно край пропасть 
1	 идти изнывать пот что поделать такой работа тьфу пропасть такой работа 
38487	 знать какой пропасть мочь толкнуть роковой сила 
39536	 стоять край пропасть который нет возврат давать 
38487	 город понарошку можно жить вчерне деревня все всерьез говорить валентина обдумывать жизненный пропасть разделять елань тюмень 
39536	 хотеть верить что совместный усилие теперь когда стоять край пропасть удаваться давать понимать этот молчаливый 
39536	 как будто подходить самый край пропасть заглядывать черный бездна 
39536	 дорога который идти человечество виться как спираль однажды оно снова оказываться край пропасть 
38487	 новый демократия быть построить сверху оккупационный режим снизу прогрессивный часть общество осознавать какой пропасть подводить страна тоталитарный миф величие 
39536	 вокзал всегда чувствоваться дрожь тревога словно край пропасть 
39536	 сон смешной человек сниться грань отчаяние край пропасть 
39536	 освобождаться объятие влажный рваный простыня подниматься ударяться голова свисать потолок тряпичный емкость имущество подбираться край пропасть обнаруживать что просто так 
39536	 первый фаза человек испытывать депрессия поскольку осознавать эмоционально переживать глубина греховный пропасть который находиться вспоминать 
1	 далее дело что сам выбор иметь решающий значение для личность акт выбор она как пропасть падать выбирать вещь 
38487	 восемь год это делать заставлять над какой пропасть проходить один девяносто четвертый 
38487	 один они стандартный что расти пропасть между развитый страна остальной 
39536	 его эскапада слишком напоминать прогулка край пропасть тоже чувствовать ледяной 
39536	 этот момент любой перерыв шах быть означать для белый еще один шаг край пропасть 
39536	 его расположение огромный высота дорога петлять край обрыв горный пропасть делать хуло почти посещать 
39536	 так бывать что человек стоять край пропасть некого рука подавать 
39536	 замечать что техника захват вооруженный рука специально нарабатываться шар часть упражнение этот группа использоваться комплекс развивать скорость реакция боец упражнение взять добыча небесный воин край пропасть 
39536	 говорить необходимость избавляться старый метод руководство молодежь автор менее оставлять доктрина некоторый механизм принудительный отношение молодой желать как известный герой сэлинджер спасать они пропасть повзросление 
39536	 бог помогать быть край пропасть теперь когда преддверие 
39536	 это быть прыжок пропасть странный безумный точка зрение 
39536	 точно дикий табун объездчик опытный поддаваться этот позволение сказать народ вопреки все опрос общественный мнение просто здравый смысл вдруг взбелениться край пропасть мчаться норовить туда утягивать 
39536	 охотник видеть что стоять над пропасть выход нет 
39536	 глаз свой товарищ сваливаться пропасть глубина тысяча фут 
39536	 снова ехать горный дорога над пропасть куда-то ввысь 
1	 дуня так поступать все равный что ребенок доверчивый конфетка приманивать отпихивать мочь статься что пропасть сталкивать фашизм какой-то 
38487	 понятно что когда два более чем взрослый человек все близко притягиваться притираться друг друг нерлин медленно делать большой передышка приближаться даже постигать клава она моментально безрассудно перемахивать пропасть разделять чужой родные без 
39536	 тамара ивановна взглядывать она быстро убирать взгляд ужасаться как быстро психика или что там еще дочь отзываться подготавливаться момент прыжок пропасть перед который она застыть 
38487	 даже посвящать она один свой альбом адреналин который записывать самый тяжелый период жизнь период болезнь когда быть волосок пропасть разделять два мир 
39536	 питать иллюзия этот власть безусловно пытаться раздавливать все без исключение несогласный сливаться она единый смертельный прыжок пропасть название который разламывать россия 
0	 девка хватать лето они тут пропасть табуном ходить 
39536	 истон эллис это сэлинджер наоборот охотно ржать над любой пропасть 
1	 так сми вещать как пропасть тусовка выхолащивать суть посиделки 
39536	 они стоять над пропасть служкин обнимать сосновый ствол 
1	 деньги падать промышленность как пропасть 
1	 бесплатный бог как пропасть припадать это еще классика 
0	 почему спрашиваться красавица такой пропасть 
39536	 закапчивать чаша небосвод внимательно глянуть хмыкнуть наклоняться жесткий рука машина вырывать мой разноцветный пламенный сердце еще дрожать живой помедлить швырнуть темный пропасть без дно край 
1	 знать как пропасть венецианский карнавал венецианский карнавал 
1	 тьфу пропасть прощать когда пьянеть 
1	 слушаться мол ваш благородие тьфу пропасть георгий вставать 
39536	 наконец птица отчаиваться как омут голова кинуться черный пропасть холод 
38487	 пропасть разделять так большой что 
38487	 целый пропасть разделять японский микадо сметь 
39536	 прыжок пропасть состояться закрытый глаз поэтому 
38487	 пропасть между запад восток между 
38487	 представление пропасть якобы лежать между восток 
1	 решение простой скромный сыграть насмерть кинуться роль как пропасть забывать весь завет поучение 
38487	 она обнаруживать глубокий пропасть между разбудить ожидание реальность 
38487	 снова обретать рабочий форма начинать гораздо пристальный всматриваться реальный жизнь который демонстрировать бездонный пропасть между марксистский ленинский проект общественный 
38487	 разве здесь образовываться бездонный пропасть между слово дело 
38487	 социальный пропасть между горстка богатый основной 
38487	 пропасть между фраза дело великий 
39536	 еще покрывать рубероид пустота между два кирпич чтобы вода затекать туда взрывать зима чертовый мать весь кладка вглядываться темный пропасть простенок сплетать проволока 
1	 десять минута выход эфир пульт вылетать звук исчезать неведомый куда как пропасть сгинуть 
38487	 хотя быть отдельный рыцарский культура поскольку быт верх быть просто близко низ настоящий пропасть между сословие возникать лишь 
1	 тьфу пропасть ведь говорить это 
1	 там родитель лежать отвечать трегубец тьфу пропасть сплевывать что 
38487	 заказывать себя еще один кружка пиво чтобы разверзаться стол пропасть между диетический салат 
38487	 огромный пропасть между старый книжник воспитывать 
38487	 это что создавать непроходимый пропасть между архитектура барокко древнерусский 
38487	 словно для чтобы подтверждать правота разведка углублять пропасть между она контрразведка филбить 
38487	 еще любить поговорить тема глубокий пропасть между москва периферия 
38487	 человек космос расцвет культура искусство война афганистан перестройка развал ссср революция страна восточный европа кровавый всплеск национальный конфликт большой скачок расцвет китай торжество демократия право человек частное капитал рыночный отношение голод болезнь разрастание пропасть между бедный богатый 
38487	 договор москва рождаться горячий спор чем долго они длиться тем заметно быть как широко уже разверзаться пропасть между россиянин казах 
38487	 социальный неравенство пропасть между новый русский народ 
38487	 через отношение стих пропасть между герой обозначать отчетливо нежели 
1	 потом быть момент когда соня переезжать муж наконец достраивать валерик какой-то время еще оставаться они пока оформляться весь справка для ясел оставаться вдвоем опустеть квартира годовалый ребенок похожий соня как два капля вода они оба как пропасть обрушиваться счастие так казаться 
38487	 модный сверхчеловечество ницше уже хватить сила уставать самовыковывание тот пропасть между надсон малларме который 
1	 последний время она нападывать такой курица муж кануть командировка как пропасть 
38487	 однако недолго пропасть между быть громадный когда 
38487	 как парадоксально это звучать чем много углубляться пропасть между родовой княжеский вотчина 
39536	 спрашивать татарский чувствовать что боль только что откинуть край какой-то глубокий темный пропасть 
1	 тут как пропасть утягивать как болото 
38487	 рассматривать однако подробно понятие актант сирконстант попробовать выяснять столь глубокий пропасть между они чтобы проводить 
1	 нора проваливаться вина как пропасть 
38487	 его результат быть непрерывно углубляться пропасть между два поколение русский дворянин 
0	 для открываться такой пропасть информация который мочь 
1	 так лететь сейчас как пропасть 
39536	 твой герой объяснять режиссер теоретик как стоять над пропасть знать срываться 
1	 фома попробовать подтягивать сиплый волчий тенорок сбиваться сбивать маманя тьфу пропасть раздраженно плюнуть она 
0	 летучий мышь они тут пропасть они даже гонять 
0	 фома всякий случай едва удерживаться чтобы тут пропасть 
1	 вскринуть сержнат бросаться куда-то как пропасть 
1	 как пропасть уже ничто ничто помогать 
1	 пусть даже парашют впервые как пропасть опрометью закрывать глаз затаивать 
1	 верзила впрочем стоить докука выпрямляться оказываться один рост разве что коренастый чуть кряжистый тьфу пропасть сказать досада 
38487	 елена павлова вместе этот пропасть одолевать 
38487	 душа вздыматься волна реветь черный ураганный ветер там где рано быть место эль фантик образовываться нестерпимый как бездонный пропасть пустота 
39536	 всегда стремиться край пропасть разве 
1	 восьмой сутки работа пропасть штурмовой группа состав 
39536	 правый борт что над пропасть вырастать 
38487	 расти пропасть между технология цель расти 
1	 болото вести они как думать рано пропасть 
0	 послушать зачем такой пропасть собака удивляться отец 
38487	 весь это вспомнить ганка смотреть отто грубер целый пропасть быть между тот молчаливый замкнутый 
39536	 ступать нога как будто твердый нога уходить становиться страшно совсем пропасть уходить нога 
39536	 человек бывать нужно необходимо уходить тоска одиночество край мрачный пропасть глубокий разочарование человек 
0	 вон бежать удаляться разверстый пропасть они они она 
39536	 если видеть что мчаться пропасть понимать это 
39536	 дом чрезвычайно безобразный свой конструктивный простота стоять край галдеть пропасть именовать улица 
39536	 выбираться крыша самый большой пятнадцатиэтажный дом наш квартал подходить край перелезать бортик стоять сантиметр пропасть 
38487	 возомнить себя красный комиссар ургант доказывать что между остроумие иногда бывать целый пропасть 
39536	 затем сваливаться пропасть неглубоко сломать рука покорежить 
1	 вязкий смрадный бездонный как болото пропасть позор позор глупый поражение 
38487	 непонимание углублять пропасть между россия запад 
1	 вчера это казаться надежный защита ведь все знать что она пропасть 
39536	 отец медленно неуклонно сползать черный пропасть безумие 
39536	 бывать что долгожданный площадка оказываться узкий гребень обрываться пропасть другой сторона 
39536	 нельзя бесконечно висеть над пропасть нельзя ждать 
38487	 один ведущий исследователь русский крестьянство шанин утверждать крестьянский самосознание покоиться убеждение глубокий пропасть между крестьянский разнообразный 
38487	 такой установка порождать глубокий пропасть между физический экономический география 
38487	 александр горшунов вот только тот учебник доказывать что между мочь сделать огромный пропасть 
