38487	 однако большой интерес быть мочь представлять второй часть посвящать преодоление тот пропасть между субъективный объективный который 
38487	 заказ прежде все английский позволять отечественный анимация пропасть окончательно 
39536	 хитрость трофейный игрушка быть что когда она подъезжать край стол передок свешиваться центр тяжесть перемещаться поперечный колесико касаться поверхность отворачивать машинка край пропасть она никогда падать 
39536	 уже знакомый слушатель произведение включая край пропасть тон знаменитый 
38487	 тогда казаться что первый второй отделять глубокий пропасть 
38487	 этот сезон географический пропасть еще более разверзаться 
39536	 понимать что вот это край свет ночь стоять один нога над пропасть быть нестрашно надежно 
39536	 далеко между бог человек возникать вырастать вдруг мгновенно открываться пропасть потому что тот момент 
39536	 зато теперь быть уверенный что мой команда давать пропасть луна мой воскрешение 
38487	 через бездонный пропасть поколение век надо весь создавать 
38487	 христианский календарь находить для это должный образ светлый нить луч жизнь протягиваться над пропасть великий пост 
39536	 иногда срываться падать бездонный черный пропасть лететь тот пора 
38487	 журналист мочь написать все что угодный между тот время нынешний целый пропасть 
38487	 пропасть между первый химический реакция способствовать 
39536	 стараться стереть память образ разверзаться под нога пропасть переводить взгляд крыша 
38487	 украинский президент весь видимость приходиться принимать неизбежный пропасть кризис вверять экономика должный 
38487	 причина только несправедливость вступительный экзамен пропасть между уровень знание обыкновенно получать 
39536	 при встреча тревожно сообщать что положение ухудшаться каждый день идти пропасть революция 
39536	 вдруг показываться что шагнуть пропасть 
39536	 епископ фьезолесский старый сказать фракасторо чувствовать как открываться под нога пропасть 
38487	 этот символ вера подтверждаться простенький ужасающий народный пословица коготок увязать весь птичка пропасть 
38487	 правда глубокий пропасть здесь нет какой сказать 
38487	 стратегический физик сахаров свой письмо год его американский коллега статья год как раз писать неумолимый логика который превращать иллюзия стратегический безопасность реальный шаг этот пропасть 
38487	 чей хороший рабочий год двадцать пять сорок уходить вода песок погрязать болото ухнуть бездонный пропасть 
39536	 вот находиться что зацепляться чтоб ухнуть пропасть 
38487	 только постепенно год год сознаваться отчего пропасть между пушкинист театр затягиваться 
39536	 понимать что весь происходить закономерный идти правило жизнь потому что документ мой должный быть пропасть 
39536	 какой-то головокружительный секунда она вдруг распахнуть глаз увидеть они прямо перед себя кажется даже понимать что-то что нужно понимать чтобы жить далеко тут забывать проваливаться самый глубокий пропасть который конечно 
39536	 короче страна просто тоялый пропасть она висеть над она 
38487	 позволять остынуть пропасть огонь его любовь осенний 
38487	 физический страх детство обычно испытывать два случай перед темнота перед пропасть 
1	 пол подо разверзаться лететь пропасть 
39536	 весь этот сто метр зиять исполинский пропасть без дно 
38487	 попов седой уже тощий пучеглазый икать крыть далеко нынешний олигархия пропасть 
39536	 представлять себя человек самый завязнуть себя глаз радостный песня идти прямо пропасть таков 
38487	 человек этот взглядывать перепугать солдат усмехаться прежде чем тот суметь что-нибудь соображать подбегать крикнуть помощь даже попросту испугаться наклоняться посмотреть вниз толкнуть окно тело который держать сам профессиональный ловкость хорошо натренировать пловец ухнуть как глубокий вода пятиэтажный пропасть 
39536	 ощущение быть такой словно прямо под нога возникать пропасть который они пугать столько год 
39536	 человек много человек этот самолет человек что-то происходить она происходить хотя это пытаться передавать она какой-то собственный чувство саша резко обертываться смотреть уже этот белый точка глаз она все еще какой-то ожесточенный умолять дрожать слеза тот который мочь сдерживать мочь быть вполне довольный это действие его образ создавать один белый точка мучительный пропасть фон образ что быть мгновение 
39536	 появление лифт родиться транспортный средство который можно быть считать секунда взлетать вверх под крыша дом или безбоязненный нырнуть пропасть шахта чтобы как 
39536	 один деревня гореть потому что они клушин последний момент уходить высота этот сам бояться жечь потому что снаряд быть мина пропасть 
39536	 палец нога быть стереть ступня водяной мозоль идти край овечий пастбище глядеть весь глаз синий пропасть между горный щель 
39536	 понимать что верблюд выбирать самый легкий для путь почему-то весь время жаться пропасть 
38487	 без опаска вспоминать митин слово генетический раскол похожий пропасть народ убитый убийца 
38487	 либо преодолевать это восстанавливать нравственный основа либо перед возникать пропасть одичание 
39536	 раз два приводить они самый край последний пропасть весь этот избранный натура 
38487	 жилье нет пища минимум год еще очень голодный год забота пропасть 
39536	 без подготовка только пропасть прыгать хорошо 
38487	 над пропасть год хотя даже 
39536	 переживать рядом ключик хороший часть наш жизнь иметь возможность только наблюдать участвовать постоянный изменение его гений весь время толкать пропасть 
39536	 конец конец замечать что свет уже оставаться слово который можно быть верить что тогда заполнять пропасть между человеческий существо 
39536	 что нести пропасть или взлет 
39536	 вот если подниматься метель задувать резкий северный ветер или сразу после оттепель быть быстро холодать клев наверняка ослабнуть мочь совсем пропасть 
39536	 этот твой глеб опасный человек видеть тянуться сам подталкивать очень умело край пропасть там твой погибель 
38487	 вскакивать сабинин биненбойм место крикнуть президиум что видеть какой пропасть между зал 
38487	 любить африка искренне считать что последний полвека она год год скатываться пропасть что расизм наоборот погубить 
38487	 нынешний декларировать правительство стабильность это что иной как стабильный движение состав под название российский федерация вагон субъект федерация пропасть что кстати писать 
39536	 так например ася техника который опасный для здоровье или сопрягать определенный риск относиться упражнение край пропасть настоящий статья некоторые 
38487	 ибо разумеется сразу осознавать колоссальный возрастной пропасть между целый три год 
39536	 грузовик переламывать его нижний часть дерево пронзать кузов машина повисать свой передняя часть над пропасть замирать 
