21481	 близкий сипягин крестьянин его крепостной дворня встопорщиваться как пред медведь лайка бесноваться они наскакивать 
21481	 быть лайка нетти умненький собачка 
21481	 мочь рассказывать злой нартовый собака лайка австралийский собака 
30243	 генерал сипягин сидеть белый конь помахивать рука белый лайка 
21481	 через десять минута задмясь бакенбарда выходить передняя черный цилиндр затягивать черный сюртук задымить манилла зуб натягивать черный лайка палец становиться чернолапый 
21481	 палуба громоздиться зырянин востроносый лайка урал охота 
21481	 завидеть утка пробрести талый снег охотничий лайка взвизгивать осторожно обнюхивать подтаивать берег 
30243	 галопадать всадник эскадронный ряд кирасир кавалергард белокурый огромный покрывать броня белый лайка гладкий обтянутый панталоны золотой 
21481	 медвежий охота выходить два три охотник собака медвежатник помесь лайка дворняжка бить зверь 
21481	 выдра выслеживать лайка глубокий снег лыжа 
21481	 арендатор гордеев выписывать сибирь партия лайка олень организовывать они 
30243	 невозможно описывать тот горесть который испытывать узнавать смерть доблестный защитник наш родина герой полкан лайка 
21481	 пионерка космос становиться симпатичный собачка лайка спустя неделя отдавать жизнь 
21481	 помимо жучок козявка быть птичка быть носатый мой любимый бездомный котенок который наш двор убивать забегать соседский лайка быть соседский кошка муся пострадать 
21481	 федеральный служба государственный статистика работа совещание участвовать заместитель руководитель лайка заместитель начальник управление финансовый 
21481	 верочка ирис обсуждать ожидаться под гора домик садовник событие должный быть ощениться всеобщий любимица лайка тагажма таг решать быть 
21481	 унт борода ружье верный лайка хвост кольцо символизировать для 
21481	 сразу становиться похожий лайка простоватый обманчивый внешность дружелюбный хвост 
21481	 конечно неизменный симпатия вызывать собака огромный ездовой эскимосский лайка маламут 
21481	 она рыдать над они зачем зарезать собачка лайка 
21481	 обычный дельфин лайка местный название отличаться помимо сухопутный 
21481	 филя похлопать задница запнуть под банка где его приниматься сосредоточенно молча обнюхивать эскимосский лайка взять берег для 
21481	 вопреки лесной правило оставлять лайка улица пускать дом 
21481	 михаил есеновский лайка давно этот история приключаться 
21481	 уже приобретать охотничий собака породистый западносибирский лайка крепкий клык усердно 
21481	 двенадцатый декабрь ровно половина четвертый вдоль эстакада проходить удивленный бригадир притыкин иван михайлович толстый овчинный полушубок самокатаный валенок пышный шарф козий шерсть шапка молодой лайка 
21481	 представитель высокий руководство сулейман лайка поддерживать идея комкор предлагать 
21481	 состав правительство входить ватанджар рафия кадыр сулейман лайка 
21481	 сегодня приезжать ответственный зона восток ндпа сулейман лайка 
21481	 сулейман лайка президент дра представитель 
21481	 председатель спускать сероглазый точно лайка лось 
21481	 где мой забота котик лайка застегнуть темный рысь серый 
21481	 тот мгновение будто ничто быть более прекрасный вечный истинный чем глухой ночь искра дым лететь созвездие крик гусь пустынность небо лайка смотреть умный глаз бормотание 
21481	 немного погодя матвей лукич подходить костер держать задний нога убивать белок давать понюхать один лайка слизнуть кровь 
21481	 матвей лукич подходить собака полагать перед вскакивать старый лайка это розоватый беспомощный тельце только 
21481	 этот раз давать понюхать молодой лайка старый нехотя подниматься зевнуть 
21481	 это быть настоящий лесной человек жить свой кот хомка черный как воронье крыло лайка соболька 
21481	 порода северный лайка белый серый точно 
21481	 малый золотой медаль присуждать западносибирский лайка байкал максименко пойнтер дар печникова 
21481	 чемпион год порода являться английский сеттер джипси белушкин пойнтер дивар герасимов русский европейский лайка амур волнушкин 
21481	 непосредственно росохотрыболовсоюз тот период проводить всероссийский состязание лайка гончий легавый который 
21481	 так например всероссийский состязание лайка привлекаться общество участвовать 
21481	 недавно изучать каталог летний наряд что позволять выбирать вид знаток разный миленький вещь спортивный обувь тапочек туфелька мятый лайка для мятый девочка прочее 
21481	 осень услышать знакомый условный звонок открывать дверь впускать густой рыжий борода хозяин чемодан заплечный мешок крупный лайка волчий окрас 
21481	 хороший щенок северный лайка рано все говорить трудно доставать 
21481	 давидыч привозить себя опять тот чок ходить либо вчетвером чок либо местный лайка 
21481	 невольно горечь еще раз вспомнить наш собака якутский лайка чонка который только вчера пропадать 
21481	 разделять сытный трапеза лайка ночь убегать обратно панолик 
21481	 лайка бежать впереди наш собака 
21481	 лайка два наш собака побежать 
21481	 вид это быть пес довольно неопределенный порода помесь лайка сеттер 
21481	 хорошо помнить собака который приходиться охотиться особенно нравиться охотничий русский лайка весь собака это пожалуй 
30243	 увидеть больше кануть без адрес тьма растворяться уходить безызвестие становиться безымянка видно взяться один рука баку другой развеиваться воздух галопада помчаться туда невыдирный щель вероятно оставлять близ гардероб упавший наряд свой мандра два рука белый лайка манжетка из-под визитка 
21481	 подходить рыжий лайка нюхнуть калач 
21481	 белок бить начинать октябрь когда она успевать сменить свой красноватый летний мех серый зимний охота она продолжаться глубокий снег производиться при непременный участие местный охотничий собака карельский лайка который выслеживать зверек держать 
21481	 один главный условие успех это приучать медвежий охота собака лайка который вертеться кругом зверь хватать 
21481	 это быть типичный промысловый лайка небольшой крепкий стоять 
21481	 произносить дама приближаться протягивать товарищеский бесцеремонность рука черный лайка 
21481	 когда лайка только что просыпаться подниматься 
21481	 удивительно похожий лайка внешне как бывать похожий новый 
21481	 завершать этап пробный сельхозперепись кодирование переписной лист область побывать заместитель руководитель федеральный служба государственный статистика лайка 
21481	 мастерская поставлять его картина мольберт лицо стена охотник рыжий лайка теперь маячить 
21481	 валера приседать холка подымать звереныш смешной лайка лиска вчера отец дядька 
21481	 хорек доставать нож лайка униматься отскакивать лес 
21481	 чудиться отовсюду подстерегать глаз только сонный разлениваться лайка вселять зыбкий уверенность примерещиться 
21481	 держать там гарнизон столько сколько можно это подчеркивать генерал шкидченко ответственный зона сулейман лайка сказать что ничто 
21481	 понимать человек посылать космос пассажир как собачка лайка 
21481	 как только приближаться калитка земля лениво подниматься два здоровенный лайка верный угадывать позевывать 
21481	 тот время резко возрастать поголовье лайка гончий они широко распространять 
21481	 навстречу вертолет приветливо махать хвост бежать два лайка 
21481	 мурзилка это всего-навсего молодой пес вроде крупный лайка помесь несколько порода 
21481	 поэтому ходить все-таки под чок давидыч какой-нибудь местный лайка весь они быть чистопородный 
21481	 быть собака рыжий лайка еврейский имя роза который 
21481	 сворка впереди бежать беленький остроносенький лайка незаменимый пес для сибирский охотник 
21481	 существующий питомник промысловый лайка полуй третий пятилетка 
21481	 первый встреча гольдский лайка наш собака носить враждебный 
21481	 сын поцеловать рука холодный отшлифовывать точно лайка пропитывать духи взглядывать лицо 
21481	 все дело быть джек молодой лайка станочник ковалев 
21481	 голова рука что-то вылепливать обтягивать черный лайка 
21481	 знавать северный ездовой лайка собака который дальний 
21481	 пассажирка милый приветливость протягивать свой маленький ручка черный лайка крепко по-английски пожимать все 
21481	 этот раз сам себя один тряпка лайка мудрено обходиться 
21481	 мочь утверждать что это наш заслуга подозревать что наш общий лайка соцсеть перепоста 
21481	 балет сияние люстра бархат ложа лайка тонкий рука что это 
21481	 мимо бежать два крохотный пудель черный белый следом поводок идти юноша девушка одевать одинаковый куртка серый лайка джинсы заграничный кроссовок 
21481	 инопланетянин лайкин ракета магнит притягивать откупоривать лайка себя комод затащить 
21481	 она быть собака лайка который как раз недавно объедаться 
21481	 конечно отдавать насовсем они собираться это быть большой грех лесник еще жить лайка сказать что один собака 
21481	 увидеть сырой вымерзать зима откос яркий синева бревно вкопать земля глубина двор дом собака крыльцо злобный ездовой лайка захолонуть страх сердце 
21481	 сначала кроме рая никто ничто понимать потом андрюшка качаться вставать из-за стол прошагать немножко двор мешок повалиться земля приниматься так хохотать что оба лайка верный угадывать торопливо подходить 
21481	 женька уже быть свой собака зырянский лайка звать пон что здешний 
21481	 любить завывание ездовой лайка который еще нужный для спасательный 
21481	 вот хоть взять собака лайка этот самый нешто она 
21481	 знать где проходить путь ассоциация почудиться что это голос наш лайка 
21481	 растопыривать ухо она хватить большой лайка рост она быть мало 
21481	 вроде ничего отбивать маленько кто курить этот лайка хоть убивать помнить 
21481	 заползать будка лайка там жаться она 
21481	 она есть без жадность точно выказывать при это ленивый осторожный брезгливость молодой лайка покоситься равномерный звук хруст 
21481	 для лайка нужный другой флюс например хлористый 
21481	 змея выползать наташа лайка она схватываться 
21481	 обедать день игорь жить собака зырянский лайка 
21481	 небось теперь этот самый лайка кухня подходить 
21481	 большой часть так думать насовать тряпка лайка обтягивать платье прикрывать 
21481	 быть инициатор просматривать весь предыдущий заявка ставить лайка нужный место прежде чем 
21481	 вроде играть лайка растравливать она чувствительно шлепать 
21481	 насколько знать лайка она отвечать тот 
21481	 может она это сделать пользоваться отсутствие лайка мочь она ненавидеть 
21481	 вот ночлег лайка будка спать что 
21481	 наташа дочь поэт сочинять такой стихотворение лайка 
21481	 мужик прежде задолго жатва ильин день ставить сено место мочь сосед быть луг лайка сибирский разумный собака никогда 
21481	 собака увековечивать памятник колтуш лайка белка стрелка тысяча 
