30243	 валентин владимирович быть кожевенный часть всякий раз норовить растолковывать разница между шевро лайка самый тонкий деталь поэтому 
30243	 модный такой аристократический перчатка кожа замша кружева хороший сорт тонкий лайка который можно быть натягивать 
30243	 сырье это кожа шевро хром лайка юфть опоек шагрень 
21481	 сибирский лайка один наиболее близкий 
21481	 очень большой собака лайка очень долго быть 
21481	 главный улица горсовет над который полоскаться красный флаг пылить под наш колесо свора сибирский лайка бродить город шофер 
21481	 понос рвота едва превращаться пар как там быть дотаскиваться свой менее повертывать командир залезать под насквозь пробивать холод машина где уже быть вырыть окопчик поставлять печка свернуться резиновый коврик который покрывать снаряд живой равнодушный простуда словно сибирский лайка 
21481	 важный веха развитие космический биология становиться полет год искусственный спутник земля собака лайка борт 
21481	 поздно олег георгиевич газенко писать медицина включаться космический исследование весьма оперативно завершаться еще месяц день запуск первый искусственный спутник земля октябрь год уже ноябрь тот год быть осуществлять первый орбитальный биологический эксперимент собака лайка борт второй искусственный спутник 
21481	 через месяц полететь спутник собака лайка который становиться первый живой существо 
21481	 совсем другой дело сибирский лайка который ходить хозяин 
21481	 исправлять свой оплошность лайка снова рвануть след 
21481	 маманя грузить вроде как приходить мент собака свой собака редкий смесь волк сибирский лайка тот подраться сын искусывать 
21481	 здесь мой собака лайка еда так по-разному 
21481	 выходить орбита когда там побывать уже второй советский исз первый мир биологический спутник собака лайка весить более полтонны 
21481	 занятие скучать глядеть окно который отцовский верховой конь мальчик гоняться село лайка кличка белка 
21481	 вдруг набегать собака лайка целый стая 
21481	 американский коккер спаниель сеттер боксер бультерьер ротвейлер московский сторожевой американский стаффорд французский бульдог карликовый пинчер болонка пудель шпиц колли цвергшнауцер миттельшнауцер ризеншнауцер доберман бордоский дог немецкий овчарка среднеазиатский овчарка западный сибирский лайка фландрский бувья метис скотчтерьер фокстерьер 
21481	 западный сибирский лайка шанель лад киселев 
21481	 хороший собака группа западный сибирский лайка зайка серов 
21481	 продажа животное без родословный такса кобель год щенок лайка американский коккер кобель 
21481	 щенок немецкий бельгийский голландский французский овчарка карликовый пинчер лайка также большой выбор крупный 
21481	 среднеазиатский овчарка кобель мес щенок бельгийский овчарка лайка тело 
21481	 щенок метис лайка дворняжка мес 
21481	 собака помесь дворняжка лайка кобель мес 
21481	 американский коккер спаниель сеттер боксер бультерьер ротвейлер московский сторожевой американский стаффорд французский бульдог карликовый пинчер болонка пудель шпиц колли цвергшнауцер миттельшнауцер ризеншнауцер доберман бордоский дог немецкий овчарка среднеазиатский овчарка западный сибирский лайка фландрский бувья метис скотчтерьер фокстерьер 
21481	 основной сибирский лайка они очень выносливый 
21481	 вот услышать космос голос первый четвероногий космонавт собака лайка 
21481	 тут еще практически следом запускать второй живой собака лайка внутри 
21481	 хотя кино приходиться падать крыша лошадь валяться снег ездить упряжка чукотский собака лайка перевертываться море вместе 
30243	 во-первых конечно перчатка белоснежный тонкий лайка часто затейливый отделывать тиснение сборочка 
30243	 обычно каждый бал покупаться новый перчатка редкий пара выдерживать более один два чистка лайка становиться жесткий сседаться поэтому 
21481	 умный сибирский лайка уже начинать привыкать такой 
21481	 чтобы действовать наверняка начинать что поехать урал покупать чистокровный сибирский лайка 
21481	 видно писание стих после приобретение сибирский лайка окончательно добивать его жена 
21481	 знать что чувствовать сибирский лайка который если верить газета поедать 
30243	 сшивать какой-то тонкий кожа наподобие лайка 
30243	 что только быть здесь спутывать разноцветный мотка мулине пакетик швейный иголка веер слоновый кость наперсток грибок для штопка китовый корсет драный перчатка лайка серебряный пудреница алмазный монограмма 
21481	 все быть обычно как все самый банальный сумасшествие так называть семейный жизнь уже созревать душа мой решимость понимать наконец как должный поступать купить себя щенок сибирский лайка 
30243	 перчатка носить вязаный фильдекос более теплый время лайка замша 
30243	 жена перчатка лайковый зеленый сумка лайка сапог хром каблук 
21481	 баба приходить нос поводить нос она что сибирский лайка бельчатница верхом брать 
21481	 большой черный пес сибирский лайка рваться цепь жаждать познакомиться 
21481	 потом оказываться что иногда она улица выходить босиком например чтобы давать корм кузя тот самый сибирский лайка что сидеть цепь 
21481	 такса удивлять борька лайка расстраивать защемлять сердце 
21481	 защемлять сердце когда увидеть белый пушистый веселый собака острый ухо кренделек хвост спина очень напоминать лайка пропадать тяп 
21481	 медведь убивать охотник московский общество стрельников помощь лайка звонкий дружный под новгород 
21481	 пустой клетка быть надпись здесь жить лайка 
21481	 зверовой сибирский лайка любить сидеть дома 
30243	 полдень обычно шаутбенахт менять перчатка правый рука тонкий лайка выдерживать шаутбенахт бить человек 
21481	 антон павлович очень любить зима снег скучать они как сибирский лайка 
30243	 труп жить смерть этот смерть просачиваться сквозь лайка перчатка 
30243	 можно сам приготавливать себя чехол такой случай хорошо все сделать легкий шелковый материя или лайка длинный дамский перчатка 
21481	 корм для они быть служить белок который быть стрелять дорога сибирский лайка неприхотливый довольствоваться немногие 
30243	 стягивать мертвый рука желтоватый какой-то пыльца перчатка медленно торопиться напяливать каменный палец белый лайка 
30243	 весь этот ворох военщина даже какой-то полицейский эстетика приставать какой-нибудь сынок корпусный командир соответствующий семейный традиция очень плохо вязаться кухонный чад средне мещанский квартира отцовский кабинет пропахнуть кожа лайка опойка еврейский деловой 
30243	 сей пора казаться запах ярмо труд проникать всюду запах дубленый кожа лапчатый шкурка лайка раскидывать пол живой 
30243	 белый лайка злополучный перчатка теперь ярко выступать 
30243	 сжимать белый перчатка кулак так что лайка один палец лопнуть 
21481	 самый интересный этот выставка являться предстоящий испытание сибирский лайка медведь 
21481	 себя квартира показывать штабс-капитан свой библиотека коллекция старинный фарфор редкий гравюра два породистый сибирский лайка 
21481	 видеть рябчик тетеревиный выводка дичь пугать взять сашка пестрый собачонка лыский типичный сибирский лайка 
30243	 весь продукт получать место окончательный обработка лен вывозиться вид полотно семя образ олеин кожа поступать чемодан лаковый пояс собачий шкура выделываться лайка тимофеев трава вывозиться вид 
30243	 электричество который так переполнять мой сердце который желать передавать доходить ваш сердце через перчатка лайка дурной проводник целовать рука несколько 
30243	 тут начинаться разговор перчатка лайка мастер 
30243	 такой случай нередко подкрашивать она или распятнывать образец тигр барс или какой другой зверь кожа делать лайка 
21481	 институт стратегический анализ например подсчитывать что год лайка дружеский переписка обходиться экономика 
21481	 пес небольшой средний лайка ушко острый хвост загибать 
21481	 помощь статистический модель ученый проанализировать лайка сравнивать результат данные 
21481	 если формулировать точно наверное тогда быть мода придурь сейчас много цениться глупость крайний мера если судить лайка фейсбук 
21481	 привязывать патронташ лайка кличка джон начинать 
21481	 владелец лайка знать почему отпускать 
21481	 нет шарик лайка шарик шарик быть 
21481	 точно свой останки такой охапка мятый лайка уже маяться что 
21481	 бурят уже маска лайка бегать зал подсаживаться 
21481	 впрочем привыкать быстро первый этап изготовление лайка именоваться шакшевание для приготовление шакша 
21481	 весь они быть лишь немного крупный лайка только повадка ледяной 
30243	 отправлять нарочный просить они скоро щекотать кончик палец протягивать дылда почтмейстер великанский ладонь мол голубчик старый дружба постоять вместо чтобы запрятывать собачий упряжка свой откормленный лайка посылать какой-то доходяга 
21481	 слышать опытный заслуживать всяческий доверие путешественник будто себя родина разводить крепконогий лайка чтобы они таскать снег 
21481	 возле дверь увидеть сидеть снег пожилой белый пес помесь лайка дворняжка 
21481	 щенок метис карело-финский лайка овчарка мес 
21481	 через месяц превращаться пушистый обожать рыжий шар имя филимон порода карельский лайка 
21481	 замечать пальто быть явно натуральный лайка быть эрнст быть 
21481	 короче говорить однажды очень сильно попросить колупаев купить лайка 
30243	 колупаев зашвырнуть лайка куда-то далеко вслед кошка 
21481	 если лайка сворачиваться клубок оставаться 
30243	 библия быть древний деревянный переплет обтягивать тонкий лайка 
21481	 комната племянник обнаруживать никакой имущество даже тот обносок что привозить прошлый год тетя тома перво-наперво поводить нос как лайка бельчатница брать тайга поверху 
21481	 тот-то штука что ничто издавать отвечать сандро держать нос ветер как лайка хороший верхний нюх 
30243	 хотя перерабатываться лайка давать товар низкий сорт тонкий 
21481	 быть космос подход бесполезный катать щедро лайка амеба нелетучий монголия 
21481	 эскимосский лайка показывать себя как добрый боевой 
21481	 существовать сегодня полтора десяток аборигенный чисто российский порода собака южнорусский овчарка русский гончая русский спаниель четыре порода лайка особенно цениться западносибирский 
21481	 по-видимому это быть помесь немецкий овчарка лайка 
21481	 лайка рвануть вперед рычать оскаливать клык 
21481	 помесь лайка овчарка величина теленок 
21481	 так укрывать кожаный нос меховой хвост спать длинный зимний ночь лайка они сниться мороженый рыба 
21481	 собственно весь собака лайка основной быть там бродячий 
21481	 это быть очень старый лайка совершенно красный глаз 
21481	 знакомиться поймать мой взгляд сказать начальник полет товарищ лайка первый советский космонавт 
21481	 даже собака повырождаться вместо благородный труженица лайка бродить улица переулок 
21481	 лайка они ответ хвост закивать 
21481	 питать страсть гончий пес благородный сеттер ирландский гордон уважать дратхаар преклоняться перед западносибирский лайка 
21481	 собирать свой пожитки покидать наш край уезжать работать сибирь родина свой лайка 
21481	 наконец снова зажигаться прожектор оркестр заиграть полька лайка клоун провозглашать 
21481	 только после это быть производить запуск искусственный спутник иметь борт собака лайка который последовать ряд блистательный 
21481	 цель этот эксперимент исследовать три год запуск первый спутник второй лайка как зверек переносить космический полет 
30243	 выступать лайка халиль бровченко комдив 
21481	 центральный фигура быть член ревсовет комкор халиль министр президент академия наука дра сулейман лайка 
21481	 пятнадцать возвращаться саныч привозить щенок чукотский лайка выклянчивать местный девочка 
21481	 это объясняться строгий достоинство невеста что новоиспеченный лейтенант еще привыкать свой необминаться офицерский китель предстоять они скорый разлука разный конец земля разлетаться старый товарищ только что передавать радио сообщение полет второй спутник собака лайка борт 
21481	 когда качество пассажир один первый спутник советский ученый отправлять космос лайка заранее знать что она 
30243	 обувь особо оригинальный фасон нередко ботинок белый лайка 
21481	 жаль вот лайка пятнашки быть приболеть 
21481	 осока озеро медведь сохатый край близкий берег мерцать порхать световой отблеск перед стена тьма дышать студеный холодок земля лежать два лайка смотреть умный спокойный желтый глаз 
21481	 вдруг разом вскакивать оба лайка каменно застыть глядеть чаща 
21481	 второй собака по-видимому молодой еще который давать понюхать добыча выгибать остроносый свой морда все-таки слизывать кровь морда старый собака лайка успокаиваться вновь ложиться матвей лукич 
30243	 егарм быть тонконогий вихлястый сука развесистый ухо какой-то странный помесь лайка уродливый дворняга исключительно 
30243	 крыльцо валяться кучка капкан какой-то шкурка распинать стена белеть свой мездра два лохматый лайка восторженно носиться друг дружка 
21481	 тут момент второй промах волчица тот секунда протискиваться дупло выставлять зуб зарычать неистово становиться лаять так как никогда жизнь лаять как гончая след как лайка берлога без передых 
21481	 демонстрироваться собака западносибирский лайка русский русский пегий 
21481	 намечать межобластной состязание лайка легавый межобластной выставка северо-западный 
21481	 порода русский северный лайка что повиноваться действительно 
21481	 особый внимание уделять вопрос развитие северный собаководство разработка стандарт производственный группа лайка 
21481	 рядом ньюфаундленд белолобый лежать лайка молодой овчарка 
21481	 внимательно оглядывать собака спрашивать анискин овчарка лайка грызться 
21481	 когда участковый открывать дверь крыльцо бесшумно выпрыгивать два собака лайка овчарка 
21481	 кривонос лайка медведь пассажир сходить 
21481	 сегодня быть сделать один выстрел московский охотничий общество проводить испытание лайка медведь 
21481	 торжественно вести заранее облюбовывать полянка куда след скоро устремляться лайка 
21481	 улица бродить корова собака лайка который зима запрягать нарты 
21481	 лайка уже давно обрастать зимний непроницаемый 
30243	 тут зверь белый лайка олень песец горностай 
21481	 второй спутник взлетать пассажир собака лайка 
21481	 здесь вольер павильон собаководство напротив босар жить маленький светлый охотничий лайка тузик она привозить далекий 
21481	 вот вдали показываться темный точка дымчато-серый собака лайка везти почтальон ночь 
21481	 якутский лайка ойюран пушистый черный пес 
21481	 чонка большой пес якутский лайка род река чон приток 
21481	 наш охотничий собака лайка приезжать берег 
