36983	 скакать быть нельзя джемс берег свой костюм хотлы быть забрызгать грязь здиль шаг рысь дорожка булонский лса быть мокрый 
36983	 кострюшкин смиренно отходить опять пускаться рысь 
20083	 лихач место взять крупный рысь покрикивать публика запружать мостовая 
36983	 мрачный прохор погонять гнедой жеребец ехать емкий рысь 
36983	 митька повертываться седло посмотреть макар равнодушно как чужой незнакомый человек поехать рысь 
36983	 взять лошадь тронуть рысь речка переезжать хутор вброд 
20083	 ороч добавлять перечисленный животное еще лось медведь рысь волк выдра колонка ежа 
36983	 волков поклониться низко хмуро глядеть засмеяться степенной рысь поехать докладывать царица 
20083	 шестерик застаиваться сивый выходить крупный рысь бревенчатый мостовая 
20083	 отряд прохать легкий рысь разрзать проход улица 
36983	 кавалерийский отряд свертывать проселочный дорога взять рысь 
36983	 недалеко казак сменить рысь шаг 
36983	 лошадь сам переходить рысь хотя безайс продолжать машинальный хлестать 
36983	 приходить счастливый мысль сдерживать карьер ромка стараться чтобы бегать близко около рысь 
20083	 дикий кошка рысь сидеть ветвь над 
20083	 полдень вода исчезать вместе она исчезать медведь рысь дикий кошка лисица 
36983	 все часто часто когда бежать рысь захватывать сердце 
36983	 бао напрягать весь свой сила побежать рысь 
36983	 чубаров беспомощно умолкать скидывать лыжа полезть сани лошадь тотчас тронуться рысь повалиться сено 
36983	 оба прибавлять рысь долго ехать молча 
36983	 нивка хотеть бежать рысь мечик машинальный подгонять она 
36983	 постепенно лошадь переходить рысь становиться различимый отдельный обгорелый 
36983	 через час увидеть так рысь возвращаться эскадрон 
36983	 поехать рысь другой время это доставлять 
20083	 сразу срываться место легкий рысь полететь небольшой кавалькада вскоре 
36983	 некоторый расстояние рысь мчаться тройка белый лошадь 
36983	 идти идти все еще далеко побежать рысь 
20083	 след этот глушь только рысий медведь рысь это как-то вместе выходить 
36983	 они пускать лошадь рысь нога горный дорога обрываться 
20083	 прощать повертывать конь ускакивать рысь вильгельм долго смотреть вслед 
36983	 простой машина потому что вслед зеркальный каретка скакать облегченный рысь конвой восемь конный 
36983	 лошадь побежать рысь сухой чернозем разносить топот копыто 
36983	 верховой догнать кузя бежать рысь сказать егор 
36983	 застаиваться кобыла весело бежать размашистый рысь звонко цокать дождевой лужа 
20083	 жилье медведь дикий кошка коза олень рысь ночь отвратительно кричать по-кошачьи 
20083	 животное долина кусун обитать изюбр дикий коза кабарга куница хорек соболь росомаха красный волк лисица бурый медведь рысь тигр 
20083	 крупный млекопитающее верховье бягама встречаться лось рысь бурый медведь росомаха ниже 
20083	 тут водиться тигр рысь дикий кошка белка бурундук изюбр 
36983	 время время останавливаться прислушиваться когда приближаться уходить сперва прыжок потом шаг рысь 
20083	 животное здесь держаться изюбр дикий козуля кабарга кабан тигр росомаха енотовидный собака соболь рысь 
36983	 конвой полагать ружье сани усаживаться подвода лошадь пойти рысь скоро доезжать этап 
36983	 надо скоро разузнавать рысь туда вступление 
36983	 когда всадник ехать рысь пан очень трудно поспевать 
36983	 рысь частить лошадь перебивать мелькание свой 
20083	 прощать господи виноватый осуждать кровь невинный корнилов крупный рысь ехать выселок колыхаться распущенный 
36983	 царский село пойти рысь нагонять становиться обгонять полка 
36983	 адъютант приподниматься английский рысь поехать трубач 
36983	 надо быть идти рысь шаг саблин 
36983	 угол манеж ротбек бежать рядом солдат ехать рысь вцепляться оба рука 
36983	 усаживаться взять повод пускать сивый рысь никита начинать валиться 
36983	 отвратительный ощущение ровный рысь проходить никита сидеть легко 
20083	 широкий проспект каменноостровский крупный рысь катить коляска проноситься длинный автомобиль 
36983	 офицер сейчас вернуться машина штатский некоторый время перегибаться глядеть вниз затем отгибать воротник рысь догнать товарищ 
36983	 крайний они повертывать лошадь рысь подъезжать тротуар где идти 
36983	 гуськом рысь пойти все много много 
36983	 потом лошадь переходить постепенно опять рысь фыркать поматывать голова 
36983	 шарабанчик почти она ездить рысь она хороший быть 
36983	 ехать хотин опять рысь верста сделать 
36983	 ехать всадник политок рысь служащий отдел народный образование 
36983	 заложиться рубль бежать рысь ежели лошадь карьер 
36983	 молодой сразу подчиняться переходить рысь потом самый бережный 
20083	 опускать голова удерживать застаиваться нетерпеливый жеребец крупный рысь возвращаться двор шутливо здороваться 
36983	 внезапно разъезд переходить шаг рысь скрываться темнота 
20083	 вот она опоэтизировать сивко плестись рысь как-нибудь дровнишки полуразваливаться 
36983	 весело скрипеть полоз сани сбиваться рысь карьер прозябнуть мустанг 
36983	 кто идти крикнуть прибавлять рысь незнакомец молча повертывать конь 
36983	 такт лошадиный рысь мой плясать ритмический 
36983	 такой занятие скоротать время смена уходить весело рысь один потому что 
36983	 посреди улица свой помпон колыхаться рысь ехать император 
36983	 уласенков сперва шаг пойти потом побежать рысь вперед 
20083	 смотреть дыхнуть цветок как быть несть контесса чутье мимоза рысь шалопай 
36983	 непосредственно заведовать бега рысь под седло все много распускаться 
20083	 стражник проделывать перед управляющий губерния ряд кавалерийский упражнение как-то манежный езда весь аллюр рысь карьер атака брать барьер 
36983	 поговаривать сказать пускать лошадь рысь что пруссак показываться миля 
36983	 когда они уже поравняться голова сотня казачий офицер скомандовать ехать рысь весь сотня 
36983	 крауза повертывать лошадь сводить рысь потом шаг становиться 
36983	 большой дорога мужик загреметь телега поехать рысь 
36983	 дождаться когда все садиться лошадь гикнуть помчаться тот дорога что приезжать бросать ехать рысь кто отставать лупка 
36983	 лошадь замориться приходиться где рысь где шаг 
36983	 повод послужить обстоятельство что один заезд рысь под седло судья лишать платный 
36983	 шесть час наполеон убеждаться что сражение кончать садиться конь апатично поехать рысь дворец причем дождь струиться 
36983	 другой ручонка засовывать пазуха лицо синий испуганный тоже рысь поспевать сестра 
36983	 лошадь сейчас дернуть пойти кинуться вожжа находить они приниматься взвизгивать свой голос испуганный лошадь побежать рысь увозить тарантас прямо черта 
36983	 команда проезжать шаг рысь весь карьер развертывать 
36983	 шарахнуться сторона дорога лошадь пробежать рысь хлеб останавливаться 
20083	 тучковый мост услышать себя крупный рысь 
36983	 уже тронуться переходить рысь когда офицер внезапно закричать 
36983	 дорога пойти под гора лошадь побежать рысь подымать колесо пыль 
36983	 рысь подъезжать бородач сдерживать разгорячать 
36983	 только пожалуйста поехать рысь наказывать юрий денисович сын 
36983	 через несколько минута мимо церковь сергий рысь промчаться направление суд 
36983	 время езда рысь громко отчетливо отсчитывать темп 
36983	 хищно склоняться над седло рысь они промчаться мимо десять 
36983	 дворник продолжать кричать сбегать вниз неловкий рысь причем рукав его рубаха трепаться 
36983	 держать взывать старшина рысь нестись улица лошадь вылетать 
36983	 полицмейстер начинать прицеплять шашка путать портупея пристав побежать рысь приказывать подавать дрожки помощник ужасаться 
36983	 кликнуть себя кривой дубовый кастрыга рысь поехать усадьба лукоперова 
36983	 лошадь бежать полный рысь быть недалеко 
36983	 садиться джентльмен теперь поехать рысь ружье можно полагать 
36983	 когда певец смолкать билль пускать лошадь рысь оборачиваться пассажир произносить 
36983	 возвращаться поле мужик трястись рысь облучок пустой телега снимать 
36983	 крикнуть арестант бодриться несмотря жара рысь перебежать свой новый щегольский 
36983	 выдерживать выезжать ряд экипаж поехать рысь левый сторона проспект который 
36983	 бог рысь марш полуэскадрон отделяться вперед 
36983	 кивнуть приветливо голова поехать рысь переулок где прежде стоять 
36983	 лошадь пойти рысь разбирать дорога темнота 
36983	 крикнуть пускать лошадь место полный рысь 
36983	 далеко много рысь все делаться крупный крупный 
36983	 ханефи элдар также садиться лошадь дружелюбный прощаться хозяин офицер поехать рысь свой мюршид 
36983	 бродяга опять останавливаться потому что рыжий мужик лететь наперерез потом усиленный рысь побежать недалекий поскотина 
20083	 встречаться также олень кабарга выдра росомаха рысь редко волк еще редко 
36983	 выезжать город побежать рысь большой дорога 
36983	 ехать рысь нахально кричать беречься переходить дорога 
36983	 весь тройка один один ехать ровный рысь 
36983	 шаг или тихий рысь идти оно беспрестанный останавливаться прислушиваться 
36983	 первый верста восемь проезжать грязный дорога все-таки рысь 
20083	 капитан переваливаться как утка почти рысь являться спальня 
36983	 подымать коляска фордек лошадь побежать рысь 
36983	 ехать рысь быть никакой возможность 
20083	 это рысь отвечать бургомистр она жить 
36983	 вдруг маленький рытвинка дорога шарабан мягкий треск подскакивать отрадный рысь переходить вскачь запрыгать закусывать удила 
20083	 шумский двинуться коридор крикнуть васька копчик рысь прибегать голос барин иван 
36983	 лошадь тронуться место даже изредка переходить рысь 
36983	 должный быть покоряться вдруг побежать очень шибко рысь весь забирать правее правее 
36983	 этот слово заставлять цуберка прибавлять шаг наконец пускаться даже рысь 
36983	 тот минута повертывать назад почти побежать рысь все казаться что 
20083	 гора водиться пропасть рябчик немало глухарь тут жить коза изюбр сохатый медведь рысь росомаха волк множество хищник 
36983	 ровный час оборотень какой проговаривать креститься поехать рысь оглянуться 
36983	 муромов садиться тележка подбирать вожжа поехать рысь 
36983	 погода разгуливаться осенний солнце начинать приятно греть наш сырой двухдневный дождь одежда дорога быстро сохнуть ехать адрианополь веселый рысь новый молодой суруджа который 
36983	 лошадь поминутно прерывать рысь глубокий сугроб 
36983	 ехать святогор рысь прохожий все идти передом 
36983	 тот пускать лошадь полный рысь аггей никитич 
36983	 климовна тот быстрый шаг почти рысь побежать переулок 
36983	 матвей тоже увидеть барабин вполне понимать что заставлять так закричать невольно пускать лошадь рысь быстро умчаться 
36983	 левин поехать рысь домой чтоб успевать пообедать 
36983	 сказать тит почти рысь пойти передом 
20083	 хромота плечо чувствительный лишь рысь изредка 
36983	 сторожкий сильно тряский конь забирать рысь натягивать повод въезжать 
36983	 трогать проезжать самоделковый вожжа свой лошадь губа она весь сила подчмокивать даже рука так суетливо размахивать лошадь никак мочь идти быстро рысь тот человек или ежели угодно 
20083	 часто встречаться барс рысь дикий кошка малый черный медведь 
36983	 попробовать было ехать рысь невыносимый трясти царь 
36983	 выступление пехота садиться лошадь генерал обыкновенно рысь обгонять обоз войско 
36983	 они пускаться вскачь долго скакать мочь опять побежать рысь 
20083	 животный мир библия лев составлять верблюд единорог конь онокентавр оседать лошак слон леопард тигр рысь барс медведь волк гиена лисица 
36983	 фелицата антоновна шаблов жена лакей посылать так мать собачий рысь она побежать 
20083	 вскакивать лошадь крупный рысь поводить караван 
36983	 все изменяться рысь галоп марш-марш все 
36983	 ходить вдали несомненно быть дикий идти вниз ущелие увидать наш верблюд побежать рысь замечать вьюк человек 
20083	 горный хребет окружать долина вышеназванный береговой река сплошь покрывать дремучий преимущественно лиственный лес который держаться множество различный зверь дикий коза аксис или пятнистый олень изюбр медведь кабанов енотовидный собака барсуков менее часто попадаться тигр барс рысь дикий кошка 
36983	 довершение огорчение после выстрел все стадо прибавлять немного рысь продолжать бежать прежний направление 
36983	 шаг или тихий рысь идти оно беспрестанный останавливаться прислушиваться 
20083	 млекопитающее уссурийский край тигр барс рысь дикий кошка медведь бурый 
36983	 тихий сонный рысь пробираться райский рогожный перекладной 
36983	 тронуть однако рысь свой лошадь направление 
36983	 едва они сходить под гора как невольно они аллюр рысь переходить галоп становиться все 
36983	 улан рысь подъезжать пьер француз 
36983	 прибавлять рысь вскоре въезжать двор 
36983	 она бойко ехать рысь бойко пускаться бурливый волна 
36983	 лошадь побежать самый полный рысь имшин поскакать они 
36983	 старик побежать рысь мост вдогонку гловацкий 
36983	 всадник ехать рысь весело посвистывать держать 
36983	 барыня дуняша улыбаться опять зашагать как трава насилу удерживаться чтобы побежать рысь 
36983	 рысь пестрый свой пестрота преобразовывать 
36983	 быть вороненький косматый конек крепкий нога довольно резвый правда приходиться скакать весь лопатка когда электрик идти полный рысь все-таки отставать 
36983	 лаврецкий ехать рысь возле карета сторона лиза 
36983	 терка желать остаток потешать свой начальник нахлестать лошадь который привыкать бегать рысь заскакивать уродливый галоп дрожки забренчать 
36983	 все этот причитывание сопровождаться приличный количество эхо вздох покрякивание пока игнаток усаживаться подбирать вожжа наконец послышаться один невыразимый междометие последующий затем гом лошадь побежать рысь прыть этот однако продолжаться 
36983	 граф приказывать охотник идти место повертывать направо сопровождение стремянный поехать рысь узкий проселочный дорожка 
36983	 первый прыжок русак стремянный пускаться рысь указывать арапник 
36983	 через час время хозяин наш стоять изба пара дюжий конь запрягать крестьянский телега афанасий напутствовать весь возможный совет приказание усаживаться мягкий подстилка резкий рысь отправляться путь 
36983	 поворотить конь нжинский дорога поскакать добрый рысь 
36983	 ваш надежда алексеевна начинать щелкалов большой трусиха она бояться если лошадь побежать рысь мой бьютти смирна как 
36983	 ехать рысь вечер дорога между рожь 
36983	 два другой тройка вслед курьерский который звенеть колокольчик полный рысь бежать впереди без дорога пускаться 
36983	 господин пандалевский проводить домой волынцев пускать лошадь рысь великий удовольствие 
36983	 лошадь ленивый рысь тащиться песок колесо визжать 
36983	 крутой гора никакой кнут заставлять лошадь идти рысь тут они обнаруживать непоколебимый упорство 
36983	 ехать рысь увидать володя приостанавливать лошадь 
