36983	 вдруг сделаться страшно рысь пробежать шаг пять упасть 
36983	 слушать праскухин рысь побежать ложемент стрельба становиться 
36983	 артиллерийский ездовой громкий крик рысь пускать лошадь вода 
36983	 лошадь бежать рысь усадьба оставаться позади снег скрипеть 
36983	 становиться прохладный поехать рысь село яновщина оставаться верста 
20083	 ехать медленный рысь видно быть что 
36983	 между тамарин ехать медленный рысь везти она много новый 
20083	 красивый заводской лошадь тронуться место крупный рысь переезжать яуза становиться 
20083	 сердитый пристяжная варварски сгибаться коренная место пойти крупный рысь 
36983	 город небольшой через четверть час уже нестись весь рысь дорога 
36983	 ехать рысь быть невозможно потому что седло 
36983	 было хотеть еще придавать рысь конек вдруг видеть бежать 
36983	 палади махнуть арнаут когда тот подводить оседлывать лошадь прощаться господарь вскакивать конь пускаться рысь дорога вести селение 
36983	 только разве крутой гора мул идти шаг кроме это или сильный рысь или вскачь тогда кучер 
36983	 господь сказать антон пускать рысь пегашка 
36983	 даже курица стремиться ускоренный рысь подворотня один бойкий петух 
36983	 провожать только конец улица извозчик поехать рысь старик бежать 
36983	 прибавлять вслух видеть что левшин продолжать ехать рысь 
36983	 несмотря свой усталость лошадь принимать дружно побежать шибкий рысь 
36983	 скакать останавливаться ехать рысь шаг шаг шаг 
36983	 соус патиш курица рысь взглядывать истинный ужас 
36983	 добро рысь ездить русский рысь батюшка 
36983	 итак вот причина который должный писать скоро вдруг свой письмо покамест простыть рысь 
36983	 следовать четыре всадник вроде драгун ехать рысь дромадер они толпа 
36983	 через несколько минута отряд конник пускаться крупный рысь запад 
36983	 насвистывать какой-то тихий песенка всадник неспешный рысь пробираться пустынный улица нижний 
36983	 публика сразу подымать отчаянный крик шарахнуться кондитерский назад сминать более ненужный павел иосифович из-за рыбный гуськом свой оттачивать нож рысь побежать дверь черный ход 
36983	 тот самый время григорий иванович муромский соблазниться хороший погода велеть оседлывать куцый свой кобыла рысь поехать около свой англизировать владение 
36983	 министр соглашаться большой рысь поехать они назад 
36983	 тут разрабатывать специальный рабочий троеборье шаг груз шаг снежный целина груз рысь груз 
20083	 лореас напрягаться подаваться вперед как рысь перед рывок 
36983	 толстяк рысь кинуться пиджак обвисать 
20083	 рысь спать последний солнцепек по-кошачьи 
36983	 пропеть рожок рысь подкатить карета скорый помощь 
20083	 как зоологический музей стеклянный глаз рысь 
36983	 читать лермонтов они конь рысь сбиваться упрямо убавлять ход 
36983	 варвара тяжелый рысь метнуться кухня отыскивать 
36983	 миг показываться что рысь живой 
36983	 мой взгляд упасть рысь оцелот 
36983	 самый трудный между прочее рысь шаг 
36983	 шеф пригревать рысь быть возбуждать крайность 
20083	 олег упор смотреть рысь бес они знать 
20083	 степка рысь забулдыга непревзойденный столяр хотеть 
20083	 также видеть отец фотий птица черный яко орел другой зверь аки лев третье животное яко рысь бежать орел 
20083	 насчет животный яко рысь толкование сказать ничто 
36983	 быть никакой гималайский рысь стандартный тот пора 
36983	 протирать веко девушка зашептать видеть рысь большой как 
36983	 загибать левый фланг шашка наголо атака рысь марш 
36983	 асфальт легко все забираться телега повозочный взмахивать вожжа бегом рысь где галоп 
36983	 прямо наш костерок ретивый рысь нестись семеро кришнаит 
36983	 переключаться драматический полушепот хватать полный ведро подсолнечный масло тащить сюда рысь барон 
20083	 сей раз рысь поводить морда вслед 
36983	 когда понимать что опаздывать сперва переходить рысь потом шаг потом 
36983	 старший воспитатель наш капитан пидгорный впрямь учебный рысь трястись привычный седло 
36983	 однако нахрапом без наглость учебный рысь так сказать 
36983	 пойти тот рысь галоп свой приберегать 
36983	 виктор рысь все еще смотреть она вслед 
36983	 перелесок кончаться выбегать круто подниматься берег два тонкий едва оперяться деревце виктор пускать мальчик рысь проходить мало три 
36983	 подъезжать мост через бейсужок виктор услышать пронзительный вскрик давать мальчик шенкель выезжать рысь проулок большой дорога 
36983	 мальчик идти быстрый рысь мокрый тускло мерцать мостовый 
36983	 ленка глухов взвывать весь как команда посмотреть дулегов рысь кинуться турин 
36983	 кольча младший отламывать ветка елка хлестать зад лысуха гнедко лошадь брать рысь алешка закидывать 
36983	 великий наш удовольствие лошадь рысь вбегать двор 
36983	 бесшумный как ночь объявляться из-за спина красотка рысь становиться тереться нога 
36983	 такой пьяный рысь мнение специалист изучать скелет 
36983	 чучело рысь стоять зал где 
36983	 струк вежливо откозырять полк рысь префект молча подождать пока весь 
36983	 остальной отпрядывать тут оглянуться они неспешный рысь подъезжать коренастый немолодой казак 
20083	 лошадь крупный рысь понести вверх сретенка 
36983	 тяжелый рысь пробежать кабинет останавливаться 
36983	 кабинет пол ничто лишний быть никакой деталь чурбак железный лист инженер забегать кабинет освобождать веселый рысь 
36983	 домой такой рысь скакать один потерять 
36983	 они двинуться неторопливый рысь почему тут крутиться домой 
36983	 где мой забота котик лайка застегнуть темный рысь серый боты махать муфта 
36983	 ласково похлопать свой верный любимец круп легко вскакивать седло ровный неторопливый рысь направляться сторона замок виконтесса 
20083	 женщина покорно отступаться отпускать грядка место взять рысь 
20083	 весь подбираться как рысь перед прыжок 
36983	 котовский только подносить рука малиновый фуражка полуобертываться седло скомандовать рысь марш 
20083	 редко встречаться рысь рысь там полно 
36983	 лошадь бежать тихий рысь останавливаться все быть изумлять извозчик 
36983	 кучер фрол сергеев уметь место переводить орловский рысь 
36983	 опять воспоминание раз парнишка еще ехать конь хороший рысь 
36983	 седло сидеть прямо как влитой непроницаемый лицо под слегка сдвинутый лоб шапка строго переходить рысь шаг останавливать крепконогий длинношерстный 
36983	 конь переходить рысь еще как ударять 
36983	 потом анискин секунда постоять неподвижность вдруг рысь побежать тот сторона клуб 
36983	 мочь быть белый конь шашка наголо рысь танк марш-марш 
36983	 рослый гнедой мерин бежать ровный неторопкий рысь 
36983	 мещеряков идти все рысь почти намет сбоку 
36983	 женя рысь пробежать мимо куча 
36983	 миновать полынь примолкать там где рысь метнуться после выстрел вот 
36983	 наконец появляться бабур выныривать из-за орудие рысь подбегать пантелеев суетливо становиться 
20083	 вальган смотреть бахирев светлый желтый глаз рысь медленно тереть подбородок 
20083	 глаз вальган заметаться под ресница желтый быстрый глаз рысь вспомнить бахирев вставать 
36983	 чертыхаться жалобно стонай отпрукивать почуять ночлег жеребец старик становиться линейка весь рост широко расставлять нога туго натягивать вожжа молодецкий гикнуть жеребец место пойти машистый рысь под изволок они все больше 
36983	 второй пролетка поехать шаг первый тронуть рысь скрываться темнота 
20083	 однако паренек как только отъезжать шаг тридцать раскручивать над голова вожжа пока быть видно быть видно километр два гнать лошадь вскачь рысь 
36983	 нина рысь замечать она хозяйка ходить 
36983	 пойти рысь сердце отлегать когда 
36983	 заря уже заниматься когда мокрый лошадь тяжело раздувать бок рысь примчать кэб порт 
20083	 так как дорожка идти вниз пологий склон сразу взять рысь заржать жеребенок 
36983	 валет поспешать его крупный шаг перебивать рысь снизу вверх засматривать иван алексеевич 
36983	 пантелей прокофиевич погнать кобыла рысь видеть как провожать 
36983	 аксинья морщаться выжимать юбка подхватывать плечо мешок улов почти рысь пойти коса 
36983	 пантелей прокофиевич доезжать сажень сто придерживать лошадь затрусить рысь 
36983	 подниматься изволок пан пускать крепыш машистый рысь 
36983	 григорий выскакать вперед первый шеренга становиться вполоборота вынимать шашка тихий рысь марш 
36983	 подбег выдергивать ярмо железный заноза опять рысь 
36983	 всегда медлительный прохор этот раз пускаться квартира рысь 
36983	 закутывать лицо шелковый шаль ехать молча рысь вскачь весь его 
36983	 после короткий остановка быстрый дробный рысь 
36983	 возвращаться назад видеть идти прогулка боря короткий пальто воротник гималайский рысь 
36983	 неторопливо почти задумчиво взять полосатый матрасный материя сшивать мешок вдруг мелкий рысь побежать ворота пренебрежительный поглядывать 
36983	 кованый колесо проваливаться яма даже жеребец рысь сбиваться хозяин хвататься 
36983	 дробный рысь мчаться два донце 
36983	 ритмично скрипеть седло рысь конь успокаивающе равномерный 
36983	 конь чувствовать отпускать повод сразу забирать рысь 
36983	 рысь промчаться они мимо густой заросли 
36983	 меж иннокентий филатыч поспешный рысь главный кондуктор седой 
36983	 александров поспешный рысь побежать навстречу останавливаться 
36983	 чуять скорый остановка лошадь подбадриваться передовой трогать рысь хотя это безопасно 
36983	 обязывать действовать расстояние подпускать дистанция рысь мара 
20083	 его лошадка снег почевать плестись рысь как-нибудь товарищ мамашев спать рядом 
36983	 драйер мелкий рысь кинуться лоток выбирать 
36983	 валить туда рысь дурак петр 
36983	 ведь чтобы идти рысь надо почти беспрерывно останавливать крик 
36983	 лошадь бежать шибкий рысь очевидно пропускать поворот попадать 
36983	 кавалерист сразу замечать его передний даже сначала шарахнуться сторона увидать дорога никто другой направляться рысь взять винтовка наперевес 
36983	 крадучись проходить гумно перемахивать через плетень рысь контора 
36983	 энта тронуть рысь скрываться под гора 
36983	 заведующий полянка митин широкий рысь обгонять плюгавый деревенский коняк 
36983	 ежо так рысь убивать она разгуливать 
36983	 указывать дорога ехать ровный тихий рысь вовсе узнавать путь 
36983	 ножов рысь побежать просека собачонка встречать 
36983	 тот взять полный рысь заторопить лошадь карета свертывать 
36983	 большой камень русло заставлять сотник артифексовый задерживать конь переводить рысь потом шаг 
36983	 армия хотеть притти последний она свертывать проселок там понестись вскачь подвода повозка задыхаться пешком волочить рысь артиллерия бросать застревать орудие 
36983	 зык подручный рысь въезжать крепость 
36983	 снова ослик рысь сечь перламутр песок пирамидный 
36983	 ездить гора шаг под гора рысь 
36983	 мистулов муженков рысь поехать лес 
36983	 ехать ровный средний рысь весь время смотреть лошадь 
36983	 пыль тошнить клопиный рысь перебултыхаться живот 
36983	 этот время из-за часовня рысь выезжать два австрийский полевой жандарм 
36983	 справа слева самый колесо приподниматься седло такой рысь трусить казак 
36983	 литейный бассейный правый рука расстояние шаг сорока прямо навстречу торопливый рысь мчаться карета 
20083	 поровняться они скомандовать что-то балкон затарахтеть рысь 
36983	 мой лесной царь понестись быстро английский рысь 
36983	 потом из-за угол изба загреметь телега подкатить крыльцо рысь подъезжать останавливаться старик отец 
36983	 опять выезжать дорога пойти рысь 
36983	 проехать немного рысь сотня снова переходить шаг 
36983	 рысь подымать пыль перерезывать большак 
36983	 через минута блюм мочь уверенность различать твердый рысь лошадь 
36983	 два час спустя они ехать полный рысь москва 
36983	 вот наконец открываться широкий даль картина город забелеть полоса шоссе бежать весело шевельнуть вожжа покатить вдоль рысь отгонять прочий ехать ярмарка 
36983	 почему-то становиться обидно что отзываться именно шван всегда необыкновенно молчаливый золотушный немец отвисать угол губа так еще хвастливый самовлюбленный отзываться рысь последний угол марш-марш 
36983	 митька зареветь испуг весь глотка рысь кинуться вон столовая 
36983	 общий картина получаться такой рысь арш 
36983	 перепугать барыня ткнуть кучер спина тот тряхнуть возжами пускать место полный рысь 
36983	 через несколько минута лошадь тяжелый рысь вынести двое поворот 
36983	 фыркать проситься рысь шумно шуршать копыто глубокий 
36983	 она теперь чуть трусить часто переходить рысь шаг 
36983	 извозчик вопреки обыкновение петербургский возница ехать бодрый рысь седок казаться что 
36983	 полуэскадрон отделяться вперед идти полный крупный полевой рысь день наставать вполне быть жарко 
36983	 несмотря болото пень завал усталость после тридцать верста сделать полный рысь весь опор вылетать атаманец 
36983	 казак выдвигаться рысь вперед пойти через поле 
36983	 потом проходить церемониальный марш сначала повзводно шаг потом пополуэскадронно рысь 
36983	 атаманец идти самый начало бой полный рысь команда штабс ротмистр аленич 
36983	 объезд сделать преимущественно рысь потому что войско быть особенно 
36983	 стоять дорога человек расходиться хадж мурат оглядываться большой иноходь пускаться вниз дорога элдар большой рысь ехать позади они 
36983	 отвечать задорный мальчуган увидеть твой рысь марш 
36983	 увидать охотник зверь вставать сперва шаг потом рысь побежать прямо 
36983	 проезжий собранный рысь увидать рука его высочество 
20083	 коляска закладывать пара большой лошадь почтарь перекидывать труба через плечо тронуться место крупный рысь 
36983	 ускорять шаг побежать почти рысь придерживать кивотик под мышка 
36983	 через несколько минута появляться снова антип уже рысь тот пакет 
36983	 очень скоро нагонять рысь другой казак тот полк 
36983	 тир поэтому уже рысь забегать прямо 
36983	 ехать крупный рысь долго толковать встреча делать 
36983	 съезжать рысь горка въезжать опять 
36983	 подъезжать войско государь скорый рысь обгонять голова колонна останавливаться 
36983	 стрела мчаться щегольской карета уносить заключенный они звездоносец между они мелкий рысь сновать извозчичий пролетка скрючивать 
20083	 ходить заповедь божий говорить русский современник побеждать поганый язычник устремляться они как лев гневный как рысь губительный как крокодил пролетать 
36983	 ельцинский фабрика подъезжать рысь почтовый тройка 
20083	 род кошка отвлечение между лев тигр барс кошка рысь реальный совокупность все 
36983	 название что дорога быть грязный оказываться слишком слабый она быть адски непроходимый весь изрыть колея бакалдина ехать хоть легонький рысь быть она совершенно невозможно 
36983	 алпатыч плыть шаг чтобы только бежать рысь едва догнать ростов 
36983	 неуклюжий крепко сколачивать тарантас наш греметь шоссе лошадь бежать ровный основательный рысь без кнут понукание даже 
