36983	 один незначительный тогда считаться племя рысь 
36983	 босой цыган сиреневый рубашка ехать неспешный рысь вдоль обочина коричневый сытый 
20083	 рысь костя мастер компания этот 
36983	 спасибо угощение сказать переходить рысь чтобы как ненароком упираться 
36983	 так что шаг рысь под руководство овладевать 
36983	 дальнейший продолжать выступать дрессированный рысь 
36983	 думец зотов переходить галоп учебный рысь 
36983	 возвращаться видеть идти прогулка боря короткий пальто воротник гималайский рысь 
20083	 копылев рысь относить этот рисунок редактор 
20083	 калина как рысь дуга огибать дровосек заходить 
20083	 юмшан тыран латып разом прыгнуть дерево как рысь 
20083	 тихо как рысь светлана подкрадываться сзади 
20083	 выругаться сын епрев витька нарочно завозить догадываться любка рысь как домой 
36983	 тот отказываться говорить хоть председатель колхоз без толк скакать заставлять многозначительно добавлять животный сам знать когда она шаг идти когда рысь бечь 
36983	 одновременно тренерский успех герман обрастать полезный знакомство перестройка нестись быстрый рысь проходить восьмидесятый начинаться тревожный девяностый 
36983	 бег рысь можно сравнивать неустойчивый равновесие 
36983	 чуть-чуть хватить выносливость второй номер пятый седьмой наездник мастерство сбиваться рысь финиш второй номер деньги 
20083	 николай особый случай она связывать определенный план прощупывать подкрадываться как рысь 
36983	 неторопливый рысь она направляться прямо 
20083	 шолохов возникать кабинет неслышно почти крадучись мягкий походка рысь 
36983	 вставать тотчас конь рысь поле при первый свет 
36983	 когда панталончики кружево вдруг исчезать переходить несолидный растерянный рысь 
20083	 командовать полин как-то очень естественно невесомый обнимать шея правый рука скакать впереди легкий рысь полин что-то говорить что-то 
36983	 давно надо быть заводить домик деревня расслабленно размышлять позволять вороной переходить такой минута галоп размеренный рысь 
36983	 это отрезвлять павел переходить рысь 
36983	 только что сотворить она излучать свой замысел сильно все вокруг сильно рысь сильно смоква когда она 
36983	 поход продолжаться заря заря весь время рысь 
36983	 пускать мальчик рысь поворот нагонять идти 
36983	 стискивать мальчик шенкель мальчик могучий рысь тронуть вперед 
36983	 всадник сближаться переходить рысь между они разведка оставаться 
20083	 николай степанович живо представлять как обрадоваться прокопьич городской дозволенный вера гостинец грецкий орех свежий дрожжи кусковой колоть сахар цукат патрон капсюль порох сокол картечь особенно новенький буквально небо снятой карабин рысь 
36983	 лошадь переходить рысь шаг седло подниматься 
36983	 тоже находить жених цыкнуть рысь ромбик 
20083	 панин бросать сильно как катапульта приземляться посередине комната чуть упасть поскальзываться что-то жидкий позади командор выпутываться штора передо угол сжиматься как рысь готовиться прыгнуть огромный голый парень 
36983	 один парень рысь метнуться корма 
36983	 несильный тронуть бок ржавый каблук тот послушно переходить рысь 
36983	 крупный шаг история переходить рысь 
36983	 добиваться правильный посадка правильный рысь чтоб всадница лошадь сливаться 
36983	 иловайский подходить ружейный выстрел пускаться рысь ударять такой храбрость 
36983	 человек переходить рысь без паника даже изящество 
36983	 буров рысь понестись изба когда 
36983	 человек вокруг благоговейно молчать следить обстоятельный рысь перо оживлять сокровенный надежда 
36983	 снова бесконечный тоннель коридор переход театр нервный рысь нестись начальственный группа 
20083	 пока она это писать неслышно как рысь дверь появляться странный существо 
20083	 зем вздрагивать испуг метнуться как рысь кабина бормотать что-то про 
36983	 лошадь уставать тридцать верста василий мочь удерживаться слегка притрагиваться кнутик крупа папаша лошадь предчувствовать скорый отдых обильный корм переходить рысь мчаться гора 
36983	 вроде рано вставать все рысь никак 
36983	 дядя сандро идти очень быстрый рысь потому что этот раз 
20083	 уже знать что подумать шепотом спрашивать нападывать рысь 
20083	 линчей означать рысь как писать основатель академия это 
36983	 полк справа три рысь арш 
36983	 сразу успокаиваться вдруг обессилевать опускаться баул она размашистый рысь приближаться легкий коляска самый ганс 
36983	 сытый лошадь идти размашистый рысь коляска мягко покачиваться гнутый 
36983	 впереди размашистый рысь ехать командир без мундир 
36983	 все еще решаться пускаться рысь при человек 
36983	 кучер натягивать повод лошадь место брать рысь 
20083	 так как тогда михайловский сад кавалер место взять рысь 
36983	 извозчик заскучать безделье хлестнуть лошадь поехать скорый рысь 
36983	 трижды проходить конвоец церемониальный марш посотенный шаг рысь намет 
36983	 лошадь берег рысь стоймя лыжа 
20083	 человек скакать яко козел раздуваться яко пузырь гневаться яко рысь съедать хощета яко змий ржать 
36983	 рысь побежать чистить лишь никто 
36983	 лаврентьев обгонять пленный возбуждать бой яблочный розовый пятно щека юный лопоухий первый подбегать легонький рысь выпрямлять ладонь висок вытягиваться 
36983	 бежать мерный неспешный рысь вдруг спохватиться припускать вовсю 
36983	 встречать руслан возвращаться лес бежать середина улица мерный размашистый рысь увидеть поистине 
36983	 карько сразу деревня взять ходко терять рысь кошевка накатать дорога скользить 
36983	 наездница подходить конь пускать рысь круг 
36983	 здесь замечать что глаз лариса павловна мгновение суживаться точно рысь она удовлетворенно кивнуть 
20083	 жить быть село чебровка некто семка рысь забулдыга непревзойденный столяр 
20083	 чебровка столяр семен рысь вот семен съездить 
20083	 моргнуть глаз называть семен рысь столяр чебровка 
36983	 горец велеть идти рысь спешить напрасно карновский 
36983	 полоз омерзительный скрежетать камень копыто лошадь когда она пробовать бежать рысь лететь ошметие талый грязный снег 
20083	 череп крупный хищник медведь рысь волк шакал уссурийский тигр присылать 
20083	 этот трофей золотой медаль удостоить череп бурый медведь балл хабаровский край владелец зуев награждать ценный подарок череп рысь балл добывать 
20083	 связь что волк рысь находиться грань полный исчезновение 
36983	 неужели появляться исторический музей конница переходить рысь 
36983	 вдруг замалчивать рысь кинуться свой место 
36983	 мерин поневоле приходиться переходить рысь через минута возбужденный дружок 
36983	 наверное дмитрий наркисович раз наблюдать как идти хороший рысь лошадь кучер 
36983	 нетронутый пелена снег осторожно обходить полынь идти рысь 
36983	 идти рысь сбиваться как хороший бегунец 
36983	 вечер танцевать или вдруг спохватываться бежать рысь водка мелко переступать 
20083	 отдыхать конь вдоволь нарезвиться табун мелкорослый покорный лошадка идти крупный рысь 
36983	 пасть четвереньки дробный рысь подскакивать окошечко взяться 
36983	 напористый рысь шумно промчаться мимо встречный лошадь 
36983	 вспотеть сбивать нога двигаться скверный вихляться рысь 
36983	 лошадь привычно трогать идти рысь песок возчик так 
20083	 глаз рысь смотреть упор ресница вальган 
36983	 ехать свита местный власть рысь нестись охранять казак солдат 
36983	 после долгий трудный поиск быть наконец обнаруживать паренек уметь ездить рысь намет без седло 
36983	 запечатывать письмо свой новый печать отдавать мальчик подпасок чтобы тот рысь мчаться мохлин 
36983	 бежать рысь запаривать лошадь тяжело разбрасывать копыто 
36983	 разгонять двор пересигнуть через плетень только вихорь виться рысь или шаг сроду ездить 
36983	 весь резон рысь бечь как побежать 
36983	 преодолевать очередной подъем тузик шумно вздыхать короче протрубить переходить рысь быстрый шаг 
36983	 рослый гнедой лошадь уставать глубоко проваливать бок время время еще трусить рысь 
20083	 после это рысь бежать начальство бойко 
36983	 игнат шевельнуть вожжа гикнуть завертывать жеребец пускать вдоль улица машистый рысь 
20083	 клад рысь нападывать сейчас поляна 
36983	 там быть всего-навсего рысь она лежать вытягиваться деревянный 
36983	 когда николай уезжать фронт нина спешно вернуться гастроли рысь целый день ходить она 
36983	 плохо грустно спрашивать нина рысь скучно 
36983	 два раз его путь пересекать след рысь сразу вспомнить 
36983	 широко шагнуть уже рысь переходить вот изволить 
36983	 трогать они легко сразу переходить рысь 
20083	 желтый бак торчать как рысь сторона его серый лицо 
36983	 потрепать плечо немного поскакать держаться лук один нога около верховый конь тяжело садиться седло поехать рысь обочина 
36983	 после прохождение ответ царь приветствие надо быть переходить рысь чтобы перестраиваться взводный колонна 
36983	 наконец после постепенный переход сокращенный рысь тротт смена останавливаться 
36983	 неужели появляться исторический музей конница переходить рысь 
36983	 ямщик дремать править иногда вскрикивать непонятный ямский язык стегать прыгать крупа пристяжной когда идти шаг лошадь сам останавливаться напруживать задний нога вспотеть носить бок коренник начинать мочиться ямщик долго подсвистывать опять вскрикивать трогать тройка рысь 
36983	 возчик понукать лошадь рысь ехать темнота над 
36983	 топот все близко ехать рысь несколько конь 
36983	 слезать часовня поехать рысь чтобы буря выбираться 
36983	 проводник после обед уезжать назад ехать рысь мочь поздно вечер вернуться 
36983	 кавалькада переходить рысь скоро миновать длинный уродливый 
36983	 лошадь идти рысь железный шина однообразно надоедливо 
36983	 слышно один звук только биться брюхо лошадь бежать рысь шипеть колея 
36983	 дудор ткнуть бок иноходчик каблук лошадка рысь побежать поле взметать копыто 
36983	 подумать анна решительно схватываться вожжа лошадь ускорять рысь обниматься баба начинать горланить песня 
36983	 это ускорять работа участок без обнажение ехать рысь 
36983	 казак слагать табурет выдергивать земля пика значок вскакивать седло последовать кутузов главнокомандующий отправляться высота село семеновский конь трусить мелкий рысь кавалькада генерал потянуться вслед кутузов 
36983	 лейб-кучер фрол сергеев уметь место переводить лошадь рысь 
36983	 слон повиноваться легкий удар крючковатый нож побежать рысь быстро одолевать пространство степь 
36983	 севрюк вскакивать верховый лошадь гикать помчаться вперед размашистый рысь 
36983	 театр размашистый рысь подкатить карета скорый помощь 
36983	 впрягать бечева который канал тянуть трешкоут замечать что проходить свой станция ровный рысь быстро другой приходить совершенно 
36983	 закричать доктор низвецкий побежать рысь кравцов прибавлять шаг приближаться 
36983	 его лошадь идти шаг ленивый рысь труха труха труха сани клонить вправо-влево 
36983	 ермилка становиться перепрягать тройка свежий заводной конь побежать шибкий рысь пугачев хмуро посматривать сторона 
36983	 вот завидеть ехать рысь всадник малыш выхватывать из-за пояс 
36983	 впереди они шибкий рысь бежать рослый черный жеребец уносить 
36983	 оба даша рысь поехать царский ставка 
36983	 вот видеть ехать рысь справа слева 
36983	 отдыхать конь бодро взять рысь вот уже вынести майор 
20083	 подо оказываться иноходец рысь очень понравиться 
36983	 день прогулка погода стоять холодный беспокойный лететь перламутровый небо склоняться лозняк овраг копыто вышлепывать брызги жирный лужа шоколадный колея каркать ворона потом мост всадник свертывать сторона поехать рысь темный вереск над который 
36983	 оркестр лихо подхватывать сигнал бодро запрыгать мотив кавалерийский рысь весело избочиться 
36983	 они перегнать ломовой телега рысь прогромыхать вниз пристань 
36983	 выдавать маузер деревянный кобура пускать лошадь рысь всегда поддерживать рука 
36983	 ускорять ход верблюжий караван невозможно скорый шаг верблюд идти рысь трясти расстраивать вьюк набивать 
36983	 ехать шаг переходить рысь быстро соображать что мой 
36983	 всадник доезжать полверсты переходить рысь 
36983	 соскакивать брус рысь догонять свой время время 
36983	 григорий выжидать немного рысь поехать 
36983	 становиться словно под нога увидеть глубокий поглядеть назад чуть рысь под над дон займище 
36983	 второй михей падать назад передергивать вожжа силиться перевести скакать лошадь рысь 
36983	 пантелей прокофиевич долго топтаться один место будто сразу хотеть переходить рысь 
36983	 возмущенно закричать задний ряд сотня переходить рысь разговор смолкать 
36983	 всадник переходить рысь снова сдерживать конь 
36983	 конь переходить рысь ускорять ход понестись вскачь 
36983	 вскричать михалев рысь побежать больница 
36983	 накладной стенка зыбка привешиваться качество побрякушка бусы пустой ружейный гильза копытце кабарга кость рысь тоже охранять мальчик посягательство 
20083	 предлагать вдвоем нести рысь палка отказываться 
36983	 видимо почуять пойти рысь под гора 
36983	 ну-ка попробовать рысь раз упасть вместе 
36983	 лошадь горбунов марковский идти размашистый ровный рысь 
36983	 ехать рысь вдоль скала лагерь 
20083	 при это езда строевой рысь очень утомлять если попадаться тряский 
36983	 время строевой рысь команда доходить хвост 
36983	 отвечать садиться тачанка спускаться крещенский спуск веселый рысь выезжать степь синий 
36983	 лошадь бежать ровный рысь визжать накатать снег колесо 
20083	 прекрасный лес башкирия встречаться хищник медведь волк лисица росомаха рысь 
20083	 лес водиться медведь рысь много быть волк ветвь 
36983	 вдыхать аромат цветущий трава рысь мчаться пестро цвести ковер 
36983	 греметь артиллерия проезжий рысь булыжник мостовая гром 
20083	 жатка идти ровный механический звук лошадь свободно набирать рысь даже поворот задерживаться 
36983	 японец бегать отставать кавалерия делать рысь большой несколько десяток верста 
36983	 конный дивизя вести бой только один авангардный полк главное сила дивизя подтягиваться рысь все казаться что 
36983	 корнет останавливать ядро разъзда группа дерево галопом выдвигаться головной дозор увидло что конный противник сила два двигаться дорога знаменское выселок миновать мост через ручей переходить рысь 
36983	 этот письмо удивительно читать настолько они свой настроение совпадать обычный наш представление толстой который год научаться ездить велосипед год гарцевать лошадь делать она рысь двадцать верста 
36983	 видеть поблизости царь кое-кто боярин понемногу рысь опережать иноземный посол чтобы первый 
20083	 карл как рысь быстро повертывать узкий лицо 
36983	 полк рысь проходить верста откатиться 
20083	 крикнуть тунгус весь ощетиниваться как рысь 
36983	 рысь побежать бригада болтать перед 
36983	 бежать некоторый время рысь что думать 
36983	 совсм другой она пускать свой лошадь рысь они прохаль молча аллея 
