28103	 наживин никогда жизнь встречать жить если ошибаться брюссель почему-то вместе некоторый другой сотрудник газета избирать свой мишень 
28103	 становиться тихо как тир когда там менять мишень 
28103	 соблазнять живой мишень давать пристреливаться весь 
28103	 стрелять оба рука пританцовывать ледяной площадка возле камень бросаться вправо влево падать снова вскакивать слышать как постанывать над голова пуля посылать девятизарядный вальтер расстояние когда опытный стрелок поражать мишень первый выстрел 
28103	 хотя роль публичный школа воспроизводство элита общество куда более очевидный разительный именно грамматический школа становиться ныне англия главный мишень критик средоточие борьба 
28103	 убеждаться что немец успевать занимать господствующий высота нет смысл лежать они под нос живой мишень 
28103	 проходить через они электрон попадать мишень давать типичный интерференционный картина 
28103	 поляна ставить дощечка вид мишень шура стрелять браунинг 
28103	 знать что стремиться добро что добро любить что оно представляться прекрасный желанный вместе это как человек стрелять мишень мочь промахиваться так 
28103	 пуля выпускать трехлинейный винтовка тридцать шаг разносить плексигласовый мишень кусок 
28103	 так продолжаться пока мишень покрывать защитный слой 
28103	 для решение задача зажигать электрический дуга один конец который упираться подопытный мишень 
28103	 участочек мишень раскаляться выстреливать порция ион 
28103	 при это происходить разогрев вещество который состоять мишень 
28103	 если выстреливать мишень точечный импульс главенствовать процесс 
28103	 выбивать мишень ион композиционный быть соответствовать исходный 
28103	 центр круг заветный цель оранжевый мишень диаметр 
28103	 дюже мишень большой лошадь кто оставлять 
28103	 кривоногий сын степь пухлый губа фонарясия приучать природа делиться ближний быть отличный мишень для благородный лефоша 
28103	 сторожевой замок возле дорога стоять хлебный элеватор небольшой старинный походить силуэт мишень для стрельба огромный элеватор 
28103	 главный мишень острота служить конечно техасец 
28103	 животное они смотреть как живой мишень они создавать чтобы они убивать 
28103	 почти исчезать ныне луговой тетерев американец называть его курица прерия барабанщик любовь долго служить просто мишень для тренировка стрельба они 
28103	 ружье стрелять гораздо далеко чем два подхвостный железка мишень хорошо заметный небоязливый дикарь отличный 
28103	 ядро бромистый фреон хороший мишень для нейтринный шрапнель они 
28103	 давление возникать при столкновение струя броневой плита настолько превышать напряжение необходимый для разрушение становиться что прочность мишень играть существенный роль 
28103	 так вот кинокомедия если она выстраивать строгий закон этот жанр прочность мишень иметь значение 
28103	 морж суша чересчур большой мишень стрелять неинтересно 
28103	 вокруг центральный часть как многорядный частокол сборка отвальный уран это урановый мишень где образовываться плутоний внутри реактор 
28103	 если изучение частица вестись помощь сцинтилляционный или черенковский счетчик ускоренный протон надо выводить мишень постепенно 
28103	 мишень тоненький проволочка вводиться вакуумный 
28103	 если помещать камера близ мишень направлять чрево 
28103	 тут подхватываться внешний магнит направляться мишень 
28103	 потеря частица путь кольцо синхротрон мишень превышать несколько десятитысячный доля 
28103	 внешний мишень медный стержень диаметр 
28103	 задача решать здесь рассортировывать частица получать после удар протон мишень сфокусировать они доставлять однородный 
28103	 протон ударять мишень при столкновение ядро 
28103	 технический оснащение эксперимент таков подытоживать рассказ устройство руководитель лаборатория нейтринный исследование доктор физико-математический наука мухин что каждый сотня ударять мишень протон получать для работа 
28103	 плотный как занавеска четкий рисунок напоминать стрелковый мишень 
28103	 какой инструмент быть вооруженный нейрохирург требоваться снайперский точность попадание мишень 
28103	 такой ровный начало предопределять обостренный характер борьба упражнение стрельба неподвижный подводный мишень 
28103	 попадание гарпун мишень фиксироваться после каждый выстрел спортсмен 
28103	 наконец мишень устанавливать так чтобы все спортсмен 
28103	 недостаток очевидный теряться главный преимущество нападать внезапность транспорт часто превращаться мишень для артиллерист 
28103	 множество опыт проделывать пока помощь умелец мерефянский стекольный завод создавать надежный разрядный вакуумный трубка они помещать бомбардировать мишень применять импульсный разряд постоянный ток 
28103	 подобно артиллерийский орудие она стрелять литиевый мишень разгонять большой скорость ядро 
28103	 тот время заседание судейский коллегия обсуждаться вопрос проведение упражнение стрельба подводный мишень 
28103	 открываться при бомбардировка листок мишень золотой фольга весь альфа-частица 
28103	 далеко ставиться нужный для бомбардировка мишень 
28103	 это увеличивать вероятность захват ядро мишень провзаимодействовать неторопливый частица много 
28103	 частица лететь ядро как пуля мишень 
28103	 шанс тем много чем много мишень сравнение поперечный сечение этот сравнение 
28103	 содержательность этот образ его точность напротив условность ядро безучастный мишень микрочастица безучастный пуля 
28103	 бор обесценивать образ лабораторный бомбардировка микроснаряд разрушать мишень ничто она 
28103	 потому возникать составной ядро это более тяжелый изотоп тот элемент какой сделать мишень 
28103	 можно через сто год помнить что как ворваться мишень ставить зависимость 
28103	 для это естественно нужный быть золотой мишень 
28103	 однако обнаруживать новый элемент американский ученый год удаваться несмотря использование мишень нептуний большой исходный активность 
28103	 мишень выполнять вид трубка можно 
28103	 начальник разведотдел армия подполковник щербенко будущий генерал заподозривать этот стык как возможный мишень для немецкий прорыв который 
28103	 она становиться мишень для немецкий артиллерия немецкий 
28103	 вспоминать как происходить обучение наш вновь сформировывать пехотный полк бегать лес кричать ура раз стрелять мишень беречь патрон 
28103	 бороться жизнь плазма оказываться возможно помощь улучшение термоядерный мишень 
28103	 как уже быть сказать сам себя высокий плотность мишень облегчать зажигание плазма 
28103	 расчет показывать что помощь лазерный излучение можно увеличивать плотность мишень раз 
28103	 процесс сжатие вещество происходить из-за реактивный сила появляться при испарение плазма разогревать поверхность мишень 
28103	 выходить последний каскад поток световой энергия помощь оптический система собираться восемь луч который сферически симметрично атаковать мишень строго программировать время лазерный 
28103	 излучать лазер мощность превышать мощность весь электростанция мир что становиться мишень поверхность мгновенно нагреваться 
28103	 возникать при это реактивный сила сжимать мишень 
28103	 этот момент плазменный корона работать как тепловой линза собирать падать энергия уменьшаться поверхность сжимать мишень 
28103	 вот уже весь мишень представлять себя сверхплотный горячий плазма 
28103	 заключаться эксперимент называть спектр что особый устройство закреплять орбитальный станция захватывать атмосферный частица формировать они достаточный плотный пучок который затем бомбардировать мишень 
28103	 прибор должный быть фиксировать весь особенность частица струя отражать мишень различный состав 
28103	 потом заговаривать свой работа экстра сенсорный восприятие всякий род проба испытание мишень тысяча опыт который проделывать 
28103	 цель управляемый мишень который пойти большой высота 
28103	 конечно вначале быть занятие потом зачет потом лейтенант апполон сражать истребитель противник имитировать скоростной мишень 
28103	 справа все тот над выемка пересыхать ручей вытаптывать взлобок похожий могильный холм насупленный темнеть мрачный свинья подрыть помещение закрытый ставня замкнутый широкий железный полоса дверь так избивать гвоздь что можно быть принимать они мишень изрешечивать дробь это магазин кедр 
28103	 если пойти вперед быть мишень для немец 
28103	 уже тот подножка где стоять потертый поравняться станция уже тетя стюр уставать идти поезд повертывать обратно черный плоский как мишень нести плечо багровый закатный 
28103	 левый эра открывать быть артиллерийский огонь брать мишень кремль совнарком 
28103	 после срабатывание магнит весь лишний частица отклоняться два поток направляться мишень пассивный стальной или медный 
28103	 это объясняться тот обстоятельство что такой видный большевик как анастас микоян самсон канделак оставаться живой тогда как число попадать несколько работник незначительный величина николайшвили метакса младший богданов даже случайный товарищ мишень арестовывать баку недоразумение 
28103	 член военный революционный комитет анатолий богданов советский служащий арменак борянин советский работник журналист эйжен берг матрос иван габышев бригадный комиссар татевос амиров командир кавалерийский отряд ираклий метакса иван николайшвили коммунист назначать партия для личный охрана шаумян джапаридзе исай мишень делопроизводитель военный революционный комитет беспартийный 
28103	 например считать что изобретение ракета авиация окончательно терять значение что подводный лодка полностью заменять наземный корабль поскольку последний плавучий мишень для ракета 
28103	 третий источник информация измерительный щит мишень также оснащать тензодатчик 
28103	 должный мишень обратно брюхо ползти 
28103	 чтоб зад твой над местность торчать служить мишень для враг один слово обладать 
28103	 запоминать больше как сам стрелять как окоп специальный сидеть команда мишень высовывать для другой 
28103	 пуля мишень щелкать над окоп посвистывать 
28103	 третий разрабатывать устройство минерал синтезироваться при ударный взаимодействие флюидный струя мишень затравка моделироваться взрыв флюидный включение 
28103	 при эксперимент воздействовать образец часто все так выстреливать как мишень ударник вид плоский пластина 
28103	 кроме невозможно нацеливать такой неуправляемый метеорит мишень чтобы изучать механика высокоскоростной удар 
28103	 навстречу неподвижный модель сила взрыв устремляться плоский мишень 
28103	 чтобы отсеивать весь побочный осколок лететь под различный угол ставить перед мишень экран узкий щель 
28103	 пучок мюон уже давно получать искусственно разгонять высокий энергия протон бомбардировать они различный мишень 
28103	 вакуумный камера образованный стальной плита колпак вводить катод анод электрод мишень наносить прессовать 
28103	 после очистка отрицательный потенциал прикладывать мишень 
28103	 разгар бой вражеский снаряд попадать локомотив крепость колесо превращаться неподвижный мишень 
28103	 заключительный участок сближение точный взаимный положение корабль определяться визуально помощь оптический прибор аполлон стыковочный мишень советский корабль 
28103	 человек приближаться цепь превращаться удобный подвижный мишень 
28103	 военный министр барон будберг быть зал его квадратный коричневый цвет лицо седоватый бобрик волос даже очки черепаховый оправа служить мишень для острота 
28103	 вооруженный автомат весьма уверять себя свой игрушечный пушчонка представляться очевидно более чем придурок начинающий живой мишень 
28103	 делать даже так идти место большой маневр становиться главный мишень лупить все орудие 
28103	 ведь такой пожилой женщина спрашивать нельзя чтоб она двигаться мишень первый выстрел без промах 
28103	 стрельба неподвижный мишень преимущество быть спортсмен который 
28103	 один только она неправый слабоватый для сатира юмор хотя как мишень годиться право поладьев 
28103	 казаться ничего нет просто сбивать такой повисать воздух мишень 
28103	 снимать это означать останавливать машина дорога делать она мишень для немецкий пушка 
28103	 отличие подводный охота культивировать многий страна комплекс наш соревнование включать стрельба подводный ружье неподвижный мишень стрельба двигаться 
28103	 программа соревнование быть включать три упражнение стрельба малокалиберный пистолет стрельба подводный ружье неподвижный мишень подвижный цель рыба 
28103	 тут интеллигент находить наконец свой очки подбирать шест опрометью бросаться укрытие так что фермер оставаться посреди мостовая один одинешенек единственный достаточно соблазнительный мишень для волосатый снайпер 
28103	 управление морской подготовка досааф сделать правильно упор развитие ссср стрельба под вода двигаться неподвижный мишень 
28103	 упражнение стрельба мишень под вода принимать наш 
28103	 это объясняться что они тренироваться стрельба мишень установленный под вода 
28103	 такой образ стрельба под вода неподвижный двигаться мишень следовать всемерно развивать 
28103	 значок ерунда сказать чепец нужно стрелять мишень это готовый девис 
28103	 более агрессивный мишень если они обнаруживать охотник 
28103	 танцевать самозабвенный плохо так как быть принимать тот время представлять себя мишень для насмешка присутствовать при это 
28103	 тот дело раздаваться выстрел быстро лететь мишень маленький круглый тарелочка взвиваться стремительно 
28103	 сильный оказываться мастер спорт армеец кулак поражать командный личный соревнование траншейный стенд мишень 
28103	 окрестный земледелец проникать мишень плакат фудзи быть 
28103	 другой дальномер крейсер превращать пыль корабль мишень где-нибудь курить 
28103	 шесть миллион миллиард протон быть посылать мишень 
28103	 это значить культура быть что они вывозить весь подчистую музей использовать обертка рукопись библиотека украинский академия палить пистолет статуя зеркало могильный памятник все где быть какой-нибудь яблочко мишень 
28103	 поток такой частица обрушиваться мишень сделать вещество который нужный 
28103	 все кто когда-либо работать циклотрон хорошо известно как трудно бывать вести эксперимент если мишень устанавливать непосредственно вакуумный камера 
28103	 увидеть что полосатый похожий мишень для стрельба 
28103	 несколько по-другому поступать тир там всегда стремиться как можно часто попадать определенный место центр мишень 
28103	 после стрельба мишень выглядеть примерно так как 
28103	 допускать что раз выстреливать мишень раз попадать десятка 
28103	 если теперь взять точно такой мишень опять раз 
