28103	 при выполнение этот условие полный право можно считать себя идеальный мишень для опытный гранатометчик 
28103	 качество мишень для идентификация использовать видоспецифичный участок 
28103	 качество мишень для видовой идентификация быть выбирать 
28103	 основной преимущество анализ являться простота выполнение возможность одновременный детекция большой количество мишень последовательность днк 
28103	 такой переброска становиться катастрофа для тыл дивизия успешный выполнение боевой задача вне привычный полигонный условие когда каждый командир танк знать где когда появляться тот или иной мишень вызывать сомнение 
28103	 качество мишень для быть выбирать именно 
28103	 зебра бамбуковый лесенка тарелка похожий мишень тир 
28103	 качество клетка мишень использовать фибробласт мышь линия 
28103	 концентрация клетка мишень составлять тыс лугнка 
28103	 спленоцит получать иммунизировать мышь вносить клетка мишень соотношение 
28103	 группа мышь иммунизировать рекомбинантный сальмонелла достоверно регистрироваться специфический лизис клетка мишень 
28103	 отношение эффекторный клетка клетка мишень составлять 
28103	 возможно сателлитный примесь участвовать отщепление наружный домен гемагглютинин нейраминидаза проводить некий предварительный обработка вирион например удалять углеводный остаток предоставлять фермент бромелаина много возможность добираться мишень 
28103	 полевой условие нет проверочный мишень ящик артиллерийский мастер габаритный линейка 
28103	 вставлять ствол винтовка трубка холодный пристрелка пулемет наводить перекрестие трубка точка обозначать мишень 
28103	 ход ведение боевой действие гора всегда находить подходящий место для производство выверка вряд под рука оказываться контрольный выверочный мишень трубка холодный пристрелка пулемет 
28103	 взаимодействие кластерный мишень лазерный импульс приводить 
28103	 некоторый случай ядро мишень вылетать ион энергия 
28103	 тот кто быстро поражать свой мишень выходить победитель данный раунд 
28103	 для уменьшение себя как мишень бой рекомендоваться вести более 
28103	 основной мишень статья сердюченко это сегодняшний 
28103	 силовой удар наоборот скорость движение ударный конечность мишень намного много чем после соударение 
28103	 цель безопасность обучение техника перехват удар карате сначала отрабатываться против удар выполнять контролируемый способ большой амплитуда голова например маваш ура маваш каитен уширо маваш выполнять силовой манера тот без резкий отдергивание ударный конечность после соударение мишень 
28103	 кроме этот методический прием позволять ученик приобретать способность выполнять удар запланировать скорость сила воздействие мишень 
28103	 мишень удар нога пока точно 
28103	 активность клетка определять тесто освобождение уридин меченый клетка мишень клеточный лимфом мышь 
28103	 время последний война именно как важный психологический оружие становиться первый мишень время ночной бомбардировка вспомнить 
28103	 второй часть криминальный драма заставлять себя ждать сделать вид что собираться всерьез чистить свой ряд правоохранительный орган быстро находить мишень интересно крупный уже почувствовать 
28103	 данный область участвовать формирование вирусный структура взаимодействовать корецептор клетка мишень 
28103	 стоячий мишень рано или поздно обязательно 
28103	 преимущество полимерный состояние вещество расширять диапазон чувствительный мишень открывать возможность для преодоление 
28103	 инфекционный титр иды определять культуральный среда заражать кратный разведение вирус фрагмент хао планшет без адамантансодержащий комплексный препарат или присутствие концентрация при эквимолярный концентрация ремантадин при который ремантадин действовать только основной мишень ионный канал белок 
28103	 известно что при такой высокий концентрация ремантадин блокировать мишень функция ионный канал белок 
28103	 поскольку основной мишень для действие амантадин ремантадин 
28103	 другой непрямой мишень для действие адамантан являться гемагглютинин 
28103	 поскольку одновременный возникновение мутация различный мишень маловероятный предполагаться что этот путь 
28103	 принципиально иной подход разрабатывать позволять создавать антигриппозный препарат широкий круг вирусспецифический мишень потенциально активный только против 
28103	 теоретически можно предполагать что отличие базовый адамантан адамантансодержащий полимерный препарат иметь более широкий спектр вирусспецифический мишень счет общий увеличение сайт 
28103	 при освобождение базовый адамантан процесс биодеструкция полимерный препарат сохраняться вероятность последующий взаимодействие специфический мишень ионный канал белка 
28103	 наш мнение именно кооперативный действие перечислять тип взаимодействие обеспечивать максимально выраженный антивирусный активность вирус грипп ингибирование другой вирус который отсутствовать специфический мишень взаимодействие аминоадамантан грипп 
28103	 неопытный боец как правило при атака утрачивать культура движение делать себя мишень для контратака 
28103	 удерживать рука защищаться противник представлять хороший мишень для атака поскольку корпус 
28103	 при конструирование препарат пролонгировать действие использование производный лекарственный вещество необходимый чтобы действующий начало высвобождаться клетка мишень под действие клеточный фермент водовозов 
28103	 согласно статистика нетание далеко первый раз становиться мишень террорист прибрежный курорт близкий 
28103	 один пуля миновать нужный мишень угождать буренка мирно 
28103	 становиться мазать уже десятка или девятка всаживать пуля разброс весь круг мишень 
28103	 мочь сто раз подтягиваться перекладина секунда одолевать метр расстояние метр всаживать кучно очередь автомат мелькнуть мишень мышца мой крепнуть каждый 
28103	 успевать три секунда швырнуть граната повалить мишень стрелять они два 
28103	 похоже что самый дело два сильный человек ингушетия решать выставлять хамзат гуцериев качество ложный мишень 
28103	 мелкашка метр обычный круглый мишень 
28103	 стрелять десять патрон короткий очередь три мишень 
28103	 первый появляться пулеметный расчет пятнадцать секунда затем два раз грудной мишень выскакивать 
28103	 честно говорить даже мишень толком видеть поэтому весь 
28103	 самый удивительный что даже отстреливаться отлично повалить грудной мишень пулеметный расчет 
28103	 общий пока они такой образ это дело решать дружно открывать огонь мишень конечно потом долго смеяться вспоминать 
28103	 так сей пора знать что надо делать такой ситуация стрелять мишень или защищаться газ 
28103	 может это варварство боец ветка отличный мишень 
28103	 конечно америка институт разный круг тоже относиться по-разному институт раз становиться мишень для атака крайне правый 
28103	 хотя непосредственный мишень антидиссидентский политика быть сотня мочь 
28103	 они этот оазис становиться почти такой излюбленный мишень для атака консерватор общественный 
28103	 константин арский мишень нквд москвич поминать тысяча 
28103	 только год находиться документальный подтверждение что мишень стрельбище быть человек 
28103	 депутат близкий нынешний руководитель ханнара хведжан быть один первый мишень борьба коррупция 
28103	 главный мишень традиция ребенок близкий 
28103	 прежде все это усиление охрана военный объект который мочь становиться террористический мишень 
28103	 потому что многий военный объект представлять мишень для террорист 
28103	 окно вставать стакан рука ясный сквозь прицел как мишень 
28103	 пускай статья определять суд виновный хотя взять мишень тир как художественно 
28103	 как художественно звучать иносказание мишень тир все равный обозначать расстрел 
28103	 сторонник повышение возрастной планка говорить что летний подросток мочь отвечать свой действие становиться легкий мишень для педофил 
28103	 действительно представитель государственный власть редко становиться мишень для политический сатира часто все 
28103	 сам указывать они мишень кто указывать 
28103	 кто указывать мишень десяток человек нападать первый 
28103	 как неправильный один волосок прицел давать миллион раз большой ошибка мишень так теперь уклонение 
28103	 мишень тарелочка вылетать неожиданно часто 
28103	 мишень тарелочка вылетать неожиданно часто 
28103	 ваш команда взмывать воздух мишень успевать она застыть 
28103	 слово сказать выстрел вместе мишень обслуживание стоять здесь 
28103	 яркий оранжевый мишень подпрыгивать отчаянно скакать полянка 
28103	 хороший спортинг иногда для разнообразие отправляться пострелять площадка классический стрелковый дисциплина круг или траншея мишень там еще дешевый если 
28103	 второй задача состоять чтобы использовать космический аппарат входить система пко для фотографирование телевизионный наблюдение спутник мишень 
28103	 артиллерийский система стоять впереди лагерный передний линейка выстраиваться ряд крайний мера десяток километр представлять себя доступный мишень 
28103	 недовольно фырчать лошадь изящный брызги жижа хлябь смачный разрыв пуля тыква мишень немногословный дакаскос вертушка 
28103	 вбивать свой пуля центр мишень как гвоздь похлопать фогель 
28103	 торопиться упор погулять прицел винтовка распластывать огромный гранитный валун неподвижный живой мишень тщательно выцелить гриша рука 
28103	 успешный пуск печора разрабатывать нпо алмаз завершаться эффектный попадание мишень глаз один 
28103	 там где стена красоваться мишень для метание мячик разноцветный 
28103	 пример оригинальный измерительный средство являться буксировать вертолет контейнер мишень измерительный матрица 
28103	 излучение лазер ориентироваться двигаться контейнер мишень наводиться центр измерительный 
28103	 опасливый держать отлет перенести мишень стоять поодаль чероки 
28103	 мишень светиться темнота подавать свой 
28103	 полигон быть сбивать первый мишень конец тот 
28103	 возможность последний февраль быть полный мера продемонстрировать выставка абу даби где выражение местный газета трехсотка буквально украсть выставка поражать небо над полигон макатр ряд низколетящий мишень 
28103	 однако соответствие новый политика официальный источник быть сообщать меньший объем сведение ракета мишень предназначать для перехват также 
28103	 разрабатывать фирма кентрон юар зенитный ракета умхонто вертикальный старт совершать успешный перехват ракета мишень 
28103	 одновременность разумеется носить целенаправленный характер так сказать два выстрел два рядом стоять мишень 
28103	 состоять наземный командный вычислительный измерительный пункт подмосковье специальный стартовый площадка полигон байконур ракета носитель космический аппарат перехватчик радиолокационный тепловой головка самонаведение осколочный боевой часть также спутник мишень для комплекс пко иса 
28103	 август целеуказание комплекс пко иса теплова впервые мир поражать защищать космический аппарат мишень 
28103	 оба такой изделие быть поражать первый наш ракета причем подрыв боевой часть вызывать детонация боевой снаряжение мишень 
28103	 весь подготовка наш соотечественник который быстро передвигаться лыжня метко стрелять мишень строиться строго учет это 
28103	 идти большой скорость чтобы представлять себя возможно меньший мишень 
28103	 следовать добавлять что этот традиционный концепция защита история этот способ выносить исторический событие продолжать доминировать мир вплоть эпоха очень близкий наш день что сегодня еще продолжать утешать аграрный традиционный европейский общество упрямо удерживаться безысторический позиция поэтому являться мишень яростный атака весь революционный идеология 
28103	 группа исследователь быть показывать что протеиновый рецептор также называть фузин или являться корецептор позволять тропный изолят вич инфицировать клетка мишень вскоре после это быть 
28103	 различие рецептор использовать тропный тропный изолят вич определять различие клеточный тропизм механизм проникновение вирус клетка мишень для проникновение вирус клетка 
28103	 более даже лицо инфицированный путем непосредственный попадание вирус кровь при внутривенный введение наркотик ранний стадия инфекция все равный доминировать тропный штамм принимать внимание этот данные можно предполагать что время непосредственный инфицирование ранний стадия инфекция проникновение вич клетка осуществляться через посредство корецептор весь видимость клетка являться мишень ранний стадия инфекция экспрессировать 
28103	 очевидно что использование направленный транспорт лекарственный вещество помощь разрушать ультразвук эритроцитарный контейнер иметь смысл только для тот соединение который быстро необратимо связываться мишень 
28103	 для развитие этот направление необходимо наработка база данные константа скорость связывание лекарственный вещество соответствующий мишень сочетать изучение устойчивость 
28103	 поставлять себя психологический установка что враг это человек мишень 
28103	 боевой действие относиться они как мишень 
28103	 только потому что второй огневой рубеж расстреливать чужой мишень 
28103	 позиция где размещаться пусковой установка мишень фаланга познакомиться 
28103	 отзыв отвечать весь необходимый требование командование создавать самый благоприятный обстановка для проведение весь работа испытание этот мишень 
28103	 после первый команда все выходить открывать площадка командный пункт несмотря сильный ветер сторона азовский море полный тишина стараться увидеть оценивать старт мишень обстрел тунгуска 
28103	 элиза дулиттл становиться эротический мишень весь мужчина земля кроме конечно 
28103	 этот плавучий мишень пускать металлолом толк много 
28103	 поскольку основной мишень международный террорист становиться мирный население 
28103	 второй неделя они быть совершать дикий пеший вылазка спускаться пещера учиться выживать дикий природа водить джип бездорожье стрелять мишень совершенствоваться верховый езда 
28103	 однажды смотреть как взрослый лучник безуспешно стрелять мишень 
28103	 итог согласительный комиссия женева сентябрь быть принимать следующий положение система про считаться нестратегический тот пора пока испытывать против цель мишень скорость полет 
28103	 приходить стрелять пистолет рука дрожать мишень раз попадать 
28103	 тут случаться чудо первый раз жизнь попадать пистолет мишень получать пятерка 
28103	 бить громко сильный отдача разворачивать мишень кусок 
28103	 для бомбист очень приметный мишень глубокомысленный говорить глотать борщ 
