28103	 тот пора пока разрешать способность стандартный система распознавание мишень улучшаться значительно быть существовать 
28103	 поскольку основной мишень болезнь являться центральный нервный 
28103	 поскольку мишень при паротитный инфекция являться 
28103	 неважно как целиться важно как чувствовать мишень 
28103	 ворошиловский стрелок так гордо именоваться мастер попадать мишень 
28103	 почему американец выбирать мишень именно этот островок 
28103	 первый фау последовать второй создавать под руководство отец немецкий ракетостроение вернер фон браун мишень снова становиться великобритания 
28103	 относить кабан венецианец рубинский удача действительно трудно однако проза этот как всегда наш автор настолько самоироничный лишать претензия что упражняться стрельба беззащитный мишень тянуть 
28103	 прицеливаться центр воображать мишень нажимать курок 
28103	 прицеливаться центр воображать мишень нажимать курок попадание фиксироваться сброс 
28103	 часто куда-то отлучаться оставлять леонид наедине отряд там недоразумение возникать потому что подвозить патрон красногвардеец яростно лупить мишень 
28103	 страсть ниже пальба тот мишень давать отделять философия улыбаться федос 
28103	 прямолинейный как винтовка заряжать письмо прицеливаться адрес заряд обязанный попадать цель потому что стрелять неплохо если изменяться положение мишень писать 
28103	 она быть пришпиливать большой лист бумага изображение мишень 
28103	 способ применение местный часто системный читатель узнавать широкий спектр действие орган мишень 
28103	 поведение слегка удивлять марат как удивлять что хозяин синий пиджак оставаться сидеть стол спина вход представлять себя великолепный мишень 
28103	 апрель год малый ракетный корабль муссон быть поражать учебный ракета мишень атака который должный быть 
28103	 апрель год ракета мишень стриж запускать российский 
28103	 пускаться наутек отсюда очевидно решать быть больше мишень кто-то невидимый спасать 
28103	 этот мгновение подручный часовой вышка поймать таки прожектор долгожданный мишень 
28103	 кто-то интересовать мишень под название блуждать кабан кто-то 
28103	 стрельба двигаться мишень двигаться транспорт 
28103	 нужно поражать весь мишень который возникать твой путь 
28103	 самый конец доска слева она метр десять выскочить мишень савелий давать она 
28103	 легко перемахивать грязевой яма поражать ход мишень 
28103	 этот момент савелий прыгнуть ров вода поражать мишень выскочить метр двадцать 
28103	 это сочетание цифра уже видеть вчера когда одиннадцатый стрелять мишень 
28103	 немудрено что противник большевик избирать его главный мишень злобный нападки сделать его предмет 
28103	 весь трое стоять кучно как один большой мишень 
28103	 мгновенно догадываться что следующий мишень быть девушка 
28103	 хоть что-то ходить голый как мишень 
28103	 это связанный множество новый мишень который становиться известный благодаря открытие 
28103	 если соседний машина стрелок страх открытый ничто защищать кроме боковой стекло мишень 
28103	 нет пока мишень номер один 
28103	 как всякий доходный бизнес особенно сфера денежный оборот банковский пластиковый карточка становиться мишень для преступный посягательство банка нести 
28103	 восьмерка семерка особенность шестерка вот тот место мишень где находить себя пристанище маленький 
28103	 злость анатолий хотеть было запускать мишень сам пистолет прозвучать 
28103	 говорить что следующий год зачет быть уже два мишень 
28103	 вместо один статический круглый мишень быть выстреливать еще один динамический 
28103	 если простой следующий год вводиться новый зачет стрельба двигаться мишень бежать кабан 
28103	 так называться двигаться мишень вид кабан натуральный 
28103	 мишень двигаться влево вправо появляться 
28103	 может просто очередной мишень бежать кабан который быть 
28103	 быть мишень бежать кабан человек 
28103	 охотник один все мишень все один 
28103	 последний раз глушенков стрелять почти год назад выбивать пять выстрел неподвижный мишень весь тридцать очко 
28103	 чтобы выигрывать этот заяц нужно поражать двадцать мишень подряд 
28103	 она похоже все еще нравиться быть повод для скандал мишень для сплетня 
28103	 связываться рецептор поверхность клетка цитокин инициировать реакция клетка мишень или клетка медиатор что вернее 
28103	 очень часто клетка мишень ответ инициация цитокино 
28103	 вирус корь специфически связываться клеточный комплементрегулирующий белок находить моноцит являться первичный мишень для вирус корь 
28103	 показывать что рецептор являться корецептор для штамм вич тропный макрофаг образовывать синцитий рецептор являться корецептор ответственный успешный проникновение лимфотропный штамм вич клетка мишень 
28103	 так один шаг мишень попадать 
28103	 как жестяной мишень тир корабль становиться переламываться 
28103	 наш белоснежный красавец срочно ход перекрашиваться серый цвет чтобы выделяться ночь вода быть для летчик приметный мишень 
28103	 несколько свой мишень они обнаруживать парная 
28103	 для уверенность гость сделать повторный обход подарить каждый мишень контрольный выстрел голова 
28103	 грянуть выстрел поражать мишень разлетаться осколок второй 
28103	 вновь прогреметь выстрел вновь мишень быть уничтожать фил 
28103	 колумбийский боевик ожидать нападение тот дело становиться мишень для команда феликс потому что 
28103	 подходить мишень стоять штырь являть 
28103	 перед они качество живой мишень стоить соотечественник собрат соплеменник 
28103	 сначала очень долго искренне хвалить свой мишень рассказывать добрый качество 
28103	 этот избитый человек одетый разрывать кровавый рубаха как хусейн стараться узнавать свой мишень 
28103	 если играть рука если уверять себя целиться голова это плохой мишень выбирать тот цель куда легко 
28103	 вообще подозревать что быть мой товарищ любимый мишень для упражнение остроумие 
28103	 гимназистка немного волноваться пальто молча безжизненно водить глаз один лицо другой будто через вмонтировать зрачок оптический прицел некий киборг фантастический фильм фиксировать присутствовать роль возможный мишень 
28103	 скоро все стрелка нужно дождаться когда поле его зрение оказываться много мишень 
28103	 главное единый восприятие они сам как сказать директор делать различие между тот кто одевать военный форма тот кто носить гражданский одежда весь они для ходячий мишень стол поставлять закуска 
28103	 опера кость быть отличный стрелок сейчас требоваться превосходить себя успевать выхватывать пистолет из-за пазуха поражать мишень точно область ушастость 
28103	 политика звезда шоу-бизнес крупный предприниматель делаться мишень клеветник так часто что 
28103	 интересный вопрос что это устройство организм если абсолютно несопоставимый эмоция смерть чей-то там статья обладать одинаковый сила воздействие где гнездиться природа такой устройство ворона особый состояние мой бедный тело который становиться яблочко мишень тогда любой выстрел 
28103	 написать конопляный масло корабль растягивать пяльцы вышивка гладь дубинка дубовый гладкий увесистый удочка пулька финка выжималочка для масло вертелок который обжаривать молодой скворцов мишень который бить обратный 
28103	 необходимость для сильный игрок попадать мишень волан который отбивать слабый 
28103	 бояться что следующий мишень они выбирать школа детский 
28103	 мой мишень что дело что 
28103	 командир приказывать устанавливать мишень расстояние один километр 
28103	 никто новобранец выполнять упражнение задеть даже край мишень 
28103	 подавать команда вперед мишень это ваш последний шанс 
28103	 нет стрелковый тир там работать замена мишень гребец говорить приятель 
28103	 зайти городской парк тир поражать все мишень 
28103	 опять пойти тир опять поражать все мишень давать приз плюшевый медвежонок 
28103	 метод иммуноблоттинг использование поликлональный антитело мка мка выявлять белок мишень для перекрестный реактивность 
28103	 для метод иммуноблоттинг выявлять белка нуклеопротеин который являться мишень для поликлональный антитело специфичный 
28103	 метод иммуноблоттинг выявлять белок мишень который взаимодействовать 
28103	 если полностью доверяться реклама женщина переставать быть личность превращаться голый сексуальный мишень 
28103	 при это вариант мишень яагмется рнк 
28103	 зависимость состояние цитоплазма или наличие связующий клеточный белок необходимый предварительный обработка например разбавлять или такой детергент как сапонин тритон также протеолитический фермент такой как пепсин протеиназа для предотвращение маскировка нуклеотидный последовательность мишень 
28103	 после тепловой денатурация зонд молекула нуклеиновый кислота мишень если это необходимый проводить собственно 
28103	 простой способ обнаружение молекула мишень это использование зонд метить флюорохром 
28103	 этот способ можно разделять группа способ амплификация сигнал способ амплификация молекула нуклеиновый кислота мишень клетка осуществлять путем проведение 
28103	 очевидный как прогресс сам метод отношение амплификация мишень направление амплификация сигнал 
28103	 низкоэнергетический бета излучатель геологический практика наиболее широко применяться тритий мишень скважинный генератор нейтрон как 
28103	 этот исследование выявлять наиболее опасный зона поверхность корпус генератор непосредственный близость позволять потребовать разрабатывать гость ост обязательный маркировка место расположение мишень генератор внешний поверхность 
28103	 некоторые боец упа добровольно сдаваться власть вскоре они вместе семья становиться мишень для террористический акт служба безопасность 
28103	 один дело всаживать автоматный очередь или снаряд мишень полигон другой живой 
28103	 быть еще масса человек плохо накормить плохо обмундировывать плохо воспитывать они исповедовать идеал жизнь браток гражданка брать себя пример герой крутой боевик телевизор который день ночь выплескивать казарма матросский кубрик тонна человеческий кровь оглушать восхищенный пацан погон отменный стрельба живой мишень 
28103	 пролетать бешеный скорость где-то заоблачный высь невидимый ракета противник пытаться проскочить мимо наш наблюдательный пункт разный скорость высота самолет или беспилотный мишень молниеносно вырываться ствол пусковой 
28103	 начинать май год последний день пребывание грачев должность лето фигура министр оборона быть излюбленный мишень большой группа журналист представлять издание 
28103	 свой время предупреждать что ландграф это название мишень 
28103	 чтобы игра прерываться передавать мишень свой приятель кассир дело нехитрый 
28103	 снова хамас автобус излюбленный мишень террорист много человек малый 
28103	 даже походить некоторый время тир пострелять там пистолет неизменно попадать соседский мишень 
28103	 карим почувствовать как что-то заклокотать под сердце сейчас мочь позволять себя погружаться розовый туман ярость который можно различать только силуэт враг похожий мишень 
28103	 так павел петрович сидеть кухня автоматически рисовать тарелка творог мишень отмечать попадание никакой план операция 
28103	 чета алагез ясно мишень крупный 
28103	 проникать наделать фигушки ребята мишень самый время обгонять юрин 
28103	 кричать мышкин потрясать воздух размочаливать мишень 
28103	 поздравлять мышкин раздраженно отшвыривать сторона мишень этот снова мухлевать зараза 
28103	 хороший тренировка двигаться так сказать мишень 
28103	 подбирать свой мишень пристально она уставляться 
28103	 пробормотать мышкин засовывать палец злосчастный дырка мишень 
28103	 бандит купить мышкин вытаскивать палец дырка опять бросать мишень под нога 
28103	 мышкин подбирать мишень полагать урна напоминать 
28103	 баба надо сказать мышкин запихивать мишень урна 
28103	 небрежно так один рука мишень лететь клок гусев осторожно приближаться 
28103	 гнуть свой лук для призрачный мишень 
28103	 два шаг увидеть человек ищущий автомат мишень 
28103	 экран мочь проецироваться слайд любой мишень или например изображение противник 
28103	 значительно мало средство потребоваться расходный материал фанера мишень 
28103	 один сторона или делать вид что вообще нет никакой бомба или представлять себя качество мишень другой делать вид как 
28103	 так пример апресян роль место расщепляться два роль посессор часть роль содержание расщепляться мишень аспект периф 
28103	 нельзя тратить движение что должно быть отдавать мысль мысль стрела мысль мишень она сам становиться мысль 
28103	 являться постоянный мишень для тайный насмешка анекдот 
28103	 насколько помнить гусейн рефлекторный воспринимать как мишень все быстро двигаться объект крупный 
28103	 зря они когда поссориться стараться глядеть один тот вещь зато получать мишень бить она последний 
28103	 она казаться что желтый розовый схема учебник иметь много отношение человеческий анатомия чем круговой мишень картонный силуэт который военрук 
28103	 иногда кухня пропадать остаток каша несколько конфета иметься другой убыток вид расхлестать посуда рассыпать коробка пуговица настенный календарь котенок собачонок который маргарита обожать картинка собираться заводить живьем болтаться вверх нога последний кнопка как подбивать мишень 
28103	 оба камуфляжник представлять себя вполне доступный мишень для прямой удар нога 
28103	 прибивать шест фанерный щит который наклеивать мишень подымать этот сооружение вверх 
28103	 прибивать шест фанерный щит который наклеивать мишень подымать этот сооружение вверх 
28103	 нет стрелковый тир там работать замена мишень непридуманный рассказ 
28103	 она включать себя контрольный пункт тир стрельба мишень врач оказание первый медицинский помощь 
28103	 должный понимать что это просто мишень цель 
28103	 жаль только становиться тот китайский творческий работник что поверять приманка сто цветок превращать себя беззащитный мишень маоист 
28103	 диктатор одержимый мания стрельба живой мишень 
28103	 если волонтер находиться мишень использовать назначение 
28103	 правда тут кто-то пускать слух что другой ошибаться тоже стрелять его мишень 
28103	 волос становиться мокрый темный солнечный луч падать теперь словно стрела мишень все темный голова ганна 
28103	 строевой штыковой бой стрельба залп стрельба плутонг даже стрельба одиночка мишень 
28103	 это удивлять потому как мишень одиночка стрелять армейский 
28103	 шагать строй уметь штыковой бой равный оказываться три мишень первый одиночный стрельба 
28103	 страшно чем смешной для пуля как мишень 
28103	 нравиться торчать тупой вид живой мишень предпочитать залегать 
