19615	 наверное человек который хотя немного знать сюжет уже оставаться наверное сделать еще пост где попросить написать свой мнение 
19615	 что-то последовать это пост кто-то реально этот человек 
19615	 вот что удивлять вышенаписанный пост 
19615	 перепрыгин наталья просто что-то сегодня слово путать бетти согласный пост александр кременчуг почему возможно такой 
19615	 алина жена про реинкарнация карма быть пост форум 
19615	 пост помма открывать новый тема помма спасибо 
19615	 жена далее год переставать разгибаться локтевой сустав полагать тушинский детский больница там смочь правильно расшифровывать рентгеновский снимок начинать лечить закупорка артерия связь видеть лечить причем таблетка язва первый неделя есть потом подсматривать название пост сказать его мама 
22320	 март год партия регион выдвигать николай азаров кандидат пост премьер-министр 
19615	 первый седмица великий пост святой патриарх московский весь 
19615	 февраль вторник первый седмица великий пост святой патриарх кирилл молиться 
19615	 утро февраль среда первый седмица великий пост святой патриарх кирилл молиться 
19615	 февраль четверг первый седмица великий пост святой патриарх кирилл молиться 
19615	 вообще можно констатировать что приход пост главный тренер армеец леонид слуцкий 
22320	 владимир путин назначать таймураз боллоев пост глава олимпстрой ждать 
22320	 после продажа евросеть александр мамут вымпелком пост глава компания быть назначать бывший 
19615	 мена власть будущий олимпийский столица для многий эксперт становиться неожиданность мэр анапа анатолий пахомов прочить пост мэр сочи еще полгода назад 
19615	 вероятно недавний отставка евгения муравьев пост первый вице-губернатор быть продиктовать именно 
19615	 исидор получать флоренция пост кардинал папский легат для 
22320	 сильный человек гучков занимать пост военный министр держаться особняком 
19615	 февраль год перед великий пост никон рассылать московский храм 
19615	 во-первых перетрушивать замерзать просто вламываться себя пост сначала чуть приоткрывать дверь 
19615	 пост вахтер хотя быть простор 
19615	 предлагать пойти погреться догадываться что все равный оставаться пост 
19615	 острый необходимость легитимация настоящий время пост современный россия порождать весьма своеобразный 
19615	 эльмар соблюдать намаз весь пост участвовать радение 
19615	 аль акрам абдул начинать еще время вечерний молитва раскалываться темя голова еле добираться дом закат еще стоять его мозг жечь сейчас очень хотеть изнасиловать жена сестра потому что два неделя назад назначать себя пост потому что этот два 
22320	 это быть заслуживать фронтовик человек занимать руководящий пост крым крупный хозяйственник партийный 
22320	 партия коалиция быть формировать федеральный региональный орган исполнительный власть наоборот выдвигать кандидат пост глава государство руководитель регион 
22320	 диссидентский движение против чаушесок начинаться момент его назначение пост генеральный секретарь 
22320	 сменить пост директор киевский политехнический институт профессор 
19615	 пост дежурный сестра освещать как огромный 
19615	 табак арбитр чей бодрый выкрик досаждать немногое мало гвоздь оставаться пост 
22320	 дело практиковаться равенство весь гражданин россия при занятие они государственный пост федеральный уровень 
19615	 это отнюдь новый веяние вспомнить импрессионист фовист пост импрессионист наконец западный куратор интересный 
22320	 архитектор продолжать вести большой общественный работа пост председатель московский архитектурный общество возглавлять 
22320	 всего гвардейский чин получать назначение пост руководитель местный орган власть 
19615	 собственный ежемесячный сто сорок пять так греть душа что лето собираться покидать свой пост операционный блок хотя поверять 
19615	 тот муха бросать едва подкуривать сигарета понестись пост трубка 
19615	 устанавливать около она индивидуальный пост мочь 
19615	 посадить леночка индивидуальный пост всякий случай хотя 
19615	 очень важно что фазовый переход пост перовскит перовскит понижение 
19615	 весь мир говорить жить сегодня ощущение пост постиндустриальный общество общество постметафизика 
19615	 магомед хазбиев председатель организация мехка кхела называть себя альтернативный парламент ингушетия объявлять что приступать созыв чрезвычайный съезд ингушский народ который призывать москва назначать исполнять обязанность президент руслан аушев первый президент ингушетия который покидать свой пост начало год 
19615	 ворчун государство это некий аморфный зачастую враждебный субстанция конкретный человек занимать конкретный пост действовать определенный интерес 
19615	 автор данный пост нормальный человек рыдать стыд 
19615	 пост про что нельзя зацикливаться 
19615	 искренне надеяться что это пост наш дорого читать 
19615	 кстати вон конец гиперссылкаочень грамотный оценка понимание пост 
19615	 его пост куча дыра так примазывать 
19615	 это пост сменить легендарный мохаммед эль 
19615	 другой сторона если владимир путин посчитать для себя нормальный уходить президентский пост после два срок почему 
19615	 между как сообщать источник прошлый неделя банк москва принимать решение заменять евгений калабин пост гендиректор экс менеджер веда 
19615	 напоминать если что если фотка тут пост писать увлеченно 
19615	 поздно так быть сейчас пост москва намного высоко 
22320	 только потом шаг шаг никита сергеевич разбираться товарищ начинать править единолично это год когда разоблачать антипартийный группа убирать жукова хотя реально становиться доминировать январь после назначение булганин пост председатель совет министр 
19615	 протяжение весь время высокий пост путин при весь кадровый решение 
19615	 суть президент рассказывать какой хотеть видеть страна какой она мочь становиться год если считать тот самый год когда заступать пост 
19615	 трудно отделываться впечатление что медведев обкатывать весь важный пост чтобы получать необходимый опыт 
19615	 испытывать внутренний неуверенность свой талант больная думать что этот пост этот работа единственный для 
22320	 сентябрь заменять генерал гальдера пост начальник генеральный штаб сухопутный войско 
19615	 это совсем близкий садиться пост миротворец 
19615	 это доносить буквальный смысл слово донос непосредственно сталин владимир ставский самый бездарный весь побывать пост генсек союз писатель 
19615	 накануне этот знаменательный день деловой жизнь переходить повседневный ритм ритм особый продиктовать приближаться окончание пост возрастать спрос подарок 
19615	 век обязательный считаться исповедь раз год время великий пост 
22320	 самый начало славный сказочный романтический девяностый год коллектив комсомольский работник занимать руководящий пост городской комитет всесоюзный ленинский 
22320	 при это успешный менеджер это часто тот кто зарабатывать много деньги или занимать более высокий пост тот кто самостоятельно решать 
22320	 сам талейран ходатайствовать истинный француз хотя уроженец корсик быть даже предлагать пост министр внутренний дело 
19615	 уманский искать полезный знакомство хотя через дочь она тянуться ощущать себя взлет жаждать возвышение новый пост устраивать нина 
19615	 ага особенно что значить новый пост просто хотеться возиться 
22320	 говорить когда подрастать занимать руководящий пост быть проводить свой политика 
19615	 алексей иванович уже начинать понимать ждать спасение маленков через семьдесят пять день получать засушивать как листик гербарий пост зампред совмин рсфср через 
22320	 назначать начальник шугнанский пост штаб который располагать 
22320	 одновременно пост директор фсб покидать другой лидер 
19615	 быть чиновник выполнять свой функция сообразно занимать должность или начинать переделывать пост под себя последний 
22320	 быть информация что либерал добиваться отставка сечин пост заместитель глава президентский администрация 
19615	 время ход желтиково наугольный изменяться значит вариант осаживание пост наугольный отпадать 
19615	 повод дмитров пост узнавать кое-что 
19615	 девочка куда красивый списочек деваться первый пост 
19615	 новый форум его после такой пост модератор выкидывать два счет 
19615	 новый форум его после такой пост модератор выкидывать два счет 
19615	 будущий жена маринкин пост видеть конечно она наш 
19615	 будущий жена исходить пост отрицательно они настроенный человек 
19615	 талит этот десяток пост подробный описание что 
19615	 аська исходить пост отрицательно они настроенный человек 
19615	 можно даже более общий образ сформулировать что это пост иметь отношение лично 
19615	 многий участник тот дискуссия технический сторона дело интересовать мнение быть вполне стиль ваш пост власть 
19615	 тут ещеуточнять уточнять извинять добираться пост поздно ведьн так 
19615	 весь класс переться так каждый второй пост этот училка каждый день 
19615	21584 последний раз смотреть скорость быть вообщий вообщий замечать из-за крик усталость знак писец пролетать пост гибдд гаишник бежать тормозить 
19615	 приезжать пост они начинать говорить что какой 
19615	 мой мировоззрение вообще ничто запрещать быть что-то после физический смертит узнавать что сейчас гадатькаждый свое говорить многий здесь мало говорить что бессмысленно спорить этот тема основываться что несколько предыдущий пост хотя быть человек мой знакомая 
19615	 мой мировоззрение вообще ничто запрещать быть что-то после физический смертит узнавать что сейчас гадатькаждый свое говорить многий здесь мало говорить что бессмысленно спорить этот тема основываться что несколько предыдущий пост хотя быть человек мой знакомая 
19615	 первый пост убедительно просить слепыхна 
22320	 только третий попытка под угроза роспуск дума ельцин проталкивать кириенко пост председатель правительство 
19615	 история россия один правитель добровольно покидать свой пост 
19615	 как-то упускать вид что среди диспутант находиться многолетний московский корреспондент вашингтон пост боб хайзер 
22320	 менее они продолжаться прежде все усилие ава кривошеино занимать май год пост главноуправляющий земледелие землеустройство александр 
22320	 четыре день новый год трепов пост председатель совет министр сменить старый 
22320	 реальный власть сосредотачиваться рука ненавистный общество иго щегловитов получать январь пост председатель госсовет протопопов который 
19615	 вернуться через пара день сентябрь собирать министр объявлять они царский воля все оставаться свой пост заседание дума прерывать поздно 
19615	 слух она появляться первый неделя пост кто война никто 
19615	 неудивительный что шлезингер продержаться цру полгода горячий пост его сменить уильям колбить который 
22320	 женщина этот страна занимать видный государственный пост быть наместник провинция 
22320	 тот факт что юридический владелец собственность являться жена выгодный для мужчина особенно занимать пост государственный аппарат 
19615	 чтобы оправдываться добавлять уверенный можно это быть сейчас пост отец клавдий викарий архиепископ помье 
19615	 оцеплять периметр невозможно сплошной болото хотя сторожка пара человек пост распоряжаться пожалуйста 
22320	 есть анисимов считать головин фактический руководитель боярский комиссия ближний канцелярия предшественница сенат что дело быть аналогично пост премьер-министр 
19615	 двор пост батюшка подавиться сказать иначе 
22320	 большинство чиновник весь уровень привлекать следствие вымогательство казнокрадство оставаться безнаказанный дальнейший продолжать занимать пост государственный аппарат 
19615	 короткий всплеск надежда массовый сознание после уход президентский пост ельцин вновь смениться разочарование 
19615	 легкое позабывать едва начинаться пост удовольствие принимать себя 
19615	 этот человек занимать немалый пост обладать огромный возможность один 
19615	 состязательность атмосфера игра главное сознание возможность выбор который связывать теледебаты высокий пост государство мочь становиться сам 
19615	 начальник караул прапорщик дыбовский сидеть прямо земля пригорок располагать чуть высоко склон контрольно-пропускной пост такой расстояние чтобы 
19615	 уважаемый евгений последний абзац ваш пост совершенно неясный 
19615	 так сколько можно большой пост цитировать 
19615	 прочитывать наконец сам пост боже что 
19615	 садовник слушать качать голова потом сказать вчера начинаться пост рамадан четыре час ничего 
22320	 пока новый демократический россия переживать свой медовый месяц пока как казаться весь слой весь класс объединяться содружество быть конец князь лев все представляться хороший глава правительство одновременно занимать пост министр внутренний дело 
19615	 ладно общаться пойти пост посмотреть сказать скорчить тоскливый гримаса 
22320	 теперь вспомнить недавний путинский заявление что положение конституция согласно который глава государство занимать свой пост максимум два четырехлетний срок отменять 
19615	 март при необходимость даже устраивать показательный порка выгонять свой пост несколько козел отпущение 
19615	 стоять себе запасный путь цветочный пост уходить сокрыться 
19615	 понимать боевой воспоминание нахлынуть взор затуманивать неплохо похмеляться ничто поделать раз партия доверять этот высокий пост нужно работать 
19615	 сам сталин нисколько претендовать известность руководство только следить голосование кто какой пост 
19615	 оказываться негодяй намечать крупный военный пост комитет координация что-то 
19615	 только вырывать колода король сорвать весь они банк начисто если этот история продолжаться дело доходить запрос тогда кое-кто слетать пост 
19615	 рыба пост кушать вода каждый день 
19615	 считать наиболее достойный кандидат этот пост широта военный кругозор 
19615	 говорить гагин пост покаяние себя налагать 
19615	 весь это знакомый стоять немного стяжать благодать божий прикладывать усилие молитва пост делание христос так сразу 
19615	 муж формулировка отборный тупость быть забанить юзер оставлять комментарий вот этот пост ввиду что девственность население 
19615	 бек признаваться что пока она узнавать что такой тролль она даже пугаться видеть сотня возмущать комментарий житель германия пост 
19615	 далеко отходить пост патруль двое непонятный 
19615	 хоть билл клинтон суметь вклиниваться между два президент дом буш высокий пост клинтон пока первый 
19615	 если пример главный загрязнитель атмосфера становиться частный автомобиль местный чиновник обязанный решать проблема иначе мэр мочь лишаться пост 
19615	 жена сидеть черный водолазка почувствовать себя опасный отличный пост жена зощенко прямой 
