19615	 светлый тюмень хотеть сразу оговариваться что мой пост имхо начало конец 
19615	 перепрыгин наталья красноярск любой ваш пост отдавать ненависть цинизм 
19615	 ноль кружочек обилие болда создавать впечатление истеричность пост или истовый проповедь 
19615	 хотя автор пост остальное согласный 
19615	 еще раз приводить цитата гиперссылка пост 
19615	 спасибо что находить мой пост орфографический ошибка 
19615	 дополнять свой пост особенность обучение остеопатия разный 
19615	 абрамов александр этот тема второй пост сверху 
19615	 после твой предыдущий пост совершенно все равный что 
19615	 после твой предыдущий пост совершенно все равный что 
19615	 гаишник даже новый должностной инструкция прописывать что типо гражданин иметь право видеосъемка исключение внутренность пост гаи гейский машинка изнутри 
19615	 спорить больше поддерживать как мочь копировать его пост местный форум 
19615	 мавр кстати для приклейка папиросный бумага вполне пойти разбавлять вода пва мой пост архив форум 
19615	 никогда замечать что пост как тележка 
19615	 видеть что коммент твой пост анонс твой новинка разработка тоже 
19615	 леночка всегда согласный умничек поэтому такой как допускать пост 
19615	 адреналин судя ваш первый пост успех тут пахнуть 
19615	 турок сидеть пить пиво ракия такой вот пост 
19615	 тот год великий пост начинаться март 
22320	 год пост генеральный директор российский газета приходить 
22320	 назначать пост директор фсин россия 
19615	 стоить отмечать что г-н фельдман назначать свой пост еще президент рейган являться далеко 
19615	 изначально ставиться как компромиссный фигура лояльный кремль сегодняшний день кремль быть более лояльный кандидат поэтому ради сохранение пост алиев приходиться идти большой 
19615	 мгновенно понимать она запирать дверь лаборатория правда наверняка предупреждать весь пост озабоченно проговаривать маша 
19615	 это промчаться мимо пост минуточка 
19615	 выходец оттуда занимать весь ведущий пост должность наш регион 
19615	 мэр заменять команда весь вице-мэр кроме один смещать свой пост прежний неэффективный руководитель также 
19615	 вместо это садиться любимый компьютер написать живой журнал очередной пост который прочитывать примерно столько 
22320	 июль близкий николай генерал есть богданович писать что кривошеин начинать играть опасный вредный роль мечтать пост премьер или министр внутренний дело 
22320	 также советовать кривошеино самарин пост министр внутренний дело если 
22320	 теперь планироваться заменять маклаков самарин назначать булыгин пост председатель государственный совет игнатьева 
22320	 затем февраль март год раша занимать пост помощник делопроизводитель 
19615	 социалистический для культура соцреалистический начало год когда брежнев перенести тяжелый инсульт оставаться свой пост 
19615	 тот самый часовой оставлять весь позиция окоп пустой противник давно уже обходить фланг вокруг никто держать пост надо 
22320	 марта год результат военный переворот куба быть свергать правительство прио сокаррас тот день быть сформировывать новый правительство глава генерал фульхенсио батист занимать пост президент куба 
22320	 генерал-фельдмаршал вильгельм фон лееб группа армия север гросс адмирал карл деница сменить адольф гитлер пост глава государство быть католик 
19615	 проблема как всегда хватать говорить загайнов сменить пост гендиректор крылатский аналогичный должность 
19615	 что тоталитарный мясорубка даже последний вегетарианский период когда дракон быть великий пост непроходимый запор 
19615	 отделение где лежать выздоравливать адам давно все стихать свет коридор идти только настольный лампа пост дежурный медсестра 
19615	 адам кивнуть знак согласие они катя направляться пятый палата александра проходить пост дежурный медсестра облокачиваться стойка 
19615	 александра чмокнуть адам щека быстро быстро пойти коридор мимо пост катя математика мимо больной 
19615	 все пойти сказать отходить они александр тут чтобы подавлять вдруг накатить тошнота прижимать губа носовой платок пост опять дежурить катя почему-то она 
22320	 еще год накануне вторжение ирак госсекретарь сша колин пауэлл подписывать секретный соглашение абдулла гюль который занимать тогда пост министр иностранный дело 
19615	 цзы закалывать гао здесь дворец для пост 
19615	 удобно все проникать клуб бесплатно когда глохнуть движок электростанция киномеханик занимать двигатель билетерша уже оставлять свой пост дверь 
19615	 такой образ принимать пост врач отдельный железнодорожный строительный батальон 
19615	 даргинец магомедов сменить это пост аварец муха алиев 
19615	 сообщение что горбачев возможно выдвигать свой кандидатура президентский пост честно говорить обрадовать 
19615	 больной разрешать скоромный пища даже пост значит разрешать скоромный мысль 
19615	 пост под стекло телефон весь врач 
19615	 иван алексеевич быть снимать свой пост направлять преподавательский работа 
22320	 запад больше все нарекание вызывать назначение пост министр оборона бригадный генерал ахмад 
22320	 самый старт избирательный кампания позиция юлия тимошенко уже много два год занимать пост премьер-министр быть явно менее предпочтительный 
19615	 этот день сосватывать сергей тигипко пост вице-премьер экономический блок будущий правительство 
22320	 занимать высокий государственный пост страна где государственный 
19615	 муж кстати писать недавно как раз тема друг деньги муж отличный мотивационный пост спасибо натолкнуть интересный мысль 
19615	 саид иначе приходиться архивировать все подряд потом дублировать удалять цитата свой пост 
19615	 жена вкратце пост высоко уже излагать почти все 
19615	 жена принцип чтобы понимать что суть можно быть ограничиваться один пост 
19615	 муж кстати предыдущий пост являться скрытый реклама 
19615	 муж понятно что навальный наваливать сколь частота свой пост амбиция азарт исследователь 
19615	 муж прочитывать название тема первый пост автор 
19615	 весь видимость недолго думать решать что это пост быть перечислять весь станция 
19615	 судя что один пост оппонент г-н прохоров оставаться 
19615	 татьяна новичок ваш компания случайно набредать этот сайт прочитывать ваш пост судя ваш интерес 
19615	 элла писать сайт начинать восьмой час утро тоже нравиться твой пост татьяна 
19615	 сергей далее что фильм хилькевич бордери снимать разный жанр согласный это говориться предыдущий пост 
19615	 так быть масса заболевание похожий астма симптом поэтому сначала врач ведущий удалять пожалуйста пост мочь серьезно навредить 
19615	 смотреть хотя пост если новый книга упаковывать 
19615	 второй вопрос этот пассаж посмотреть график это пост 
19615	 большой удовольствие прочитывать твой пост 
22320	 именно так трактовать наблюдатель назначение пост специальный советник стросс кан заместитель 
19615	 второй событие февраль это стремительный приближение великий пост 
19615	 литургический приготовление пост уже начинаться еще 
19615	 быстро лететь время успевать настраиваться великий пост 
19615	 окончание литургия святой патриарх кирилл поздравлять собираться праздник сретение господний прощеный воскресение пусть благословение божий покров пречистый царица небесный пребывать над все укреплять особенно время великий пост 
19615	 вечер февраль накануне начало великий пост святой патриарх кирилл совершать вечерня 
19615	 февраль понедельник первый седмица великий пост святой патриарх кирилл посещать зачатьевский 
19615	 февраль пятница первый седмица великий пост святой патриарх кирилл совершать великопостный 
19615	 февраль суббота первый седмица великий пост день память святой великомученик феодор 
19615	 появляться сми сообщение что роберт бенмош собираться отказываться свой пост из-за недостаточно высокий зарплата сам 
19615	 впрочем тут преминуть выражать сожаление свой весь директорат повод ограничение размер заработный плата который его слово мешать удерживать свой пост высококвалифицированный кадр 
22320	 закреплять пост финансовый директор руководитель производство 
19615	 спустя год после уход карло радикатить пост гендиректор ооо русский стандарт водка 
22320	 считаться что президент роснефть занимать пост губернатор один регион 
22320	 бывший президент иран мохаммад хата желать вновь баллотироваться пост глава государство июньский выборы 
19615	 молитва пост быть для алексей просто 
19615	 только при такой царь мочь подолгу держаться высокий пост такой яркий личность как ртищев 
19615	 здесь быть напечатать четвероевангелие псалтырь триодь постный молитва начало подготовка великий пост пасха триодь цветной 
19615	 так тихо добираться свой пост хотеть уже набирать номер 
19615	 нет что пост сидеть вересов ужинать михалков смотреть 
19615	 город набирать оборот предвыборный кампания пост мэр который наш меценат планировать 
22320	 год монна занимать пост комиссар планирование 
19615	 просто работать хор над роспев обязательно обращать внимание богословие текст например служба приготовительный неделя великий пост 
19615	 зима путь яхт-клуб видеть как бухта стремительно пересекать байдарка как гребец взмахивать снежный пелена весло как лопасть идти подкрутой летучий карусель лететь как пирс подходить военный катер навстречу выходить другой совершать новый круг патрулирование зенитный батарея наблюдательный пост пво остров замыкать бакинский 
19615	 проходить еще четыре пост каждый предъявлять пропуск 
19615	 итог что мочь сделать молодой полный амбиция биолог чтобы оставлять свой след эпоха постдарвинизм пост днк 
19615	 все должно быть гарантировать что представитель быть замещаться депутатский вакансия для работа постоянный основа руководить пост 
19615	 еще очень хотеться поглядеть свой дракон который толком видеть завтрак обед подавать постель сфинкс который стеречь тоже есть сходить пост 
19615	 выдвигание весь советский пост свой наиболее стойкий преданный 
22320	 собственный вооруженный отряд пешмерг полиция таможня процент весь доход экспорт нефть полный отсутствие иракский курдистан чиновник центр играть сколько-нибудь влиятельный роль наряду это сильный позиция центральный власть пост президент ирак вице-премьер министр иностранный 
19615	 кандидатура медведева навязывать сторона это быть выбор самый путин который как показывать жизнь мочь сохранять себя президентский пост действовать через большинство государственный 
19615	 поскольку нато принцип согласный принимать украина свой состав нет необходимость срочно ускорять практический действие этот направление это цитата его статья газета вашингтон пост 
19615	 такой артистизм увязнуть его маньеризм пост византийство венецианский палитра 
19615	 захватить нацист голодный париж писатель иван шмелев вспомнить молодость теплый укладливый москва как перед рождество пост легкий веселый торговый 
22320	 арсаев сменить пост министр убежденный шариатчик 
19615	 арсаев недолго оставаться быть министр идти ураза мусульманский пост как истинный мусульманин держать 
19615	 стрельба отвлекать жажда голод время вечер проходить быстро лечить кажется строгий пост держать хватить 
19615	 понимать поговаривать кабинет что асланбек уходить вынуждать оставлять свой пост 
22320	 точно так начало май пост министр иностранный дело уходить ахьяд 
22320	 май год кадар резко противиться переоценка событие быть фактически отстранять руководство переходить должность первый секретарь почетный специально для создавать пост председатель партия 
22320	 лиссабонский договор упразднять система ротационный полугодовой председательство вводить пост постоянный президент евросовет 
22320	 дело что представитель племя мехсуд занимать тогда высокий пост армия разведка 
19615	 этот характерный только для минерал называть пост перовскит обладать весьма своеобразный 
19615	 великий пост держать духовник оптина строгий 
19615	 голосок тыкать ухо умный пора уже делить пост хороший шанс 
19615	 вот как описывать николай иванович кареев неограниченный монархия вынуждать быть терпеть около себя самостоятельный корпорация наследственный судья каждый они весь они вместе можно быть пожалуй ссылать куда угодно прогнать занимать пост быть нельзя потому что это 
19615	 недавно глянуть один глаз довольно забавный французский фильмец жак бедняк или жан бедняк что-то такой после ваш пост пазолини это немного моветон 
19615	 доказательство вина послужить его пост интернет неосторожный интервью 
22320	 госдума продлять полномочие сергей игнатьев пост председатель банк россия еще 
19615	 такой человек нужный при любой режим тамаев суметь сохранять пост даже при смена мэр 
19615	 как становиться известно один самый известный топ-менеджер автобизнес оскар ахмедов уходить пост управляющий директор дилерский холдинг гем 
22320	 скандал изгонять единый россия увольнять пост глава администрация президент республика башкортостан 
19615	 давать понимать что разногласие нет лишь позиция гендиректор сергей нетесанов это пост должный сменить александр мелинг 
22320	 этот компания прорабатывать год занимать различный пост руководство отдел продажа 
19615	 колючий друг еще виноватый что написать такой пост 
22320	 хрущев уже несколько год работать партаппарат занимать руководящий пост 
19615	 ведь свой пост они столько получать сколько 
19615	 свой пост они сохранять верность закон 
19615	 этот слой претендовать пост номенклатура 
19615	 уезжать через два день проводить строгий пост 
22320	 пик военный карьера фрунзе приходиться год январь сменить троцкий пост председатель реввоенсовет республика одновременно 
19615	 кот приходиться покорно ждать когда чик соизволять оставлять свой пост 
19615	 кот приходиться покорно ждать когда чик соизволять оставлять свой пост 
19615	 сталин его просьба выполнять перевыполнять снимать год весь вообще пост включая директорство создавать 
19615	 день местный престольный праздник занятие школа прерываться школа работать первый неделя великий пост 
19615	 середина сороковой год его отец петр леонидович капица быть снимать весь свой пост опальный положение жить 
19615	 очень поддерживать мой отец даже самый трудный время когда год петр леонидович лишаться весь свой пост 
19615	 ехать через бесконечный число блок пост который стоять пацан 
19615	 добираться под обстрел большой земля мыться горячий вода паровоз надевать ушивать довоенный наряд устраивать танец под патефон или гармошка прямо рядом эшелон чтобы случай авиационный налет быть пост 
19615	 ведь сегодня ночь наступать пасха можно хоть один единственный хороший дело совершать этот великий пост 
