19615	 вообще приятно читать его пост как змеюки все кусаться 
19615	 вот как-то странно что весь свой пост упоминать мытье пол туалет 
22320	 надо быть просто снова норигтон приглашать пост режиссер хотя после большой 
19615	 пост про как человек развлекаться 
22320	 летний китайский лидер цзян цзэминь подавать прошение отставка пост председатель центральный военный совет 
22320	 это сообщать сегодня китайский столица издаваться сянган информированный газета саут чайна морнинг пост ссылаться китайский источник 
22320	 тогда происходить утверждение пост председатель председатель кнр 
22320	 российский председательство настраивать тесный слаженный взаимодействие посол руперес испания недавно назначать пост исполнительный директор ктид 
19615	 читать пост автор внимательно девочка забываться делать 
22320	 кто этот время занимать пост средний рука госслужба 
22320	 для более оперативный согласование усилие весь силовой ведомство целесообразный чтобы министр оборона занимать пост заместитель верховный главнокомандующий 
22320	 внутренний организационный дрязги очередной перераспределение руководящий пост ощутимо пошатнуть позиция единый россия 
22320	 источник руководство единый россия утверждать что близкий время подавать отставка оба партийный пост 
22320	 руководство отказываться идея вносить госдума законопроект отменять запрет федеральный министр занимать пост исполнительный орган тот или 
22320	 качество корреспондент газета работать год бонна занимать пост заместитель председатель бюро президиум национальный 
22320	 нынешний дума занимать пост секретарь мальцев вести себя 
21584	 год быть реализовывать единый система несение боевой дежурство предусматривать единый для весь часть продолжительность несение боевой дежурство периодичность заступление дежурный смена оборудование боевой пост порядок выполнение личный состав 
21584	 последний год встречать новый год боевой пост 
22320	 отличать фундаментальный знание область экономика политика большой педагогический стаж работа свой время пост ректор монгольский государственный университет несомненно 
22320	 следующий концертный сезон занимать пост художественный руководитель знаменитый оркестр баварский 
22320	 ранее этот пост прочить александр дементьев начальник увд 
22320	 бобровский попадать тот день когда борис грызлов занимать пост глава мвд 
21584	 сержант милиция алексей пост лубянский площадь оперировать сплошь 
36343	 выполнение человек свой религиозный долг частность соблюдение пост помогать задумываться над смысл 
22320	 удивляться тут нечего архитектура как впрочем многий другой область человеческий деятельность пытаться руководить профессионал знаток чей познание этот вид творчество увеличиваться зависимость высота занимать пост 
36343	 так молиться как молиться фарисей стоять храм знать что право стоять этот храм благодарить бог что такой праведный что бог знать что соблюдать пост что знать весь правило 
21584	 этот дождливый вечер городской управление милиция стоять пост вход молодой милиционер степан 
36343	 теперича взять чем господь бог угождать мочь пост молитва 
22320	 что делать ведь нельзя человек служащий занимать пост 
22320	 алексей гордеев занимать пост министр сельский хозяйство посоветовать 
22320	 год занимать тогда пост премьер-министр председатель наблюдательный 
36343	 строго соблюдать пост чем контролировать муж 
36343	 без сюрприз зарубежный поездка премьера сша обед который президент обама распоряжаться приготавливать его честь индуистский традиция премьер ограничиваться стакан вода оказываться соблюдать пост 
22320	 выпускник год борис георгиевич салтыков год занимать пост министр наука технический политика 
22320	 июль год борис георгиевич занимать пост директор июль 
22320	 сразу после окончание университет юнкер заниматься политика год занимать пост министр финансы люксембург 
19615	 муж нет очередь как написать пост 
19615	 муж это создавать сложный контраст быть отдельный пост 
19615	 муж быть большой пост муражечный видео 
19615	 муж она еще быть следующий пост наверное 
19615	 муж весь это быть увлекательный фрагмент видео который пойти поздно отдельный пост 
19615	 муж видеть уникальный присущий только данный местность пункт реализация продукция горьковский автозавод музей который быть отдельный пост 
19615	 господин повертывать назад тема тпа или приходиться пост удалять 
19615	 наверное потом тут написать пост когда она покончить уже наконец 
19615	 если читать по-английски буквально день читать пост один хоумскульный мама канада 
19615	 третий пост про термояд выдерживать 
19615	 александр павлов муж проходить пол год анонимный пост про тупиковый ветвь мой 
19615	 должный врать это сложный этический вопрос бояться однозначный решение ока написать пост цифра обсуждать муж для палатка 
36343	 игумен сергий рыбко миссионер мон делиться читатель портал православие мир рекомендация как избегать ошибка период соблюдение пост проводить угодный бог 
36343	 недолжный соблюдение пост смех слеза ругань празднословие 
21584	 погибать боевой пост причем возмездие что называться обрушиваться 
36343	 даже страх трава приручать неожиданно быстро чтобы поселять его место желание затяжка еще более сильный желание знакомый теперь ненавязчивый легкий щекотка воздушность где-то верхний часть череп который забываться сколько после искупать его соблюдение пост обет работа собственный 
19615	 закон прописывать про социально опасный положение что той написать пост как раз про 
19615	 муж похоже спутывать предыдущий пост материал подложка сам переход 
19615	 муж вопрос что хотеть сказать этот пост автор 
19615	 мит андрей кстати алексей княгинино хороший вопрос прозвучать обсуждение его пост про только власов 
19615	 мит андрей если опубликовывать продолжение пост можно поговорить этот тема 
36343	 для дурак или истукан религия это все показной набожность внешний атрибутика бесчисленный пост обряд вера чудо 
19615	 александра написать пост высоко оля свой школа 
19615	 мит андрей можно даже пост забабахать история один песня 
19615	 мит андрей можно пост написать история один песня 
19615	 мит андрей просто вспомнить раз пост про память цена нефть 
19615	 сегодня наткнуться очередной кусочек информация как надо разжимать эпилептик зуб добавлять пост заодно вот коммент 
19615	 выбирать ваш пост слово невзирая контекст 
19615	 можно только добавлять что взять хотя этот тема нельзя находить пост либерал предложение слово 
19615	 где-то читать что пост это когда угрожать никто 
19615	 пост про интроверсия написать что 
19615	 весь день про ваш пост сегодня думать 
21584	 крутой лестница косогор спускаться командир пост смирнов плотный сорокатрехлетний капитан 
21584	 отглаживать форма начищать ботинок подтянутый фигура четко обозначать строевой стойка командир пост недовольно скривиться какой-то 
21584	 мочь заменять боевой пост практически любой офицер главный командный 
21584	 первый год корабль быть традиция соблюдать отсек боевой пост идеальный чистота что михаил 
21584	 оказываться так заснуть боевой пост спать долго 
19615	 юлия читать пост профессиональный преподаватель историк под ник 
19615	 читать пост заниматься поиск излечивать себя 
19615	 вообще читать пост очень интересный 
19615	 мирьям хайфа наташа мой мысль угадывать слово слово только хотеть написать пост тут появляться твой 
19615	 олег гарина читать ваш пост еще рано тема быть закрывать 
19615	 уважаемый господин четко ясно написать пост жидкостный техника как 
19615	 август прошлый год написать пост федор езеев красногорск 
19615	 мария литвинова жена олег вот читать пост встречаться такой выражение должный 
21584	 столица уфа весь сторона окружать усиленный пост милиция 
21584	 цит бонч-бруевич боевой пост февральский октябрьский революция 
21584	 посуточно находиться боевой пост три старик 
36343	 жена соблюдение пост казаться скучный невкусный 
36343	 настояние духовник алексей уже самый начало царствование издавать указ соблюдение пост посещение храм запрет непристойный игрище 
21584	 кстати умирать можно сказать боевой пост мольберт окружение ученик 
21584	 облегчение вздыхать подумать покидать боевой пост 
21584	 думать сам отец даниил такой отношение казаться странный это ведь быть смерть воин христов смерть боевой пост 
21584	 все ожидать тот число россия что это сугубо американский проект призывать сменить боевой пост полностью дискредитировать себя 
19615	 оставаться гордый одиночество написать пост 
21584	 его место лично награждать себя митька именной оружие или худой конец час внимательность боевой пост вовсе колотить 
36343	 основа его практика употребление прописной буква существовать дореволюционный время устанавливаться полтора последний десятилетие после снятие идеологический запрет современный печать например слово бог господь богородица название религиозный праздник пост пасха рождество крещение троицын день 
21584	 обычно это делать около пост полиция чтобы угонщик приходиться 
19615	 если внимательно читать пост высоко видеть 
19615	 объективно фотоаппарат делать отличный тоже так стоить наезжать это насчет пост про утюг имхо многий модель 
19615	 просто надо давать понимать что родитель где садиться там слезать ооо прямой отвечать мой пост про мой братик 
19615	 быть неплохо если размещать какой-нибудь нейтральный пост про обвинительный заключение
19615	 опять становиться соглашаться твой пост 
19615	 когда читать пост чувствовать точность 
19615	 поудалять мой безобидный пост теперь казаться что 
19615	 сам снимать поэтому мочь проходить мимо это пост 
21584	 шофер иметь спецпропуск автомобиль включать световой освещение только предварительный свисток патруль комендант город пост милиция или доезжать 
36343	 бармен перечислять утверждать что нет бог кроме аллах произносить молитва платить закятт налог бедный совершать паломничество мекка соблюдать пост 
19615	 учитывать ваш пост низко пояснять ребенок хорошо 
19615	 ваш пост трудно понимать что вообще 
19615	 просить воспринимать мой пост серьезно замполит 
19615	 естественно ответ пост высоко анжуля 
19615	 георгий сатаров заявлять факт купля продажа министерский пост белый дом 
19615	 пост гаи прилежно докладывать прохождение 
22320	 для привлечение ответственность лицо занимать занимать высокий пост руководство страна причинять 
19615	 вообще-то пост уже идти как раз 
22320	 затем работать нижневартовскнефтегаз тюменский область занимать ответственный пост башнефть когалымнефтегаз 
19615	 если уже молодой если быть имя репутация или если занимать какой-нибудь мало-мальски значительный пост союз или другой 
19615	 контролер равнодушно отвертываться гаркнуть пост ваня труповозка приезжать пропускать 
19615	 неудача лужков пост мэр должный быть рассказывать сергей 
19615	 если кириенко хотеть реально претендовать пост московский мэр должный оставлять 
19615	 дорога быть знакомый как пост гаи приближаться они 
19615	 это относиться отрывок евангелие который читаться перед пост страшный суд овца 
19615	 это должно быть когда-нибудь быть потому что говорить по-русски все кот масленица должный пост быть 
19615	 такой глухой вечерний час скидывать свой плечо как тяжелый ведомственный шинель весь это серый длинный здание площадь дзержинский весь его пост секретка кабинет несгораемый шкаф тюремный 
19615	 выходной сейчас всюду пост понатыкать поезд скоро 
19615	 расчет быть что часовой зайти они часто заходить склад быть уютно чем пустой длинный мрачный коридор часовой болтать отец дверь коридор быть открывать они видеть свой пост видеть свой 
19615	 конечно великий пост посылать оказия 
19615	 видимость становиться совсем плохой два шаг различать дерево быть отдавать приказ усиливать пост зря 
19615	 потом подходить пора сменять пост разбираться спор два 
19615	 наш общество пост передаваться наследство 
19615	 подходить солдат где ваш пост спрашивать миролюбивый два 
19615	 бессмысленно оглядываться шататься конферансье добредать только пожарный пост там сделаться 
19615	 сцена проникать через зал сбоку через ворота сцена пробираться пост оттуда рампа тихонько 
19615	 вот изволить видеть дело быть этак как сказать солгать великий пост самый ростепель 
19615	 великий пост быть лишь подготовка восхождение 
19615	 пост металл плюс немного прога 
19615	 муж тема огромный как-то кононенка паркер писать огромный пост идиот бороться неоникотиноид 
19615	 муж тема огромный как-то кононенка паркер писать огромный пост идиот бороться неоникотиноид 
19615	 катя викуся приседать рядышком банкетка возле пост охрана 
19615	 леонид быстров муж вообще-то мой пост быть что ирина 
19615	 думать грузинский молодежь садиться фейсбук строчить пост про вовсемвластьвиноватый властьнамдолжный властивсескрывать 
19615	 андрей муж специалист обеспечивать гарантийный пост гарантийный обслуживание высокий уровень 
19615	 павел гавриченков муж лев читать ваш пост про школа впадать уныние 
19615	 анна квиринг насчет делишки сейчас прочитывать пост пархоменко колпашевский 
19615	 либо претендовать высокий пост если грешить дорога либо 
19615	 вместо привычный наш край пост гаи здесь настоящий бетонный дота 
19615	 мужик быть нападать милицейский пост грабить инкассатор иногда рассуждать 
22320	 генерал жорж буланж получать пост министр оборона начинать энергично 
19615	 даже если порошенко яценюк смочь разделять пост они нужно для стабильность 
19615	 два ключевой задача бисмарк пост имперский канцлер быть изоляция франция 
19615	 как приводить избрание ведущий пост лицо настроенный 
22320	 октябрь год хрущев ловко убирать жуков пост министр оборона 
19615	 большинство голос пост отдавать епископ лундский епархия антье 
19615	 крайний мера больше шанс завоевывать желанный пост борьба партия конкурент 
22320	 фейгельман также занимать пост заместитель директор институт теоретический физика 
19615	 поэтому просить иметь вид мой цель рассказывать столько киклоп сколько что киклоп увидеть понимать свой пост 
19615	 раз упоминать полифема добавлять что киклоп быть еще один известный персонаж древность звать чжуан цзы именно это пост почерпать свой выдающийся познание 
19615	 при двор пользоваться доверие сохранять пост благодаря профессионализм 
19615	 наткнуться водопьяновский пост радостно помчаться продюсер 
19615	 бешеный прапор муж чего это бандеровец начинать стирать мой пост 
22320	 почти весь сотрудник глава бывший директор ныне занимать пост президент музей наум клейман подавать 
19615	 нынче пост претендовать четверо николай курмышев проректор 
19615	 как считать много успевать сделать хороший отводить срок ваш пост 
