19615	 местный чиновник недоумевать пост вице-мэр г-н тамаев курировать сфера 
19615	 пост вице-мэр майрам тамаев курировать сфера 
22320	 генеральный директор петербургский редакция назначать александр мискарян который ранее занимать пост руководитель отдел продажа иды работа 
22320	 зурабов сохранять прежний позиция после увольнение пост министр работать помощник 
22320	 марк херд занимать пост исполнительный директор президент 
22320	 марк херд занимать пост президент исполнительный директор 
19615	 указанный количество пост быть справляться объем 
19615	 колючий друг ха-ха пост отлично тоже подумывать написать 
19615	 это пост как видеть роль железнодорожный 
22320	 восемь год медведев занимать следующий ключевой пост заместитель глава аппарат правительство заместитель 
22320	 среди выпускник нпи немало известный человек который разный год занимать руководящий пост государственный муниципальный структура 
19615	 ночь казак выставлять вооруженный пост конный разъезд патрулировать окрестности 
19615	 даже сказать много продолжать между царица когда мой бездарный внучок николай второй соображать хорошо следовать только прочитывать этот книжка назначать владимир ильич какой-нибудь ответственный пост 
19615	 разведчик хотеть сдаваться идти пост боровицкий 
19615	 потом новость сообщать проходить мимо мечеть камень гора там совершать сожжение обливаться бутылка зажимать под локоть костыль как книга камень закуривать вдруг вспыхивать пылать двинуться пост араб думать мешать 
19615	 вместе капица по-видимому быть немало шанс быть назначать директорский пост юнеско ввиду явный симпатия 
19615	 лечить филипп несложно привыкать многодневный пост находить они особый фанатичный 
19615	 грузинский колонна заканчиваться километр через два откуда взяться дорога появляться пост миротворец 
19615	 затем однако пост главред неделя приходить виталий александрович 
19615	 позировать скульптор высматривать пост кремль небо 
22320	 занимать видный пост министерство дипакадемия 
22320	 ама пузанов год занимать пост председатель совет министр рсфср поздно 
19615	 при штаб-квартира памирский отряд быть перенести пост памирский хорог 
22320	 занимать пост начальник штаб турецкий армия 
19615	 окоп противник несколько десяток метр наш боец пост немецкий траншея крик русый 
19615	 слух компрометировать факт байка про потенциальный кандидат высокий пост это верный признак борьба вестись 
19615	 поварово икша кубинка столбовой дмитров пост 
19615	 кубинка поварово икша дмитров пост воскресенск егорьевск 
19615	 два этап при строительство второй путь илейкино ветч ликино руново ястребок жилино бухарово при сокращение объем перевозка санино ратмировый мякинино шматово пост повадин чернецкой дюдьково 
19615	 быть быть пост жилино поезд 
19615	 эльгранд андрюха твой пост понимать 
19615	 поэтому копия ваш пост доступный лента ссылка 
19615	 прочитывать внимательно мой пост никакой хамство повторяться тут нет 
19615	 один пост его нет наоборот прослеживаться защита 
19615	 собственно неинфомированность приводить этот тема автор исходный пост 
19615	 квартира его собственность она как понимать предыдущий пост муниципальный 
19615	 квартира его собственность она как понимать предыдущий пост муниципальный 
19615	 маринкин пост видеть конечно она наш 
19615	 быть еще пост новгородский сообщество предложение 
19615	 пост который упоминать быть очень 
19615	 сходить топ ничто подобный там находить пост убивать возможно доставаться 
19615	 это тоже возмущать почитать пост коммент ужасаться тетка 
19615	 остальноесма предыдущий пост кажется соседний тред 
19615	 писать это предыдущий пост тут ездить 
19615	 итог выходить мой пьяный муж который пойти пост гаи который все дорога 
19615	 гаишник быть шок наверно итог зайти пост там тоже прикол быть 
19615	 вообще никто воспринимать уже пост фактум все становиться проситься 
19615	 твой пост читать урывками спустя 
19615	 извинять по-другому мочь расценивать ваш предыдущий пост 
19615	 топря какой условиях читать пост высоко 
19615	 подр выше пост про отличие воспитание дрессировка 
22320	 преемник столыпин пост председатель совет министр 
22320	 оканчивать александровский царскосельский лицей служить министерство юстиция год занимать пост министр финансы который теперь 
22320	 год гучков занимать пост председатель союз октябрь 
22320	 качество октябрист протопоп занимать пост товарищ председатель государственный дума 
22320	 представлять свой спутник коковцов гучков сообщать что дума формировать правительство который терещенко занимать пост министр финансы 
22320	 витта коковец последовательно занимать пост министр финансы существо 
22320	 пост военный министр занимать прежний заместитель 
22320	 время пребывание витта пост министр финансы государственный 
22320	 январь учреждать петербургский генерал-губернаторство глава который поставлять треп бравый генерал страшный глаз сохранять пост товарищ заместитель министр внутренний дело 
19615	 всякий случай власть выставлять возле клетка милицейский пост 
19615	 вскоре принимать очертание прожектор будка гаи пост беспокойство очнуться витька 
19615	 навсегда успокаиваться идти второй неделя мой пост сухарь быть навалом голод 
19615	 ворота пост охрана домик тянуться огромный 
19615	 единственный момент когда быть очень тяжело когда поставлять очень сложный положение этот конец начало год когда почти официальный его преемник это пост работать первый зам 
22320	 потомок долгий время занимать ключевой пост финансовый аппарат дипломатический 
19615	 быть рождественский пост волконский поесть пустой 
19615	 если король доверять этот важный пост прикладывать весь сила 
22320	 год занимать пост попечитель московский учебный округ что 
19615	 она уже скрываться вид когда рация раздаваться взволнованный голос весь пост ограбить банк улица ильинка 
19615	 говорить инспектор дорожный пост старший лейтенант трошин 
22320	 князь юрий федорович шаховской кавалер орден иуда занимать достаточно важный государственный пост 
19615	 заключение предвыборный борьба пост канцлер германия сентябрь 
19615	 именно телевидение полный мера проявляться сила слабость претендент президентский пост 
19615	 вопрос получение доступ среднеазиатский носитель целое следить контекст предыдущий пост восток дело тонкий 
19615	 оформлять пост прилично линк офсайт оставлять 
19615	 один они отправка бан набивание пост 
19615	 очень интересно быть увидеть ваш пост какой именно данный 
19615	 веселый масленица любить все даже когда приходить пора вычеркнуть прошлое память почти каждый семья неделя великий пост масленица печь блин 
19615	 если профессор экономика ваш фамилия начинаться один первый буква алфавит много шанс получать престижный пост или премия научный достижение 
19615	 вот оттуда пост украинский полицай цитата 
19615	 читать ночь книга издавать после год мой предыдущий пост про средневековый историк 
19615	 черт длинный пост щас выходить попробовать два 
19615	 пожалуйста вернуться мой предыдущий пост мой собака очень хорошо отдресировать 
19615	 русский национализм пост советский пространство 
19615	 фон вымышленный республика северный авария дарго входить состав поминутно пытаться она отделяться автор рисовать взбаламутить кавказ где поток литься кровь где сводиться личный семейный счеты при помощь винтовка калашников взрывчатый прибор где власть государственный пост продаваться что уходить миллион 
22320	 несколько министерский пост занимать социалист меньшевик эсер 
22320	 готовый предоставлять высокий государственный пост например заместитель председатель всекитайский собрание 
22320	 образование медик многий год работать сельский врач сидеть тюрьма свой политический деятельность ныне занимать пост медицинский консультант компания страхование 
19615	 географический положение болотистый остров располагать между малайя индонезия побуждать предприимчивый англичанин томас стэмфорд раффлз договариваться местный султан создание там британский торговый пост 
19615	 киви притаскивать пакетик дескать пост держать 
19615	 асфальтовый дорога вскоре пост переходить проселочный 
19615	 может там наш портрет пост висеть 
19615	 между пост интервал десять кабинет отсчитывать 
19615	 впоследствии дослуживаться пост вице-губернатор бессарабия градоначальник керчь 
19615	 палата быть темно лишь под дверь теплиться желтый полоска свет докатиться дальний конец коридор где быть пост медсестра 
22320	 впервые создаваться пост председатель европейский совет президент 
19615	 подчеркивать что регион должный воспринимать введение новый пост вице-премьер проблема жкх 
19615	 вслед пратс уходить свой пост командующий ввс вмс 
19615	 тормозить как-то пост выезд город гаишник 
19615	 если александр левин все добровольно уходить свой пост канал нужный быть новый продюсер 
19615	 год назад незадолго католический рождество свой пост быть увольнять главный тренер терри 
19615	 летний сергей соколов быть немедленно снимать свой пост 
19615	 таня серый тонкий птица порхать вокруг стол все раскладывать тарелка ехать кинуть она василиса кусок скоромное гусь думать забывать что рождественский пост все притуляться ход 
22320	 александр дмитриевич сменить отец пост директор 
22320	 разве что время отказываться совмещение пост глава государство гроссмейстер ложа 
19615	 например когда год престол восходить отец елизавета король георг его пост гроссмейстер сменить его родной брат 
19615	 вчерашний милицейский сводка доводить как положено весь отделение хотя налетчик китель без погон видеть пост гаи загородный шоссе 
19615	 наш третий спектакль театр приходить тогдашний президент ева перон сменить это пост свой умерший муж 
19615	 браться судить его деятельность это пост целое для культура 
19615	 когда вернуться дом неодобрительно подымать глаз похожий сухой роза старуха сидеть пост дверь уже пора быть 
19615	 поток подсознание вернуться свой пост открывать книга судя вид 
19615	 мочь быть когда другой смена солдат девушка заступать каждый свой пост они идти кино 
19615	 ночь они конечно свой пост расставлять 
19615	 такой пост мочь слово вымолвить 
19615	 весь делать один дело свой место свой пост мера свой сила трудиться 
19615	 шофер приезжать оружие ночевать поселок машина стоять возле склад тут быть наружный пост охрана второй 
19615	 вот что уважаемый партия доверять столь высокий пост платить большой зарплата кормить 
19615	 постный сахарок николай ефимович если сила возможность 
19615	 пост быть таков что красноречие свой 
19615	 хорошо опровергать его предложение снимать пост его сторонник 
19615	 контрольный пост быть тумбочка стул около 
19615	 работа контрольный пост быть легкий человек проходить 
19615	 сам полковник яконов так очень неудобный быть этот контрольный пост ибо весь день отрывать 
19615	 сам полковник яконов так очень неудобный быть этот контрольный пост ибо весь день отрывать 
19615	 миновать пост еще пара дверь заколачивать 
19615	 извиняться возвращаться свой пост подъезд 
19615	 автор этот строка надеяться помещать описание один такой модель так называть машина пост близкий номер математика 
19615	 воля они занимать большой пост когда они выкидывать 
19615	 отец уставать жизнь крупный пост который сидеть 
19615	 два человек два верста пост 
19615	 бандит назначать очень высокий международный пост вот являться 
19615	 что считать некомпетентный вопрос театр достойный занимать мой пост оставлять без ответ 
19615	 ванна сто семнадцатый отдельный пост распоряжаться врач надевать 
19615	 двое швейцар лишь только увидеть бросать свой пост раздевалка бежать 
19615	 сравнительно часто бывать петровский разумовский уже после как переставать ездить туда дача городовой все стоять свой пост только его переводить паровичок 
19615	 двор быть шум отворять окно заборчик батюшка проклинать свой дочь так как надо проклинать обычай православный церковь как анафемотствовать первый неделя великий пост емельян пугачев 
19615	 как иначе понимать постановление местный организация снятие пост этот хозяйственник постановление иметь 
19615	 разве это случайно что они занимать один время важный пост наш партия оказываться потом 
19615	 оставаться брюсов служака который гонять пост 
19615	 положение мой быть более трудный что один известный русский общественный группа один область один армия исключать даже донской выдвигать генерал краснов пост главнокомандующий соединенный сила 
19615	 уезжать великий пост тогда быть снег быть мороз 
19615	 проходить святки проходить масленая этак неделя третий пост карп лукич говорить чтобы 
19615	 только что хотеть помещаться обыкновенный пост свой наблюдение дверь как 
19615	 нужно замечать что устинья федоровна весьма почтенный дородный женщина иметь особенный наклонность скоромный пища кофей через сила перемогать пост держать себя несколько штука 
19615	 все хорошо известно страстный седмица великий пост относиться 
19615	 вот примерно такой опамятование тягучий сон кошмар ежедневный суета греховность расслабленность дух ознаменовывать для начало великий пост 
19615	 весь пост это именно рывок душа 
19615	 самый происходить опыт смертный сон разрушать иллюзия сладость грех ясно показывать где черный где белый давать толчок христос опыт пробуждение душа великий пост преддверие пасха христов давать 
19615	 она нужно еще раз поговорить загадочный демидов чтобы узнавать точно какой палата какой этаж лежать катерина некоторый подробность расположение коридор туалет пост тоже быть необходимый 
19615	 тут она услышать звук шаг дверь голос демидов который церемонно здороваться медсестричка вера пост 
19615	 валентин львович водоем сегодня уходить жизнь как известно хотя сам исполнять исполнять конец быть пост 
19615	 слово евкуров чрезвычайно понравиться идея проверка госслужащий полиграф первый чиновник уже лишаться свой пост проваливать тестирование 
19615	 два лишний год служба враг муж катерина ничто антинародный свой пост предпринимать 
19615	 коупля лидер лейборист лондонский городской ассамблея заявлять что борис джонсон уходить свой пост оставлять город еще большой 
19615	 сергей мурашов муж заодно можно считать иллюстрация анна квиринг можно многий храбро лайкать пост сергей мурашов муж вот 
19615	 стас табацкий муж вот находить тот пост этот задача 
22320	 при это назначение пост директор новосибирский театр опера 
19615	 максим покровский муж что возобновлять свой заметка очень интересный приятный пост каково пользоваться услуга 
19615	 они учить свой ребенок школа университет франция время передавать свой пост этот ребенок тот хотеть 
