31219	 все бросаться глаз изменение окраска цветок гвоздика астра она становиться темно 
31219	 следователь она заслонять мамин букет василек львиный зев гвоздика 
0	 каждый щит быть обойный гвоздика прибивать жестяной инвентарный номер 
31219	 сейчас гирин замечать ее маленький туфля высокий гвоздика следовательно она несколько мало 
0	 резиновый шланг он трубочка петля сначала спускаться гвоздика пол 
31219	 она виднеться полка ларец украшать позолотить гвоздика лежать книга переплет 
31219	 мартышка нести рука зонтик сумочка букет красный гвоздика 
31219	 еще давно бабушка сказать она гвоздика цветок революция 
31219	 старик кивнуть мальчик который рука быть букет красный гвоздика 
31219	 пожаловать сюд амуниция я она гвоздика определять 
31219	 утыкать лицо букет полевой гвоздика она мчаться луговой тропинка 
31219	 переговоры цк он приезжать смокинг красный гвоздика петлица 
31219	 ребята нести пахнуть полевой свежесть ромашка колокольчик фиалка гвоздика василек 
0	 он бросать одежда нога жена погрозить кулак сторона пруд где пожарник суетиться пожарный насос василий рушничок там гвоздика валенец еще забормотать катерина 
31219	 улыбаться клавдия николаевна георгин гвоздика роза она ласково поглядеть 
26662	 кг гриб стакан вода г уксусный эссенция г уксус г соль лавровый лист перец гвоздика корица 
31219	 она называть дрема ночной красавица гвоздика пастуший сумка копытень мыльный корень 
31219	 большой бульвар одурять запах золотой мимоза привозить ницца парижский фиалка розовый гвоздика 
0	 все становиться уговаривать он он ходить гвоздика слушать хотеть 
0	 семен понадобиться гвоздика вколачивать он совершать неслыханный 
31219	 этот строка случайный беглый воспоминание поклон тот далекий сторона небо вода лес красный гвоздика душистый майник человек там 
0	 четыре час день петербург проспект красный зоря появляться странный объявление небольшой серый бумага листок прибивать гвоздика облуплять стена пустынный дом 
31219	 опираться локоть вася рассматривать хорошо этот кучка сказать гвоздика некуда девать мама обещать коробочка 
0	 спрашивать кандыбин доставать рот новый гвоздика вкладывать он дырочка 
0	 прибивать гвоздика висеть стена лист белый 
0	 он сколачивать он маленький гвоздика выкрасить чернила поставлять сушить 
26662	 сведение выработка я получать каждый час добавлять мэнеджер повесить бумажка гвоздика 
31219	 дикий гвоздика окрашиваться темно-коричневый зеленый полоса 
0	 он подходить часы вделывать башенка постучать ноготь циферблат так сбоку час медный гвоздика висеть ключик он взять он 
31219	 воображать весь стол усыпать гвоздика резеда роза 
31219	 двести куст роза высаживать здесь колонист еще осень сколько здесь астра гвоздика левкой ярко красный герань синенький 
31219	 поддевка удобно раскидываться кресло ладонь подпирать задумчивый седеть голова столик проходить сборщик красный гвоздика 
0	 тусклый освещение висеть стенной гвоздика лампа коптилка я видно он 
31219	 зайти побриться купить цветок гвоздика фиалка купить засахаривать каштан 
31219	 студент вынимать горшок стебель который два распускаться гвоздика один бутон 
31219	 она исписывать истыкивать флажок гвоздика исчерчивать гордый луч графически 
31219	 становиться они красный лента просить мы они бросать все иметь красный цветок гвоздика стоять я первый 
31219	 простой цветочек дикий попадать один букет гвоздика 
0	 иногда пропадать шляпа оказываться калоша важный гость прирастать пол он увлекать прощальный беседа замечать они прибивать пола гвоздика 
31219	 луна просвечивать облако женский ножка модный ажур писать эгофутурист шершеневич доходить такой галантерейность могильный червь торопиться свежий труп величать франт фрак гвоздика петлица спешить званый 
31219	 смерть актриса приезжать она двоюродный брат какой-то веселый легкомысленный актерик гвоздика петличка неимоверно надушить 
31219	 многий завод рабочий требовалм вмеето ромашка красный гвоздика 
31219	 сейчас дюферля букет белый роза середка черный гвоздика 
31219	 хорошенький лиза кокетливый костюм французский цветочница старательный раскладывать большой поднос обвивать дубовый лист бутоньерка роза махровый гвоздика рядом она милочка 
31219	 весь белый пучок розовый гвоздика волос она казаться сегодня 
31219	 она быть костюм красный шапочка колено лежать букет чайный роза розовый махровый гвоздика 
31219	 зеленый сочный трава пестреть фиолетовый колокольчик полевой розовый гвоздика голубой незабудка ландыш 
31219	 зеленый луг тот пора отжелтеть курослеп выкидываться забагряниться липкий луг гвоздика забелеть ромашка овес 
31219	 он лиловый медвежий ушко красный кашка гвоздика богородицын трава желтый нечто 
31219	 д являться заседание традиционный красный гвоздика петлица г 
31219	 характерно вчера пуришкевич возмущать красный гвоздика петлица 
31219	 спрашивать уго поправлять красный гвоздика петлица 
31219	 уго орсинь красный гвоздика петлица бледный безбородый 
31219	 она она сейчас сказать гвоздика голова она просить унижаться 
0	 четыре длинный сквозной комната еле освещать коптеть красноватый свет четыре жестяной ночник висеть каждый взвод стена ручка гвоздика 
31219	 прочее я получать совершенно любовный письмо париж говорящий она молчать весь дорога думать я она хранить мой засыхать гвоздика молитвенник она уже 
31219	 зеленый гирлянда дубовый лист перемешать букет астра георгин левкой гвоздика обвивать спираль ее стальной корпус 
31219	 захотеть налагать арест запрещение мой движимый имущество премного я обязывать движимый я орден анна два гвоздика тот похищать таможня 
31219	 сперва он она угол гвоздика приколачивать чуть натягивать так 
31219	 расхаживать я расхаживать весь этот машина орудие статуя великий человек подумать я тот пора такой выходить приказ вместе исчезновение какой-либо народ лицо земля немедленно должно быть исчезать хрустальный дворец весь то тот народ выдумывать наш матушка русь православный проваливаться мочь тартарары один гвоздика один булавочка потревожить 
26662	 он разводить кофе сахарный тростник мускатный орех гвоздика кардамон красный перец т 
31219	 основа составлять серый гранитный камень образовываться терраса уступ соседствовать миниатюрный хвойник многочисленный очиток камнеломка низкорослый колокольчик гвоздика 
31219	 в московский время мы лида ренова подоспевать загс букет нежно-розовый гвоздика где уже ошиваться игнатова даша 
31219	 там быть нарцисс тюльпан анютин глазок незабудка колокольчик ромашка флокс пион ирис василек крокус гладиолус еще георгин астра табак фиалка маргаритка мак ноготок китайский гвоздика роза люпин лютик тигровый 
31219	 сам приглашать помнить хорошо официальный часть встреча посвящать неудачный иберийский кампания легендарный венгерский генерал мат залка оканчиваться вокруг оставаться самый любопытный дотошный детишки семидесятилетний холерик понести красногалстучный слушатель их великий страна ее героический прошлое такой отчего запылать революционный гвоздика весь колюнино личико 
26662	 взять кг белый патока г мед г корица бутон гвоздика чайный ложка молотый имбирь 
26662	 приготавливать точно тот разница уксус прибавлять корица гвоздика эстрагон вершок корица 
26662	 тогда очищать окорок нож подрезать верхний кожица отворачивать она наполовину нашпиковать красиво гвоздика полоска клеточка посыпать один 
31219	 кожа она мочь быть далеко близко край вырезать фестон жир украшать гвоздика натыкать наискось 
26662	 это быть светлый благоуханный рай исполнять аромат корица кардамон гвоздика ваниль 
26662	 композиция классический сочетание болгарский роза удовой дерево дополняться свежий аромат сочный мандарин апельсин калабрия пряный гвоздика пикантный черный перец 
31219	 срезать гвоздика роза хризантема лежать черенок 
31219	 они туфля шпилька рука они гвоздика тот слева красивый 
31219	 удочка толстый мужской рука леска наматываться кованый квадратный гвоздика 
0	 мы большой комната стена висеть черный круглый тарелка репродуктор низко петелька гвоздика ромбик керамический плитка черный 
31219	 она уже занавеска скрываться я все махать наверняка щелочка глядеть работа конфета купить гвоздика шампанское роковой ошибка 
31219	 он держаться хороший знакомый лучезарный улыбаться держать один рука букет гвоздика другой черный кейс 
26662	 это быть светлый благоуханный рай исполнять аромат корица кардамон гвоздика ваниль 
31219	 красный гвоздика убеждение екатерина андреевна быть 
31219	 мама рассказывать когда-то давно служительница коршун набрасываться женщина туфля каблук гвоздика заставлять надевать специальный войлочный 
31219	 роза быть красный гвоздика кулак пролетарский 
31219	 играющий разделяться соответственно армия роза армия гвоздика 
31219	 мальчишка поступать следующий образ брать рукоятка сломать клюшка выпиливать торец выемка вставлять туда фанерка ударный лопатка приклеивать их эпоксидный смола обматывать изолента иногда крепость пробивать гвоздика такой клюшка хватать 
31219	 гоша послушно выжигать дощечка поздравлять папа февраль цветок гвоздика что аккуратно слагать прибор 
0	 лысый блестящий голова отдельный волос россыпь родинка устало прикрывать глаз опускать уголок губа принадлежать сапожник чадровый улица фартук зажимать колено колодка губа блестящий гвоздика он глухо страшно колотить 
31219	 тот гвоздика веревочка мир упасть 
31219	 каждый стул цветок рука нога глаз ухо уходить такой веревочка один гвоздика 
31219	 особенно нарядный высаживать фон мелкий крупный гравий декоративный лука полынь седум тысячелистник бадан эрингиум коровяк герань гвоздика 
26662	 вернуться парусник доставлять тонна корица мускатный орех гвоздика 
26662	 технический культура также разрешать генетически модифицированный лен декоративный гвоздика 
26662	 бутылка л красный сухой вино гвоздика 
26662	 кг тест достаточно бутон гвоздика молот вид суп 
26662	 сухой редька толочь просеивать сито затем заливать патока добавление перец мускат гвоздика 
31219	 прошептать поражать сатана глядеть кто-то спокойно покупать пакетик тут парапет стоять два величественный полицейский гвоздика петлица дымить ароматный 
26662	 так написать рувим израилевич он набивать четвертушка антоновский яблоко гусь они добавлять гвоздика индия черный перец 
31219	 марина дочка являться госпиталь букет гвоздика 
31219	 девушка пышный платье колено туфля гвоздика стоять стул гостиная 
26662	 придание аромат последний этап варка добавлять несколько бутон гвоздика кусочек имбирь 
31219	 быстро заполнять расщелина камень колокольчик ложечницелистный гвоздика травянка армерия приморский 
31219	 трещина прожилка жеода можно обнаруживать кристалл кальцит срастаться пучок напоминать хризантема георгин гвоздика 
31219	 подъезд максим извлекать пальто букет гвоздика 
31219	 первый операция я лежать еще почти недвижимый саша приезжать навещать я привозить гвоздика порог утыкаться взгляд 
31219	 я преподносить скромный букет полевой цветок один гвоздика это радовать гораздо много 
26662	 современный хозяйка делать он так горячий чай вино сахар гвоздика корица лимонный сок апельсиновый цедра 
31219	 лето сменять друг друг цвести рододендрон роза лилейник флокс дельфиниум гвоздика георгин 
31219	 закричать август впереди показываться каменный стена малин схватываться поручень закрывать глаз замирать ожидание всесокрушающий удар мгновенно оглохнуть грохот визг открывать глаз увидеть плыть нежный голубоватый розовый марево купол звезда хайдарабад свой дочь живой любимый услышать протяжный музыка вызывающий дрожь почувствовать запах цветок роза магнолия гвоздика пионов запах горелый 
31219	 розовый облако герань кровавый красный лиатриса колосковый гвоздика перистый 
31219	 кто-то раздавать два гвоздика постоянно звонить мобильный телефон опера 
31219	 особенно эффектно выглядеть сорт темно пурпурный бархатистый цветок общество нежно-розовый махровый гвоздика садовый плотный куртинка который образовывать 
26662	 вино вода сахар корица гвоздика нагревать первый кипение давать 
31219	 привлекательно выглядеть крупный куртина благоухать лаванда хоста зибольд мощный фактурный лист серебристо-серый подушка сантолина гвоздика перистый 
31219	 дочь уезжать она все раскапывать этот гвоздика кипа старый газета какой-то 
26662	 жаркое получаться более пряный можно полагать мешочек марля специя гвоздика эстрагон кинза базилик тушить 
31219	 мой самый любимый магазин где гвоздика гаечка прочий инструмент 
31219	 ворох мятый газета журнальный столик пульт телевизор почему-то лежать вверх нога экран телевизор слой пыль сверху белый вязаный салфеточка который стоять ваза подзавядший гвоздика еще один пульт видеомагнитофон 
31219	 один день девушка козерожица порадовать белый нежный гвоздика другой она быть 
31219	 один прекрасный зимний день мы выходить двор почти цитата обменять рубль гвоздика направляться куда глаз глядеть 
31219	 тот момент я собираться заниматься привычный цветоводство помощь любимый акация гвоздика гиацинтов синоптичество 
26662	 гайлардий гелихризум сухоцвет гвоздика годеция душистый горошек дельфиниум капуста 
31219	 здесь высаживать манжетка обыкновенный колокольчик широколистный шалфей луговой смолевка поникать гвоздика фишер мак самосейка кровохлебка 
31219	 тот отчаянный национал большевичка который букет гвоздика отхлестывать породистый лицо английский герцог 
31219	 календула гвоздика полуувядший роза короткий 
31219	 здравствовать евгения иван протягивать она три гвоздика я извиняться прошлый раз 
31219	 вернуться барсуков забывать мы кресло рядом искусственный гвоздика 
31219	 ус щеточка накрахмаливать манжета воротничок стойка гвоздика петлица непременно папироса 
31219	 восьмидесятый год городской власть взять попечительство могила легендарный гонщик тот пора ежегодно день его гибель она возлагаться тринадцать роза гвоздика счастливый число бернд розмайер 
31219	 астра настурция гладиолус анемон магнолия флокс гвоздика лилия роза ромашка василек анютин 
31219	 он встречать букет гвоздика три человек теперь уже знакомый 
31219	 приезжать букет розовый гвоздика перевязывать красный ленточка 
31219	 гвоздика бывать мила сердце человек 
31219	 несколько поздно мы она играть кухня скрабль мой жена дочь тихонько пойти купить карминовый камейно розовый гвоздика вернуться перемешать белый 
31219	 этот время один девушка ударять он лицо букет гвоздика 
31219	 так стоить вешать ключ гвоздика дверь бросать 
31219	 водосточный труба быть ячеистый стебель гвоздика мой трость 
