31219	 проделывать несколько похожий опыт магнит стальной гвоздика можно убеждаться наш 
31219	 прошлый сезон законодатель цветочный мода германский цветок год быть объявлять гвоздика 
31219	 освещать место быть хорошо расти гвоздика травянка 
31219	 рама внизу самый стекло протягивать шнурок средний толщина прикреплять булавка мелкий гвоздика оба его конец опускать 
31219	 этот растение прекрасно сочетаться лук христоф шуберт котовник молочай эхинопсис шалфей тимьян гвоздика очиток 
31219	 большой интерес представлять почвопокровный многолетник который относиться разный низкорослый вид форма очиток гвоздика колокольчик резуха флокс шиловидный качимый 
31219	 я отхлебывать жидковатый горячий вино оно слабо пахнуть гвоздика смотреть гора 
31219	 кожа белеть морщиться напряжение он шаг шаг прихватывать она край гвоздика протыкать шило сшивать 
0	 список значиться гоголь прутков бах глинка гамсун гвоздика висеть серебряный карманный час под 
31219	 ты этот гвоздика я это 
31219	 тянуть он этот шарик гвоздика указывать маня гейдеко 
31219	 другой сторона облик гвоздика ее плотный тонкий ножка 
31219	 сильно разрастаться культура дюшеня индийский гвоздика травянка очиток едкий 
31219	 издательство я встреча кнут там буфет он раскручивать я небольшой банкет поэтому домой я прийти поздно огромный букет розовый гвоздика 
31219	 базар любой восточный страна похожий один другой разнообразие товар можно купить весь ржавый гвоздика ракета носитель космический спутник 
31219	 идти приветствие свой скамейка он вдруг обнаруживать себя рука букетик красный гвоздика 
31219	 я поднести несколько гвоздика я попрощаться зал сгребать 
31219	 вбивать я один гвоздика туда куда надо 
31219	 два тройной гвоздика зачем мы 
31219	 ехать значит ехать замечать самый низ перила гвоздика торчать 
31219	 много они чересчур больше все гвоздика 
31219	 они человек никогда видно доводиться томно нюхать мочалка мытье бутылка принимать она махровый гвоздика 
31219	 я сметь они канавка полагать могила свежий гвоздика 
31219	 надо отдавать должное осип потому он этот случай честно стараться отделываться шоколадка гвоздика получать другой зрительница пока 
31219	 левый подставлять чурочка правый острый сапожный нож разделять стукать он этот самый правый чурочка пластинка тонкий гладкий высота будущий гвоздика 
31219	 желтый твердый гладкий кромочка кант два ряд деревянный гвоздика 
31219	 кругом душистый роза гордо изгибаться тонкий стебелек тянуться кверху стройный белый лилия нарцисс гиацинт ландыш гвоздика все это ярко пестреть 
31219	 повесить я гвоздика уборная весь задание 
31219	 ты опять трезвый звездить ты гвоздика вставать стоять смотреть 
31219	 они просыпать рассвет черный кролик пушок забегать город свой дело увидеть мостовая гвоздика 
31219	 именинник гвоздика хризантема роза очень 
31219	 вбивать гвоздика обвисать темный одежда 
31219	 ты хороший рассказывать мы откуда ты этот симпатичный гвоздика 
31219	 конец конец марлен михайлович отодвигаться пишущий машинка становиться тупо ждать заканчиваться проклятый гвоздика 
31219	 постоять примериться вынимать гвоздика ус потихоньку постукивать вбивать 
31219	 правда первый ночь я проваливаться пол гвоздика держать мешковина проржаветь 
31219	 александр петрович полагать деньги стол прижимать сверху пакет гвоздика 
31219	 они прикалывать лацкан стариковский пиджак искусственный хорошо сделать гвоздика 
31219	 фридрих малкин два конец два кольцо гвоздика загадка вынести заголовок статья 
31219	 кума стягивать голова камлейка повесить гвоздика 
31219	 все это быть народ видный всегда чисто выбривать умело закручивать ус они вовремя мочь поднести свой дама пучок красный гвоздика какой женский сердце 
0	 так они трижды обходить громада монастырь что баран отводить стена где толща ее быть устраивать закапчивать камин лежать полешко буковый дрова кованый гвоздика висеть шампур 
31219	 какой удовольствие взять повесить гвоздика завал хлам 
31219	 мочь быть это несгоревший косточка мочь быть гвоздика гроб 
31219	 я сам забивать доска гвоздика повесить этот икона я 
31219	 распространять мнение вещество сильный запах гвоздика перец чеснок хрущак вредить 
31219	 два маленький хитрость гвоздика палец мартовский номер 
31219	 этот недостаток легко устранять фильтровальный гвоздика изготавливать фторопласт 
31219	 такой исторический краеведческий музей который начинаться стеклянный витрина где гвоздика развешивать позеленеть время медный 
31219	 зачем труба почему гвоздика веревка висеть почта 
31219	 труд перевертывать опрокидывать шахматный столик вынимать филенка гвоздика потянуть себя крышка 
31219	 отскорлупать я яйцо замолоточивать этот гвоздика бумага откнопкаться 
0	 я гвоздика он заколачивать я табуретка они 
31219	 потом я привыкать тяжесть запах тубероза роза гвоздика другой неизвестный я цветок тропики 
31219	 пульт экран по-прежнему лежать букетик гвоздика 
31219	 я помнить вы еще качество один распорядитель большой аудитория политехнический музей вы студенческий сюртук гвоздика петлица объявлять выступление 
31219	 бесшумно переступать порог повесить гвоздика дверь свой заплечный мешок 
31219	 книга источать острый запах лизол гвоздика 
31219	 тот пора этот запах становиться я признак вязать скука особенность запах гвоздика черный похожий маленький обойный 
31219	 вновь погрозить собакин я вынимать весь гвоздика свертывать полотно трубка 
31219	 каменный променад казино видать вид пожилой цветочница лиловатый бровь ловко продевать петлица какой-нибудь потентат штатское тугой дуля гвоздика он скашивать взгляд она 
31219	 гвоздика мы отвечать отвечать бублик 
31219	 этот разговор видно первый быть тот который гвоздика еще успевать насолить как 
31219	 тяжелый скоба крохотный еле палец удерживать гвоздика сразу появляться ящик 
31219	 впереди полк два солдат нести один грандиозный букет цветок каждый батальон каждый рота нести букет грудь каждый офицер букетик гвоздика дуло каждый винтовка 
31219	 задний парта где сидеть толстый васяток тоненько настойчиво нестись гвоздика 
31219	 он перебивать острый приторность запах гвоздика 
31219	 поставлять новый изба катерина отыскивать сохраняться фотография егор все их мелкий гвоздика приколачивать передний угол 
31219	 целовальник приказывать сынишка перевязывать сапог лычко повесить вбивать чан гвоздика 
31219	 один разворачивать танк торчать нога серый обгорать обмотка толстый башмак подбивать стираться железный гвоздика 
31219	 они общий нравиться чужой чудачество деловой бумага писаться стих природа отложной ворот гвоздика насморк лягушка обратный билет 
31219	 причина поломка оказываться один гвоздика несколько год то назад второпях 
31219	 этот гвоздика сырость давать постоянно ржавчина 
31219	 сделать пропеллер надо вбивать катушка два гвоздика шляпка 
31219	 сидеть паркетный пол никифор клещи выдергивать рамка гвоздика фанерный крышечка выпадать сам 
31219	 мать молодой большеглазый пухленький щечка взять кепка его рука повесить гвоздика потом улыбаться я 
31219	 третий восемь чарка он романея ренский медов малиновый смородинный обарный три кружок паточный гвоздика ведро день паточный 
31219	 павка уставляться глаз потрескаться половица внимательно изучать высовываться шляпка гвоздика 
31219	 его лицо круглый розовый иметь явный семейный сходство председатель голубой гвоздика 
0	 гвоздика висеть пальто порыжеть время 
31219	 посмотреть я глаз гвоздика спрашивать 
31219	 группа нарядный дама тот сторона улица расходиться сторона отягчать охапка гвоздика мимоза розанов нарцисс миндальный 
31219	 я однажды вбивать гвоздика потолок сгибать проволока привешивать 
31219	 дряхлый лошаденка подпрыгивать пролетка тащиться свешивать голова пьяный актер судорожно зажинать кулак гвоздика 
31219	 шататься торчать дерево наполовину выскочить гвоздика 
0	 мишень гвоздика он прикреплять находить письменный 
31219	 одевать вкус возраст средний непременно пенснэ черепаховый гребень прическа держать себя солидно культурный придираться так отставать инструмент кусачка вцепляться гвоздика 
31219	 любить цветник николай степанович уже алеть гвоздика пахнуть левкой 
31219	 тихий ветер сонно веять тихий мутный ока качаться золотой лютик отягчать роса лиловый колокольчик немотно опускаться земля разноцветный бессмертник сухо торчать малоплодный дерн раскрывать алый звезда ночной красавица гвоздикаа 
31219	 черный этот гвоздикаа лишать всякий сдержанность сад феррара 
31219	 покрутить голова мечтательный говорить квартирмейстер дуб сидеть руль антик гвоздика подумать взглядывать корзинка 
0	 перила крыльцо стоять синий кастрюля корявый тряпка висеть гвоздика 
0	 передник сэт висеть гвоздика как повар что 
31219	 гвоздика дверь висеть старый пиджак 
31219	 старик сидеть узкий прилавок снимать икона риза выковыривать гвоздика маленький стамеска 
31219	 я спорить вбивать кроватка гвоздика повесить часы сам 
31219	 лейкин я писать один встреча ты попросить ты написать я что-нибудь вообще лейкин гвоздика сей письмо ты получать 
31219	 этот страдание его быть отнюдь мало вещь всякий случай легко отказываться что-то этакий запах гвоздика 
31219	 чудно показываться сказать сказать правда страсть любить он гвоздика вбивать случаться 
31219	 который крепко пахнуть гвоздика подколесина 
31219	 этот время проходить мимо еще совсем пожилой бабенка плотно обтягивать запаска выказывать она круглый крепкий стан помощница старый кухарка кокетка страшный который всегда находить что-нибудь пришпиливать свой очипок кусок ленточка гвоздика бумажка 
31219	 год назад апрель год португалия происходить бескровный революция получать название революция гвоздика результат который быть свергать 
31219	 надо черный называть белый чеканить тишка тетя казаться запястье она вбивать мелкий гвоздика 
31219	 стоять табурет степан забивать рама мелкий гвоздика поглядывать свой забавный перепачкать 
31219	 год назад апрель год португалия происходить бескровный революция получать название революция гвоздика результат который быть свергать 
31219	 краешек плита нина уманский торчать пересыхать гвоздика 
31219	 мексика хлопок соя колумбия хлопок гвоздика чили кукуруза соя 
31219	 основание треугольник охватывать край сосуд сам оковка крепиться дерево миниатюрный золотой гвоздика 
31219	 так солнце великолепно себя чувствовать овсяница сизый чистец шерстистый гвоздика молочай лаванда полынь шалфей котовник 
31219	 тумбочка банк одиноко розоветь гвоздика 
31219	 впопыхах еще нарочно еще случайность бежать сшибать один урна корзина роза тюльпан гвоздика сразу понравиться сразу зацеплять 
31219	 оказываться сени гвоздика сам забывать повесить 
31219	 елизавета вдруг свертывать полезть сторона сугроб я набирать снег ботинок уже издали замечать серый папаха торчать снег плита эдуард григорьевич бабаев откопать снег год бросать получаться ямка гвоздика снег который спрятаться 
31219	 мы игорь саша газета встреча сегодня дарить весь грустный женщина радость сказать мы протягивать свой нечаянный визави гвоздика 
31219	 засыпка рама опилки покрышка должный быть туго натягивать закреплять гвоздика край рама 
31219	 вы цветущий луг гвоздика альстремерия гипсофил другой 
0	 потом все разъехаться одинокий вещь так оставаться висеть гвоздика 
31219	 ты опять выгонять твой мастерский который ты досочка гвоздика построить свой рука 
31219	 спрашивать он бурзум злобно сверлить я гвоздика свой черный глаз 
31219	 мало то трудно понимать становиться раритет так машина еще где-то хранить надо гвоздика повесить 
31219	 вид мед быть вишневый смородинный мозжевельный обварный приварный красный белый белый паточный малиновый черемховый старый вешний гвоздика княжий боярский 
31219	 уже тонкий шпилька гвоздика сыпаться нож 
0	 оставаться венок двенадцать пятнадцать гвоздика я он надевать один 
31219	 первокурсник момент получение первый гвоздика июнь следующий год 
31219	 приходить пустой рука алый гвоздика два бутылка молдавский коньяк 
31219	 потом промакнуть губа рукав понюхать мятый гвоздика торчать петлица его сюртук 
31219	 напалечный компактный простой изготовление легко маскировать менее заметный применение недальнобойный птица попадать короткий расстояние пулька металлический быть сгибать гвоздика медный алюминиевый железный 
31219	 редко теперь выдаваться свободный денек ржаветь баржа городской пристань дело отпускать архив где ион все еще потерять надежда когда-нибудь сваривать свой сыр разыскивать изображение чертеж старый русский сыроварня пытаться находить они тот который она наконец построить воссоздавать оно быть каждый бревнышко каждый наличник каждый гвоздика хорошо другой вписываться 
31219	 романтический история девочка мой поклонница который каждый пятница приносить я гвоздика 
31219	 ты никуда мочь деваться факт что глотать мэл гибсон красный гвоздика понимать 
31219	 больший часть роскошный роза гвоздика сваливать гора предбанник ресторан 
31219	 больше один стол все ресторан цветок быть вы любить гвоздика спрашивать она павел 
31219	 я вообще гвоздика любить никакой значит они 
31219	 зеленка плохой гвоздика поискать мебельщик 
31219	 он холл оставаться мокрый надломленный гвоздика маленький транспарантик кривая 
31219	 сидоров гвоздика выйдтя строй санузел 
31219	 облизываться кролик проглатывать влажный роса буква гвоздика сразу превращаться 
31219	 он снимать дождевик повесить гвоздика 
31219	 весь его обязательство повесить перо гвоздика все его клятва никогда 
31219	 чижик смочь вгонять гвоздика доска очень расстраиваться 
31219	 постоянно существовать гвоздика косяк который 
31219	 сказать мадам малый написать особый мнение забывать повесить гвоздика 
31219	 цена рынок оказываться слишком высокий так мы снабжаться хороший образ приобретать пара соленый слоновий хобот ящик страусовый яйцо финик саго корица гвоздика прочий пряность 
31219	 конечный период лезвие практически параллельный действующий кромка удалять гвоздика 
31219	 он все равный любить уходить утро мастерская писать рисовать потихоньку возиться картина маленький молоточек вбивать багет гвоздика укреплять картон перебирать лист кое-что 
31219	 старый бубен подарить она цыганка висеть гвоздика дверь 
31219	 шляпка гвоздика накладывать кружок фильтровальный бумага диаметр 
31219	 хорошо все шляпка гвоздика сделать сменный различный диаметр так 
31219	 иметься пористый фторопласт шляпка гвоздика можно сделать он 
31219	 потом он приносить тепло повесить гвоздика печка он вдруг оттаивать 
31219	 мы оказываться общий страсть рожа разводить роза гвоздика подсолнух говорить влияние свет 
