31219	 каждый столик цветок вход дама раздавать букет роза ландыш перевязывать лента мужчина цветок гвоздика отдельный стол занимать штаб московский 
31219	 кой веко попадать цветущий лоно природа аполлон аполлонович видеть здесь мы быть видеть он цветущий лоно природа мы лоно распадаться мгновенно признак фиалка лютик одуванчик гвоздика сенатор отдельность этот возводить 
31219	 мужчина предлагать петлица небольшой пучок гвоздика 
31219	 какой-то благотворительный вечер она представлять он свой муж добродушный немного смешной человек черный фрак красный гвоздика петлица превосходный 
31219	 рука его пестреть василек веточка белый донник мышиный горошек два три полевой гвоздика 
31219	 дерево полный цвет бледно розовый гигантский гвоздика громадный белый колокольчик нежно 
31219	 желать занятие приходить час вечер александровский сквер увидеть инженер гвоздика петлица переговаривать условие 
31219	 пасха поступать продажа запас роза ландыш гиацинт гвоздика проч 
31219	 муриловский барин скупать все что быть хороший там он выбирать самый большой красивый роза весь махровый бледно-розовый гвоздика 
31219	 белый нарцисс багряный гвоздика хрустальный чаша стол 
31219	 поэтому ресторан кургауз часто подаваться щука отдавать левкой розовый гвоздика грудь аптекарь благоухать салака 
31219	 алый гвоздика их нос пахнуть окунь 
31219	 лена ребенок скоро мы покидать пойти домой мы мама пойти еще цветочный магазин мама купить я чудный роза два гвоздика я быть страшно рад 
31219	 мама купить я три гвоздика что прикалывать они вечер 
31219	 черный черный старица преклонясь рог свещный огонь плясать клобук хвост прошушукать амвон отрывать рой искра красный пчела уползать фимиам чело они кровь гвоздика оплетать пламень восковой копия 
31219	 черный черный старица чудо преклонясь рог свещный огонь плясать клобук хвост прошушукать амвон отрывать рой искра красный пчела уползать фимиам чело они кровь гвоздика оплетать пламень восковой копия 
31219	 то лестно человек быть он скромный полевой гвоздика 
26662	 кравчий разносить легкий белый вино красный кипрский густой подогревать заправлять фисташка корица гвоздика 
26662	 снизу товарный склад подниматься запах чужеземный пряность индейский перец имбирь корица мускатный орех гвоздика 
31219	 она опираться деревянный перила хорошенький смуглый лицо ее наклоняться ящик отцветать левкой распускаться астра гвоздика 
31219	 вертлявый поцеловать кончик палец антик муар гвоздика купец какой хороший мереть 
26662	 мы любить казенный щи каша говяжий котлета казаться мы сомнительный достоинство быть сильно приправлять бурый болтушка корица гвоздика лавровый лист 
31219	 один они полный брюнет выхоливать барский лицо пробегать газета дымить дорогой сигара другой высокий тонкий гибкий как хлыст франтик который как срываться первый страница юмористический листок так много быть его фигура начинать монокль красный гвоздика петлица кончать удивительно 
31219	 мы встречать вероника красивый астра ирис чертополох очень массивный шишка гвоздика дикий гречиха масса самый разнообразный 
31219	 она вечно увиваться рой поклонник один привлекать остаток ее замечательный красота другой искать ее приязнь имя то ее муж быть влиятельный член государственный совет третий просто манить возможность постоять бок бок великосветский женщина этот цветочек дикий желающий попадать один пучок гвоздика быть большинство 
31219	 охота вы алексей васильевич прыскаться душиться какой-то гадость говорить критик вы какой-то бергамот гвоздика пахнуть 
31219	 грузило ты мочь взять свинец пуля гвоздика какой-нибудь 
31219	 вначале известно быть прочее чрезвычайно трудно понимать какой образ похищать вещь витрина все она казаться порядок замок быть повреждать маленький ключик висеть особый гвоздика свой место 
31219	 все заговаривать ее гостиная где пальмовый мебель быть обивать черный тисненый кожа золоченый гвоздика два цуг ее лошадь 
31219	 ухо отдавать извинять немой гвоздика другой какой предмет так 
31219	 она покраснеть вскакивать место торопливо засовывать цветочный горшок свой тетрадка гость скидывать верхний платье вешать он гвоздика дверь где простыня 
31219	 сгруппировывать такой поэтический центр этот материальный конец сам как-то облагораживаться уподобляться цветочек дикий попадать один пучок гвоздика 
26662	 правда тот время прогресс успевать еще проникать глубина номер найтакинский гостиница освежать коридорный запах повеять кухня благодатный аромат гвоздика лавровый лист 
31219	 попробовать я рюмочка так гвоздика пахнуть розан пахнуть 
0	 едва успевать он повесить свой пальто гвоздика он опять становиться 
31219	 офонькин этот время освобождать себя тысячный ильковый шуба внимательно посмотреть вешать она гвоздика принимать платье лакей 
0	 иной тихо гладить он перчатка гвоздика он гладить 
31219	 лето тепло светло жар тень прохлада все зеленый каждый цветок стараться наряжаться можно хорошо кашка весь свой головка убирать розовый белый колпачок гвоздика смотреть розовый звездочка 
0	 все он выговаривать торопиться ровный ударение каждый почти слово вколачивать их гвоздика 
31219	 человек год сорок небритый подбородок испитой лицо засаленный сертук весь снаружи внутри нечистый замарывать небольшой плутовской глаз тот особенный запах русский пьяница составлять вечно поддерживать перегорелый сивушный букет оттенок лук гвоздика прикрытие 
0	 пол постилать половик изгребной прибивать пола гвоздика 
31219	 какой-то джентельмен петербургский все подбирать перо твой номер вероятно ты бросать подбирать потом весь бумажка все они полошить свой бумажник какой-то генерал сослуживец якубович вырывать весь гвоздика стена его каземат 
31219	 далее поле находиться синий колокольчик полевой гвоздика водяной желтый лилия 
31219	 быть я забота так один я казаться ты здесь скучать заключать она то гувернантка суетливо отходить окно спускаться сад делать вид рассматривать гвоздика посмеиваться платок 
26662	 штабс-капитан ш предлагать мы сыграть еще партия городки то проигрывать партия перевоз заплатить несколько бутылка красный вино ром сахар корица гвоздика глинтвейн который этот 
31219	 один пугать я лидия так мало заниматься я так беззаботно хохотать сестра так спокойно заниматься свой гвоздика я начинать 
31219	 дополнять композиция хоста белоокаймленный гвоздика травянка камнеломка 
31219	 щит почтовый ящик клетка болото тарелка луна синий фонарь открываться дверца деревянный нога почтовый ящик стул приклеивать спинка чучело ворона сидение его утыкивать гвоздика грудь чучело надпись 
31219	 хорошо октябрь плавать корабль день равновесие утро целый день небо перекрывать синь вечер снежный хмарит утро свежо зеленый сочно видный трава солнце нагревать лавочка расстегивать куртка подставлять грудь ветер март зима отступать казаться каждый весна навсегда дорога праздничный засыпать лист клен чистый гладкий еще сжиматься корявый комок усыхать кожица смертный судорога старушечий ладонь я проходить подземный переход заглядываться киоск торговать женский белье отворачиваться разрезать пополам инвалид нищенка главный ворота пойти вперед направо наугад осторожно высоко подымать нога кто наступать круглый аквариум беречь цветок могила красногвардеец надпись сынок младенец инночка капитан артиллерия ненавистный приходить время мы отдыхать почти встречать привычный простонародный кладбище женщина уборщицкий халат резиновый перчатка баночка вода краска стоять поглядывать солнце расставлять рука очередь нагибаться родной холмик свежо перекопать земля наращивать горка вырывать сорняк я понимать скоро пойти молотов микоян аллилуев орджоникидзе вася сталин навсегда вася красавица екатерина тимошенко слушать рассказ она испытывать легкий волнение умирать один понимать замечать птица залетать форточка что-то клевать падаль квартира слово себя мочь позволять безымянный ничтожный маршал нарком железный человек здесь вставать молча истукан спина спина вон они наискось фурманов островский приметный каменный буденновка яркий гвоздика соседство мать молотовой 
31219	 второй подрагивать длинный стебель гвоздика 
31219	 пасха развозить гвоздика введенский кладбище армянский 
31219	 гвоздика держать старый стекло искалечивать безнадежный 
0	 русский туалет гвоздика висеть обрывок газета листок 
31219	 я быть старый дед быть дышать паровоз средний размер выписывать пионерский правда я все равный забывать самый страшный отчаяние мой жизнь быть плохо повесить я гвоздика тазик уборная рухнуть 
31219	 оценка директор маркетинг сеть магазин петровский олег гвоздика уже сегодня москва 
31219	 вначале запахнуть полевой цветок целый букет который каждый мочь выбирать запах любимый травинка ромашка дикий гвоздика 
26662	 заменитель гвоздика вырабатывать эвгенольный базилик расти 
26662	 обычно пережигать гвоздика кусочек отмазка печь иногда попадаться 
0	 диван гвоздика висеть перчатка шкаф 
31219	 зуб он быть такой мочь перекусить гвоздика 
31219	 программа быть включать также выступление приветствие местный фольклорный коллектив ансамбль казачий песня город бишкек казачий хор станица садиться беловодское народный вокальный ансамбль ветеран город кара-балта столичный хор ветеран красный гвоздика 
31219	 кафедра артиллерийский система также иметь свой ангар где устанавливать реальный образец вооружение частность самоходный орудие гвоздика мм акация 
0	 гвоздика висеть плащик рядом стоять 
31219	 фото аркадий паничерский гвоздика травянка фото виктор сазонов 
31219	 железка дощечка гвоздика ус доми хаять будить 
31219	 так регулярно раз год проходить конкурс молодой исполнитель гвоздика отечество 
31219	 полынь прекрасно сочетаться гвоздика травянка овсяница сизый гипсофила ползучий 
31219	 стол стоять статуэтка оставаться бабушка ваза красный пластмассовый гвоздика 
31219	 он жалеть квартира этот полочка я прибивать этот гвоздика я ввинчивать 
31219	 скорпионий натура нельзя хорошо подходить махровый цветок торжественный хризантема пион гвоздика 
31219	 могила они немецкий долгий время быть полный запустение железный колышек табличка пара увядший гвоздика дмитрий щегол специально совершенно 
31219	 держать рука охапка гвоздика порог обращаться мы 
31219	 ваш гвоздика я безумно рад спасибо 
31219	 я служить танковый полк командир батарея гвоздика быть что 
31219	 господин эйхлер сказать я это вы так пахнуть гвоздика 
31219	 входить хрущевка любопытствовать там угол какой кривая гвоздика что похожий 
31219	 крокус бадан астильб очиток рябчик шахматный нарцисс тюльпан безвременник пион ирис лилейник примула хост декоративный лук лиатриса многолетний астра люпин полынь дельфиниум гвоздика турецкий камнеломка эдельвейс монард летник 
31219	 помнить чиграшов удовлетворенно хмыкнуть я сообщать он мой прикидка примерно тот самый время он день-деньской вкалывать деревообрабатывающий цех анадырский промзона я лева криворотов число хороший ученик средний школа киевский район изнурительный неоднократный репетиция трогательный соразмерный букет казенный гвоздика приветствовать пионерский галстук пилотка 
31219	 магазинчик маленький уютный домашний старый книга пахнуть горький запах гвоздика пыль 
31219	 престарелый пионервожатый коммунар тоскующий педагог чиновник минобразование собирать рубль букет девять гвоздика женщина который муж иногда 
31219	 пагубно тюльпан действовать гвоздика ландыш лилия нарцисс роза душистый 
31219	 конечно гусарский набор шампанское коробка конфета дополнять тройка чахлый гвоздика это банальный 
31219	 задний копыто лететь ирис лилия ландыш гвоздика орхидея 
31219	 благородный кожа цвет бордо бронзовый гвоздика такой бронзовый звонок 
31219	 говорить она уже как мозг гвоздика тюкать 
31219	 мочь быть пистолет наполеон мочь инкрустировать перламутр золотой гвоздика редактировать сочинение нестор иванович 
0	 модель гильотина это он работа сказать жан жак все точно последний гвоздика он немножко разбойник этот шарло 
31219	 когда наступать время покидать этот беспорядочный мирок никто по-прежнему обращать ты внимание комната продолжаться событие выясняться отношение звучать неизвестно что относиться диалог прихожая путаться мелкий редиска обмораживать гвоздика раздеваться какой-то заснеженный женщина притаскивать 
31219	 ритуал посвящение первокурсник дипломник раздавать каждый гвоздика объясняться любимый цветок борис 
31219	 починять сказать жена там всего-то один гвоздика вбивать починять починять заученно отвечать 
31219	 всего-то надо быть один гвоздика вбивать сказать жена хвалиться 
31219	 маленький ржавый гвоздика впиваться ее кожаный куртка 
31219	 вазочка узкий горлышко каждый махровый гвоздика 
31219	 лидия пойти кухня нож отгибать этот гвоздика передумывать 
31219	 гвоздика дверь увидеть сразу несколько 
31219	 теперь этот тип подходить игрок злобно вырывать они гвоздика бросать они урна 
31219	 я мочь один гвоздика вбивать туда куда нужно 
31219	 зрение ты например видеть гвоздика вон там 
31219	 парфюмерный магазин помятый мужичок обращаться продавщица два тройной гвоздика зачем мы 
31219	 так всегда проходить я жизнь нести рука неудобный постыдный рваться газетный обертка пакет какой-то поручение похожий невыкинуть крышка майонез долг напоминать нестираный носок неопубликованный рукопись я выкидывать этот пакетик два фото паспорт несколько пуговица пробка дореформенный копейка множество моток бумажный бечевка там еще гвоздика один быть там еще сверху 
31219	 просыпаться еще разок я вдруг испытывать ужас потеря расслабление свобода тогда видеть уголок рот край вода клочок небо там сразу цветущий поле никто замечать ты туда туда пойти окликать окликать тогда свободный место пакетик место гвоздика кривой ржавый высохший 
31219	 конечно ведро роза пион георгин гвоздика дороговатый 
31219	 сегодня праздник зря он тянуть гвоздика красивый что 
31219	 неказистый гвоздика во-первых другой быть во-вторых 
31219	 хозяин наш маленький отель устраивать праздничный ужин гвоздика лежать скатерть а 
31219	 этот явление гете наблюдать поездка италия садовый роза гвоздика 
31219	 энергичный покупатель подозревать помещение где они приобретать итальянский ботинок голландский гвоздика быть мочь скоро быть летать 
31219	 ночь быть черный непрозрачный единый гвоздика небо 
31219	 купе поражать я свой совершенно мирный вид окно бронированный стена быть плотно занавешивать столик стоять ваза гвоздика 
31219	 я сам улыбаться леша понюхать гвоздика 
