31219	 кстати сцена быть украшать корзина белый гвоздика любимый цветок мария каллас 
31219	 погост шелестеть пожелтеть лист береза два могилка обносить ограда ухоженный рука воспитанник меняться гвоздика астра плита 
0	 базар быть его университет местный жизнь он пропадать он музей впитывать все попадаться глаз кожаный фартук сапожник скрипучий дратва следовать шило колено зажимать колодка молоток усмирять гвоздика пятка часовщик будка 
0	 по-настоящему следовать поначалу молоток прибивать моторчик гвоздика пользоваться четыре отверстие его 
26662	 первый вариант брать бутылка красный вино ложка мадера сахар изюм корица гвоздика апельсиновый цедра миндаль водка 
26662	 рецепт действительно изящный очищать апельсин втыкать палочка гвоздика печь он духовка 
26662	 взять топор отскабливать обух блеск отшкурить топорище белизна полагать котел заливать вода близкий родник зарезать рыжий курица можно корова засовывать котел разжигать очаг желтый сосновый чурка толстый два вершков подбрасывать закипать соль перец лук мак гвоздика лепесток речной лилия 
26662	 наливать кастрюля стакан молоко всыпать полстакана панировочный сухарь хорошо вы они сделать сам подсушивать белый хлеб полагать полголовка лук втыкать луковица палочка гвоздика подкидывать веточка петрушка небольшой лавровый 
26662	 растапливать кастрюля столовый ложка сливочный масло добавлять петрушка мелко нарезать лук морковь сельдерей столовая ложка каждый тушить минута потом полагать три горошина перец один палочка гвоздика кусочек лавровый лист чайный ложка 
31219	 тот возвращаться честно запыхаться тащить белый гвоздика 
31219	 искушение кадр белый гвоздика выглядеть такой невинный 
0	 самый первый пододвигать стремянка молоток черный ленточка влезать физрук дрозд губа он держать обойный гвоздика учительская тесный группа стоять 
26662	 чашка подвядший лепесток роза чашка цветок бархатцы лепесток пион чашка цветок монарда жимолость турецкий гвоздика чашка поваренный соль 
31219	 такой-то пасмурный зимний полдень мы как-то раз приносить она много белый гвоздика 
31219	 вы низина нежный полный шепотом лист непутевый ветер литься ручей свежий редко зримый смуглый звезда бросать сюда ваш око яркий финифть зеленый трава пить медовый дождь вешний цвет обагрять земля торопливый первоцвет умирать забывать хохлатый лютик бледный ясмин белый гвоздика сиять фьялка в 
0	 уже подходить дверь он неожиданно обертываться негромко внятно спрашивать писательский дом вы гвоздь нет христос распинать находить гвоздика грозный начальник побагроветь закручиваться 
31219	 купить большой букет белый гвоздика подниматься последний этаж дома 
26662	 специя лавровый лист перец гвоздика соль класть суп 
26662	 сметана г лавровый лист перец гвоздика зелень 
26662	 минута окончание варка добавлять белый соус нарезать листик свежий щавель соль лавровый лист перец гвоздика 
26662	 л вода ч ложка соль лавровый лист гвоздика толченый мускатный орех 
26662	 начало приготавливать шпиговка кусочек мелко порезать свиной шпик смешать выдавливать давилка чеснок головка соль перец сушеный свежий мелко порезать зелень кинза петрушка укроп толченый мускатный орех толченый гвоздика толченый лавровый лист 
26662	 уксус крепкий процентный он надо разводить наполовину вода это добавлять соль сахар пряность перец корица гвоздика мускатный орех кориандр лавровый лист 
26662	 г среднее находиться зерно черный перец столько зерно душистый перец гвоздика 
26662	 приготовление маринад каждый стакан уксус взять стакан вода стакан сахар ч ложка соль немного корица гвоздика перец весь это прокипятить охлаждать 
26662	 уксус вскипятить добавление соль перец горошек желание можно полагать также лавровый лист гвоздика сахар остужать заливать они 
31219	 вести я бесконечный коридор распахнуть я дверь свой небольшой кабинет где стол стоять два вазочка один несколько розовый белый гвоздика другой самый разнообразный 
31219	 человек кепка набивать коробка телевизор стиральный машина розовый красный белый гвоздика 
0	 я бить молоток гвоздика хотеться давать он 
31219	 накупать красный роза белый гвоздика поминальный птичка черный тесто 
31219	 удобно ты спать повапленный гроб лепетать она раскладывать могила красный роза белый гвоздика крест чередовать кровавый снежный 
26662	 мы месить глина солить ее стаскивать кухня соль рвать клумба увядать гвоздика делать что-то еще столь 
0	 гвоздь думать задыхаться дамский говядина анатолий панфилыч выпускать выпускать работать набирать губа гвоздика 
31219	 этот талия совокупность венок белый гвоздика голова укладываться 
26662	 снимать огонь добавлять стакан сахар немного соль имбирь толченый гвоздика тереть цедра половина лимон 
26662	 калмык заваривать чай молоко класть оно соль лавровый лист мускатный орех гвоздика узбек черный перец 
0	 великий дюма говорить он история гвоздь который можно навешивать любой одежда вколачивать он свой гвоздика намертво подкапываться 
0	 самоделкин взять молоток четыре гвоздика прибивать ворота школа 
31219	 метр уходить тут вернуться большой букет белый гвоздика высокий хрустальный ваза 
31219	 сказать ты приносить два белый гвоздика 
31219	 так ты приносить такой красивый гвоздика 
0	 молоток вы быть гвоздика он прибивать карта потом 
0	 митя карман оказываться гвоздика молоток стеклорез он 
0	 день отъезд стоять совсем уже голый комната где железный койка стол три табуретка гвоздь стена газетный фунтик лампочка оставаться он оглядеться кругом вдруг сам знать почему подходить зеркальце все еще висеть гвоздика простенок 
0	 так ты что это значить гвоздь есть говорить я гвоздика очень любить еще 
0	 смотреть как надо работать гвоздика молоток осадочек 
0	 присниться я однажды гвоздь доставать дерево цветок который называться гвоздика разноцветный нитка бисер находить 
31219	 принцесса греза должный быть успех вскружить она голова один рука посылать воздушный поцелуй галерка бельэтаж бенуар другой прижимать грудь букет белый гвоздика атласный лента один 
31219	 появляться маша каллаш крахмальный манжет крахмальный воротничок строгий жакет мужской покрой белый гвоздика петличка красивый вызывать 
0	 он выделывать головка гвоздь знать добыча минерал его химический состав его спектр один сторона другой он знать роль свой гвоздика каждый фабричный вещь 
0	 год война плата десять пфенигов немец вбивать он гвоздика покрывать монумент броня железный шляпка 
0	 подходить близко он увидеть навес крыльцо кривой торчать утыкивать гвоздь палка этот черный обойный гвоздика висеть шевелиться ветер розовый 
31219	 я продираться молодой сосняк издираться вконец какой запах какой сухой белый гвоздика рыжий хвоя какой паутина 
0	 охотник гордиться они поведение мать спокойно курить трубочка обивать медный гвоздь гвоздика этот блестеть свеча ребенок 
31219	 я писать раскрывать окно солнце опалять лоб плечо окно зеленый пропасть метр глубина весь покрывать красный розовый белый гвоздика 
0	 несмотря сопротивление жена вытягивать обойный гвоздика стена запрятывать молоток 
0	 день отец стругать доска сарай перестилать заново пол изба никита он давать работа выпрямлять молоток кривой гвоздика 
31219	 ниже кремовый желтый бордюр морда виторогий овен свет окно май фиалка лазоревый цветик лист роза ницца сюда забегать весь франтик быстро продернуть петлица гвоздика ромашка выбегать перебежать мостовая нырять 
31219	 пошло беснование гавк голос ладонь протоп каблук разрыв глаз все вскакивать букет просто куст красный пряный гвоздичник тащить стол два студент красный гвоздика он привставать раскланиваться 
31219	 я носить петлица красный гвоздика служба ставить она 
31219	 неудобно сразу уходить оставаться оба красный гвоздика откуда вы цветок 
31219	 наконец вставать он навстречу широко раскрывать огромный объятие восклицать обленисимов красный гвоздика сверкать его пиджак а 
31219	 сказать наталья борисовна красный гвоздика петлица вставлять орать 
31219	 идти приходиться лес идти интернационал напевать красный гвоздика рвать вдруг куст выходить 
31219	 алый капля гвоздика воздушный тонкий стебель колокольчик 
31219	 помогать яркий щегольской лубок угол улица взятие одесса похожий глупый красный гвоздика взрыв снаряд белый клуб 
31219	 отец она помнить мать смутно знать хорошо зеленый степь ее цветок дикий цветок лиловый ирис гвоздика тмин 
31219	 михаил платонович стожаров муж лидия брать пучок ниццский цветок гвоздика фиалка лежать рояль 
31219	 день мама подарить я цветок гвоздика гелиотроп фуксия мирт так 
31219	 так как они воображать горный фея стоять рабочий люд точь-в-точь их рассказ становиться одеваться девушка женщина сорганизовываться синдикат зеленый красный вышивка лист цветок гвоздика зеленый лента пояс белый 
31219	 она невольно вздыхать голос прошлое ярь ночной многомесячный мечтание она воскресать цветок гвоздика бросать снежный вуаль пурга 
31219	 молодежь пристращаться употребление живой цветок я первый раз свой жизнь видеть здесь фуражка военный образец красный кант украшать кокарда свежий роза полевой гвоздика 
0	 все держаться гвоздь гвоздика отопление комната 
31219	 дом его деревянный одноэтажный вечно стоять забитый дверь заколачивать ставня запущенный сад превращаться зеленый тенистый пустырь который сень старый липа лопух достигать громадный баснословный размер пушистый головка куриный слепота повсюду белеть рядом мелкий цветок одичать колокольчик гвоздика венерин голубков 
0	 тут гвоздика целый гвоздь приходиться посадить 
26662	 апельсин лимон стакан черносмородиновый джем г консервированный протертый яблоко стакан мадера луковица ст ложка уксус ч ложка картофельный крахмал ч ложка готовый горчица гвоздика лавровый лист 
26662	 лук нашинковывать промывать холодный вода полагать кастрюля заливать уксус добавлять лавровый лист перец гвоздика тмин поставлять варить 
26662	 фазан стакан белый сухой вино г шпик ст ложка сливочный масло свиной жир стакан сметана луковица лавровый лист ягода можжевельник гвоздика перец соль 
31219	 однажды открытка разворот красный знамя красный гвоздика бывший майор котлов извещать торжественно 
31219	 хорошо этот тихий полутьма вдруг выходить светлый поляна все сразу по-иному теплый земля запах нагревать солнце можжевельник подвижность воздух поникать большой колокольчик отливать фиолетовый металл цветок дикий гвоздика липкий смолистый стебель 
26662	 стакан мелко нарезать апельсиновый цукат чайный ложка корица чайный ложка гвоздика сок один лимон 
26662	 вытертый очищать рыжик слагать банка шляпка вверх заливать горячий уксус вскипятить корица гвоздика лавровый лист простой английский 
26662	 очищать обтирать вскипятить соленый вода откинуть сито остынуть слагать банка пересыпать гвоздика простой английский перец лавровый 
26662	 крепкий непереспелый груша очищать кожица наливать ключевой вода полагать немного сахар мед варить почти мягкость откинуть решето переливать холодный вода стакан крепкий уксус вскипятить фунт сахар корица гвоздика соль см 
26662	 кто любить специя сок этот можно вскипятить специя корица гвоздика растолочь 
26662	 вино стекать совершенно перелагать вишня банка перелагать немного специя корица гвоздика лавровый лист четверик вишня 
26662	 изрубать мелко натертый луковица прибавлять фунт нарезать ломтик сырой свинина фунт очищать жить дичь сырой говядина изрубать весь это вместе полагать перец английский простой гвоздика мелко накалывать лед 
26662	 вкусовой компонент употреблять суп лавровый лист простой английский перец соль гвоздика морковь брюква картофель сушеный гриб 
26662	 гвоздика корица имбирь мускатный орех мускатный 
26662	 отваривать изрубать печенка ливер поросенок истолочь ступка протирать сито полагать ложка масло желток коринка перебирать кипяток обваривать гвоздика перец немного сахар прибавлять франц 
26662	 взять противень дно посыпать изрезанный лук немного петрушка лавровый лист английский перец гвоздика полагать весь это свинина 
26662	 два ложка вишневый яблочный пюре пюре слива мед сахар разводить стакан бульон вода прибавлять надо чайный ложечка корица толченый гвоздика лимонный цедра мадера портвейн 
31219	 она вытаскивать шкаф тряпье выковырять кнопка булавка гвоздика крепить фотография завешивать окно 
31219	 металлический узор ограда заткнуть красный гвоздика 
31219	 я недавно быть могила сталин там гора цветок красный гвоздика убивать черт знать человек 
31219	 они хороший настроение смеяться разговаривать жестикулировать улыбаться махать камера цветок красный гвоздика 
31219	 красный гвоздика автор славить девица марин козлов 
31219	 какой она платье чистый гвоздика девочка 
31219	 например игра красный знамя браться два красный цветок гвоздика роза они срываться 
31219	 точно так мама идти почта долго выбирать крутиться стеллаж открытка гвоздика роза перевязывать красный лента 
31219	 оба книга постоянно маячить бюст один они возлагать черный тюльпан полный видимо антоним официальный красный гвоздика портрет прочий изображение ленин 
31219	 поравняться я кидать красный гвоздика я чуть уронить 
0	 окошечко чистенький рачительный хозяйка он мыло здесь он показывать гвоздика который болтаться мохеровый синий 
26662	 гриб шампиньон рыжик масленок крепкий мелкий подосиновик опускать подсолить кипяток доводить кипение снимать пена прибавлять винный уксус лавровый лист черный душистый перец гвоздика корица очень слабый 
26662	 рацион слон входить соль сахар мука вино также гвоздика имбирь корица мускатный орех 
26662	 россия свой время пользоваться большой популярность водка померанцевый ароматизированный смесь померанцевый корка бадьян мускатный орех кардамон гвоздика корица ароматический смола стиракса 
26662	 литр маринад литр вода литр ного уксус литр вода ст ложка уксусный эссенция соль ст ложка сахар ст ложка гвоздика 
26662	 рассол л вода потребоваться ст ложка верх соль сахар также вкус пряность лавровый лист зерно черный перец зонтик укроп лист петрушка веточка базилика бутон гвоздика немного молотый корица чеснок 
31219	 такой растение хоста астильб герань калужница щучка осока ожик карликовый лилейник астра лаванда гвоздика пепельный дицентр красивый 
31219	 она становиться такой образ гвоздика ноябрь мимоза 
26662	 пряность добавлять исходить личный предпочтение имбирь гвоздика кардамон мускатный орех 
26662	 л клюквенный сок мл апельсиновый сок гвоздика палочка корица сахар вкус 
