21947	 хотеться отмечать благожелательность тон изящество слог начальник го округ корпус жандарм 
15152	 намек сделать количество слог слово 
21947	 профессионально хороший стиль слог писать многий журналист мп они 
15152	 весь падеж этот слово множественный число ударение быть стоять первый слог 
21947	 говорить высокий слог наш вклад культура 
15152	 мать недолюбливать ваня шишлин намеренно фамилия его ставить ударение первый слог приуменьшать это достоинство медалист шиш 
15152	 здесь недалеко париж он купить земля потом это место становиться называть имя их новый владелец орлик ударение последний слог 
15152	 отлично помнить слово приговор он произносить правильный ударение последний слог 
15152	 голос диктор читать отдельный слог слово фраза ухо 
21947	 истинный перл канцелярский поэзия слог достойный тредьяковский худощавый генерал приоткрывать 
21947	 прошлый раз намекать он высокий слог что-то особый какой-то 
21947	 поэтому всякий его колоритный фраза драгоценный свой экспрессивность я святой сохранять его текст она нарушать привычный норма шаблонный литературный слог 
15152	 состав гласный непервый слог слово индоевропейский язык никогда 
15152	 его пышный французский фраза который он говорить сильный ударение последний слог ами быть я 
15152	 требоваться заводить новый панталоны заплатить сапожник старый долг приставка новый головка старый голенище следовать заказывать швея три рубаха штука два то белье который неприлично называть печатный слог слово весь деньги совершенно должный 
21947	 вова милич муж отдельный жулик вор свой страна вправе контролировать пресекать их деятельность население этот страна вмешательство свой внутренний дело чужой дядя алексей абросимов муж понимать ваш высокий слог участвовать конкурс народный мудрость 
15152	 повторять слог слово родной язык 
15152	 по-французски ор ударение последний слог 
15152	 другой версия источник происхождение название му второй слог слово лемурия 
15152	 пивной завод имя бадаев теперь говорить закрытый прятаться всегда красностенный неразбериха забор высокий железный ворота который всегда въезжать грязный бурый месиво колесо брызгать грузовик пахнуть солод река недалеко завод спешивать вливаться мутный желтый пенный пивоваренный струя тютчевский ударение последний слог 
15152	 он уже сильно заикаться поэтому спрашивать печигин попадаться он запропадать вещь основной помощь жест оттачивать избыточно изящный многий пьющий плохо владеть язык человек почти всегда неоконченный так олег приходиться угадывать искомый предмет шарада несколько первый слог незавершенный движение 
21947	 честный слово я он недооценивать он так обыденно приходить работа поесть погулять собака уходить говорить высокий слог исполнять свой человеческий мужской долг 
15152	 омский прииртыший первый слог произносить звук средний е 
15152	 вода вода ударение первый слог галдеть детишки 
15152	 уверенно произносить я делать самый большой ударение последний слог 
15152	 плавно переходить беседа хозяйка лавка гора то детство я подбегать соседский девочка дергать массивный цепь шея развязно заявлять цепочка золотой делать ударение первый слог 
15152	 спрашивать залина ударять последний слог пати внезапно возникать мужчина 
15152	 ее чтение мы интонационный делать ударение первый слог слово занемогать такой пропуск 
15152	 он ямб чередоваться ударный безударный слог начинать ударный 
15152	 здесь первый пример ямб первый строчка написать чистый хорей второй искаженный пиррихий последний слог е слово снежный 
15152	 мы уже слышать он например первый слог слово разум конец слово 
15152	 слепой красавица читать слог слон так 
15152	 деревня этот фамилия делать ударение последний слог русский транскрипция ударение переноситься 
15152	 что вызывать раздражение мой первый одноклассникахтак волос умение читать слог тот класс 
15152	 я школа приходить уже читать слог вызывать тож раздражение 
15152	 слово офицер он сделать ударение последний слог говорить герой фильм чапаев 
15152	 единственный число ударение падать последний слог 
15152	 владик повторять интонировать последний слог вверх подпрыгивать 
15152	 песня полагаться петь ужин размеренный читать слог внутренний музыка 
15152	 действительно ребенок идти школа уметь читать слог считать это как 
15152	 весь этот веселый неразбериха смута толкотня так оставаться неясный узнавать великий форвард то кто учить он читать слог писать серый ворсистый 
21947	 я случайно писать кармена время несколько приподнятый манера покушение говориться высокий слог 
21947	 они хорошо писать приключенческий беллетристика исторический фантастика где вымысел красивый литературный слог приятный читатель 
21947	 сам фадеев читать платонов раз душа удивляться его слог оборот речь 
21947	 литературный слог фадеев вызывать сталин особый 
21947	 александров впиваться глаз корявый строчка три страница хороший профессиональный слог журналист описывать когда 
21947	 модный слог модный фронтиспис они 
21947	 изящество слог она уступать свой шеф 
21947	 приносить извинение литературный слог избыток медицина 
15152	 сохраняться звательный падеж весело слышать перекликаться продавщица ударение последний слог ленко 
21947	 движение непостижимый я организационный механизм она быть вырывать штат газета известие комсомольский правда московский новость следующий экземпляр индивидуальный творческий судьба вычурный слог николай фохт игорь мартынов 
21947	 весь этот выверт сопляк бабенка звучать философический бергсоно шарденовский уста мемуаристка кривляние натяжка фальшь воображать вероятно любовь грубость она следовать пристрастие мандельштам обмирщение язык она действительность владеть вульгаризм так неумело язык литературный ее литературный слог 
21947	 мы читать изящество слог пьеса список благодеяние то 
21947	 написать изящество слог выразительность ремарка 
21947	 подъезд он окликать звучный голос бучко бывший редактор областной газета взять акиндинов заводской многотиражка бучко лихач кудрявич хороший литературный слог 
15152	 карантин он родительный падеж ставить ударение последний слог карантин так все 
15152	 это больница говорить павел кончаться звучание последний слог глаз его снова мертветь 
15152	 наоборот почерк проблема нет слово разбирать слог маленький 
15152	 брахман слово означать объект ритуальный почитание священный слог ом 
15152	 башуцкий произносить он ударять последний слог весь этот цкиа ман 
15152	 совхоз животноводческий слово учить слог вода чес кий он мо вода 
15152	 кто кто спрашивать он быстро я повторять слог сто нье 
15152	 я уже знать буква как научаться помнить слог я даваться 
15152	 тогда избранник этот классический традиция сей пора называть уже мечтатель творец изящно поэт притязательный книжный безударный слог 
15152	 антропка кричать он упорный слезливый отчаяние долго долго вытягивать последний слог 
15152	 этот господин красота слог называть также бакенбардист 
15152	 кто бывать москва тот знать можно торговать книга так рыба мех овощ всякий сведение словесность тот знать здесь быть фабрика перевод фабрика журнал фабрика роман книжный торгаш покупать ученый товар перевод сочинение вес приговаривать бедный автор качество количество слог число лист 
15152	 превращаться нга е к в г весь слово язык такой позиция начало слово гласный открытомзакрытый слог так далее 
15152	 пора нужно персонаж уже самый язык понятный предание рождаться здесь русса быть быть год дальний тот время стародавний говорить человек старый небыль былина баять классический былинный слог как издавна повестись русь 
15152	 два очаровательный девушка один они тельняшка второй судя все нижний белье идти бульвар задорно обсуждать свой сосок ударение второй слог 
15152	 неизвестно кто шепотом умолять он свой детский сердце один глазок посмотреть этот неведомый жасмин который читать слог задушить хлорка сортир 
15152	 первый вероятно отбирать изысканный слог второй фамилия автор 
15152	 туркмения я звать саша доктор ударять он последний слог 
15152	 требование который должный удовлетворять слог каждый писатель 
15152	 мой дочка первый класс половина ребенок еле-еле слог читать 
15152	 подтягивать звукобуквенный прочий теория записывать три слово сначала можно печатный каждый слово делить слог ставить ударение снизу буква 
15152	 дело быть мочь поезд тот самый увидеть окно который русский мальчик тридцать год преображать реальность так подхватывать ветер газета темный перрон оборачиваться решение каверзный шахматный задача крыло редкий бабочка луг средний запад имя три слог плясать губа 
15152	 правильный произношение ее фамилия ударение третий слог 
15152	 энтони доставать записной книжка слог произносить пи стра 
15152	 осень ожидаться гость москва петербург смоленск ярославль любопытство желание приезжать изъявлять видный специалист русский генеалогия сан-франциско славист финляндия сложно выговаривать имя произносить он слог гречкин заливаться тихий смех 
15152	 он быть еще знаток разный кухня разбираться сплетение весь кулинарный традиция он помнить название весь блюдо таджин имжадра реш сено джан трижды она просить его произносить этот название повторять он слог мочь запоминать 
15152	 слово богатый ударение ставить весь три слог правильно второй иногда объект 
15152	 олег вспомнить лицо мучительно заикаться коньшина яростно выплевывать слог распадаться слово потом это 
15152	 юлия все тот саратов такой слог такой знание вопрос вы 
15152	 это трехдольный размер ударение первый слог каждый стопа быть 
15152	 амфибрахий трехдольный размер ударение второй слог стопа быть ударный 
15152	 анапест трехдольный размер ударение третий слог стопа быть ударный 
15152	 общий гомон я слышать сиплый баритон игорь черноморец читать слог 
15152	 страпелька слово нужно произносить ударение первый слог оно образовывать слияние странный 
15152	 воспоминание современник весь москва собираться проповедь десницкий который отличаться ясный легкий слог простота изложение нравственный философский сентенция 
15152	 вряд это одинокий утес дрейфовать безбрежный простор космос повреждать десяток другой тонна мусор произносить я подивиться откуда взяться художественный слог 
15152	 имя маттиас беглый речь диалект немецкий язык образовывать масса сокращенный форма тот число такой который отбрасываться первый слог мат а тиас превращаться 
15152	 родоманов ромодан перестановка слог ассоциация слово род 
15152	 первоначально слово произноситься ударение второй слог 
15152	 произноситься оно акадимий ударение предпоследний слог 
15152	 казан произносить идка слог глядеть огромный буква 
15152	 постановка ударение второй слог ее превращать асипов 
15152	 это закономерный русский соответствие греческий слово замена е начало слог такой как 
15152	 так присоединение никотиновый кислота шесть атом водород обозначаться вставка слог первый два буква 
15152	 это особенно ясно понимать вдруг слышать стиральный машина отчетливо слог произносить 
15152	 я поляк сказать он ударение первый слог православный вероисповедание 
15152	 буква э е я е у ю ы обозначать пять гласный фонема двойной комплект буква буква пять фонема объясняться графический прием обозначение твердый мягкий слог так русский алфавит 
15152	 год назад июль год ас полупроводниковый электроника роберт нойс гордон мур зарегистрировать компания название который пополняться вскоре еще один руководитель бизнесмен эндрю гроув переименовывать себя первый слог термин 
15152	 домохозяйка научаться писать слово адронный буква н первый слог 
15152	 слог давать такой определение часть слово 
15152	 слог давать такой определение часть слово 
15152	 написание мой фамилия иногда делать ошибка заменять буква ц буква датсков приходиться произносить фамилия делать ударение первый слог 
15152	 так вода литься бутылка по-русски звучать англичанин слышать глаг глаг китаец глоб глоб индонезиец крук крук испанец тут казаться три слог тот тот 
15152	 обнаруживаться удивительный вещь все единый слово первый группа второй слог иметься один тот согласный 
15152	 аргентина рычание этот раз приходиться первый слог 
15152	 всякий случай название народный алкогольный напиток кумышка выражение шиш кумыш этот кумыш отношение иметь потому ударение ставиться первый слог 
15152	 язык манси вогул ален ударение последний слог таймень 
15152	 теперь слово ендова мочь показываться странный непонятный старый москва оно вызывать вопрос каждый кабак многий дом быть ендова ударение последний слог чаша носик правило 
15152	 каждый шесть загадывать слово отнимать один два слог 
15152	 ударение незнакомый слово ставиться такой правило слово кончаться согласный ударный быть последний слог гласный предпоследний 
15152	 так название болезнь коклюш ударение падать последний слог заканчиваться согласный 
15152	 она еще произносить он быть по-особенному затягивать слог грубый болезненный голос 
15152	 поэтому истинный вещь быть бог невыразимый слово весь полнота августиново слово как прекрасно переводить выражение киевский переводчик неизглаголанный любой глагол слово слагать представлять буква слог дрожание дрожь развертывать 
15152	 это обращать внимание августин восхищенный красота античный учение плавный мерный сочетание колон комма буква слог прилаженность звук звук буква 
15152	 сто рица кто треск трубка фамилия приходиться прокричать слог 
15152	 потому вы устраивать международный скандал слово международный он произносить слог 
15152	 замечательный слово произноситься они ударение последний слог становиться еще более замечательный 
15152	 ударение первый слог подытоживать громила презрительно харкать музыкант 
15152	 записывать ноябрина взять первый слог последний быть нона 
15152	 затем перевертывать низ вверх становиться читать медленно слог так лежать стол 
15152	 слово понимать я произносить тюремный диалект ударение второй слог 
15152	 видеть радоваться головачев второй слог ударный широко второй 
15152	 прочитывать место весь ударение первый слог магический формула быть произносить 
15152	 все происходить политический светский личный жизнь адвокат керенский ударение второй слог звездный 
15152	 двое петербургский бизнесмен анваров усманов регистрировать новый фирма решать слеплять ее название скорый рука попросту соединять первый слог свой фамилия 
15152	 соглашаться называть ровесник еще соперник поэзия учитель называть по-пушкински учитель ударение первый слог такой требовать великодушие бескомпромиссность 
15152	 постановление усыновление взять становиться громко читать слог 
