15152	 точно так ваш императорский величество гулко слитно слог как кто-то дирижировать 
15152	 похвастаться отлично переплетать зеленый сафьян тиснить золото книжка шишков рассуждение старое новое слог автограф денис давыдов 
15152	 вы быть слог быть прекрасный мысль например 
15152	 волнение он удваивать начальный слог некоторый слово 
15152	 по-русски он говорить торопиться проглатывать один слог выпевать другой чувствоваться он 
15152	 все уставать слог высокий все хотеть прекрасный ясность 
15152	 привирать красота слог напутывать что-нибудь 
15152	 этот серьезный лингвистический литературоведческий работа впервые становиться возможный говорить рождение жанр танка поэтический форма слог 
15152	 записка терять тут недавно находить испугаться мой рука написать боже какой орфография буква пропускать слог переставлять глубина душа я 
15152	 судя этот официальный казенный слог написать письмо антон иванович флот 
15152	 поглядеть какой грустный ясный взор увидеть здесь все какой элегический настроение говорить старинный прекрасный слог овевать каждый строка все 
15152	 я человек отзывчивый садиться время дежурство написать люба письмо шуточка прибауточка попытка освежать мысль слог который я так наблатыкаться 
15152	 этот трактовка она иллюстрировать другой четверичный структура текст гаудапада фаза рецитация священный слог ом правило санскритский фонетика 
15152	 он быть манера делить слог поддерживать мимика какой-нибудь важный 
15152	 свой варварский слог он уметь выражать такой тонкий 
15152	 как расходиться весь издание благодарный быть публика весь предприятие зачитываться наш юноша рассказ невыдуманный увлекательный крайность переноситься они отдаленный страна понимать они польза себя геройски простодушный рассказ пленник головнин мастерской слог г гончаров один время 
15152	 наш журнал быть уже говорить содержание достоинство книга мы теперь разбирать занимательность рассказ совершенство слог уже быть отдавать надлежащий похвала 
15152	 здесь биограф сознаваться он что решаться говорить такой нестоящий низкий щекотливый скажем более обидный иной любитель благородный слог подробность весь 
15152	 что касаться глава слог вообще она должный состоять 
15152	 потом пустой манера разделять сочинение род внешний форма определять какой род сочинение какой приличный слог 
15152	 слог ваш описание быть зависеть 
15152	 выслушивать надлежащий распекание приговаривать виноватый ваш превосходительство наконец сквернохульничать произносить самый страшный слово так старушка хозяйка креститься отроду слыхать он ничто подобный то более слово этот следовать непосредственно слог ваш превосходительство 
15152	 каждый язык каждый автор быть выражение непереводимый весь объезд слог выражать они вполне 
15152	 он написать акулина письмо самый четкий почерк самый бешеный слог объявлять она грозить они 
15152	 должный я извиняться то такой простой слог мой сочинение быть несколько чужестранный 
15152	 быть заставлять ждать себя час сорок минута громко раздельно отчеканивать отец григорий подчеркивать каждый слог удар пол свой тяжелый 
15152	 почему-то кажется такой бедноватый торопливый слог правдиво все представать судьбинный мощь 
15152	 ольга пахомова скрипалево жена это бунин мемуарист какой слог какой отношение человек 
15152	 прежде зара придавать они однозначный смысл они походить заклинание составлять слепо пригонять друг друг слог звук предназначать 
15152	 несмотря то поведение софья андреевна взвинчивать самооправдываться одновременно агрессивный слог ее дневник появляться нечто совершенно 
15152	 особый красота сыскать сила быть быть слог свой русский летучий 
15152	 приказ верховный главный ман дуть растягивать он последний слово уже часто войско го украинский фронт содействие войско го украинский фронт полуторамесячный осада упорный бой трудный условие большой город февраль вера растягивать слог разгром окружать группировка противник 
15152	 опытный человек слог говорить целый слово показывать 
15152	 он лиза карамзин например говорить любовь такой квадратный слог какой ломоносов писать ода 
15152	 то он произвольно искажать слово заменять они буква добавлять лишний слог обрубать конец 
15152	 он доставать кеманча проводить струна несколько раз давать верный настрой мы запевать загудеть алла получаться сносно правильный техника дыхание речь еще идти я слегка задыхаться скрадывать нос одышка излет слог 
15152	 ты иметь вид удивляться я цветистость слог отто ответ мой друг 
15152	 короче они я звать я просить ваш разрешение мария порадовать слог письмо грамотность анатолий видно 
15152	 занудный хромать каждый слог жалоба лэри путаный ветвистый 
15152	 умозрительный допущение то год двор поэтический слог ломоносов дорожить много чей-либо 
15152	 современный человек говорить язык гоголь то это прихотливый нарочито приглаживать слог сам автор ревизор 
15152	 лечить приглаживать несуществующий борода карикатурный воздевать рука небо ты послушать какой слог какой оборот 
15152	 наконец искомый рино рин го лог чес кой слог прочитывать маринка белиберда какой язык 
15152	 написать это быть заунывный слог добротный пресный предложение 
15152	 какой письмо какой слог благородство 
15152	 каждый слог можно использовать один раз 
15152	 бракосочетание быть совершаться отвечать он насмешливый расстановка каждый слог 
15152	 так теэтет е отмечаться слог совокупность сумма 
15152	 сам слог этот документ я быть задеть 
15152	 сам этот слог выдавать немой как 
15152	 гэбэшный псевдоним аниколаев довольно гладкий слог наверное сам петька большевик 
15152	 барабанщик почему-то аккуратный галстук бабочка вколачивать каждый слог гвоздь 
15152	 работа отличаться ясность слог легкость восприятие 
15152	 кто-то уже бегло себя читать кто-то буква слог составлять становиться они получать 
15152	 че го тот три слог я думать теперь понести 
15152	 я говорить вы жать тесь последний слово она проговаривать слог я разбирать 
15152	 он читать дрожать голос слог русский буква вывеска наш 
15152	 вокальный уровень целое удовлетворять исполнение ряд случай скорый песня неоправданный ускорение темп забалтывание слово мало игра слово слог напрямую результат вокальный работа 
15152	 уже уходить разминуться полчаса перекресток татьянина дочь услышать слабый дальний голос ручей перелив несколько нота несколько слог ручей существовать детство освальд быть 
15152	 сплошь документ быть сырье натуральный канцелярский слог середина позапрошлый век взамен сюжет 
15152	 какой-нибудь настоящий извинять руина смысл слог я иметь вид 
15152	 комбинировать они можно построить слог 
15152	 системный отношение это то я говорить уже принцип иерархический кодирование комбинирование звук они слог 
15152	 то быть так звук мы строить слог слово дельфин простой 
15152	 ты опять слышать го спрашивать слог 
15152	 свой буква каждый слог один буква просто 
15152	 ударение почему-то первый слог глаз восхищение 
15152	 то он левша заставлять писать правый рука он развиваться редкий болезнь трудно воспринимать буква текст путаться слог слово 
15152	 юстиниан приходить вывод то терминология сам себя иметь вторичный значение важный благочестивый разумение имя слог речение 
15152	 поражать изумительный чувство слог прекрасный русский язык особый стиль 
15152	 этот сцена быть уже писать широкий развязный слог бульварный листок ловецкий читать они 
15152	 ее угнетать такой степень она начинать писать письмо почти телеграфный слог 
15152	 это сказываться его речь он путать чередование слог слово история его чудесный 
15152	 сергей берндгардович позвать капитан смолянинов слог выговаривать его отчество 
15152	 он останавливаться окно повертываться пристально глядеть дорохов сказать слог вы вать 
15152	 мочь зрелый мужчина наш страна представлять себя нечто достойный народный государственный доверие проходить он суровый школа комсомольский партийный комитет научаться работать человек люди постигать партийный дисциплина партийный мышление ударение нужный слог 
15152	 особенность это гимн заключаться то каждый стихотворный строка он начинаться тон выше результат что образовываться некоторый звуковысотный последовательность связывать непосредственно стихотворный текст первый шесть слог текст 
15152	 подлинный цель фиксация линейный нотация заключаться то стоять сольмизационный слог графический выражение 
15152	 плохой сегодняшний кореец японец который еще четыре год то осваивать футбол слог 
15152	 желательно получать выход связный речь набор слог произвольный последовательность 
15152	 час смотреть рваный газета складывать слог сти с 
15152	 любопытный димон приходиться угадывать слог бурчание то 
15152	 он вытаскивать сумка утренний газета прочитывать слог заголовок 
15152	 я рад то много переводить стих это учить следить сжатость речь дорожить каждый слово каждый слог проза 
15152	 опять чей-то экипаж подорвать бульвар слагать слог баклавский 
15152	 первый раз он напрягаться сергей анатольевич давыдов чуть слог продиктовать свой постоянный адрес 
15152	 исследователь сказать аннотация показывать связь панталоны фрак жилет полемика старое новое слог размышлять владимир ленский как 
15152	 переходить я пока поздно опять свой суконный слог который речь идти 
15152	 прощать высокопарный слог это общенародный общенациональный дело 
15152	 лицо она знакомый пойти красный пятно она совладать себя как подытоживать отчеканивать слог 
15152	 мы так мило он верность пушкинский след неизменность слог душа она другой 
15152	 особенно разительный отличие запись розанов отсутствие они тот розанов занимать постоянно авторефлексия повод свой манера слог жанр 
15152	 изысканность лекарский слог мешать вникать суть дело 
15152	 спотыкание инвалидный язык дядя федя его натужный подъем гласный вершина слог эхо возвращать произносить дядя федя 
15152	 должный сознаваться теперь уже проза пушкин старый слог манера изложение 
15152	 кино оставаться самый вершина роковой ударение первый слог культура самый роковый ударение 
15152	 разговор рассыпаться слово слог буква нет они 
15152	 музыка замолкать этот рука начинать вытанцовывать свой безмолвный танец мелькать мелькать сотня рука необыкновенный тишина зал шорох шарканье напряженный глаз который смотреть глаз другой рука что-то читать читать глаз стараться упускать буковка слог слово застыть лицо 
15152	 долго слог читать я она когда 
15152	 то более включать этот план югославский режиссер мирослав белович ударение первый слог повторять наш сцена свой 
15152	 тан нел повторять он слог то олег 
15152	 они форма красота слог округлость фраза подменивать мысль страсть 
15152	 некоторые правда подобный плавность чистота слог смущать 
15152	 много все софья андреевна злить девчонка начинать она подражать она возникать ощущение этот крупный тяжелый ребенок буквально виснуть она она усталый тетрадь сумка продукт должный еще двигать шевелить этот безвольный рука нога повторять жест слог делать ошибка ударение 
15152	 внутренний воин должный обладать чуткий слух острый зрение готовность открывать огонь поражение первый представляться случай способность хранить память течение три час два слово длина каждый который превышать три слог пароль отзыв 
15152	 меньшой брат державин баратынский хлебников товарищ заболоцкий мартынов петь наш существование день торжественный слог слово полк игорев 
15152	 язык его заплетаться острый клин китайский слог 
15152	 торжественно чуть слог читать мы побеждать враг 
15152	 сметь утверждать весь это быть выдающийся говориться нетленный произведение некий достойный качество кое-какой мысль внятность слог занимательность потребитель гарантировать 
15152	 варламов писать усреднять девятнадцативечно эмигрантский советский дистиллированный слог предпочитать мягкий тон описание 
15152	 никто вправе пользоваться этот магический слог отношение они понимать 
15152	 год мой внутренний слог складываться я он 
15152	 фон беспрерывно повсюду звучать рок-музыка странно выглядеть газетный дискуссия то какой слог следовать ставить ударение фамилия 
15152	 мы редакция поступать факс мосгорсэс скупой канцелярский слог никакой эмоция 
15152	 возможно дело то люба скромный обучать краснобайство завитушка слог 
15152	 приписываться флорентийский музыкант использовать больший сравнение звучность первый слог собственный фамилия наш ухо 
15152	 человек глухой один ухо смочь разбирать один слог например сказать что 
15152	 этот письмо быть написать очень изящный слог 
15152	 нынешний циничный читатель слог тутаевский подвижник мочь показываться слегка 
15152	 главный они оставаться сам форма обращение девический доверительный слог письмо почерк конечно 
15152	 преисподний адский здесь содержать себя внутренний форма свой исподний нижний платье близкий тело стыдный скрывать что быть остро чувствительный гоголь преминуть например упоминать насущный нужда акакий акакиевич штука два то белье который неприлично называть печатный слог 
15152	 тут я поймать себя то предложение солнце выводить один тот слог второй раз 
15152	 этот подробность толстой интересовать внутренний мир хадж мурат слог его речь манера поведение 
15152	 заглядывать зачетка выделять каждый слог прочитывать написать она чужой 
15152	 сразу далеко сразу выныривать митя весь безобразный несообразность канцелярский слог простор складной ладный 
15152	 то менее нет причина обращать внимание то три слог один корень язык 
15152	 мечтать деньги можно спорить наследство дело доходить вопрос какой путь реальность складываться богатство так сцена выходить вульгарный петр петрович лужин раздражать уже то слишком плохой судейский слог писать слишком довольный свой 
15152	 нормальный взрослый человек объем она иметь вполне определенный значение называть различный слог буква цифра он 
15152	 мы хотеться обращать внимание чуть настораживать парение слог 
15152	 бывать видимо время сам слово свобода лишаться смысл польза научаться читать он слог 
15152	 бальзак они написать лубок столетие потому дедушкин устарелый слог оказываться весьма подходящий 
15152	 я хотеть пользоваться нынешний общепринятый ударение первый слог поэтому везде текст ставить 
15152	 отец писать они отличный слог который можно нынче позавидовать 
15152	 раздельно почти слог прокричать дама коляска 
15152	 правда слог редакционный заметка быть довольно убогий 
15152	 грушков они разбирать знать он знать читать легко видеть где фамилия недоставать три буква где пять где вовсе слово оставаться один единственный слог 
15152	 вы полагать я рука медленно слог проговаривать несчастный 
