15152	 например прилагательное русский рефлексивный прилагательное английский нерефлексивный прилагательный трехсложный рефлексивный этот слово состоять три слог прилагательное четырехсложный нерефлексивный состоять 
15152	 поэтому автор таблица японский русский транслитерация сто год назад выбирать передача слог обозначать латинский буква 
15152	 особенно получать новогодний пожелание авторский картинка старинный репринт такой забавный немецкий открытка который надо надписывать разбирать кусочек паззла получатель заново слагать слог ваш послание 
15152	 повторять слог пять сят рубль 
15152	 эра джи яс слог прочитывать его название капитан 
15152	 ты лунинский бабка говорить он небрежно голос ораторский хорошо поставлять все равный брать свой отзвякивать ударный слог 
15152	 слог пиитический аполлиноватый хотеть видеть 
15152	 ахматова быть аграфия пропуск слог парадный беловик 
15152	 губайдуллина елена головокружение слог канадец привозить спектакль война 
15152	 возможно слог константин рудницкий малоэкспрессивный скупой 
15152	 все быть прозрачный невозможность имя мятежный князь расписывать слог прегрешение его держава излагать 
15152	 решение упражнение разложение левый часть множитель слог плексиглас прочитывать света шульгин 
15152	 математический анализ распределение ударный слог новелла мерим кармен налагать 
15152	 балансировать пауза слог лихо оступаться препохабие 
15152	 внимательно впопыхах чуть слог прочитывать крим экспресс 
15152	 почему он имя агамемнон соответствие оригинал сохранять ударение третий слог 
15152	 слог гоголь надо сказать впрямь 
15152	 спасаться взбухать трудный слог неловкость пимыч спрятать густой 
15152	 коридор два парень банка пиво водить палец биография кандидат читать они вслух почти слог 
15152	 один лурье создавать собственный система стихосложение она метроном звучать собственный метафизика она небытие первично определять сознание кто похожий слог который вырезать игла 
15152	 твердо отвечать марина смутный прежний знакомый край ухо слышать спина пресса агитатор пытаться скандировать плохо собираться голос неразборчивый лозунг лозунг путаться лишний слог никак раскачиваться 
15152	 леха мент вместе сникерс вынимать карман клочок бумага таиться открытый прочитывать слог о лак 
15152	 букварь этот быть издавать год название первый учение отрок она буква слог прилагаться символ вера некоторый 
15152	 мужской смениться женский сделать мягкий акцент слог 
15152	 возможно этот характерный черта обуславливаться традиция япония хайку например слог может она определять высокий 
15152	 валерий захарович она стараться выговаривать слово почти слог все равно получаться слишком 
15152	 рен последний слово он произносить слог вы товарищ называться 
15152	 она произносить этот слово медленно чуть слог 
15152	 анна ионовна смущенно принимать грамота неловко взять кукла который вдруг закрывать стеклянный глаз внятно выговаривать слог 
15152	 это быть непонятный речь знакомый весь буква слог слово непонятный непостижимый напевный 
15152	 ваня диагноз глухота выговаривать слог 
15152	 хорошо медленно слог произносить она я посмотреть 
15152	 название американский платежный единица зураб произносить несколько раз ударение второй слог 
15152	 усиливаться приступ удушье он уже мочь ничто выговаривать слог 
15152	 он хорошо говорить по-русски слишком тщательный проговаривание каждый слог выдавать заместитель главный редактор 
21947	 я снимать месяц деревня кино я обязательно привлекать говорить высокий слог пространство время 
15152	 век вообще служба увеличиваться количество пение петься становиться то рано читаться полугласный заменять гласный хомовый пение погоня мягкость нежность гладь вводить дополнительный слог 
15152	 второй рисунок жалобно злобно реветь пасть фюрер она второй слог рев 
15152	 ян любить яблочный сок почти слог проговаривать митя 
15152	 че го се как слог произносить дашка мама ты 
15152	 немзер предельно лаконичный остальное выверенность слог продуманность мотивный перекличка символика достоверность 
15152	 внятно слог отчеканивать господин стол 
15152	 длинный тяжелый коса туго вплетать красный лента ударять девочка спина она резко сводить лопатка вскидывать узкий подбородок ее походка становиться еще легко ухо чеканить каждый слог вибрировать вперемешку знобкий порыв 
15152	 бес переть спечь тив вслух слог произносить хрусталев садчиков владеть роскошный 
15152	 конечно репутация дмитриев слаповский вполне складываться их последний вещь требовать беглый замечание детальный анализ семантика сюжет жанровый стратегия особенность слог 
15152	 она сразу узнавать я задыхаться так слово выговаривать слог 
15152	 броневой капулетти самый потрясать смерть племянник брак дочь насквозь он пронимать другой он сообщать светопреставление чеканить слог 
15152	 нетрудно догадываться проигрывать экспроприировать идея особенно слоган некоторый коммерсант слог весьма туго некоторый время 
15152	 мочь антон объяснять он много весь лапоть вместе взять настоящий будущий он нравиться сам слово гурка он произносить выдвигать последний слог вперед челюсть что обтягиваться 
15152	 тут мочь быть хорошо никогда можно сминать последний слог 
15152	 поменять место слог слово узнавать какой 
15152	 тут каждый слог замечать честь тут 
15152	 леон терстоун свой знаменитый статья год аттитюд мочь быть измерять писать я определять аттитюд намерение реагировать позитивно негативно психологический объект который мочь быть любой символ личность фраза слог идея который индивид 
15152	 писать я ударение второй слог всегда 
15152	 саша тот страна где ты плутовка замужем тот франция где ты наверное называть сашель винограждать ударение последний слог вспоминать ты иногда абхазия 
15152	 гийевик читать много почти весь сонет читать марсенак арагон разный стих они один написать форма сонет зло тцар ответ сонет тцар китайский сверху вниз один слог рифмоваться сонет 
15152	 он все равный нервничать прикалываться себя отсюда такой слог 
15152	 писание рассказывать богочеловек мы так становиться рассказывать человек слог самый простой изначальный библейский 
15152	 удостоверяться илья вооружаться лупа становиться читать слог написать картинка 
15152	 ужасаться федор федорович корф чиновник прозаик драматург чей легкий веселый слог хвалить пушкин 
15152	 друг останавливаться надгробие зажигать карманный фонарик последний слог быть почему-то стереть 
15152	 возможно человек пугать странный дисфункция его речь слово который он пытаться произносить распадаться слог который потом склеиваться друг 
15152	 лара жена жан сходить маман говорить она куст баня жан муж слог ди я ти рюс ро манс мой 
15152	 первый слог расслышать узнавать его настоящий 
15152	 воспроизводить четыре строчка оговаривать помнить разбивка лесенка проставлять ударение разделять слово слог пытаться определять размер 
15152	 страшно быть подумать крикнуть что-нибудь свой беззвучный голос хоровой радиогром где целый тысяча железный народ петь слог один тот гордый 
15152	 один слог один иероглиф включать 
15152	 быть слог который произноситься одинаково быть 
15152	 изумленный нинино он внимание быть свой время разбудить то плавной течение этот вербальный совершенство вдруг вывинчиваться часовой стрелка варварски екнуть словечко звонить барачный ударение первый слог 
15152	 этот вывеска висеть долгий год никто делать попытка она заменять исправлять быть известный автор этот лишний слог 
15152	 я так сказать решаться марат отчетливо слог прошептать она ухо говорить 
15152	 сравнивать первый строчка строфа первый строчка антистрофа второй второй так далее число слог расположение ударение всюду быть 
15152	 этот наречие оно переходить латинский язык перемещать ударение облегчать средний слог получаться махина 
15152	 тот время приказ учитель малыш браться буква слог 
15152	 это говориться тот цитата пастернак который единственный мой жизнь довлатов выписывать еще молодость весь жизнь стремиться выработка тот сдержанный непритязательный слог который читатель слушатель 
15152	 кто там четко слог спрашивать я хороший мать пробурчать 
15152	 главный трудность который сообщение западный ученый справляться оставаться язык свиток проблема заключаться иносказательность слог точно отыскание единственно верный 
15152	 главное ораторство красота слог то сказать правда 
15152	 начертание буква слог письмо весь немой выдавать 
15152	 так формальный структура стих основывать частность повторение сходный звучать слог согласование существительный прилагательный 
15152	 реальный ударный безударный звук чистый ударный безударный слог акустический данность они 
15152	 сопротивопо ставляемость звук отношение ударность вопрос реализовать ударность быть иметь место ударность реализовать ударность данный случай существенный это подтверждаться то отношение слог неударный позиция ударный 
15152	 это говорить ямб мы обозначать неударный слог как ударный как 
15152	 раздробление стих заканчиваться уровень слог 
15152	 ритмический единица образовывать система соотнесение свойственный поэтический речь делить стихать составлять он лексема фонема слог 
15152	 русский силлабик характерный чтение слог 
15152	 все слог читаться ударный вдох 
15152	 отсюда внутренний связь сказочный сюжетосложение иронический слог традиционализм пересмешничество установка 
15152	 мы родина начинать он проникновенный странствующий рыцарь принимать называть человек вдруг становиться особенно близкий слог ху 
15152	 казаться ухватывать ситуация коварный слог легкий улыбка появляться 
15152	 раздельно подтверждать доктор использовать свой рыцарский право магический слог это он преданно глядеть 
15152	 он отчеканивать это слог громыхнуть напоследок стул 
15152	 удить тельнопроизносить он медленно медленно сон растягивать слово слог почти напевать 
15152	 мой быть форма речь ее слог 
15152	 тогда все беспорядок речь язык слог все скрипеть телега 
15152	 прощальный письмо быть литературный жанр качество таковой требовать автор находить необходимый равновесие новизна условность новизна заключаться уже то рассвет я быть весь вероятность убивать дуэль тогда традиция презирать всякий новшество традиция запрещать уделять этот весьма возможный факт слишком много внимание традиция предписывать сдержанность здравый смысл сухой красота слог 
15152	 жевать корова слог квадратный биться пульс выя 
15152	 русский язык ударение ставиться разный слог 
15152	 затем ты часть возвращать я три миллион оставаться миллион снимать свой гениальный кино отчетливо чуть слог произносить максим глядеть алексей брюс 
15152	 последний три слово она отчеканивать слог вновь засмеяться 
21947	 семантически слово значит стилистически оно значить знак высокий слог наш слух близко первый значение 
15152	 чтение стихотворение то более многий стихотворение один поэтический культура читатель складываться система ожидание стихотворение начинать пушкинский ямб ударение он быть ожидаться каждый второй слог лексика быть возвышенный 
15152	 стиховедение норма строение стих называться метр метр стопный ямб ударение четный слог мой дядя самый честный правило отсюда читатель возникать ритмический 
15152	 докладывать говорить ударение второй слог 
15152	 народ кстати почему-то всегда называть он ударение первый слог фидель 
15152	 катя послушно повторять слог складывать они слово вскидывать 
15152	 выделять слог становиться название нота 
15152	 слог содержать гласный звук восприниматься 
15152	 так правый ухо подаваться слог левый 
15152	 тенденция повторение слог приводить дальнейший целый 
15152	 вейра отмечать сделать он звукозапись лепет месячный китайский ребенок существенный отличие лепет их русский американский сверстник китайский ребенок произносить преимущественно отдельный слог их повторение отдельный 
15152	 приблизительно так ударение второй слог звучать слово черный сленг 
15152	 наш корреспондент выяснять кумир виктор детство быть большой пролетарский писатель горький это слог этот перо восклицать музыкант 
15152	 виктор неуклюже сказать он ударять заключительный слог вдруг ослабевать губа 
15152	 тяжелый слог изъясняться яков саулович господин 
15152	 рукопись хазред цветистый арабский слог расписываться возвращение земля человек 
15152	 русский произношение два долгий слог подряд бывать 
15152	 г-н теплый пытаться читать рукопись вслух стараться нащупывать какой-нибудь ритм помощь чередование ударный безударный слог поймать разгадка 
15152	 он комбинировать слог использовать старинный методика грабба построить 
15152	 тридцать два слог стоять целый книга 
15152	 такой образ важный интересный широкий публика идея перо кюстин должный быть получать дополнительный звучание он задавливать они тяжеловесный слог 
15152	 бесконечный целое существовать этот телесный пространственный видимый вещество голос звук тон он невидимый он быть тут нельзя вспомнить августин его сближение существо время длительность песня я знать время так как знать длительность слог спеть я еще 
15152	 самый дело слог герой формироваться направление как 
15152	 такой лукавец говорить он слог замечать никитенко 
15152	 жажда слог стыд два полюс существование 
15152	 воспоминание п анненков белинский хотеть помогать достоевский выправлять слог сообщать он сильный так 
15152	 ты он буква слог разучивать 
15152	 пожалеть увечный она произносить слог липа тот 
21947	 верить обращаться их чувство честь высокий слог вызов герой седой незапамятный старина 
15152	 женщина производить впечатление учтивый галантный старинный слог сказать яр тур показывать всадница 
15152	 старинный слог здесь жаловать свистнуть ременный 
15152	 седина стерильный чистота общий матовость безукоризненность мягкость черта лицо складка одежда степенность размеренность жест движение речь двигаться он слог весь это необыкновенно располагать 
15152	 военный стезя генерал-лейтенант хрущев пролегать так звездный звук у первый слог тут помогать 
15152	 водить палец купчиха приниматься прилежно вычитывать слог 
15152	 этот слово она повторять несколько раз слог 
15152	 тот дело восклицать она полет необычайный иностранный ударение первый слог несомненно говорить она 
15152	 нестеров почерк нелегкий слог самобытный неслыханный новый 
15152	 они я два раз он сделать ударение последний слог два раз вже отказывать 
15152	 ритмизация зачастую достигаться растягивание добавление слог счет эмфатический частица 
15152	 мы вать проговаривать слог диктант мочь спрашивать 
15152	 этот секретарь горком партия спокойно слог сообщать рафик 
