15152	 кстати ударение его фамилия последний слог каталонский звучать по-французски 
15152	 читать слог большой творческий деятельность 
15152	 дедушка приезжать тамбовский деревня немец где ударение падать последний слог 
15152	 юрий енцы так по-московски ударение первый слог 
15152	 мент энергично сделать ударение первый слог человек сказать подумать 
15152	 аз космонавт новый русский касса буква слог здравствовать дружок 
21947	 каждый мы проявлять сознательность гражданский долг прощать высокий слог 
15152	 нур ган дов терпеливо произносить парыгин слог 
15152	 возможно хозяин стерпеть кофе средний род ударение первый слог слово звонить они 
15152	 ставить он выразительный ударение второй слог 
15152	 особенность мелодия это гимн являться постепенный повышение начальный слог каждый шесть первый полустишие 
15152	 экран напоминать экран обычный телевизор непрерывно возникать знак соответствующий наиболее употребительный слово часто повторяться слог 
15152	 фамилия сражать сказать он казацкий правильный ударение первый слог 
15152	 тогда год второй неделя словарь столичный богема обогащаться два французский заимствование неестественный ударение последний слог бутик ку 
15152	 спрашивать он ударение первый слог 
15152	 вообще разница долгий слог ударение утрачивать 
15152	 евгений еще раз пробежать глаз строка доходить слово март месяц проблема заработный плата быть поставлять пометка означать последний слово надо произносить громко четко желательно слог 
15152	 очень важный изменение история русский язык касаться произношение безударный гласный теперь безударный слог мы мочь произносить 
15152	 первый слог надо делать ударение 
15152	 ксе я произносить он разбивать слово слог наверное пущий убедительность я 
15152	 первый критика бедный человек оценивать этот слог находить он 
15152	 акакий акакиевич достоевский так можно быть определять стилистический амплитуда бедный человек этот предел формироваться слог 
15152	 стараться я внимательно следить ударение свой язык изобретать спасительный правило знать где поставлять ударение ставить он один слог близко конец слово 
15152	 начало век появляться тенденция переносить ударение один слог близко начало слово 
15152	 славянский потому ударение всегда падать первый слог 
15152	 зря он козел обзываться такой слово можно шея любить я этот новый слог прорекать вопрошать можно по-старому 
15152	 принц полуконь толковать основное лошадь понятие честь который кентаврос оказываться весьма своеобразный плохой странный слог 
15152	 все быть он подбородок крутой ямочка рост достаточно невысокий указывать остряк первый слог его фамилия звук 
15152	 так приходить их жизнь третий прелестный каурый трехлеток интрига строптивый дочь интернационал риголетта унаследовать полагаться кавалерийский лошадь первый слог они имя 
15152	 странный образ я начинать слышать понимать слышать по-другому чувствовать уже слово каждый слог 
15152	 это священный египетский слог который навозник уже много тысячелетие 
15152	 тихо прошипеть вишнегубый эдик подозревать дора пригородный вариант древний вода булыжник величественный имя песнопевица дебора отголосок великий слог который он сейчас кастетчик 
15152	 произнесение этот слово ударение второй слог весь произносить означать планирование 
15152	 по-настоящему применение хозяйствование надо произносить ударение последний слог планировать 
15152	 повторять слог потребоваться уже семнадцать повторение 
15152	 сейчас взять начинать считать армия офицер ударение последний слог произноситься семнадцатый когда 
15152	 этот мой реплика быть эмоциональный реакция столько неправильный произношение фамилия боннэр ударение последний слог главный образ почувствовать 
15152	 первый слог мой фамилия говорить один 
15152	 как уже упоминаться стихира канон святитель герман иметь ясный отчетливый структура ясность простота слог 
15152	 толик становиться подгнусавливать произносить слово французский манер ударение последний слог 
15152	 значит так количество продукт должно соответствовать потребность общество раздельно слог произносить федор 
15152	 весь учреждение тогда именоваться очень кратко первый слог первый буква 
15152	 фамилия этот древний дворянский дважды родниться голицын ударение надо делать второй третий слог 
15152	 прежде начинать этот глава хотеть оговариваться мы называть свой родитель папа мама ударение последний слог 
15152	 все называть он ударение последний слог то он быть 
15152	 такой образ задавать интонационный структура это значить расчленять предложение указывать тон т е соответствующий каждый группа указывать группа какой слово предел группа падать ее акцент предел слово ударение естественно падать ударный слог 
15152	 петь стих проза потом читать нараспев немного растягивать слог потом читать неплохо 
15152	 некоторый слово произноситься замедленный как слог 
15152	 этот мой реплика быть эмоциональный реакция столько неправильный произношение фамилия боннэр ударение последний слог главный образ почувствовать 
15152	 ребенок он сразу учиться читать сначала слог потом отдельный слово потом предложение 
15152	 юрий яковлев захлебываться глотать буква слог слово я трудно говорить товарищ 
15152	 все быть предел всякий разумный человек ясно исключение ять он подобный знак строй алфавит обеднять слог отечественный язык 
15152	 он допевать последний слог его оборвать резкий аккорд выстрел 
15152	 я интерьесно этот думать вы тщательно слог произносить он 
15152	 она раиса равиля ударение последний слог татарка 
15152	 поразмыслить это обращать внимание легкий слог послание быстрый изящный способ изложение 
15152	 весь вероятность представлять себя слово образовываться результат перестановка слог более древний слово долонь долонь лодонить ладонь 
15152	 оканье называть полный звук различаться весь предударный заударный слог 
15152	 этот звук различаться первый предударный слог такой оканье называть неполный 
15152	 здесь заслуживать внимание тот факт окать произношение употребление звук безударный слог обычно совпадать написание буква 
15152	 безударный слог акающий произношение этот звук 
15152	 можно сказать аканье звук получать исключительный право употребление безударный слог заменять себя безударный гласный 
15152	 полотнище становиться медленно опускаться колебаться открывать народ разный слог подрывной слово 
15152	 процесс опосредование мало помогать тот они который устанавливать чрезмерно формальный связь связь созвучие например понятие сомнение рисовать рыба сом потому совпадать первый слог слово дружба два 
15152	 делать ударение первый слог оно становиться оценка 
15152	 например узнавать слово делиться часть слог который можно переносить строка 
15152	 он настаивать его имя произносить ударение последний слог боб бобок достоевский 
15152	 он выставлять большой палец нога разрывать кожа запекаться черный кровь костя белоголовый большой растопыривать ухо быть два год старый брат он готовиться идти следующий год школа знать весь буква уметь слог читать оттого посматривать 
15152	 я знать сделать господин карамзин эпоха история русский язык сделать так очень худо сделать эпоха значит произвесть некоторый перемена слог книга мой пространный 
15152	 умный пылкий никита муравьев требование предъявлять восемь выходить том декабрист орлов некоторый остряк который ужин перелагать первый глава тит ливия слог карамзин 
15152	 первый воспитанник пажеский корпус который я доводиться знать я называть андрей петрович иванов ива новый фамилия свой воспитанник пажеский корпус он произносить особый манер ударение первый слог 
15152	 я знать кто это сделать отчеканивать каждый слог сказать алик 
15152	 затем они изучать буква переходить чтение слог слово обозначать название окружать 
15152	 большой воспитательный ценность указывать е н водовозов обладать также басня который характерный простота слог тщательный художественный отделка остроумие 
15152	 перечисление синонимичный число слог приходиться каждый слово 
15152	 что действительно почерпать имя использовать впоследствии нужда стихотворение это первый слог имя райнер 
15152	 этот зависть почти ревность время этот рыдать какой счастие сбиваться смещение ударение первый слог ты простонародный оканье 
15152	 ты узнавать сегодня азы тишизм прочитывать первый слово букварь слог 
15152	 федоровна жена она говорить плгода ударение первый слог 
15152	 павлик муж слово человек голос ребенок произносить ударение первый слог 
15152	 слишком либер говорить он врастяжку договаривать последний слог 
21947	 раз показывать вы смочь вы хороший слог 
15152	 один великолепный писательница первый два страница путевой заметка средиземноморье выбегать прямо ловец охватывать громадный тема столько зверь сколько находить зоопарк гаген бек максим горький колумб богданов луначарский кошка дом колумб андреев николба ударение последний слог поганинь мадзиня диккенс эдгар 
15152	 начинать он надо быть прежде говорить все тот военный слог перегруппировывать сила подтягивать тыл и 
15152	 спрашивать конфуций ударять последний слог ученый слово 
15152	 медленно читать слог все раздельно произносить 
15152	 племя сиу змей почитать сиу последний слог прозвище данный племя надовесиу значит 
15152	 изобретать слово заумь оно как слово бездарь сначала произноситься ударение второй слог крученый действовать ум 
15152	 этот голос фрау герберт снижать протягивать слог последний слово душно ожигать он 
15152	 ответ быть никитин сказать он много ничто уже ловить команда княжко знакомый звонко ясный слегка растягивать слог 
15152	 чудиться ощущать слабый вкус ее шершавый губа видеть полураскрытый улыбка влажный зеркальце зуб сиять произносить слог радостный удивление выучивать русский 
15152	 слово токамак состоять первый слог буква название основной элемент 
15152	 случайно выясняться буква я уже знать она становиться учить я читать слово разбивать они слог сразу все слово целиком 
15152	 я вчера выпивать висок хорошо спать о опять протягивать он мадам веретягин нет быть молодой девушка он сделать ударение второй слог вы вчера пить 
15152	 андрей отлично помнить он большой процесс худенький хлопчик очки похожий золотушный изнеженный домашний воспитание гимназистика вдруг этот дерзкий карбонарский слог понятно почему народ заволноваться 
15152	 он привлекать один поэтичный легенда происхождение древний село радуль ударение первый слог 
15152	 древний русь саркофаг называться гробница ударение первый слог 
15152	 прибавлять это очарование крепость старинный слог описание всяческий подробность быт еда 
15152	 однажды я позвонить немой альберт петрович спрашивать известно он отвечать куприн начало свой писательский известность тот господин который предумышленный произносить его фамилия ударение первый слог 
15152	 а теккерей он сделать ударение предпоследний слог честно сказать я 
15152	 вкус доцент сеничкин быть одежда конечно первый очередь слог 
15152	 первый слог икэ означать жить 
15152	 иметься тогда мы три слово который выговариваться совершенно сходный первый слог 
15152	 слово ивнинг вечер немой первое е означать второй е ровно ничто обозначать последний слог опять-таки читаться 
15152	 маленький ребенок играть очень точно подражать звук автомобильный сигнал произносить слог би би 
15152	 поверять мочь заботливый британский педагог переписывать весь роман так немой имя собственный оставаться единый слово длинный один слог 
15152	 имя виктор он произносить незнакомый ударение последний слог 
15152	 следовать сказать сравнение ритмический структура предшествовать кульминационный этот абзац ожидание давать мы совершенно неожиданный картина оказываться слог кульминационный абзац падать ударение 
15152	 казаться это ритмический парадокс напряженный кульминация давать ударный слог мало пластический развертывание тема 
15152	 некоторый время я часто все вспоминать этот односложный имя мочь быть потому мой представление возникать теперь маргарита сильвестр француженка ницца американский авантюристка луиза дэвидсон просто лу этот один слог быть заключать много событие 
15152	 очевидно я неотчетливый произносить первый два слог вы подумать 
15152	 иностранный слово участковый произносить медленно осторожно почти слог правильно 
15152	 у до стоить растягивать слог повторять он слово 
15152	 он произносить этот слово иронический ударение последний слог 
15152	 последний слог предыдущий строка повторяться начальный 
15152	 мой фамилия он произносить ударение последний слог неимоверно гортанный г 
15152	 это быть счет шаг первый слог его знаменитый левый марш 
15152	 слово атомный он нет аналогия слово атомизм атомистический оно должно произноситься ударение второй слог 
15152	 словарь ушаков приводиться исключительно атомный атомность ударение второй слог 
15152	 ударение последний слог вдруг всяческий то 
15152	 весь химик произносить аммиак ударение последний слог тот время 
15152	 тот время мы говорить свинец свинец свинец слово аммиак ударение также должно стоять последний слог 
15152	 отмена он всюду механически заменять положение некоторый гласный особенно это следовать делать написание толкать неверный чтение вводить слово лишний слог 
15152	 прощать я мой неуклюжий слог уже второй месяц я 
15152	 появляться неожиданно это мучительно который хотеться произносить ударение последний слог давать ключ весь стихотворение как 
15152	 все он родич свой фамилия ударение делать последний слог куприн 
15152	 я раздражать делать неправильно ударение первый слог 
15152	 читать складывать слово квадратик буква слог 
15152	 этот модификация быть называть ссср стиповерит первый слог фамилия весь три первооткрыватель стишов 
15152	 я видеть он пожилой женщина огромный жгучий черный глаз узнавать друг друг я показываться она уже готовиться произносить первый слог имя константин вдруг 
15152	 развитие язык совершаться все малыш один тот закон весь русский ребенок равный оглаголивать имя существительное удваивать первый слог выбрасывать трудный согласный бороться 
15152	 новый наблюдение показывать писать нпкрасногорский образование слово огромный значение иметь сила раздражитель быть звуковой сила фонема слог который составляться слово 
15152	 ребенок первый очередь берет упрочивать повторение первый последний наиболее сильный ударный слог слышимый слово 
15152	 дальнейший он присоединять это слог второй сила раздражитель 
15152	 образовывать слово молоко ребенок фиксировать произносить сначала слог мо первый раздражитель связывать 
