0	-    В сериале как ни странно не семнадцать серий и повествование начинается не сном Максима Максимыча засыпающего в своей машине превращаясь в фон Штирлица уклоняющегося от хитроумных нападок проекций Мюллера и агентов гестапо и переходящего на следующий уровень сна в кабачок для ожесточенной схватки интеллекта с 
0	-    Добротная экранизация иногда дословно цитирующая книгу разумно дополняющая и вдохнувшая жизнь в ставших знаменитыми персонажей   И пусть факт того что так глубоко в фашистскую организацию не мог внедриться никто из славян и что появление русской жены в полном шпиков Берлине  это залог полного провала но ведь не будь этого и жизнь на улицах не замирала бы на те мгновения пока он первоначально транслировался по телеканалу а склонные к мелодраматизму дамочки не стирали бы слезы глядя на немую сцену встречи  в кабачок      Не думай о секундах свысока 
37286	редьки моркови тыквы кабачок томатов - -   
37286	И такая тут сытая холёная флора что думаешь о ней как о фауне кабачок как толстые поросята жёлтые красные 
37286	вишни   падающими яблоками огурцами патиссонами кабачок первыми клубнями молодой картошки заготовкой 
37286	Там имелось всё и размашистость нелепого дома с громадным незастроенным вторым этажом где хранились старые газеты дырявые самовары сломанная дядюшкина байдарка чемоданы телогрейки ботинки корзины и куча прочего хлама в нём мальчики любили копаться дождливыми или холодными днями и огород с южной стороны там выращивали лук горох репу морковку свёклу чеснок огурцы и кабачок были плодовые деревья которыми занимался 
37286	помидорами  и кабачок построил себе в Купавне отдельный 
37286	А коммунист папа по-прежнему молчал хранил государственные тайны в партийной печати и проводил политсеминары посвящённые международному положению и осуждению еврокоммунизма один дядюшка выращивал огурцы и кабачок второй лазил в горы и 
37286	Он не пришёл ни на один из судов и добровольно от всего отказался забрав себе лишь заржавевший велосипед созревший кабачок несколько яблок и коврик с 
0	Перед Средней Землёй стояла очередь очередь у входа в лондонский кабачок это невероятно но у Ронни 
0	Что ж тогда будет с миром  спрашивали мы друг у друга в своих ночных кабачок  
0	Жена любовница -летний сын драка в портовом кабачок  
0	Два раза в неделю бряцаю по клавишам в ресторане Ашота  кабачок называется Чёрный голубь  По замыслу 
37286	Я вспомнила как один молодой папа близнецов рассказывал мне Окончательно я осознал себя отцом когда жена вместо обеда предложила мне доесть детский творожок половинку желтка и перемолотый в миксере кабачок с цветной капустой которые жалко 
37286	жен   Ну а овощи не крахмалистые такие как зелень капуста огурцы баклажаны лук репчатый и зеленый чеснок репа редис сладкий перец помидоры Крахмалистые-картофель свекла морковь брюква кабачок патиссоны тыква  
37286	При сухой обработке семена огурцов тыквы кабачок патиссонов держат накануне посева в 
37286	Там никто не ставил домики и не жил как городские а просто сажали скучную картошку тыквы кабачок подсолнухи арбузы  
37286	Золотова    Сегодня была каша гречневая курица с кабачок творожок черничный и иогрут яблоко 
37286	Чертовка    Обед огурец плюс телятина с бататом и кабачок  
37286	Золушка     а ты кабачок морковку не тушишь вместе  
37286	Яичница с салом помидорами и кабачок неестественно яркая словно рисунок ребенка 
37286	Для посадки сильно разрастающихся овощей  капусты кабачок томатов  гряды располагайте на расстоянии 
37286	Интервалы между лунками оставляйте в зависимости от культуры для свеклы лука и других невысоких культур в два ряда   см для огурцов и томатов в один ряд   см для кукурузы дайкона кольраби   см для всех видов капусты в шахматном порядке   см для кабачок арбузов и дынь в один 
37286	В начале мая  огурцов тыквы кабачок ближе к июню  арбузов и 
37286	Пчелоопыляемые огурцы кабачок после зацветания приоткрывайте для опыления 
37286	Кабак  слово заимствованное из татарского языка в - веках наименование дешевого легкого небьющегося сосуда удобного для кочевой жизни сосуд из тыквы кабачок кабака  
37286	Средняя рассада посев семян с  марта по  апреля позднеспелые сорта белокочанной капусты томат перец баклажан огурцы кабачок арбузы дыни репчатый лук брокколи 
37286	Поздняя рассада посев семян с  апреля по  мая  среднеспелые сорта белокочанной капусты цветная капуста огурцы кабачок патиссоны тыквы спаржа ревень и 
37286	Рассада тыквы кабачок патиссона выращивается до  
37286	Поскольку витамин  относится к жирорастворимым витаминам перечисленные овощи употребляйте с добавлением небольшого количества оливкового масла дабы помочь организму быстрее их усвоить     морковь тыква кабачок   Эти овощи содержат другой каротиноид 
37286	желтый перец кабачок тыква кукуруза  
37286	Глядишь через несколько месяцев и вспомнятся эти взаимные советы добрым словом   МАРИНОВАТЬ кабачок  ЧЕГО ЖЕ ПРОЩЕ  
37286	Не охватишь кочаны  Белоснежные хрустят   С грядки смотрят кабачок  Золотистые бочки   Помидоры  огонь  
37286	Во всяком случае московские дамы наезжая сюда в командировки обязательно при отъезде затариваются банками с кабачок  
37286	У них в министерстве здешнее место так и именуется полуофициально  город маринованных кабачок  
37286	Курица с тушеной картошкой из столовой на компрессорной квашеная ларисина капуста маринованные кабачок кекс Уфимский  
0	От доктора же Фауста остался кабачок Ауэрбаха где он попивал пиво 
0	время  спуска на воду нового корабля на торжественном собрании в ресторане кабачок шинке погребке Ауэрбаха и при 
0	Ладно Ян ты говорил что кабачок один неподалеку знаешь  
0	С Артуром он познакомился полтора года назад  во время драки в одном из бесчисленных кабачок открывшихся в столице в конце 
0	Крупнейший порт мира город-купец и промышленник заповедник французской речи французской еды в ресторанах и кабачок столица негритянского джаза  
0	кружкой  пива в горном кабачок У кота на передовых первой и второй 
0	Подобно тому как первоначальное расположение и нерасположение к незнакомому человеку определял в большей или меньшей степени внешний облик его так и первое ощущение неизвестного города и не только за границей подчиняло Никитина доверчивой силе толкающего любопытства и его тянули хаотичность живой толпы кипение ее на тротуарах теснота метро и трамваев переполненные пивные маленькие бары шумные увеселительные кабачок торговые улицы где ежесекундно появлялись 
0	Лота Титтель нетерпеливо взмахивая веерообразными ресницами возбужденная выпитым виски грубоватым напором этого неуклюжего русского гибко полулегла в кресле при этом ее тугая тонкая затянутая во что-то серебристое фигурка выражала острейшее любопытство и Никитину пришло в голову что она вероятно еще не переутомленная жизнью и славой эстрадной певицы любила смотреть бокс спортивные состязания даже случайные драки в кабачок где с азартным удовольствием могла 
0	Многим из них побывавшим в свое время в Париже нравилось что и в Петербурге есть кабачок напоминавший знаменитые парижские кафе  
0	Не помню при каких обстоятельствах Бродячая собака приказала долго жить но помню это было в  году что Борис Пронин получил субсидию и открыл новый литературный но уже не кабачок а шикарный ресторан Привал комедиантов 
0	Они весело обедают на открытых верандах ресторанов и кабачок они смеются едят со смаком 
0	Гейдельберг  старинный город кабачок песни дуэли бурши в романтических 
0	Однажды в хмурый ноябрьский вечер Бернс вместе с друзьями проходил мимо деревенского кабачок  
0	Высокие некрасивые старые дома сплошь заняты под рестораны кабачок кофейни лавчонки с дребеденью для 
0	Вместо фешенебельных ресторанов выросли маленькие спикизи  кабачок  
0	Это был собственно не ресторан и не трактир и не кабачок  
0	Когда кабачок поздно ночью закрывался оба они 
0	Собутыльники кое-как вытащили их из кабачок взвалили на плечи отнесли подальше 
0	В кабачок распевались куплеты очень жизнерадостного содержания 
0	В кабачок распевались насмешливые куплеты против боязливых 
0	В кабачок пели куплеты прославлявшие его прошлое 
0	Иногда не пишется  я тогда бросаю и иду гулять или в гости или в кабачок  
0	Дордонь местный священник Шабо вынужден был по сообщению  открыть кабачок где сам разносит пиво  
0	Поэтому нет ничего мудреного что возвратясь из дневной экскурсии по окрестностям он говорит самому себе вот я и по деревням шлялся и с мужичками разговаривал и пиво в кабачок с ними пил  и ничего 
