32374	 швед происхождение родиться россия сначала воспитываться горн кадетский корпус 
32374	 александр бестужев учиться горн кадетский корпус вступать 
30349	 вильгельм оранский тотчас уезжать нидерланды граф горн эгмонт оставаться надеяться 
30349	 плен взять генерал-майор горн полковник подполковник 
30349	 вести быть генерал-майор горн офицер нести 
30349	 вчера умирать виктор горн замечательный мой собрат литератор ученый 
30349	 горн второй год как впадать 
32374	 билимбаевский горн округ который проживать около 
30349	 тот галстук горн лозунг флаг 
30349	 вопрос наш корреспондент отвечать заместитель командующий войско скво воспитательный работа начальник управление генерал-майор серов побывать дарьяльский горн полигон 
32374	 вот приближаться горн впереди гарцевать кавалерист знамя 
1	 село лыхна древний абхазия седой жить женщина который год она звать елизавета шакрый горн село ачандар быть долгожитель тимур 
30349	 можно сказать что этот горн озеро отражаться небо 
1	 один слово тимур жванб его природный высотобоязнь горн село чегем всегда выглядеть странноватый 
30349	 сначала май солженицын его горн уединение вдвоем все 
32374	 павел аносов унтер-офицер оканчивать отличие курс петербургский горн кадетский корпус выпускать практикант 
30349	 останки хозяин тоже быть находить под развалины горн там где настигать стрела 
30349	 они уже разжигать для какой-то надобность походный горн суетиться около обнаженный 
30349	 как странный этот эпизод галстук горн барабан неожиданно успокаивать она 
30349	 генерал горн опускать труба вслушиваться что кричать 
30349	 гок харлампиев трубить горн маленький отряд отправляться 
32374	 горн первый любовник магда который 
32374	 горн нью-йорк тотчас предъявлять фирма 
30349	 петр вымахнуть горн пудовой клещ промахиваться 
30349	 применение таран особенно ценный горн дело при глубокий бурение 
30349	 сизов горн составлять культурный характеристика эпоха феодальный 
30349	 константиновский корниловский горн джумай болгарь предсда полк 
30349	 иван ильич пробыть мастерская вечер видеть что горн все равный погасать почесать 
30349	 двинский позиция борьба воронка образованный взрыв наш горн продолжаться целый день оканчиваться 
30349	 бой воронка образовываться взрыв горн северо-восточный черновцы неприятель применять бомбочка 
32374	 приезд гумбольдт россия торжественный его прием здесь должный быть заинтересовывать прежде все чин горный корпус потому естественно что этот время начинать появляться перевод статья гумбольдт горн журнал 
30349	 набирать вода горн источник свой папаха магом 
32374	 прииск берикульский площадь томский горн округ присутствие владелец 
30349	 апрль вечер взрывать нсколько сближать горн 
30349	 случайный встреча петр демидов поставлять вопрос горн дело иной почва она 
32374	 год управлять верхнекарийский золотой промысл нерчинский горн округ 
32374	 наклать уголь горн разводить огонь 
30349	 гарнизон крепость город нарва быть сравнительно малочисленный комендант его полковник горн решаться защищаться последний капля 
30349	 карл окружать быть один испанец говорить уже итальянец так часто предводительствовать его войско пескара другой впоследствии видеть при немой нидерландский сановник граф горн эгмонт вильгельм принц оранский 
30349	 особенность три человек быть недовольный поступок король вильгельм оранский эгмонт горн 
30349	 тот год этот волнение улечься благодаря мера правительство пособие вильгельм оранский горн эгмонт наконец вообще нидерландский 
32374	 сугорина описание камень похищать прошлый весна горн музей телеграфировать нью-дели посольство 
32374	 они быстро разводить огонь переносной горн раскалять немой страшный 
30349	 петюшка брать клещ горн тащить накладывать 
30349	 замечать артем новый складка лоб работать артем подвижный горн второй ребенок 
32374	 художник роберт горн проживать нью-йорк однажды завтракать 
32374	 владелец богатый золотой россыпь томский горн округ называть недавно один шахта 
32374	 конец шестидесятый год когда уже несколько год служить урюмский золотой промысел открывать нерчинский горн округ случаться проезжать 
32374	 год октябрь быть назначать партионный офицер амурский золотоискательный партия год только что жениться жить алгачииск рудник нерчинский горн округ 
30349	 полакомиться пойти горн все равный 
32374	 всюду полыхать красный огонь переносной горн трещать молоток трюм отзываться громовой 
30349	 кузьмин сказать так-то вздох пойти горн 
30349	 заскрипеть блок сорокапудовый якорь пойти горн искра взвиваться метель кузница 
