30349	 камердинер его являться час четыре кофейник распускать немой немного крепкий бульон пользоваться химический горн ставить огонь вместе 
1	 делагарди выходить новгород преемник фельдмаршал еверт горн январь год объявлять 
1	 причина побуждать шведский правительство мир москва высказывать письмо канцлер оксенштирный горн 
32374	 нельзя подумать глядеть она чтоб она быть горн большой лодка всего 
30349	 тот время под ямбург подступать нарвский комендант генерал-майор горн прогнать урон 
30349	 рассвирепеть солдат ничто слышать горн сам кулак бить барабан 
30349	 ходить вместе барабан горн петь пионерский песня край родной 
30349	 виктор горн тогдашний руководитель писательский организация ходить 
30349	 когда выпадать заказ гидропроект социально экологический мониторинг горн алтай связь катунский 
30349	 конец июль начало август год жена отдыхать горн алтай турбаза адар 
30349	 многие они прославляться ава глушков лесной часть кудрявцев земледелие бушуев горн дело тунев 
32374	 фонд находиться сохраняться большой дело год расследованиихищение вбывший горн департамент 
32374	 смирнов дейчман занимать горн департамент казенный квартира прежний 
32374	 бывший главный обогатитель компания евдокимов говорить что работать лейтес получать более серьезный теоретический подготовка нежели доводиться таковой заиметь обучаться горн техникум 
30349	 шесть белоснежный колонна увенчивать фигура шесть пионер трубить горн 
30349	 избегать упрек что спектакль идеализировать советский прошлое действительно сцена много красный косынка галстук трубить горн ребенок выстраивать пирамида свой 
32374	 после очередной съезд кооператор вестибюль гостиница измайловский подходить парень который учиться горн институт курс молодой 
1	 горн ущелие тропа заваливать яблоко они 
30349	 горн дело технология услуга повторный 
32374	 через несколько год горн вырабатываться оставлять здесь 
32374	 более год назад горн журнал под рубрика рудник будущее 
30349	 боб горн служащий железный дорога роберт 
30349	 почему поддерживать лапшин думский выборы горн алтай 
30349	 кстати первый танковый бригада резерв верховный главнокомандование который доводиться потом служить формироваться наш горн край 
30349	 имаго личинка собирать небольшой горн ручей высота 
30349	 горн бадахшан быть находить небольшой 
30349	 год небезызвестный андрей вавилов борьба михаил лапшин горн алтай выбрасывать кампания 
30349	 исчезать свой горн пейзаж больше вернуться 
32374	 тесло изготавливаться топор тоже оживать шалить горн красный как таймение хвост лезвие 
30349	 горн анна викторовна поэзия волшебный рог 
30349	 положение федеральный горн промышленный надзор россия утверждать 
30349	 положение федеральный горн промышленный надзор россия утверждать 
30349	 совсем недавно пресса промелькнуть сообщение сенсационный находка горн алтай прекрасно сохраняться конечность неведомый 
32374	 декабрь прошлый год горн институт санкт-петербург состояться всероссийский 
30349	 положение федеральный горн промышленный надзор россия утверждать 
30349	 положение федеральный горн промышленный надзор россия утверждать 
30349	 подпункт пункт положение федеральный горн промышленный надзор россия 
1	 горн село ольгетти граница грузия 
30349	 суббота польский горн курорт криница заканчивать работа 
32374	 смертельный враг бруно любовник магда карикатурист горн михаил полосухин так скрупулезно отыгрывать 
30349	 под сель погибать житель кишлак дашт горн бадахшан таджикистан 
30349	 один первый исследователь обращать внимание описывать экспериментальный данные существо впервые обосновывать многий физический явление взаимодействие поле горный порода современный толкование использование горн дело электродинамический термодинамический акустический 
30349	 это ботаник получать право спокойно бездумно сказать красиво горн кряж геолог стихотворение 
32374	 потом когда учиться ленинградский горн институт приглашать его весть 
30349	 сам таджикистан уже фактически расчленять ситуация горн бадахшан ленинабадский область центральный 
30349	 горн дело например прекрасный пол отводить 
32374	 тоннель горн массив быть проделывать длина почти 
30349	 недалеко город встречать пионер красный галстук горн барабан 
30349	 уже сделать большой фильм хакассия горн алтай калмыкия татарстан 
30349	 настя позвонить город махачкала сказать что очень счастливый собираться теперь жить вместе арсен маленький горн селение чахнуть 
30349	 происходить уже вовсе быть дело его жизнь оно изменять такой как уходить из-под нога еще замечать этот пионерский горн петь петь пионерский 
30349	 опять петь рука его горн 
30349	 вечер когда спать совершенно хотеться горн петь так словно это вовсе 
30349	 тот время когда построение бывало завершать где-то впереди бодро радостно ударять барабан петь взблескивать солнце пионерский горн весь отряд двигаться правый 
30349	 немногочисленный священник епархия горн алтай способный противостоять натиск 
32374	 как начинать ленка горн гулять так раздаваться плечо 
30349	 самый почти метр превосходить наш весенний достижение когда пещера алтайский горн алтай экспедиция под руководство анатолий 
32374	 через несколько год охотиться тур срываться скала утопать горн озеро 
32374	 время время молотобоец раздувать мех уголь горн 
30349	 сознаваться все любовь гроб протяжно петь вдогонку горн спальня неохотно укладываться пионер 
30349	 конец конец понимать что так мочь стоять бесконечность почему-то представлять пионерский горн который трубить уставляться 
32374	 дима очень уставать надо рано выбираться служба кроме служба еще лекция горн институт 
30349	 горн мир ангел божий вечно петь 
30349	 когда клава ивановна подниматься навстречу затрубить пионерский горн ударять барабанный дробь отряд 
1	 танк упражняться горн склон заставлять вздрагивать громко 
30349	 американский сленг драйв продажа товар дешевка цель конкуренция горн дело драйвер обыкновенный коногон  
32374	 большой услуга оказывать горн земледелие 
1	 оно фиксироваться как дарахтеть сурх вероятный правильно дараги сурох щель ущелие тадж дараг горный располагать горн ущелие сурох дыра отверстие 
32374	 горн туризм существовать объективный условие для 
30349	 утро пробуждаться горн дождаться когда смолкать ребячий гвалт 
30349	 путь эшелон призывно заиграть горн зазвучать повторять громкий голос команда 
30349	 написать путевой очерк горн алтай дневник поэт карелия 
30349	 ветер наддавать как мехи гигантский горн кузнец 
30349	 доводиться побывать закопане польский горн курорт 
32374	 можно видеть сейчас ленинградский горн музей 
1	 вот как жить далекий горн село мальчик петь как 
32374	 первоначальный образование получать петербургский горн корпус где проучиться специальный 
30349	 казаться поезд въезжать огромный кузница мчаться меж горн наковальня 
30349	 горн наковальня быть бесчисленный составлять 
30349	 трубить горн отряд прошагать улица 
30349	 иногда ночной смена когда дежурить соседний горн петь поочередно 
32374	 пермский гражданский губернатор селастенников как сообщаться горн журнал осень 
32374	 мушкет проводить горн департамент мой назначение иркутск 
30349	 горн дело некоторый риск при разведка 
30349	 охотник наш подбираться самый ворота нарва ночь захватить посланец ревельский губернатор нарвский комендант горн цифирный письмо 
30349	 государь самый быть генерал горн нарвский комендант 
30349	 угол горн зазвенеть охапка ржавый цепь 
30349	 наш горн затишье они уже расти 
30349	 огонь озорно яростно ворчать горн 
30349	 обижать что называть хлюпик штаб трубач коля колокольчик вскидывать горн раздувать щека яростно протрубить 
30349	 барабан горн звать рассыпать русский полк под 
32374	 все когда год уезжать навсегда заграницу слуцкий быть все еще международный комитет учиться горн институт без отрыв производство 
30349	 горн стоять ребро толстый бронзовый 
30349	 ленуар соскакивать горн крепко пожимать гарин рука 
32374	 камора быть жарко так как узкий проход кузница приходиться горн 
30349	 капитан ордан константин константинович горн инж подпоручик бари александр александрович 
30349	 темный тишина резко зазвучать горн сейчас край 
30349	 видимо любить свой зверь этот горн замечать однажды кречмара обращаться 
30349	 нарвский комендант быть опытный отважный воин полковник горн 
30349	 подымать шпага сейчас протяжно заиграть горн второй еще невидимый 
30349	 прохор приглашать протасов тот универсальный образованный горн дело собака съедать 
32374	 стоять горн деловитый показывать двое матрос как 
1	 быть один горн ущелие истекать кровь 
32374	 гора эксп опубликовывать горн журнал сведение растительность 
30349	 благожелательно расставаться глухой горн место железный крест откуда 
30349	 приходить кукша один длу горн стоять весь сажа быть 
30349	 заграждение оставаться верста когда вдруг горн берег ударять пушка снаряд 
30349	 задание геологический комитет горн инж 
30349	 постановление кондырев евсеев тютрюм эйшинский эрна лианоз против богданов горн филиппео 
30349	 сегодня состояться частный совещание быть горн эрна эйшинский пешков филиппео 
30349	 вот внезапно разрезать свист ветер звонко запевать серебряный горн 
30349	 район южнее крева вечер май быть взрывать горн 
30349	 ночь апрель германец взрывать горн район деревня новоселка южнее 
30349	 новоселка отбивать штурм германец для захват воронка после взрыв горн занятый край воронка 
30349	 район сопановый севернее кременец противник взрывать три горн пытаться занимать воронка 
30349	 район северо-запад кременец район верхний стрып противник быть взрывать несколько горн 
1	 север бояна противник впереди наш окоп взрывать один горн 
30349	 северо-запад кременец район сопановый противник взрывать перед наш окоп два горн быть состояние 
1	 север бояна противник также взрывать горн перед наш окоп 
30349	 новоселка вестись борьба обладание воронка образовываться взрыв горн 
1	 галиция район север бояна одновременно быть взрывать горн после что наш пехота быстро 
1	 галиция район север бояна взрывать горн после что наш пехота проходить 
30349	 иллукст вчера быть взрывать горн 
30349	 галиция северо-запад тарнополь район садиться глядка воробьевка взрывать горн занимать воронка 
30349	 иллукст быть взрывать пять горн под пять немецкий блокгауз 
1	 днестр михалкий взрывать горн разрушать проволочный заграждение противник его 
30349	 двинский позиция борьба воронка образованный взрыв наш горн оканчиваться наш польза 
1	 высота восточнее раранча противник быть взрывать горн 
1	 один участок боевой линия генерал лечицкий север бояна под неприятельский проволочный заграждение окоп быть взрывать горн 
1	 район бояна противник огонь бомбомет ручной граната тщетно пытаться вновь овладевать занимать ночь январь воронка горн 
30349	 район деревня топоровец раранча северо-запад бояна несколько наш разведчик подбираться занятый противник воронка горн забросать она ручной граната 
1	 север бояна противник взрывать перед наш окоп три горн пытаться нисколько раз атаковать наш 
32374	 итальянский войско производить смелый разведка горн хребет виллакорн альпийский стрелка атаковать 
32374	 немедленно ручной фунтовый снаряд наскоро взрывать немецкий галерея вскоре затем быть решать закладывать большой горн для окончательный разрушение работа неприятель 
30349	 через час наш горн быть уже готовый 
30349	 рожанка нижний неприятель взрывать закладывать горн близ наш окоп затем 
1	 немец фон горн тюремный заключение месяц 
1	 великобританский посол штат потребовать выдача канада немец фон горн обвиняемый попытка взрывать железнодорожный 
1	 великобританский посол посещать государственный департамент представлять формальный требование выдача канада немец фон горн обвиняемый попытка взрывать железнодорожный 
1	 немец фон горн обращаться германский посол 
1	 территория штат быть арестовывать немец фон горн совершать этот преступление 
1	 арестовывать обвинение повреждение динамит железнодорожный мост вансеборо назваться вернер фон горн год 
32374	 отчет путешествие гумбольдт россия горн журнал 
30349	 франк расчистка раскрепление шахта западный донецкий каменноугольный горн инж 
30349	 горн алтай близ кузнецк забивать вулкан 
30349	 сначала мистрис горн набирать свой шхуна экипаж 
30349	 при выход порт мистрис горн стоять капитанский мостик 
32374	 верхний силезский горн район настоящий время бастовать 
32374	 западный виргиния горн округ пайн крик возникать беспорядок 
32374	 горн округ момкусшир возникать беспорядок особенно 
32374	 солнце красный как нагревать горн лемех уходить земля 
32374	 манус муж быть еще знать отец мальчик быть когда становиться горн работать работать работать что 
30349	 этот горн озеро полярный круг должный 
30349	 наконец январь вечер великий удивленить вмсго усиливать горн француз взрывать весьма слабый 
32374	 большой сенсация вызывать нью-йорк бракосочетание немка тереза берг датчанин горн львиный клетка 
32374	 теперь горн впереди нет значит пока 
32374	 деревня славянка лежать лощина при быстрый горн ручей текущий кура 
30349	 утро быть праздничный жаркое радостно наперебой трезвонить над донец над зеленый гора колокол уноситься туда где ясный воздух стремиться небо белый церковка горн перевал 
30349	 выводить быть этот порядок линия горн берег быстрый ручей который 
32374	 быть один хороший человек горн департамент определять 
30349	 основание первый железный завод забота петр горн дело роль случайный человек 
30349	 вероятно этот опытный горн дело пленник помогать демидов поставлять 
30349	 год прибывать колывано воскресенский завод опытный горн дело бригадир беер 
30349	 пожар мелкий искра разлетаться семенова гора разливаться весь широко широко ставиться горн укрепляться тиски пила заводить 
32374	 горн институт оставаться теперь решительно 
30349	 альба его сподвижник думать правда без основание что ужас повсюду вызывать казнь столько дворянин особенно граф эгмонт горн сильно ослаблять энергия нидерландский оппозиция 
30349	 горн алтай видеть что алтайский 
32374	 сентябрь прошлый год арест студа горн инст гудок перевозить петербург 
32374	 иногда стоять горн тятя дуть или кто-нибудь 
32374	 лясковской кончать курс инст вислоухий студа горн инст коршунов студа 
30349	 самый глухой угол тлеть горн огонь тускло сверкать 
30349	 тот запасаться англичанин специалист горн дело 
30349	 нарвский комендант карл горн удачно отражать первый приступ 
30349	 они бороться освобождение родина граф эгмонт горн вильгельм принц оранский 
30349	 граф эгмонт горн жильбер петр дандело 
30349	 они жить наш горн город ходатайствовать дело 
32374	 горн приниматься посол особенно потерпеть 
