30349	 быть много что уморительный куплет пионер красный галстук короткий штанишки барабан горн исполнение волкова 
30349	 весь больше толковать диета здоровый образ жизнь целебный горн воздух 
30349	 купить распродажа пионерский горн барабан палочка 
30349	 пионерский комната который рано кроме горн барабан ничто быть 
30349	 испускать радиация газ присутствовать даже хрустальный чистый горн воздух 
30349	 красный половина пионер знамя пионерский горн белый чистенький никчемный буржуйский 
30349	 пионерский горн петь петь пионерский 
30349	 горн петь над волшебный река над 
30349	 хороший девочка изнасиловать горн курорт надо что-то срочно 
32374	 цвет работать совместительство преподаватель ботаника сельский хозяйство варшавский ветеринарный институт преподаватель ботаника химический горн отделение варшавский политехнический институт 
30349	 назначать свой среда вожатый настригать красный материя галстук взять горн барабан поселяться 
30349	 быстро плащишко перемещаться один клиника другой интересоваться столько больной сколько сокурсница частность высокий рыжий девушка лена горн который поток говорить 
30349	 это город это самый глухой горн хутор 
30349	 заиграть горн подхватываться поводить физзарядка 
30349	 становиться разрядка прогорнить сбор как хлыст еще взбадривать этот горн что-то быть затягивать такой 
30349	 остаток горн мехи который приводиться 
32374	 усердно раздувать мех хищно запылать пламень алхимический горн 
1	 нестор находить этот абрек далекий горн село сделать талант 
32374	 жить учиться ленинград горн институт 
32374	 дима готовиться первый лекция горн институт 
32374	 маленький гениальный еврей недоучившийся горн институт бежать харьков 
1	 однажды находить горн ущелие оседлывать лошадь 
30349	 смотреть сережа настенный фотография забывать сережин поколение испанка кисточка держать рука сверкающий пионерский горн отлет 
30349	 традиция маршак чуковский быть преданный забвение горн барабан заглушать щебетание птица 
30349	 римма васильевна физик что-то спорить стоя тумбочка горн 
30349	 кружка пиво горн кабачок кот передовой первый 
32374	 увольнять вооруженный сила запас пенсионер работать преподаватель физический воспитание московский горн институт 
30349	 гигантский горн медведь который изредка встречаться 
30349	 утро звенеть пионерский горн три громадный лагерь ликующий глупый 
30349	 когда утро холодный прозрачный горн воздух звучать добрый утро 
1	 узкий горн ущелие где находиться завод всегда 
30349	 это загорелый детский ручонка тянуться ручка пионерский горн возглас быть готовый 
30349	 утро просыпаться звук горн воинский часть 
32374	 работать геологоразведка учиться заочно ленинградский горн институт 
30349	 вот сторона штаб раздаваться хриповатый звук горн просыпаться репродуктор начинать сотрясать 
30349	 сторона палатка штаб раздаваться звук горн отбой 
30349	 потом что-то ласковый приступать бок кто-то прикладывать пухлый мальчишечий губа пионерский горн рассыпаться барабанный дробь услышаться строгий 
30349	 вдруг вспомнить этот горн городок уже однажды 
30349	 шелохнуться рука шов ждать звук горн удивляться ребята 
30349	 это быть далеко москва самый таджикистан горн бадахшан 
32374	 краевич преподаватель физика горн институт инженерный училище 
30349	 ведь никогда поймать если про горн услышать 
32374	 сомнение исчезать когда быть расчищать большой горн для обжиг заготовка 
30349	 горн который сегодня обжигать крынка 
32374	 сыродутный кузнечный горн они получать сырцовый сталь 
32374	 например если требоваться изготавливать нож раскалять кузнечный горн поковка закаливать холодный вода 
30349	 возле гремячий трубить горн рокотать барабан 
32374	 ознакомляться преподавание университет горн институт разный прикладной факультет 
32374	 средний образование получать нижегородский военный гимназия высокий горн институт петербург 
30349	 все-таки вылезать набирать ботинок снег становиться носить свой чемодан совершенный тишина темнота чистый горн воздух 
30349	 внутри горн над шлак что-то загудеть зашипеть 
32374	 горный журнал или собрание сведение горн соляной дело присовокупление 
30349	 лагерь запевать голосисто раскатистый горн звать обед 
30349	 это поэтический рассказ красивый место северный кавказ горн массив архыз домбай его своеобразный 
30349	 спуск флаг горн вспомнить кисловатый металлический вкус 
30349	 час наступать поздний горн уже потушить огонь 
32374	 тогда никита васильевич тот или иной клещи быстро вынимать железо горн ловко повертываться класть 
30349	 ребята подходить дом бородулин строй горн барабан 
30349	 густоусый что-то буркнуть под нос потом швырнуть угол горн барабан хотеть было бросать 
30349	 петька свищевый почему-то держать рука помятый пионерский горн 
30349	 вдруг острый пронзительный звук повисать над кладбище это петька свищевый подносить губа старый пионерский горн выдувать звать хватать 
32374	 отец быть может быть еще более злой неутомимый работа работать ожесточение быть кузнечный горн или раскорчевка ляд 
30349	 это нелегкий пока загудеть горн 
30349	 рождаться маленький горн городок мечтать весь время 
30349	 это когда смена горн кончать рано 
30349	 переходящий красный знамя министерство кинематография ссср вновь завоевывать московский областной контора главкинопрокат управляющий тов горн одесский завод кинан директор тов 
30349	 после краткий отдых горн городок бейтензорге где маклай написать 
32374	 архив федоровский институт кристаллография минералогия петрография учение месторождение полезный ископаемый при ленинградский горн институт сохраняться много письмо выдающийся 
32374	 сожаление интерес молодой федоров встречать поддержка официальный представитель кристаллография минералогия горн институт знаменитый математик 
30349	 философия говорить герцен выращивать эмпирия страшный горн перед огонь который ничто 
32374	 ленинградский горн институт храниться большой кристалл 
30349	 федор елизарович вернуться свой горн жениться савелий лозовой уезжать 
32374	 можно соглашаться поэтому григорьев шафрановский что история минералогия горн институт значительный степень быть 
32374	 основной раскоп глубина быть обнаруживать развалины глинобитный гончарный горн огромный количество керамика 
32374	 горн институт возникать разниться известный 
32374	 горн институт особенно советский время 
32374	 суметь превращать первый союз лаборатория обогащение полезный ископаемое при горн институт всесоюзный институт механический 
32374	 оставаться отмечать что горн институт быть закладывать основа 
32374	 юность учиться горн институт лето год 
30349	 под дробный грохот барабан звук горн бизань-мачта громобой взлетать белый 
1	 сейчас проворный движение выхватывать горн огненный оранжевый змейка бросать она 
1	 как санька любить старый евсеич который казаться весь жизнь стучать наковальня любить вздох твой горн звонкий перестук молот запах уголь 
32374	 мушкет занимать горн институт кафедра геология после освобождение 
30349	 скомандовать вожатый горн протрубить приветствие ребята 
30349	 протяжный звук горн всколыхивать воздух дальний эхо 
30349	 если это сопоставлять что талый выступать параллель минотавр уничтожать юноша девушка просто пришелец огонь бронзовый талос связанный лесной огонь печка яга сжигать ребенок горн виланд куда бросать царский 
32374	 зима горн институт пристанище студенческий вместе 
1	 это жить горн остров отрезать все обездоливать 
30349	 штаб трубач коля колокольчик сжимать рука медный блестящий горн босоногий суровый гейка держать 
30349	 этот вековой тишина услышать она вдруг звук пионерский горн 
30349	 любить звук горн лес реветь подобно изюбр 
32374	 борьба разрушительный сила пламень кирпичный кладка горн туго стягивать множество стальной обруч 
30349	 жить неделя маленький горн городок 
32374	 глубина сарай возвышаться потолок лес здесь пылать горн раздувать рабочий сквозь балка лес 
32374	 поплыть колонка цифра рисунок чертеж появляться пылать горн угрюмый хохлов раздувать уголь 
1	 трест апатит возникать результат настоятельный нужда страна доброкачественный сырье для фосфатный туковый промышленность геологопоисковый работа проводить кольский полуостров год обнаруживать хибинский горн массив громадный апатито нефелиновый интрузия 
30349	 снова взвизг прорезать воздух горн страстной подходить свежий гренадерский 
32374	 через несколько год после окончание институт становиться профессор занимать тот горн институт кафедра геогнозия петрография 
30349	 прыгать рука горн губа слушаться извлекать звук 
30349	 как только двор раздаваться звук горн сейчас отправляться 
30349	 под звук барабан горн стоять перед один койка 
30349	 под аккомпанемент высокий отрывистый звук горн рассыпаться частый барабанный дробь 
30349	 под звук горн барабан человек расходиться 
30349	 детство леонардо протекать среди чудесный тосканский природа городок винчи ютиться горн ущелие вверх вниз тянуться 
1	 декабрь назначать день утро будет происходить вновь избранный ректор академи горн 
32374	 при свет кузнечный горн или кухонный очаг родитель родственник 
30349	 заиграть горн откликаться рожок точно 
30349	 высоко горн уступ отец гильденбрандт молиться 
30349	 потом устанавливать мелодия горн воздух унтер-офицерский легкое 
32374	 смотреть ствол красный как железо вытаскивать кузнечный горн 
30349	 ранний осенний альпийский утро звонить звать обедня соседний горн городок 
32374	 очень хороший для этот цель кузнечный горн переносный тип вентилятор 
32374	 курсы радиоинструктор открывать при днепропетровский горн институт 
1	 пусть горн этот пламень хлынуть вон живой 
1	 опять грей горн приходить надавать шея 
30349	 ежо удачно располагать свой усадьба очень скромный горн воздух склон пригревать постоянный 
30349	 вот сходиться два сторона красный белый глухой горн городок копал кругом спокойный 
30349	 это горн кряж быть несколько приметный вершина 
1	 стихия кристалл горн как это трудно все определять 
30349	 молодой рабочий горн сын иван рублев васька засмеяться 
1	 нет перебивать иван рублевый выхватывать горн брызжущий искра болванка нет господин 
32374	 воспитываться горн институт императрица екатерина выдерживать 
32374	 снова запылать маленький горн два пламень соединяться 
30349	 присутствовать кроме горн эйшинский евсеев пешков 
30349	 дно шахта проводить штрек горизонтальный ход пояснять замечать как подниматься бровь банкир при это горн термин 
30349	 район новоселка взрывать горн воронка который закреплять 
32374	 горн массив мормолад итальянец занимать укреплять 
30349	 район сопановый севернее кременец противник взрывать три горн который занятый противник 
30349	 иллукст взрывать горн который подорвать германский окоп 
1	 север бояна взрывать усиленный горн 
1	 север бояна противник взрывать горн 
30349	 северо-восток черновцы противник перед наш окоп взрывать горн который завязываться упорный бой 
32374	 итальянский войско коль лана занимать вершина горн сиф 
1	 немец фон горн взрывать железнодорожный мост приговаривать суд 
30349	 севастополь упасть убиваться авиатор мичман светухин приговор над фон горн вэнсборо 
32374	 телеграф горн журнал название местность 
32374	 неизвестный горн институт настоящий время 
32374	 настоящий время местный горн институт заготавливаться рождественский подарок 
32374	 она входить палисадник быть устраивать кузнечный горн дверь постройка быть прикрывать 
30349	 судно иметься лишь один мужчина муж капитанша мистрис горн 
30349	 судно иметься лишь один мужчина муж капитанша мистрис горн мистрис 
30349	 скучать глухой горн городок кенигштейн таунус 
32374	 горн департамент сегодня получать телеграмма 
30349	 ялта инициатива директор местный санаторий д-р лебедев составляться кружок лицо желающий проводить лето палатка вершина гора пендикюль настоящий горн воздух 
32374	 новый инспектор получать образование горн институт 
1	 нет недостаток работник производство земледельческий горн земляной работа химический 
30349	 каждый день наш душа как клинок раскаляться белый свет горн страсть вдруг погружаться 
32374	 повышение плата учение горн институт 
30349	 небольшой горн наковальня несколько старый самовар 
30349	 теперь окрепнуть поздороветь горн воздух она возвращаться домой 
30349	 вырабатываться железо окрестности тула устюжна местный руда это железо переделываться домашний горн гвоздь другой предмет 
30349	 август час утро перед штурм француз взрывать впереди курган горн весьма близкий расстоянь 
30349	 объяснение давать директор правление гужон леблон технический директор горн инж 
30349	 где-то недалеко строиться церковь копошиться плотник разноцветный рубаха чистый горн воздух звучать веселый песня 
30349	 вокруг наружный стена успенский собор стоять горн который француз плавить обдирать 
30349	 это быть для все самый приятный прогулка горн воздух вечереть день 
30349	 иногда горн берег вдруг появляться огонек рыбацкий 
30349	 только что затихать напряженный пение муэдзин чистый горн воздух пропитывать запах кизячный дым 
32374	 денежный польза город налог подлежать местность занимать заводоуправление основание правило излагать устав горн 
32374	 никон сидеть смотреть ярко пылать горн добела накаливать полоса железо 
32374	 гимназия потом горн институт отличаться сочинение 
30349	 первый сведение горн дело россия иметься 
32374	 горн институт петербург иметься портрет 
30349	 завод уничтожать горный потушить искра из-под заводский горн уже разлетаться кругом семенова 
30349	 высота восточный альпы швейцария верхний энгадина скромный горн городок понтрезина окружать снежный вершина 
30349	 они находиться граф эгмонт горн который высиживать восемь месяц 
30349	 воображение дополнять что мочь схватывать глаз кажется самый воздух этот чудный горн воздух напоить свежесть ночь 
32374	 теперь горн институт музей лежать 
30349	 что тут наш горн понимать 
30349	 офицер засуетиться горн протрубить налево прямо вперед 
32374	 тятя стоять горн дуть мех 
30349	 батальонный командир младший штаб-офицер адъютант садиться лошадь раздаваться команда отделение направо заходить потом скорый шаг марш под звук горн грохот барабан оставлять 
32374	 епифан панкеев студа унива матем факультет мамикансон студа горн институт арестовывать апрель 
32374	 левый сторона шоссе тянуться сумрачный лес кое-где вырубать давать место или барский дача или харчевня или кабак или наконец кузница адски пылать горн 
32374	 такой-то порядок служить там горн правление или городской или 
1	 другой день получаться главный начальник горн правление приказание ссылать облупалов урочно 
