30349	 каждый день ровно час четыре сторона свет раздаваться башня горн трубач 
30349	 цыганка танцевать завлекать солдат хотя тот первый звук горн убегать казарма 
30349	 быть страшно общительный видимо обладать какой-то организаторский способность потому что всегда быть капитан волейбольный футбольный команда командовать игра зарница играть горн барабан гитара год 
30349	 вместе они грустный мальчик глядеть преуспевать лицо тело раскраснеться раскармливать одноклассник синий шорты белый рубашка под звук горн стук барабан цветок 
30349	 чуть каждый фракция оставаться дежурный готовый случай нападение индеец быть какой-нибудь выходка кремль трубить горн призывать гарнизон обратно 
30349	 это блестященький горн пионерский это красненький это 
30349	 отец вставать горн побудка подымать сын идти 
30349	 вдруг пионерский лагерь горн заиграть 
30349	 над они гордо плескаться красный знамя бить барабан трубить горн десять пионер отделяться остальной  
30349	 объяснять что тут что познакомить компас кренометр показатель давление масло барометр туманный горн 
30349	 видимо просто быть создавать для счастливый детство под звук горн 
30349	 горн воздух звук расплываться далеко 
1	 все это случаться потом сначала фрегат аврора огибать мыс горн приходить апрель перуанский 
1	 этот раз маршрут между кольский полуостров камчатка пролегать через атлантический тихий океан огибать мыс горн 
30349	 видимо просто быть создавать для счастливый детство под звук горн 
1	 когда-то они быть мечта отправляться весь семья автопутешествие мыс горн 
1	 сашин аппарат шуметь будто вокруг шторм водный мотоцикл огибать мыс горн 
32374	 газета тогда конечно существовать однако конструкция печь быть воспроизводить точно неолитический гончарный горн чрезвычайно простой круглый площадка 
1	 вербоваться навигационный служба авианосец звонить раз два год персидский залив или мыс горн чрево плавучий атомный монстр 
30349	 форма трубач действительно напоминать труба горн или рупор 
32374	 что-либо иной более трудоемкий быть трудно заниматься так как горн или печь требовать постоянный внимание 
32374	 время игрушка становиться обжигать горн сушить печь 
1	 раз два неделя выходить радиосвязь один наш общий друг член яхт-клуб сообщать что проходить через зона шторм вокруг мыс горн так далее 
30349	 оракул работящий труженик первый звук боевой горн способный вставать ряд обороняться 
30349	 детство все свободный время после школа пропадать дом пионер где учиться играть барабан горн 
30349	 играть горн городок целье небольшой очень 
32374	 чтобы понимать наш чувство представлять себя горн печь для обжиг гончарный изделие 
32374	 так вот оказываться что раскапывать весь обжиг быть весь изделие находиться печь бой один такой горн хотя сам 
32374	 довольно часто нарушаться требование технологический инструкция что мочь приводить прорыв горн доменный печь 
1	 вместо обещать семь миллион босс век фокс давать только три гонорар коннерить абрахам забирать себя территория прокат мыс горн аляска 
0	 новый система охлаждение печь химочищенный вода использование холодильный плита усовершенствованный конструкция высокопрочный чугун шаровидный графит экстремально напряженный зона печь как использование микропористый углеродистый блок андалузитов изделие для футеровка горн давать возможность значительно увеличивать межремонтный 
0	 требование безопасный эксплуатация новый печь обеспечивать система разгар горн лещадь система подготовка анализ 
32374	 самый запоминаться становиться творческий встреча мастер различный школа направление строительство горн обжиговый печь проведение показательный 
30349	 общий они каждый год так поступать будкин уже привыкать просыпаться июльский утро под звук горн ухо зубной 
1	 первоначально речь идти судно который предназначаться для рейс основное под парус калькутта впоследствии проект быть перерабатывать для кругосветный плавание маршрут англия мыс добрый надежда калькутта австралия мыс горн англия 
1	 дополнение паровой машина судно быть сохранять парусный вооружение шесть мачта высота фут общий площадь парус более вполне достаточный чтобы воспользоваться ветер господствовать долгий путь между мыс добрый надежда мыс горн 
1	 думать весь жизнь запоминаться вид его где находиться отделять мыс горн америка потому что 
1	 последний раз звонить мыс горн через индийский спутник связь 
30349	 директор под звук горн вручать неслыханный тот 
30349	 впрямь что-то такой чудиться задорный живой молодецкий что-то горн барабан труба традиция боевой шахтерский 
1	 хотеться поспевать кроме атакама мыс горн огненный земля 
1	 познакомиться один парень идти чуть сам мыс горн собираться доходить 
30349	 из-за закрытый дверь доноситься звук горн потрескивание барабан оставаться 
30349	 что-то быть затягивать такой торжественный слитие красный знамя под угол бронзовый ильич посеребренный горн резкий звук гордый осанка 
1	 кроме побывать экспедиция антарктида аляска индийский океан мыс горн альпы памир 
32374	 один печь что стоять чистый алхимический горн разве что воздуходувка взамен мех 
30349	 наконец осада наш комната быть снимать заживать спокойно хотя звук горн будить час 
30349	 замысел серебряный звук горн раздаваться над гагра шесть 
30349	 тревога понимать лишь один его свисток отступать перед звук перед сигнал мой горн 
32374	 туманный прошлое заводский двор сохраняться толстостенный кирпичный кладка забрызгать металл массивный свод горн печь 
0	 улица еще тьма как ночь цех гореть электричество впрочем гореть тлеть два чуть живой лампочка качаться длинный провод над волочильный стан третий возле отжигальный печь там обычно без светло горящий горн еще один лампочка едва 
30349	 под чистый звук горн уже успевать загорать детвора выбегать 
30349	 кажется праздник быть конец вот раздаваться звук горн отбой 
1	 затем ложиться прежний курс заменять дефектный часть палуба без дальнейший приключение огибать мыс горн проходить мимо новый зеландия 
30349	 измученный переход они жадно вдыхать дым костер предвкушать ужин звук горн сигнал отдых артиллерист выпрягать 
30349	 правый сторона старик стоять мальчик горнист хотеть играть горн уметь играть мочь 
30349	 про белый мальчик рассказывать неправда стоять играть горн хотя изо 
32374	 для это они приспособлять горн печь получать название переделочный 
32374	 сухой точный изложение леонтьев можно ощущать весь напряжение очень долгий тяжелый физический труд задымить кузница пышащий жар пудлинговый печь горн 
0	 ломоносов писать новый рапорт печь все горн складеный нужно теперь запасать дрова 
32374	 один случай это печь периодический действие например горн другой действующий непрерывно камерный 
32374	 горн камерный пламенный печь для обжиг 
32374	 цементация или науглероживание вести тогда кузнечный горн или печь 
30349	 слон исчезать лагерь играть горн заспаться сказать вожатый юра дергать 
30349	 поневоле клава тоже слушать как все вместе отдельность играть скрипка горн пианино она время становиться 
0	 попадать мастерская алхимик где жарко топиться печь шипеть горн кипятиться реторта чан 
32374	 чтоб окончательно очищать сплав ненужный примесь медь отправлять соседний верхотурский завод там быть плавить сначала особый печь сплейсофен затем еще раз переплавлять штыковой горн 
30349	 играть движение вперед раздаваться звук горн всегда привычный знакомый они 
32374	 скоро этот завод постигать участь его предшественник горн плавильный печь оказываться недостаточно огнестойкий 
30349	 кроме горн который играть сам гок 
30349	 дробь атака сигнал который играть горн барабан для приготовление корабль 
30349	 карл очнуться пушечный лафет под вонючий шинель горн протяжно играть отбой сбросить шинель 
32374	 лепить проектировать расцвечивать готический печь изразец посуда горн коробить мой рукоделие срывать полив 
30349	 горн играть далеко все дудка стараться 
30349	 это быть обыкновенный повестка сигнал играть горн четверть час спуск 
1	 находить путь мыс горн остров туамоту быть 
1	 мыс горн север нет широкий океанский 
32374	 идти рассвет гудеть гудок сотня черный человек идти станок печь горн 
30349	 вчера ночь вследствие появление цеппелин быть принимать предписывать военный власть мера звук горн труба предупреждать население 
32374	 кирпич для печь взять кузнечный горн палисадник часть собирать 
32374	 глиняный изваяние форма железный остов запруда для жидкий металл горн плавильный печь все быть готовый 
1	 окончание спешный нагрузка динор сниматься якорь взять курс мыс горн 
1	 ветер быть попутный крепкий ровный брамсельный как говорить моряк динор иметь себя весь парус какой только можно быть поставлять подвигаться мыс горн делать сутки сто 
1	 обыкновенный буря встречать суд мыс горн этот раз быть 
32374	 являться трещина стена машина ржаветь печь горн разваливаться сам себя водяной ларь 
32374	 она быть два изразцовый стол большой печь для прокаливание горн песчаный баня два переносной 
32374	 здесь под гора базиль увидеть ряд наскоро устраивать пылать горн печь 
1	 конопатка весь баргоут тяга такелаж окраска пополнение провизия другой необходимый работа для приготовление транспорт предстоящий переход вальпарайзо вокруг мыс горн задерживать здесь 
1	 декабрь утро при тихий ветер запад выходить море другой день пересекать тупик козерог широта направляться мыс горн 
1	 январь год переходить меридиан мыс горн южный широта 
1	 порт море компанейский суд вокруг мыс горн как это делаться тот 
1	 обычный пребывание английский французский крейсер этот вода быть вальпарайзо миновать против обыкновение суд огибать мыс горн рассчитывать калао освежать команда 
30349	 приходить музыкант оба дружина играть горн барабан свой поздравление 
32374	 целый лето крайне занимать быть перестройка горн институт печь сторона 
1	 видно черт взять всякий полушарие обходить безопасно хорошенький дамочка бурливый мыс горн 
1	 дневной пребывань сей рейд получень свжаго запас состоять больший частя свинья тыква разный зелень февраль направлять наш плаван круг мыс добрый надежда надясь уже столь поздной время благополучно обходить мыс горн 
1	 сей причина усиль надежда наш устремлять быть мыс горн врный полагать 
1	 около полдень миля проходить меридан мыс горн уклонившйся втирать 
1	 сказать следующий мореплаватель обходить мыс горн возвратный путь южный 
1	 некоторый мореплаватель географ полагать что рош обходить мыс горн восточный сторона обретать 
1	 мучение несчастие горн этот мастер искушение мехи пытка 
30349	 дело конечно сервелат горн воздух для здоровье просто 
32374	 олимпийский объект размещаться пополам два кластер прибрежный горн 
32374	 новый технология быть разрабатывать горн институт санкт-петербург 
30349	 похищать гипсовый бюст ленин также пионерский горн 
30349	 колесо автомобильный чабрец приминать повисать голодный горн воздух травяной сок горячо 
1	 когда-то уже после уничтожать цветаевский дача песочный здесь быть горн линейка разбитый коленка поцелуйчик 
1	 этот крупный храм страна располагать горн ущелие юго-восток корейский полуостров 
30349	 дело конечно сервелат горн воздух для здоровье просто 
32374	 эксперимент проходить высокий школа экономика казанский государственный технический университет имя туполева мая мгту имя бауман московский физико-технический институт мифь московский институт становиться сплав нижегородский государственный университет имя лобачевский новосибирский госуниверситет пермский государственный техуниверситет самарский государственный аэрокосмический университет имя академик королева санкт-петербургский государственный горн институт имя плеханов 
32374	 горн институт толя лейтес получать 
30349	 год отрочество быть лагерь горн что речка узунджа находиться 
32374	 медик начинать горн туризм именно так как 
30349	 вдруг неожиданно останавливаться посреди палата горн мучительно выкрикивать словно выбивать пробка 
30349	 это волшебный горн сказать вкладывать рожок она 
30349	 горн алтай над разлом нередко наблюдаться 
1	 обратный путь домой горн вираж мааль адумить 
30349	 еще пожалуй немного похожий этот саксофон горн который иногда трубить тревога 
32374	 автобан идти словно рельс если поднажимать горн серпантин 
30349	 кто мешать горбачев шеварднадзе переговоры москва чистый горн воздух кавказ 
32374	 помнить родитель прочитывать газета что пермский горн институт открывать набор группа 
30349	 пионер трубить горн повязывать красный галстук председатель 
30349	 бильбао леонардо появляться свет небольшой горн поселок санта-крус игунья муниципия 
32374	 июль святой патриарх московский весь русь алексий совершать чин великий освящение домовый храм имя преподобный макарий великий египетский петербургский государственный горн институт технический университет 
32374	 последний священник церковь преподобный макарий великий горн институт быть протоиерей 
30349	 перебивать все бежать далеко маг тут включать чита убивать просто шайка некоторые правда горн биться недолго заламывать 
0	 дальнейший развитие система диспетчеризация направлять создание горн предприятие полнофункциональный система управление горный 
32374	 святой патриарх алексий совершать великий освящение домовый храм имя преподобный макарий египетский божественный литургия санкт-петербургский горн институт 
30349	 труд кузнец оставаться столь тяжелый вредный для здоровье из-за образовываться горн газ 
30349	 это служащий звать боб горн неожиданно мгновение 
30349	 это становиться возможный благодаря реформа горн законодательство латиноамериканский страна проводить 
32374	 открытый ринг горн институт где легкий 
30349	 сумерки приходить юрта свой синий нога чистый горн воздух хорошо спаться ранний хрустальный 
30349	 серебряный горн виктор леонидович протрубить зоря 
32374	 горн институт вывешивать объявление так как 
32374	 например горн недавно быть сдавать коттедж 
30349	 вот раздаваться сигнал горн весь компания построиться 
30349	 складываться отношение горн который конец конец покидать 
30349	 струя бить рыбный горло прямо стоить центр пионер горн 
1	 этот красивый штучка везде уместный сафари остров горн склон 
32374	 время мой учеба горн институт совпадать драматический событие 
30349	 узнавать это конюшня холл использовать шасси горн позвонить штат 
30349	 белоселец пытаться обгонять сам ангел опережать его жест который тот прижимать губа медный горн исторгать трубный глас 
30349	 при приближение катер принимать парад кабельтов каждый корабль корабль горн играться сигнал захождение 
