15531	 эйверь коллега показывать что днк выделять чистый вид капсулированный форма пневмококк тип мочь проникать клетка некапсулированный форма пневмококк тип 
15531	 так быть обнаруживать наследственный трансформация клетка помощь молекула днк 
15531	 настоящий время разрабатываться метод искусственный стабилизация молекула днк рнк повышение способность проникать клетка высокий организм включая человек 
24810	 при вскрытие грудной клетка малыш вблизи аорта обнаруживаться металлический 
16575	 восьмой март подарить вегоневый шарф клетка зеленый черный красный 
19864	 кто-то придумывать чтобы уборщица мыть лестничный клетка перед его квартира 
24810	 потом уже возникать другой симптом становиться более мягкий косточка появляться хруст сустав костный бугор расширение грудной клетка 
19864	 дым она выносить художник каждый десять минута приходиться выбегать покурить лестничный клетка 
19864	 когда заканчивать брачный песнь сила оставлять два десяток молодой честолюбивый голодный прозаик перекуривать лестничный клетка старый московский дом безжалостно 
19864	 входной дверь без замок должно быть потому что вечно теряться проклятый ключ раскалывать косяк большой дырка который тянуть лестничный клетка дым нескладный гул пьяный голос 
19864	 лестничный клетка время время доноситься голос 
24810	 его особый зрение включаться сам себя видеть уже операционный поле над который трудиться валентина ивановна все целиком женский тело редкий стройность легкость позвоночник узковатый грудной клетка тонкий ребро несколько высокий 
24810	 серый морщинистый тело узловатый длинный нога чернильный вена красный сыпь мелкий сосуд ссыхаться как паук грудной клетка большой крест чуть 
19864	 просыпаться через неопределенный время попить кран вода помочиться раковина уборная быть лестничный клетка один весь четыре подвальный 
24810	 избежание несчастный случай оставлять малыш один ванна посидеть рядышком заодно прослеживать чтобы погружаться вода самый плечо верхний часть грудной клетка область сердце должный оставаться 
24810	 девчонка бессознательно укрупнять объем ляжка расширять мышечный ткань грудной клетка 
24810	 итак четвертый попытка когда веревка уходить уже метр ход суживаться настолько что быть под вода для дальнейший его преодоление приходиться выдыхать воздух уменьшать самый толщина грудной клетка 
24810	 галерея продолжаться плавно набирать глубина расширяться сужаться настолько что пора холодный объятие сжимать грудной клетка 
19864	 обычно чтобы сохранять себя иллюзия прежний забота провожать она дверь лестничный клетка бормотать она вслед что-то неразборчиво напутственный 
19864	 лестничный клетка последний раз затягиваться открывать 
19864	 тогда лампочка лестничный клетка заключаться проволочный сетка чтобы 
24810	 это быть отполированый время широкий крестьянский кость видный быть остаток грудной клетка который некогда куковать давно 
19864	 они ухнуть стеклянный дверь конец коридор все опять замолкать там стекло быть лестница лестничный клетка стоять часовой 
16575	 течение столько день видеть только серый цемент пол белый лампа черный клетка гладкий стена цвет болотный 
19864	 маляр это быть какой-то реминисценция преступление наказание убийство кровь лестничный клетка раскольников королевич обожать достоевский 
16575	 какой клетка должный находиться вне шахматный 
19864	 михайлов понимать этот однако мочь избегать острый хотя короткий приступ ревность неловко совестно большой солидный рыхлый мужчина приникать лицо замочный скважина потом воровато оглянуться становиться удобство ради колено стоять грязный пол лестничный клетка прижиматься ухо замочный скважина 
15764	 лапа быть белый значит сидеть клетка давно 
15764	 клест сидеть свой жердочка торжественно гордо как командир конь бросать клетка семечко подсолнух командир соскакивать 
16575	 другой стена короткий скамья отдельно сидеть женщина год тридцать пять сорок очень новый шуба серый головной платок который ворс начисто вытираться всюду обнажаться простой клетка вязка 
15764	 булыжный мостовая ехать колхозный грузовик полуторка мешок картошка отруби плетеный клетка который сидеть курица вскрикивать 
19864	 однажды время немецкий авиационный налет когда обезуметь молотобоец бить тяжелый кувалда камень земля железо греков увидеть батраков сидеть над обрыв лестничный клетка читать какой-то книжонка 
24810	 оба артец заглядывать нутро бах мочь увидеть весь тот оппозиционный нечисть который былой год отызвестковаться его грудной клетка 
15764	 вот они клетка сидеть каждый 
15764	 курт сидеть корточки перед клетка кормить птица 
24810	 первый обнажать засыхать кровь тело перебивать рука раздавливать грудной клетка другой голова выбивать 
16575	 белый король наконец догадываться что хотеть вдруг стаскивать себя мантия бросать она клетка убегать доска 
16575	 король клетка два глядеть доска 
16575	 мессир ужас завыть кот изображать ужас свой морда этот клетка нет король 
15764	 извне слышаться отдаленный гул толпа бродить улица время время гул этот как будто приближаться смешаться внезапно свирепый завывание ветер шум дождь посылать окно производить такой грохот что даже канарейка сидеть нахохливаться клетка над голова поручицы вздрагивать высовывать 
15764	 прекрасный золотой клетка сидеть большой серый попугай 
19864	 викуся недовольно насупливаться влезать куртейка обматываться свой длиннющий шарф выходить лестничный клетка 
19864	 вот она сейчас выплывать лестничный клетка задавать какой-нибудь наводить вопрос 
19864	 присутствующий собираться только мысль что такой она втюхать как гюрза процесс визуальный контроль вверять она лестничный клетка иной слово шарить повсюду глаз 
19864	 пожарный щит лестничный клетка третий этаж 
19864	 вообще-то вика геннадий быть велено строго-настрого лестничный клетка отсвечивать чтобы привлекать 
19864	 лестничный клетка впускать если пообещать учинять 
19864	 потом они звонить соседний квартира пока какой-то соседка все-таки трубка снимать орать уговаривать чтобы она выходить лестничный клетка позвонить катя 
15531	 при высокий доза радиация клетка разрываться цепочка днк что вести 
19864	 привязывать старый подагрик лестничный клетка лапа перила что 
19864	 зато утро перед отъезд вокзал нора аккуратный образ вымывать лестничный клетка 
19864	 год человек приватизировать квартира почему-то складываться представление что один дело личный жилплощадь другой лестничный клетка она пусть отвечать государство 
15531	 книжка дух душа тело говорить что человеческий душа мочь содержать себя информация тело именно этот информация тело быть восстанавливаться быть общий предвосхищать идея клонирование клетка днк только предполагать 
15531	 фагмида внедрять свой днк клетка бактерия выделять вещество смертельный для 
19864	 андрей курпатов муж кто-то что-то кто-то сказать как-то смотреть неправильно подозрительно вместо правительство кгб марсианин всяческий темный сила сосед лестничный клетка продавец магазин родственник сокурсник 
19864	 наталья переодеваться нужно всегда лестничный клетка 
19864	 один лестничный клетка надя жить вполне типичный 
24810	 дима заставлять свой грудной клетка расправляться делать вдох 
24810	 стеллочка сграбастать свой принц охапка крепко обнимать так что степан чуть треснуть грудной клетка 
24810	 никто знать скрипнуть остов скрипка проломиться грудной клетка вероника который тут 
15531	 днк клетка иногда повреждаться длинный молекула 
19864	 при слово милиция просторный лестничный клетка заполняться жилец 
19864	 лестничный клетка обивать черный кожа дверь 
19864	 это придумывать отделывать они стена лестничный клетка 
15531	 поначалу предполагаться что исследователь находить ископаемое кость целый цепочка днк или худой конец смонтировать кусочек находить разный клетка помещать яйцеклетка приемная мать 
15531	 статья который идти речь начало быть сделать очередной шаг практический использование днк оригами для борьба раковый клетка 
15531	 так вот первый днк ящичек тоже быть снабжать замок вид аптамер призванный распознавать определенный белок поверхность раковый клетка соединяться 
24810	 большой продолговатый голова такт шаг качаться широкий плечо под дорогой долгополый пиджак скрывать непропорциональный туловище казаться грудной клетка быть прямо подгонять объем 
24810	 зверь стрелять вертолет так давно два сквозной ранение сверху один зацеплять грудной клетка другой задний нога пуля быть 
15531	 они днк такой образ скрывать отдельный более защищать участок клетка погружать прямо 
15531	 любой биологический особь состоять большой число клетка каждый который храниться 
15531	 при зачатие происходить взаимодействие два родительский половой клетка каждый который нести днк 
15531	 как правило взаимодействие клетка заключаться деление днк 
24810	 недавно оно быть другой бедный зашивать грудной клетка прокачивать через себя какой-то муть 
24810	 сорок шестой размер обувь спрашивать шестидесятый шапка который тоже носить зычный голос легко перекрывать грохот метро грудной клетка гладиатор который первый 
24810	 лицо исполосовывать уличный свет грудной клетка гладиатор стягивать кожаный ремень 
15531	 если специальный знать отдых система антиоксидантный защита разрушать клетка белок углевод днк все 
15531	 этот хитрый механизм обходиться без самый популярный вещество клетка молекула днк 
15764	 конечно считать что сидеть клетка что следовать весь правда 
24810	 пена легкий белый пышный чуть отдавать корица этот сладкий обжигать воздух входить она медленно обволакивать замирать грудной клетка притаиться живот 
16575	 какой-то смысл быть мочь быть этот двигаться узор этот удлинение клетка вытягивание продольный скрещение поперечный линия 
15531	 ген как известно это последовательность химический звено тот молекула днк который присутствовать каждый клетка наш организм один 
15764	 сидеть клетка все вид допоздна 
24810	 сердце ныть гулко стучать замирать как тигр зоопарк прыгать грудной клетка 
24810	 мама упираться приклад плечо спускать курок разворачивать папа грудной клетка 
24810	 сердце весь время колоть болеть разрывать грудной клетка 
15531	 днк храниться ядро каждый клетка наш организм нести себя 
15531	 совокупность молекула днк один клетка называть она геном именно 
15531	 клетка элементарный единица живой мелкий частичка 
15531	 каждый клетка уникальный система который мочь самостоятельно 
15531	 каждый клетка содержаться генетический информация молекула днк 
24810	 они просто входить менять изнутри наполнять легкий раздвигать грудной клетка наделять сила твой голос расширять 
24810	 это равносильный что человек ампутировать грудной клетка успокаивать что много 
24810	 естественный отказ отец отдавать ребенок начинать выламывать рука батюшка мочь подымать рука сей пора поварить пол надевать наручник наваливаться так что мочь дышать повреждать грудной клетка 
15531	 еще число ключевой слово название наука физика химия базовый понятие такой как большой взрыв клетка днк 
24810	 сейчас они вспарывать грудной клетка самый подбородок 
15531	 как только вирус вич-инфекция проникать наш организм поселяться клетка иммунный система тот активизироваться 
15531	 как только вирус вич-инфекция проникать наш организм поселяться клетка иммунный система тот активизироваться начинаться 
15531	 время внедрять искусственный днк пустой клетка который заранее удалять наследственный 
16575	 когда раздеваться дворницкая под пиджак оказываться рубашка ковбой черный красный клетка под ковбойка больше ничто 
16575	 быть новый малиновый башмак шахматный носок зеленый черный клетка кремовый кепка полушелковый шарф 
15531	 дополнительный исследование распределение меченый мышьяк клетка анализ элементный состав днк рентгеноспектрометрия 
15531	 тот раз паабо проанализировать этот палец только днк митохондрия крохотный органелла клетка который вырабатывать для она энергия 
15531	 вот конец год журнал появляться новый статья группа паабо который сообщаться что продолжать изучение сибирский палец исследователь суметь извлекать днк уже только митохондрия также ядро давно омертветь клетка 
15531	 его клетка удаваться извлекать только митохондриальный днк 
15764	 свежий яйцо свободный счастливый курица который весь жизнь сидеть клетка 
15764	 сергей под роспись сдавать материал вдруг удивление увидеть что клетка для задержанный сидеть гуссейн аликперов 
24810	 воскобойников приседать потом закрывать голова рука повалиться лицо обугливать земля поэтому картечный рой пролететь над впиваться застывший как каменный статуя черемхово изрешечивать грудной клетка 
15531	 сол запоминаться что дрим говорить еще какой-то сложный малопонятный вещь программа закладывать клеточный ядро развертывание который проходить десяток раз быстро положенный повреждение генетический аппарат клетка еще что-то весь 
15531	 ядро клетка молекула днк наматывать белок 
24810	 прислушиваться внимательно свой организм понаблюдать что изменяться телесный ощущение столько самый правый рука сколько другой участок тело особенно грудной клетка верхний часть живот 
15764	 кролик сидеть клетка цыпленок ящик поставлять 
15764	 ринка это нравиться хомячок должный жить клетка сетчатый стенка который 
15764	 ринка это нравиться хомячок должный жить клетка сетчатый стенка который 
15764	 специально для гришка крыса сидеть клетка дверца быть привязывать 
15764	 итог стоять клетка она сидеть десять обезьяна 
16575	 сет попросить один пшеничный зерно первый клетка шахматный поле два второй 
16575	 выбирать родитель род собрание выбирать клетка красный зеленый черно белый этот 
15764	 всякий случай логика все порядок зверь должный сидеть клетка что делать нормальный 
16575	 представлять себя оторопь шахматист который располагаться столик перед очередной тур крупный международный турнир разом замечать что каждый расставлять здесь доска клетка занимать невесть откуда взяться 
16575	 однако доска клетка или другой число 
16575	 затем весь комиссия отправляться дом конференц-зал полный карта атласов определитель заставлять стол пустой клетка 
15764	 попугай который сидеть красивый массивный клетка выходить гулять его нянька катя 
15764	 вытаскивать крыса клетка разбудить она сидеть 
15764	 один клетка сидеть самый обыкновенный курица 
16575	 обходить ход конь шахматный доска начинать клетка заканчивать 
15764	 они сидеть грязный клетка высасывать сырой яйцо через 
