15764	 гостиная стоять украшать изящный резьба великолепный книжный шкаф красный дерево стиль поздний георг лаковый китайский шкаф для фарфор полный тонкий напросвет чашка каждый свой имя возраст фортепиано бронзовый канделябр для свеча крышка который обитать три фарфоровый статуэтка три многажды битый клееный маркиза один сидеть туалетный столик другой держать рука клетка птицей третий пить кофе 
15764	 нажимать кнопка вызов напоминать сам себя глупый обезьяна который сидеть клетка жать клавиша после 
16575	 каждый черный клетка получать очко каждый 
15764	 основной всякий пародийный дурашливость про два друг кличка дуга дуга тирли тирли либо псевдовосточный один клетка попугай сидеть 
15764	 основной всякий пародийный дурашливость про два друг кличка дуга дуга тирли тирли либо псевдовосточный один клетка попугай сидеть другой 
16575	 жизнь полгода провисеть заставка мой домашний компьютер экран сталкиваться сморщиваться изгибаться узор порождать простой правило отдельный клетка вспыхивать если рядом быть другой 
16575	 президент харьковский игровой клуб лис колоколок аленков предлагать читатель журнал головоломка ход шахматный конь клетка стоклеточный шахматный доска заполнять буква 
16575	 ход конь обходить все клетка доска прочитывать при это 
16575	 шахматный математика популярный задача обход конь весь клетка шахматный доска 
16575	 платье элизабет становиться зеленый черный клетка 
16575	 понятно что природа шахматный доска где все клетка одинаковый 
16575	 плотность вязка квадрат филейный сетка размер клетка 
16575	 черный полоса вязать соответственно клетка лиф без прибавление ряд 
15764	 спустя сутки после третий сеанс весь крыса обычный тот кто сидеть барокамера начинать подвергать стресс течение час каждый крыса получать слабый удар ток проходить через пол клетка 
15764	 это когда все сидеть свой клетка или мелькать подхват 
16575	 каждый клетка шахматный доска обозначать определенный участок 
16575	 поставлять груша пустовать клетка склоняться над доска приготавливаться 
16575	 громадный транспортный клетка выстраивать толстый доска 
16575	 последний год число шахматный материал многий газета журнал резко сокращаться диаграмма черно-белый клетка вообще становиться редкость 
15764	 последний ходить улица колокольчик шея медведица обычно сидеть клетка хотя иногда удирать причем возможно 
16575	 бдительный журналист зафиксировать активность чемпион мир при розыгрыш два лот классический комплект белый красный фигура тип стаунтон середина век необычный шахматный доска черно бирюзовый клетка 
16575	 безвинный вид занятие шахматы прогневить тот чей взгляд быть неизмеримый более широкий скажем яна гус тоже яростно выступать против состязание шестьдесят четыре клетка 
16575	 если посмотреть валлетта сверху это шахматный доска узкий улица образовывать равномерный клетка машина они почти нет 
16575	 узор иметь ярко выраженный рельефный структура состоять мелкий клетка 
19864	 комплекс натуральный масло витамин насыщать клетка кожа липид влага 
19864	 патентованный комплекс аналог церамидов кожа восстанавливать клетка кожа способствовать разглаживание мелкий морщинка 
19864	 когда витамин достаточно молодой клетка энергично приходить замена старый 
19864	 весь масло без исключение обладать свойство хорошо питать увлажнять кожа усиливать обновление клетка омолаживать подтягивать кожа лицо 
15764	 некоторый животное светочувствительный клетка группироваться вид глазной пятно 
15531	 внутри каждый человек проживать килограмм микроб один клетка наш организм они приходиться 
15764	 сам вирус нет вот поражать они клетка организм несомненно 
16575	 однако влияние алкалоид опий или производный размножение вич другой чувствительный клетка практически исследоваться 
15531	 для размножение лабораторный штамм вирус вич использовать осветлять культуральный жидкость содержать вирус который добавлять клетка соотношение или 
19864	 результат процедура стимулировать регенерировать клетка кожа 
16575	 мальчик искать этот тайна повсюду выбирать между страна народ египетский пирамида космический корабль родной литература миф древний греция звездный небо строение клетка ядро цитоплазма 
15764	 милый скотий детвора теленок покойно дремать свой клетка или задумчиво тянуть ясел 
15531	 препарат стимулировать обмен вещество клетка головной мозг ноотропить когитум пантогам 
19864	 еще далеко конец коридор быть отгораживать кладовка там клетка без окно без дверь меж 
15531	 многообразие морской фауна кольцов переходить форма животное почему животное такой форма другой далее переходить форма клетка 
15764	 весь жизнь страшиться заданность плохой чем тюремный клетка становиться трудно дышать 
15764	 они сачок весь улица захватывать набивать они клетка доверху везти как значит 
15764	 только клетка сидеть просто взять 
16575	 клетка должный тщательно мыться горячий вода 
15764	 активный клетка хотя тысячный доля градус 
16575	 что такой недоумение спрашивать воланд становиться глядеть доска где стоять королевский клетка офицер отворачиваться закрываться рука 
19864	 узенький клетка между наружный внутренний дверь 
15764	 это вытаптывать босой нога камень бегать бурный ночь свой клетка 
15764	 клетка она древесный стружка поилка 
15531	 оказываться что оно напрямую влиять макрофаг особый клетка наш организм 
16575	 шейд фролова рассказывать результат действие азобензен потенциал зависимый канал сердечный клетка получать метод пэтч клампа 
15531	 как вирус прион мочь размножаться только счет ресурс предоставлять хозяйский клетка 
15531	 некоторый время назад информационный агентство итар-тасс опубликовывать заметка создание группа валерия фокина препарат который потенциально мочь использоваться для борьба раковый клетка 
16575	 быть мочь быть еще какой-то лекарство тоже точно доставлять определенный клетка 
15531	 близкий этот тема конкретный проект разрабатывать такой лиганд который быть как транспорт нести себя лекарство доставлять пример поражать клетка 
15764	 создаваться впечатление что создавать для она золотой клетка 
16575	 склад транспортный клетка как называть специальный контейнер для 
15531	 вич поражать именно иммунный клетка только надо сцепление 
16575	 понятно что любой клетка без труд отличать наличие ток 
15531	 начало февраль год американский журнал быть опубликовывать статья посвящать программа создание наноустройство который смочь находить уничтожать раковый клетка популяция 
15531	 как известно каждый наш клетка пара хромосома каждый 
15764	 после суд интервью клетка все такой искренность 
15531	 между возможность мозг прямо зависеть число составлять его клетка 
16575	 при это похоже этот отросток выполнять весь обычный работа нервный клетка принимать сигнал орган чувство 
15531	 как известно школьный курс биология весь клетка организм кроме половой присутствовать двойной 
19864	 какой странный квартира она постоянно быть дело прихожая заводиться незнакомый шарф книжка поменяться закладка телефонный трубка снимать сенин клетка 
15764	 стволовый клетка активный течение весь жизнь 
15531	 дело что каждый клетка наш организм существовать энергетический станция 
15531	 когда быть обнаруживать что большинство клетка человеческий тело мочь делиться ограниченный 
16575	 известно что ретинол обладать ярко выраженный пилинговый эффект быть способный удалять отмирать клетка указывать доктор обрайен 
15764	 исследователь считать что при сжатие клетка сжиматься компонент внеклеточный вещество 
15531	 такой образ клетка становиться как сплошной среда 
19864	 пол лестничный клетка перед квартира муза лежать дезок 
19864	 все запихивать чемодан доволакивать дверь размашистый жест выкидывать лестничный клетка 
19864	 ребенок светлана таня перенимать этот привычка понимать зачем мыть лестничный клетка 
19864	 ребята курить лестничный клетка готовый грузить коробка 
15764	 тут пункция атипичный клетка все как положено 
15531	 животное растение она храниться ядро клетка 
15764	 из-за они клетка один организм мочь различаться 
15531	 этот маркер блокировать разрушение здоровый клетка иммунный система человек 
15531	 этот маркер блокировать разрушение здоровый клетка иммунный система человек что 
15764	 вернуться поди домой вдоволь нагуляться искать свой клетка кормушка вода 
15531	 именно благодаря вирус попадать клетка иммунный система человек или обезьяна 
15531	 поначалу наш организм мочь без труд заменять погибать клетка иммунный система 
15531	 при это стоить забывать что синтез геном насчитывать много миллион пар основание его успешный трансплантация клетка который удалять наследственный 
19864	 если например стволовой клетка последний десятилетие говориться очень 
16575	 различать эмбриональный стволовый клетка получать отторгать эмбрион гематопоэтический 
19864	 например франция общение между незнакомец часто естественно устанавливаться разный место ситуация время демонстрация заседание квартальный совет лестничный клетка булочная почта 
15764	 научаться управлять свет воздух тепло человечество добровольно закрываться золотой клетка променивать многообразие жизнь гарантировать 
15764	 недавний время быть принятый считать что они синтезировать эндокринный железа или специализированный эндокринный клетка разбрасывать весь организм 
15531	 клетка диффузный эндокринный система развиваться 
15531	 быть иммунный система способный узнавать появление вирус как инфицировать клетка 
15764	 усадить маленький нахохливаться обтрепывать птичка золотой клетка носиться она носиться 
15764	 семен гальперин муж стволовой клетка все так просто 
15764	 она безвредный жить клетка насекомое червь который паразитировать 
16575	 например подстилка мышиный клетка должный соответствовать параметр 
15764	 лисенок енот кролик другой животное пересаживать дорожный клетка увезти москва туда 
15531	 весь молекула днк содержать наш ген окутывать клетка защитный белок 
15531	 как многие вероятно известно вирус вич-инфекция проникать иммунный клетка после что размножаться там 
15764	 сахар сахарозаменитель вызывать диабет провоцировать рост опухолевый клетка лабораторный крыса 
19864	 начинать можно любой клетка последний прыжок должный вернуть 
19864	 невольно бросаться старый чемодан доставать забывать блузка цветок юбка клетка 
15764	 вернуться клетка все еще верить что 
16575	 работница уход обезьяна жаловаться что мешать убирать клетка вообще становиться агрессивный 
16575	 далеко весь обезьяна добрый воля заходить транспортный клетка многие приходиться отлавливать сачок 
15764	 поджидать сафрон переносной клетка дверца который надо успевать быстро 
15531	 пример очень чувствительный нейропептид клетка иммунный система который под действие 
15531	 это понятно сначала активироваться ген затем синтезироваться спустя некоторый время ядро клетка начинать нарабатываться белок 
15531	 внешне они сохранять весь атрибут цветковый растение содержать хлорофилл клетка мочь самостоятельно вырабатывать питательный 
15531	 внедрение гаусторий ткань будущий кормилец происходить результат воздействие специальный фермент разрушать клетка 
15764	 тяж чуждый лиана клетка похожий грибной мицелий высасывать 
16575	 евгений гик математика клетка занимательный задача головоломка 
15531	 тот самый маленький молекула что производиться специфический клетка наш мозг 
24810	 сторона мочь показываться что человек метаться невидимый клетка ограниченный начинаться тут глухо 
16575	 число поломка изменять покалечить молекула все увеличиваться пока несущий клетка получать приказ совершать самоубийство 
15531	 результат любой вакцинация являться иммунный ответ который обеспечивать как плавать кровь белок антитело так непосредственно клетка иммунный система 
16575	 круглый блестящий железка полностью заполнять масло клетка под видно 
15531	 наночастица проникать клетка различный тип накапливаться 
15531	 размножаться плесень обычно бесполый вегетативный способ спор фрагмент гиф мицелий значительно редко половой путь слияние клетка когда происходить обмен генетический информация 
15531	 клетка это элементарный живой система способный 
15764	 загнать свой научный разбойник лаборатория вытаскивать клетка крыса наташа раскладывать таблица включать 
24810	 вставлять звуковой файл моторчик заставлять расправляться пластмассовый грудной клетка оказываться дешево чем нанимать живой 
19864	 более представлять что пребывание клетка можно кто-то передаривать как это 
15531	 уровень распределение мутация перегруппировка хромосома при образование половой клетка 
15531	 каждый половой клетка индивидуум попадать хромосома 
15531	 другой половой клетка хромосома материнский набор 
15531	 клетка тип покрывать среди прочее 
15764	 антитело склеиваться чужой клетка что вызывать отторжение организм 
19864	 стволовый клетка это придумывать какой-то американский ученый 
15531	 иногда забираться верх клетка цепляться лапка дождаться момент 
15764	 надо они вытаскивать клетка решать вася 
15764	 избыточный количество глутамат приводить неконтролируемый возбуждение клетка конечный итог 
15531	 именно такой борьба находить иммунный система фагоцит поедать опасный для организм клетка трогать 
15531	 маргарита аншина жена суррогатный материнство банк половой клетка ведение пациент начало лечение 
15531	 маргарита аншина жена суррогатный материнство банк половой клетка ведение пациент начало лечение 
15531	 внутри капсула генетически модифицировать клетка который мочь выбираться наружу 
19864	 это взять сигарета выходить лестничный клетка 
24810	 они тормозить биохимический процесс призывать бороться раковый клетка самый провоцировать канцерогенез 
15531	 первый такой ген называть сирт быть обнаруживать клетка дрожжи червяк поздно гарент 
15764	 доказательство глубокий знание майк садиться перед клетка поза лотос как 
19864	 стоить кто-то только подумать что пора запирать клетка как 
15531	 определенно знать что вынашивать коварный план заключение его клетка 
24810	 тип дыхание диафрагмальный брюшной дыхание медленный плавный вдох нос вдох грудной клетка почти неподвижный передний брюшной 
15764	 вартбург михаил рождение клетка что лежать 
16575	 что другой более пластичный быть поддаваться изменение элемент клетка или организм целое 
15531	 предлагать термин эффект положение ядро клетка поскольку регуляция генетический активность зависеть 
16575	 взять себя дом только документ клетка два волнистый попугайчик 
16575	 достижение критический длина клетка получать сигнал самоуничтожение запрограммировать 
