16575	 возможный решение дырка решение два клетка два половинка некоторый участник 
16575	 размер клетка чередоваться шахматный порядок 
15531	 клетка гипофиз свой очередь выделять 
24810	 обломок они сейчас прятаться клетка воздействовать функция как 
15531	 возникать основа главный вызов последний достижение биология клеточный биология технология чтение сохранение генетический информация создание генетический программа перспектива замена орган выращивать соматический клетка успех агробиология многообещающий генно инженерный 
16575	 теперь надо выбирать краска удачно схватываться знакомый клетка возбудитель сифилис малярия туберкулез 
19864	 кстати ваш семья тридцатый год жить дом нкид хоромный переулок дом два дробь шесть один лестничный клетка константин уманский что 
15764	 татьяна брайтон англия маршал ворошилов буденный дружить дом тот пора как попадать золотой клетка двести семья обеспечивать полностью 
15531	 такой человек всего лишь страдать нарколепсия иммунный система поражать собственный клетка специфический нейрон орексин 
15531	 план заключать ядро этот один единственный клетка молекула днк 
15531	 каждый клетка нести себя информация 
15531	 брать ядро клетка кишечник взрослый лягушка 
15531	 как устраивать молекула днк этот королева живой клетка 
15531	 однако при нарушение обмен вещество неблагоприятный условие окружающий среда засуха засоление почва действие техногенный фактор возникать опасность накопление этот вещество клетка токсический концентрация 
16575	 опухолевый клетка при это уничтожаться только 
15531	 контакт между клетка многоклеточный животное обеспечиваться специальный белок 
16575	 согласно современный воззрение контактировать клетка два способ 
15764	 растение гриб канал связующий клетка устраивать вид цитоплазматический мостик 
16575	 оценка балл хороший решение следующий два клетка два половинка рассматривать множество 
15531	 организм зарождаться встреча два половой клетка материнский отцовский 
16575	 построить замкнутый маршрут шахматный конь весь клетка ступенчатый квадрат порядок 
16575	 результат такой объединение получать замкнутый маршрут шахматный конь весь клетка ступенчатый квадрат порядок 
16575	 любознательный читатель мочь изучать возможность обход конь клетка например ступенчатый прямоугольник 
16575	 затем эмбрион состоять стволовой клетка два различный мышь имплантировать 
15531	 каждый клетка содержать генетический код полный информация 
15531	 нервный клетка вряд удаваться выращивать печеночный 
15764	 всякий случай власть выставлять возле клетка милицейский пост 
15531	 например давать определение стволовой клетка молекула нанометр нейрон правильно оценивать 
16575	 какой клетка должный находиться вне шахматный 
16575	 кроме прочее шесть общий тетрадь четыре клетка два линейка 
15531	 помощь можно быть например создавать больший массив биофункциональный цепочка который позволять обнаруживать идентифицировать организм определенный клетка белка маркер 
19864	 гиттис выталкивать лестничный клетка захлопывать дверь 
15531	 поэтому при наличие давление большой число клетка один масть снижаться разнообразие 
15531	 поразмыслить признавать свой неправота мещанин должный подоконник цвести герань клетка содержаться канарейка комод 
15531	 ископаемый состояние как правило сохраняться только оболочка клетка иногда удаваться увидеть 
15531	 сахарный диабет тип разрушение клетка поджелудочный железа приводить абсолютный 
24810	 митральный клетка самый крупный нервный 
16575	 дендритный окончание митральный пучковый клетка получать сигнал аксон 
15764	 насколько интенсивно делиться клетка сидеть мембрана зависеть скорость 
15764	 один специалист считать что синезеленый водоросль окремнеть время другой полагать что они активно минерализовать кремний третий что окремняться мочь только мертвый клетка 
16575	 обходить все клетка таблица ход шахматный конь начинать 
16575	 клетка действительно обновляться откуда взяться 
16575	 черно-белый клетка беспорядок лежать магнитный фигурка 
19864	 хранить стволовый клетка банка древний время 
19864	 майор вздыхать выходить покурить лестничный клетка кухня теперь нельзя 
15531	 во-первых никакой половой клетка инфузория нет во-вторых 
24810	 стоить отмечать что человек клетка эмбрион обнаруживать материнский кровь 
19864	 время они превращаться специализировать клетка щитовидный железа кишечник желчный пузырь 
15531	 еще середина год быть идентифицировать ген белка поверхностный молекула который должный пристыковаться вирус вич-инфекция чтобы проникать внутрь иммунный клетка 
15531	 результат единожды инфицированный клетка нести себя ген лентивирус 
15531	 некоторый окрашивать окончание отросток моторный нейрон кора головной мозг быть обнаруживать непосредственный близость клетка ядро лицевой нерв 
15764	 повзрослеть птица пересаживать клетка высота длина 
15531	 сегодня считаться что меланин защищать ядро клетка кожа излишний ультрафиолет облучение 
15531	 цитокин молекула помощь который клетка обмениваться информация передавать сигнал 
15531	 лимфоцит клетка участвовать иммунный ответ организм 
15531	 они впрямь способный воспроизводить себя при подходящий условие даже бесконечно переписывать храниться они генетический информация клетка следующий поколение 
15531	 даже информационный процесс внутри клетка называть письмо 
19864	 действительно вскоре дверь клетка открываться кавказец уводить 
15764	 особенно долго стоять клетка крокодил 
19864	 параллельно развиваться протеомик наука взаимодействие белок клетка время жизненный цикл 
15531	 прусс американский школа ребенок учить строение клетка механизм обмен вещество 
16575	 клетчатый бумага нарисовать прямоугольник размер клетка строка столбец 
15531	 как правило она помещаться поверхность клетка обращать наружу где этот 
24810	 корова ведь расходовать запас содержаться клетка мышечный ткань 
15531	 сегодня ученый называть белка встроенный интегрировать мембрана клетка рецептор 
15764	 замечать как оказываться золотой клетка 
19864	 смысл что треш это кожа сдирать мертвый клетка кожа 
19864	 жить пятый этаж без лифт весь стена лестничный клетка быть исписывать любовный послание 
19864	 один лестничный клетка вера жить женщина врач 
19864	 следом она лестничный клетка выплывать одурять запах жирный мясной 
15764	 ванька кормить мелко нарезать мясо уцелеть черномагический книга академик шипеть клетка 
19864	 охотно посвящать весь тонкость содержание дрессура лечение хищник клетка хоть убивать впускать 
15531	 каждый клетка человеческий организм содержаться около 
15531	 биологический роль митоз длиться обычно час состоять обеспечение идентичный генетический информация два дочерний клетка 
15764	 вращаться золотой клетка необычный птица сырой 
24810	 постоянно кашлять жаловаться боль грудной клетка 
15531	 прилипать клетка хозяин вич проникать внутрь 
15531	 строка матрица соответствовать различный диагноз описывать совокупность значение параметр указывать клетка матрица отмечать звездочка 
15764	 число кролик поставлять откорм должно превышать один клетка 
16575	 при это клетка матрица соответствовать строка 
19864	 разговор лестничный клетка возобновляться кто-то становиться рассказывать 
15531	 она состоять как клетка каждый 
15764	 перерыв между опыт они сидеть печальный глаз клетка 
16575	 клетка отравлять собственный углекислота получать 
15531	 основывать этот соотношение алгоритм синтез совокупность называть алгоритм процесс свой функционирование алгоритм реализовать заполнение клетка табла 
16575	 обозначать множество вносить клетка оценка 
15531	 диагностика осуществляться помощь выявление инфекционный возбудитель первичный культура клетка альвеолярный макрофаг свинья 
16575	 получать лигазный смесь трансформировать клетка штамм тор 
16575	 при это клетка ресуспендировать лизировать 
15531	 встраивание гликопротеин вирус болезнь ауесок мембрана искусственный липос взаимодействие клетка 
15764	 очищать вирион вба гликопротеин вба гепарин ингибировать связывание вирос клетка что свидетельствовать специфичность они 
15531	 ключевой слово альфа герпесвирус вирус болезнь ауесок гликопротеин реконструировать липосома взаимодействие клетка 
16575	 шить верхний юбка ткань клетка или любой другой подходить 
15531	 как правило это быть отчет инвентаризация таксационный описание ведомость запас клетка квартал альбом посортиментный распределение ликвидный 
15764	 бунтовщик определять специально приготавливать деревянный клетка пребольно потыкивать палка сквозь 
15531	 кроме она вовлекать синтез нуклеиновый кислота молекула носитель генетический информация клетка 
15531	 работа использовать суммарный днк клетка инфицированный штамм 
16575	 культура клетка почка зеленый мартышка 
16575	 оптимальный субстрат для производство игва мочь быть перевивать линия клетка удовлетворять требование воз 
15531	 слабо присоединять внешний слой мембрана клетка нейрон помощь гфия 
15531	 такой образ мочь осуществляться транспорт между нейрон клетка 
15531	 этот данные показывать что анти действие ифна зависеть тип ифна тип клетка 
15531	 транскрипция вирусный геном инфицированный клетка приводить появление набор субгеномный 
15531	 данный работа использовать эукариотический система экспрессия клетка насекомое основа бакуловирусный вектор 
15531	 погибший яванский макака штамм васильченко день диффузный распространять изменение отмечать лобный двигательный теменной кора зрительный бугор хвостатый ядро бледный шар ядро пара черепномозговой нерв ядро дейтерс сетчатый вещество нижний олива кора мозжечок клетка пуркинья зубчатый ядро ядро внутренний 
16575	 клетка перитонеальный полость получать индивидуально 
15531	 такой образ укрепляться мускулатура сжигаться жир разрушаться клетка целлюлит 
15531	 такой условие терапевтический эффект проявляться глубокий подавление вич-инфекция инфицировать пациент выраженный увеличение количество клетка 
15764	 далеко наверное своеобычный остро пахнуть полутемный клетка решать 
15764	 передний часть тело иметься два симметричный пятно каждый они тысяча светочувствительный клетка 
15764	 глаз человек быть два вид светочувствительный клетка палочка колбочка 
15531	 транспортер это белок который транспортировать щель между синапс точка контакт связь между нейрон такой важный модулятор работа нейрон как серотонин еще называть вещество хороший настроение обратно клетка 
19864	 состав для биодермабразия который размягчать кожа оптимизировать процесс деление клетка кожа 
15531	 высокий безымянный мудрость заключаться что один единственный клетка образовывать малоподвижный слегка 
15764	 лобан горделиво похвалить корытин останавливаться возле клетка 
15531	 сейчас например инсулинзависимый сахарный диабет здесь успешно лечить вживлять пациент клетка поджелудочный железа кролик который как 
19864	 неясный пока причина клетка щитовидный железа неожиданно становиться словно 
15531	 по-прежнему небольшой комната крашеный пол среди сохнуть детский пеленка стук швейный машинка среди птичий клетка его окружать молодой поэт 
15531	 как клетка зверь она вступать 
15764	 еще помнить вверху сучок висеть золоченый клетка она неизвестный барский 
19864	 узенький клетка между два дверь протягивать рука 
15531	 сегодня известно что диабет тип возникать из-за что активно разрушаться бета клетка поджелудочный железа который нормальный 
15531	 она быть размещать клетка человеческий кожа печень 
15531	 дело что клетка вырабатывать воспринимать 
15764	 клетка она ненавидеть поэтому моментально прекращать 
15531	 данный случай она состоять что хотя результат метаболизм клетка морской трава образовываться несколько вид 
15531	 стоять услуга около тысяча рубль выделение клетка тысяча каждый 
15531	 результат действие любой вакцина появление организм большой количество компетентный иммунный клетка чей рецептор способный узнавать данный 
15531	 дело что процесс образование половой клетка сперматозоид яйцеклетка необходимый для 
15764	 вот только клетка жить мочь 
15764	 почему этот истина конечный итог заманивать клетка 
19864	 например стволовой клетка кровь находиться костный мозг 
19864	 весь остальной время выходить лестничный клетка встречать сосед рассказывать 
15531	 соприкасаться вечность молчать слушать слушать каждый клетка слушать 
15764	 даже сам размещение сборная пафосный отель бристоль соседство президентский дворец оказываться ошибка как известно золотой клетка свой суть менять 
15764	 повар усаживаться корточки вытаскивать клетка кобра 
15531	 во-вторых глицерин менять оптический структура клетка так как при замещение оно 
15531	 свой очередь микротрубка цилиндрический белковый волоконце взамен формирование неподвижный сетчатый скелет клетка как это наблюдаться рыба 
16575	 при это клетка мочь иметь слишком толстый 
19864	 американский ученый разрабатывать оригинальный техника выявление злокачественный клетка основывать комбинация оптический 
15531	 диагностика болезнь осуществляться при помощь выявление белок мезотелин который вырабатываться злокачественный клетка мезотелиома онкологический новообразование яичник 
15531	 фотография слева эндотелиальный клетка здоровый человек 
15764	 многие все еще недооценивать уникальный сложность клетка 
15531	 присутствие биокирпич повышать степень сложность клетка хозяин следовательно трудно прогнозировать 
19864	 последний год много говориться успех эксперимент стволовой клетка 
19864	 год колба чашка петри группа американский ученый глава профессор университет штат мичиган ричард ленск смениться тысяча поколение клетка кишечный палочка 
15531	 обнаруживать что клетка соединительный ткань фибробласт мочь делиться 
15531	 важный этап иммунный ответ это распознавание специфичный молекулярный комплекс чужак для животный клетка 
15531	 лимфоцит содействовать лимфоцит или уничтожать заражать клетка 
15531	 натуральный киллер популяция лимфоцит способный оказывать прямой токсический действие раковый вирус инфицировать клетка 
15531	 этот грандиозный карта создатель который идея должный ускользать один извив человеческий мысль получать название аналогия геном опись весь ген содержаться один единственный клетка 
16575	 клетка пересечение строка столбец указываться 
16575	 мочь случаться что клетка пересечение строка столбец соответствующий 
15531	 верх клетка подвешивать банан один 
19864	 начальник любовник упираться захотеть выходить лестничный клетка наводить порядок подгонять слесарь 
