15531	 четырежды упоминать высоко теломер свой род колпачок кончик хромосома хромосома свой очередь представлять себя упаковывать белковый оболочка днк наш клетка днк как все известно 
15531	 конгломерат клетка связывать между себя обмен вещество 
15764	 как оказываться кофеин только предотвращать возникновение болезнь способствовать восстановление уже поражать клетка 
15764	 слизистый оболочка кишечник сосредотачивать иммунологический активный клетка 
16575	 противоопухолевый эффект адаптоген вероятно связывать регуляция межклеточный контакт при это деление опухолевый клетка нормализоваться влиять межклеточный взаимодействие 
15531	 волосок мочь состоять как один так несколько клетка 
15764	 затем периодически начинать подергиваться мышца из-за раздражение нервный клетка спинной мозг 
15531	 что органелла клетка являться рано отдельный живой система 
15531	 дело что каждый вид клетка наш тело иметь свой 
15531	 вильсон говорить классический генетический стохастика который работать уровень образование половой клетка независимый распределение между образовываться половый 
15531	 допускать что один половый клетка попадать хромосома отцовский 
15531	 каждый половой клетка оказываться свой сочетание отцовский 
15531	 они обязательно перегруппировываться рекомбинировать процесс образование половой клетка 
15531	 наверное все слышать что информация как построить организм храниться днк своеобразный библиотека живой клетка 
15531	 изучать строение клетка головной мозг так 
15531	 химический реакция происходить только окружающий среда клетка человеческий тело 
15531	 фермент белковый молекула катализировать процесс живой клетка 
15531	 во-первых отличие другой флуоресцентный метка подобный белка для свечение нужный никакой вспомогательный вещество кроме молекулярный кислород поэтому клетка оставаться живой неповрежденный 
15531	 во-вторых отличие другой краситель это белковый молекула который синтезироваться клетка свой генетический код 
15531	 такой генетически модифицировать клетка начинать синтезировать сложный химерный белок 
15531	 сабинин предсказывать исключительный роль нуклеиновый кислота жизнедеятельность клетка растение тот число 
15764	 возможно потому что оказываться запирать золотой клетка 
15531	 мутация это катастрофа уровень геном клетка 
24810	 если ранний стадия развитие изымать клетка эмбрион человек после 
16575	 ведь химик органик уже нарабатывать огромный семейство пигмент крепко сцепляться органический волокно быть какой-то органелла клетка теперь надо выбирать краска удачно 
15531	 нервный клетка соединять проводящий путь 
15531	 нервный клетка вдруг переставать работать гибнуть 
16575	 выявлять изменение поведение клетка при старение организм 
16575	 второй инъекция трансформировать эмбриональный стволовый клетка эмбрион 
15531	 многий многоклеточный животное такой канал построить молекула белок который так называться белка щелевой контакт они встраивать мембрана клетка почти весь ткань 
15764	 каждый эмблема долгий история жизнь клетка словосочетание стволовый 
16575	 рассматривать множество фигура клетчатый плоскость состоять два соседний клетка иметь общий сторона два 
15531	 выращивать нервный клетка мочь использоваться для восстановление нерв 
15531	 пока что ученый выращивать нервный клетка жировой ткань крыса 
15531	 во-вторых возникать должный быть днк клетка первобактерия устойчивый замкнутый 
16575	 оказываться весь клетка ступенчатый квадрат любой порядок можно 
16575	 это значить что рассматривать метод можно построить обход конь клетка ступенчатый квадрат любой порядок 
15764	 тоже становиться досадно что из-за какой-то неудачник пистолет застревать клетка 
16575	 если дословно нобелевский премия присуждать открытие принцип введение специфический генный модификация организм мышь посредством эмбриональный стволовый клетка 
16575	 эванс его сотрудник внедрять генетический материал эмбриональный стволовый клетка половой 
16575	 год очередной публикация журнал они сообщать введение эмбриональный стволовый клетка мышь донор стволовый 
16575	 стволовой клетка выделять эмбрион донорский мышь 
16575	 для облегчение идентификация трансгенный животное донорский эмбриональный стволовый клетка эмбрион взять мышь 
15764	 совершенно нелепо попадаться мурь метаться клетка вместе все еще живой 
15531	 внутри окунаться спертый зловоние медвежий клетка 
19864	 обязанность катя входить выходить покурить лестничный клетка осуществлять предварительный отбор избежание 
16575	 хорошо удалять отмирать клетка роговой слой токсин загрязнение 
15531	 при соприкосновение корень растение хозяин верхушка корень заразиха превращаться присоска гаустерия который активно внедряться корень при содействие специальный фермент разрушать клетка 
16575	 гломерула осуществляться контакт между окончание аксон обонятельный нейрон дендрит нейрон второй порядок который являться митральный пучковый клетка 
16575	 пучковый клетка мало митральный функционально 
15531	 помимо повышение риск развитие атеросклероз сопутствующий заболевание сердце сосуд этот снижение чувствительность клетка поджелудочный железа инсулин диабет 
15531	 во-вторых это обмен генетический материал между клетка быть перенос ген 
16575	 наряду лучевой терапия химиотерапия при лечение злокачественный новообразование применять метод гипертермия при повышение температура опухолевый клетка погибать 
19864	 хранить стволовый клетка банка один ключевой 
15531	 образовываться определенный форма клетка кардиомиоцит 
15531	 процесс нейрогенез образовываться нейрон клетка глия 
15531	 большой часть клетка головной мозг ребенок образовываться уже 
15531	 один этот препарат мешать вирус попадать клетка размножаться другой позволять 
15531	 чтобы узнавать как далеко простираться отросток нервный клетка кора головной мозг крыса нейрон 
15531	 экворин накапливаться внутри клетка нарушать жизнедеятельность 
15531	 когда человек инфицировать ретровирус реовирус цитомегаловирус вирус эпштейн барра происходить формирование антитело который атаковать клетка поджелудочный железа что мочь приводить 
16575	 трансформировать клетка превращаться фабрика производство 
15764	 сетчатка защищать светочувствительный клетка фоторецептор палочка колбочка 
16575	 суть это цифровой пасьянс требоваться заполнять клетка таблица поделить 
16575	 холестерин важный для клетка почка селезенка для функция 
15531	 подобно как генетический код клетка запечатлевать зашифровывать вид важный 
15531	 восклицать дэвис это живой клетка они впрямь способный воспроизводить 
15531	 как воспользоваться этот особенность живой клетка для передача космический сигнал 
16575	 грудной клетка при это вроде должный 
15531	 небольшой количество клетка животное растение присутствовать также 
15764	 как оказываться бокал другой вино мочь повышать тонус мозговой клетка задерживать старение 
15531	 специализированный клетка кишечник поглощать вода каловый 
15531	 наверное сознание избавление такой сила охватывать что каждый клетка вливаться блаженный смазка 
15764	 если процент клетка активный мутировать ген оказываться 
15531	 во-вторых единственный который находиться клетка мужчина мочь проявлять весь положительный 
15531	 получаться что зрительный клетка это действительно живой природный фотоумножитель 
19864	 год назад январь год журнал помещать первый сообщение производить американский ученый выделение кроветворный стволовый клетка человек 
16575	 преинкубация культура клетка витронектин блокировать способность патогенный 
19864	 резко спрашивать она выходить лестничный клетка 
19864	 лестничный клетка галя выходить вместе 
19864	 закуривать почувствовать себя психологически хорошо крячко выходить лестничный клетка начинать спускаться лестница 
15531	 работа использовать вирус грипп штамм изолированный больной острый респираторный заболевание проходить пассаж клетка линия использование стандартный 
16575	 осадок клетка ресуспендировать ростовый среда 
15531	 такой образ при синтез каждый множество полагаться равный отмечать что излагать далее алгоритм синтез представительный фрагмент совокупность клетка табла 
15531	 алгоритм заканчивать работа заполнение клетка она вноситься 
16575	 обозначать через оценка решение частный задача оптимальный при рассматривать лук только этот принадлежать множество оценка должный вноситься каждый очередной клетка табла 
15531	 синтез выполняться модификация алгоритм предусматривать внесение каждый очередной клетка табла 
15531	 проанализировать клон копия вирусный геном оказываться инфекционный введение клетка приводить получение 
16575	 для получение тотальный днк лимфоцит зировать помощь обработка протеиназа этот цель около клетка ресуспендировать лизировать 
15531	 материал для выделение противовирусный днк рнк вич служить периферический кровь получать серопозитивный лицо разный стадия вич-инфекция все образец культуральный жидкость клетка лимфобластоидный культура заражать лабораторный штамм 
15531	 задержка клетка различный стадия митотический цикл 
16575	 выделение вирус провожать использование перевивать культура клетка почка обезьяна 
15531	 цель работа быть изучение взаимодействие липос содержать встроенный гликопротеин вирус болезнь ауесок вба плазматический мембрана чувствительный клетка 
15764	 гликопротеин ориентироваться мембрана липос эктодоменный фрагмент наружу виросома дозозависимый связываться клетка очищать вирион вба гликопротеин 
15531	 инфицирование клетка альфа герпесвирус начинаться 
15531	 центральный роль адсорбция альфа герпесвирус клетка играть гликопротеин который связываться 
16575	 выделение вирус осуществлять микрометод культура клетка общепринятый методика 
16575	 чувствительность некоторый перевивать культура клетка вирус тезис доклад 
15531	 количество розеткообразующий спленоцит также претерпевать изменение устанавливать достоверный увеличение количество клетка 
16575	 использовать также перевивать культура клетка почка сибирский горный козерог 
15531	 для размножение клетка использовать среда игла мема 
16575	 вирус изолировать культура клетка метод 
16575	 весь вирус быть изолировать культура клетка 
16575	 культура клетка спэв оказываться слабочувствительный модель для 
16575	 однако результат разработка культуральный игва изготавливать при использование перевивать линия клетка 
16575	 высказывать выше опасение отношение возможный аллергический реакция введение потенциальный опасность контаминация вирус лейкоз птица мочь быть устранять при производство перевивать линия клетка удовлетворять требование воз 
15531	 поскольку иметь слабый связь внешний слой мембрана клетка счет гфия относительно 
16575	 инфекционный титр вирус определять после пассирование белый мышь при интрацеребральный подкожный инфицирование формирование негативный колония монослой культура клетка почка африканский зеленый мартышка 
16575	 инфекционный активность вирус определять чувствительный перевивать линия культура клетка почка теленок коронарный 
16575	 титрование лейкоцитарный сывороточный интерферон ифа проводить культура клетка отношение вирус 
15531	 классический метод диагностика вирус являться выделение вирус первичный культура клетка альвеолярный макрофаг получать 
15531	 белок синтезироваться клетка инфицированный вирус преобладающий 
16575	 для препаративный синтез рекомбинантный антиген использовать суспензионный или монослойный культура клетка также культура 
19864	 идеально регулировать водный жировой баланс обменный процесс клетка кожа 
15531	 лейкоцит кровь после индукция инфицированный клетка продуцировать ифна формула ифна формула 
15531	 как показывать данный исследование лейкоцит после такой контакт продуцировать ифна формула ифна формула формула фноформула что отражать по-видимому первичный реакция организм попадание инфекционный агент включение она основной клеточный популяция кровь моноцит клетка хелпер тип 
15531	 зеленый мартышка погибать день после заражение штамм куйбышев отмечать выражать экссудация острый прогрессировать процесс поражение двигательный височный кора головной мозг зрительный бугор красный ядро черный вещество клетка пуркинья зубчатый ядро ядро внутренний 
16575	 поскольку макрофаг обладать выраженный адгезивный способность стекло отличие другой клетка перитонеальный полость после первый 
15531	 показывать что вирус изолированный разный хозяин адаптироваться рецептор клетка хозяин 
16575	 березин леонтьев кондрашин лев влияние рибавирина репродукция буньявирус культура клетка эксперимент белый 
16575	 влияние рибавирина виразол репродукция некоторый аренавирус культура клетка вопра вирусол 
15764	 его сетчатка иметься четыре миллион светочувствительный клетка 
15531	 миша молдаванин завороженно смотреть летать клетка соратница слушать речь 
16575	 вглядываться она рассматривать смутный силуэт срубать дерево целиком вносить клетка грубый сук его 
19864	 костный мозг находиться мезенхимальный стволовый клетка который всегда приходить туда где 
19864	 сосуд исследователь высеивать клетка костный мозг образовывать тромбоцит 
19864	 мочь выращивать клетка костный мозг разрабатывать индивидуальный 
15531	 смех один прапор заводить слушать клетка замок запирать 
15531	 погодить погодить клетка они запихать это нехитро 
15531	 исследователь удаваться превращать фибробласт клетка соединительный ткань вырастать место 
16575	 подытоживать стволовый клетка эмбрион казаться настоящий протей они 
19864	 это позволять ученый разрабатывать принципиально новый метод обнаружение злокачественный клетка кровяной русло наличие который 
15531	 любой живой организм постепенно развиваться комочек один несколько клетка величина 
15531	 вирус инфицированный вирус активировать клетка производить белка способный прямо подавлять 
15531	 лабораторный исследование выявлять что вирус поражать незрелый клетка жировой ткань ускорять рост 
15531	 клетка потреблять вкусный глюкоза путь 
15531	 если окружающий среда содержать избыток химический соединение метить проникать клетка некоторый метильный группа усаживаться 
19864	 выходить неизменно ручка ученический тетрадка клетка 
15764	 может потому клетка возвращаться любить что 
15531	 белковый молекула входить состав клетка весь живой существо земля 
16575	 влиять межклеточный взаимодействие адаптоген обеспечивать возникновение облысеть опухолевый клетка посадочный площадка для лимфоцит 
15531	 этот специфический для каждый вид клетка программа работа определяться 
