28103	 она начерчивать мел стол круглый мишень взять шашечный фишка ловко 
28103	 она концевой сечение принимать заданный ориентация использовать уже описывать система оптический мишень следить датчик привод 
28103	 кто много все мишень поражать тот становиться победитель 
28103	 после большой застолье начинаться стрельба мишень 
28103	 как будто человек двигаться мишень кабан значит ничто 
35543	 исследоваться такой возможность связывание вирус клетка мишень вызывать высвобождение протеиназа фермент расщеплять 
28103	 один они древний распятие послужить мишень для стрельба 
28103	 автор этот работа облучать металлический мишень изготавливать ниобий или кобальт 
28103	 однажды выстрелять тир плюшевый медведь говорить кадик двигаться мишень 
28103	 удел быть служить мишень для скрытый издевательство попадать 
28103	 дурной вкус современный поэзия живопись музыка служить мишень для насмешка наивность нищета 
28103	 калачева наталья бутузов мишень цель 
28103	 когда идти атака наш батальон они косить пулемет как двигаться мишень 
28103	 почему они избирать мишень для свой пошлый шутка 
28103	 орантес учить играть бейсбол стрелять двигаться мишень подбрасывать воздух бутылка пикник 
28103	 когда мишень сниматься зритель показывать что стекло 
28103	 соблазнять живой мишень давать пристреливаться весь 
28103	 поляна ставить дощечка вид мишень шура стрелять браунинг 
28103	 если выстреливать мишень точечный импульс главенствовать процесс 
28103	 центр круг заветный цель оранжевый мишень диаметр 
28103	 животное они смотреть как живой мишень они создавать чтобы они убивать 
35543	 ядро бромистый фреон хороший мишень для нейтринный шрапнель они 
28103	 давление возникать при столкновение струя броневой плита настолько превышать напряжение необходимый для разрушение становиться что прочность мишень играть существенный роль 
28103	 тут подхватываться внешний магнит направляться мишень 
28103	 потеря частица путь кольцо синхротрон мишень превышать несколько десятитысячный доля 
28103	 технический оснащение эксперимент таков подытоживать рассказ устройство руководитель лаборатория нейтринный исследование доктор физико-математический наука мухин что каждый сотня ударять мишень протон получать для работа 
28103	 такой ровный начало предопределять обостренный характер борьба упражнение стрельба неподвижный подводный мишень 
28103	 открываться при бомбардировка листок мишень золотой фольга весь альфа-частица 
28103	 это увеличивать вероятность захват ядро мишень провзаимодействовать неторопливый частица много 
28103	 потому возникать составной ядро это более тяжелый изотоп тот элемент какой сделать мишень 
28103	 она становиться мишень для немецкий артиллерия немецкий 
28103	 возникать при это реактивный сила сжимать мишень 
35543	 вот уже весь мишень представлять себя сверхплотный горячий плазма 
28103	 чтоб зад твой над местность торчать служить мишень для враг один слово обладать 
35543	 разгар бой вражеский снаряд попадать локомотив крепость колесо превращаться неподвижный мишень 
28103	 человек приближаться цепь превращаться удобный подвижный мишень 
28103	 военный министр барон будберг быть зал его квадратный коричневый цвет лицо седоватый бобрик волос даже очки черепаховый оправа служить мишень для острота 
28103	 ведь такой пожилой женщина спрашивать нельзя чтоб она двигаться мишень первый выстрел без промах 
28103	 отличие подводный охота культивировать многий страна комплекс наш соревнование включать стрельба подводный ружье неподвижный мишень стрельба двигаться 
28103	 программа соревнование быть включать три упражнение стрельба малокалиберный пистолет стрельба подводный ружье неподвижный мишень подвижный цель рыба 
28103	 такой образ стрельба под вода неподвижный двигаться мишень следовать всемерно развивать 
28103	 увидеть что полосатый похожий мишень для стрельба 
28103	 допускать что раз выстреливать мишень раз попадать десятка 
28103	 там снег она прямо готовый мишень она слушать 
28103	 готовый мишень все здесь готовый 
28103	 если стрелок выполнять норма или вообще попадать мишень все равный оставлять 
28103	 делиться мишну повторение тосефт комментарий мишень два гемар завершение иерусалимский 
28103	 третий день команда стрелок лететь мишень отправляться первый тренировка 
28103	 двое спортсмен сеничев ссср россинить италия поражать все мишень 
28103	 поражать мишень набирать одиннадцать человек 
28103	 метательный машинка траншейный круглый площадка поставлять фирма нимрод мишень быть желтый цвет круглый 
28103	 этот метод элемент можно быть получать фермий год мишень сделать элемент можно 
28103	 год обстреливать мишень калифорния ион углерод 
28103	 этот раз трансурановый элемент получать линейный ускоритель метод тяжелый ион элемент при бомбардировка мишень плутоний ион кислород 
28103	 для добыча сто второй элемент мишень плутоний бомбардировать ядро 
28103	 вероятно известно что элемент быть получать при бомбардировка мишень плутоний ион неон 
28103	 другой метод основывать облучение близкий тяжелый трансурановый мишень заряжать частица 
28103	 сила электростатический отталкивание между ядро частица мишень одинаковый положительный заряд ядро заставлять 
28103	 это объясняться исключительный требование предъявлять мишень пучок тяжелый ион 
28103	 процесс рождение пи-мезон съедать львиный доля весь падать мишень ускоренный протон 
28103	 петр себейкин муж тут знать сниться будто значит еще армия лежать стрельбище мишень вот как ясно передо 
28103	 что происходить если вместо мишень чистый водород взять 
28103	 модельный опыт применяться мишень окисел разный элемент 
28103	 модельный опыт применяться мишень окисел разный элемент 
28103	 при работа плутониевый мишень когда вместо гафний лантаноид 
28103	 при ядерный синтез менделевий мишень служить золотой фольга который 
28103	 этот пучок направляться мишень ядро какой-либо атом 
28103	 мишень находиться двигаться никелевый лента транспортер 
28103	 весь процесс синтез адсорбционный удаление нелетучий хлорид транспорт мишень детектор продолжаться около 
35543	 существовать предположение что если удаваться накапливать достаточный количество калифорния использовать качество мишень при подземный ядерный взрыв удаваться 
28103	 они свистеть душный воздух попадать мишень они пролетать мимо как говориться 
28103	 гроб запоминать сутулый черный спина над мушка испуганный скашивать глаз вернуться дорогой сапог надоедать скин расстегнуть гимнастерка спокойно сказать наклонясь посмотреть как таинственно лист кружение этот долгий зима смочь проживать любить учиться стрелять живой синеглазый мишень потом тот кто быть 
28103	 часто все стрельба быть происходить рыба проплывать мимо поэтому стрелять приходиться некоторый упреждение как любой двигаться мишень 
28103	 метеорологический станция ледяной остров дрейфовать несколько год район полюс недаром именоваться тарджет мишень 
28103	 легко видеть что условие наш задача ширина мишень при прохождение ворота хороший 
28103	 посмотреть теперь как большой ширина мишень для центр двигаться шар при 
28103	 значит ширина мишень этот случай как видно 
28103	 ворона быть наш излюбить мишень они немало полегать окно 
28103	 крайний мишень выбрасывать сопло мощный огненный 
28103	 так время практический стрельба ход двигаться мишень помещать между два броненосец промежуток 
28103	 вовсе надо принадлежать число лвые пошляк для который дарданеллы служить мишень утвержден ганфман юбилейный сборник 
28103	 гололобов становиться шарить карман кривоносовский шинель попадать туда куда надо соображать что выскочить фонарь крыльцо это значить изображать себя нечто вроде светиться мишень бродяга берданка бродяга 
35543	 серафима павловна быть шаг сорок яркий краска представлять себя соблазнительный мишень 
28103	 гершуни быть чрезвычайно огорчать что фон валя отделываться так дешево что боевой организация случайно потерять такой заслуживать кара мишень 
28103	 она без конец разбирать собирать винтовка автомат пистолет вместе другой знать стрелковый дело ежедневно учиться стрелять мишень 
28103	 чтобы ловко маршировать лихо делать фронт проворно действовать пулемет двигаться мишень метко стрелять винтовка надо 
28103	 выводить они снежный поле там начинать учить стрельба двигаться мишень рассыпать цепь гонять перебежка 
28103	 богачев жестокий стрелять тоже живой человек двигаться мишень как учить еще 
35543	 чувствовать себя мишень который весь сторона 
28103	 все направляться северо-запад направление русалочий остров направление мишень 
28103	 светлый день море блистать громить пушечный пулеметный огонь как учебный мишень 
28103	 летчик ловить перекрестие прицел наземный мишень старый отслуживать свой срок самолет 
28103	 предстоять опыт новый бомба нужно находить подходящий мишень 
28103	 это все мишень для наш артиллерия авиация 
28103	 обер комендант приказывать докладывать неприятель открывать пальба егорьевский церковь равный манер мишень супротив орский ворота 
28103	 мишень казаться двести шаг так 
28103	 наиболее ненавистный имя исчезать сцена уже мочь служить мишень для думский нападение 
28103	 каждый день разыгрывать двигаться мишень глаз немецкий летчик 
28103	 наш винтовка быть труба который посмотреть мишень увидешь так близко как будто 
28103	 пока еще видеть мишень глядеть мушка глядеть 
28103	 вдруг виктор сунуться карман доставать оттуда слагать мишень оборвать четвертушка 
28103	 поэтому чтобы поражать мишень приходиться предварительно сделать несколько выстрел 
28103	 поэтому бомба сбрасывать борт тот момент когда мишень который надо быть попадать 
35543	 тесно сгрудиться повозка представлять прекрасный мишень для аэробомба 
28103	 летчик нацеливаться мишень весь свой самолет подходить 
28103	 лидинька хотеться побежать сам это запрещаться инструктор медленно идти мишень браво лидок самый сердцевина 
28103	 сема сводить она крайком комсомол она выдавать удостоверение что она инструктор стрелковый спорт через час она уже бегать город доставать ружье мишень патрон смазочный масло 
28103	 получаться нечто вроде тот черный спираль картонный круг который безумный стремление обращаться мишень бесконечно вращаться витрина берлинский 
28103	 иногда после слабенький отрывистый выстрел слышаться звон разбитый бутылка или начинать шуметь механизм двигаться мишень 
28103	 стрлковой часть программа упражнень первый два винтовка нужно выбивать мена очковь метр мишень или лит 
28103	 третий основной упражнен стрльба боевой винтовка метр мишень десяток 
28103	 фон грудной мишень попадан который присчитываться 
28103	 миноносец буйный весь поход служить мишень для издевательство адмирал рожественский 
28103	 кстати урал громадный судно мочь служить хороший мишень для стрельба 
28103	 когда подходить чуть оживать вести глаз словно целиться двигаться мишень хрипло выстреливать паж паж 
28103	 она сидеть неподвижно как мишень отлично видеть она 
28103	 футроз позвонить приказывать слуга приносить мишень также малокалиберный винтовка пуля 
28103	 она передавать оружие роэн все отправляться смотреть мишень 
28103	 показывать знать показывать как уметь что вовсе намерен служить мишень для его 
28103	 подле глубокий ров нижний сад писать свиньин показывать еще столетний ясень служить мишень для император александр когда 
28103	 борьба этот иллюзорность сей пора наука мишень давид метать галиаф суеверие 
28103	 остряк избирать мишень для свой стрела 
28103	 штааль быстро прицеливаться выстреливать мишень 
28103	 словом этот чувство радость прицел полет пуля мишень 
35543	 спектроскопический диагностика плазма лазерный эрозия поликристаллический мишень соединение 
28103	 анализ находить земля остаток мишень показывать что 
28103	 время соревнование российский спортсмен приходиться выполнять следующий минимальный норматив проехать лыжа общий сложность они малокалиберный карабин спина пробежать конек раз выстреливать мишень положение стоя еще 
28103	 его теория мишень быть подхватывать институт англия 
28103	 мешок песок лежать среди они солдат мишень вид фриц каска 
28103	 заведующий опираться спина стойка глядеть зеркальце шлепать мишень воздушный ружье пуля 
28103	 жалко другой мишень давать нудить 
28103	 рука московский привычка готовый прислонять мишень валидатор капитонов знать как называться 
28103	 для они мишень они никто объяснять что 
28103	 так вот немецкий мишень считывать восемьдесят процент такой выстрел 
28103	 чтобы поражать пять мишень пятиборец быть неограниченный количество 
28103	 афины мочь завоевывать еще один золото последний выстрел умудряться поражать чужой мишень 
28103	 дело что рибосома это мишень воздействие для большой число антибиотик 
28103	 давать быть желать чтобы отсыхать рука тот нелюсти злорадно прицеливаться нажимать курок при вид живой двигаться рыжий мишень 
28103	 перевод обычный язык это означать что чудов посылать пуля центр мишень сектор соответствовать шестичасовой 
28103	 перевод обычный язык это означать что чудов посылать пуля центр мишень сектор соответствовать шестичасовой 
28103	 мишень черносотенец становиться часто все мирный 
35543	 мишень для киллер быть выбирать доминиканский 
28103	 выбираться из-под одеяло подходить мишень календарь подбирать дротик 
28103	 смеяться дружно если кто-то удаваться кто-то попадать несколько человек выбирать мишень надя становиться бросать проворный 
28103	 пучок литий взаимодействовать мишень бериллий вызывать ядерный реакция 
28103	 неясный вероятность слияние столь массивный ядро ядро мишень вести образование новый элемент 
28103	 пистолет ковыль предупредительный снимать предохранитель сжинать челюсть готовый быть отправлять ворох пуля любой мишень 
28103	 наш взвод быть так если боец автомат мочь попадать мишень или полоса препятствие вместо 
28103	 еще один плюс объемный мишень достаточно длинный пулевой канал 
28103	 вместе перечень сложность задача возлагать воздушный мишень мишенный комплекс постоянно возрастать 
28103	 успевать курок нажимать боец уже мишень повалить ближний дальний 
28103	 для перемещение мишень средний точка попадание вправо-влево необходимо 
28103	 ощущение объединение мишень знакомый многий хороший стрелок 
28103	 фронтовой вариант мишень оказываться военный комиссарский камарилья 
28103	 они подымать мишень выводить они трасса 
28103	 они подымать мишень выводить они трасса 
28103	 быть множество стрела готовый лететь мишень 
28103	 мишень быть игральный карта который 
28103	 зебра бамбуковый лесенка тарелка похожий мишень тир 
28103	 концентрация клетка мишень составлять тыс лугнка 
