28103	 полигон цель ознакомление новый зенитный ракетный средство приезжать высокий руководство страна быть проводить пуск ракета сбивать мишень затем около завершать испытание 
28103	 течение входить состав противоракет стандарт быть выполнять три успешный перехват баллистический ракета тот число один ракета мишень быть перехватывать участок она 
28103	 поскольку качество свой мишень основный оппонент мальцев выбирать 
28103	 когда мишень один сплошной десяток надо целиться 
28103	 его процесс планироваться осуществлять перехват над тихий океан баллистический ракета мишень стартовать остров кауаи 
28103	 нужно быть находить новый мишень удар который приводить 
35543	 наружный поверхность орбитальный отсек быть сооружать стыковочный мишень позволять экипаж аполлон судить 
28103	 марта советский экспериментальный комплекс про система впервые мир осуществлять перехват поражать головной часть баллистический ракета мишень 
28103	 действие гормон строго специфичный только определенный клетка мишень или группа 
28103	 спустя некоторый время подаваться команда набор высота ракета наводиться беспилотный самолет мишень 
28103	 тот время летчик приказ применение бортовый вооружение вертолет только разрешение командование вызывать однозначный реакция полет воздушный мишень 
35543	 качество мишень для идентификация использовать видоспецифичный участок 
35543	 качество клетка мишень использовать фибробласт мышь линия 
28103	 тот кто быстро поражать свой мишень выходить победитель данный раунд 
28103	 при освобождение базовый адамантан процесс биодеструкция полимерный препарат сохраняться вероятность последующий взаимодействие специфический мишень ионный канал белка 
35543	 удерживать рука защищаться противник представлять хороший мишень для атака поскольку корпус 
28103	 один пуля миновать нужный мишень угождать буренка мирно 
28103	 мелкашка метр обычный круглый мишень 
28103	 первый появляться пулеметный расчет пятнадцать секунда затем два раз грудной мишень выскакивать 
28103	 общий пока они такой образ это дело решать дружно открывать огонь мишень конечно потом долго смеяться вспоминать 
35543	 потому что многий военный объект представлять мишень для террорист 
35543	 артиллерийский система стоять впереди лагерный передний линейка выстраиваться ряд крайний мера десяток километр представлять себя доступный мишень 
28103	 недовольно фырчать лошадь изящный брызги жижа хлябь смачный разрыв пуля тыква мишень немногословный дакаскос вертушка 
28103	 однако соответствие новый политика официальный источник быть сообщать меньший объем сведение ракета мишень предназначать для перехват также 
28103	 разрабатывать фирма кентрон юар зенитный ракета умхонто вертикальный старт совершать успешный перехват ракета мишень 
28103	 состоять наземный командный вычислительный измерительный пункт подмосковье специальный стартовый площадка полигон байконур ракета носитель космический аппарат перехватчик радиолокационный тепловой головка самонаведение осколочный боевой часть также спутник мишень для комплекс пко иса 
28103	 август целеуказание комплекс пко иса теплова впервые мир поражать защищать космический аппарат мишень 
28103	 оба такой изделие быть поражать первый наш ракета причем подрыв боевой часть вызывать детонация боевой снаряжение мишень 
35543	 различие рецептор использовать тропный тропный изолят вич определять различие клеточный тропизм механизм проникновение вирус клетка мишень для проникновение вирус клетка 
28103	 позиция где размещаться пусковой установка мишень фаланга познакомиться 
28103	 второй неделя они быть совершать дикий пеший вылазка спускаться пещера учиться выживать дикий природа водить джип бездорожье стрелять мишень совершенствоваться верховый езда 
28103	 однажды смотреть как взрослый лучник безуспешно стрелять мишень 
28103	 приходить стрелять пистолет рука дрожать мишень раз попадать 
28103	 управлять лазерный луч ракета бронебойный подкалиберный снаряд они поражать весь бронировать цель мишень 
28103	 челябинский станкомаш представлять несколько вариант ракетный мишень предназначать для обучение личный состав 
28103	 дегтярева быть представлять мишень фаланга для подготовка боевой 
35543	 даже рисковать впадать некий донкихотство становиться мишень усмешка сторона друг 
28103	 гонка даже замечать что стрелять чужой мишень 
35543	 александра сознательно выбирать для первый удар самый крупный мишень 
28103	 тот момент когда взлетать тот роковой ракета воздух быть только один ракета мишень рейс 
28103	 она выходить оптимальный высота чтобы достигать тот дальность который она четко видеть назначать она мишень 
28103	 российский время стрельба свой полигон тоже довольно часто страдать из-за перелет часть ракета мишень территория казахстан 
35543	 каждый кустик стоять середина аккуратно вычерчивать мишень 
35543	 каждый кустик стоять середина аккуратно вычерчивать мишень 
28103	 поэтому при стрельба навскидку заряд ложиться высоко левее мишень 
28103	 так что создание сверхзвуковой ракета мишень база отслуживать свой срок 
28103	 существующий мишенный комплекс российский федерация значительный место занимать ракета мишень создавать именно база 
28103	 рамка реализация этот задача быть разрабатывать внедрять эксплуатация наземный средство предстартовый подготовка запуск ракета мишень вид передвижной наземный комплекс 
28103	 избирать несчастный мишень вгонять пулеметный лента истребительский 
28103	 что такой боевой стрельба всего лишь несколько минута предел уплотненный время сначала пуск полигон ракета мишень обнаружение 
28103	 еще один полигонный словцо точка точка называть место запуск ракета мишень они характеризоваться удаленность азимут 
28103	 период подготовка выполнение стрельба прибывать часть иногда возлагаться свой род барщина завозить ракета мишень точка 
28103	 занимать свой место кабина управление докладывать готовность впиваться глаз оранжевый экран район предполагать старт ракета мишень 
28103	 первый стрелять дивизион двадцать пятый зенитный ракетный бригада полуостров рыбачий почти сосед тоже пятый армия быть старт первый мишень докладывать волков 
28103	 мишень первый интрига избирать неаполитанский посол 
35543	 реестр быть удручающий длинный создаваться впечатление что житель петербург добывать себя пропитание исключительно охота досуг вызывать друг друг барьер или лупить мишень 
28103	 очень скоро обнаруживать что состояние стрелять живой мишень тут начинать слезиться глаз 
28103	 ракета быть запускать два цель мишень удаление около 
28103	 ход испытание зур перехватывать мишень имитировать противокорабельный ракета малый дальность 
28103	 прямолинейный как винтовка заряжать письмо прицеливаться адрес заряд обязанный попадать цель потому что стрелять неплохо если изменяться положение мишень писать 
35543	 поведение слегка удивлять марат как удивлять что хозяин синий пиджак оставаться сидеть стол спина вход представлять себя великолепный мишень 
28103	 апрель год ракета мишень стриж запускать российский 
28103	 стрельба двигаться мишень двигаться транспорт 
35543	 восьмерка семерка особенность шестерка вот тот место мишень где находить себя пристанище маленький 
28103	 если простой следующий год вводиться новый зачет стрельба двигаться мишень бежать кабан 
28103	 охотник один все мишень все один 
28103	 связываться рецептор поверхность клетка цитокин инициировать реакция клетка мишень или клетка медиатор что вернее 
28103	 несколько свой мишень они обнаруживать парная 
28103	 грянуть выстрел поражать мишень разлетаться осколок второй 
28103	 перед они качество живой мишень стоить соотечественник собрат соплеменник 
28103	 сначала очень долго искренне хвалить свой мишень рассказывать добрый качество 
28103	 этот избитый человек одетый разрывать кровавый рубаха как хусейн стараться узнавать свой мишень 
28103	 командир приказывать устанавливать мишень расстояние один километр 
35543	 начинать май год последний день пребывание грачев должность лето фигура министр оборона быть излюбленный мишень большой группа журналист представлять издание 
35543	 проникать наделать фигушки ребята мишень самый время обгонять юрин 
28103	 подбирать свой мишень пристально она уставляться 
35543	 оба камуфляжник представлять себя вполне доступный мишень для прямой удар нога 
28103	 диктатор одержимый мания стрельба живой мишень 
28103	 год ракета болд орион запущенный борт средний бомбардировщик быть посылать навстречу спутник мишень 
28103	 слово отечественный спутник мишень боевой расчет работать так 
35543	 пора заворачиваться становиться хороший мишень подумать 
28103	 вот девочка вылезать трибуна стрелять мишень троцкий зиновьев который 
28103	 первый мишень неизвестный террорист попадать начальник служба 
28103	 дополнение счет официантка свет потребовать еще двадцать пять тысяча что ваня вставать из-за стол устремляться круг дартс начинать довольно умело посылать дротик мишень 
35543	 теперь они лишь хороший мишень для ракета 
28103	 год ракета болд орион запущенный борт средний бомбардировщик быть посылать навстречу спутник мишень 
28103	 сентябрь год ракета срэм альтаир поражать космос спутник мишень 
28103	 осколочный боевой часть боевой снаряжение разнести кусок мишень 
28103	 отечественный спутник мишень боевой расчет работать такой 
28103	 при попадание дротик мишень волокно раздвигаться при вытаскивание 
28103	 при попадание дротик мишень волокно раздвигаться при вытаскивание 
28103	 видеть она работать ощупь ошибка огорчаться упорно гасить мишень пить поощрительный сок 
35543	 этот свойство поллинологический маска являться главный мишень художник рекламировать антиаллергический препарат 
35543	 сам старый чудак представлять себя великолепный мишень для насмешка воспользоваться этот 
28103	 виктор иванович долго тогда смотреть мишень 
28103	 должный быть стоять как живой мишень ждать когда они признавать 
28103	 стискивать зуб шагать вперед оступаться перекатываться под сапог каменно пересыхать комочек земля правый рука сжимать скользкий пот наган придерживать левый бить нога бесполезный шашка рука рука спотыкаться мучительно замедлять шаг идти подпоручик веткин маленький коротконогий плотный похожий весь фигура поясной мишень огромный распушаться 
35543	 студенческий год первый курсы особенно быть удобный мишень для такой его стрела 
35543	 из-за скученность человек техника небольшой участок узкий дорога колонна дивизия представлять себя очень удобный мишень для нападение противник 
35543	 вот теперь представлять мост возноситься высоко над мета прямо-таки лететь над она какой удобный мишень для террорист 
28103	 ушанка ярко рыжий поддельный мех наводить тревожный мысль что предназначать совместительство роль двигаться мишень 
28103	 мишень отделять около пятьдесят метр 
28103	 поводить урок военный дело пустырь школа где поставлять вместо мишень портрет разный там предатель 
28103	 там вместо мишень портрет враг народ 
28103	 назначение охотничий для стрельба рыба целевой для стрельба подводный мишень 
35543	 этот регуляторный механизм вполне мочь становиться мишень противовирусный терапия 
28103	 два три раз неделя время контрольный пуск ракета ездить мишень район кол снимать место 
28103	 колорадо например любой мишень молния город касл рок где 
28103	 прилаживать дерево мишень чтобы показывать как стрелять настоящий 
28103	 хорошо знать путь какой предпочитать ходить транспорт ждать когда появляться мишень настойчиво искать она 
28103	 слать сигнал целиться небесный мишень атмосфера никогда бывать ангельски 
28103	 становиться стрелять мишень изготавливать доска кусок 
28103	 представляться редкий случай стрелять как обычно закрытый цель открытый вид все мишень двигаться небо 
35543	 аня сказать что верить наговор хорошо выбирать другой мишень чтобы душа быть весело 
35543	 поход пехотный дивизия свой серо-голубой авиационный форма постоянно чувствовать себя хороший мишень который контрастно выделяться общий 
35543	 выбивать мишень ион композиционный быть соответствовать исходный 
28103	 внешний мишень медный стержень диаметр 
28103	 протон ударять мишень при столкновение ядро 
35543	 недостаток очевидный теряться главный преимущество нападать внезапность транспорт часто превращаться мишень для артиллерист 
28103	 тот время заседание судейский коллегия обсуждаться вопрос проведение упражнение стрельба подводный мишень 
28103	 частица лететь ядро как пуля мишень 
28103	 мишень выполнять вид трубка можно 
28103	 процесс сжатие вещество происходить из-за реактивный сила появляться при испарение плазма разогревать поверхность мишень 
28103	 например считать что изобретение ракета авиация окончательно терять значение что подводный лодка полностью заменять наземный корабль поскольку последний плавучий мишень для ракета 
28103	 запоминать больше как сам стрелять как окоп специальный сидеть команда мишень высовывать для другой 
28103	 пуля мишень щелкать над окоп посвистывать 
28103	 третий разрабатывать устройство минерал синтезироваться при ударный взаимодействие флюидный струя мишень затравка моделироваться взрыв флюидный включение 
28103	 казаться ничего нет просто сбивать такой повисать воздух мишень 
28103	 снимать это означать останавливать машина дорога делать она мишень для немецкий пушка 
28103	 более агрессивный мишень если они обнаруживать охотник 
35543	 окрестный земледелец проникать мишень плакат фудзи быть 
35543	 шесть миллион миллиард протон быть посылать мишень 
28103	 если обстреливать мишень сделать какой-либо тяжелый элемент 
28103	 пока тайный гордость подсчитывать пробоина свой мишень испытатель перезаряжать карабин продолжать 
28103	 олимпийский игра являться знаменательный событие для стрелок лететь мишень впервые программа олимпиада кроме 
28103	 сеничев выходить победитель сделать мишень один промах 
28103	 если так поступать мишень эйнштейний первый опыт 
35543	 знать что берлин бомбить след разрушение быть видно гигантский город слишком обширный мишень возможно везти неповрежденный 
35543	 самый крупный военный завод находиться предел город союзник они бомбить тот мишень 
28103	 располагаться чуть поодаль тротуар пустырь похожий кукольный театр из-за свой ярко освещать раскрашивать мишень 
28103	 вера посмотреть мишень казаться что там метр 
28103	 если условие опыт меняться замена мишень или частица изменение энергия ион 
28103	 очень быстрый частица либо ускоритель либо космический происхождение ударять ядро атом мишень 
28103	 петр себейкин муж мишень вот она карабин порядок 
