28103	 наиболее перспективный метод связанный облучение различный мишень пучок ускоренный сложный ядро тяжелый 
28103	 получать мезон при торможение мишень протон ускоритель 
35543	 теперь представлять себя что пруд это водородный мишень вместо кувшинка пруд плавать 
28103	 плутониевый мишень подвергаться течение длительный время 
28103	 атом элемент получаться при взаимодействие ускоренный ион неон мишень плутоний 
28103	 учиться стрелять живой синеглазый мишень как питерский шлюха учиться 
28103	 она спрашивать что такой живой синеглазый мишень как можно бояться пристальный взгляд 
28103	 ширина мишень при нацеливание столбик равный 
28103	 девяносто восемь укладывать мишень над машина гипроливать трудиться 
28103	 картина служить мишень для стрельба маузер 
28103	 товарищ генерал штурман эскадрилья управлять мишень лейтенант филин прибывать ваш 
28103	 надо постараться уклоняться ракета совершать посадка мишень 
28103	 однажды стрельба сильно разбрасывать мишень пуля 
28103	 они мальчик называть мишень вот брат 
35543	 автор начало конец заранее знать конечно что вермандуа легко мочь становиться мишень для нападки насмешка 
28103	 мишень или даже центр для свой 
35543	 отсвечивать лысина минор представлять себя привлекательный мишень для коротать время солдат 
35543	 хороший мишень чем белый фуражка сыскать 
28103	 там рубеж лесостепь подниматься начальный сооружение древнерусский фортификация набивать земля обшивать лафетный тесница терраса из-за который так удобно целиться осатанелый гарцевать конь мишень затекший смола надолба ров 
28103	 второй мишень боевой организация поставлять палач полтавский 
35543	 сигнальный огонь зажигать мачта капер для ориентирование шлюпка парламентер послужить нападать хороший мишень 
28103	 другой отвечать оставаться только мишень русалочий риф 
28103	 другой отвечать оставаться только мишень русалочий риф 
28103	 спокойно будто стрелять мишень альберт вениаминович укладывать все трое 
28103	 смотреть наземь мишень следить опыт 
28103	 наскакивать обер комендант губернатор глядеть глядеть они из-за мишень бить почему 
28103	 почему мишень сей пора срыть 
28103	 офицерский мишень круг черный центр 
28103	 после это летчик направлять самолет точно мишень вести так чтобы 
28103	 бугор сходиться атака хитро окружать обходить противник стрелять мишень дробовица казак молодой охотно 
35543	 белый простор дон лошадь седок становиться прекрасный мишень 
28103	 часть свой войско некоторый случай также изображаться мишень или опознавательный сигнал 
28103	 снова выстреливать мишень казаться нетронутый лидинька хотеться побежать 
28103	 вдруг оттуда прямо как учебный мишень открывать пулеметный ружейный огонь 
28103	 жадный восхищение рассматривать висеть над прилавок пистолет ветвистый подставка для стрельба упор заводной игрушка мишень который один нравиться мальчик 
28103	 приходиться изготовлять мишень ручной кустарный способ 
28103	 для малокалиберный винтовка тирова класс сдаваться метр мишень или пятерка 
28103	 это испытани сумма два нужно выбивать мена очки метр мишень черный яблоко 
35543	 эскадра частично смешаться скучиваться представлять себя грандиозный мишень 
28103	 когда пять выпускать пуля махальщик показывать три попадание головной мишень четыреста шаг лицо 
35543	 перманентный благоразумие немецкий социал-демократия действительно являть себя удобный мишень для насмешка обличение 
35543	 так сидеть представлять себя великолепный мишень 
28103	 роман опускаться один колено прикладываться задерживать дыхание ловить прорезь мушка темный пятно мишень 
28103	 вскричать рой первый подбегать мишень оборотиться давенант схватывать 
28103	 стрелять как подвижный мишень тяжелый раскатистый залп 
28103	 опять ранний стрельба мишень общий удовлетворительно 
35543	 затем все толпа перегонять друг друг бросаться мишень наперебой тыкать палец 
28103	 вместо мишень гвоздик прикреплять находить 
35543	 представлять результат исследование излучение лазерный плазма формировать вакуум при действие поликристаллический мишень лазерный излучение 
35543	 излучение анализироваться диапазон длина волна пространственный область удалять мишень 
35543	 тогда украинский военный начальство посчитать что украина так много военный база склад взрывоопасный тонкий место включая чернобыль что она мочь становиться легкий мишень для террорист 
28103	 спутник иса официально называться космос сближаться спутник мишень космос взрываться поражать 
28103	 ноябрь год спутник космос успешно поражать спутник мишень космос 
28103	 показывать талант который служить мишень 
28103	 так хороший стрелок лежать огневой рубеж видеть мишень чувствовать попадать 
35543	 посоветовать сабо чтобы она другой раз хорошо выбирать мишень 
28103	 это серьезный вызов для наука который искать только новый мишень новый способ влияние 
28103	 хотеть перезаряжать бок закалывать стрелок удаляться почивать последний поделка сулейман василий тот день служить мишень пока измочаливаться неузнаваемость 
28103	 дело двигаться мишень расхвастаться шутка 
35543	 знать старик кирилл процитировать фил нет ничто сладкий ветер странствие перемещаться место место следовать хотя для чтобы превращаться мишень кажется очень понравиться 
28103	 состав мишень входить изотоп литий реакция 
28103	 его сотрудник направлять пучок ускоренный протон мишень 
28103	 дело что протон который ударять мишень церн лететь постоянный 
28103	 мнение чемпион мир андрей моисеев первенство олимпийский все мишень работать без нарекание 
28103	 мой хеннелор использовать традиционный метаматериалы стоить подлетать живой мишень слишком близко 
28103	 значит просто двигаться мишень еще увесистый гиря 
35543	 самый привлекательный мишень для фармаколог быть оставаться 
28103	 после неудача ренин фармаколог заниматься поиск другой молекулярный мишень 
35543	 пожилой немного вон они лавка ласкать собака румяный придурковатый мишень для насмешка 
28103	 вроде тренировка живой мишень слабый предъявлять 
28103	 белок антиген который служить мишень для моноклональный антитело иметься 
28103	 фигура уполномоченный земгор земгусар оборотистый молодец форма военный образец служить мишень для насмешка публика фельетонист 
28103	 при подлет ядро мишень первый казаться должный вступать 
35543	 этот изотоп вид газ быть использовать качество материал мишень 
28103	 хороший стрелка пытаться поражать этот мишень сей пора этот 
28103	 мой бедный отец постоянно служить мишень семейный остроумие 
28103	 главный вид спорт для борзой бег преследование двигаться мишень механический заяц 
28103	 наконец разогнаться пучок попадать мишень атом другой элемент обычно 
28103	 образовываться реакция плутоний ион кальций изотоп элемент масса вылетать мишень останавливаться камера заполнять 
35543	 первый литограф изготавливать сша для получение излучение длина волна использоваться лазерный разогрев мишень 
28103	 нужный для подсветка нейтрон производиться счет фрагментация ядро мишень при облучение 
28103	 большинство уверенно поражать мишень затрачивать это всего 
28103	 дверь забывать паника красоваться пестрый мишень утыкивать дротик 
28103	 проблема двигаться мишень при отработка действие засада 
35543	 бтр зайти между дом становиться хороший мишень 
35543	 здесь низко малый скорость лететь машина становиться хороший мишень 
28103	 именно такой мишень успешно срабатывать например боевой расчет 
28103	 наш планета подобный двигаться мишень под обстрел множество астероид 
28103	 было уже поверять непричастность жрец весь здешний проблема как вдруг замечать замечать что положенный время покорно пристраиваться очередь укол его обнажать для доступ антибиотик ягодица подобно стрелковый мишень изрешечивать специфический оспинка 
28103	 когда это происходить цель процесс являться равновесие некий двигаться мишень там 
28103	 для они запускать два мишень тип стриж 
35543	 качество мишень для видовой идентификация быть выбирать 
35543	 качество мишень для быть выбирать именно 
35543	 спленоцит получать иммунизировать мышь вносить клетка мишень соотношение 
28103	 отношение эффекторный клетка клетка мишень составлять 
28103	 вставлять ствол винтовка трубка холодный пристрелка пулемет наводить перекрестие трубка точка обозначать мишень 
28103	 некоторый случай ядро мишень вылетать ион энергия 
28103	 инфекционный титр иды определять культуральный среда заражать кратный разведение вирус фрагмент хао планшет без адамантансодержащий комплексный препарат или присутствие концентрация при эквимолярный концентрация ремантадин при который ремантадин действовать только основной мишень ионный канал белок 
28103	 теоретически можно предполагать что отличие базовый адамантан адамантансодержащий полимерный препарат иметь более широкий спектр вирусспецифический мишень счет общий увеличение сайт 
28103	 стрелять десять патрон короткий очередь три мишень 
28103	 самый удивительный что даже отстреливаться отлично повалить грудной мишень пулеметный расчет 
28103	 так сей пора знать что надо делать такой ситуация стрелять мишень или защищаться газ 
28103	 вбивать свой пуля центр мишень как гвоздь похлопать фогель 
28103	 только потому что второй огневой рубеж расстреливать чужой мишень 
28103	 для реализация указанный задача состав мишенный комплекс иметься баллистический мишень известный под название кабан 
28103	 кроме она быть представлять мишень ракетный 
28103	 кроме мишень станкомаш производить эффективный авиационный неуправляемый 
28103	 кто-то опасаться раз электричество включать служить мишень естественно хотеться 
28103	 радиоактивный метка служить бихромат натрий мкка рабочий концентрация клетка мишень составлять реакция провожать 
28103	 клетка эффектор добавлять равный объем клетка мишень 
28103	 тир парк горький украсть все мишень 
28103	 хотя сам сей пора находить объяснение почему всегда так точно поражать мишень 
28103	 знать стрелять чужой мишень отвечать 
28103	 или просто любить стрелять двигаться мишень 
28103	 спустя еще полчаса выясняться что как раз четверг украинский корабль самолет проводить стрельба мишень тип рейс беспилотный самолет разведчик 
28103	 цель быть захватить дальность пуск производить когда мишень оставаться только 
28103	 если попадать первый выстрел далеко стрелять иметь смысл рывок затвор отвлекать внимание мишень находить второй раз 
28103	 неясно кто становиться мишень это иметь особый 
28103	 просто последний огневой рубеж форсберг расстреливать чужой мишень что она наказывать 
35543	 открытый голова шея хороший мишень для снайпер 
28103	 мишень распылять соединение вид керамический 
35543	 вот этот ракета быть предлагать использовать качество мишень благо ресурс двигатель исчерпывать 
28103	 однако роман известный мальколм брэдбери профессор криминал описывать британский оригинал описание являть весь тот особенность букер который ежегодно служить мишень для российский пресса литература как 
28103	 они характеризоваться удаленность азимут пуск мишень 
28103	 докладывать волков быть старт второй мишень через некоторый время 
28103	 замысел ясный центр мишень поставлять хрущев 
28103	 малоразмерный мишень быть поражать первый 
28103	 поскольку мишень при паротитный инфекция являться 
28103	 прицеливаться центр воображать мишень нажимать курок 
28103	 апрель год малый ракетный корабль муссон быть поражать учебный ракета мишень атака который должный быть 
28103	 говорить что следующий год зачет быть уже два мишень 
28103	 вместо один статический круглый мишень быть выстреливать еще один динамический 
28103	 так называться двигаться мишень вид кабан натуральный 
28103	 мишень двигаться влево вправо появляться 
28103	 может просто очередной мишень бежать кабан который быть 
28103	 быть мишень бежать кабан человек 
35543	 показывать что рецептор являться корецептор для штамм вич тропный макрофаг образовывать синцитий рецептор являться корецептор ответственный успешный проникновение лимфотропный штамм вич клетка мишень 
28103	 зайти городской парк тир поражать все мишень 
28103	 опять пойти тир опять поражать все мишень давать приз плюшевый медвежонок 
28103	 быть еще масса человек плохо накормить плохо обмундировывать плохо воспитывать они исповедовать идеал жизнь браток гражданка брать себя пример герой крутой боевик телевизор который день ночь выплескивать казарма матросский кубрик тонна человеческий кровь оглушать восхищенный пацан погон отменный стрельба живой мишень 
28103	 кричать мышкин потрясать воздух размочаливать мишень 
28103	 экран мочь проецироваться слайд любой мишень или например изображение противник 
28103	 зря они когда поссориться стараться глядеть один тот вещь зато получать мишень бить она последний 
28103	 нравиться торчать тупой вид живой мишень предпочитать залегать 
28103	 начало война отвечать вопрос какой воинский специальность призадумываться отвечать двигаться мишень 
28103	 это делать ускоритель тяжелый ион разгонять ион неон направлять тонкий мишень ядро формула результат 
28103	 избирать легкий мишень целиться особо надо 
28103	 это как двигаться мишень целиться надо мгновенно главное 
28103	 сталкиваться один ядро мишень протон расщеплять ядро 
28103	 они хотя быть уговор один день один акция рефлекторный двигаться мишень 
28103	 чертить деревянный забор мишень кидать самодельный дротик 
28103	 сергей кончик поставлять вполоборота мишень попросить отходить она 
28103	 если уставать глаз сразу подходить мишень все порядок 
28103	 правда ученый рано вызывать особый симпатия его занятие служить мишень обывательский зубоскальство 
28103	 виктор иванович они поправлять мишень так 
28103	 валентин однажды слышать как усаживаться гость кто-то сказать двигаться мишень двигаться валентин рассказывать племянник 
28103	 сейчас виктор иванович подходить мишень 
28103	 возникать ощущение что ехать картина петрушка вот она впереди маячить мишень 
28103	 если мочь попадать мишень расстояние пятнадцать тысяча 
28103	 дело что новый мишень секс символ 
28103	 два мишень каин дайна сор 
35543	 весь масть величина глупый свой безмятежность этот вечерний час они представлять себя великолепный мишень 
28103	 ведь это живой мишень товарищ 
28103	 всякий попытка посягать свобода слово свобода печать становиться наш общий проблема независимо кто служить мишень конкретный случай нтв попцов 
28103	 без голова картонный мишень рука болтаться 
28103	 когда спрашивать какой воинский специальность циркач отвечать двигаться мишень 
28103	 полный мера двигаться мишень оказываться саша 
28103	 быть класс второй место плевок мочь любой этаж попадать центр двигаться мишень 
