35543	 колючий друг или препод быть мишень это 
28103	 стрельба умолкать пока ждать когда подниматься мишень 
28103	 бывать еще ночной стрельба когда мрак делать расстрел мишень похожий охота 
35543	 что борис сожаление уязвимый для критика представлять себя хороший мишень тоже факт 
28103	 шмальнуть шпалера который для стрельба мишень годиться никак для 
28103	 они пригодный для сверхточный стрельба мишень для охота мелкий 
28103	 владимир слизаев уже становиться мишень наемный убийца 
35543	 она рекомендовать правительство государство член допускать преподавание креационизм как наука главный мишень современный креационист являться образование 
28103	 вчера быть стрельба даже мочь представлять себя как вытягиваться лицо наш коммод изумление когда пять выпускать пуля махальщик показывать три попадание головной мишень четыреста шаг 
28103	 почему пуля улетать прошлое или будущее дырявый голова несчастный мишень 
28103	 главный прицел естественно шведский мишень олимпийский ванкувер 
35543	 сам знать что взять себя этот неподъемный поручение совет мочь становиться мишень самый жестокий критика 
28103	 при стрельба смотреть только свой мишень говорить слепцов 
35543	 более расправляться наконец ненавистный журнал для который быть постоянный мишень издевательский критика сваливать твардовский прочно 
28103	 передавать стрела энергия столь большой что когда блочный лук быть запатентовывать затем обретать официальный спортивный статус спортсмен без лишний спор решать что максимальный усилие момент отрыв стрела тетива блочный лук использовать состязание должно превышать фунт потому что потенциальный возможность такой конструкция немереный мишень который стрельба этот 
35543	 этот цепь проблемный каждый связь каждый подобный отождествление становиться мишень кубриковский критика 
28103	 раз месяц полицейский сдавать стрельба три положение вытягивать рука два рука стрельба неожиданно появляться мишень когда надо успевать расстегнуть кобура 
28103	 менее соблюдение рекомендация различный диетолог напоминать стрельба двигаться мишень 
28103	 жизнь устав стрельба мишень сопка ваш сопка наш оставаться 
28103	 кроме внезапный вывод дежурный часть подразделение план главнокомандующий ввс полигон проведение они боевой стрельба мишень аналог нарушитель госграницы 
28103	 боевой пуск три ракета мишень стриж аналог крылатый ракета 
28103	 хотя даже конструктор называть кабан дьявольский мишень 
28103	 результат экспериментальный пуск быть отрабатывать методический рекомендация уничтожение указанный тип цель запуск мишень кабан условие полигон ашулук 
28103	 ростовчанин выполнять боевой стрельба два крылатый ракета стриж один аэробаллистический ракета мишень кабан условие постановка активный 
28103	 очень популярный стрельба мишень боевой оружие 
28103	 при нескоростной стрельба одиночный выстрел это тоже иметь значение как известно когда пистолет дернуться рука после выстрел пуля уже находиться мишень 
28103	 сначала каменистый склон устанавливаться мишень или цинк 
28103	 дальность использоваться тот число качаться мишень выполнять любой плотный материал 
28103	 при выполнение оба упражнение боевой стрельба кроме оценка правильность тактический действие оцениваться управление огонь полнота частота поражение мишень 
28103	 сумочка для плеер пояс время стрельба мишень 
35543	 канун избирательный кампания поупражняться критика власть самый время для это хорошо использовать самый крупный мишень 
35543	 бурный выражение народный гнев напоминать уличный митинг год обеспечивать даяна пост министр оборона однако теперь даян быть мишень 
35543	 правительство как мишень для критика использовать отнюдь 
28103	 принципиальный возможность организация эффективный борьба современный существовать основываться комплексный применение средство пво четвертый поколение российский производство что подтверждаться положительный результат боевой стрельба ракетный мишень аналог средство воздушный нападение 
28103	 создание мишенный обстановка ашулук обеспечиваться запуск пять парашютный мишень тип четыре 
28103	 боевой стрельба ракетный мишень стриж бекас 
28103	 завершающий стрельба мишень впервые проводиться 
28103	 из-за это время стрельба ограничивать минута далеко внизу мишень это фотография полный рост 
28103	 первый это стрельба дистанция метр метровый мишень черный кругом диаметр 
35543	 еще недавно быть мишень самый острый президентский критика 
35543	 ответ обвинение представитель ханнара чхонвон заявлять что они беспочвенный или основной касаться прошлый который хведжан давно отмываться сравнивать сын нынешний президент гангстер сомнительный предприниматель авантюрист намекать что сам ким дэчжун тоже мочь становиться мишень специальный парламентский расследование 
35543	 быть белый зимбабве сегодня значит быть мишень 
28103	 оторопь восторг брать сразу скорость чтение лист быстро осмысление осмыслять одобрение как отдача при меткий стрельба когда приклад поддакивать плечо знаменовать попадание яблочко стрелок еще выпрямляться чтобы оценивающе сощуриваться мишень 
28103	 более что мой ганс чемпион прусия стрельба двигаться мишень 
28103	 задание редакция вдвоем фотокорреспондент должный быть присутствовать опытный боевой стрельба новый мишень фаланга 
28103	 между погода улучшаться поступать указание руководитель стрельба подготовка первый мишень пуск 
35543	 придумывать много практический решение проект пока очень сырой хотеть давать никакой конкретность потому что они сразу превращаться мишень для критика 
35543	 привычный мишень партийный критика вечный скиталец 
35543	 президент свой окружение становиться мишень беспощадный критика сторона конкурент 
35543	 потому что теперь они оба мишень для наркоман 
35543	 череп надоедать быть мишень для глазастый глист 
35543	 олег семенович знать что именно сейчас ослеплять прожектор софит телеоператор идти одиночество лосниться фигурный паркет достойный мишень для сотня пар глаз 
28103	 ворваться офис хохол они ничто оставаться как открывать огонь если они это сделать сам становиться мишень для пуля противник 
35543	 театральный режиссер художник акимов натерпеться свой жизнь рецензия говорить наш критика стрелять только двигаться мишень 
35543	 конец год популярный любимый лидер превращаться мишень для критика ненависть 
28103	 возможность принимать участие ряд боевой операция сталкиваться лицо лицо изрешечивать тир пуля силуэт мишень реальный враг который 
28103	 перед пуля быть мишень гунн лично притаскивать она 
28103	 потом когда приходиться стрелять военный сборы казаться что пуля просто рука втыкать мишень 
35543	 быть мишень обладать сознание эстетический восприимчивость 
35543	 спокойно воспринимать весь этот вокруг давний тот статья возня потому хотя увы это никто понимать что критика быть стрельба двигаться мишень они прицеливаться тот место 
28103	 как-то уже после начало отечественный война учебный тир занятие стрельба пятеро студент должный быть мелкокалиберный винтовка лежать выполнять следующий команда презренный фашистский мишень один мелкокалиберный пуля 
28103	 повторять презренный фашистский мишень один мелкокалиберный пуля 
28103	 затем необходимый проходить дорожка вдоль поле именовать полигон тульский дивизия имя летие вдв дальний конец который иметься стрельбище посечь пуля фанерный мишень 
28103	 человек десять оставлять случай степь лететь наперерез как пуля разный ствол выпускать один мишень 
28103	 этот изрешечивать пуля колодезный бадья который стрелять как мишень тот время как 
28103	 однако весь поиск наш пуля только мишень боковой стенка 
28103	 машина можно отвертка пробивать для пуля она мишень 
28103	 дробнис прицеливаться тщательно подолгу вести ствол сверху вниз сажать пуля пуля свой плотный майор попадать хороший случай край мишень мягкий его часть 
28103	 постоять так минута лукин вернуться место откуда стрелять подбирать пустой гильза только после это пойти мишень 
28103	 помнить как школа ходить урок военный дело стрелять они там стрельбище поставлять вместо мишень всякий портрет помнить 
35543	 политический система китай представлять себя чрезвычайно удобный мишень для критика особенно после 
35543	 кооператив подымать цена мочь становиться мишень классовый критика тип тот что 
28103	 оглянуться лакоб как оглядываться стрельбище чтобы показывать куда попадать стрелять или спрашивать надо подготовить мишень очередной выстрел 
28103	 может именно потому что стрелять мишень лакоб быть очень 
28103	 для это солдат учить стрелять хитро расставлять мишень ориентироваться складка местность быстро 
35543	 даже быть никакой сомнение этот отношение совершенно точно сказать что мой мишень говорить против правительство 
35543	 веселый словесный игра перевертыш лепой нелепица весь что так любить ребенок что всегда отстаивать горький как поэзия помощь который ребенок усваивать дух родной язык многий год быть мишень для человек футляр для 
35543	 киевлянин склонный как весь южный человек ирония сделать новый самостийный правительство мишень для неслыханный количество анекдот 
28103	 быть испытывать июль когда полигон уайт сэндс быть перехватывать мишень имитировать крылатый ракета 
28103	 состав мишенный комплекс кабан создавать база метеорологический ракета входить баллистический мишень пусковой 
28103	 решение этот задача обеспечиваться наличие четыре модификация мишень 
28103	 наряду мишень станкомаш производить авиационный неуправляемый ракета 
28103	 раздаваться первый выстрел мишень алеша застывать душа 
28103	 зенитный комплекс компания успешно перехватывать мишень который имитировать перспективный крылатый ракета 
35543	 спутник использовать качество мишень получать название тюльпан быть 
28103	 тот время спутник иса космос перехватывать мишень имитировать американский военный спутник транзит 
28103	 невдалеке стрельбовый площадка сидеть земля самолет мишень тупорылый обрекать черный крест 
28103	 долгий час лежать неподвижно вдруг увидеть недалеко себя нечто вроде стрелковый мишень или геологический карта 
28103	 четыре огневой рубеж закрывать восемь мишень 
28103	 наконечник оказываться очень хороший оружие достаточно глубоко проникать мишень 
35543	 перемещаться пространство необходимо хотя для чтобы превращаться мишень 
28103	 вывод лазер воздействовать исключительно волос как только мишень устранять поглощающий центр больше нет 
35543	 все-таки сидеть довольно долго раскоряка понимать что представлять себя отличный мишень для какой-нибудь местный большевичка таиться 
28103	 чтобы попадать метровый мишень надо стоять далее 
28103	 петергофский самсон гервиг быть ровесник наталья писать красавец очень нуждаться деньги чета герцен оказываться идеальный мишень вот тут наталья вспомнить 
28103	 мама купить лук мишень четыре стрела 
35543	 мишень представлять себя диск диаметр 
28103	 протягивать искусственный рука перчатка указывать стрелка втыкаться мишень 
28103	 поиск лекарство гипертония три мишень молекулярный цепочка 
35543	 получать пробоина паропровод сильный превращаться неподвижный мишень для вражеский орудие 
28103	 мишень видно прекрасно прокомментировать двукратный олимпийский 
28103	 примерно половина спортсмен сначала закрывать крайний слева мишень другой половина начинать крайний 
28103	 чтобы классика дистанция тридцать метр научаться попадать десятка спортивный мишень кружок диаметр восемь сантиметр тренироваться 
28103	 стрела который посылать мишень классический блочный лук 
28103	 взять город столько для охота куропатка заяц сколько цель опробовать мишень 
28103	 облучать альфа-частица атом разный легкое элемент резерфорд научаться превращать свой мишень совсем другой элемент 
28103	 первый трансурановый элемент нептуний атомный номер фермий номер получать американский физик беркли путем облучение урановый мишень мощный поток реакторный нейтрон 
28103	 боеголовка принцип можно выбирать любой все зависеть тот каков оказываться мишень 
28103	 поэтому переходить плутониевый мишень через неделя уже получать 
28103	 смотреть вместо мишень внутри пачка деньги как 
28103	 свой мишень избирать двадцативосьмилетний судья 
28103	 потом притихать мишень один клок оставаться подниматься 
28103	 дополнительно вне рамка тактический учение полк проводить экспериментальный боевой пуск ракета мишень кабан аналог аэробаллистический ракета потенциальный 
28103	 успешный боевой пуск ашулук прежде все аэробаллистический ракета мишень становиться возможный благодаря большой 
28103	 оно считаться выполнять хорошо если стрелок укладываться зачетный время секунда при это поражать зачетный зона мишень дистанция метр 
35543	 для усиление взаимодействие лазерный излучение мишень предлагаться использовать свч излучение сантиметровый 
28103	 чтобы обеспечивать видимость успех устанавливать ракета мишень радиомаяк работать определенный частота 
28103	 боевой часть поражать мишень район гавайский остров 
28103	 его помощь осуществляться разработка уточнение исходный данные радиолокационный характеристика тот число выполнять технология телс конструирование мишень заданный радиолокационный характеристика экспериментальный 
28103	 новый мишень должный обладать широкий возможность 
28103	 вдобавок предприятие отечественный опк иметь богатый опыт этот дело сейчас основа мишенный парк составлять ракета мишень серия стриж база зур 
28103	 состав наземный средство обеспечение запуск ракета мишень как правило использоваться штатный радиотехнический 
28103	 благодаря они управлять полет ракета мишень проходить требовать траектория 
28103	 для преодоление этот трудность также интерес снижение эксплуатационный расход разрабатываться комплекс автономный ракета мишень 
28103	 пристрелка пистолет согласно инструкция производиться присоединять кобура приклад положение лежать дистанция метр спортивный пистолетный мишень диаметр черный 
28103	 пистолет можно пристреливать стоять рука или два рука без кобура приклад тот мишень дальность при такой способ 
35543	 рейли заявлять что теперь мишень должный становиться глава делегация чичерин 
28103	 скорость полет баллистический ракета мишень любой участок траектория она 
28103	 дальность полет баллистический ракета мишень превышать 
35543	 недавно быть выделять ген кодировать основной белок рецептор мелатонин находиться мембрана клетка мишень рис 
28103	 вот кто становиться мишень объект ненависть из-за недоступность наживать 
28103	 лишь июнь время десятый испытание боеголовка ракета мишень имитировать тип скад 
