40487	 веселить сердце бежать весенний ручей прыгать через пень кочка разбрызгивать влага торопиться склон уже пестро цвести пролеска незабудка какой-то другой цветок имя который позабывать хотя знать хорошо детство незаметно выходить опушка широкий горб лежать слева пробуждаться 
40487	 постоять лесной опушка они направляться подвал 
40487	 осень опушка бродить баба ребятишки собирать 
40487	 снова поползти чувствовать как возвращаться сила крутиков находить товарищ лесной опушка быть бурлак 
40487	 они залегать опушка лес готовый продолжать бой 
40487	 ребята тянуть лесной опушка где около рыжий островерхий куча 
40487	 едва перетягивать линия фронт они тяжело приземляться брюхо первый попадаться опушка лес 
40487	 ужин кинг рассказывать наблюдение опушка лес заканчивать слово 
40487	 как красный бусы украшать шея девушка так малина красоваться лесной опушка 
40487	 потому что опушка лес слишком холодно 
40487	 доходить опушка чуть углубляться лес увидеть 
40487	 необозримый стадо антилопа свирепый бык слон жираф тесниться простор степь опушка темный лес 
40487	 близ река опушка лес встречаться развалины древний постройка 
16750	 опушка расти белый дерево корявый 
40487	 капрал джемс муррей ночь идти опушка лес туда где проходить дорога 
40487	 перебежать полянка лесной опушка она оглянуться 
40487	 минеев под лунный свет густой опушка лес закачаться петля 
40487	 блиндаж располагать под стена дом населенный пункт здание скат высота глубина лес опушка блиндаж иметься 
40487	 придавать танк использоваться как неподвижный огневой точка путем вкапывание они земля окраина населенный пункт опушка лес главный образ 
40487	 обязательно наступление следовать проводить ряд конкретный тренировочный учение характер свой аналогичный особенность предстоящий бой тренировка форсирование речной преграда населенный пункт опушка лес 
40487	 огневой точка располагаться глубина опушка лес больший плотность 
40487	 штаб артиллерийский часть соединение недостаточно суммировать анализировать данный весь вид артиллерийский разведка вследствие что система организация оборона отдельный узел сопротивление противник быть вскрывать недостаточно начало наступление роща считаться нейтральный тогда как она иметь гарнизон более взвод неправильный оценка оборона северный опушка роща единица 
40487	 полка вступать лес энтоловый располагаться ночлег высылать вперед восточный опушка лес монделев сильный 
16750	 часто можно слышать такой заявка подавлять пулемет пушка противник высота такой-то или окраина деревня такой-то учитывать что высота опушка роща окраина деревня часто иметь 
40487	 наступление атака пехота танк должный быть стремительный безостановочный короткий остановка исходный для атака рубеж для сбор подтягивание подразделение огневой средство пехота штурмовой группа артиллерийский наблюдатель для постановка задача младший начальник также для перестроение боевой порядок если пехота наступать открытый местность она предстоять атаковать опушка лес далее вести бой 
40487	 командующий артиллерия армия подготовить массированный огонь оборона противник проходить восточный окраина город также иметь подготовить огонь выход пурвциемс юго-западный опушка лес восточнее пурвциемс давать 
40487	 при отсутствие цель воздух возможно необходимо массированный применять для стрельба наземный цель противник опушка лес вышка 
40487	 качество вертикальный маска использоваться забор ограда населенный пункт опушка лес сад 
40487	 разведка подступ противник состояние озеро река болото опушка роща если таковой иметься 
40487	 для это характерный точка местность иметься карта летный состав тригонометрический пункт отдельный высота опушка роща окраина населенный пункт 
40487	 при оборона горный лесистый местность период подход противник бой опушка лес если позволять условие местность 
40487	 кустарник роща опушка лес как правило противник обстреливаться 
40487	 огонь артиллерия миномет авиация подавлять оборона противник опушка лес очищать вершина дерево 
40487	 овладение опушка лес при втягивание лес 
40487	 метр сто опушка спать погружать мертвенный мгла 
40487	 разведывать опушка лес отдельный домик спикировать 
40487	 перед рассвет отшагать ночь десять пятнадцать километр выбирать стоять опушка лес сарай забираться 
40487	 называть этот впервые открытый котловина верхний токкинская пересекать она глубокий снег достигать темнота опушка лес 
40487	 ночь сапер ахмедвалиев коробков сделать проход минный поле утро залегать опушка лес 
40487	 край опушка лен вершок рост 
16750	 косой утренний луч опушка ослепительный белизна береза белый мраморный 
40487	 утро старший сержант борисов поводить новый разведчик опушка лес 
40487	 когда подходить опушка лес савченко показывать вервищенский 
40487	 она пролететь через весь поляна опушка лес 
40487	 выскочить траншея гнать фашист опушка лес 
40487	 первый выскочить траншея гнать немец опушка лес 
40487	 полицейский отрываться бинокль подзывать себя немец тот вставать рядом направлять свой бинокль опушка лес 
40487	 противник оборонять лесной опушка батальон наступать общий правило 
40487	 главный усилие батальон направляться чтобы овладевать выступ лес откуда противник фланкировать опушка проникать лес хотя 
40487	 лес следовать цель наступление батальон являться выход противоположный опушка 
40487	 задача батальон назначать походный охранение при наступательный марш обеспечивать беспрепятственный движение главный сила захватить важный местный предмет высота теснина опушка лес водный рубеж отражать любой 
40487	 бой лес вестись близкий дистанция слагаться бой овладение опушка лес бой внутри лес 
40487	 подавление противник опушка лес огонь артиллерия миномет 
40487	 лесной опушка застреливать они три заяц два 
40487	 ружье двухствольный тяжелый выбегать охотник опушка лес запыхаться земля садиться 
40487	 они сидеть опушка большой лес отдыхать 
40487	 вдоль лесной опушка грохот взлетать воздух 
40487	 выскочить тарантас пойти лесной опушка 
16750	 его опушка предательски притаиться противосамолетный орудие 
40487	 вдали показываться лес тот самый нагой опушка который летчик собираться производить посадка 
40487	 занимать оборона садиться опушка лес юго вост 
40487	 васильевский исход день овладевать садиться опушка лес 
40487	 силеевка антошкин зап опушка лес вост 
40487	 утро укреплять рубеж южа опушка лес 
40487	 силеевка антошкин зап опушка лес 
40487	 предпринимать наступление ночь овладевать совместно прокоповка занимать южн опушка лес 
40487	 бубен бруев каретовка зап опушка лес зап 
16750	 мелькемен далее шоссе вдоль восточный опушка роминтенский пуща останавливаться 
40487	 батальон приказывать быть занимать тыловой позиция опушка лес 
40487	 колонна двигаться очевидно недалеко опушка этот выстрел быть услышать 
40487	 южный опушка лес замыкаться болотистый долина 
40487	 подсерский лясы два три дом опушка лес 
40487	 сан укрепляться высота северный опушка они обеспечивать исходный для наступление 
40487	 тот время наступать восточнее корпус сбивать передовой часть австриец подходить северный опушка таневский лес где наткнуться 
40487	 полевка можно встречать огород кустарник опушка лес глубина лесной массив 
40487	 этот след сильно расширяться при таяние снег после как весь снег вокруг растаивать оледенение огромный оставаться тумбочка весь опушка лес 
40487	 опушка возле старый остроконечный часовня 
16750	 скрип сани вскакивать серый белый подпудник заяц мигать оторачивать черный опушка хвост пойти щелкать целина 
40487	 лошадь повертываться ветер спина искать укрытие возле редкий разбрасывать опушка лес куст боярышник 
40487	 справа над опушка лес чуть видный сквозь пыль 
40487	 совсем плохой летунья малоподвижный небольшой стрекоза стрелка множество встречаться трава недалеко вода нередкий лесной опушка поляна 
16750	 прекрасный летун коромысло час носиться вдоль опушка или лесной дорога хватать 
40487	 впереди сквозь стеклянный прозелень вода начинать проступать как опушка лес смутный очертание кустик 
40487	 опушка оказываться какой-то молодой мужик 
16750	 подъезжать опушка высокий лес тут красноармеец 
40487	 противоположный берег опушка лес мало чем 
40487	 теперь через стекло видный быть весь опушка дерево который скакать 
40487	 они отставать выкатить опушка девять лыжник 
40487	 усср скай часть западный граница опушка ребята играть футбол ловкий 
40487	 опушка между дерево висеть обрыв колючий 
40487	 часть донцов умудряться пробираться меж обоз опушка лес спешиваться выстраиваться 
40487	 весь опушка лес оглашаться вопль стон крик 
40487	 казак решаться ехать большак правиться опушка лес выискивать сверток проселок 
40487	 опушка лес самый край береговой 
40487	 некоторые они производить впечатление однобокий метелка мелкий ветка расти густой пучок образующая опушка непроницаемый чаща 
40487	 желать нарушать покой свой проводник направляться опушка лес где среди тальник расти 
40487	 скоро колхозник петр иванович карзун увидеть опушка лес человек осторожно пробираться сквозь 
16750	 дорога двоиться вправо влево почти вдоль опушка тянуться ухаб санный 
16750	 сосновый еще дикий опушка тянуться без конец вдоль автомобильный 
40487	 жаль мало жить лес мало ловля государь жить все матюшкин плут ловчий близ дорога опушка лес полянка трава она 
40487	 поздно ночь они быть близ волга ночевать опушка лес 
40487	 даль слдовать тот замчательно смшная анекдот который уже приводить автомобиль умышленно оставлять возл опушка исчезать 
40487	 поспшило обратно опушка звать товарищ ужас 
40487	 лесной опушка разбойник опять нагонять 
40487	 ладонь защищать глаз солнце оглядывать окрестность страшный бой опушка лес синьор карабас держать 
40487	 дерево расти опушка бывать искривлять тот который расти 
40487	 вблизи опушка лес прямо земля всхрапывать 
40487	 час через три четыре выходить какой-то опушка 
40487	 если опушка большой образовываться цпочка парагвайский хата 
40487	 устье опушка лес разрушать коши после который 
40487	 затем поражать изумление его спальня превращаться опушка лес какой-то черный кавалер 
16750	 опушка останавливаться становиться присматриваться нет 
40487	 при выезд опушка лес бурун брать вожжа 
40487	 просторно раскидываться ласковый живой небо опушка лес притихать сумерки силуэт 
40487	 уставать думать тайком подниматься окно глядеть глядеть без конец опушка лес 
40487	 однажды неслышно подходить лесной опушка становиться слушать дерево 
16750	 мост широко разъезжать песчаный дорога валить без строй солдат стрелец ненавистный петр колпак лисий опушка изломанный кое-как связывать телега 
40487	 темный неясный тень виднеться опушка лес 
16750	 еще если всматриваться зоркий видеть теперь тонкий опушка березовый лесок насыпь убегать 
16750	 черный опушка парк она сделать крутой прыжок 
16750	 или можно тута внизу внизу опушка 
40487	 похоронить пустынный кладбище опушка лес 
40487	 свертывать шоссе лесной опушка ложиться спать 
16750	 докатить опушка одежа себя долой 
40487	 очаровывать свирель моцарт петь весенний солнце опушка лес 
40487	 мой сердце любить римский корсаков родной свирель опушка лес 
40487	 два убитый бандит чернеть снег возле опушка лес 
40487	 зверолов прекрасно знать что лето медведь палка загнать берлога что медвежий берлога сроду бывать опушка лес зверолов догадываться что над 
40487	 захар севастьянович маркиз муж внутренность большой шатер опушка вековой лес 
40487	 перед мост повертывать вправо пойти над берег яуза опушка лес 
40487	 тонкий острый стрелка тоже повертываться несколько раз качнуться черный конец показывать тот сторона где опушка выситься старый раскидистый сосна 
40487	 опушка лес они слагать весь вещь 
40487	 когда выходить опушка лес солнце уже проходить 
40487	 возле поле опушка притаиться наш пушка 
40487	 слева стоять человек крага стек рука глядеть вдаль опушка лес из-за который через несколько 
40487	 бежать наш лошадка большой дорогой рубеж через полянка около опушка лес 
16750	 совхоз завыть гудок завод плаксивый зовущий выбегать опушка парк гореть кубанский 
16750	 верста медведково мужик махальщик завидеть карета замахать шапка опушка березовый роща отзываться второй 
40487	 зато просыпаться весь ночь быть жалкий писк голод гоняться друг друг весь этот мелкий крупный хищник дремать день телеграфный провод таиться ров лесной опушка 
16750	 тогда завертывать угол побежать направление кладбище опушка перелесок останавливаться передыхать бухнуться 
40487	 быть уже готовый поход поэтому пойти опушка посмотреть распускаться куст черемуха 
40487	 вероятно опушка уже сам понимать что 
40487	 утро они оставлять дом лесной опушка взять направление степной 
40487	 сила солнечный жар сохраняться еще вечерний луч опушка бор обращать запад продолжаться 
40487	 вскоре прилет замечать этот птица лесной сеча опушка 
40487	 конец север заяц последний помет держаться около поле опушка лес 
40487	 конечно дача мой понравиться так как при она быть даже забор стоять она одиноко опушка лес быть вообще неуютно 
16750	 весь комната находиться деревянный лавка опушка многий расписной стол 
40487	 это быть почти опушка большой лес мелкий 
16750	 ранний утро тетерев глухарь быть дерево бекас располагаться внутри куст вальдшнеп опушка ходить мороз 
40487	 пятый картина мраморный колонна надеваться чехол древесный кора превращать они ствол сосна тот лес опушка который происходить дуэль 
40487	 доезжать верста полтора станция опушка сосновый лесок красногвардеец велеть кучер 
16750	 черный серый опушка нагольный полушубок расстегнуть 
40487	 бой деревня волк батальон полковник моравский выпадать доля лоб атаковать опушка лес мешок входить позиция 
40487	 дружный торжествовать ура загреметь опушка лес 
40487	 приносить только один бекас вальдшнеп находить опушка лес возле озимь 
40487	 сидеть целый час под елка потом быстро обходить часть опушка озимь опять забираться под 
40487	 обходить лес вдоль линия посмотреть опушка зубча озимь вернуться 
16750	 вот энт самый шапочка котиковый горностайный опушка серебрецо подавать при деньги 
40487	 однажды утро когда весь мужчина быть охота женщина заниматься растирание корень маниок который они делать опьяняющий напиток каширь проходить окраина селение услышать стон шалаш стоять одиноко самый опушка лес 
40487	 выходить петр кирилович лесной опушка перекрещиваться 
16750	 словно зайти гость назад опушка сквозь еловый гуща потерять дорога 
16750	 светлый над опушка бить месяц река 
40487	 сойдясь все опушка лес лагерь видеть 
40487	 над опушка полный блистать луна поглядеть как 
40487	 там опушка какой-то старый лес машина потерять 
40487	 опушка тот самый лес где несколько 
