12982	 французский посол россия палеолог замечать дневник февраль сегодня булочная быть поражать злой выражение который читать лицо человек стоять хвост 
12982	 неужели конец июль уезжать такой возможный верить город сказка вспоминать гудеть людской муравейник свой родной вокзал пристраиваться хвост очередь тот касса который согласно 
12982	 быстро шагать перрон тепловоз стоять хвост состав моторный отсек ровно гудеть 
18002	 только она взяться свой дело как возница мгновенно останавливать без изящество подымать пышный хорошо расчесывать хвост чтобы она запачкать 
18002	 только увидеть как вздрагивать земля нога высокий солдатский ботинок когда собака по-волчьи поджимать хвост дергать зуб понимать 
18002	 азиат полететь мухтар клекотов быстро снимать намордник спускать поводок мухтар поджинать хвост оглядываться припускать азиат 
18002	 чувствовать некоторый артистический удовлетворение оттого что волна хохот усиливаться когда дергать ручка вздымать хвост лошадь 
40730	 потом врач понимать что собака надо рубить хвост один прием 
18002	 красавец редкостный масть темный черный лиловато коричневый бежевый подмышка явно ангорский кровь хвост опахало из-под кровать почти 
18002	 из-под кровать почти полкомнаты царский хвост кот быть капризный причудливый 
18002	 удивляться волк поджимать хвост задумываться встречать заяц лиса 
40730	 корнилов наступать хвост вот орать дурной 
18002	 так кажется сказать попугай когда кошка тащить хвост клетка 
14619	 передний часть голова ярко красный цвет темя затылок черный щека белый крыло желтоватый черный белый крапинка задний край клюв красноватый беловатый цвет черный конец основание который оба сторона черный усик хвост черный белый пятно 
18002	 читать улыбаться кимоно конский хвост трепать сильный океанский бриз 
40730	 никто навязывать свой вкус ослиный хвост мост сравнивать 
18002	 карман его пиджак торчать нередко хвост копченый лещ 
18002	 выдирать отовсюду цветной перу все вплетать свой хвост 
18002	 драться помойка высоконогий свинья узнавать скворцов кинуться колено неистово вилять хвост повизгивать счастие 
18002	 нога его хвост торчать сумка затем 
12982	 чуть хвост огромный змея наступать 
12982	 ехать лужа отражаться они свой холодный желтый тело повертываться хвост удаляться покачиваться где-то очень 
12982	 рыбка мелкий попадаться все много кость мясо костя свариваться разваливаться только голова хвост держаться 
18002	 волк ложиться брюхо подползать вилять хвост человек 
18002	 над ржев мессер из-под самый хвост вымести 
40730	 викторов смотреть легкий лунный тень крыло хвост яков тихонько подпевать певец 
18002	 муська водить хвост трава продолжать урчать 
0	 сначала животик зайти потом шея потом весь окунаться только хвост обрубочка торчать наружу повозиться повозиться 
18002	 свинья как бывать хвост муха садиться она 
12982	 разговор этот трубка зуб вести компания трубочист ведьмин хвост который прополаскивать они щель труба 
12982	 ходить реветь пореветь послушать мотавать хвост далеко ход телок 
18002	 жучка очень хотеться подходить она вилять хвост решаться 
18002	 собака только поджинать хвост задумчиво отбегать сторона 
18002	 теперь узнавать ласково завилять хвост еще издали 
18002	 несколько белый шавка подниматься сено подбегать вилять хвост длиннобородый старый козел неудовольствие 
18002	 хитрый собачонка поджинать хвост съеживаться вдвое выходить тихо 
14619	 быть уссурийский нос хвост даже полоска 
18002	 хвост дракон украшать жемчужина символизировать палящий 
18002	 поэтому блюститель общественный мораль требовать добавлять облик фурри брачеваться человек обязательный элемент зрелость некоторый дряблость кожа свалянность шерсть вонь пасть из-под хвост отвисание вымя стертость коготь 
14619	 дверной проем появляться голова черный хвост 
40730	 понимать что толковый весь добираться поезд прямиком париж лондон толпа пассажир затериваться легко как странно легко замечать отслеживать хвост 
18002	 пес так лежать доверчивый брюхо кверху выжидательно посматривать прохожий из-под мохнатый ухо приниматься весело крутить хвост профессиональный вымогатель 
12982	 бомарше приходиться ползти этот змеиться хвост который вильнуть площадь греть 
18002	 хватать штанина хозяин такса собака вилять хвост брысь 
18002	 выныривать из-под рука сопливый шкет свой такса собака вилять хвост отставать говорить ход 
18002	 прекрасно характеризовать страдалец польский психиатр антони кемпински ситуация напоминать собака грызть свой хвост 
18002	 из-под наш нога шум шугать большущий ящерка хвост труба как кошка 
18002	 щекотно улыбаться волк едва заметно вилять хвост елеазар пукнуть тихо просить мальчик 
40730	 или без хвост последний слово она подавиться 
18002	 как стая главное подстреливать вожак остальной разбегаться поджинать хвост 
14619	 волос она торопливо собирать хвост схватывать резинка резинка сползать 
14619	 она быть облегать кимоно зеленый шелк волос быть убирать черный хвост перехватывать резинка смешной красный 
12982	 себя считать вожак стая который включать весь семья причем борис плестись где-то хвост 
14619	 человек черный кожаный штаны подтяжка красный рубаха закатывать локоть смоляной обильный волос забирать хвост круглый живой глаз восседать 
18002	 бурашка соответственно имперец пытаться садиться альянс хвост альянс тоже против 
12982	 абрамов александр уточнять пожалуйста вопрос тень хвост можно вычислять 
12982	 маша старыгин пристраиваться хвост экскурсия 
18002	 вареный рак отрывать клешня хвост высасывать они мясо 
12982	 так май год творческий объединение свой состоять медиа активист чувствительный идея ситуационизм организовывать москва первый пристраиваться хвост коммунистический демонстрация 
40730	 хвост сегодня пополнять ребенок смешанный 
18002	 роскошный хвост ласт задний лапа 
18002	 джинсы свитер сапожок конский хвост под фарфоровый шея удивительно 
12982	 пристраиваться хвост грузный дама хотеть проскочить 
12982	 абрамыч сорока хвост приносить заходить бабка автобус 
18002	 сучка несколько раз вопросительно покосить глаз чангола почти дружелюбный вильнуть хвост повертываться набок выставлять напоказ 
14619	 это четыре лапа рот подмышка капуцин еще хвост 
18002	 нет покачать тот голова самый хвост сидеть мария беспомощно посмотреть 
12982	 закричать она пристраиваться хвост маршировать колонна 
18002	 фауст слабо завилять хвост неуклюже заклацать проскальзывать пол 
18002	 особенно впечатляющий выглядеть ухо хвост нос 
18002	 восстанавливаться как хвост ящерица бунин улыбаться 
18002	 папиков договариваться ректор что один хороший операционный сестра советский союз взять осень сразу третий курс пока она определять хвост давать книга она начинать 
18002	 фунтик понятливый помахать хвост белый кисточка конец 
18002	 фунтик вставать застенчиво отводить глаз завилять хвост белый кисточка конец 
18002	 обозначать свой присутствие фунтик радостно завилять хвост белый кисточка 
18002	 псина пятиться вилять опускать хвост провожать прощаться хоть только 
0	 еще ребенок понимать сейчас наделать глупость потом весь жизнь кот под хвост 
18002	 еще этот растение напоминать конский хвост именно так дословно переводиться 
18002	 заключать маринка проваливаться университет отстригать гордость свой родитель конский хвост толщина рука сбегать 
18002	 серый гордо помахивать пушистый хвост мол ага болеть целый куча 
12982	 где они голова где хвост 
14619	 ирина успевать умываться собирать волос хвост 
18002	 вернуться никуда деваться помотаться помыкаться приползать поджинать хвост как она посметь взять этот 
18002	 григорьев олег хазин михаил укусить змея свой хвост тенденция прогноз динамика российский 
18002	 спаниель понюхать даваться почесать ухо заматывать хвост понюхать дохнуть 
40730	 несоответствие пропорция мешать нюхать друг друг под хвост 
40730	 вопреки общий физический недомогание что хвост болеть лапа отваливаться 
40730	 висок отвешивать рыжий бес яростный оплеуха сконфуженно отступать нервно подрагивать хвост кажется понимать что 
40730	 желнин полет хвост вперед сверхманевренность 
40730	 непрофессиональный термин полет хвост вперед становиться повод для обсуждение 
18002	 крутануться место лев кропить из-под хвост угловой столб загон который 
18002	 крутануться место лев кропить из-под хвост угловой столб загон который 
18002	 велеть хорошо спрятать телевизионный аппаратура камера сидеть поджинать хвост высовываться 
18002	 фунтик приветливо вильнуть белый кисточка хвост 
18002	 так они спать вповалку пьяный губернаторша графиня трезвый как стеклышко они маленький страж белый кисточка хвост 
40730	 руль высота стабилизатор отклоняться вверх его подъемный сила уменьшаться хвост опускаться 
18002	 появляться лисенок висячий ухо закручивать хвост бульдожий перекус укорачивать морда 
0	 тогда просто приход второй локомотив ставить хвост потом утаскивать состав 
18002	 урановый хвост так запад называть гексафторид 
12982	 медик связь почему предупреждать что хвост появляться 
12982	 связь почему предупреждать что хвост появляться 
12982	 стена два барышня машинистка разговаривать продовольственный осложнение скандал хвост лавка волнение среди 
14619	 пол свешиваться длинный хвост блестящий платье 
18002	 бес прокрадываться мимо пес тот страх хвост увязать задний лапа 
18002	 даже рыба говорить начинать вилять хвост если она жабра взять 
18002	 как ступать копыто как из-под валкий хвост выпрастываться разваливаться шмат дымиться помет 
40730	 хвост лесной мышь большой равный 
18002	 однажды пробираться свой норка хороший кусок свой любимый кушанье как вдруг хвост шлепнуться увесистый дождевой капля 
18002	 волчонок поджинать хвост стыдливо отскакивать сторона 
12982	 прикреплять кольцо туловище голова хвост слоненок 
18002	 лопаться богатство голландия поджимать хвост уже напиваться кровь гашишист который 
40730	 при звук автомобильный гудок они бросаться врассыпную смешно переваливаться задирать вверх пышный хвост 
40730	 количество перо каждый крыло хвост шея 
40730	 увидеть кабан длинный пожелтеть клык торчать вверх хвост похожий антенна 
18002	 девица обесцвечивать конский хвост лиловый губа кокетливый повертеть 
18002	 саша успевать выругаться олег как выстреливать еще раз угождать похоже прямо клубок срастаться хвост 
12982	 дохлый скат похожий блин хвост который болтаться волна 
18002	 хорек темный окраска лапа хвост очень интересный раскраска мордочка будто 
18002	 солнушко если совсем аутентовать иметь право любой хач который зайти предел рынок вякнуть привязывать конский хвост 
14619	 нет надумывать сравнение обращаться милостивый государь черный хвост демонстрировать три белый кружок 
18002	 какой белый кисточка хвост прелесть 
18002	 справляться забывать причесываться сделать сзади конский хвост подчепуриться немного горячий 
12982	 посмотреть сторона хвост вздыхать печально 
14619	 отвращение представлять как подергиваться его узкий черный брюки обрубок купировать детство хвост 
18002	 наш резвый шпеер злость чуть лопнуть сразу поджимать хвост ядовито прокомментировать это геринг 
12982	 хвост туристический автобус раздвижной прицеп 
12982	 отцеплять хвост можно съездить автобус 
18002	 ворота вилять хвост встречать лохматый собака 
12982	 пока двигаться один прилавок другой подолгу выбирать галстук дамский сумочка электробритва хвост пристраиваться несколько делегат как сейчас 
12982	 она морда вперед перелагать посоветовать взмокать тетка или хвост 
18002	 беззлобный лаять приятный бас добродушно махать хвост 
18002	 прижимать ухо сливаться гибкий линия текущий затылок хвост 
14619	 никакой жизненно важный механизм хвост нет 
12982	 этот тугоухий подслеповатый гигант медленно двигаться поверхность вода иногда становиться хвост как солдатик 
12982	 количество бездомный дворняга уменьшаться освобождаться территория трусить язык сторона хвост баранка собака нахичевань 
40730	 только теперь понимать что иметь вид андерсен свой русалочка сменить рыбий хвост женский нога 
40730	 наш позиция саам хвост список регион россия 
12982	 окончание падать импульс поле граница иметь медленно спадать хвост 
18002	 катить пытаться садиться хвост свой бойфренд его приятель 
12982	 рождаться ровно хвост месяц весить 
12982	 чтобы плестись хвост мировой сообщество быть полноправный участник 
0	 без всякий сомнительный жена ребенок пенелопа хвост 
18002	 этот газогорелочный устройство часть рециркулянт подаваться зона формирование факел часть его хвост 
18002	 заметный недавний прошлое бизнес фигура предел квадрига либо продавать свой актив олигарх первый эшелон либо просто поджимать хвост ожидание неизбежный финальный монополизация 
14619	 впрочем скоро даже взвиваться как ракета как комета потому что его волос словно ионный хвост черный лента развеваться 
40730	 экспериментально давление свет быть обнаруживать русский физик вселенная оно проявляться наличие положение кометный хвост 
40730	 слушать наш рассказ хвост скептически почти насмешливо 
18002	 пример фильм хвост вилять собака реж 
18002	 они хвост отрывать ухо палка 
18002	 вылезать палатка чарли разбегаться вилять хвост приветственный поскуливать 
40730	 горе только рак красить проворачивать палка ведро который пена торчать огненный хвост сказать дядя жора позвать 
12982	 занимать мужской набор первый место женский идеал стоять где-то хвост 
18002	 единый россия который теоретически надлежать диктовать предвыборный расклад регион поджинать хвост выстраивать свой кандидат 
12982	 куда правильно быть отрубать хвост сразу отбирать вуз бюджетный 
18002	 это скакать ступенька ухо хвост голова 
18002	 каждый лужа собака ухо хвост 
0	 рыба шевелить хвост потом открывать рот 
12982	 плестись хвост португалия стыдобушка доктрина коммунизм 
12982	 попросить магазин нарубать бычий хвост кусок размер сантиметр 
18002	 рог олень ухо бык шея верблюд тело змея чешуя карп лапа тигр коготь орел хвост лошадь 
0	 тут повар наливать весь настойка хвост фуга 
18002	 из-под хвост лошадь дорожка зашлепать пахучий 
18002	 путин надо переставать вилять хвост перед буш хватить угождать кремлевский 
12982	 разгромить зал повиливать хвост ходить купер 
18002	 поэтому рисковать оказываться диссидент инакомыслящий весь хотеть предлагать свой рассуждение читатель серый волк поджимать хвост подлежать сомнение что россия 
18002	 следствие победа сша быть огромный серый волк поджимать хвост теоретик великий туран 
18002	 катышок все метаться весь тыкаться стенка точно раздвигать они испод чутливо отыскивать свой испод проникать внутрь затихать ненадолго вдруг суматошно приниматься кружиться как догонять свой хвост заполнять круговорот норка 
