18002	 картинка кун горгона медуза быть недурной себя два змейка обвивать она шея хвост высовывать головка из-под кудри 
18002	 мастерица цеплять золото кисточка беличий хвост класть кожаный подушечка набивать 
40730	 серый красавец кокетливый красный хвост летать еще может 
18002	 спрятать хвост между нога кобелиный трусливо рвануть 
18002	 несведущий иноземец даже посмеиваться над меднокожий странник равнина называть они собиратель овечий навоз пожиратель вонючий сыр нюхатель пыль ветер из-под конский хвост 
12982	 только шум мотор плач ребенок откуда-то хвост 
18002	 зеркало задний вид никоненко видеть его хвост потрусить между грязный оседать сугроб 
18002	 как кошка который бегать свой хвост 
14619	 выхухоль плотный валикообразный тело лапа оторачивать жесткий волос плавательный перепонка сплющивать бок чешуйчатый хвост 
14619	 сбивать ася черный хвост дым рушиться земля сбивать 
18002	 лошадь грива хвост вплетать быть разноцветный лента 
12982	 контролер никогда садиться середина поезд только голова или крайний случай хвост 
18002	 хвост вилять собака только фильм 
12982	 марион петри оксфорд впервые задумываться зачем павлиний самка особо красивый хвост партнер 
0	 тянуть голос хвост изо весь мочь чуть 
14619	 сергей дарькин удаваться отспаривать минэкономразвития приголубливать дальневосточный регион один минтаевый хвост даже тот десять тридцать 
40730	 завидеть хвост белый перебинтовка понимать что 
12982	 елагинец тихо проходить десятый час утро через каменный мост пристраиваться хвост пролетарский колонна двигаться набережная 
18002	 какой кошковед пришивать кобыла хвост 
12982	 где наконец хвост пожалуй птица соглашаться 
12982	 крыть брезент грузовик вытягиваться колонна сопровождение два бэтээр голова хвост рев набирать все много 
18002	 она искриться чернота бить хвост она веять бесовский 
12982	 отец варить оксеншванцензуппа суп бычий хвост 
12982	 сущность давно пора быть отрубать этот хвост 
18002	 один взгляд тушканчик обрисовываться весь голова кисточка хвост 
12982	 вдруг как что-то зашипеть около чуть хвост огромный змея наступать 
18002	 как хвост холм вывалить так 
18002	 силок биться птица разноцветный хвост 
18002	 чеп чик крикнуть малинин вслед махать хвост 
18002	 подсовывать веревка под самый репица хвост плотно прикреплять она седельце 
18002	 собака хвост между нога зажимать смотреть 
18002	 сей идол посвящать быть белый конь кой грива хвост позволяться единый выдергивать 
40730	 потом один они отцепляться они оба повисать один хвост прекращать турзучать друг друг 
18002	 быть верный пес алексей андреевич аракчеев больно хвост вилять становиться раздражать павел 
18002	 чем сильный собака грызть свой хвост тем много болеть 
12982	 сорока хвост кто когда врать 
40730	 ученый находить это такой объяснение при горизонтальный положение шея голова хвост уравновешивать друг друг кроме 
18002	 хвост между нога полезть под лавка 
12982	 шестой чувство рощин срабатывать незамедлительно или сорока хвост приносить 
12982	 лежать только живот вверх при это свернуться даже калачик завертываться крендель или даже штрудель так что понимать где хвост где голова иногда спать 
40730	 одиннадцать отчетливо вырисовывать перо хвост крыло змеешея птица составлять 
40730	 судя количество маразм править элита навальный наступать хвост 
18002	 бурашка причинять садиться хвост долбить 
0	 галина весь мнение предложение весь проводить работа этот период кот под хвост 
18002	 предугадывать недовольство сторона ярый защитник животный отмечать что щупальце некоторый вид головоногий отбрасываться вполне естественный образ как скажем хвост ящерица еще долго 
0	 весь мелодрама кот под хвост ведь глюк сладенький финал 
18002	 иркутск находить нормальный бюрократический компромисс между воля начальство здравый смысл пожертвовать последний герб губерния мощный зверь лишать полоса пририсовывать роскошный хвост задний лапа почему-то становиться 
12982	 девушка ассистент режиссер хвост приносить работать 
12982	 чернов сорока хвост все дело процент 
18002	 жена либо загонять купалка либо хвост либо приманивать шиповник или курага 
12982	 сорока хвост дружба продлевать жизнь 
12982	 убитый крыса отрубать хвост десять 
14619	 пусть быть ступня хвост нет хобот такой 
18002	 фунтик приветливо вильнуть хвост преданно посмотреть тетя 
0	 жаль столько работа кот под хвост 
40730	 помимо этот письмена уцелеть камень можно быть различать конец выветривать подсвечник лист два оскаливать лев сцепляться друг друг собственный хвост какой-то колонна кудрявый навершие 
18002	 виль виновато махать хвост косить глаз лидочка 
18002	 чесать она пузо она счастливо махать хвост 
0	 закукарекат весь лечеба насмарку кот под хвост поэтому петух запирать баня 
12982	 приклеивать черный бусинка зеленый фон пришивать туловище голова хвост котик 
18002	 фил бродить комната опускать хвост 
12982	 убитый крыса отрубать хвост десять 
18002	 из-за девка происходить приезжать старик внучка год восемнадцать начинать тут хвост вертеть 
18002	 аккуратно накрасить белый рубашка длинный бусы начищать сапог хвост голова наташа пробка 
18002	 менее урановый хвост два три раз год 
18002	 какой-нибудь зараза повисать хвост вплотную некоторые держать хоть какой-то 
12982	 роберт анна тот дело заваливаться студия где после полночь усаживаться стол расходиться под утро где словно возрождаться бубновый валет или ослиный хвост где издеваться над академия 
40730	 вертикально вставать над очередной вал опираться хвост кит тесно прижиматься друг 
40730	 постепенно ритм обмакивание учащаться партнер сближаться друг друг самец захватывать клюв перо затылок самка взбираться она изгибать вниз хвост подводить под 
14619	 раскусывать клык глиняный плошка сбивать хвост стена коврик 
14619	 корова сам доиться хвост сбивать масло сыр 
14619	 осетр свешиваться блюдо хлопать хвост бедро стряпуха 
18002	 торопиться вычерчивать буква подрисовывать они хвост завитушка ругать себя 
12982	 где хвост что они приключаться 
18002	 лошадь перевивать перепоясывать сбруя цепь под хвост рот крупа как 
40730	 довольно долго она бросать любопытный взгляд друг друг пока начинать перевертывать страница только хвост мелькнуть трава 
18002	 гордо помахивать пушистый хвост она выходить кухня 
40730	 несколько крыса нежданно для они сам освобождаться друг друг становиться расползаться тащить себя задний лапа хвост некоторые короткий другой 
12982	 запоминать весь жизнь уже рассказывать это чудный видение севастополь ялта медведь гора дворец ласточкин гнездо стоящий высокий скала дохлый скат похожий блин хвост который болтаться волна 
18002	 переминаться заносить лапа осаживаться хвост решаться прыжок 
0	 тянуть кот хвост носок находить мочь 
18002	 смущщенно поджинать хвост вообще-то только 
0	 весь работа кот под хвост решать видно нужный ремонт 
40730	 бунчик который уже наступать хвост 
18002	 свой рейчел ласковый словно месячный щенок махать хвост стараться облизывать 
0	 чуть сторона весь работа кот под хвост 
18002	 можно сказать весь река море облазить нигде никакой русалка хвост встречать 
40730	 обрубать хвост почистить перо ончик отбывать 
18002	 длина лисий хвост есть несколько раз превышать 
18002	 сумлеваться хавать как миленький вна как хвост топорщица загривок 
18002	 пока какой какой хвост махать 
18002	 австралия скандий содержаться урановый руда хвост разработка 
18002	 перед отъезд москва учеба старший сын четверяго подарить мать скелет собака который бегать вилять костлявый хвост хватать враг острый зуб 
18002	 хвост недовольный собака единый россия осуждать 
18002	 многократно убеждаться что нет хвост встречать заранее 
12982	 человек находиться везде где они хотеться рассматривать файл компьютер хватать хвост кот слушать музыка 
14619	 тот самостоятельно отгрызать себя хороший случай хвост плохой жизненно важный орган 
18002	 нога его сидеть старый кот мурат облезть хвост исключительно умный дворняжка тобик 
14619	 белый лебедь один черный перышко хвост младенец который поп крестить 
14619	 крыло белый пятно ярко-голубой зеркальце надхвостье белый хвост черный 
18002	 сваривать соль перец лавровый лист укроп они самый дело быть крупный хотеться есть быть отламывать мощный хвост высасывать колючий ломкий клешня 
18002	 рефлекс шавка хвост вилять перед начальство выхватывать чемодан 
18002	 часть образовательный общественность вообще считать что госзаказ нынешний его вид это всего лишь отрезание больной хвост кошка часть 
18002	 зарабатывать себя право вертеть махать хвост 
12982	 скорпион ведь убивать хвост где смертоносный жало 
18002	 рыжик понюхать тетрадь недоверчиво вильнуть хвост 
12982	 наш сосед ресторан вто упоминать так что мочь этот песня второй раз заводить попросить магазин нарубать бычий хвост кусок размер сантиметр 
0	 распределять тело плавник хвост фуга неравномерно оказывать неодинаковый 
14619	 второй нос хвост переливаться золото краснота осенний 
14619	 доставать карман заколка для волос женский по-моему привычный жест собирать волос хвост сзади 
40730	 охотиться друг друг как собака собственный хвост хотя такой воинственный 
40730	 они зависать там как рыба подвешивать кухня внутри окно веревка вдруг заклокотать кухонный сквозняк забиваться друг друг сухой хвост вдруг нестерпимо захотеться 
18002	 заранее сгибаться хвост вилять что 
0	 два год переговоры мелькнуть удача весь кот под хвост 
18002	 ловец возвращаться берег кричать коллега дельфин попросить передавать привет помахать хвост или что-нибудь этот дух 
40730	 когда читать подобный торопливо состряпать декларация донос оставлять ощущение что автор загнать клетка словно несчастный зверек отчаянный попытка выживать кусать друг друг отгрызать друг друг хвост 
18002	 фильм хвост вилять собака описывать ситуация как 
0	 становиться быть весь накоплять сотрудник все они барыга переквалифицироваться оперативный прочий информация кот под хвост 
12982	 народ уверенный что первый почетный место коррупция держать милиционер таможенник второй судья прокурор только третий высокий федеральный орган власть где-то хвост плестись армия православный церковь 
18002	 суть распускать перед они хвост действительно пленять личный обаяние 
18002	 это когда прижимать хвост какой-нибудь демократический пташка тип нтв 
0	 все-таки кот хвост яблоко хвостик 
12982	 суп варить такой голова хвост воблин 
18002	 они увидеть скопление машина дорога слепить фара сзади быть загораться лес тогда они пойти снежный рукав между лес дорога довольно гордо знать вполне независимо даже некоторый достоинство хотя зажимать между нога хвост 
18002	 пока возиться кукла несколько раз хлестануть кончик хвост 
0	 усатый взять мой стакан выливать коньяк пол рубль сорок кот под хвост 
18002	 какой-то мудрый начальник считаться арестантский психология распоряжаться выдавать одновременно либо селедочный голова либо хвост 
18002	 полезть она потрогать хвост облезлый плафон заглядывать под 
18002	 вот какой ухо длинный хвост короткий охотник рассказывать какой песик 
18002	 переходить мягко шелестеть проворный греческий который каждый слово конец либо восхитительный лисий хвост либо залихватский притоптывание 
12982	 наконец хвост площадка это пустовать 
0	 сто год россия кот под хвост они слава советский людоед 
40730	 кто такой чтобы наступать хвост судьба 
40730	 обрубать хвост деепричастие выпалывать любимый слово 
0	 столько труд весь пес под хвост 
0	 заслуга мой перед музыковедение учитывать весь год преподавание кот под хвост документ куда-то затериваться 
0	 все понятно тяжело подумать шабанов день пойти кот под хвост свидетель потерпевший приходиться переписывать 
0	 сегодня познакомить этот журавлев что тянуть кот хвост денис оказываться симпатичный молодой парень 
18002	 переходить мягко шелестеть проворный греческий который каждый слово конец либо восхитительный лисий хвост либо залихватский притоптывание 
18002	 вообще-то непонятно чем они вызывать такой ненависть инженер потребитель все много прибор лишаться свой хвост 
18002	 персидский сирень лисий хвост розоватый пена раскаленный лазурь 
12982	 крейсер сплошной железо стальной море броненосец убивать крыса отрубать хвост десять 
18002	 обнюхивать вильнуть хвост досадливо убегать увиваться райский 
18002	 тот вереница бежать скрипучий телега как угорелый махать хвост немедленно признавать она свой 
18002	 если повилять перед они хвост выразительный пошевелить бровь 
12982	 крейсер сплошной железо стальной море броненосец убивать крыса отрубать хвост десять 
0	 быть полный расстройство казаться что весь труд целый месяц работа все кот под хвост 
18002	 глаша слабо вильнуть хвост ободрять неожиданный поддержка написать 
18002	 это точно особенно если пробка горка какой-нибудь зараза повисать хвост вплотную 
12982	 однажды петр кирюша все-таки отрубать хвост погружать тележка 
18002	 длина хвост значительно превышать половина длина тело 
40730	 обкорнанный ухо обрубать хвост сжинать взрыв мышца 
0	 ведь весь подпись новый круг собирать приходиться два неделя работа кот под хвост растяпа чертов 
0	 может под утро устраивать половецкий пляска весь измерение кот под хвост 
12982	 все дело что павлиний хвост предрассудок предубеждение общество 
0	 ладно стас быть тянуть кот хвост решать гуров 
18002	 хотеть убеждаться что нет хвост гуров 
12982	 потом чистить рачий хвост варить суп жарить 
40730	 ончик благополучно обзаводиться хвост проматывать дедушкинский стипендия развлечение 
18002	 образование ель лисий хвост больший длина чем сосна 
18002	 скорость рост ель способствовать защита хвоя агрессивный действие хорошо подтверждаться высокий значение коэффициент корреляция между длина лисий хвост прирост соседний ветка ель 
18002	 рисунок видно что чем мало длина прирост есть одногодичный хвоя тем много длина лисий хвост 
18002	 лисий хвост ель уфа встречаться исключительно 
18002	 сша основной запас сосредотачивать хвост разработка флюоритовый месторождение 
0	 хватить тянуть кот хвост сказать определенно купить 
12982	 вспоминать как такой стан голодный ребенок собирать колосок пшеница варить зерно каша воровать колхозный поле горох мама варить свинячить хвост суп 
0	 говорить что пока папаша зона весь его денежки спускать кот под хвост 
0	 несколько год напряженный труд пойти кот под хвост 
12982	 что быть скользить меж звезда волочить сиреневый скользкий хвост что становиться ясный морозный мой 
18002	 опускать голова поджимать хвост она собираться выходить 
12982	 суп бычий хвост тоже один такой этот 
18002	 партия власть строиться как раз расчет инерционный предвыборный сценарий теперь находиться ситуация пришивать кобыла хвост 
