0	 тянуть кот хвост препятствовать союз россия белоруссия 
18002	 мочь больше сопротивляться поднатуживаться завопить весь свой ископаемый глотка вытягивать шея опускать хвост прыгнуть высоко вверх 
18002	 российский бюрократия это собака единый россия хвост 
0	 декабрист вероятно разбудить герцен предварительно чуть выбрасывать кот под хвост успех русский оружие 
40730	 один они являться отработка техногенный месторождение флотационный хвост обогащение флюоритовый руда месторождение вознесенское 
18002	 все быть дорогой кавалер распускать хвост доказывать что нет ничто невозможный 
18002	 вместо глаз жаворонок вставлять ягодка черемуха или рябина иногда изюмина кусочек цукат либо зерно злак хвост клюв травинка тоненький 
40730	 кто наступать хвост стоять послушать сегодня целый 
0	 восемнадцать деталь пес под хвост что 
0	 весь этот год когда тетя рая рвать жила пес под хвост 
0	 выбрасывать пес под хвост буквальный смысл 
0	 весь день пес под хвост 
40730	 идти качаться она хвост судьба человечий 
0	 иначе труд драматург бутафор пес под хвост или это модерн 
0	 спускать пес под хвост случайный выигрыш мир припоминать неслучайный проигрыш 
18002	 длина колибри пчелка кончик клюв кончик хвост 
18002	 она хвост развеивать дымок подвывать заглядывать 
18002	 лот периодически исчезать потом внезапно появляться дрожать кончик хвост каждый раз вопрошать 
40730	 белый овчарка афган сжинать взрыв мышца вспышка сахарный кость пасть ловить иногда свой обрезать хвост лежать нога охрана 
18002	 длина тело этот животное длина хвост высота 
0	 старательный теперь весь пес под хвост этот фефа забирать 
0	 надо пнуть пес под хвост несколько год обучение педагогика вкупе 
0	 как будто три год обучение пес под хвост 
18002	 прочий мышевидный грызунов весь полевка отличаться очень короткий превышать половина длина тело хвост покрывать волос 
0	 поговорить хвост сказать андрей отрываться 
0	 пес под хвост мотор твой напряжение сила работать 
0	 так что весь твой переживание пес под хвост 
18002	 визуальный наблюдение ель уфа показывать что там лисий хвост встречаться значительно редко чем 
0	 россия вместе она весь свист лететь пес под хвост 
0	 все теперь пес под хвост пускать приходиться 
0	 столько труд план весь пес под хвост из-за что железка подминать 
0	 единственный выходной тот пес под хвост 
40730	 если кто-то наступать хвост такой мочь быть пора 
40730	 например вознесенский месторождение флотационный хвост обогащение ежегодно пополняться более 
40730	 второй этап организовывать извлечение бериллий возможно лития тантал хвост обогащение флюоритовый руда вознесенский 
40730	 поскольку основной объем отечественный запас бериллий заключать месторождение комплексный руда который бериллий являться попутный компонент некоторый добывать отрасль промышленность плавиковошпатовый редкометалльный вольфрам молибденовый оловянный хвост обогащение также скапливаться менее 
18002	 бывший ученица прасковья федоровна рассказывать один раз получать пятерка хвост вот какой иметь способность учиться 
0	 антон ехать петровка переполненный досада раздражение сам себя несколько час выбрасывать пес под хвост зачем ездить этот 
18002	 когда юродивый фома кончик крысиный хвост пощекотать арсения ноздря тот чихнуть 
18002	 что хвост приделывать этот животное 
0	 так любой тщательно разрабатывать план самый радужный надежда успех мочь полететь пес под хвост из-за один неучтенный деталь 
18002	 особь новооткрытый вид фото иметь длина кончик хоботок кончик хвост более полметра весить 
40730	 если кто-то просто хвост висеть быть 
40730	 если кто-то просто хвост висеть быть 
40730	 если кто-то касаться или пытаться обижать скат взмахивать длинный хвост колоть обидчик ядовитый хвостов 
40730	 если кто-то твой банда опять колокольчик мой хвост отвязывать три час вокруг 
18002	 сомалиец утверждать что передвигаться глубокий трава кабан кончик хвост чувствовать приближение опасность 
18002	 вот писать сам дрожать кончик ухо кончик хвост вдруг администрация решать что мой 
18002	 крючок хвост поведение животное никак влиять 
40730	 казахстан например реализовываться лениногорский проект предусматривать переработка хвост обогащение полиметаллический руда содержать 
18002	 достаточно заниматься физкультура кончик нос кончик хвост 
18002	 подтягивать под себя лапка прикрывать нос кончик полосатый хвост 
18002	 теперь все тело нос кончик хвост сиять изумительный ярко-зеленый цвет 
18002	 вероятно кличка она получать совершенно черный шкура без единый светлый пятнышко нос кончик хвост 
40730	 геолого технологический диагностика отходы рудый обогащение устанавливать что лежалый хвост мочь быть использовать 
