39939	 когда гиря падать винт приходить движение оба зеркальце 
39939	 отпускать гиря приводить движение зубчатый колесо винт 
17916	 вырастать расти гул рокот мотор винт 
16398	 все быть сильно удивлять что случаться огорчать что винт мочь состояться другой 
39939	 шум винт малый ход слышный быть 
39939	 два башка бултых винт поток 
39939	 этот момент издали раздаваться очередь вертолетный винт 
39939	 так предприятие народный комиссариат авиационный промышленность толкать винт срок поставлять мастерская 
39939	 система работа над который быть начинать еще год включать себя навесной гребной винт приводить движение вращение двигатель 
39939	 летний американский велосипедист дельтапланерист брайен аллен перелетать через ла-манш мускулолать летательный аппарат который взлетный разгон дальнейший работа воздушный винт обеспечиваться мускульный сила нога пилот 
39939	 вертолет отличие другой модель иметь шестилопастный винт новый газовый турбина оборудовать система 
16398	 похлопать себя поджарый ягодица быть винт 
17916	 этот винт относиться класс деталь представлять 
39939	 подходить она суд шум свих винт пугать кит утверждать координатор дальневосточный 
39939	 работа использовать содержать метамфетамин препарат винт получать эфедрин ханка 
39939	 такой препарат относиться винт жаргонный название наркотик стимулировать тип 
39939	 определение цитотоксический активность препарат винт ханка 
16398	 употреблять все что мочь доставать транквилизатор средство для наркоз амфетамин винт 
39939	 каравацкая играть современный мадонна девушка без твердый жизненный правило без винт 
39939	 кроме осматриваться цистерна главный балласт подводный лодка донный арматура цистерна надводный корабль забортный арматура подводный лодка руль линия вал гребной винт также другой устройство система 
17916	 рассматриваться вариант торможение посадка помощь винт подобный вертолетный 
39939	 флер взваливать винт плечо нести 
39939	 выходить склад поле зрение сторож механик взбунтоваться сбросить винт 
39939	 кость полина запрыгивать вертолет над который уже закручиваться лопасть винт 
39939	 капитан показывать также машинный отделение где полный темнота восемь тысяча отборный велосипедист сидеть специальный станок педаль приводить движение гребной винт 
39939	 закрытый кабина убираться шасси винт изменять полет шаг 
39939	 аня винт варщик приходиться вкус 
16398	 кто так узнавать ибо тот самый момент кубинский субмарина рубануть винт податлантический телефонный кабель 
39939	 пластиковый бояться коррозия корпус как нельзя хорошо подходить для мелкосидящий речной судно два гребной винт 
17916	 гул винт слышать или вернее угадывать 
17916	 врач одобрять конструкция быть изготавливать прикреплять его кровать должный быть постепенно закручивать винт 
39939	 живо дожидаться остановка винт попрыгать его грохотать чрево 
16398	 быть винт гораздо толстый оглобля установленный вертикально 
39939	 лопасть могучий винт вращаться быстро быстро 
17916	 понадобиться вырубать новый деталь подкручивать несколько винт подвижный элемент составляться 
39939	 женя николаев отставлять чай полезть наверх редуктор несущий винт осматриваться 
16398	 марья минт идти кухня враз все винт кочерга завинчивать 
39939	 хорошо различать кильватерный след славутич дорожка взбивать крейсерский винт вода теряться серый завеса 
16398	 они проезжать мимо дворец тот минута когда граф воронцов дашков кончать игра винт переходить графиня столовая 
39939	 окно медпункт быть видно как механика спешно сдирать чехол винт вертолет красный 
39939	 неисправный нет ресурс требовать ремонт замена редуктор втулка несущий винт правый двигатель 
39939	 самолет уже весь дрожать предстартовый возбуждение винт быстрый вращение растворяться 
39939	 четыре вертолетный винт вздымать воздушный вихорь оглушать треск 
16398	 они сказать что один дизель сходить фундамент это они беспокоить кто-то украсть винт стоянка 
39939	 игорь винт притяжение вопреки размышление багажный 
17916	 тот картина случай если оснащать поворотный винт или система отклонение реактивный струя 
17916	 когда быть нужда снимать мотор заключать винт она готовый можно 
39939	 при вертикальный положение ось туннельный винт осуществляться вертикальный взлет посадка 
39939	 самый дело руль такой суд ставиться гребной винт 
17916	 задний ролик шкив ведущий ремень передний эксцентриковый ролик винт крепление стенка крышка фильтр 
39939	 вовка слушать как магнитофонный лента трещать винт вертолет набрасывать нота 
17916	 они зажимать винт край раковина или 
17916	 там поворот обнаруживаться что похожий свойство электрический электронный явление позволять элемент сам электромир сооружать модель для поток вода для поток тепло для вращение винт для обтекание крыло 
39939	 два гребной винт который приводиться силовой установка мощность 
39939	 прогревать холостой оборот ловко включать винт совершать для успокоение заведовать несколько 
17916	 так год инженер английский фирма вуд компания уменьшать размер литой коробка считать что она прочность конструкция холловский якорь снижать отверстие для поддерживать болт сделать стопорный винт веретено над литой коробка 
39939	 песок ввинчивать девять винтовой свая диаметр винт четыре фут глубина 
39939	 песчаный коса два миля берег ввинчивать семь свая винт диаметр три фут глубина 
16398	 она все более напоминать теперь морской раковина винт сходить нет 
39939	 решать рубануть оно винт хвост 
17916	 установка съемочный камера бокс крайне простой сводиться закрепление адаптер бокс один винт надевание вал управление 
17916	 оба сторона корпус нижний его часть находиться два электродвигатель винт укрывать кольцеобразный насадка 
39939	 где-то над голова густо зареветь мотор весь усиливаться вибрация понимать что огромный винт вертолет набирать скорость 
39939	 она делать бесшумный шестерня подшипник пропеллер гребной винт 
39939	 туда надо держать решать карец шум винт заставлять настораживаться из-за остров 
39939	 винт вертолет вращаться горизонтальный плоскость 
17916	 для придание место склейка больший надежность стенка бокс стягивать винт 
39939	 здесь слышный дышать судовой машина или это лопасть винт вращаться холодный морской вода 
39939	 снабжать два вертикальный винт противоположный вращение 
39939	 фирма мольт тейлор построить серия двухместный подносный высокоплан аэрокар мотор лайкоминг вращать через удлинять вал толкать винт размещать оперение самолет 
16398	 вот пущина мелькать мысль порядок винт 
39939	 опыт винт рыкачев впервые подавать 
39939	 машина мгновенно останавливаться отзвук движение корабль ткачев улавливать ускользать казаться очень далекий шум винт подводный лодка 
39939	 оба корабль получать незначительный повреждение корма винт быстро исправлять макаров решать 
39939	 воздушный винт шуршать под мерный стук мотор 
39939	 оголять винт медленно хлестать вода видимо 
39939	 номинальный режим обмин номинальный режим винт обмин 
39939	 окружать беззвучие шум винт крик сирена вот 
39939	 жироплан брегэ снабжать два горизонтальный винт вращаться противоположный направление 
39939	 стрелять мотор сердито реветь винт корабль идти вверх крутиться 
17916	 читальня заходить редко главный образ для чтобы вздремнуть или подождать когда собираться партнер винт или преферанс 
39939	 из-за мелководье болото малайзия потребоваться заменять винт водомет 
39939	 глыбин лежать вода бок плашмя вода возле они ходить винт 
39939	 артемка муж всяко надо еще наверное насоветовать винт как минимум под 
39939	 когда возвращаться парковка она вдруг увидеть жирный плыть блеск винт кукурузник из-за который наплывать очкастый 
39939	 этот день экспедиция поступать сообщение эбелях что проходчик шныри попадать под винт вертолет получать смертельный травма 
39939	 небольшой диаметр высокооборотистый винт создавать горизонтальный тяга одновременно 
39939	 перевод плита другой вид газ осуществляться замена сопеть винт малый пламень газовый служба 
17916	 вставлять заготовка гибка равнять прочерчивать линия край фаска затягивать винт 
17916	 вставлять заготовка гибка равнять прочерчивать линия край фаска затягивать винт 
16398	 волкодав только тускло отмечать про себя что старый сегван вот кто быть мореплаватель прирожденный подтаскивать подветренный борт косатка дабы возможность мало замарывать славный корабль все венн как-то умудряться наваливаться грудь бортовой доска увидеть совсем близко вздыматься зеленый вода строгий лад этот движение его кишка окончательно скручиваться судорожный пульсирующий винт тугой ком устремляться через 
39939	 инкубация кислый раствор винт приводить более быстрый снижение 
39939	 при исследование препарат винт использовать как свежеприготовленный препарат 
39939	 вскоре откуда-то сверху ударять два яркий луч пронзать мрак туман они высвечивать поляна рядом причал стоять повисать винт вертолет звезда борт 
39939	 шум винт изменяться машина пойти снижение 
39939	 полупрозрачный блюдце килевой винт тянуть хвост сторона разворачивать 
39939	 удар борт фрегат нос рубка скорость узел узел равняться приводить повреждение легкий корпус лодка ограждение рубка правый руль фрегат получать крупный вмятина трещина переборка повреждение винт 
39939	 винт международный аэропорт кеннеди совершать 
39939	 докуривать давидофф швырнуть окурок корма вспенивать мощный винт теплоход вода 
17916	 если вдруг чей-то доброта обломиться шаровой винт или героин надо иметь 
16398	 рейка соединять оба часть устройство быть прямой полукруглый еще щель винт так что один планка 
39939	 еще брат райт устанавливать свой первый самолет винт противоположный вращение цель устранение 
39939	 потом быть еще кадр вертолет над море винт отрубать специальный патрон превращать 
39939	 основа математический вычисление экспериментальный данный получать аэродинамический лаборатория политехнический институт ботезат называть такой интегрировать метод эмпирико теоретический быть давать характеристика режим работа винт определять выгодный условие работа 
39939	 кстати прощать мусульманин так происходить вертолетный винт тот крест 
39939	 делать шаг бедный мой голова винт вращаться рушиться 
39939	 мина взрываться прикосновение корпус лодка антенна вид идти мина длинный металлический усик сотрясение сеть взрывной механизм программироваться так чтобы срабатывать шум винт магнитный поле корабль 
39939	 непрерывно поступать доклад гидроакустика шум винт все сильно цель быстро приближаться 
39939	 винт получать прокатка винтовой калибр 
39939	 ведь известный случай когда рыба меч нападать судно проживать обшивка корпус кит ломать гребной винт современный китобойный суд 
17916	 узел управление объектив кинокамера киев мочь быть значительно упрощать ввиду возможность крепление шкив объектив винт 
39939	 вода быть необычайно прозрачный хорошо виднеться винт корабль находиться 
39939	 торпеда взрываться быть уходить когда услышать шум винт вражеский лодка 
39939	 кроме хвостовой винт потреблять значительный мощность двигатель 
17916	 материал который изготавливать весь конструкция латунь для винт винидур текстолит для каркас 
39939	 отпускать проводник лошадь даяр переночевать лагерь утро странный насекомоподобный машина завертеть огромный лопасть винт повисать над инд неторопливо 
39939	 ткачев понимать что подводный лодка услышать прекращение работа винт над себя тоже застопоривать 
39939	 полтора четверть хвост голова винт идти еле выволакивать 
39939	 под они впереди крутиться теневой диск видимо воздушный винт 
39939	 крайний его короткий мачта мощно реветь вертикальный винт давать опускаться 
39939	 лось замечать что кроме шум винт посвистывание ветер крыло 
39939	 равнодушие японец шум винт ровный сильный звук колокол все 
39939	 чтобы летательный аппарат мочь подниматься вертикаль необходимо снабжать подъемный винт вращаться горизонтальный плоскость 
17916	 без этот винт нельзя быть собирать этот станция 
39939	 конец кренить самолет отдавать уже реветь винт рябить вода помогать лодка 
39939	 пока монтевидео чистить винт вода серебряный река опускаться 
17916	 перед работа этот винт следовать завертывать корпус 
39939	 усиливать новый винт аэродинамический особенность давать прирост 
39939	 комплект сопеть винт малый пламень поставляться требование 
17916	 затем вставлять заготовка гибка равнять прочерчивать линия край фаска затягивать винт фото 
39939	 толкать винт погубить баринов быть заменять тянуть 
39939	 подниматься винт ветер взбаламутить туча песок 
39939	 летчик мочь увеличивать тяга увеличение шаг винт варьировать поворот его лопасть 
39939	 исследование ботезат теория воздушный винт кроме уже отмечать публикация 
39939	 придавать ствол необходимый угол возвышение артиллерист вращать вертикальный винт устанавливать станина соединять 
39939	 шум винт едва слышный фон налетать 
39939	 через четверть век американец потратить немало время пытаться вырабатывать тюлень условный рефлекс звук работать винт подводный лодка 
39939	 звук его почти заглухать весь натужно дрожать когда оседать корм винт забуриваться глубоко лодка трудно взбираться 
16398	 хвост убивать вдевать быть петля затягивать нос наш катер огрузнуть так что винт жужжать над вода 
17916	 известный сейчас тот винт гайка который образовывать механизм 
17916	 один этот кристаллический форма нельзя объективно относить правый или левый как это можно например сделать случай винт или спираль тот время 
39939	 видеть как впереди над машина огромный винт свиваться белый пламень 
39939	 свет горячий ветер косо скользить чайка ровный шум винт взбивать зеленый пена создавать ощущение 
17916	 помощь этот винт происходить погружение подводной судно 
17916	 указывать тогда грацианский что страшиться будущее наследник свой человечество никогда смочь отказываться архимедов винт или менделеевский таблица 
39939	 опускать винт предохранительный решетка зоолог скворешня 
39939	 состав кроме перечисленный входить оао корпорация воздушный винт оао нпо сатурн оао топливорегулирующий 
39939	 перед установка плита проверять соответствие сопеть винт малый пламень пробка кран 
17916	 сотый раз подтягивать этот винт ивашников подумать что многие 
17916	 перед отцепка прицеп шаровой головка винт вставляться гнездо застопориваться 
17916	 затягивать винт наводка резкость анна ахматова 
39939	 все высаживать голодать далеко машина поставлять под охрана советский солдат тот пора пока подвозить для ремонт замена новый винт 
16398	 так что один лишь беглый перечисление таинственный винт гвоздь шляпка мало 
