17916	 световозвращатель освобождать винт гайка помещаться между спица 
39939	 еще немного могучий сила мотор погасать бешено крутиться воздушный винт останавливаться воздушный корабль беспомощно 
16398	 когда пьер после дуэль долохов разрыв элен сидеть торжок почтовый станция ничто мочь понимать знать для что жить что быть жизнь что смерть как будто всегдашний свой привычка находить вот только что это место поэтому цитировать буквально как будто голова его свернуться тот главный винт который держаться весь его 
17916	 если мгновенный рывок винт кипеть небесный струя переноситься 
39939	 муж сегодня предлагать оплачивать фактический время прогрев двигатель остановка воздушный винт 
39939	 муж сегодня предлагать оплачивать фактический время прогрев двигатель остановка воздушный винт похоже 
39939	 нико лаич однако руководство компания быть вполне компетентный достаточно прозорливый если накануне великий кризис потрясать весь капиталистический мир сикорский авиэйшн корпорейшн июнь входить качество филиал мощный юнайтед эркрафт энд транспорт корпорейшн интерес который распространяться производство самолет двигатель воздушный винт также эксплуатация авиалиния 
17916	 нужно лишь просверливать нарезать для крепежный винт отверстие его горловина 
17916	 благодаря сдвиговый сила передача практически отсутствовать люфт поэтому выдерживаться высокий точность взаимный перемещение винт гайка 
17916	 отвертка просверливать ручка отверстие под вороток помогать выкручивать присыхать или приржаветь винт шуруп 
17916	 помощь удаваться разбирать резьбовой соединение прикипать винт гайка 
39939	 объект испытание служить дирижабль оснащать два электромотор приводить движение винт 
39939	 склоняться над окуляр медленно вращать черный винт машина еще один 
16398	 кто спорить издатель автор книга джейсон эпштейн против вице-президент компания винт серф 
16398	 рано хоть винт быть сейчас туда чуть 
16398	 видеть только что мамаша маргарин голова уже давать винт 
39939	 давать попробовать спокойно разбираться что реально давать соосный схема несущий винт точка зрение летчик 
39939	 время боевой действие чечня стрелковый оружие земля вертолет поражаться центральный часть фюзеляж случай несущий рулевой винт случай лишь 
39939	 отсутствие трансмиссионный вал большой длина промежуточный хвостовой редуктор рулевой винт должно страховать такой беда 
39939	 тяга для движение создавать маршевый винт 
39939	 вертолет выполнять соосный схема два трехлопастный винт 
39939	 несущий система включать два соосный расположенный трехлопастный воздушный винт 
39939	 силовой установка включать два турбовинтовой двигатель рот компания пратта энд уиттни пятилопастный винт изменять шаг 
39939	 основной тактико-технический характеристика бла размах крыло площадь крыло длина высота диаметр винт масса пустой 
39939	 отсутствие рулевой винт сказать карен 
39939	 новый легкий многофункциональный вертолет выполнять фирменный камовский схема соосный винт два двигатель октябрь 
39939	 основной особенность машина являться отсутствие хвостовой винт модульный компоновка 
39939	 обеспечиваться флюгирование противообледенительный система воздушный винт термоэлектрический автономный 
17916	 гайк прижимной винт регулировочный рукоятка 
17916	 выворачивать регулировочный винт снимать резиновый подпятник 
17916	 крепиться соковыжималка крышка стол или доска прижимной винт 
39939	 модификация являться оригинальный вариант поскольку она вместо привычный рулевой винт для компенсация разворачивать момент использоваться 
39939	 быть устанавливать мощность квт пятилопастный несущий винт образный оперение машина 
39939	 именно она резко экономить взлетный вес вертолет счет отсутствие хвостовой винт весь трансмиссия обеспечивать работа 
39939	 рассматривать различный система спасение экипаж милевец отказываться катапультирование отстрел лопасть несущий винт устанавливать 
17916	 она устанавливаться истребитель истребитель быть укреплять четыре такой пушка стрелять через трехлопастный винт 
39939	 обнаруживать рулевой винт трещина потенциально мочь приводить 
39939	 последний раз этот мера быть вызывать обнаружение трещина втулка рулевой винт 
39939	 вертолет иметь складываться хвостовой балка лопасть винт что позволять перевозить 
39939	 время один они октябрь год вертолет перевертываться из-за неисправность опора хвостовой винт игорь иванович труд 
39939	 внутри шар наполнять гелий колесико при близкий рассмотрение оказываться лопасть воздушный винт 
17916	 мария выбирать нужный она отвертка надевать рукавица откручивать винт крышка распределитель зажигание открывать 
17916	 это особенно приятно лежать ложе который винт выскочить пружинка который иметь тенденция 
39939	 работа использовать жидкий препарат винт содержать 
17916	 далее расстопорить винт механизм выверка вращение крышка 
17916	 далее расстопорить винт механизм выверка вращение крышка 
17916	 необходимый поджим проволока проход под ролик обеспечивать регулировочный винт 
17916	 отдельный пластиковый коммерческий экземпляр или деревянный военный щечка рукоятка крепиться винт каждый сторона рамка 
16398	 винт громко сказать дождаться сигнал 
17916	 под корма самоходка чернеть вырубать пешня прорубь для винт 
39939	 поэтому вводить иной показатель мощность вал быть выдавать двигатель для полезный работа движение колесо винт 
39939	 рулевой управление тип винт гайк требовать активный работа даже 
16398	 правда винт верстальный машина быть 
39939	 принцип действие тот получать при сгорание керосин газ под давление подаваться лопатка турбина который приводить движение гребной винт 
39939	 при удар хвостовой винт бибигонов вертолет быть вырывать основный 
17916	 для снижение потеря трение для облегчение вращение между винт гайка предусматривать специальный канал 
39939	 грохот винт усиливаться вертолет начинать набирать высота 
17916	 вызывать доверие зажимной винт резьба который легко сворачиваться 
16398	 садиться кровать разглядывать жеваный сорочка брюки винт нога тоска 
17916	 каждый пара изображать два половинка мостовый пролет который должный соединяться при помощь поцелуй это называться всаживать винт суматоха николай протискиваться 
16398	 так сказать что все поверять менее сперва неохотно потом разгораться прочитывать лекция меч сакральность они даже сексуальность ведь умирающий роланд меч свой называть вдовица что касаться этот обломок стальной изготавливать особый технология железный прут выжигаться углерод прут затем коваться скручиваться винт расплющиваться снова бросаться 
16398	 как знать каждый хитрый задница свой винт находиться потом старик трегубец 
16398	 хитрый жопа быть винт кыся 
17916	 накал три накал три голубь орать штурман стараться перекрывать голос шум мотор винт 
16398	 капитан майор мой ксива видеть так что мочь учудить майор винт 
16398	 касса наш быть винт валюта брюлика разный цацка 
17916	 при сборка электронасос винт плотно затягивать для предохранение 
16398	 играть время прием основной так называть коммерческий игра пикет винт покер вист 
16398	 владимир коккинак говорить страшно летать потому что винт перед нос вращаться 
17916	 слово размер сатанеть болт винт 
39939	 преимущество боевой живучесть обеспечиваться отсутствие рулевой винт его привод поражение который 
16398	 игра тоже быть три просто игра рулетка редко винт покер любовь политика 
16398	 мнение родич этот хитрость унаследовать свой отец раввин ария левинский весь страшный кременчугский погром просыпать диван гостиная полицмейстер чертов чертянко после тридцатишестичасовой королевский винт 
39939	 что преимущество соосный схема который оказываться зуб никто кроме камовец перед заполонять мир вертолет хвостов винт 
39939	 соосный схема это скоростной набор высота устойчивый поведение предельно малый высота невозможный для машина хвостов винт маневренность самолетный легкость управление 
39939	 практически каждый журнал выставочный проспект размещаться реклама создавать западный фирма тяжелый транспортный боевой самолет который быть оснащать экономичный турбовентиляторный двигатель шестилопастный винт композитный материал 
17916	 укрепляться лоб больной соединяться при помощь система винт шнурок ухо 
39939	 выполнять машина традиционный для камовец соосный схема быть иметь два несущий винт один ось вращаться 
17916	 при измерение конический ножка штангенциркуль плотно вводиться углубление торец марка штырь строго перпендикулярно торец стопорный винт закрепляться движок сниматься отсчет 
16398	 первый что замечать быть массивный медный ручка вырывать мясо парадный дверь болтаться один винт 
39939	 выполнять схема уток оснащать двигатель толкать винт также его вариант 
39939	 конец год наш столетие ограниченный возможность воздушный винт вызывать трудность решение проблема 
39939	 нужно замечать что интерес соосный воздушный винт проявлять столько год сколько 
39939	 георгий александрович заниматься дальнейший исследование область теория воздушный винт начинать россия 
39939	 винт вертолет превращаться прозрачный круг 
39939	 последний случай гарантировать высокий проходимость так как движитель являться колесо воздушный винт 
16398	 быть молоков совсем старый обшарпывать унылый вяло бурлить винт дышать гудеть 
39939	 винт почти затенять фюзеляж позволять 
39939	 при работа винт самолет топливо тратиться 
16398	 уже знать что этот посудина устойчивый что волна парус иметь преимущество перед винт что море обнаруживать такой 
17916	 полк устанавливать четыре длинный винт два каждый сторона 
39939	 интенсивный поток воздушный винт обдувать вертикальный оперение заметно повышать 
16398	 что списывать подбирать свалка что иван ильич заказывать точить винт москва 
39939	 акустика докладывать слышный шум винт большой корабль 
17916	 сколько дно ценность отвертка ключ винт капот сам мотор лодка бутылка 
39939	 как впечатлять успех цаги намного превышать все официально зарегистрировать рекорд высота конструктор убеждаться машина недостаточно устойчивый что органически присущий аппарат жестко прикреплять втулка лопасть несущий винт 
39939	 трансмиссия система управление так связывать несущий рулевой винт что доля потреблять они мощность 
16398	 как говорить наш время винт 
39939	 проводить разведка вертолет мятежник обстреливать вертолет пуля попадать хвостовой винт вертолет после это вертолет уничтожать 
16398	 другой гидроцикл роль движитель играть винт водяной колесо французский 
39939	 совсем недавно год финский крестьянин шиир снабжать конструкция воздушный винт 
39939	 неприметный чуть высоко колено рост что-то похожий гребной винт небольшой корабль 
39939	 появляться аэросани воздушный винт изготавливать металл 
39939	 ферма смонтировать силовой установка сильный двигатель винт изменять шаг крыло позаимствовать 
17916	 она помощь пропустить через каблук винт крепить фиксировать обычный гантель 
39939	 воздушный винт сочетание воздушный подушка 
39939	 вместе однокашник построить авиетка толкать воздушный винт 
39939	 воздушный винт толкать пилот сидеть впереди 
39939	 скорость судно регулироваться количество оборот гребной винт если она ниже 
17916	 таков прикреплять шнек нижний часть рама экскаватор жестко помощь регулировать винт 
17916	 предварительный положение определяться передвижение гайка винт 
39939	 вес самолет при это мощность поршневый двигатель винт регулируемый шаг квт 
17916	 при желание можно далее усовершенствовать прибор заполнять компас спирт что повышать устойчивость стрелка отверстие корпус после заполнение заглушать небольшой винт прокладка 
39939	 замена громоздкий гребной колесо винт сразу придавать стремительность корабль 
39939	 сразу завращаться шесть воздушный винт первый самолет затем 
17916	 расстояние между они меняться передвижение ползун укреплять винт ключ 
39939	 орлеан толкать воздушный винт специалист единодушно приходить 
16398	 как говорить теперь авиация винт 
39939	 заявлять что если якорь ввинчивать помощь рычаг грунт несколько фут попытаться вырывать приходиться прикладывать сила который быть способный вытаскивать масса грунт составлять обращать конус диаметр основание который равный диаметр винт 
16398	 выпивать закусывать поздравлять новорожденный царство небесный садиться играть винт сдавать лев толстой каждый 
39939	 через радужный похожий крыло лететь стрекоза круг винт быстро приближаться земля 
16398	 взвизгивать цензор так что ржавый винт снова вонзаться андрей затылок 
39939	 супертанкер устанавливать турбина мощность гигантский гребной винт помещать направлять насадка вес 
17916	 вращение рукоятка винт планк шарик сжиматься словно 
17916	 предлагать например изготавливать кусок рельс двухзаходный винт гайка диаметр миллиметр 
16398	 однако изобретать она быть для нужный действительность лишь тот кто быть винт болт или шуруп 
17916	 если вторичный давление нужно увеличивать винт вращать вправо если следовать 
17916	 фотоаппарат крепиться кронштейн крышка один винт выниматься бокс вместе 
39939	 парус весло механический крыло винт приводить движение мускул пассажир 
39939	 главное назначение окраска запасной часть двигатель вспомогательный механизм якорь гребной винт также различный дорогой прибор 
17916	 макровизир это раздвижной рейка который укреплять нижний крышка фотоаппарат специальный винт этот 
17916	 причем через пенопластовый вкладыш соответствующий место делаться сквозной отверстие который пропускать стягивать винт проходить левый накладка 
39939	 винт заверещать громкий вертолет развертываться борт 
17916	 обувь помещать жестяной коробка прокладка чтобы болтаться при транспортировка закрывать герметичный крышка винт 
17916	 деталь этот материал скреплять винт болт заклепка склеивать между себя 
17916	 дозатор включать себя поршень регулировать гайка настроечный винт запирать конус уплотнение отсекать поршень 
39939	 техника кавитация доставлять немало хлопоты из-за она катастрофически быстро разрушаться лопасть турбина гребной винт гидротехнический сооружение 
17916	 запрещаться нарушать пломбировка заправочный штуцер также регулировочный винт пусковой тепловой реле 
39939	 публиковать статья метеорология обрушиваться полемический брошюра ученый который его мнение увлекаться математический теория искажать физический картина мир изобретать волноход использовать энергия волна проектировать станция для испытание воздушный винт принимать участие работа русский 
39939	 как его предшественник вертолет выполнять соосный схема иметь два несущий винт располагать друг над друг который 
