20531	 жена человек без мечта что птица без крыло 
31524	 обращать внимание низкий для иномарка цена расходный материал технический обслуживание некоторый деталь евро первый третий передний крыло или половинка задний 
19801	 между точка конец крыло самолет возникать небольшой разность потенциал 
35257	 самарский ростовский область это регион где традиционно сильный правый крыло политический спектр 
35257	 подчеркивать без известный факт партийный принадлежность задержанный коданев иметь никакой отношение официальный партия либеральный россия входить другой крыло финансировать борис березовский 
31524	 сюда входить нижний часть правый задний крыло 
31524	 подобно как борт сходить стапель новый судно разбивать бутылка шампанское передний крыло один машина глаз 
20531	 быть ощущение что расправляться крыло паря как птица 
19801	 это правильный подход когда один производитель делать кабина самолет другой заниматься хвост третий разрабатывать крыло говорить филипп камю 
20531	 при это видный быть что елена прежде никогда замечать хвостовой оперение пролететь птица вставать почти вертикально заострять конец крыло опускаться книзу спичечный темно-серый ножка 
0	 дым рассеиваться уже комнатный табачный пороховой пушечный ветряной мельница махать крыло дом малый морской 
0	 генерал бенкендорф сидеть конь смотреть как махать крыло ветряной мельница 
0	 возвращаться война боевой генерал боевой конь ветряной мельница махать крыло дорога приключаться случай 
0	 если фалльский замок украшать горельеф молодой бенкендорф освобождать голландия наполеонов ярмо если фалльский парк вращать крыло голландский мельница копия праздный 
20531	 как раз большой белый птица черный шапочка свинцовый серый крыло пролететь прямо над они 
20531	 больной птица наоборот малоподвижный перо она взъерошивать крыло слегка опускать голова прижимать 
20531	 голова мой махать ухо как крыло птица 
20531	 выше трепетать крыло словно настоящий птица ярко раскрашивать 
20531	 вроде вколачивать каблучок гроб свой калека жизнь сам как птица бить крыло чтоб отлетать 
20531	 какой-то крупный птица махать крыло тщетно силиться лететь против ветер 
19801	 рухнуть мой надежда начинать свой путевой записка как-то необычно свежо например описывать полет над океан улыбка стюардесса спасательный жилет огонь город под крыло самолет едко высмеивать деление внутри 
19801	 под крыло самолет плыть красноватый земля 
20531	 как уметь они передавать мягкость пух райский птица мелкий чешуйка крыло колибри светоносность изумруд бронза 
36977	 множество окно здание этот выглядеть фестончатый как крыло стрекоза 
19801	 бензовоз отъезжать из-под крыло самолет винт самолет начинать медленно 
19801	 видный серый коробочка дома прямоугольник огород они скользить уходить под крыло самолет 
19801	 вот лес дрогнуть поползти под крыло самолет 
29548	 даренский быть известный карта событие происходить только южный крыло сталинградский фронт 
20531	 труд пробираться сквозь заросль наполнять крик птица шелест бесчисленный количество крыло 
20531	 март новый платок рука который неведомый птица распускать крыло хвост играть весь цвет 
20531	 открывать книга лежать ночной бабочка острый блестящий крыло 
20531	 быть тут еще какой-то птица небольшой серенький они держаться поодаль либо тоже что-то искать земля либо чиститься распускать веер крыло 
20531	 черный птица длинный бесшумный как кошка косо пронестись мимо они широко махать крыло 
20531	 соседний комната вылетать большой темный птица тихонько задеть крыло лысина буфетчик 
20531	 вдруг увидать белый птица она чуть наклонять крыло лететь над море 
20531	 особенно любить смотреть как время метель лететь сквозь снег опускаться земля птица они складывать вновь раскрывать крыло точно хотеть расставаться 
20531	 давно уже верить бог ангел зрительный представление небесный сила сохраняться детство думать что этот крылатый красивый человек лететь садиться так как птица они должный быть делать быстрый движение так как такой взмах крыло свидетельствовать суетливость 
20531	 птица трагически свистеть крыло носиться тоска они 
20531	 слышно кухня вспархивать шуршать крыло залетать птица вправо-влево вдруг 
20531	 сколько раз хотеть собирать ребенок твой как птица собирать птенец свой под крыло захотеть 
0	 пригорок маленький восьмикрылый мельница лениво махать кургузый крыло 
0	 обалдуй подпрыгивать кверху залепетать замахать рука как мельница крыло моргач ковылять подходить яков 
36977	 для школа быть удобно два крыло каждый этаж там класс 
35257	 левый крыло политический спектр давно хотеться 
35257	 тогда это оказываться невозможный видимо из-за противоречие условный либеральный силовой крыло власть 
29548	 через несколько час выясняться что сообщение армейский корпус ошибочный приказ охватывать крыло быть отдавать поздно корпус опять 
29548	 пока армия эверт плева упорно обороняться левый крыло фронт происходить менее знаменательный 
29548	 счастие правый крыло сентябрь сила гвардия 
29548	 один сторона два русский армия большой потеря быть вытеснять восточный пруссия другой южный крыло австро венгр понести еще большой 
29548	 этот время брусилов фактически игнорировать успешный развитие операция левый крыло свой фронт именно наступление 
36977	 переезжать далеко потребоваться соседний крыло тот здание 
35257	 нельзя критиковать путин что недостаточный патриот недостаточный националист потому что болтать делать политический акция этот крыло серьезный подрастать правда чтобы входить 
35257	 судя все процесс размежевание антинациональный крыло элита продолжаться 
35257	 речь идти чтобы постепенно течение несколько год включать умеренный она крыло система политический власть 
35257	 путинский элита формироваться сеть личный доверие силовик друг земляк президент либеральный крыло доставаться наследство 
29548	 февраль март год левый крыло ударный армия вести 
35257	 они ставленник называть нынешний президент махмуд ахмадинежад который только свертывать весь демократический преобразование инициировать либеральный крыло аятолла при предыдущий президент мухаммад 
19801	 или метель аэродинамика метельный перенос заниматься еще николай жуковский тот самый который сформулировать теорема подъемный сила крыло самолет 
35257	 так новый глава провинция луксор становиться адель асад мухаммед аль хайят один руководитель партия созидание развитие политический крыло группировка аль гамаа аль исламия 
31524	 если какой-либо они можно снимать машина как например капот или дверь облегчать самый процесс нанесение рисунок платить оформление приходиться маленький чем пример задний крыло или стойка 
31524	 если окраска подлежать весь борт капот или передний крыло автомобиль вряд это 
36977	 окно два параллельный крыло даса торчать человек правый корпус 
36977	 интересно что совсем рядом через дом пара десятилетие располагаться писательский организация проспект ленин второй этаж правый крыло 
0	 говорить мочь только шипеть махать рука как мельница крыло 
19801	 эксперт разумеется польский находить тротил нитроглицерин пассажирский сидение место соединение крыло самолет фюзеляж 
19801	 тетя наташа расставлять рука как крыло самолет протяжный 
36977	 олег поинтересоваться что означать услышать что все просто сведение находиться двенадцатый этаж правый крыло сектор отдел зал 
36977	 планировка позволять гость чувствовать себя максимально автономный можно снимать этаж или крыло вообще встречаться 
35257	 партия власть уже даже начинать отрастать крыло праволиберальный социал-демократический консервативный 
0	 во-вторых крыло ветряной мельница всегда крутиться 
19801	 под крыло самолет что-то петь зеленый 
31524	 потом выменивать трещотка для велосипед подвешивать крыло колесо велосипед ход 
35257	 последний четыре год оранжевый акция приобретать популярность среди либеральный оппозиция молодежный крыло 
29548	 чингиз хан левый крыло свой армия называть джунгар 
36977	 сторожев уже крепко стоять нога купить целый крыло двухэтажный старый здание 
36977	 персонал закреплять разный крыло здание запрещать меняться 
19801	 даже авиастроение находиться место плесневой гриб при участие изготовлять смесь защищать крыло самолет обледенение при взлет 
19801	 крепко уже поездить страна мочь сказать что жизнь россия сравнимый стояние край пропасть когда вытягивать шея вглядываться падение тот время пятиться простой грунт высота шесть фут три дюйм неведомый родина дышать под окно квартира великий пустошь тянуться тысяча миля под крыло самолет жить 
35257	 только историография ряд партийный документ под влияние либеральный крыло фактически происходить реабилитация реформаторский 
35257	 анархо-синдикализм пытаться было возрождать оживлять коллективность тип средневековый корпоративный цеховой они быстро инкорпорироваться система либо как подсистема самый государство советский фашистский вариант либо через аффилиация разный политический партия иногда через создание собственный классический пример английский лейборист политический крыло тред-юнион 
0	 брат мой детство мой уходить как сказка грустный сниться его старый мельница шесть крыло как шесть огонь 
36977	 машина занимать весь первый этаж подвальный помещение левый крыло институт который быть организовывать постановление 
19801	 приблизительно так размышлять когда авиалайнер компания люфтганза отрываться взлетный поле франкфурт-на-майне под крыло самолет поплыть сначала ухоженный немецкий 
19801	 угол атака угол между некий условный линия например хорда крыло самолет направление скорость встречный 
29548	 предпринимать собственный инициатива наступление берлин серьезно ослаблять левый крыло украинский фронт 
31524	 нижний сторона задний крыло калиго большой темный очень 
31524	 джунгли юго-восточный азия дом бабочка напоминать громадный тройдес бархатный черный золотой задний крыло 
31524	 когда тройдес лететь вдоль плотный зеленый стена тропический лес его ярко-желтый задний крыло казаться гореть лампочка 
36977	мельница уже работать она быть крыло самый верхний этаж 
35257	 руководство легализация левый эсер являться лидер легалистский крыло партия начало 
29548	 после капитуляция армия генерал-фельдмаршал паулюс конец зима складываться сложный ситуация для германский армия весь южный крыло восточный фронт февраль сообщать 
31524	 причудливый изогнутый край передний крыло форма рисунок напоминать 
35257	 рука сечин видеть уголовный преследование генерал госнаркоконтроль александр бульбова заместитель министр финансы сергей сторчак цель ослабление позиция либеральный крыло соответственно руководитель госнаркоконтроль виктор черкесов 
31524	 ударять опель задний крыло рикошет отскочить вправо ударять 
35257	 тот вечер терраса дом волошин поэт юморист либеральный крыло лодик ахнов спеть только что 
35257	 литературный круг либеральный крыло гулять веселенький разговор скоро мол 
35257	 творческий публика пойти выход либеральный крыло идти негромкий разговор что все 
35257	 слева кадет складываться пестрый группа называть себя трудовой партия небольшой правый крыло составлять умеренный либерал союз 
35257	 депутат под крыло либеральный союз освобождение образовывать совет 
36977	 описание этот дом впервые встречаться геркенс год это приятный дом итальянский стиль два этаж крыло построить немалый расход однако 
19801	 так прототип стратосферный дирижабль форма напоминать крыло самолет 
19801	 партнер связист выступать фирма который работать над создание дирижабль нетрадиционный форма напоминать крыло самолет 
19801	 там возникать сплав серия частность сплав полный аналог наш сплав нагрузка который испытывать крыло самолет неравноценный если верх 
31524	 закрытый вариант быть лишать деревянный отделка салон передний крыло нести запасной колесо что 
31524	 граф иметь свой роскошный автомобиль москва демонстративно раскатывать бронированный американец нацистский флажок передний крыло 
0	 дорога круто свертывать влево шпиль королевский усыпальница аббатство сено дени скрываться лес мельница монмартр последний раз прощально взмахивать крыло тоже пропадать 
31524	 потом спрыгивать сосредоточенно изучать толстый ребро протектор большой задний колесо становиться ось обжигать ладонь касаться высокий выкрасить синий краска крыло 
35257	 год мельгунов вступать партия народный свобода кадет где примыкать левый крыло 
36977	 снимок гостиница который сегодня после снос отстраиваться заново хорошо видный архитектурный различие крыло здание 
0	 сам рост мало кнут туда вертеться крыло мельница жизнь переходить совершенно 
35257	 правый крыло республиканский партия сша обвинять 
19801	 береза пружинить земля бешено срываться из-под забирать подбородок коленка мчаться напор рушиться куда-то вниз как из-под крыло самолет при отрыв бежать 
31524	 однако передний крыло агриппина довольно узкий задний 
31524	 недавний время атлас очень широкий передний задний крыло считаться сам крупный бабочка мир 
19801	 пока пересекать она конец конец под крыло самолет почти четыре час тянуться 
19801	 подлет харьков крыло самолет подниматься вверх смыкаться 
19801	 так она твердить себя между чудище ревность ложиться крыло самолет смотреть она 
19801	 але вериться что барселона исчезать проваливаться под крыло самолет 
36977	 впереди виднеться громадный здание странный вгибать форма один крыло который быть наполовину снести 
19801	 костер крыло самолет получаться высокий ясный мрак 
0	 вздыхать полный грудь блаженно посмотреть вдаль где застыть крыло старый мельница 
31524	 сильно левый передний крыло приминать изрядно выправлять его серебров 
31524	 успевать переводить дыхание хоть немного увеличивать скорость как получать мощный удар задний крыло 
31524	 подразумеваться что данный тип крыло наряду более широкий колесо 
31524	 ремонтировать предстоять передний крыло любой проверка сразу заинтересовываться мочь 
31524	 неприятно что при крен кузов задний колесо задевать отбортовка крыло 
31524	 эрл тщательно срисовывать облицовка радиатор линия передний крыло 
31524	 младший брат кадиллак обязательно стоять колесо проволочный спица запаска размещаться передний крыло это быть стандартный оборудование 
36977	 таня ягун заканчивать расселять команда магфорд правый крыло жилой этаж 
31524	 колесо нештатный меньший вылет торчать из-под крыло полтора два раз снижать 
36977	 жить также второй этаж противоположный крыло 
