19801	 особенность структура воздушный сила тихоокеанский флот являться что состав акр рэб самолет выделяться эскадрилья состав авианосный крыло для несение боевой служба 
35257	 спортивный общество крыло совет инфизкульт москва 
19801	 декабрь год начинаться пропагандистский тело радиовещание ирак борт самолет зоя коммандо соло состав авиационный крыло командование сила специальный операция ввс 
19801	 может нести три дополнительный топливный бак два подвесной под крыло один кабина что 
19801	 устремляться вслед голубковский недоверчивый деверь может шурин забывать который сидеть сидень майка мрачно пить водка видимо рубашка уже пропивать упорно отказываться взять деньги валяться буквально под нога запиливать жена конец конец плюнуть относить весь свой достояние близкий отделение ммм под сень бабочкин крыло 
19801	 наполеон ноябрь год совершать переворот становиться первый консул год император расправлять крыло обретать мощь затем уже 
19801	 работать центральный аэрогидродинамический институт цаги находить математический решение важный практический задача смертельно опасный разрушительный колебание крыло шасси самолет флаттер 
19801	 колотить крыло воздух они учиться аэродинамика 
19801	 помешаться деньги оставлять сережа все что быть умчаться крыло любовь бедный швейцарский художник 
19801	 сначала поумнеть возмужать отращивать укреплять крыло для этот восхитительный страшный 
35257	 молот прикамье пермь крыло совет москва 
19801	 жилкование оба пара крыло сходный задний 
35257	 конец год губернатор самарский область константин титов уговаривать компания сибирский алюминий ныне базовый элемент взяться спонсорство местный футбольный команда крыло совет 
19801	 голова засовывать сзади между крыло нога отгибать назад привязывать 
35257	 однако команда мамут переставать интересоваться российский футбол конец август пойти слух что мамут вести переговоры приобретение контрольный пакет акция питерский зенит затем короман оказываться самарский крыло совет 
35257	 географический положение санкт-петербург самара также футбольный традиция зенит крыло совет давать они право 
35257	 тот вечер самара главный тема для обсуждение быть разгромный победа крыло даже восхождение любимый 
19801	 крыло дедушка раскрасить синий охра выходить 
19801	 чистый вода попытка спрятать голова под крыло 
19801	 склонять пред они оба крыло смирение доброта молвить 
19801	 все свадьба так находить крыло взлетать порывисто 
19801	 вульгарный крестьянский синий муха развалины грубый здоровяк тяжелый крыло пчела изящный 
19801	 нет так пылко любить подскакивать потрескивать шипеть быстро вертеться под игла вера васильевна шипение треск кружение завиваться черный воронка расширяться граммофонный труба торжествовать победа над симеонов нестись фестончатый орхидея божественный темный низкий сначала кружевной пыльный потом набухать подводный напор восставать глубина преображаться огонь вода колыхаться парус надуваться голос все громко обрывать канат неудержимо нестись каравелла брызгать огонь ночной вода все сильно расправлять крыло набирать скорость плавно отрываться 
19801	 конечно перелетать через забор усаживаться распластывать тяжелый крыло 
19801	 тяжелый лететь невысоко посвистывать сечь синь крыло марей ружье подымать 
19801	 масленников умирать черный крыло ужас распростираться некоторый время 
19801	 воображать что летать что вырастать крыло 
19801	 она уже много похожий гигантский стервятник чем человек все крыло пока подымать она 
19801	 всякий случай очевидно проект гедцеса футурам как проект гигантский трансконтинентальный самолет летать крыло описывать автор книга горизонт 
19801	 двухкомнатный квартира этаж типовой башня похожий уголок ботаника никакой коллекция стена разве что несколько подарить пейзаж портрет составлять крыло бабочка 
19801	 элитный каста который когда-то чванливый принимать новоявленный чужак пост гендиректор партия сегодня стекаться под его крыло 
19801	 после взрыв ташкент когда выступать министр внутренний дело произносить абсурдный фраза что взрыв стоять военный крыло хезболла под название хизба ута 
19801	 появляться тот время компьютер давать кибернетика крыло 
19801	 впоследствии когда россия опускаться черный крыло красный террор чесноков 
19801	 какой парашют хорошо круглый купол или тип летать крыло 
19801	 лебедь гусь утка баклан шум гам стайка молодняк крыло становиться по-над самый вода 
19801	 вот что додумывать она успевать стол оплавляться двинуться потечь побежать синий реченька птица встревожиться забивать крыло сокол взмыть небо курица 
19801	 описывать конец крыло кольцо вокруг она летчик выравнивать 
19801	 долго идти спор вопрос как птерозавр начинать летать сверху вниз быть прыгать дерево планировать затем или снизу вверх быть отталкиваться земля нога сильно колотить крыло 
19801	 этот повод уже наш время дмитрий быков саркастически замечать странно слышать подобный автор полупорнографический крыло вероятный непристойный кузмин казаться 
19801	 фрерин сзади кромка крыло машина под угол плоскость 
19801	 бурашка сзади кромка крыло машина под угол плоскость 
19801	 она слетать ветка замахать крыло перед лицо девушка чирикать 
19801	 теперь тут жить водяной дева ундина наиболее безопасный весь дух который мочь даже рожать ребенок человеческий душа вешчица суккуб огненный крыло дриада раган дарить свой любовь 
19801	 цыпленок видимо озябнуть путь тотчас полезть под крыло будущий мама 
19801	 только вот беда аппарат тот взлетать упасть специально устроенный мосток сломать крыло 
19801	 постепенно крыло авиация крепнуть она набирать высота 
19801	 мочь час наблюдать парение чайка как она зависать подрагивать кончик крыло взбираться гора воздух 
19801	 эксперт потерять рассудок как только прийти себя тут прибегать обратно под крыло формула 
19801	 отдельно делать каждый часть насекомое брюшко грудной отдел ножка крыло контур жилкование усик антенна 
19801	 успешно бороться шум вредный выброс помогать переход новый тип самолет основа концепция летать крыло 
19801	 редко петь редко петь когда петь подниматься ветер дразнить крыло уже крыльцо 
19801	 как хлопать крыло черный племя ворон как смеяться 
19801	 степь тут воевать истребитель вот крыло слагать будапешт 
19801	 попытаться они объяснять непрошенность свой визит быть учтивый прерывать взять под крыло гостеприимно местность ознакомлять 
19801	 фактический сопротивление воздух при полет подъемный сила крыло расчетный совпадать 
19801	 при разработка стратегический бомбардировщик тот крыло изменять геометрия ученый цаги предлагать 
19801	 что сказать художественный совесть природа когда довольствоваться что сложенный бабочка калима она делать удивительный подобие сухой лист жилка стебелек она кроме этот осенний крыло прибавлять сверхштатный воспроизведение тот дырочка 
19801	 вот резкий остановка переход свеча чтобы разминать крыло 
19801	 помогать себя крыло утка совершать еще пара пробежка 
19801	 весь планер фюзеляж крыло оперение строиться композиционный материал 
19801	 над сиять быть вечно подвижный эфир полный ангельский крыло создавать пространство пламень 
19801	 носить аккуратный шевелюра абрис выразительный угол крыло нос широкий рот особенный 
19801	 она зарыться головка под крыло уже спать только бабушка 
19801	 вот тот утро когда велька выходить двор она уже греметь ведро птичник курица суматошно галдеть пихаться крыло кормушка 
19801	 лебедь почуять неладный когда быть уже поздно обвисать грязный сосулька крыло мочь подымать они 
19801	 миллион поколение задний пара крыло комнатный муха частично редуцироваться 
20531	 глаз как небо перед рассвет губа как птица крыло рука сильно море 
19801	 как мысль самоубийца дряблый зонд висеть над пляж трос держать невод метеоцентр немой плыть погода все ждать как баба гром перевод рыба свет штиль серебро крыло тень шторм свинец 
19801	 запоминать дядька который палка толкать вперед большой бабочка она хлопать крыло двигаться пол 
19801	 длинный глубокий складка вдоль крыло нос 
35257	 главный тренер самарский клуб крыло совет гаджа гаджиев мочь 
35257	 дерби москва динамо игра между участник куеф зенит крыло 
35257	 спартак крыло совет кажеться что это 
35257	 все помнить что происходить футбольный крыло совет самара когда владелец 
19801	 однако главный его достижение этот создание первый страна самолет стреловидный крыло преодоление они звуковой барьер 
19801	 правда основной рыцарь убивать драконить вставать еще крыло защищать драконица отрубать 
19801	 нет вот этот складка крыло нос быть непривычный 
19801	 треугольный крыло тонкий аэродинамический профиль являться компромиссный 
19801	 американский компания боинг инициативный порядок вести концептуальный разработка перспективный транспортный заправочный самолет особенность конструкция который являться плавный сопряжение фюзеляж крыло также отсутствие оперение 
19801	 военно-воздушный сила включать два авиационный крыло боевой самолет вертолетный зенитный 
19801	 состав авиационный крыло входить два эскадрилья боевой авиация 
19801	 так чтобы крыло нос при это напрягаться 
19801	 можно сказать что все они подымать вершина мировой авиационный рынок только незаурядный организаторский талант первый руководитель авиакомпания волга днепр ныне президент группа компания волга днепр алексей исайкин могучий крыло самый большой мир грузовой 
20531	 больной птица отмечаться тело наличие оголять место поломать выворачивать несимметричный перо крыло 
19801	 авиационный крыло человек насчитывать пять самолет 
19801	 видимо приходить время весь специалист иметь отношение строительный комплекс рамка свой общественный объединение или под крыло ведущий компания создавать рабочий группа 
19801	 воздушный сила атлантический флот эскадрилья авиакрыло истребитель авианосный авиация выделяться состав авианосный крыло формировать рамка оперативный организация 
35257	 этот очень неординарный человек год становиться заниматься бокс спорткомплекс крыло совет доходить мастер 
19801	 тяжелый всплеск короткий сильный крыло можно быть догадываться что утка 
19801	 кожа очень тонкий пигментный пятно рекомендовать проводить пилинг даже поверхностный ярко выражать носогубной складка сосуд крыло нос пора расширять 
35257	 полузащитник андрей каряк крыло совет алексей смертин челси англия 
19801	 взять под крыло сдаваться милость побеждать 
35257	 после победа над донецкий шахтер обеспечивать московский локомотив место основной сетка розыгрыш лига чемпион железнодорожник взять реванш поражение первый круг самарский крыло совет побеждать они счет 
19801	 когда кто-то взмахивать рядом крыло вожак погладить перышко вперед 
19801	 лететь молодняк волноваться гоготать хлопать крыло бежать 
19801	 знать кто иметь дело крыло раскидывать рука выпячивать грудь 
19801	 гусев потом рассказывать что самолет карчевский внезапно потерять скорость начинать валиться крыло двигатель казаться срезать 
19801	 раненый птица ошалело колотить земля крыло 
19801	 черный слизь струиться крыло капать земля 
19801	 время ветеранский движение страна взять под свой крыло профсоюзный комитет партийный орган 
19801	 капитан крыло знать какой действие возыметь 
19801	 авторский кукольный театр екатерина трубицина игрушка получать звание народный взять под крыло хостинский районный дом культура 
19801	 нина константиновна писать как курица крыло хлопать куда таха таха как так 
19801	 как только сунуться туда заорать оглашенный становиться носиться под нога хлопать крыло 
19801	 правда еще молодой крыло окрепнуть 
19801	 губа крыло нос божий человек яков 
19801	 пока подбегать курица клевать находка успевать несколько раз обходить она напыщенно волочить крыло как захлебываться 
19801	 все порядок сказать костя малинин тоже вытирать крыло лоб 
19801	 тут необыкновенно представительный большой вкус одетый человек кудри вороной крыло вдевать глаз монокль 
19801	 она проходить потом быть пауза время который успевать глянуть синеть крыло нос белый губа 
19801	 заклекотать злобный клекот негромко хрипло снова садиться земля упираться крыло пыль 
19801	 птица оправляться день через три она прыгать двор тяжело влачить себя измятый крыло длинный веревка прыгать 
19801	 отвязывать солнцев конь ясли столь бывать бодрый стройный как сей вместо пламень дышать черный дым когда бодриться зыблиться под земля подыматься его нога намериваться ступать земля казаться желать подыматься облако распускать его хвост грива служить вместо крыло сила столь быть большой 
19801	 первый птица взять под свой крыло еретический учение британский проповедник 
35257	 попытка николай после поражение сторонник самодержавный монархия дума усиливать консервативный крыло государственный совет давать ожидать 
19801	 год после национализация имущество кпсс банк взять под свой крыло петербургский мэрия 
19801	 авиационный крыло тихоокеанский ввс сша 
19801	 они липнуть дохлый муха промасливать крыло 
19801	 свернуться клубочек дрыхнуть лапа нос прикрывать лететь понимать крыло любовь она спать почему 
19801	 издалека казаться что крыло олежка заказ выезжать 
19801	 этот перистый полуптица полудинозавр впрочем гигант размер средний нет даже больший ворона вскоре получать название археоптерикс архайос древний птерос крыло буквально древний крылатый 
19801	 фрерин благодаря кабина аппарат мочь опускаться так чтобы орудие мочь вести огонь бок ниже кромка крыло 
19801	 личный неприязнь псевдоакадемик фомин обретать дополнительный убийственный вес быть сей фомин нелюбимый могучий еще мановение рука государыня императрица расправлять широкий крыло россия орден иисус 
19801	 усталый замучивать поэт возлегать свой одр ощущать как черный крыло бог сон гипнос уносить 
19801	 положение скачок зависеть скорость чем она больше тем близко скачок передний кромка крыло также деформация 
19801	 маруся попытаться представлять как этот чудесный машина трансформироваться как она вырастать крыло черный маслянистый смола обтягивать 
19801	 детка строить жить помогать именно одинокий наш чуткость волчий поджарость трепетание крыло нос предчувствие взять след 
19801	 природа создавать крыло бабочка восхитительный разнообразие цветовой палитра 
19801	 она шуметь скандалить желать вставать крыло мат все все вокруг 
19801	 как упоминаться выше шуметь только двигатель фюзеляж крыло оперение другой деталь планер 
19801	 ученый регистрировать частота биение крыло комариный пара 
19801	 густой черный шерсть его отливать синева вороний крыло 
