19801	 как правило там где это возможный экспедиционный авиагруппа создаваться база подразделение один крыло 
19801	 для борьба ирландский террорист состав полк английский сас сформировывать группа получать название крыло противодействие революционный экстремизм 
19801	 пять лошадь штат школа жокей свой конюшня мечта взять под свой крыло весь распадаться конезавод 
19801	 крыло его тонкий полоска металл 
19801	 владимир чередниченко написать один немногие кто ворон касаться свой крыло 
19801	 искать обгонять год крыло слагать свой никогда 
19801	 понимать что уснуть смочь решительно повертывать номер ознобихин предусмотрительный николай приезд быстренько доплачивать снимать люкс дальний крыло такой расчет чтобы отгораживаться 
19801	 лен пытаться прочитывать надпись крыло слышать голос священник читать 
19801	 власть попустительствовать нацист зачастую прямо покровительствовать они иногда воспитывать под свой крыло 
19801	 очень низкий удельный нагрузка крыло сочетание рекордно высокий 
19801	 иначе первый зимний период эксплуатация заканчиваться покраска отшлифовывать дорожный пескоструйка крыло порог 
19801	 если гусь подранивать крыло волочить оно уковылять 
19801	 страшно кричать ребенок понимать что они страшно приятно делать вид что страшно чтобы потереться материнский крыло напоминать себя она что 
19801	 труд пробиваться вперед чешуя искалечивать крыло под высокий рука брать побеждать 
19801	 огонь его крыло быть видный отчетливо слабо 
19801	 вместе быть робкий застенчивый чувствительный иметься закут под дом больница где жить убогий животное собака отрубать лапа слепой кот печальный галка выдергивать крыло 
19801	 его уродливый обезьяний личико быть странно неподвижный только иногда быстро вздрагивать губа крыло худой тонкий злой нос 
19801	 распускать свой крыло выкатить грудь 
19801	 утренний солнце каждый день обманывать полдень неизменно сереть начинать сеять дождь все густой холодно тогда пальма подъезд отель блестеть жесть город казаться особенно грязный тесный музей чересчур однообразный сигарный окурок толстяк извозчик резиновый крыло развеваться ветер накидка нестерпимо 
19801	 тот только сильно замахать крыло помчаться еще быстро еще 
19801	 много долг вот вертеться как муха свечка греться надо крыло сжигать 
19801	 один этот птица подниматься было воздух другой потерять сила мочь быть когда-нибудь подстреливать летать мочь она только взмахивать крыло оставаться 
19801	 отделять синий пучина серый тучка желанный парус сначала подобный крыло морской чайка мало-помалу отделяться 
19801	 многие стихотворство много твой знание иметь весь писать трагедия ода элегия поэма все что они вздуматься короче сказать если пегас попротивиться поймать грива оборвать крыло садиться насильно поехать прямо 
19801	 она подошед чернобогов жертвенник распространять свой крыло знак свой повиновение дотрагиваться 
35257	 против резко выступать консервативный крыло англиканский духовенство который итог 
19801	 однако тот пора минуть без малое два десяток год михалев тридцатилетний бандюк превращаться солидный дядечка под полтинничек деловой даже почти приличный старый память привечать принимать под свой крыло вполне высокоинтеллектуальный народ 
19801	 обрезать крыло сунуть они карман рябок 
19801	 семь час вечер раздаваться все тот звук фанфара вода промчаться катер подводный крыло тогда еще невиданный технический чудо 
19801	 дом испарять молоко дымить ароматный трава держать паук чтобы они паутина сгребать смрад птица клетка чтобы они перемешивать воздух крыло 
19801	 рядом конец обращать земля крыло отчетливо увидеть слегка стилизовать 
19801	 как она потом туалет крыло мат медсестра слышать все 
19801	 паша вечный бабки вечный скамейка называть ангел глаз ангелочек глаз куда много паша походить открыточный экземпляр даже белокурый кудряшка иметься хотя крыло быть уже тогда 
19801	 вот еще пара вариант кто-то кто-то мутировать например конь крыло отращивать или самый простой весь 
19801	 бурашка больший хотя намного это протонный торпеда крыло четыре ланчер ракета 
19801	 жернов двигаться крыло вращаться мельник фаддей ворожба свой 
19801	 убитый лежать яма три тяжелый слой соня очутиться между придавливать труп принимать двойной удар отец клим уже тянуть она живой или мертвый разбитый тяжелый как камень легкий как стрекозиный крыло весь черный липко мокрый 
19801	 мгновение глаз стекать вместе лицо крыло взмахивать невольно подставлять 
19801	 один главный символ этот культура быть большой птица распахнуть крыло человеческий лик 
19801	 зачастую слишком длинный крыло просто мешать взлетать 
19801	 ничто особенный пожимать плечо крыло такой как все грешить 
19801	 весна когда зацветать ива пыльца золотистый цветок копошиться увалень шмель проворный пчела соседство они можно увидеть перепархивать желтый бабочка небольшой красноватый пятно крыло 
19801	 они быть много все хотеть входить некоторые быть прозрачный крыло сторона тоже гореть 
19801	 иван андреев софизм недозволенный процесс силлогистический умозаключение который нарушать правило простой категорический силлогизм термин распределенный взять весь объем один посылка мочь быть распределять взять весь объем заключение весь птица иметь крыло некоторый яйцекладущий иметь 
19801	 если кто-то ловить клюв пиджи пускать ход сокрушительный крыло 
19801	 увидеть знакомый тропики огромный южноамериканский бабочка ослепительно синий морфо пелеидес калиго атрейя его крыло тоже отсвечивать глубокий синий свет 
19801	 тогда туполев сотрудник так проверять самолет прочность забираться крыло подымать туда тяжесть смотреть 
19801	 яркий пример схема низкорасположенный крыло глиссировать сходить носовой 
35257	 больший активность константинополь развивать известный авантюрист михал чайковский садык паша многолетний сторонник лидер консервативный крыло польский эмиграция князь адам чарторыский 
35257	 представитель консервативный крыло есть феоктистов так писать 
19801	 это означать что принцип перелезать через забор помогать себя крыло жур конечно смочь 
19801	 именно среди они иногда попадаться особь сломать крыло находить спасение мусорный контейнер 
19801	 быть они больший часть деревянный фюзеляж крыло обтягиваться ткань 
19801	 можно представлять что чусовая частый крутой поворот полный скорость плотный компактный группа нестись или даже современный теплоход подводный крыло тип ракета или метеор 
19801	 всплеск заполошный гогот крик хлопание крыло возня чавканье хруст стебель 
19801	 хлопание крыло борозда волна звенеть как опрокидываться 
19801	 грудной плавник похожий крыло большой птица 
19801	 филипп чувствовать что радость словно вырастать крыло 
19801	 расправлять свой крыло зов господин лететь 
19801	 где сначала птичка какать мужичок потом мужичка хлебать ред була вырастать крыло какать птичка 
19801	 прилетать обратно приносить лето свой изящный крыло рассекать теплеть атмосфера 
19801	 надежда крыло вырастать счастливый просто 
19801	 судно подводный крыло нужно доплывать хотя 
19801	 судя описание это точно ужас лететь крыло ночь 
19801	 крыло состоять четыре стальной профиль 
19801	 неистовый энергия струминский помогать преодолевать противодействие сторона руководство институт внедрение стреловидный крыло 
19801	 результат многочисленный экспериментальный исследование стреловидный крыло быть обнаруживать область где эффект 
19801	 движение очень ограниченный только поворот голова рука подымать крыло 
19801	 бок можно сравнивать манипуляция железный шварц крыло бутафорский харриер 
19801	 вот лететь черный плащ ужас крыло ночь дорогой кашемировый пальто распахнуть 
19801	 дыхание грядущий овевать подол одежда неземной осенять они свой крыло так далее 
19801	 они подкорректировать профиль крыло это позволять двигаться под 
19801	 газпромавиа становиться лауреат общероссийский премия крыло россия номинация участник 
19801	 спонсорский поддержка национальный авиационный премия крыло россия осуществлять уже становиться 
19801	 национальный авиационный ежегодный премия крыло россия присуждаться хороший авиакомпания страна 
19801	 время свой существование премия крыло россия приобретать статус наиболее престижный 
19801	 мнение многий авиационный эксперт субъект рынок авиаперевозка крыло россия сегодняшний день это 
19801	 точно так отказываться забросить малолетка брать они под свой крыло инструктор взрывник старший лейтенант алексей 
19801	 это несколько вещь фибрагимов красивый выразительный крыло перекликаться античность ника 
19801	 туловище дракончик однотонный зеленый зато крыло яркий пестрый сверху изумрудный 
19801	 надо быть частично разбирать снимать оперение тот число консоль крыло 
19801	 всегда отдавать должное мадам лишь один качествуинтуиция чудесный образ чувствовать кто мочь крыло обжигать 
19801	 тогда попробовать взлетать мама полагать под крыло уснуть 
19801	 кот подбивать крыло весь равный взлетать 
19801	 главное уберегать хрупкий экспонат воздействие прямой солнечный свет противный случай крыло бабочка хитиновый панцирь жуков 
19801	 если башка так трещать наверное вообще мат все крыло 
19801	 главный сила способный искривлять траектория полет являться подъемный сила крыло 
19801	 чем мало удельный нагрузка крыло тем большой маневренность 
19801	 хрупкий письменный столик образцовый порядок быть раскладывать толстый словарь прилежный курсистка освещать трепещущий крыло отсвет пламень сжигать пачка наш 
19801	 вспыхивать молния увидеть как биться угол палатка прозрачный крыло изогнутый коромысло синий стрекоза 
19801	 ответ этот первый чуфыканье косач токовик далеко весь болото раздаваться такой чуфыканье хлопание крыло вскоре весь сторона 
19801	 действительно где-то вдали послышаться шум многочисленный крыло 
19801	 слуга бросаться галя готовый быть схватывать она этот время большой птица взмахивать крыло усадить галя себя 
19801	 птица еще много вытягивать коготь приподымать голова дрожь крыло простирать земля огонь 
19801	 сначала ястреб противиться взмахивать крыло когда понимать что 
19801	 рудольф сергеевич почувствовать между лопатка дрожь благоговение словно сладкий чесотка дух намекать что пробиваться крыло 
19801	 пробор разделять пегий волос точно посередине так что они быть похожий сложенный крыло 
19801	 происходить белоголовый орлан уже рассекать воздух длинный сильный крыло распускать они бесшумно 
19801	 степан останавливаться глянуть оба сторона нетронутый след буранный просека рюкзак повесить сук доставать наружный карман глухариный крыло пойти влево там недалеко 
19801	 огонь пылать конец копье лишать ангел его белоснежный крыло один демон вода 
19801	 если новый любовь еще подвертываться тут радостно нестись следующий там через тот три год семь год все исчерпываться они снова бежать или уже постареть пообломать крыло останавливаться оседать чтобы уныло тянуть 
19801	 только теплый бежать она навстречу коридор обнимать она как один мочь соскучиться мой животик тут без переход как думать если один крыло трехглавый дракон сломать бой 
35257	 менее консервативный крыло представлять амиш новый порядок 
19801	 спастика быть анимированный золото перебегать солнечный искра под нога уходить кудрявый нарисовать лесок танцевать веселый зверенок скакать копытце свинка шутливо драться обезьянка помахивать крыло курочка 
19801	 крыло быть дорогой как истребитель 
19801	 там угол съехидничать такой как нарисовать еще крыло перепонка лапа 
19801	 мочь быть неугомонный летун так называть что они стремительно рассекать воздух длинный крыло точно стричь небесный полотно ножницы 
19801	 злата понировский препарировать механический игрушка делать они инопланетный существо крыло большой количество разнообразный конечность 
19801	 она вспыхивать где-то она зрачок пробегать волна приоткрывать влажный рот вдруг начинать дрожать белый слегка мясистый крыло нос все никак 
19801	 знать мочь доля свой может крыло слагать посреди степь пропеть этот 
19801	 вода птица использовать свой короткий крыло больше похожий ласт для 
19801	 оперировать миллион рубль тот рубль напоминать золотой содержание равняться примерно пятнадцать нынешний доллар сша под его крыло действовать много два тысяча завод 
19801	 рассказывать невероятный художественный остроумие мимикрия который объяснимый борьба жизнь грубый спешка чернорабочий сила эволюция излишне изысканный для обман случайный враг пернатое чешуйчатый прочий малоразборчивый столь бабочка лакомый словно придумывать забавник живописец для умный глаз человек догадка который мочь далеко уводить эволюционист наблюдать питаться бабочка обезьяна рассказывать этот магический маска мимикрия громадный ночница состояние покой принимать образ глядеть змея один тропический пяденица окрашивать точный подобие определенный вид денница бесконечно она отдаленный система природа причем ради смех иллюзия оранжевый брюшко иметься один складываться другой оранжевый паховый нижний крыло своеобразный гарем знаменитый 
19801	 тогда крыло колебаться быть очень похожий 
19801	 увидеть деревенька садиться возле запруда спешить подбирать крыло ломкий иней 
19801	 казаться усталый плащ свисать плечо как подбивать крыло все замедлять замедлять 
19801	 утка гусь полоскать крыло ряпать клюв мелкий зерцало залив 
19801	 они делать фюзеляж крыло хвостовой оперение 
19801	 гудение штурмовик они проноситься несколько сантиметр так что даже чувствовать ветерок они крыло 
19801	 крыло приклеивать снизу так чтобы они 
19801	 нестеров жить один жизнь россия конец свой день мочь повторять слово анна ахматова под чуждый небосвод под защита чуждый крыло быть тогда мой 
19801	 насчет иной метод так весь они выходить данный подход немногое дополняться если муха отрезать крыло если нога отрезать тоже муха 
19801	 тварь скользкий почевать плечо еще появляться крыло так век век скоро 
19801	 это быть костистый неуклюжий еще оформляться входить сила дракон подросток длинный шея огромный кожистый крыло 
19801	 нет инк чешуя чтоб выскальзывать крыло чтобы улетать скоро мистер 
19801	 они можно относить компоновка хвостовой часть самолет высокоэффективный механизация крыло многоколесный шасси топливный система система 
19801	 весь мир полный стрекозиный крыло синий изразец ассирия 
19801	 конец март московский международный дом музыка состояться торжественный церемония вручение национальный авиационный премия крыло россия 
19801	 конец март московский международный дом музыка состояться торжественный церемония вручение национальный авиационный премия крыло россия 
