19801	 мария помахать она ответ самолет еще раз покачать крыло становиться набирать высота ложиться 
19801	 забавный девушка ужас крыло ночь окт 
19801	 добавлять спустя минута секунда ужас крыло ночь писать 
19801	 гаджиев оставаться крыло барановский бабла загнать немерено 
19801	 слепой ласточка чертог тень вернуться крыло срезать увы 
19801	 применение оптимальный крыло пассажирский военный авиация 
19801	 казаться нарастание пограничный слой размах крыло позволять усомниться это 
19801	 потакать разгуливаться фантазия режиссер преодолевать брод выпускать крыло взмывать небо 
20531	 когда голова снимать кожаный колпачок птица захлопать крыло хищно защелка клюв попытаться 
19801	 справа крыло дворец помещать наркомат вмф 
19801	 гоярын разбегаться раскидывать крыло тяжело взлетать 
19801	 длина воздушный гигант составлять метр размах крыло метр 
31524	 масса снижать сделать крыло капот задний часть пол 
19801	 однажды например ученый изготавливать действующий модель большой ястреб размах крыло составлять семьдесят сантиметр 
19801	 основной характеристика последний следующий стартовый масса масса боевой часть проникать тип максимальный дальность пуск геометрический размер длина диаметр корпус размах крыло 
19801	 парный змей расправлять крыло маска перед лицо 
19801	 трудность воспроизведение самолет быть очень много особенно получение плита длина для крыло 
20531	 ангел преклонять колено прикладывать палец губа распростирать крыло 
19801	 площадь метр размах крыло метр 
19801	 этот поток позволять птица набирать высота неподвижный крыло 
19801	 бла построить схема моноплан длина размах крыло масса 
19801	 основной тактико-технический характеристика бла размах крыло площадь 
19801	 этот аппарат создавать схема тип летать крыло иметь размах 
19801	 габаритный размер длина размах крыло площадь 
19801	 выполнять аэродинамический схема утка оснащать треугольный крыло размах 
19801	 основной тактико-технический данные максимальный дальность пуск комбинированный система наведение инерциальный лазерный полуактивный стартовый масса осколочный фугасный масса длина диаметр размах крыло 
19801	 предельно допустимый шум его работа полезный нагрузка менее минимальный площадь крыло 
19801	 вооружение пушка боезапас выстрел устанавливать справа наплыв крыло узел внешний подвеска 
19801	 сосудистый сетка крыло нос полностью исчезать 
20531	 так что когда девушка взлетать небо сгорать самолет это воспринимать столько как реальный драма сколько как метафора ледяной ангел слагать крыло покидать наш невменяемый мир 
19801	 слепой ласточка чертог тень вернуться крыло срезать 
19801	 они давать автор возможность под крыло движение объединять тот кто быть 
19801	 однако гусь оказываться орел размах крыло мало два метр 
19801	 например быть непонятно как мезозой мочь летать птеранодон крылатый ящер размах крыло около метр еще 
19801	 знать что под крыло профком пермнефтеоргсинтез под руководство опытный 
19801	 свободный полет мысль крыло интуиция необходимость завершать полет 
20531	 многофакторный анализ почему все получаться внимательный читатель наверное замечать над весь свершение г-н бернштам словно распростирать свой крыло птица цвет аквамарин госпожа удача 
35257	 скоро все нынешний квартет аутсайдер спартак мечесть крыло совет молот прикамье оставаться 
19801	 максимальный скорость дальность полет взлетный вес размах крыло около длина самолет 
19801	 крыло громов раскат смыкаться вокруг 
19801	 жилкование крыло веснянка примитивный состоять набор 
19801	 крыло любовь помчаться существо произносить 
19801	 высокий небо продолжать кружить аист изредка хлопать крыло пролетать утка 
19801	 анна федоровна приваливаться подлокотник катя поджинать под себя тонкий нога забиваться мать под рука как цыпленок под крыло рыхлый курица 
19801	 вроде американка предлагать укапустин америка поехать под крыло родитель миллионер 
19801	 май набирать крыло уже плыть над земля 
20531	 неделя птенец появляться перо спина хвост крыло 
19801	 быть уже совсем темно чистый фиолетовый небо прозрачный кристаллический звезда смотреть окно снегирь спать подтыкать голова под крыло когда уводить сказать ганка 
19801	 перед самолет лежать тысяча миля путь над океан прежде чем снова ложиться под его крыло чужой гостеприимный земля 
19801	 самолет еще покачиваться вздрагивать когда летчик выбираться крыло 
19801	 слово его проходить много два день как другой газета появляться статья критика ариман который называться враг под крыло редактор который говориться что 
19801	 известно один два голова другой три нога третий три крыло вот весь урод 
35257	 ведь принадлежать консервативный крыло российский журналистика 
19801	 тот пора многий предприятие почить боз или переходить под крыло международный холдинг 
19801	 первенец советский индустриализация промышленный гигант построить сибирь рекордный день сегодня под крыло евраза оставаться лишь рельсобалочный производство 
19801	 летюй история последний восемь проходить под крыло 
19801	 под крыло вертолет паводковый ситуация это 
20531	 видеть тоненький фигурка ита море слепящий дрожать свет язычок пламень упруго гнуться ветер время шелковистый блеск мираж гул волна свист птичий крыло 
19801	 один основатель компания пол аллея объявлять план построить самый большой самолет весь история авиация размах его крыло составлять метр такой 
19801	 летчик сделать остров котельный промежуточный база вот уже под крыло район дрейф пилот алексеев 
19801	 наставать момент когда этот самолет быть летать высокий быстро надежный все понимать ага обратный угол крыло вот что надо быть 
19801	 метр тридцать пятьдесят земля самолет начинать сильно махать крыло вверх-вниз вот это быть страшновато 
19801	 через пять метр сам выронить свой добыча пока упоенно бежать оба сторона физиономия тяжелый поникать крыло волочься оба тапок отнимать 
19801	 сибиряк комнатный вооружение пулемет бомба или пулемет под крыло 
19801	 милицейский оркестр исполнять катюша военный оркестр наяривать разум давать стальной рука крыло еще один оркестр прощание 
19801	 спускаться небо крыло трескучий амур становиться вперекор сюжет 
19801	 знать даже мочь сам господь бог под крыло 
19801	 сначала пупырчатый как ощипанный курица мама даже быть задумчиво измерять сантиметр замораживать курица супермаркет надежда оценивать какой размер мочь вырастать крыло сын потом 
19801	 антрацитовый зрачок обводить округ сумерки сгущаться синева смежаться веко небосвод ястреб прятать голова под крыло чтобы никогда больше просыпаться 
19801	 роковый полет трещина соединяться крыло складываться как бабочка 
19801	 май год появляться приказ мингео слияние восточный амакинский экспедиция естественно под крыло амакинка 
19801	 палатка или под крыло палатка заноситься продукт вещь 
19801	 оценка показывать что перспективный океанский самолет амфибия низкорасположенный крыло мочь иметь аэродинамический качество 
20531	 почему человек смочь это сделать ведь кажется нужно лишь скопировать крыло птица прикреплять они рука 
19801	 тигренок муж утопия или утопия самолет чтобы летать нужный крыло двигатель там еще кое-что 
19801	 подумать только поднебесный сфера ваксон тут про себя добавлять где пахнуть пот отрыжка они заткнуть под крыло грибочуев пятый зам журнал 
19801	 для жизнь под крыло нквд большой подходить тот часть 
20531	 дужка его очки быть прикручивать проволока опаска оттягивать птица крыло птица рвануться подныривать под плащ 
19801	 витрина мясной отдел прятать мертвый голова под крыло серо-коричневый тетерев 
19801	 невидимый дятел один сосна несколько мгновение замолчать возобновлять свой работа тут мальчик удаваться замечать метр двадцать наверху красный перышко крыло белый хохолок 
19801	 выходить обочина подымать рука тотчас сбавлять скорость подруливать шестерка тронутый ржавчина крыло приветливо просигналить поворотник 
19801	 современный инженер российский авиационный консорциум вернуться она проект среднемагистральный пассажирский самолет так называть интегральный схема который предусматривать единый конструкция крыло фюзеляж 
19801	 так что как выглядеть муха знать весь размер миллиметр длина серый хитиновый тельце два большой глаз голова хоботок конечно два пара крыло шесть лапка вот собственно 
19801	 под крыло видный остров очерчивать серебристый полоса 
19801	 уславливаться встречаться летний кафе бриз под крыло местный брюс уиллис 
19801	 рядом быть ромадин сын высокопоставленный живописец лауреат ленинский сталинский премия процветать под крыло папочка процветать достойно 
19801	 теперь солнце оставаться справа мешать обозревать земля под крыло 
19801	 серир по-русски галька действительно поплыть под крыло совсем скоро душа 
19801	 погода благоволить лишь изредка под крыло проплывать невесомый перышко облако 
19801	 орел парить крыло дух заоблачный высота воитель 
19801	 включать складываться аэродинамический поверхность реализовать аэродинамический схема присоединять крыло элемент питание механизм раскрытие 
19801	 ромбовидный крыло иметь крылатый ракета треугольный 
19801	 сгрудиться вокруг этот деревце сдюжить деревенский баба под крыло спасаться голодный смерть 
31524	 напоминание пининфарина задний крыло центр салон 
19801	 для полет над водный гладь борт ринспид сплэш выдвигаться крыло сзади разумеется мощный винт 
19801	 счет идти секунда седьмой выброс медуза парашют размер полотенце который стабилизировать спортсмен воздух вытягивать мешок спина крыло большой парашют десятый раскрытый бэйсер 
19801	 этот положение позволять защищать вертикаль при помощь соединять рука положение давать тьен горизонталь при помощь техника расправлять крыло 
19801	 этот положение позволять защищать вертикаль при помощь соединять рука положение давать тьен горизонталь при помощь техника расправлять крыло 
19801	 кстати фелиция первый модель выпускать шкода под крыло фольксваген 
20531	 хозяин пошевелить крыло ветер пронестись комната 
19801	 собрат небо параплан отличаться частность форма крыло она эллипсовидный прямоугольный 
19801	 пилот свой секрет общение воздух для маршрутный полет неоднократный схлопывание крыло практически норма 
19801	 конвэровский проект носить наименование скэйт представлять себя весьма совершать аэродинамический отношение летать лодка лишать сухопутный шасси стреловидный крыло иметь плавный сопряжение фюзеляж 
19801	 самолет выполнять нормальный аэродинамический схема высокорасположенный трапециевидный крыло двухкилевой оперение два двигатель 
19801	 отечественный колесный трактор спрос превышать возможность экспортный производство раз первый год предложение экспорт автомобиль нива только германия фирма запрашивать тыс штука при объем производство тот время тыс штука год один крупный фирма сша получать отказ поставка заказывать она катер подводный крыло рекламироваться первый страница журнал 
19801	 вертолет мочь использоваться как постановщик минный заграждение для что под крыло подвешиваться контейнер малогабаритный груз кмга 
19801	 это позволять подвешивать под крыло вертолет груз масса 
20531	 участок лишенный перо отсутствовать перо гладкий блестящий крыло симметричный нога симметричный без искривление 
19801	 эскадрилья авиационный крыло иметь вооружение соответствие 
35257	 защитник дмитрий сенник вадим евсеев оба локомотив денис колодин александр анюков обакрыло совет сергей игнашевич цска алексей 
20531	 прогоготать новый приятель быстро лететь вперед занимать место глава родной клин потом странно размахивать крыло пускаться лететь вкривь вкось 
19801	 почему посылать черта весь этот столичный блажь сбегать куда-нибудь провинция под крыло папа мама 
19801	 знать чем она показываться она решительно взять под крыло проводить весь аттракцион 
19801	 пока оставаться под крыло государство гарантировать максимальный сохранность 
19801	 работать отмечать превитта над создание моноплан низкорасположенный крыло оснащать высотный двигатель компания 
19801	 мать ждать освобождаться под крыло вернуться непутевый 
19801	 церковь нет соблазн вернуться под крыло государство заявлять главный организатор рождественский 
19801	 как уже писать нга обращение пленум сергей глазьев виктор илюхин николай харитонов игорь родионов еще шестеро товарищ написать что попытка подгребать весь левый патриот под крыло кпрф обрекать неудача 
19801	 она понимать что она ничто светить часть любовь надо жить ради ребенок ставить они крыло 
35257	 крыло совет самарский клуб камень 
19801	 данила схватывать гусь оба рука зарыться его крыло перо лицо услышать 
20531	 весь жизнь повертываться ветер как просто как удобно крыло ангел 
19801	 проходить пять минута как они уже висеть над бездонный каньон медленно набирать высота покачивать прощание серебристый крыло 
20531	 приседать корточки как воробей втягивать голова плечо закладывать рука спина словно крыло 
19801	 морда блаженный сверху слеза текет рука вот этак вот род крыло прямо сейчас полететь 
19801	 еще минута она вставать крыло 
19801	 потому как долгий ожидание полиция потерянный протокол день два смятый крыло 
19801	 фуражка высокий тулья который раскидывать крыло серебряный летучий мышь 
19801	 большой птица даже расправлять крыло тяжелый куль валиться вниз 
19801	 дело быть мочь поезд тот самый увидеть окно который русский мальчик спустя тридцать год преображать реальность так что подхватывать ветер газета темный перрон оборачиваться решение каверзный шахматный задача крыло редкий бабочка луг средний 
19801	 асфальт нестись поток вода она прибывать автомобиль подводный крыло рассекать зеленый гладь кооперативный улица 
19801	 сверху дымный чахлый облако что притулиться сбоку луна мушиный свой рай смотреть константинов убиенный муха чистить слюдяной крыло подниматься лапка смерть 
19801	 например мобер превращаться курица поджимать рука крыло наклоняться начинать кудахтать кукарекать 
20531	 этот бровь самый конец утрачивать свой красота полет быть как особый его клеймо личный знак внятный памятный всякий кто хоть раз внимательно посмотреть переносица срастаться путь висок набирать сила густота затем утончаться отнюдь редеть как будто проводить уверенный карандаш ярко черный по-прежнему внезапно висок обрываться они образовывать один тот совершенный линия какой встречать природа нечеловеческий человек думать знать изгиб случайный ветка под фонарь зимний ночь ласточкин росчерк грозовой закат под эль грековский небо взмах крыло кружиться над залив над дюна 
