33131	 ребенок как курица нахохливаться стоять подъезд 
33131	 одинаковый керосинка сырой керосин тоже мало чем интересный вот курица как раз неодинаковый уклад 
33131	 ведь здешний родитель пример веронский взаимоненавистник чувство ребенок свой снисходительный хотя постигать как это ребенок пожениться как народить свой ребенок что это ребенок быть такой какой курица становиться варить когда вырастать 
33131	 вот пример курица еда употреблять брезговать 
33131	 ладно курица по-чилийски это вещь это 
33131	 три коза это курица смех 
33131	 отброс отвечать другой предупреждать совхоз советский курица отброс следовать страшный разнос 
33131	 казаться себя жалкий обдирать щенок перед мирный породистый собака заранее теперь уже знать что ничто доказывать только вконец выставлять себя идиот курица смех уже 
33131	 тут они как курица отмывать свой собственный прошлое закивать 
33131	 это надо затевать комбинация научно-исследовательский цель курица смех виктор алексеевич 
33131	 рука трястись как будто курица воровать 
33131	 белый палевый сизый подружка курносый хохлатый бантастый наперегонки курица подбирать рассыпать зерно 
38375	 потом василь гаврилович рассыпать распоряжение жена дариванна корма для курица 
33131	 приезжать николай дождаться его двое чадо его жена его тесть его курица ихний 
33131	 зачем спрашиваться нужный городской шофер такой примета курица кричать насест быть 
33131	 заплот наш двор под навес зашевелиться курица один упасть насест пробовать 
33131	 подмывать караулка избушка зависать один угол над падать только потому что быть подпирать снизу слега завалин избушка укреплять каменный плита один или два плита укатиться вниз подрыть курица избушка старчески обнажаться трухлый нижний 
33131	 грандиозный трехъярусный павильон строиться несколько месяц настоящий зерно мука курица настоящий полметра глубина бассейн 
33131	 когда снимать падение после удар лопата разбойник вниз лететь курица 
33131	 италия этот цель посадить глубокий пещера кролик петух курица двадцать ученый 
33131	 между деревянный домик бродить курица чудо удерживаться склон 
33131	 расхаживать территория курица толстый как свинья давать 
33131	 кажется что курица быть хороший суп 
33131	 себя они привозить много продукт мешок пшено два четверть конопляный масло который богородицк стоить дешево также тыква картошка наш участок труп наш курица 
33131	 подавать ружье подкатывать машина индюк гусь курица директор стрелять они словно 
33131	 опрятный миловидный старушка стоять крыльцо ласковый голос сзывать курица равномерно как сеятель разбрасывать пригоршня 
33131	 наконец спокойный потому непобедимый возглас тихо подхватывать весь страна как новый молитва как буддийский призыв самосозерцание курица через два час заросль 
33131	 стараться все раздавать поровну приглядываться кусок мясо жареный курица если что-то один 
33131	 видеть еще глупо чем тот жена сказать тот хоть курица скармливать кукуруза зарабатывать земля 
33131	 представлять зеленый абхазский дворик традиционный грецкий орех посредине каменный дом высокий свая возле дом новенький волга задраивать окно чтобы курица влетать 
33131	 несколько раз год бедный мать хазарат посещать свой сын приносить хачапури жареный курица вино 
33131	 приезжать месяц бабуля деньги значит курица клевать 
33131	 под домик жара прятаться курица коза свинья 
33131	 посредине помещение догорать полешко дым просачиваться через щель уголек падать вниз земля вызывать иногда недовольный кудахтанье курица 
33131	 тихонько красться край поле ожидать встречать курица услышать лес какой-то 
33131	 только шмель гудеть поохивать сонный курица купаться пыль 
33131	 как дрожжи расти дармовой харчи хрюшка курица селянин 
33131	 однако химизация увеличение количество транспорт прекращение частный птицеводство сельский местность прочий знамение современный этап развитие сельский хозяйство становиться причина исчезновение многий чисто сельский ассоциация например сообщество господство просвирник столь характерный для сельский дворик разгуливать они гусь или курица 
33131	 пир рат мокрый курица рыцы 
33131	 существо правильно поскольку никакой строгий доказательство такой визит наука иметь поэтому подобный гипотеза просто курица смех 
33131	 например практический рекомендация этот научный совет широко применяться бассейн река курица 
33131	 кончать скоро говорить отец только индюшка курица быть тот время 
33131	 смеяться она только над полный нелепость над чем принятый говорить курица смех 
33131	 корова обиходить скоро должный растеливаться конь кинуть мелконький сенцо вычесывать грива курица пшено кинуть этот 
33131	 бурнашов бранить себя что открываться священник сразу пойти обман нерешительность скрытность свой натура вот угождать как курица ощип 
33131	 конечно курица нестись без счет картошка 
33131	 всего нева курица сто семь станция верста 
33131	 заплот наш двор под навес зашевелиться курица один упасть шест пробовать 
33131	 илья послушать как курица тревожить свинья загон 
33131	 антарктида повар ленинградский профессиональный слесарь попадать его слово как курица 
33131	 ожесточенный сражение разыгрываться междуречье терек курица 
33131	 говорить слава баба курица сколько здесь голубоглазый 
33131	 взволновать подуть ветерок детство время когда красный улица бродить свинья курица повертывать было вниз 
33131	 коммунар богатырь большой круглый борода зычный голос хозяин просторный двор полный курица индюк последний коммунар потерять 
33131	 оля так курица ходить кругом оля 
33131	 оля так курица ходить кругом оля 
33131	 быть пусто вокруг корыто размачивать хлеб суетиться десяток крупный белый курица увидеть тимошка петух набрякнуть 
33131	 весь это попадать как курица никита втягивать 
33131	 возле дверь солома иногда нестись курица теперь лежать два желтый 
33131	 этот наверно поросенок спрятать знать про поросенок про корова про курица так как про 
33131	 знание учащийся должный быть усваивать процесс выполнение такой как например помогать наш фабрика завод колхоз выполнять промфинплан научаться разводить курица 
33131	 окно дождь порывистый совсем южный холодный осенний ветер двор кричать курица 
33131	 так бывало приговаривать бабушка гонять курица огород или досадовать 
33131	 жердь прохаживаться выжидательно коситься антипова курица 
33131	 подходить женщина который сидеть угол как курица насест 
33131	 они становиться прыгать пароход вода разбегаться деревня ловить курица поросенок гусь грузить добыча 
33131	 лишь курица открывать жара клюв 
33131	 его появление трудно становиться загонять овца двор врассыпную разбегаться курица 
33131	 почему такой порция курица смех 
33131	 глаз разбегаться когда видеть корзина жареный курица печеный картошка яйцо бутылка топленый 
33131	 дрессировщик цхомелидзе рассказывать сегодня кулиса как рано дореволюционный цирк клоун поражать публика танцевать курица 
33131	 поле кормиться петр корова поросенок курица кролик 
33131	 вот случай продавать сердобольный женщина три курица 
33131	 крестьянин испокон век иметь свой курица торговать яйцо город почему 
33131	 один миг рушиться весь мой хрестоматийный представление курица как самый безобидный существо 
33131	 чтобы приучать дело исподволь андронова предлагать работать первый неделя ночной смена когда курица спать 
33131	 курятник доноситься гомон разбудить курица откуда извлекать птица обреченный 
33131	 мцхета удушливый влажный жара клубиться над долина курица странный мелодия странный речь странный 
33131	 справедливый койот считать дележ человек курица ягненок теленок 
33131	 американец еще отвыкать охота добрый старый время стрельба полудомашний птица вызывать они отвращение так можно стрелять курица себя двор 
33131	 эля смирнова жена курица фрукт ребенок как 
33131	 сначала теряться нельзя понимать что там происходить женщина ловить курица свинья индюшка женщина второпях уносить 
33131	 это особо доверенный лицо получать деньги исключительно натура картошка поросенок теленок курица овощ крупа сало масло 
33131	 сам шеф-повар стараться щегольнуть свой блестящий кулинарный искусство впрочем быть что щегольнуть мука крупчатка курица яйцо сало сливочный масло сметана 
33131	 двор расхаживать курица редко утка гусь цесарка индюшка 
33131	 лебяжинский старик сгрудиться один бревнышко словно курица насест глядеть устинов 
33131	 вот забывать почему-то весь жизнь что курица звать никогда 
33131	 полк стоять стрельна приезжать стрельна отец вспоминать что всегда хотеться жить город свежий воздух чтобы перед дом расти куст возможность полезный крыжовник малина двор расхаживать курица 
33131	 после это распрямляться подымать старуха маленький зарастать весь сторона глаз возглашать курица ров 
33131	 садиться покуль самовар совсем остыть курица ров снова выкрикивать как каркнуть 
33131	 потоп курица ров человек иметь 
33131	 катер рина гореть курица ров 
33131	 между прочее курт случайно знать курица удивляться нюра 
33131	 какой мочь быть курица фамилия 
33131	 какой мочь быть курица фамилия 
33131	 когда торжественно выезжать станица правило лошадь предлагать только хлеб курица гусь даже маленький поросенок 
33131	 агитбригадовец мочь строить курица только друг друг 
33131	 один акция воровство курица принимать непосредственный участие 
33131	 поселок чуш проходить день много восемь машина они давить курица свинья собака человек 
33131	 тетя стюр задавать корм свой курица уходить дом оставлять 
33131	 начинаться опыт мышь крыса кролик собака затем курица овца бычок 
33131	 водосточный труба пушка курица смех 
33131	 говорить громко пафос словно выступать трибуна попадать как курица ощип обращаться 
33131	 спор гамлет критика делиться два лагерь один огорчать кадр символ другой курица кстати спор символ многозначительность 
33131	 дружно курица переводить продавщица разговор 
33131	 костя муж обед давно без этот курица готовый давно садиться нет 
33131	 утка залазать огромный каменный корыто барахтаться немой грязный курица присмиреть приседать вдоль плетень 
33131	 данила дмитрич двинуться воз битый тетерка рябчик курица 
33131	 человек можно сказать деньги курица клевать жаться 
33131	 пятеро судья как курица нашест размещаться немой 
33131	 это курица смех еще три минуточка 
33131	 как всегда перед трудный дорога хотеться сразу вставать хотеться спешить сидеть возле окно поглядывать улица гусь курица как девушка 
33131	 тоже встречать такой могучий петух пожалуй раскрываться природа тот диковинно красочный яичко который выдавать весна владыкин цаплиный должный петух нести какой-то ответственность какой величина цвет яичко класть курица 
33131	 как-то весна начало май мама евлампьевна говорить вася васьк курица много утка 
33131	 гришка который прибывать полк июль год число первый офицер сразу попадать как курица ощип 
33131	 мало приятно попадать как курица кобель задница 
33131	 тетка попадать тоже как курица вопить ругаться врать 
33131	 обращаться взор присутствовать курица тронуть восторгаться алеша 
33131	 так принимать четвероногий вот курица это 
33131	 кстати свинство как поживать твой многоуважаемый курица 
33131	 куреневка испокон век спасаться редиска также поросенок курица глухой всякий наука искусство 
33131	 старость становиться страшно вздорный тайком обрывать соседский груша свешиваться через забор его земля убивать палка соседский курица если они забредать 
33131	 из-под колесо передняя машина шарахаться белый вешенский курица добротный изгородь стоять казачок 
33131	 они вероятно только что подниматься откуда-то родимый место делать широкий круг над этот место жалобно вместе призывно вести свой извечный курица 
33131	 только молоденький журавленок чуть поотставать родич кричать что-то свое мочь быть желать улетать туда зенит куда звать его мудрый вожак мочь быть просто понимать что приспевать пора лететь извечный дорога журавль прощаться родина кроме который пока еще ничто быть курица 
33131	 они бедняга попадаться как курица ощип обходиться 
33131	 николай рогодин хитрый быть мужик охотник чужой говорить вечер гринька говорить подседлывать какой-нибудь конь хотеть моев дуть деревня насшибать курица кто-нибудь 
33131	 через недолго время привозить пяток курица откручивать голова 
33131	 опять подкладывать они водосточный труба невозмутимо предлагать воробей это курица смех восклицать мячик 
33131	 так начало яйцекладка еще быть брудер инкубирование производиться районный инкубаторный станция режим курица быть решать вопрос правильный 
33131	 слово различаться два значение самец курица забияка применение 
33131	 это быть ирония злой насмешка над курица раскудахтаться после драка некрасивый гротескный 
33131	 колея наслаждаться ходьба горячий пыль бродить мальчишка курица 
33131	 лидочка сидеть подоконник ощипывать краюха хлеб крошка кидать под окно курица 
33131	 лидочка сидеть подоконник ощипывать краюха хлеб крошка кидать под окно курица 
33131	 долго наверное минута три быть слышно как косой негодующий фыркать стучать трава брезентовый туфля как ударять плетень кулак потом шаг стихать анискинский двор оставаться только свой звук клохтать курица похрюкивать свинья загородка 
33131	 возле крыльцо копаться земля курица крыша стоять коза 
33131	 затем обменять кое-что амуниция обмундирование орудие труд распахать четыре участок посадить сахарный тростник ананас банан табак лук чеснок заводить свинья курица 
33131	 быть курица полноценный если цыпленок съедать положенный она норма дождевой червь курица любить разгребать сено конечно 
33131	 естественно прийти такой вывод попытаться компенсировать этот потеря добавка известь питьевой сода пища курица лишь очень немного 
33131	 глядеть улочка белый крохотный босоногий беспокойный курица 
33131	 обыкновенно проходить верейский мост останавливаться любоваться город каждый раз открывать новый краска смотреть бурный желтый вода курица катиться так стремительно словно они 
33131	 михаська слыхать что быть такой примета если когда-нибудь курица воровать или там петух 
33131	 как-то хозяйский курица переполошиться собираться кучка 
33131	 человек этот случай действовать подобно курица ибо существовать точный примета предсказание 
33131	 этот второй оставаться община они быть низкорослый часто валяться канава подле казенный винный лавка почему-то всегда выходить так что они ребенок быть малый малый маленький баба сноси или чахотка малыш короста дома они где тоже бывать редко разбивать окно быть заткнуть тряпка теленок курица находиться тут пахнуть 
33131	 широкий двор бродить курица важно шагать три гусь 
