33131	 ласково похлопать свой верный любимец круп легко вскакивать седло ровный неторопливый рысь направляться сторона замок виконтесса виолетта мон курица 
33131	 прошка председатель захотеть ставить новый контора прежний место общий деревенский порядок где каждый утро вечер рев пыль оставлять после себя лепеха проходить усвятский стадо день-деньской возле правление сшиваться чей-то курица поросенок 
33131	 набиваться туда более пятьсот душа народ триста корова несчетный число теленок овца поросенок курица гусь собака кошка 
33131	 возбуждать хлебный запах воробей облеплять крыша сени сбиваться курица топтаться порог пытливый заглядывать 
33131	 натаха тоже молча уходить оставлять выбегать двор митюнька как только она скрываться сенцы оттуда заполошный кудахтанье перепрыгивать один через другой посыпаться курица вслед они вылетать березовый 
33131	 грустный военный пост где под нога старый ленивый служака разгуливать ленивый курица постоянный грохот ледяной грязный терек 
33131	 корм лес индюшка хватать если случаться бескормица они безбоязненный приближаться амбар смешиваться курица гусь 
33131	 ветерок шевелить белье веревка петух колонка голосисто скликать курица 
38375	 инженер щеголев изобретать конвейер для выращивание курица 
33131	 под печка клохтать курица хрюкать поросенок 
33131	 возле расположение его штаб пастись стадо ходить курица гусь поэтому кормить 
33131	 имущество движимый дело обстоять опять-таки по-своему рабочий лошадь называть нельзя потому что волость она выправляться свой лошадиный паспорт корова тот легко учитывать общественный стадо вот что касаться мелкий скот птица тут мочь говорить что овечка свинушка курица утка гусь жизнь 
33131	 тот случай мальчишка находить новый забава весь поймать змей доставлять богодула сидеть валун возле свой барак рука приподымать нога дразнить они хехекий как щекотка когда змея мгновенный прыжок пытаться прокалывать твердь блаженно приговаривать курица ров 
33131	 носить повсюду сад огород школа дом река тень дерево почтовый дилижанс дальний следование когда окно дождь плыть мимо деревня крыть солома нахохливаться будто мокрый курица душа мой человеческий страдание 
33131	 который день гнездо пустой курица сосед нестись 
33131	 вид это какой-то колючий страшилище вкус хорошо курица куропатка 
33131	 худой калеченый рваный голодный вороватый блеск глаз они торговать что попадя табак хлеб круг жмых собака кошка старый кальсоны ржавый гвоздь курица пшенный каша деревянный миска 
33131	 написываться этот второй фраза вставать вдруг перед глаз солнце заливать зеленый лужок двор где один один громоздиться серый сарай где курица погуливать посредине выбивать без 
33131	 парк оккупировать коза свинья курица играть тут ребятишки прятки 
33131	 конечно мой слово быть курица смех отказываться свадебный 
33131	 только один иннокентий иванович деревня дотягивать этот цифра иннокентий иванович всякий знать деньги курица клевать так 
33131	 красный фуражка вылетать двор распугивать курица колесо помчаться трава 
33131	 японский селекционер выводить петух курица хвост огромный длина 
33131	 виктор это мой муж слесарь оператор вдвоем выращивать тысяча курица несушка 
33131	 кобель кидаться тарантас облезлый кот взвиваться телеграфный столб курица трещать крыло шарахаться канава 
33131	 говорить москва курица доить верить 
33131	 пробовать совет местный специалист желудочный болезнь подкладывать мельница петух курица 
33131	 нечего писатель разводить курица они это дело 
33131	 томно квохтать курица захлебываться бег детский голос 
33131	 зеленый луг птицеферма точно хлопья выпадать снег покрывать несметный толпа белый курица 
33131	 нет плохо свет пакостливый завидный бабкин курица позавидовать дом жить 
33131	 костя муж полина все говорить кой курица 
33131	 двор суетиться проворный курица важно вышагивать гусь забор 
33131	 лот заорать гусь закудахтать курица жалобно замычать теленок 
33131	 провокационный входить солдатский комитет быть избираться солдатский депутат вовсе курица насмех иметь монархический симпатия 
33131	 понимать что значить гулять человек который срок десять год который уже жизнь прощаться сколько раз который сегодня утро еще быть столыпин завтра быть лагерь сейчас ходить смотреть как курица рыться станционный садик как 
33131	 быть вода носить смотреть чтобы курица огород попадать 
33131	 пойти останавливаться загнать курица телок накормить чтоб 
33131	 мама евлампьевна держать курица петух утка 
33131	 здесь продавать курица гусь теленок всякий живность 
33131	 вон человек даже курица нету жить 
33131	 начинать что сей пора даже старший тренер легкий атлетика областной спорткомитет курица чин знать это 
33131	 красный кепка муж никто нету курица собака козел яшка вот 
33131	 как относиться другой животное курица гусь овца олень мышь 
33131	 курица гусь овца олень мышь любить 
33131	 потом время бим разбираться что именно такой петух трусы убегать даже чужой петух врываться дворовый владение хотя весь правило куриный общежитие этот трус обязанный защищать покой подведомственный курица 
33131	 собственно сам курица красный петух 
33131	 тут тот секунда петух повесить крыло пригибаться побежать угол двор курица собираться беспокойный стайка участливый зритель 
33131	 рабочий при желание мочь держать сарай корова свинья курица многие иметь 
33131	 совсем недавно она появляться стальник расти долина курица 
33131	 себя курица твой чертовски повезти что эвакуироваться 
33131	 жить один внучка нюрка быть все что надо курица корова 
33131	 дед переключаться курица тот мол ходить грестись 
33131	 тот период кажется угощать синеватый курица консервы банк считаться 
33131	 лошник место где утро один другой садиться домашний курица чтобы снести очередной яйцо 
33131	 исчезать прелесть тихий зеленый сельский улица телок или козленок привязь размаривать жара добродушный пес курица гусь пушистый выводок 
33131	 марьяна ефим жить дружно хозяйство они быть маленький бедный свинья они держать около хата обносить тын бродить несколько курица луг арсеньев пастись 
33131	 где-то двор марьяна кричать петух беспокоиться курица 
33131	 заворачивать машина обратно театр теперь полпути быть курица смех 
33131	 наплывать сарай где корова курица телок живой теплый дух 
33131	 быть товарищ местный такой долбить все бывало курица воровать 
33131	 белосток вайс выходить вокзал куда устремляться весь пассажир скупать курица яйцо сдобный булка колбасный изделие 
33131	 утро сумерки просиживать окно угрюмо разглядывать серый тяжелый небо осклизлый забор раскисать капустный гряда белый кочерыжка голый заплаканный куст сирень под они нахохливаться курица мокрый обвисать хвост 
33131	 надсадно какой-то блаженный упоение заливаться скворец нежно задумчиво ворковать голубь протяжно словно пьяный распевать курица 
33131	 гневно осматривать дом ограда обругивать шепотом полуметровый лиственничный стена окно похожий из-за узкость малость амбразура дот обкладывать трехэтажный купеческий амбарчик стаечка чуланчик вызвериться два пустой собачий конура злоба доходить что петух курица посылать даль далекий 
33131	 драка затихать радость испуганный панкин курица трехногий пес шарик курица закудахтать пес вылезать 
33131	 оказываться что экстракт опухоль пропустить через фильтр мелкий пора который задерживать даже самый мелкий бактерия даже такой фильтровать бесклеточный экстракт вызывать здоровый курица саркома ничто отличаться 
38375	 миосаркома утка лимфоматоз курица млекопитающее 
33131	 как-то сказать один преуспевающий доктор что тот деньги курица клевать быть очень 
33131	 как-то сказать один преуспевающий доктор что тот деньги курица клевать быть очень 
33131	 как сообщать журнал какой-то пока еще неизвестный вещество пивной отстой повышать фертильность курица индюк 
33131	 берег курица катить свой бурный волна красоваться 
33131	 желтый вода курица подходить самый доска лавка 
33131	 звенеть весь синий тифлисский небо лист дерево избаловывать теплый ночь шумный вода курица даже стена дом улыбаться свой 
33131	 что отец курица воровать что 
33131	 отец дрожать рука будто курица воровать 
33131	 ходить ограда созывать курица цып цып цып 
33131	 вечер когда курица обсаживать шесток выходить хозяин хмурый 
33131	 взглядывать этот пробор этот ехидный взор взглядывать светлый брюки прочий разный штука взглядывать вкрадчивый манера этот морской инженер прошлое строить ледокол теперь строить курица что доводить тяжелый 
33131	 взглядывать этот пробор этот ехидный взор взглядывать светлый брюки прочий разный штука взглядывать вкрадчивый манера этот морской инженер прошлое строить ледокол теперь строить курица что доводить тяжелый 
33131	 наконец приходиться забаррикадироваться тогда шоссад передушить весь курица повесить огород замок ничто 
33131	 поблизости никто быть послеполуденный зной даже курица загнать тень только 
33131	 там курица нырять пыль встряхиваться ошалело 
33131	 взрывать пыль распугивать ошалело кудахтать курица они бежать улица пока 
33131	 залениться стрекотать кузнечик курица забиваться тень под крыльцо 
33131	 потом вспомнить как утро мама бояться что машка узнавать печальный участь выкармливать она курица петух 
33131	 серый изба пыльный улица крапива плетень курица завалинка покоситься прясло 
38375	 порода утка остальной порода курица 
33131	 нижний приступок крыльцо лежать зевать петушиный голова возле она бродить осипнуть кряхтеть наш поделить курица 
33131	 перебежать один дух возле сарай разметать соломенный крыша увидеть чужой курица 
33131	 тревожно прокричать петух курица хор закудахтать мгновенно смолкать 
33131	 весело призывно прокричать петух отвечать хлопотливый кудахтанье курица 
33131	 озеро женщина алла ярви быть округло озерный мужчина курица яур быть длинный иметь горловина 
33131	 подходить лагерь слышать над курица яур лебедь трубить 
33131	 спотыкаться козлович один другой впереди она сзади входить дверца вдруг очутиться странный темный помещение под самый соломенный крыша где очень возможно нашест спать жирный курица 
33131	 через неделя рано закудахтать первый курица еще огораживать двор 
33131	 посадить клетка под лавка рядом курица 
33131	 сейчас вспомнить как ястребок сидеть курица быть тошно 
33131	 ведь быть когда-то корова быть курица огородик все это без 
33131	 про какой-то доктор большой говорить присутствие митя что деньги курица клевать 
33131	 тот кто говорить про богатый доктор будто курица клевать деньги 
33131	 крошить курица капустный лист который они 
33131	 это шутю так ведь корова нестись нестись курица какой степень милый младенец 
33131	 кто только тут быть дезертир толстущий баба окрестный деревня оказываться безработный гувернантка экономка приживалка степенный чиновница вор рецидивист сопляк торговать рассыпной папироса поп кудахтать курица 
33131	 минута передо вставать париж сено каштан друг маленький уличка курица роан где жить шанталь 
33131	 первый мой воспоминание это большой двор курица белый рыжий кошка напротив 
33131	 это быть воспринимать как несчастие паче что накануне музо выдавать курица 
38375	 метод сублимационный сушка можно консервировать бифштекс антрекот фарш котлета курица рыба креветка картофель морковь лук 
33131	 слушать каин курица насест слушать надежда 
33131	 весь тот деревенька где брать вода колодец готовить керосинка где дом стена мычать корова квохтать курица серый убогий крыша 
33131	 дорога боржоми василий заезжать посмотреть гореть тут вдруг почувствовать что это родной земля крошечный долина излучина курица огибать плоский холм крепость 
33131	 лязгать гусеница клуб подниматься пыль шарахаться курица 
33131	 курятник выстраивать наспех как говориться курица смех вот когда 
33131	 разве гошка управляться клава мишка корова курица 
33131	 гошка очень любить чтобы музыка греметь весь дом двор мать считать что такой музыка курица разбегаться двор 
33131	 вынести дом соседка прижимать рука приговаривать что-то пойти огород свой курица 
33131	 огород все так беспокойно кудахтать курица быть туманно вокруг тепло 
33131	 тут огород пойти свиннота разный курица гусь она сроду они 
33131	 деревня этот непохожий наш быть двенадцать крепкий дом под дом аккуратно подмести подвал посыпать песок там бочка холодный яблочный сидр двор курица розовый свинья стойло тяжко 
33131	 кричать баран блеять коза кудахтать курица кричать петух наш дача уже 
33131	 быть игра двор порастать трава живописный сарайчик как деревня колодец курица дурно пахнуть помойный 
33131	 уже человек безликий койкодень обретаться больница курица кудахтать птицеферма некий 
33131	 пасека похерить пчела видеть невыгодный курица похерить 
33131	 легковой машина часто все волга шашечка сиять бок проноситься мимо мой окно стремительно вспугивать сполошный крик гусь курица свинья без 
33131	 хлюпать нос обида скрипеть прокуривать зуб быстро идти улица пугать примащиваться возле плетень курица 
33131	 большой ворота широко растворяться лишь тогда когда митрополит посещать представитель княжеский семья или привозить полоногий оброк повозка зерно дрова различный овощ курица прочий живность 
33131	 нюшка критически оглядывать лошадь заявлять что такой лошадь дядя вася никуда поехать только человек даже курица засмеивать 
33131	 деятельный курица раскапывать улица зады искать 
33131	 весь свой жизнь бабка коза проживать дымка вставать петух ложиться курица самый большой шум какой она 
33131	 трактор как солдат учение лихо повертываться один место потрясать перед себя тяжелый нож покатиться вдоль деревенский улица распугивать курица 
33131	 варяг кричать туман курица фра 
33131	 норвежанин встречаться тот спрашивать курица фра 
33131	 штурм лить помои цветник давить лизхен курица кошка 
33131	 утка гусь считать колхоз тысяча курица тот много 
33131	 первый замечать она саша сидеть корма доска вместо рулевой весло мешок курица лежать нос спина 
33131	 вынуждать быть сейчас выезжать курица 
33131	 называться так потому что курица наступление сумерки ничто 
33131	 это значить однако что зарождаться полезный план напротив всегда голова его иметься несколько весь они касаться неустройство второстепенный предел его учреждение как например проект выводить сорт картофель кубический форма для удобство укладка перевозка дальний расстояние последующий перенос если окупаться яйценесение курица 
33131	 никакой тучка замечаться пока над голова судя скопиться воздух истома как чиститься курица под забор благушинский хозяйка 
33131	 птицеферма комиссия ходить курица сигать через изгородь 
