33131	 ксения сдвигаться место никогда жизнь она рубить курица нога окаменевать 
33131	 рука ксения краснушка вдруг замирать словно оцепенеть весь другой курица петух ефрейтор отходить 
33131	 курица круг клевать зернышко благодаря 
33131	 потом ходить проведывать курица отрывать листок висеть стена 
33131	 они сортир хоздвор где лето жить курица 
33131	 черный бревно корявый ранетка желтый брус недостроенный дом бродить штакетник курица задний двор 
33131	 имя петух индоевропеец связанный его основной мифологический функция певец провозвестник заря русый петух певень петел петь петь общеслав курица санскра каути кричать реветь 
33131	 приносить дар весна животное бродить роща все лето курица выводить цыпленок петух громко распевать 
33131	 пестрый негодяйка курица отсутствие петух заниматься любимый 
33131	 солнце совсем уничтожать витас сенчявичус курица сонно квохтать свинарник вергилиус 
33131	 адрес простой под наманган кишлак катт курица 
33131	 куда надо напоминать спрашивать шофер катт курица тогда через джумашуй надо ехать 
33131	 вскоре они въезжать катт курица куда 
33131	 баранов курица даже корова вот 
33131	 ладно поскольку читальня деньги курица клевать вызывать дом 
33131	 тьфу тьфу отплевываться отряхиваться кикимора это курица лесавка общипывать они этот 
33131	 кафе уют где подавать два вид второй котлета маленький котлета особый вкус точно такой как первый больший шоссе сонно бродить курица здесь вообще много всякий птица 
33131	 как-то вечер собираться покормить двор курица 
33131	 вот тот утро когда велька выходить двор она уже греметь ведро птичник курица суматошно галдеть пихаться крыло 
33131	 купить пятнадцать курица пятнадцать петух быть уверять что курица жить моногамный брак 
33131	 микроб труп находить нерв спинной мозг курица быть замечать тот дегенерация 
33131	 заслуживать бронетанковый майор сдуру жениться молоденький учительница ночь глядеть тщательно бриться электробритва опрыскиваться одеколон красный москва строить курица аппетитный подруга жизнь 
33131	 слышный шум волна привычный кудахтанье курица экзотический крик обезьяна 
33131	 крайний мера всегда хотеться приваливаться плечо шершавый ствол старый липа так стоять слушать безмятежный кудахтанье курица вдыхать аромат травяной свежесть 
33131	 иной дом мелкий мусор объедки помои выбрасывать выплескивать прямо канава дом курица склевывать что мочь склевывать остальное 
33131	 скоро выпускать гусь курица сарай звать они 
33131	 курица гусиный крыло пугаться отбегать испуганно 
33131	 просыпаться вспомнить как гусь курица созывать судсуд судсуд 
33131	 там еще быть слон кенгуру черепаха курица петух 
33131	 надо быть пересекать этот большой утоптанный островок трава двор мимо деловитый разгуливать курица индюк попадать тесный 
33131	 маленький местный базарчик мама покупать курица тетя настя рубить они 
38375	 реклама средство для уход волос глисс курица легкий флюид шварцкопф 
33131	 суоми китай всюду родина святой подъезд телефон отрывать какой-то разжива трубка лифт который шанс рухнуть близкий шанс вляпываться вопрос бессмертный быт где брать этот курица 
33131	 видный быть очередь возвращаться восвояси гигантский курица 
33131	 ничего вздыхать этот повод глафира петровна курица быть главное парень 
33131	 восклицать пафнутьев нестись курица павел николаевич 
38375	 конфетти ухаживать волос продукт серия глис курица швартскопф 
33131	 никак еще они мерцать бальзам быть его вечер можно только выход прямой блестка видно волос рука потом фига смывать мой уход шампунь бальзам маска глис курица 
33131	 стоять блин помнить примерно рублик странно раз видеть еще флюид раз видеть глиз курица где продавать блин 
33131	 тут снова размечтаться собираться заводить гусь курица кабанчик который рождество 
33131	 участие отец советский водородный бомба домашний хозяйство сводиться основной два вещь рубить дрова тот инструмент лишать жизнь курица 
33131	 какой-то подмосковный хозяйство его превосходительство увидеть здоровенный клетка породистый белый курица 
33131	 деньги семья курица клевать иметь все дом 
33131	 мой деньги курица клевать всего полно загородный 
33131	 клиентка расплачиваться мастер кто как мочь обычно весьма щедро сельский вечно везти что-то свой огород из-под курица столичный штучка они быть большинство 
33131	 курица пойти запирать отвечать дед вполне 
38375	 аппарат для хот-дог сковорода для блин тостер для приготовление горячий бутерброд гриль вулканический лава вертикальный гриль гриль для курица это настольный оборудование выполнять 
33131	 гриль вулканический лава использоваться для приготовление сосиска мясной рыбный стейк колбаска курица другой блюдо 
33131	 нагрянуть без предупреждение приводить родитель полный отчаяние свой появление однажды утро свист оповещать все свой приезд так что округ испуганный птица срываться ветвь разбудить курица цесарка заголосить 
33131	 немногочисленный корова курица коза большой прибыль 
33131	 война опять лошадь после война поросенок корова коза курица животное держать арбат 
33131	 вот тот который ноздря раздуваться пение ехать домой везти сто сикля серебро жена петь лошадь косить голубой белок корова вымя измазывать навоз встречный обладать знание как пепелище расхаживать курица свинья детский 
38375	 высокопатогенный вариант для курица обнаруживать вьетнам 
33131	 особый внимание привлекать себя сообщение большой эпизоотия февраль среди курица голландия вызывать высокопатогенный вариант 
38375	 резервуар слабопатогенный для курица вирус обнаруживать природный 
33131	 бригадир галина михайловна касьмин сельхозпредприятие риа зимний стол свой земляк заботиться уже сегодня здесь выращивать курица гусь пятачок 
33131	 хотеть познакомить читатель грузинский режиссер который недавно два год небольшой начинать работать вологда перед глаз все возникать вечерний тбилиси какой запоминаться свет огонь отражать вода бежать курица великолепие грузинский театр 
33131	 микроволновка этот курица стейк сосиська хот-дог 
33131	 тот курица круг например делать 
33131	 вообще купить диск серия волшебный голос природа там малыш деревня малыш море малыш река малыш лес там классик адаптированный перед каждый произведение звук море или голос птица если деревня кудахтанье курица мычание корова гусь овца 
38375	 удаваться подтверждать антигерпетический активность бромуридин ацикловир рибавирина метисазон фоспренять использовать медицинский ветеринарный практика показывать ранее отношение отдельный вирус семейство простой герпес человек тип ветряной оспа ларинготрахеит курица ирт 
38375	 состояние апрель потрошеный полупотрошеный курица включая бройлер средний розничный цена 
33131	 другой пример метасоматический генезис уголь являться месторождение курица тека памир 
33131	 план сестра организовывать подсобный хозяйство заводить корова курица коза 
38375	 изоляция гонконгский разновидность вирус грипп больной курица камчатский область вопрвирусол 
33131	 раз три день приносить молоко горелый роща это для завтрак потому что еще быть курица 
33131	 шелест листва кудахтанье курица нервозный вопль коза грохот 
33131	 там насест курица быть сидеть бык реветь 
33131	 замечать быть наблюдательный хозяин соломенный крытый хата приютить автор что курица этот хозяйство яйцо 
33131	 двор просторный курица метаться пес будка приветливо 
33131	 отличие они курица голубь птица наиболее 
38375	 художник селиванов проживать жизнь деревня владимирский область рисовать курица утка писать дикий ошибка 
33131	 жизнь этамп быть веселый большой камин часто жарить курица как-то даже быть приглашать преподаватель 
33131	 или воображать декорация грандиозный опера музыка оборваться давным-давно солист кордебалет говорить дирижер оркестрант выводить двор расстреливать рабочий сцена капельдинер расхаживать между нарисовать дворец перекликаться строить курица костюмерша кулиса заводить быт 
33131	 поросенок отвозить закрытый наглухо машина некошерный кибуц мизра курица гусь зарезать 
38375	 может новый сарай для курица для индюшка для разный живность 
33131	 деньги старик судя дорогой подарок курица клевать 
33131	 асфальт заваливать конский коровий навоз клок сено немощеный переулок бродить курица гусь индейка 
33131	 лужа крыльцо тонуть заблудиться курица остаток надежда 
33131	 они быть хороший сад огород немного земля поле курица гусь корова 
33131	 положительно этот площадь рано разводить курица 
33131	 автобус дернуться тут глядеть прокапчивать фигура крыша думать петух курица козлы бородатый 
38375	 для съемка выдавать потылиха курица 
33131	 время быть тяжелый курица быть обрез 
33131	 этот объедки даваться следующий съемка этот курица очень запоминаться однажды наставать день 
38375	 курица вроде венгерский или французский 
33131	 во-вторых когда-нибудь слышать чтобы бразилия курица разводить 
33131	 хотя изо день день внушать что деньги страна курица клевать 
33131	 зависть местный мальчишка анжело грохот гонять свой железный конь утро вечер пугать старуха курица 
33131	 сам голова приходить влезать пятый этаж коза курица 
33131	 многий превращаться горожанин селянин держать двор свой дом весь город курица зарабатывать деньги продажа яйцо 
38375	 сравнение рецепторный специфичность вирус грипп выделять утка курица человек молекула биол 
33131	 кроме дом предел садовый кольцо коттеджный поселок они территория москва около существовать еще третий случай дом окраина деревня печь коза курица случай экзотический почти сказочный 
33131	 воздух ландшафт мычание теленок кудахтанье курица весь этот сельский веять 
33131	 заскулить отбрасывать его нога пес испуганно закудахтать курица грохнуть висеть сени корыто 
33131	 лишь мышь полевка ничто бояться воробей осваивать навоз весело чирикать зато курица чуять надвигаться смерть 
33131	 речь идти божественный благость каре непослушание вера безверие десница божий грех человеческий под который пониматься танковый батальон осуждать учинять злодейство выраженный кража курица гусь поросенок 
33131	 кстати сам слово курган это шумерский курица 
33131	 возле двор придерживаться свой территория пастись курица под надзор строгий петух 
33131	 просыпаться видеть окошко свой подымать подпорка скособочить дом под который шастать соседский курица 
33131	 военный гостиница надо быть идти вдоль берег курица через легендарный майдан кривой 
33131	 другой берег курица состоять сплошной отвесный скала 
33131	 петух уже подходить курица разглядывать они интерес 
33131	 зоя платоновна открывать дверь сарай зашевелиться курица неуверенно гаркнуть подставной петух 
33131	 кто это надо курица смех хотеть быть 
33131	 впереди замечать палатка где коптиться прут оранжевый курица 
33131	 памятный детство неукоснительный обряд воскресный завтрак втроем под воскресный радиопередача мажор венгерский курица продуктовый заказ раз 
33131	 побрести район пятиэтажка смиряться мысль что доходить голодный десять или даже одиннадцать утро когда открываться магазин тут случайно увидеть двор старушка она какой-то ласковый причитание кормить двор курица 
33131	 при это прямо над она крыша сарай собираться шумный стая воробей который верещать ссориться ожидать когда старуха кончать рассыпать пшено уходить они наконец смочь спархивать вниз мгновение око обжирать этот огромный тупой знать как воробей промеж себя называть курица короче тот который промахиваться склевывать 
33131	 все это показываться столь уморительный что подходить близко сфотографировать старушка курица воробей 
33131	 только собака лаять курица кудахтать пастораль 
33131	 стая пестрый курица высыпать выгульный база петух 
38375	 там основной курица утка поросенок скотина 
33131	 премудрый рахман они привыкать чужой джурек свой родитель поминать доумиться рахман сыпать свой порог семечко приманывать чужой курица приманивать шлычка набок 
33131	 там ребенок жить слышать что совсем там плохо продукт они голодать вот приносить курица сказать она торопливо пытаться сильный 
33131	 потом подниматься произносить фраза вот какой гуманист ожидать большой грех выходить свой сумка курица бог знать чем еще 
33131	 другой брэд себя позволять мочь поскольку папа быть любить строгий набожный деньги семья чтобы клевать курица 
33131	 этот день хозяйка толпа стекаться космодемьянский церковь курица подмышка служить молебен 
33131	 контур папа валентин поседеть галя один миг заснуть корова мой белый лошадка овца курица 
33131	 уже видеть местный курица даже поросенок один 
33131	 между хижина разгуливать компания курица бегать поджарый пятнистый поросенок 
33131	 вот что скрывать под набедренный повязка курица смех 
33131	 среди взрослый сновать голопузый мелюзга кусок лепешка очищать банан рука бегать туда-сюда курица который никто двор резиденция 
33131	 сквозь решетчатый стенка бамбук пробивать пыльный столб свет орать где-то петух квохтать курица 
33131	 вот упоминать высокий художник оформитель нанимать свой кровный потому что они курица клевать чтобы тот 
33131	 марина курица весь страна объединяться создавать ассоциация 
33131	 мария красиво ухаживать кондратиевич ходить корова доить проверять как хозяйство курица 
33131	 знать что кто-то мечтать перебираться кто-то последний держаться свой двадцать пять сотка десяток курица полуразваливаться дом 
33131	 она глаз дурной курица дохнуть хорек хорек 
33131	 предсказывать внутренность курица гусь жареный вид 
33131	 весь этот женщина тоже ходить обувь балли носить норковый шуба час ориент лидия быть даже обидно что для они это обыденный жизнь мочь она они объяснять что весь они глупый домашний курица она лидия птица высокий 
33131	 тихий российский провинция изба наличник колодец дровяник яблоневый сад копошиться пыльный трава курица обрывистый волжский берег небо 
33131	 дорога посрезать веревка мокрый белье собирать ведро сохнуть забор глечики горшок пихать мешок задумываться курица утей общий проходить 
33131	 самый нога окно полуподвал алеть герань курица чернильный метка перо 
33131	 сам заменгоф его сподвижник позаботиться чтобы кошка курица гусь коза прочий живность 
33131	 тот кто самовольный проводить свет сбывать некачественный продукт сеть бутерброд шаурма курица гриль заводить административный дело 
38375	 указанный продукт полагать решетка барбекю который устанавливаться металлический уголок как режим жарение шашлык приготовление курица гриль тушка курица насаживать 
33131	 это ноев ковчег тут корова телка бычок свиноматка курица гусь мельница для 
33131	 что курица воровать что что рука 
