27906	 среда закрытие торги доходность тридцатка 
41363	 конспект тетрадь задание журнал книга быть сделать новый бумага причем гораздо меньший загрязнение для окружающий среда сравнение первичный производство 
27906	 этот мероприятие лишь один пример как инвалид организовывать свой досуг при помощь долгосрочный областной целевой программа доступный среда 
27906	 рамка программа доступный среда делать много создавать служба 
14872	 подарить они как мечтать сережа интернет кафе где весь мочь общаться где быть свой среда 
27906	 после фиаско возрождение надежда александровна переезжать эртелев переулок адмиралтейский набережная заводить среда час шесть день 
41363	 ход работа конференция быть принимать декларация оон проблема окружающий среда включать принцип достижение 
41363	 ряд последний публикация команда ученый под руководство джордж баханда утверждаться что существовать возможность правда пока лишь теория производство синтетический или гибридный материал динамический изменение окраска под цвет окружающий среда принцип который 
27906	 год назад ноябрь год выдающийся физика теоретик лев давидович ландау больница где находиться после тяжелый автокатастрофа поступать телеграмма швеция королевский академия наука швеция сегодня решать присуждать нобелевский премия физика пионерский работа область конденсировать среда особенность жидкий гелий 
27906	 муж загерметизировать автогерметик дама время высыхать весь после выходной когда отопление давать обещать труба заменять среда включать 
14872	 казнь такой образ уже касаться лицо среда опричный окружение иван грозный 
14872	 александра это еще раз говорить как важно выбирать тот среда который ребенок быть расти 
14872	 александра такой образ получаться снова создаваться определять среда более или менее благоприятный 
41363	 свой заточение клейн относиться как принудительный научный экспедиция препарировать новый среда обитание 
14872	 советский оборонка быть очень тягостный среда 
27906	 модный бандитский среда наглухо затонировать тачка угрожать 
41363	 индивидуальный летательный аппарат другой новость среда обитание 
27906	 например андердог это жанр драма среда кинопродюсер быть предубеждение что драма 
41363	 если обычный геномика ставить свой цель изучение ген тот или иной отдельный организм объект изучение метагеномика являться беспорядочный смесь весь генетический молекула они обломок который можно вылавливать среда обитание большой коллектив тот или 
41363	 этот время человеческий вирус адаптироваться новый среда обитание забывать 
27906	 алексей второй половина среда галицкий русин происходить размежевание 
27906	 киргиз фондовый индекс сша завершать торги среда большой последний три неделя 
41363	 виноградский выдвигать предположение что новый тип метаболизм следствие экстремальный среда обитание такой как вода 
41363	 слово чиновник новый вариант соглашение более широко затрагивать проблема здоровье население среда обитание 
27906	 затем половина этот мышь самка самец детский возраст помещать два неделя обогащать среда второй половина оставлять 
41363	 если естественный отбор оставлять сцена природа наиболее сильный приспособлять среда обитание труд выводить первый 
41363	 иметь закрытый информация возможный причина подобный бедствие депутат госдума сентябрь год рассматривать проект постановление потенциальный опасность для человечество продолжение сша широкомасштабный эксперимент целенаправленный мощный воздействие околоземный среда радиоволна высокий частота предлагать 
14872	 такой среда непрозрачный для электромагнитный излучение фотон 
41363	 заводить велосипедный дорожка солнечный батарея современный очистный система мусороперерабатывающий завод вводить огромный штраф загрязнение окружающий среда плата право ездить 
41363	 как известно главный задача краска защита тот или иной материал коррозия воздействие дождевой вода другой неблагоприятный воздействие окружающий среда 
41363	 причина этот феноменальный ускорение один сторона становиться загрязнение окружающий среда браконьерство другой 
41363	 ирония судьба даже загрязнение окружающий среда способствовать появление новый вид тот 
41363	 процесс эволюция осьминог приспосабливаться новый среда обитание глубоководный область океан 
41363	 переход использование полезный ископаемое извлечение полезный элемент любой среда замкнутый промышленный бытовой цикл 
14872	 этот раствор среда автомобилист известный торговый марка 
41363	 причина отсутствие адекватный среда обитание любой город 
14872	 часто это неполный семья где мать фрустрировать социальный среда 
27906	 инфраструктура система денежный перевод хорошо приспособлять для реализация многий социально ориентировать программа осуществление пенсионный выплата доведение непосредственный потребитель финансовый помощь кроме становиться возможный продвижение среда самый малообеспеченный слой население сберегательный 
41363	 для автомат этот необходимость связываться потребность согласование его возможность обработка использовать формировать сигнал носитель сообщение среда применение 
14872	 такой образ требование унификация специализация модель метод контроль вступать очевидный противоречие мера успешность разрешение который определять ниша эффективный использование конкретный среда интернет обучение 
41363	 решение модельный задача прогнозный оценка состояние природный среда зависимость различный степень 
41363	 поскольку сумма плата загрязнение окружающий природный среда быть вносить плательщик вступление 
41363	 высокий устойчивость вирус фактор внешний среда минимальный заражать доза при 
41363	 иметься многочисленный данные оказывать влияние затрагивать весь жизненно важный среда атмосфера ценосфера гидросфера 
41363	 убедясь тот или при недостаточный средство или при резко враждебный среда можно отказываться даже сам 
14872	 удивительный народ сказать александра владимировна быть какой-то свой московский среда который себя привозить 
14872	 они находить поэзия положительный проза обыденный жизнь недовольство свой среда неизбежный отрицание 
27906	 сделать тот милость что оставаться карлсбад ходить мир среда июнь ввечеру семь 
41363	 бедный жена мой испугаться видеть что вдруг побледнеть примести что индижестие велеть первый деревня сваривать генишев чай среда август приезжать киев 
14872	 чередование предмет где необходимый усидчивость концентрация предмет где ребенок мочь подвигаться позволять создавать хороший обучать среда для неугомонный ребенок 
27906	 изменение среда происходить постоянно сегодня 
27906	 впрочем уже среда рынок госдолг вернуться покупатель 
27906	 вторничный торги завершаться совершенно сюрреалистический значение курс рубль вокруг доллар около евро однако уже среда происходить откат возможно сказываться 
27906	 уже среда панический продажа сходить нет 
41363	 однако стоить видеть этот среда голый функциональность подминать человек под 
14872	 там где градообразующий предприятие иметь долгосрочный перспектива нельзя спешить оптимизация бюджетный сектор который поддерживать занятость хоть какой-то качество социальный среда 
14872	 советский время как отмечать профессор иргт марк меерович вопрос формирование условие нормальный существование благоприятный среда жизнедеятельность человек традиционно отходить 
27906	 известный инновационный компания центр речевой технология санкт-петербург рамка государственный программа доступный среда разрабатывать технология генерация субтитр 
41363	 при переработка пэт выделять никакой вредный для окружающий среда вещество транспортировка переработка бутылка 
41363	 маршрут газопровод анапа варна тщательно разрабатывать основа результат исследование более тысяча километр дно черный море также многочисленный исследование окружающий среда технический заключение 
41363	 исследователь цюрихский университет много год наблюдать группа суматранский орангутан естественный среда обитание быть тропический 
27906	 противоположный сторона двигаться курсы мексиканский песо турецкий лира понедельник среда потеря составлять 
27906	 первый половина среда позитивный настрой долговой рынок 
41363	 помимо предупреждение негативный воздействие окружающий среда компания работать ямал активно 
27906	 рамка программа доступный среда только сделать пандус 
41363	 впереди новый полугодие новый формат газета новый день выход среда новый конкурс акция 
27906	 рамка федеральный программа доступный среда предусматривать средство для регион участник 
41363	 весь это условно называть комфортный среда обитание 
41363	 первый ласточка становиться исследование проводить национальный центр гигиена окружающий среда мюнхен 
27906	 создание доступный среда для инвалид многогранный понятие рассказывать 
27906	 создание доступный среда для инвалид многогранный понятие 
14872	 это среда говорить правозащитник светлана ганнушкин 
14872	 высокий это представитель дворянство достаточно родовитый или очень родовитый традиционно служилый другой среда удивительно так семинария который 
41363	 среда обитание мегаполис американец крис берден 
41363	 тогда человечество ничего другой оставаться кроме как еще много усиливать вмешательство естественный ход событие фактически взять себя формирование искусственный среда обитание единожды описывать фантаст 
41363	 улыбка дрожь покраснение или бледность естественный реакция организм стимул внешний среда 
41363	 численный моделирование предоставлять возможность легко менять различный параметр геологический структура варьировать упругий параметр среда изменять геометрический размер трещина 
41363	 одомашнивание морской животное вообще затык разный среда обитание корова слишком тупой 
14872	 какой-то случай страшно подходить этот среда очень криминализовать 
41363	 браконьерство эпидемия эбола уничтожение тропический лес естественный среда обитание горилла неуклонно сокращать они 
14872	 политический возможность определять политический институциональный среда режим задавать стимул для 
14872	 как говорить социально разнородный эгалитарный среда бывший пивнушка давать бог 
14872	 для это сложный разговор тот среда который порождать 
41363	 оценка показывать что ресурс окружающий среда вполне допустимый население 
41363	 наконец борьба сохранение окружающий среда являться абсолютный ценность 
41363	 такой жестко иерархический субординационный структура как армия низведение священник уровень техобслуга вряд быть способствовать повышение его авторитет среда кадровый военный 
27906	 обыкновенный вторник среда как будто ничто поменяться 
41363	 бактерия устойчивый антибиотик бактерия вирус повышенный патогенность устойчивый внешний среда аэрозоль изменять 
41363	 опираться результат излагать публикация посвящать оценка влияние генетический фактор индивидуальный среда близнецовый пара 
27906	 думать что среда договариваться уже поздно 
41363	 получение вывод основывать применение экспертный знание исходный данные описывать состояние изменение состояние элемент объект внешний среда сам отс 
14872	 однако использование данный закон приводить неопределенность величина потенциал предел бесконечно протяженный гравитирующий среда который известный как парадокс 
27906	 уже среда впервые история шахматы чемпион 
41363	 российский федерация законодательный статус овос утверждаться благодаря приказ минприроды утверждение положение оценка воздействие окружающий среда 
41363	 структура овос учитывать весь компонент природный среда воздух поверхностный подземный вода 
14872	 там где отсутствовать традиция закон где рабство пропитывать весь общественный среда там политический преследование обращаться 
41363	 большой число задача выдвигать перед естествознание техника сводиться решение дифференциальный уравнение как обыкновенный при изучение система конечный число степень свобода так частный производная при изучение непрерывный среда квантовый физика 
27906	 спасибо во-первых ванная быть во-вторых уже среда мыться 
27906	 возможно впрочем что тут влиять мещанский среда который выходить брюсов 
14872	 она разделять убеждение предрассудок свой среда шовинистический монархизм великорусский парадный патриотизм 
14872	 анна квиринг изолированный среда расти социальный производный 
14872	 также среда который оно окружать 
41363	 нервный система общий мозг частность это орган служащий для адаптация внешний среда путем получение информация 
27906	 среда позитивный настрой долговой рынок 
27906	 впрочем уже среда настроение инвестор вновь заметно улучшаться 
27906	 после еда обязательно укол два укол среда какой-нибудь операция сегодня кстати 
27906	 впрочем уже среда мнение участник рынок повод 
14872	 колония становиться расти распространяться поверхность среда какой-то определенный скорость 
14872	 проходить совсем немного время ювелир курмышов становиться свой среда его приглашать премьера вернисаж 
41363	 основной урок для садовод должно становиться что дикий или естественный для определенный среда цветок наверняка привлекать пчела что 
41363	 первый что приходить подобный модель телекамера научный аппаратура борт подталкивать лазерный луч смочь неограниченно долго держаться воздух проводить мониторинг окружающий среда выполнять разведывательный задача 
14872	 этот год иван грозный невеста выбирать как для себя так для свой сын незнатный дворянский фамилия тот среда который являться опора его политика 
41363	 центр несколько организация параллельно получать доступ вычислительный ресурс либо использовать некоторый пакет например связывать механика сплошной среда 
41363	 как выясняться среда исключительно высокий уровень неблагополучный человек 
41363	 рождение поглощение утечка нейтрон зависеть нейтронный поток зависеть параметр среда состав геометрия 
27906	 впрочем оранжевый партия движение ставить качество программный заведомо несуразный абсурдный цель получать распространение уже конец советский эпоха происходить художественный среда 
41363	 проводить исследование грунт кряхтеть старик иметь привычка докладывать окружающий среда свой занятие 
41363	 дом воздвигать создатель качество наглядный пособие формирование новый среда отодвигать вглубь квартал отгораживать более 
41363	 этот работа надеяться вооружать политик администратор более корректный информация как сделать транспортный инфраструктура эффективный безопасный для окружающий среда 
