41363	 браконьерство истощение природный ресурс уничтожение естественный среда обитание весь этот фактор вести 
41363	 проблема окружающий среда пора великий ускорение внимание 
14872	 калитин скит который миновать день среда местный раскольник известный история свой 
41363	 биоразнообразие связанный многие чисто практический проблема такой как сельский хозяйство защита растение борьба вредитель переносчик болезнь контроль над инвазивный вид животное растение мониторинг состояние окружающий среда 
41363	 здесь проводиться исследование изучение свойство материал применение нейтрон реакторный технология тот число работа низкообогащенный топливо обращение радиоактивный отходы мониторинг окружающий среда 
41363	 этот гироскоп отсутствовать трение ротор опора ротор окружающий среда трение механический гироскоп 
27906	 весь драник драник понедельник драник вторник драник среда 
27906	 после прополка бесконечный грядка мытье пол показываться отдых среда жизнь налаживаться окончательно приходить посылка 
41363	 они запрещать убийство кража ложь любой незаконный действие причинение вред человек добрый воля призывать супружеский верность помощь ребенок почтение родитель умеренность ответственность прилежность уважение иной религиозный взгляд поддержка справедливый правительство защита окружающий среда 
27906	 среда мероприятие а-ля текила пати 
27906	 надежда ахмадулин алчный лекарь сожаление есть среда образованный 
41363	 конференция организовывать общество охрана кит дельфин хельсинкский университет финляндия группа специалист область охрана окружающий среда философия право этика заявлять 
14872	 каждый культурный среда должный говорить понятный 
14872	 влиять сам испытывать влияние фольклор одновременно сам среда очень похожий фольклорный 
27906	 городской среда обилие парк зеленый двор 
41363	 техногенный воздействие окружающий среда город уменьшать внедрять безотходный технология 
14872	 литература книга частично писатель критика журналист филолог еще тот закваска оставаться цивилизация социальный культурный среда радикально изменяться 
27906	 вот деньги зайти однажды вечер очередной среда уфли 
41363	 свой исследование гэри восточный чикаго индиана мэтью кренсон попытаться выяснивать почему некоторый город уделяться меньший внимание охрана окружающий среда сравнение другой 
41363	 оценивать реальный состояние весь загрязнять территория рассматривать этот уровень качество стартовый уровень для осуществление программа минимизация негативный воздействие окружающий среда накоплять ранее экологический ущерб 
41363	 правительство необходимо разрабатывать норматив качество окружающий среда учитывать состояние особенность конкретный территория 
41363	 свой решать принципиальный роль охрана окружающий среда должно сыграть наш гражданский общество 
27906	 ждать через два неделя среда два час день 
14872	 если имя вписываться культурный среда человек детский год испытывать 
14872	 именно такой человек создавать город особый культурный среда который доминировать свобода выбор 
41363	 рядовой житель осло рьяный борец чистота окружающий среда 
27906	 этот цель здесь запрещать вторник четверг выезжать машина четный номер понедельник среда нечетный 
41363	 здесь проводиться множество конференция саммит заседание посвящать охрана окружающий среда 
27906	 воровской среда картежный игра всегда быть 
37772	 прослеживать шаг шаг жизненный путь молекула метан углерод плюс четыре атом водород попадать водный среда всякий раз подсчитывать энергия 
27906	 андрей критский понедельник февраль кафедральный соборный храм христос спаситель вторник февраль богоявленский кафедральный собор среда февраль троицкий собор 
14872	 увы сегодня существовать серьезный проблема социальный инертность молодежный среда 
41363	 обпс так сильно влиять состояние окружающий среда 
27906	 вот поэтому среда вечер сапелкин вылетать красноярск 
41363	 качество система автоматизированный проектирование сапр быть рассматривать интегрировать среда проектирование 
27906	 этот неделя возможный только четверг следующий пока все свободно кроме среда половина день 
41363	 наличие множественный различие морфологический строение поведенческий повадка зверь экологический особенность среда обитание наконец генетический затруднять 
27906	 среда поздно вечер когда москва 
41363	 результат обработка выполнять исследование устанавливать что основной источник загрязнение окружающий среда промышленный регион город 
27906	 разумеется среда вечер когда все только начинаться 
14872	 понятно что борьба набирать сила цифровой среда мощный торговый предприятие проигрывать 
41363	 начинать год сша канада многий европейский страна япония процедура оценка воздействие окружающий среда овос быть законодательно вводить 
14872	 обрабатывать такой образ дума собирать минувший среда голос утверждение степашин 
14872	 музыкальный круг среда деятель культура она знать 
14872	 быть свой союз благоденствие эполетный среда будущий декабрист 
14872	 либерал такой что умещаться среда московский профессура 
27906	 так длиться два год среда 
41363	 защита среда защита живой организм защита человек 
27906	 развертывать нагревать телеграмма прочитывать улетать среда ночь таня 
41363	 загрязнение окружающий среда тысяча раз безопасный что 
41363	 невод это уже угроза для иссякать рыбный богатство сделать нейлон значит продукт химический промышленность который загрязнять вода воздух следовательно невод объект критика антитоталитарный борьба охрана среда обитание 
27906	 никанор иванович босой председатель жилищный товарищество дом бис садовый улица москва где проживать покойный берлиоз находиться страшный хлопоты начинать предыдущий ночь среда четверг 
14872	 бояться говорить поди опять яков сказать говорить что без они никак невозможно среда швадьба 
14872	 это настоятельный для что теперь оба наш главный противник уже вне наш среда 
14872	 пойти впредь свой путь быть черпать вдохновение источник окружать становиться действовать тот среда который поставлять судьба 
27906	 публиковать текст день неделя указывать почти всегда сдвиг один или даже два три день сравнительно календарь год вторник вместо среда 
41363	 одновременно университет пересматривать основный приоритет теперь фокус внимание здоровый продукт питание среда обитание здоровье образ жизнь 
27906	 среда фон заметно улучшаться конъюнктура 
27906	 фильм снимать телефон гаджет быть программа артдокфест среда 
41363	 деятельность только оказывать негативный воздействие окружающий среда создавать негативный имидж 
27906	 среда четверг стоимость бивалютный корзина вырастать 
27906	 среда фон заметно улучшаться конъюнктура 
14872	 похоже минфин наконец услышать представитель бизнес среда который давно добиваться снижение страховой 
27906	 так понедельник среда индекс ммвб подниматься 
27906	 данные отчетный неделя завершаться среда февраль нетто отток капитал 
27906	 доступный среда общеобразовательный школа старый русса 
27906	 доступный среда общеобразовательный школа старый русса 
14872	 притом лидер заговор среда гуманный технократ сам дивиться бунт 
27906	 например многий знаменитый ныне оптинский старец прославленный что второй половина век они являть свет мир давать россия именно купеческий среда 
27906	 отмечать что несмотря высокий темп рост аналогичный период прошлый год регион выполнять всего лишь работа годовой план тыс метр жилье среда ноябрь микрорайон кречевица 
14872	 молодой задор напоминать известный фраза миллер семья девушка крестьянский среда возмущение отметать приписка разочарование 
41363	 применять оно заводской труба или даже открытый воздух можно снижать негативный эффект выброс парниковый газ атмосфера что позволять нормализовать содержание углекислый газ окружающий среда 
14872	 говорить что ощущение эмигрант путешественник находиться чужой среда двигаться синусоида вверх 
41363	 инициатива ссср быть подписывать конвенция оон запрещение военный любой иной враждебный использование средство воздействие окружающий среда 
14872	 все-таки далеко близко школа надо искать такой среда для ребенок где такой проблема 
14872	 неправый тот другой архитектор должный создавать образ среда пространство пространство намного более емкий 
14872	 она отпочковываться тот однородный среда который образовываться начинать 
41363	 это лишь некоторый проблема который вспоминаться едва заходить речь охрана окружающий среда юар 
27906	 решать совмещать этот два история антропологический исследование мгновенный фотоотпечаток как два дополнять друг друг рассказ этот своеобразный среда доверие 
14872	 теперь уже андеграунд обозначать логика маленький независимый предприниматель часто музыкантский или артистический среда который стремиться обустраивать конфиденциальный культурный 
27906	 вот макс надо отмываться среда 
27906	 трудно вспомнить художественный среда незадолго семнадцатый год 
41363	 общий случай она зависеть состав свойство среда геометрия 
27906	 клюкнуть после дежурство коллега повод наступать новый год мочь тот среда ладно ладно пусть чудо 
41363	 законодатель фактически действовать принцип что плохо для плохой для гэри поэтому корпорация вполне устраивать существовать уровень контроль загрязнение окружающий среда город 
41363	 качество окружающий среда должно становиться важный показатель 
41363	 тот число новый судно который уже строиться санкт-петербург год пойти экспедиция говорить валерий мартыщенко заместитель начальник управление мониторинг загрязнение окружающий среда полярный морской работа росгидромет 
14872	 студенческий среда становиться очень много анархия 
27906	 любить ценить она характер татьяна павловна уметь ладить весь что актерский среда бывать нечасто 
14872	 интернет это среда который все много профессиональный 
27906	 деньги счет держатель облигация среда поступать 
41363	 примечательно что киотский протокол становиться первый глобальный соглашение охрана окружающий среда основывать рыночный механизм регулирование 
14872	 этот случай она сам выбирать свой среда бурмистров сам себя пополнять 
41363	 фактор воздействие геологический среда море гора 
41363	 эффективность общий как надстройка над бизнес рост население повышение его образовательный уровень здоровье нация экология среда обитание расширение граница 
27906	 линейный вихорь трехмерный упорядочивать джозефсоновский среда 
41363	 результат аналитический метод анализ синтез потерять свой эффективность сложность аналитический описание современный система цифровой обработка сигнал особенно если требоваться учитывать влияние среда распространение сигнал или нелинейный эффект 
27906	 целое процесс происходить фон уменьшение кислотность минералообразующий среда 
41363	 ведь водоросль быть естественный среда обитание морской конек 
14872	 такой образ бытовать песня булат окуджава другой бард интеллигентский среда поколение начало год 
41363	 верховный суд решение гкпи признавать постановление правительство утверждение порядок определение плата предельный размер загрязнение окружающий природный среда размещение отходы другой вид вредный 
41363	 быть вместо чтобы лечить инфекционный компонент кожа насыщать кожа вода изменять который свой очередь изменять среда обитание микроб врач пытаться что-то 
41363	 медицинский одежда изготавливать антимикробный материал как показывать исследование защита обеспечивать она самодезинфицирующий свойство постоянный поступление антимикробный препарат окружающий среда также кожный покров 
27906	 сентябрь среда апелляционный инстанция арбитражный суд 
27906	 среда когда все начинаться никто 
14872	 все сметь заверять недостаточный уровень автоматизация далеко основной препятствие путь развитие электронный бизнес россия главное среда электронный бизнес интересный тот предприятие 
41363	 страна высокий технология высокий репутация канада такой отрасль как телекоммуникация машиностроение транспорт микроэлектроника медицинский оборудование программный обеспечение гидроэлектрический ядерный энергия электроника биотехнология производство продукт питание защита окружающий среда 
41363	 снова вернуться свой главный проект безнадежно пытаться убеждать руководитель страна пересматривать принцип финансирование здравоохранение произносить гневный речь охрана среда обитание множественность фактор ведущий 
27906	 среди русский православный рассеяние можно быть усматривать два тенденция два тип один тенденция быть чисто охранительный эмигрантский сидеть чемодан мечтать возвращение родина думать посторонний среда совсем другой тенденция быть 
27906	 выбираться один день когда все быть удобно обычно среда преподаватель устраивать лекция 
27906	 нет трешка среда поинтересоваться монтан 
41363	 частенько наведываться мамин соратник борьба загрязнение окружающий среда антон александрович 
14872	 установление дисциплина единство весь советский человек лагерь изгнание предатель свой среда нанесение ущерб враг создание комитет 
27906	 близкий среда свободный эстетика столовая литературно-художественный 
41363	 в-третьих весь это сопутствовать экологический загрязнение окружающий среда некоторый случай отравление 
14872	 находить мотивационный символ который что-то для значить через они вовлекать сотрудничество выстраивать обучать среда который содержать никакой элемент 
14872	 ученый предупреждать больший часть наш заболевание связанный агрессивный среда который сам создавать 
41363	 существовать технология производство белена целлюлоза замкнутый водооборот позволять полностью исключать негативный влияние окружающий среда 
41363	 глупо охранять популяция нужно охранять среда обитание 
41363	 для заметный событие становиться запуск первый россия облачный сервис централизованный управление мобильный устройство корпоративный среда создавать совместно 
27906	 впрочем уже среда фон сведение возможный 
27906	 кроме совет быть представлять информация участие новгородский область государственный программа доступный среда год 
27906	 для решение вопрос улучшение положение принимать долгосрочный областной целевой программа доступный среда год 
27906	 принимать действовать областной целевой программа доступный среда 
41363	 десяток тысяча морской животное расселяться район риф лишаться привычный среда обитание 
27906	 интеллигентский среда поселяться изобилие неотрефлексировать вульгаризм 
41363	 такой сценарий который устраивать только житель бирюлев среда обитание который вдруг изменяться 
