26528	 хороший лечебный эффект половой гормон наблюдаться рак предстательный железа матка яичник 
26528	 рак половой член это бывать 
26528	 важный значение иметь профилактика рак половой член заключаться устранение 
26528	 это потребоваться большой часть книга посвящать гинекология так женский половой орган нередко возникать воспалительный процесс появляться опухоль многие известно такой сожаление распространять заболевание рак матка 
26528	 результат исследование американский ученый университет штат миннесота ежедневный потребление ложка непереработанный зерно существенно снижать риск смертность рак сердечно-сосудистый другой хронический заболевание 
26528	 проффер глава легендарный издательство ардис просить он этот проект говорить карл быть рак желудок он быть больно 
26528	 надо быть поставлять она рак давать зад как 
26528	 он один он известный способ лечить всякий болезнь рак 
26528	 срок процесс этот болезнь заставлять мы думать отправка к с париж где как мы становиться известный лечение рак предстательный железа давать очень большой 
26528	 пилихина начинать снимать быть уже смертельно больной рак позвоночник 
26528	 понятно здесь столько проблема приходиться четко очерчивать приоритет рак молочный железа репродуктивный право 
26528	 сейчас выходить увидеть мы рак мозг подхватывать ефим 
26528	 шесть год ира муравьев смочь переубеждать свой однопалатница верить еврей отравлять гематоген рак рыбий жир туберкулез 
26528	 дура рак говорить лейтенант этот 
26528	 семенов александр динозавр болеть рак все знать динозавр неожиданно 
26528	 этот дубль я переболеть четыре инфаркт быть умирать шестиместный палата военный госпиталь рак желудок шестьдесят пять неполный 
26528	 отец умирать я всегда казаться это запрещать удар судьба рак желудок 
26528	 умирать гриша поляк рак прямой кишка обнаруживать стадия 
26528	 умирать гриша поляк рак прямой кишка обнаруживать стадия 
26528	 рак я ползать быть выпаливать 
26528	 ничто оставаться потому все съедать рак заводиться 
26528	 такой рак душа никто нужный 
26528	 этот самый здравый мысль двадцать год надеяться что рак душа зачем тянуть мучаться 
26528	 мы рак мы стрелять весь 
26528	 пациентка рак последний стадия она проходить 
26528	 костина галина государство рак каждый год мир регистрироваться 
26528	 каждый год мир регистрироваться десяток новый лекарство рак давать надежда 
26528	 каково знать чудо-лекарство определенный вид рак наконец появляться иметь 
26528	 они дополнять первый таргетный препарат трастузумаба буквально производить революция лечение данный вид рак 
26528	 слово заведующая отделение химиотерапия ронц имя н н блохин вера горбунова век мы наблюдать значительный прогресс лекарственный терапия рак основной препарат бить 
26528	 далее следовать вопрос племянник сестра брат который все исправно помирать рак 
26528	 предполагаться активизация этот белок связанный появление рак 
26528	 предыдущий место рак умирать здесь ребенок 
26528	 тут еще подоспевать е год изучение диета эскимос который основное питаться жирный рыба высокий содержание омега кислота это почти болеть рак 
26528	 данные последний неделя сентябрь иностранный инвестор вкладывать фонд ориентировать российский рынок доллар аспирин рак любой случай 
26528	 осмысливать этот фильм время его выход окончательно понимать рася падымаютскаливать все больше ставить рак зарывать средневековый обскурантизм 
26528	 они я поставлять мочекаменный болезнь подагра подозрение рак простата остеохондроз панкреатит холецистит увеличивать 
26528	 интернет как-то прочитывать целитель лечить рак простата позвонить он 
26528	 регулировать работа иммунный система важный профилактика рак молочный железа он нужно пить 
26528	 этот разработка помогать обнаруживать рак самый ранний стадия 
26528	 наш завод работать смерть оборонка один я еще наш любимый товарищ который делать прибор рак мы работать жизнь 
26528	 отличие майка тот быть одиозный пожиратель ухо человек побеждать рак семикратный чемпион тур франс 
26528	 я он еще непонятно кто тут рак вставать 
26528	 мы тогда полночь ржать представлять виталик хуторской стоять рак надевать мы тапочек 
26528	 столько раз казаться я рак 
26528	 рак мощь агапит никто температура 
26528	 потому приготовление живой активный рак употребление пища моллюск 
26528	 изучение один древнеегипетский мумия помощь компьютерный томограф высокий разрешение показывать этот пожилой человек скончаться год назад рак простата 
26528	 поставлять свеча рак преподобный христофор арсений отступать 
26528	 евфросиния полоцкий монах показывать один рак 
26528	 арсений подносить свеча надпись один рак 
26528	 почему он болеть рак понятно уже сегодня 
26528	 гроссман который рак метастаз аккуратно вырезать весь 
26528	 валерка этот рак ее изнутри сжирать он 
26528	 этот связь наблюдение данный галактика мочь становиться первый прямой доказательство подтверждение существование этот таинственный астрономический объект новый способ диагностирование рак старшеклассник дело борьба 
26528	 дело борьба страшный болезнь рак подключаться уже совсем юный дарование 
26528	 много год назад профессор ирвинг вейсман работать медицинский школа стэнфорд вместе группа ученый заниматься изучение рак кровь лейкемия 
26528	 ученый уже быть доказывать ежедневный прием аспирин снижать риск смерть инфаркт некоторый вид рак 
26528	 то препарат уменьшать вероятность то рак давать метастаз 
26528	 сей пора новость изредка появляться известие чудо рпц икона заплакать молитва исцелять рак почему случаться 
26528	 далее следовать вопрос племянник сестра брат который все исправно помирать рак 
26528	 отец рассказывать они приятель институтский жизнерадостный парень балагур душа компания вдруг бах рак еще такой 
26528	 сниматься обнаженный социальный проект защищать ты дорогой направлять поддержка первый мир вакцина рак шейка матка 
26528	 жена рак заболевание крайне тяжелый 
26528	 жена сериал группа человек все они больной рак 
26528	 идеальный модель любой наш неприятность рак гипертония болезнь альцгеймер прочий 
26528	 слагать то быть рак пятиться весь все 
26528	 он любить открывать церковь почти конец день он быть ключарь торопиться зажигать лампада рак святой мученик пещера затем 
26528	 напоминать сорокалетний школьный учитель находить неоперабельный рак давать год жизнь 
26528	 они быть давно знакомый тот пора мама поставлять диагноз рак мхитарян сказать 
26528	 жена то поставлять диагноз рак сделать биопсия 
26528	 жена повод мой ссылка я говорить йога рак лечить 
26528	 виталий муж повод ваш ссылка йога лечить рак иже они 
26528	 жена перепутывать рак депрессия говорить что 
26528	 отсюда сформировываться положение то рак легко предупреждать что лечить 
26528	 следующий номер наш журнал главный тема быть посвящать новый подход лечение рак 
26528	 сверхскоростной самолет поезд клонирование лекарство рак вот-вот открывать телепортация 
26528	 быть я следующий раз полчаса рак почечный лоток стоять пока 
26528	 отдаленный последствие то почему тот мусульманин гораздо редко католик православный случаться рак прямой кишка 
26528	 там ребенок бояться рак укол приходиться долго искать 
26528	 я они забывать все мамин болезнь клиника то свет быть рак 
26528	 мой семья весь солдат уже умирать один еще м другой семь год назад рак 
26528	 его род женщина три поколение заболевать рак преодолевать летний возраст 
26528	 ход исследование быть выделять два группа клетка рак поджелудочный железа 
26528	 половина премия присуждать харальд цур хаузен открытие вирус папиллома человек вызывать рак шейка матка другой половина разделять 
26528	 каждый год рак шейка матка уносить тысяча 
26528	 ученый давно предполагать рак шейка матка другой генитальный 
26528	 печатный издание заполнять реклама всякий род сомнительный средство рак 
26528	 здесь лидировать антиоксидант вещество они кстати много витамин который нейтрализовать свободный радикал активный форма кислород играть ведущий роль процесс старение патогенез многий болезнь рак болезнь альцгеймер 
26528	 великолепный натюрморт распадаться бог знать уже быть видно поднос чуть потемнеть серебро золотой спираль лимон хрустальный бокал винный изумрудный блик бутыль рак чуть сморщенный уже никто 
26528	 лебедь рак щука я иметь 
26528	 стараться занимать мозг насущный дело думать разный мелочь задаваться вопрос жена действительно рак как он быть один 
26528	 например басня иван андреевич крылов лебедь щука рак начало должно быть 
26528	 андрей макрушина далекий обещание пара год начинать производство универсальный лекарство рак эликсир вечный молодость 
26528	 что выбирать ненадежность это боязнь практический свидетельство нету папа римский рак прямой кишка исцелять 
26528	 энергичный сметливый болезненно мнительный опасаться почему-то рак прямой кишка хладнокровный игрок 
26528	 старый крым рак желудок никакой море смерть 
26528	 женщина серьезный вид читать книга рак тактика исцеление 
26528	 зона радиоактивный загрязнение рак щитовидный железа встречаться гораздо часто 
26528	 распадаться он давать технеций который применяться диагностика многий болезнь кость сердце почка рак 
26528	 г-н рак стажироваться мы отвечать 
26528	 потом быть девушка оксана год назад спасаться рак йога голодание 
26528	 федор становиться конструировать чучело он раскраивать дубить сшивать штопать шкура зверь выплетать проволока хитроумный костяк походить корабль птерозавр парусный рак компоновать фантазия крепить 
26528	 рак уже большинство страховой компания 
26528	 я говорить что должно быть нарисовать микки маус поза рак 
26528	 лена рак дома она почему-то быть 
26528	 знание частота появление новый клетка печень поджелудочный железа позволять создавать новый метод диагностика лечение рак печень диабет 
26528	 ст картографировать ген рак наш день демонтировать многий 
26528	 время купание нырять маска рак 
26528	 многочисленный уверение она говорить последний американский исследование предотвращать рак пищеварительный система 
26528	 сколько раз твердить мир солнце вызывать ожог бесспорно достаточно плохо сам себя угрожать рак кожа 
26528	 этот связь другой специалист рак профессор карола сикор говорить что 
26528	 смерть бэйтсон жить эсален мучительно умирать рак последний день переставать 
26528	 креветка осьминог омар кальмар рак медуза мидия такой 
26528	 защита напротив утверждать кофе иметь лечебный свойство помогать некоторый болезнь например рак повышать уровень внимание 
26528	 оказываться этот вещество сдерживать развитие определенный форма рак 
26528	 оказываться его участок отвечать естественный защита организм рак претерпевать негативный превращение 
26528	 каждый капля свой судьба свой географический прописка туберкулез сильно рак использовать крохотный возбудитель туберкулез 
26528	 мой родной тетя рак химиотерапия почти постоянно 
26528	 потому очень сильный кашель мокрота бабуля мочь скрываться пневмония туберкулез рак легкое 
26528	 январь устанавливать диагноз запускать рак желудок 
26528	 господь политика думать мы изучать рак кожа пожилой мужчина основной 
26528	 что вы столько год молчать дожидаться слива вор закон который проходить дело убийство турок ресторан скончаться г рак 
26528	 мочь попробовать традиционный развлечение пиво тарань рак кстати собака размер 
26528	 отец пять год назад рак желудок умирать так мы 
26528	 мой жена приезжать я рак желудок 
26528	 это какой-то кто говорить нельзя держать зло себя это бывать рак поэтому надо избавляться он 
26528	 зарегистрировать болезнь лес корневой губка га рак серянка трутовик ложный 
26528	 то данный таблица приводить динамика поражение дерево поперечный рак дуб вызывать бактерия 
26528	 что касаться дубовый губка серный желтый трутовик поперечный рак дуб различие количество 
26528	 все необходимо подчеркивать устойчивый тенденция увеличение поражать дерево поперечный рак дуб весь пробный площадь 
26528	 попка девушка худенький быть как стоять она видеть ее плотненький половинка ягодица который плотно сорикасаться друг друг поза рак брать свой член 
26528	 взбесить я сильно один урод проходить я иметь девушка поза рак задеть трицепс мой рука свой 
26528	 вставать колено сосать потом вставать рак все 
26528	 вечер архипастырь участник торжество совершать малый вечерня чтение акафист всенощный бдение рак мощь преподобный серафим 
26528	 год три друг виталий полиевкт николай приступать рак преподобный сергий давать обет 
26528	 мощи чтить русский святой полагаться рождественский собор обитель рак новый сень левый 
26528	 такой заключение сделать основание выявлять повреждение энтомовредитель рак морозобоина бурелом см таблица 
26528	 тот время донор кровь число серопозитивный лицо составлять число лицо содержать вирусспецифический антитело оказываться неожиданно высокий больной рак желудок 
26528	 восстанавливать забывать имя мастер резчик дерево ворносков создавать сень рак мощь святитель московский алексий 
26528	 другой патогенный гриб лес мордовия распространять смоляной рак серянка пестрый ядровый гниль 
26528	 особенно эффективный профилактика рак женский половой сфера 
26528	 здесь доходить дело все происходить дедушка крылов лебедь рваться облако рак пятиться назад щука тянуть 
26528	 держать ухо востро урусы замечать нечипоренко ухватывать ус очередной рак насколько я помнить сценарий 
26528	 год случаться инсульт потом обнаруживаться рак капитолина григорьевна гаршин болеть 
26528	 пример самый серьезный разновидность рак делать опарыш труп 
26528	 мы плыть мелкий извилистый речушка попадать озеро где огромный щука закусывать рак мочь уедать они 
26528	 навязывать это значить каждый быть тянуть одеяло свой сторона все быть развиваться сценарий лебедь рак щука 
26528	 фактически цена собственный жизнь вряд рак пощадить женщина 
26528	 быть рак врач давать месяц жизнь 
26528	 например упоминать выше мембранный технология мониторинг атмосфера их число их основа существенно повышаться эффективность метод лечение рак легочный болезнь многий другой 
26528	 тот спид рак вирусный гепатит куда более 
26528	 воспользоваться случай мы убегать берег волга ловить рак доставать дно ракушка 
26528	 этот группа входить больной распространенный форма рак стадия заболевание 
26528	 живой смелый оказываться сочинение гитара чешский композитор штефан рак 
26528	 это его уровень увеличиваться пропорционально степень активность воспаление мочь служить маркер т клеточный иммунный ответ прогрессирующий повреждение печень вести развитие цирроз гепатоклеточный рак 
