26528	 сентябрь год правление роснано принимать решение финансирование первый инвестиционный проект область медицина рамка который планироваться создание отечественный производство микроисточник основа йод имплантировать медицинский средство основа наноструктурированный микросфера лечение рак предстательный железа печень поджелудочный 
26528	 я знать я сам уже вполне мочь читать лекция этот тема потому полгода я скармливать столько брошюра статья высказывание вред курение хватить человек двадцать еще оставаться запас я рассказывать рак легкое потом отдельно 
26528	 я рассказывать рак легкое потом отдельно 
26528	 что болезнь рак мрачно сказать акула так я 
26528	 добавлять это иммунный нарушение увеличение потеря вес чрезмерный голод привкус рот запах он астма диабет эпилепсия прыщ мигрень разумеется сердечный заболевание рак частый причина смерть 
26528	 она ждать мой приход выплескивать весь горечь обида это я быть виноватый рак она 
26528	 иногда мамин больница я оставаться сидеть янкин ребенок это быть мой отдушина я приходить себя восстанавливать себя отбирать мама ее рак 
26528	 янки возвращаться мама ее рак 
26528	 мамин рак я испытывать никогда 
26528	 количество диагноз который он наделять заботливый фанат грань выживание депрессия грипп генетический заболевание рак кожа эмфизема легкое желудочный кровотечение 
26528	 аналогичный метод быть использовать производство вакцина рак грудь ряд инфекционный заболевание 
26528	 самый распространять они опухоль шейка матка уровень заболеваемость она второй место онкологический заболевание женщина печальный пальма первенство держать рак молочный железа 
26528	 год гипотеза хаузен папилломный природа рак шейка матка подтверждать канадский исследователь 
26528	 идея подобный тумблер мочь препятствовать развитие рак автоматически переключаться быть 
26528	 собака звать лана она быть рак уже оперировать месяц протягивать 
26528	 старуха нравиться этот процедура купание взбивать массаж кожный зуд затихать она улыбаться сложенный трубочка губа синеватый молоко бескровие пухлый младенец старуха быть вычурно молодой рот надя думать рак она красить губа 
26528	 крупеник н рак санитарный служба несколько 
26528	 это рак рассматривать полноценный работник три 
26528	 правильный образ жизнь замедлять старение риск развитие рак 
26528	 риск рак убывать сотый доля процент 
26528	 итог вероятность ошибка отслеживание признак начинать рак молочный железа снижаться несколько 
26528	 что мочь быть нелепо например фальшивый лебедь я искренне порываться побелить потолок верхний часть стена сделать это явно мочь суррогатный рак актер раз осуществлять этот 
26528	 момент сгорать что рак валентина викторовна выслушивать этот известие 
26528	 я надеяться рано поздно наука побеждать рак 
26528	 плешивый капризный сын жрать ее пенсия промасленный кулек двенадцать час сутки задолбать персонал сосед свой межпозвоночный грыжа все знать это рак 
26528	 водитель погибать переживать дочь убивать рак почка соня взять щенок 
26528	 у софья мироновна обнаруживать рак кишечник вырезать поражать сегмент 
26528	 план ученый санкт-петербургский технический университет использование антиоксидантный свойство уда лечение заболевание механизм протекание который включать образование свободный радикал такой сердечно-сосудистый заболевание рак болезнь альцгеймер 
26528	 г-н рак зловеще хмыкнуть глядеть 
26528	 г-н рак забирать бумага паспорт 
26528	 воссоединение семья г-н рак хищно блеснуть очки а 
26528	 твой мать делать она рак мак помрачнеть 
26528	 тот финляндия уже много год идти наблюдение семья член который страдать наследственный рак молочный железа 
26528	 рак молочный железа безнадежно быть 
26528	 ежегодно мир регистрироваться много один миллион случай этот заболевание средний продолжительность жизнь год риск заболевать рак молочный железа составлять 
26528	 рак молочный железо известный незапамятный 
26528	 удивительный рак молочный железо встречаться 
26528	 этот особенность нередко встречаться анамнез больной рак молочный железа 
26528	 соседний покровский собор ценитель культовый экзотика крепкий нерв мочь полюбоваться огромный количество разнообразный мощь кусочек кость зуб слагать большой рак маленький стеклянный окошечко 
26528	 исходить данные различие активность фермент популяция тот число этнический группа академик пирузянин его коллега начинать изучать возможный метаболический предрасположенность индивидуум рак бронхи легкое гортань мозг 
30960	 распространенный болезнь возникновение который играть роль гипероксидация атеросклероз следовать называть катаракта некоторые форма анемия рак 
26528	 он это рак печень метастаз весь 
26528	 он сказать я все понимать я быть такой проблема семья я знать умирать рак я быть помогать никакой 
26528	 денис рак локомотив моторвагонный подвижной состав 
26528	 светил медицина побеждать спид рак 
26528	 ст рак итог эволюция более точный 
26528	 правда то один компонент приправа карри помогать излечиваться такой тяжелый заболевание болезнь альцгеймер рак 
26528	 демократия капитализм третий стадия рак сиделка одиннадцатый сентябрь 
26528	 широкий общеевропейский исследование посвящать связь питание рак обнаруживать житель средиземноморье более 
26528	 толстый человек мочь относиться группа риск другой причина витамин сохраняться жировой ткань уменьшать их риск заболевание рак 
26528	 например нельзя полностью исключать информация угроза солнечный излучение возбудитель рак кожа распространяться компания производство 
26528	 такой вакцина нацеливать хронический заболевание вызывать бактерия вирус частность вирус гепатит вирус папиллома вич опухоль все меланома рак молочный железа прямой кишка 
26528	 стремление юный представительница слабый пол загорать топлес приводить переоблучение ультрафиолет повышение риск рак грудь 
26528	 смертность рак инфекция заметно низкий 
30960	 он припугивать я там рак укусить 
26528	 дряхлеть больной рак володя уговаривать юрий входить 
26528	 то пристрастие он содействовать возникновение рак легкое становиться общеизвестный факт 
26528	 такой образ порядок японец вообще испытывать курение никакой вред рак легкий болеть 
26528	 он хотеть производить ускоритель радиоактивный изотоп необходимый диагностика рак заболевание сосуд 
26528	 федя больной рак мусульманин христианин взывать 
26528	 связь алкилирование днк свободно радикальный реакция мутация рак должный уметь объяснять любой выпускник 
26528	 так нельзя курить замечать гринев рак губа наживать 
26528	 подобный пища призывать насыщать тело приносить еще какой-то польза укреплять иммунный система костный ткань понижать содержание жир кровь мочь быть защищать рак заболевание сердечно-сосудистый система 
26528	 он умирать проблема связывать очередной курс химиотерапия повод рак толстой кишечник 
26528	 вскрытие показывать киселева быть рак легкое четвертый стадия 
30960	 разбивать рак они благословляться свой манер 
26528	 андрей лежать рак троицкий собор 
26528	 использовать крохотный возбудитель туберкулез корова можно лечить больной определенный тип рак мочевой пузырь утверждать американский врач 
26528	 инфекция вызывать иммунный система способность противостоять опухоль приводить исчезновение рак 
26528	 мнение уролог доналд ламма открытие снижать смертность рак мочевой пузырь 
26528	 наличие аспартам заменитель сахар продукт приводить рак рассеянный склероз 
26528	 она жутко этот повод переживать потому она недавно умирать мама рак грудь 
26528	 я такой родинка тот местено она чуть увеличиваться я быть беременный старший ребенкомсейчас расти такой как быть ттти я мама умирать рак грудь год назадно 
26528	 поэтому покалывание справа уже видеть рак легкое 
26528	 он заболевать рак скончаться полтора год 
26528	 второй фактор описывать вариация входить пункт я очень то бояться заболевать рак 
26528	 малыш рожать генетический дефект взрослый гибнуть расцвет год рак 
26528	 второй ноябрь ложиться больница где он обнаруживать рак 
26528	 совещание важный какой тон вестись разговор зачем так ругать константин симонов он сейчас говорить очень больной рак он симонов останавливаться тогда 
26528	 доктор приходить ужас быть самый редкий вид рак кожа саркома капошить 
26528	 выясняться причина скоротечный рак правый легкий 
26528	 умирать писатель париж сентябрь год рак легкое 
26528	 управлять траст должный быть адель нассиф еще потому мы двое он быть наиболее грамотный то действовать покупка банк надо быть очень оперативно хозяин умирать рак мой паспорт гражданин доминиканский 
26528	 бабушка быть рак кожа открытый рана кровоточить 
30960	 повар становиться отлавливать рак чан бросать они 
26528	 говорить сотовый телефон вредный излучение который вызывать рак мозг 
26528	 тут знакомый полно увидеть мама сказать она я прочее уже несколько раз рак легкое рассказывать 
26528	 мама замечать это быть конец еще один лекция рак легкое я выдерживать 
26528	 еще живой больной простатит возможно рак саддам хусейн уплетать американский военный 
26528	 голод клупт тбилиси ага хомасуридзе минск рак свердловск аи кузьмин 
26528	 ровно два год тот праздник митрополит новосибирский барнаульский варфоломей городцов рак преподобный сергий совершать он иерейский 
26528	 медицинский статистика наглядно доказывать горожанин более подверженный такой заболевание рак всевозможный аллергия заболевание легкое головной 
30960	 разнести шинок все полагать обещать ты находить поставлять рак заставлять отжиматься 
26528	 смола содержать соединение оензпирен который ослаблять сопротивляемость организм развитие рак легкий 
26528	 тот время высокий процент лицо содержать антитело обнаруживать группа вич инфицированный гомосексуалист реципиент почка больной спид ск неожиданно больной т клеточный лимфом энцефалопатия группа больной рак желудок превышать соответствующий 
26528	 ученый надеяться усовершенствовать устройство его помощь можно быть диагностировать также рак легкое заболевание печень 
26528	 это естественно рак безрыбье так принимать 
26528	 известно сыворотка кровь больной различный гепатит наряду образец сыворотка повышенный содержание гамма глобулин сыворотка пациент африканский раса лицо миеломный болезнь содержать ревматоидный фактор пациент заболевание печень цирроз рак аутоиммунный заболевание коллагеноз аутоиммунный гепатит 
26528	 очень скоро увидеть быть абсолютно правый рак она 
26528	 саймонтон к саймонтон психотерапия рак спб 
26528	 их сведение гейдар алиев быть диагностировать следующий болезнь сердечный недостаточность цирроз печень сахарный диабет рак предстательный железа 
26528	 просто говорить речь идти тот мутация который приводить патологический изменение организм то определенный условие этот самый генетический полиморфизм мочь предрасполагать определенный заболевание например хронический бронхит сахарный диабет сердечно-сосудистый заболевание рак другой 
26528	 вы александр исаевич доводиться побывать горлаг норильск берлаг колыма свой рак удаваться конец срок оставаться 
26528	 мой любимый герой экран рак отшельник актиний 
26528	 несмотря военный время эвакуация уже конец год быть получать вариант препарат активность раз высокий первичный вчерне решать трудный задача его производство достаточный количество получать первый клинический данные противоопухолевый действие круцин случай рак гортань губа пищевод грудь шейка 
26528	 примесь диоксин воздух разрушать иммунитет вызывать рак гормональный расстройство 
26528	 делать рак сушеный мышь лягушка 
26528	 основа известный метод химический терапия рак лежать апоптоз 
26528	 мало кто этот человек загорать лежать песок ультрафиолетовый луч вызывать рак кожа фидель кастро жить 
26528	 сообщать рак сосед зачарованно глядеть чудесный 
26528	 он значительно вскидывать палец говорить столь уверенно проживать рак дно озеро один 
26528	 человечество искать лекарство рак видоизменяться мутировать 
26528	 хороший больница его полагать санаторий дюна мы вместе отправлять страшный болезнь рак мозг семь месяц владик 
26528	 странно рак легкое итог настигать 
30960	 видеть глаз какой как рак молчать звереныш 
26528	 тетя клаша оказываться серьезный больница где она быть устанавливать предварительный грозный диагноз лимфогранохиматоз рак лимфатический узел 
26528	 просиживать год рак в быть освобождать искалечивать 
26528	 нонина писать рак отдавать палач капля 
26528	 она тот время уже быть рак она ослепнуть 
26528	 некоторый время экснер заболевать рак понимать она оставаться 
26528	 поручение коллега заслуживать деятель искусство россия профессор московский консерватория л в рак 
26528	 проверяться рак подозревать худеть скрытый 
26528	 уже создавать томат повышенный содержание ликопин антиоксидант несколько десяток процент снижать риск заболеваемость рак шейка матка предстательный железа 
26528	 частность многие ее тактико-технический возможность совершенный аналогичный возможность модернизированный американский система рак пэтриот 
26528	 ночной работа увеличивать риск развитие рак грудь 
26528	 она долго мучительно болеть февраль год скончаться рак городской больница 
26528	 мать рожать он сразу умирать рак кровь воспитывать отец полковник 
26528	 недостаток фолиевый кислота некоторый исследователь связывать развитие рак толстый кишка молочный железа 
26528	 цит изда миллер г тропик рак лоуренс д г любовник леди 
26528	 вместе рак грудь россия набирать темп 
26528	 россия набирать темп благотворительный программа вместе рак грудь стартовать сентябрь 
26528	 первый март действовать бесплатный горячий телефонный линия жизнь который можно получать ответ вопрос касаться профилактика рак грудь 
26528	 год руководитель этот коллектив являться доктор технический наука профессор заслуживать строитель рф действительный член академия инвестиция экономика строительство рф член правление рак лауреат премия правительство рф в 
26528	 шведский врач считать курение сигарета малый содержание никотин снижать риск возникновение рак легкое 
26528	 рак вообще мочь быть кактус он 
26528	 житель какой регион ваш взгляд специальный мера профилактика иметь большой риск заболевать один следующий болезнь холера рахит рак кожа сонный болезнь серповидноклеточный анемия 
26528	 рак стоить откладывать длительный поездка 
26528	 команда лебедь рак щука мочь эффективно 
26528	 пора получаться лебедь рак щука 
26528	 она приходить бывший супруга нужный доля скорбь безнадежность сказать врач находить она рак грудь спасать она мочь 
