26528	 один женщина джули уолтер рак умирать муж девушка линда 
26528	 то онкология метод мочь быть перспективный диагностика достаточно ранний стадия рак 
26528	 регулярно принимать оральный контрацептив иметь мало шанс заболевать воспаление матка придаток также рак яичник 
26528	 например быть кто-нибудь ваш родственница материнский линия дальний рак молочный железа 
26528	 кто-то родственница материнский линия быть рак яичник матка 
26528	 лазер компакт-диск видеокассета волоконно-оптический связь производство микрочип обработка материал экологический мониторинг хирургический операция диагностика болезнь тот число рак 
26528	 она вызывать такой профессиональный болезнь асбестоз рак легкий другой 
26528	 володя знать луис тяжело болеть много год серьезно лечиться хьюстон он совсем быть похожий человек больной рак 
26528	 я так счастливый перебарывать рак знать это 
26528	 я умирать я конечно умирать рак я хотеть мой 
26528	 я отвечать рак параджанов недавно сделать операция после 
26528	 параджанов недавно сделать операция то он обнаруживать рак легкий 
26528	 это быть четкий симптом болезнь страшный диагноз приговор рак мозг он знать 
26528	 год риск рак легкое снижаться два раз 
26528	 хирургия операция офтальмолог федоров ранний диагностика рак лечение глаукома волоконно-оптический связь 
26528	 это достопримечательность странный местожительство исчерпываться колюня быть невыносимый скучно захламлять затхлый квартира где впоследствии он проводить три самый счастливый год жизнь где тот пора жить совершенно чужой безрадостный вскоре умирать рак тетя 
26528	 еще кто болеть рак облучать бить перебивать русский 
26528	 всегда быть конкретный болезнь который сводить человек могила рак инсульт цирроз 
26528	 улица магазинный очередь приносить интересный история врач заражать больной трупный кровь ослеплять новорожденный младенец прививать рак лопоухий пациент русский происхождение 
26528	 потом он долго сидеть кабинет приглашать следующий пациентка пытаться понимать что он такой происходить откуда взяться этот схематический цветной картинка вполне развитый рак 
26528	 всякий случай служба его военный врач царский впоследствии добровольческий армия помешать он умирать свой постель честный тяжелый смерть рак 
26528	 член комиссия убежденный силиконовый имплантанта вызывать серьезный заболевание такой рак молочный железа иммунный неврологический 
26528	 шишлин умирать рак он ткнуть себя пуп 
26528	 счастие иван васильевич шишлин впираться сюда скончаться рак 
26528	 мочь быть рак страдать человек 
26528	 какой-то момент он заболевать рак ложиться больница 
26528	 мой мать течение три год умирать рак я она ходить 
26528	 надеяться хороший рак сегодня он излечимый тысяча человек 
26528	 что показывать вскрытие рак цвести оставаться она жизнь пол 
26528	 казаться курить весь жизнь крепкий папироса переживать война голод терять ребенок ты рак инфаркт то паче 
26528	 тетя клава живот быть рак поэтому живот она 
26528	 баритон он удалять повод рак гортань операция проходить преуспешно так 
26528	 вообще туберкулез рак придерживать один рука четки он 
26528	 все опускаться он человек приходить лечить насморк открывать себя рак носоглотка 
26528	 аптека покупатель подозревать фармацевт попытка подсовывать они ядовитый лекарство трамвай базар учреждение рассказывать москва закрывать несколько аптека который аптекарь еврей агент америка продавать пилюля высушивать вошь рассказывать родильный дом заражать новорожденный роженица сифилис зубоврачебный амбулатория прививать больной рак челюсть язык 
26528	 сказать доктор что мочь сообщать вы она рак легкий 
26528	 тетя поля умирать больница рак желудок возраст пятьдесят два 
26528	 потом он подниматься ярко освещать лифт идти ковровый тропинка длинный пустой коридор дверь круглый глазок палата хирургический клиника хирургия рак воздух быть теплый казенный освещать 
26528	 умирать он девять месяц февраль будущий год рак печень клиника первый мгу 
26528	 сейчас достоверный рука узнавать отвечать буфетчик одичать поглядывать какой-то фотографический группа стекло февраль будущий год умирать рак печень 
26528	 голова обращать внимание иметь отношение отвечать буфетчик голова плюнуть она здесь что рак печень просить останавливать позволять 
26528	 профессор категорически утверждать сейчас крайний мера данный момент никакой признак рак буфетчик нет 
26528	 брезговать гражданин профессор прошептать буфетчик умолять останавливать рак 
26528	 андрей фокич умирать рак печень клиника первый мгу 
30960	 теперь можно вернуться благодушный настроение снова начинать любоваться стена башня монастырь век понимать это роскошный рак поставлять святой мощь 
30960	 гурман непременно заказывать пицца одуванчик устрица речной рак икра 
30960	 ты свобода давать так ты показывать где рак зимовать 
30960	 промычать что-то невразумительный покраснеть рак потом усадить угол 
30960	 первый раз сибирь видеть мы речной рак тур вероятно волжский порода 
30960	 пруд что хотеть я обращать просвещать внимание ваш вытекать некогда речка рачок потому надо думать так называться она водиться особенно крупный вкусный рак отходы скотобойня надо полагать 
13493	 далее образовываться такой пара овен собака телец рука близнец дерево рак ящерица лев игуана дева паук 
13493	 оставаться добавлять марс январь двигаться попятный движение созвездие лев рак 
13493	 рядом яркий светило она оказываться го поллукс близнец го регулы лев го спик дева го юпитер го гамаль овен го плеяда альдебаран телец го поллукс близнец го январь сатурн рак регулы лев 
30960	 улитка один нога собака четыре пчела шесть речной рак десять это далеко 
30960	 результат экспедиция быть тщательно проанализировать ученый уже планировать включать обновлять каталог вид мягкий коралл ракообразный червь излечение рак красный вино исследовательский группа рочестерский 
30960	 последний десятилетие вновь появляться речной рак 
30960	 ревдинский пруд нижнетагильский пруд перевозить рак язь 
30960	 правильно они быть идентифицировать паук они называть ракообразный существо паучий иметь нога последний пара клешня рак форма голова они 
13493	 этот время венера проходить созвездие тельце близнец рак оказываться лев 
13493	 самый дальний видимый невооруженный глаз планета медленно ползти фон звезда лев граница рак раз там где 
13493	 первый день ноябрь она фаза последний четверть оказываться созвездие рак затем лев 
13493	 сатурн находиться сейчас созвездие рак неподалеку марс 
13493	 два месяц он уходить близнец почти пересекать созвездие рак 
13493	 марс спокойно размеренный двигаться прямой направление тот запад восток созвездие тельце близнец сатурн казаться неподвижно зависать один точка созвездие рак 
30960	 седой красивый дяденька становиться красный рак смеяться 
30960	 садиться мать петя сделаться красный рак склонять голова набок 
30960	 что там быть начинать уха форель кончать рак сваривать пиво 
30960	 он понимать проштрафиться помнить мы ребенок ждать рак пиво 
30960	 красный рак мокрый лицо заставать 
30960	 то я этот спор хорошо зарабатывать ходить потом неделя красный рак весь болеть 
30960	 один они побледнеть другой сделаться красный рак 
30960	 оттуда появляться красный рак мрачный туча крячко 
30960	 сверху сыпаться серпантин конфетти какой-то почтенный замначальник отдел красный рак пиджак сбиваться 
13493	 знак зодиак я рак этот знак присущий любовь 
13493	 близнец держаться далеко весы рак скорпион козерог иметь право 
30960	 совсем отдельный посиделки пивной бар подвал дом журналист суворовский бульвар ребята редакция какой там быть замечательный треп какой подсолить ржаной сухарик подавать пиво какой рак 
30960	 как ты относиться пиво рак 
30960	 он отрывать рак голова он они вырывать клешня 
13493	 мистически настроенный барышня близнец можно подарить композиция цветущий рябина лютиков сосновый веточка поломать голова это значить рак июнь июль 
13493	 их близнец конечно рак что это дело 
13493	 учиться м класс гороскоп рак 
30960	 мы сидеть прозрачный утренний огонь говорить рыбалка колхозный старина бедняцкий коммуна который построить двадцатый год берег река тигин устье она сохраняться самый речка где прежде быть много рыба рак рыбак рассказывать род он 
30960	 пришвин нужный быть каждодневный живой натура этот снег весна свет осень ее могильный запах речной рак нужно быть морозов 
30960	 это отец основатель ассар габриэльссон густав ларсон решать заниматься производство автомобиль год назад июль год они сидеть один стокгольмский ресторан пиво рак отмечать день святой якоб 
13493	 поэтому ассоциировать себя свой знакомый зодиак рак змея год 
30960	 алексей александрович молча смотреть рак который они подавать пиво 
30960	 простой человек пиво рак сниться каждый ночь мы 
30960	 где двести тысяча я ленин черномырдин пить пиво рак где триста тысяча ельцин 
30960	 там где я пиво рак они иван сусанин вести 
30960	 весь зеленый водяной знак все вашингтон пить пиво рак 
30960	 я осень отпускать немного рак становиться ходить выпивать конечно 
13493	 близнец плечо предплечье кисть рука рак желудок легкое лев спина сердце 
13493	 рак обожать хорошо поесть предрасполагать 
13493	 ребенок рак обычно болеть весь детский болезнь 
13493	 самый удачный день неделя близнец обещать становиться среда кто-то они удаваться честь выходить неприятный ситуация кто-то наконец получать что давно мечтать рак эмоциональный 
13493	 эмоциональный рак неделя приносить новый сильный впечатление 
13493	 начало неделя вероятно романтический приключение который надолго запоминаться рак 
13493	 встреча старый друг непременно следовать находить время вы надолго заряжаться энергия оптимизм рак самый незначительный дело 
13493	 семейный рак хорошо давать супруга 
13493	 трудно уживаться рак медлительность весы козерог 
13493	 хороший партнер близнец рак рыба дева особенно овен козерог 
13493	 подходить партнер рак лев весы водолей овен телец 
13493	 рак идеальный верный жена хороший хозяйка 
13493	 мужчина рак любить хороший кухня забота 
13493	 рак домашний мужчина мягкий добрый примерный 
13493	 рак редко жениться ранний возраст 
13493	 рак редко жениться ранний возраст 
13493	 идеальный спутник лев весы рак стрелец овены близнец 
13493	 август вторник весы рак расти луна 
13493	 август среда рак расти луна август четверг 
13493	 август пятница рак стрелец расти луна 
13493	 май пятница весы рак расти луна посев зеленной огурец 
13493	 май суббота рак полнолуние посев зеленной огурец кабачок 
13493	 май воскресение рак стрелец полнолуние полнолуние 
13493	 поберечь сила рак вы наверное уже составлять список 
13493	 сам лев много нрав качество застольный собеседник рак весы стрелец они сдержанный 
13493	 рак дева козерог посидеть рядом 
13493	 лев это уже роман пир телец рак дева скорпион держаться 
13493	 триада вода рак помощник козерог 
13493	 подсаживать он хорошо телец рак дева рыба что 
13493	 подсаживать он рак козерог самый верный 
13493	 особенно женщина рак единственный знак зодиак 
30960	 дверь гостеприимно распахиваться мы усадить прохладный зал свежий пиво дефицитный вобла подавать еще совсем уж невероятный рак 
13493	 конец февраль настроение близнец испортить финансовый проблема деньги быть мало приходиться экономить рак февраль 
13493	 скрываться глаз уходить запад я спина рысь немного она зенит самый мой голова ковылять большой медведица ниже бежать близнец спешить едва поспевать они рак лев сделать полный круг 
13493	 последний раз я видеть он давно искусственный звездный небо городской планетарий вновь мерцать мы оба медведица близнец рак лев весь прочий 
30960	 я он познакомиться летний кафе журналист там иногда появляться большущий вкусный рак весь любитель туда сбегаться 
30960	 я подходить дверь щелка увидеть борис илюша молча тихо накрывать стол центр стол дымиться огромный рак 
30960	 детство я мечтать разбогатеть быть утро вечер быть рак папин картофельный польский пляцки 
26528	 потом он рассказывать ее муж умирать рак она оставаться двойняшка 
13493	 самый дело свидетельство полезность рыба предотвращение рак очень мало 
26528	 заболеваемость рак легкий она идти вниз 
26528	 дочь выходить замуж офицер уезжать владивосток муж умирать рак вечер возвращаться пустой квартира 
30960	 некоторые гурман варить рак пиво классический рецепт 
30960	 некоторые гурман варить рак пиво классический рецепт 
26528	 речь идти использование золотой нанооболочка упрощение способ диагностика лечение рак также использование липос 
26528	 таня умирать рак месяц сгорать 
26528	 х она много болеть она удалять опухоль мозг лечить рак кожа 
26528	 февраль год он умирать рак желудок дом вернер юнга 
26528	 июнь год он умирать рак 
26528	 правда убедительный данный подтверждать вирусный происхождение рак грудь цирроз печень пока 
26528	 дмитрий младший сестра автор роман прообраз умирать рак лейкемия год 
26528	 дмитрий никакой отношение она ее история иметь молодой человек также умирать рак кость год 
26528	 ия саввин скончаться рак м год жизнь 
26528	 джо фрейзер скончаться сша м год жизнь рак печень 
30960	 торонто где день пройти саммит один крупный мир центр исследование стволовой клетка борьба рак 
26528	 нужный гипертония болезнь даун рак печень это можно 
30960	 мамочка купить я серый рак взмаливаться ринка догадываться красный 
26528	 она продолжать стоять задумчиво глядеть рак 
26528	 еще долго долго инфаркт рак легкое легкий исчезновение сон 
26528	 это быть главный священник умирать рак медленно мучительно 
26528	 виталий муж диагноз изначально быть поставлять верно ваш мама умирать рак жизнь сожаление онкология 
26528	 то кофе снижать вероятность появление камень желчный пузырь почка предупреждать цирроз печень болезнь паркинсон уменьшать риск заболевание рак толстый кишка клинический депрессия 
26528	 вынести она диагноз рак молочный железа она отказываться 
26528	 когда-то сюда стекаться человек который надеяться усердный молитва вера побеждать туберкулез теперь главный противник рак несколько месяц лурд превращаться 
26528	 она год двадцать пять я жениться она тридцать шесть она личико так очень рак 
26528	 тоска быть тяжкий возможно еще потому винница позвонить тетя лида трезвый внятный сообщать дядя сема рак легкий танька собираться 
26528	 дальнейший его название становиться предшествовать буква честь неутомимый американский исследователь реликтовый излучение дэвид уилкинсон умирать рак сентябрь год 
26528	 я умирать рак я так молодой 
26528	 она внешне сильно изменяться мама съедать рак она высыхать скукоживаться 
26528	 я кормить она стоя я кормить она сидеть я кормить она рак пардон каждый два минута сосание 
