26528	 один его пациент быть главный маршал авиация новиков уроженец наш место он заболевать рак москва хороший специалист счесть 
26528	 старший сын умирать пятьдесят шесть год рак 
26528	 сильно ударять ее бревно живот начинаться рак желудок сделать операция операция 
30960	 помнить первый год играть саксофон я надувать щека лягушка задыхаться становиться красный рак интуитивно понимать что 
30960	 борис привозить послание тимоша они сочинять он илюша пивной бар уплетать весь тот рак послание пакет 
26528	 наверняка она такой почерк мама дорогой рак глаз сразу схватывать катаракта 
30960	 иной раз они так рассвистеться кто вареный рак они самый они мало 
30960	 слушать искать мы торговка свистеть рак 
26528	 сказать ребенок учитель пойти вон рак сказать врач больной лето 
26528	 фрактальный анализ точно предсказывать рак случай 
26528	 студентка быть когда-то правда рак душа правда 
26528	 девять год назад жена поставлять диагноз рак 
26528	 один недавний конференция медицинский директор российский представительство компания мировой лидер онкологический фармрынок рустам галеев рассказывать россия зарегистрировать два новый препарат лечение особо агрессивный разновидность рак молочный железа 
26528	 один недавний открытие позволять компания создавать новый препарат кризотиниб лечение позитивный немелкоклеточный рак легкий 
26528	 что умирать ваш мать рак какой она быть раса 
26528	 что умирать ваш отец рак далее следовать вопрос племянник 
26528	 так например второй половина год планировать выводить рынок первый россия биологический препарат новый поколение лечение рак кишечник легкий яичник почка 
26528	 этот компьютерный элемент тестироваться будущее их помощь предполагаться диагностировать ранний стадия рак прямой кишка 
26528	 мощный лазер повышать чувствительность избирательность способ рак увидеть реальный время технология 
26528	 начинаться многочисленный исследование разный омега кислотный диета мышь это широкий наступление приводить то становиться повсеместно рекламироваться благодетельный свойство омега диета рыба семя зеленый овощ который защищать многочисленный серьезный болезнь инфаркт артрит шизофрения рак 
30960	 женщина ходить маммография ждать они появляться рак 
26528	 книга который джон грин рассказывать романтический история любовь два подросток больной рак сша выходить два 
26528	 можно так лечить другой вид рак 
26528	 я слышать раз рак кровь неплохо поддаваться лечение 
26528	 я два год назад поставлять диагноз рак яичник 
26528	 по-видимому этот молекула который иметься весь человек участвовать ряд биохимический процесс способный сигнализировать развитие два самый распространять заболевание ведущий смерть рак инфаркт 
26528	 расчет исследователь обонятельный дисфункция оказываться более значимый предвестник скорый смерть нарушение работа сердечно-сосудистый система легкое диагностировать рак высокий она этот предлетальный 
26528	 золотой шар быть такой тема рак погодить вздрагивать 
26528	 они открывать сказать по-простому человечество раковый заболевание человечество быть рак развиваться тот закон 
26528	 акушер гинеколог приниматься объяснять мы иногда ребенок заболевать рак кровь 
26528	 директор гемабанка александр приходько телефонный разговор становиться отрицать рак кровь ряд наследственный заболевание 
26528	 ребенок заболевать рак кровь он мочь помогать оно 
26528	 они ход военный действие погибать процент покончить себя процент результат дтп умирать процент скончаться рак процент заболевание 
26528	 процент причина быть дтп рак самоубийство 
26528	 ньювак создавать россия инновационный платформа биофармацевтический терапия онкологический заболевание основа таргетный молекула иммунологический метод лечение рак ограничиваться они 
26528	 жена первый рак желудок чуть много год 
26528	 левинтов александр рак московский раковый торговля иметь сетевой 
26528	 рак быть тварь пресноводный морской 
26528	 первый тревога забивать авторитетный город общественный организация помогать ребенок больной рак 
26528	 леня леня вставать рак я он еще 
26528	 десять награждать известный специалист область изучение ген связанный различный заболевание рак й крупный 
26528	 наконец сам гроб церковный рак покрывать серебряный пластина 
26528	 муж главное панфилов выделять деньги корпорация тяжелый рак паук троицкий вдруг 
26528	 то результат исследование мужчина который выпивать более семь чашка чай день риск развитие рак быть полтора раз высоко 
26528	 он уверять недалекий будущее диагноз рак быть звучать окончательный 
26528	 сей пора считаться рак порождение индустриальный эпоха он 
26528	 сам железо томограф исследовать картина метастаз состояние поражать орган свидетельствовать наличие рак 
26528	 жизнь царица страдать диабет рак печень скончаться возраст 
26528	 вернуться я домой полгода наташка мой умирать рак кровь ты 
26528	 пожилой человек активность такой система заметно снижать приводить ряд заболевание такой катаракта рак иммунодепрессия многий другой 
26528	 он быстро сделать анализ быстро поставлять диагноз рак желудок 
26528	 третий больница куда она привозить опять скорый где сразу ход поставлять диагноз рак 
26528	 такой препарат уже создаваться сожаление больной диабет некоторый вид рак 
26528	 это лебедь рак щука получаться 
26528	 я умирать рак троюродный племянница ребенок она 
26528	 сша разрабатывать новый способ тестирование рак поджелудочный железа ранний стадия 
26528	 новый методика разрабатывать джек рак мочь быть диагностировать точность 
26528	 сообщение нас говориться распределение элемент показывать сильный нестабильность процесс взрыв сверхновый какой-то образ выворачивать звезда наизнанку весь вид рак медицинский средство способный одинаково эффективно 
26528	 медицинский средство способный одинаково эффективно бороться разный вид рак давний мечта медик 
26528	 они можно использовать борьба лейкемия другой вид злокачественный опухоль рак грудь яичник мозг печень толстой 
26528	 это возможный способствовать более полный восприятие оценка поступать стимул конечный счет выбор более адекватный модель поведение предполагать автор работа аспирин возможно лечить рак ученый уже быть доказывать что 
26528	 частность исследование руководство профессор питер ротуэлл оксфорд показывать низкий доза мг день аспирин сокращать риск развитие рак кишечник пищевод этот 
26528	 начальник советский военный разведка берзин попросить лидер немецкий коммунист тельман подбирать подходящий товарищ внедрение окружение гитлер советский разведчик страдать рак желудок заключение суд 
30960	 я ты сучонок сейчас камера закрывать рак поставлять 
26528	 тот время медик утверждать этот человек физически более уязвимый темноволосый часто подверженный самый распространять сегодня болезнь особенно гастрит язвенный болезнь ревматизм аллергия рак кожа 
26528	 что умирать ваш мать рак какой она быть раса 
26528	 что умирать ваш отец рак далее следовать вопрос племянник 
26528	 один вызывать лейкемия рак кровь другой иммунодефицит 
26528	 грызунов быть порода устойчивый вирусный рак кровь молочный железа 
26528	 быстро мучительно рак лешка тогда быть тринадцать 
26528	 поставлять тяжелый диагноз рак грудь стадия 
26528	 становиться посол благотворительный программа вместе рак грудь россия 
26528	 работа схема рыба рак щука еще никогда 
26528	 рак быть раскладывать два кучка 
26528	 академия он поражать все близость преподобный сергий молебен акафист умилительный петься братия его рак ясный крепость существующий 
26528	 здесь можно отведывать эксклюзивный деликатес шоколадный сигара порок фрейд как известно мэтр быть заядлый курильщик продолжать дымить сигара страдать рак гортань 
26528	 она быть очень больно рак последний стадия месяц два 
26528	 виталий муж рак то вы 
26528	 возникать идея бороться рак применение такой препарат который 
26528	 александр беляев легко быть рак рассказ фантазия 
26528	 вы думать рак быть легко глубоко ошибаться 
26528	 врач быть возможность комплексный лечение онкологический заболевание использование хирургия химиолучевой иммунотерапия смертность рак продолжать расти как предупреждать 
26528	 потому риск заболевать рак мы больше 
26528	 он отчего-то весь время норовить напутывать привлекать телега мысль сразу лебедь рак щука колесо мысль 
26528	 частность девочка рожать мать принимать этот лекарство время беременность начинать уже год часто развиваться редкий форма рак половой путь 
26528	 известно половой гормон стимулировать рост многий разновидность опухолевый клетка например рак грудь женщина эстрадиол 
26528	 данные эпидемиологический исследование ход который сравнивать уровень заболеваемость рак вегетарианец любитель мясо достаточно 
26528	 частность устанавливать связь питание мясо заболеваемость рак прямой кишка 
26528	 это увеличиваться смертность рак общество расти доля 
26528	 ничего смерть свой пропивать он страшно становиться напоследок человек помучиться земля себя избавлять долго паскуда помирать рак то сыночек 
26528	 меньший роль усиление культивирование страх рак некоторый другой болезнь сыграть 
26528	 жена внезапно умирать рак матка какой-то очень скоропалительный 
26528	 рассказывать она все быть рак матка юный жена 
26528	 кстати этот боязнь паразит становиться модный россия рак паразит переноситься гипертония 
26528	 пример полезный тот факт обладатель разный аллель по-разному восприимчивый болезнь заразный рак аллергия эпилепсия диабет 
26528	 дарвинист сказать мы наблюдать здесь незавершенный процесс эволюция быть невыгодный аллель обрекать исчезновение быть неправый наоборот аллельность ген расширяться год назад рак болезнь трубочист аллергия сенной 
26528	 поймать себя то бояться пить она понимать рак это незаразный назло попробовать 
26528	 этот смысл рак печень хорошо другой 
26528	 я видеть сестра пытаться понимать она говорить наклоняться отодвигаться ее дыхание рак можно вдыхать себя 
26528	 он рожать третий жена лидер кндр имя хи который четыре год назад возраст год скончаться рак грудь 
26528	 например один родитель мочь захотеть их ребенок быть более смуглый цвет лицо избегать возможный рак кожа особенно один 
26528	 уже доказывать его роль развитие сердечно-сосудистый патология болезнь кость сустав диабет рак 
26528	 еще год назад ученый устанавливать препарат тестостерон свой благотворный влияние организм мужчина обладать побочный действие высокий доза этот гормон провоцировать рак предстательный железа 
26528	 поэтому ученый предполагать рак шейка матка обусловливать вирус 
26528	 быть находить более половина пациент рак шейка матка влагалище пенис 
26528	 теперь становиться возможный идентифицировать все почти весь существовать природа генотип вирус обнаруживаться пациентка рак шейка матка 
26528	 уже создавать профилактический вакцина который представлять себя смесь структурный белок днк вирус играть ключевой роль развитие рак шейка матка 
26528	 этот частица поглощать вредный луч зеркало атомарный размер отражать они оберегать мы солнечный ожог мочь быть рак кожа 
26528	 фрумкин ран синтезировать композитный наночастица помощь который можно лечить рак 
26528	 практически любой продукт содержать загуститель подсластитель эмульгатор прочий всевозможный добавка который стимулировать развитие диабет рак астма другой заболевание 
26528	 это доказывать прошлый год пример гена оно мы говорить выше сотрудник институт биология рак копенгаген сотрудничество 
26528	 вещество показывать свой активность лечение рак кровь так называть 
26528	 обобщение данные десятилетний проверка который участвовать тысяча пожилой мужчина показывать высокий потребление вода быть дополнительный восемь стакан коррелировать некоторый уменьшение риск рак мочевой пузырь 
26528	 помнить слегка оцепенеть веня смех я спектакль дом набережная который кстати я очень понравиться много повесть выдавать общеуважаемый трифонов рак гениально исчислять весь выгода безрыбье 
26528	 сам себя быть я диск фильм история два парень приговаривать смерть последний стадия рак отрываться полный 
26528	 сегодня уже возможно выявлять предрасположенность человек различный болезнь диабет некоторый вид рак 
26528	 зародыш древний многоклеточный роднить рак тот факт 
26528	 я такой унизительный заболевание рак прямой кишка я уставать 
26528	 его автор американский ученый гарвардский университет эдвард джиованнучча проанализировать данные проводить ранее исследование который прослеживаться связь потребление пища томат профилактика рак особенно предстательный железа легкое 
26528	 событие расшифровывать ген рак кровь это университет 
26528	 появляться ген рак кровь важный пример 
26528	 самый распространенный вид рак кровь хронический лимфолейкоз 
26528	 научаться поддерживать этот процесс называть аутофагия идеальный рабочий состояние можно продвигаться лечение серьезный заболевание такой рак различный иммунный расстройство болезнь альцгеймер 
26528	 сегодня мы это рак устраивать куликовый поле 
26528	 потом выдерживать решать позвонить г-н рак узнавать приходить 
26528	 г-н рак я знать это 
26528	 это явный синяк колено стереть рак стоять начинаться делать 
26528	 чистый дно река сновать увертливый пескарь однажды мальчик увидеть настоящий рак шевелить насекомое ус 
13493	 то гигантский рак самый дело обитать 
30960	 как латимерия гигантский рак встрепенуться густав 
26528	 переходить рак убийца номер два сердечно-сосудистый 
26528	 женщина этот семья несколько поколение страдать рак грудной железа другой 
26528	 рак молочный железа наиболее распространять вид 
26528	 течение последний год мир также россия намечаться устойчивый тенденция рост заболеваемость этот вид рак особенно город мегаполис 
26528	 как другой онкологический заболевание рак молочный железа по-прежнему оставаться коварный 
26528	 называть опухоль молочный железа рак их внешний сходство 
26528	 исключать транс жир также повышать риск развитие некоторый вид рак данный подтверждать этот гипотеза 
26528	 оказываться свободный радикал участвовать развитие лучевой болезнь многий другой заболевание частность рак 
26528	 сейчас мы сообщать избегать солнце мы подвергать себя риск другой вид рак сердечный заболевание другой болезнь 
26528	 этот основание доктор гарланд специалист рак университет сан диего 
26528	 этот вывод сейчас признаваться возникать вопрос какой мера этот разница заболеваемость рак мочь быть относить счет 
26528	 тут находиться любитель скоропалительный вывод объявлять попадать такой путь наш организм бактерия способствовать развитие язва впоследствии рак желудок 
