36483	Рок-певица Шерил Кроу проведёт в мае уникальный концерт она будет выступать на борту 
36483	Этот концерт рекламная акция новой услуги  
36483	Не так давно состоялся прекрасный концерт Казарновской и Бартолини без всяких 
36483	Особенно после каких-нибудь концерт город большой одному ночью не 
36483	Юбилейный концерт будет благотворительным    декабря в 
36483	декабря в   в Республиканском дворце культуры состоится юбилейный концерт сборной команды КВН РМ  
36483	Зрители могут принести на концерт подарки и сувениры  
36483	На концерт коллектива зрителям предоставляется возможность петь 
36483	Лишь бы зритель был мой и концерт был в кайф  
36483	Гитарист Юрий Матвеев и скрипач Артём Якушенко приправляющие звук своих инструментов изрядными спецэффектами устраивают на сцене форменное музыкальное камлание  на их концерт заворожённым зрителям бывает некогда даже 
36483	С этой целью проводятся различные мероприятия конференции выставки юбилейные концерт  
36483	Природа волновалась перед приходом ночи как зрители перед концерт в клубе  
36483	Сразу после Нового года  сказал Лёва  у нас будет концерт студентов второго курса  
36483	Тогда вы могли бы понять чем он отличается от любого нашего концерт  
36483	концерт кончился мы вышли на улицу 
36483	Передаём концерт лёгкой инструментальной музыки  сказала дикторша 
36483	В рок-музыке новых имен давно не появлялось но те кто стал известен двадцать лет назад до сих пор успешно ездят с концерт не имея серьезной медийной поддержки 
36483	Кстати музыку любили все отовсюду неслись обрывки песен маршей оперных и опереточных арий концерт по заявкам радиослушателей  
36483	концерт французского композитора автор музыки к 
36483	В библиотеке появилась лаборатория терменвокса где будут проводиться концерт и лекции по истории музыки 
36483	В Московском международном доме музыки в этот день состоится концерт ансамбля Виртуозы Тель-Авива  
36483	В городском дворце культуры Биробиджана проведут Пуримшпиль для детей с играми конкурсами и праздничным концерт  
36483	День металлурга  в Липецке отметят фестивалем Липецкое городище концерт и праздничным салютом  
36483	Наконец у нас проходят музыкальные вечера концерт фестивали  в них библиотека бывает 
36483	Шарль Азнавур о планах на будущее и о своем концерт в Москве который состоялся в 
36483	На юбилейном концерт Реченьки помимо самих хозяев выступят 
36483	Книгу Исаака Давыдовича Гликмана Мейерхольд и музыкальный театр я взял с собой в Мюнхен и Милан где у нас были юбилейные концерт посвященные ПИЧайковскому  
36483	Юбилейный же концерт к столетию оркестра к которому 
36483	Решили пусть не будет юбилея но концерт состоится  
36483	Первое отделение юбилейного концерт пожалуй более всего поразило Временами 
36483	Ведущая концерт Наталья Желявская напомнила зрителям что 
36483	Я получила сегодня незабываемое впечатление от вашего концерт  
36483	Во-вторых в среду и в четверг в оперном театре всегда давали концерт классической музыки  
36483	Вошел взял в буфете баночку джин-тоника Тримурти и пакет чипсов Амитаба сел  Начинается концерт солянка  Ну занафталиненные поп-дивы 
36483	Гаснет свет зал трансформируется в сцену сцена  в зал зрители и музыканты сбросив телесную хитиновую оболочку в обнимку неспешно отправляются в Путешествие на Восток под ледяным ветром нечеловеческой музыки ВИЛенин которая оказывается сама себя продуцирует  концерт окончен  Дальше все как у 
36483	Никто не сомневается что ее супруг  бандит но это не мешает Цеце собирать десятки тысяч зрителей на каждом концерт  
36483	Вот тогда по-настоящему мы и забили тревогу  Собрали вместо спектакля концерт  Зрители это приняли  
31612	После шумных скандалов и газетных пасквилей которыми сопровождались премьеры почти всех его сочинений в период от сочинения до премьеры Песен Гурре консервативная венская публика устроила автору настоящую овацию на что Шенберг отреагировал довольно своеобразно когда после концерт его буквально силой вытолкнули на 
