30243	 валентин владимирович быть кожевенный часть всякий раз норовить растолковывать разница между шевро лайка самый тонкий деталь поэтому 
30243	 модный такой аристократический перчатка кожа замша кружева хороший сорт тонкий лайка который можно быть натягивать 
30243	 сырье это кожа шевро хром лайка юфть опоек шагрень 
21481	 сибирский лайка один наиболее близкий 
21481	 очень большой собака лайка очень долго быть 
21481	 главный улица горсовет над который полоскаться красный флаг пылить под наш колесо свора сибирский лайка бродить город шофер 
21481	 понос рвота едва превращаться пар как там быть дотаскиваться свой менее повертывать командир залезать под насквозь пробивать холод машина где уже быть вырыть окопчик поставлять печка свернуться резиновый коврик который покрывать снаряд живой равнодушный простуда словно сибирский лайка 
21481	 важный веха развитие космический биология становиться полет год искусственный спутник земля собака лайка борт 
21481	 поздно олег георгиевич газенко писать медицина включаться космический исследование весьма оперативно завершаться еще месяц день запуск первый искусственный спутник земля октябрь год уже ноябрь тот год быть осуществлять первый орбитальный биологический эксперимент собака лайка борт второй искусственный спутник 
21481	 через месяц полететь спутник собака лайка который становиться первый живой существо 
21481	 совсем другой дело сибирский лайка который ходить хозяин 
21481	 исправлять свой оплошность лайка снова рвануть след 
21481	 маманя грузить вроде как приходить мент собака свой собака редкий смесь волк сибирский лайка тот подраться сын искусывать 
21481	 здесь мой собака лайка еда так по-разному 
21481	 выходить орбита когда там побывать уже второй советский исз первый мир биологический спутник собака лайка весить более полтонны 
21481	 занятие скучать глядеть окно который отцовский верховой конь мальчик гоняться село лайка кличка белка 
21481	 вдруг набегать собака лайка целый стая 
21481	 американский коккер спаниель сеттер боксер бультерьер ротвейлер московский сторожевой американский стаффорд французский бульдог карликовый пинчер болонка пудель шпиц колли цвергшнауцер миттельшнауцер ризеншнауцер доберман бордоский дог немецкий овчарка среднеазиатский овчарка западный сибирский лайка фландрский бувья метис скотчтерьер фокстерьер 
21481	 западный сибирский лайка шанель лад киселев 
21481	 хороший собака группа западный сибирский лайка зайка серов 
21481	 продажа животное без родословный такса кобель год щенок лайка американский коккер кобель 
21481	 щенок немецкий бельгийский голландский французский овчарка карликовый пинчер лайка также большой выбор крупный 
21481	 среднеазиатский овчарка кобель мес щенок бельгийский овчарка лайка тело 
21481	 щенок метис лайка дворняжка мес 
21481	 собака помесь дворняжка лайка кобель мес 
21481	 американский коккер спаниель сеттер боксер бультерьер ротвейлер московский сторожевой американский стаффорд французский бульдог карликовый пинчер болонка пудель шпиц колли цвергшнауцер миттельшнауцер ризеншнауцер доберман бордоский дог немецкий овчарка среднеазиатский овчарка западный сибирский лайка фландрский бувья метис скотчтерьер фокстерьер 
21481	 основной сибирский лайка они очень выносливый 
21481	 вот услышать космос голос первый четвероногий космонавт собака лайка 
21481	 тут еще практически следом запускать второй живой собака лайка внутри 
21481	 хотя кино приходиться падать крыша лошадь валяться снег ездить упряжка чукотский собака лайка перевертываться море вместе 
30243	 во-первых конечно перчатка белоснежный тонкий лайка часто затейливый отделывать тиснение сборочка 
30243	 обычно каждый бал покупаться новый перчатка редкий пара выдерживать более один два чистка лайка становиться жесткий сседаться поэтому 
21481	 умный сибирский лайка уже начинать привыкать такой 
21481	 чтобы действовать наверняка начинать что поехать урал покупать чистокровный сибирский лайка 
21481	 видно писание стих после приобретение сибирский лайка окончательно добивать его жена 
21481	 знать что чувствовать сибирский лайка который если верить газета поедать 
30243	 сшивать какой-то тонкий кожа наподобие лайка 
30243	 что только быть здесь спутывать разноцветный мотка мулине пакетик швейный иголка веер слоновый кость наперсток грибок для штопка китовый корсет драный перчатка лайка серебряный пудреница алмазный монограмма 
21481	 все быть обычно как все самый банальный сумасшествие так называть семейный жизнь уже созревать душа мой решимость понимать наконец как должный поступать купить себя щенок сибирский лайка 
30243	 перчатка носить вязаный фильдекос более теплый время лайка замша 
30243	 жена перчатка лайковый зеленый сумка лайка сапог хром каблук 
21481	 баба приходить нос поводить нос она что сибирский лайка бельчатница верхом брать 
21481	 большой черный пес сибирский лайка рваться цепь жаждать познакомиться 
21481	 потом оказываться что иногда она улица выходить босиком например чтобы давать корм кузя тот самый сибирский лайка что сидеть цепь 
21481	 такса удивлять борька лайка расстраивать защемлять сердце 
21481	 защемлять сердце когда увидеть белый пушистый веселый собака острый ухо кренделек хвост спина очень напоминать лайка пропадать тяп 
21481	 медведь убивать охотник московский общество стрельников помощь лайка звонкий дружный под новгород 
21481	 пустой клетка быть надпись здесь жить лайка 
21481	 зверовой сибирский лайка любить сидеть дома 
30243	 полдень обычно шаутбенахт менять перчатка правый рука тонкий лайка выдерживать шаутбенахт бить человек 
21481	 антон павлович очень любить зима снег скучать они как сибирский лайка 
30243	 труп жить смерть этот смерть просачиваться сквозь лайка перчатка 
30243	 можно сам приготавливать себя чехол такой случай хорошо все сделать легкий шелковый материя или лайка длинный дамский перчатка 
21481	 корм для они быть служить белок который быть стрелять дорога сибирский лайка неприхотливый довольствоваться немногие 
30243	 стягивать мертвый рука желтоватый какой-то пыльца перчатка медленно торопиться напяливать каменный палец белый лайка 
30243	 весь этот ворох военщина даже какой-то полицейский эстетика приставать какой-нибудь сынок корпусный командир соответствующий семейный традиция очень плохо вязаться кухонный чад средне мещанский квартира отцовский кабинет пропахнуть кожа лайка опойка еврейский деловой 
30243	 сей пора казаться запах ярмо труд проникать всюду запах дубленый кожа лапчатый шкурка лайка раскидывать пол живой 
30243	 белый лайка злополучный перчатка теперь ярко выступать 
30243	 сжимать белый перчатка кулак так что лайка один палец лопнуть 
21481	 самый интересный этот выставка являться предстоящий испытание сибирский лайка медведь 
21481	 себя квартира показывать штабс-капитан свой библиотека коллекция старинный фарфор редкий гравюра два породистый сибирский лайка 
21481	 видеть рябчик тетеревиный выводка дичь пугать взять сашка пестрый собачонка лыский типичный сибирский лайка 
30243	 весь продукт получать место окончательный обработка лен вывозиться вид полотно семя образ олеин кожа поступать чемодан лаковый пояс собачий шкура выделываться лайка тимофеев трава вывозиться вид 
30243	 электричество который так переполнять мой сердце который желать передавать доходить ваш сердце через перчатка лайка дурной проводник целовать рука несколько 
30243	 тут начинаться разговор перчатка лайка мастер 
