20510	 более работодатель неразумно навязывать тот страховой условие который штамповаться полис обязательный медицинский социальный страхование 
20510	 основание его оценка лишь если компания оказываться чистый быть выписываться страховой полис 
20510	 перечень документ заявление автобиография паспорт диплом копия заверять нотариус мед справка обязательный отметка дерматолог рентгенолог фотография военный билет приписной свидетельство страховой полис инн 
20510	 мочь понимать что дело говорить марина андреевна после шок вспомнить что федирко приходить утро тот день просить давать документ медицинский карта полис свидетельство рождение лора 
20510	 сейчас наиболее крупный известный банк направлять свой клиент импортер страховщик полис страхование кредит 
20510	 как правило цена аренда включать себя стоимость страховой полис ущерб угон стоимость бензин 
20510	 небрежный обращение водитель автомобиль прокатный компания подстраховывать себя только страховой полис франшиза 
20510	 даже если страховой полис вносить очевидный вещь все равный 
20510	 частный страховой полис плясать доллар 
20510	 действие полис распространяться весь мир исключая 
20510	 тот кто совершать многократный поездка течение год целесообразный воспользоваться годовой полис 
20510	 страховой компания росно они мочь предлагать годовой полис страхование 
20510	 течение срок действие полис можно совершать многократный поездка продолжительность 
20510	 этот полис понадобиться если ваш вина 
20510	 этот случай можно обращаться бюро зеленый карта тот страна где данный момент находиться урегулировать отношение потерпевший что давать полис во-первых гарантия получение профессиональный помощь 
20510	 достаточно связываться центр неотложный помощь сообщать фамилия имя номер страховой полис подробно описывать обстоятельство характер 
20510	 поэтому всякий случай перед оформление полис поинтересоваться какой именно образ страхователь 
20510	 для чтобы пускаться путь личный авто приходиться обзаводиться страховой полис 
20510	 статья страховой медицинский полис каждый гражданин отношение который 
20510	 каждый гражданин отношение который заключать договор медицинский страхование или который заключать такой договор самостоятельно получать страховой медицинский полис 
20510	 страховой медицинский полис находиться рука застраховывать 
20510	 форма страховой медицинский полис инструкция его ведение 
20510	 страховой медицинский полис иметь сила весь территория 
20510	 момент заключение договор медицинский страхование выдавать страхователь или застраховывать страховой медицинский полис 
20510	 минздрав предлагать создавать новый система медицинский страхование омс чтобы человек покупать дополнительный полис суть это государственный вариант 
20510	 слово представитель ингосстрах компания который быть вынуждать снижать активность под давление высокий убыточность постепенно возвращаться регион что позволять улучшать ситуация доступность полис осаго 
20510	 первый очередь под сокращение попадать региональный сеть страховой компания включая крупный уже год активно сокращать число точка продажа полис урегулирование убыток 
20510	 правда приобретать полис онлайн смочь лишь тот кто 
20510	 самый распространенный вид директ страхование сегодня страхование автокаско осаго упрощенный продукт страхование имущество физический лицо полис страхование выезжать рубеж 
20510	 после принятие закон электронный страхование клиент мочь совершать полноценный покупка полис онлайн 
20510	 также онлайновый режим клиент иметь возможность вносить очередной платеж при покупка полис рассрочка узнавать статус 
20510	 номинальный рост рынок год быть способствовать принятие год закон медицинский страхование мигрант который обязывать иностранный гражданин лицо без гражданство при устройство работа россия предъявлять работодатель полис 
20510	 мнение генеральный директор уралсиб сирма готовац для дальнейший поддержание собственный рентабельность страховщик необходимо оптимизировать бизнес процесс ввод полис урегулирование страховой случай 
20510	 удаваться добиваться отмена двойной налогообложение выплата накопительный полис 
20510	 результат становиться плохо все страховой услуга доступный все везде страховой компания уходить рынок банкротиться страдать из-за это потребитель теперь ряд регион вынуждать покупать фальшивый полис осаго либо ездить 
20510	 анатолий кобенков все-таки успевать похлопотать андрей знать даже что такой страховой полис устраивать тубдиспансер 
20510	 даже если руль сидеть собственник машина достаточно что вписывать полис осаго 
20510	 при оформление полис осаго себя чей-то 
0	 рассматривать феномен пример пожалуй наиболее известный хрустальный череп который как утверждать английский археолог фредерик митчелл хеджес обнаруживать джунгли британский гондурас современный белиз город упасть камень лубаатун один крупный полис древний цивилизация майя полуостров 
0	 карнаро как все сразу античный полис немного древний рим 
0	 народный собрание член который являться весь свободный гражданин эфес проводиться именно здесь агора как другой полис 
0	 одеон булетерион вместе традиционный для греческий полис агора пританеон здание городской 
20510	 кроме ваш ребенок быть оформлять страховой полис путешественник зао страховой компания чартис 
20510	 вылечивать это ходить больница полис прописка деньги лиза 
20510	 кроме иметь страховой полис иметь право соглашаться или 
20510	 леонид зипп медицина загон придумывать мед полис вот поэтому 
20510	 важно также знать что при оформление договор страховщик требовать большой количество документ даже свидетельство собственность обязательно однако при наступление страховой случай обладатель полис мочь ожидать неприятный сюрприз отказ 
20510	 еще один минус данный вариант что стоимость строение быть определяться после наступление страховой случай мочь серьезно расходиться указывать полис страховой сумма объяснять артем искра 
0	 знаменитый лисистрат аристофан женщина помощь отлучение мужчина комиссарский тело просто говорить помощь сексуальный голод добиваться остановка война между греческий полис 
0	 бездельник откровенно цинично декларировать свой право праздность это преступник сектант человек богема идиот изначально древнегреческий слово обозначаться частный лицо отказываться принимать участие общественный жизнь античный полис 
0	 волдимарс полис древний греция исторически продемонстрировать многие 
0	 древний мир государство изначально создаваться город город полис 
0	 понимать что самый полис древний город государство почти невозможный 
0	 вместе бурно развиваться механика химия расширяться круг источник энергия появляться зачаток новый социальный управленческий технология как производственный хозяйственный включая сфера отношение древневосточный античный феодальный собственность так властно регулировать тип государственный правовой институт тип восточный деспотия военный демократия полис империя клиентела абсолютизм 
0	 например античный трагедия пронизывать весь отношение античный общество жизнь полис 
0	 философ уже античность усматривать некий антагонизм между полисный государство культура греческий полис хотеть допускать никакой история 
0	 платон рассматривать полис совместный поселение как нечто создавать 
0	 еще платон уподоблять государство точно полис человеческий тело этот традиция 
0	 особенность античный историография быть преимущественный интерес местный история история отдельный полис или группа 
0	 предмет политический философия исторически определять сегодня понимать под оно современный государство тот время называть его словом заимствовать древний грек очень специфический как многие утверждать негосударственный институт полис 
0	 примерно так государство полис республика империя это просто 
0	 называть греческий полис государство анахронизм анахронизм необходимый 
0	 такой аналогия более правомерный поскольку полис государство еще конец 
0	 если приходиться брать напрокат автомобиль испания или греция поинтересоваться включать предлагать полис так называть выкупной залог 
0	 помнить это стоить тот случай если взять машина другой страна испания или греция находиться лишь проезд вид полис чтобы покрывать весь стандартный риск 
0	 каждый удаваться дослушивать конец вопрос чтобы давать заранее приготавливать ответ что древний греция называть полис думать что словом полюс 
0	 развитие демократия связанный прежде все развитие институт гражданский общество который берет начало еще греческий полис или новгородский вече 
0	 античный полис весь партия игра разыгрываться вслух 
0	 читать про себя заниматься политика про себя другой быть равный мера непонятный для греческий полис 
0	 куда мало знать что казак жить свой самоуправляемый община свой собственный писать неписывать закон обычай сохранять вплоть начало век традиция демократический управление киевский русь или греческий полис причерноморье 
0	 историк фюстель куланж еще прошлый век справедливо указывать что подобно как функциональный назначение семья первый очередь это функция деторождение также брак смерть почитание предок формировать сердце греческий римский частный религия так полис находиться сердце общественный публичный 
0	 общеизвестно что сам слово политика брать свой начало греческий полис быть город государство 
0	 античный культура полис быть просто форма социальный 
0	 этот загадка просить разгадка или крайний мера размышление подумать посмотреть глядеть площадь фронтон храм аполлон или мочь быть ворота весь святилище большой комплекс священный роща прихрамовой постройка место хранение казна греческий государство потому что греческий полис свой казна для хранение сдавать 
0	 характерно что греческий полис знать отличие 
0	 образ мир определять литература определять она кардинальный меняться человек стоять как всегда его центр соотноситься уже абсолютизировать природный социальный бытие космос полис античный литература 
0	 более прощать что судить прежде все подрыв государство сохранность афинский полис тревожить теперь мало чем прошлогодний 
0	 это нормальный ряд монархия власть один аристократия власть хороший или для хороший цель политейя власть народ малый государство полис осуществлять общий интерес 
0	 философ платон насмешливо сравнивать этот полис лягушка усаживаться берег 
0	 показательный этот отношение располагать юго-западный крым крупный древний город полис херсонес средний век корсунь 
0	 древний греция страна объединять множество рабовладельческий город государство полис 
0	 история греция особый значение иметь два полис афины спарта 
0	 для они идеальный город быть полис демократия там царь потомок 
0	 замечать скобка что под государство гегель как платон понимать данный случай вовсе только известный политически правовой организация государство современный смысл этот термин только весь вообще совокупность социальный установление регламентировать жизнедеятельность индивид бытовой нравственный интеллектуальный эстетический проявление слово весь что составлять своеобразный культура некоторый полис город государство весь что 
0	 важный художественный символ греческий полис быть театр представление трагедия 
0	 век македонский гегемония филипп при хероной побеждать объединять греция следующий год коринфский мир подчинение весь греческий полис македония 
0	 замечать что греческий герой существовать какой-то образ вне полис 
0	 кажется этот имя являться исковеркивать слово греческий язык иса тина полис быть город весь 
0	 сожаление мочь ясно представлять себя пока тот сумма научный знание который доставаться древний эллин когда среда выявляться научный мысль когда она впервые принимать научно философский структура вне религиозный космогонический поэтический построение когда впервые эллинский городской цивилизация полис создаваться научный методика логика 
