24456	 взрослый умиляться сразу забывать прежний проказа 
24456	 сделать голос бархатистый становиться расшатывать рыжеволосый взбалтывать память она говорить погода наводнение который обещаться осень студенческий проказа 
24456	 еще какой проказа выдумывать хлесткий первый 
24456	 опять какой-нибудь проказа сказать смеяться григорий иванович 
37005	 лев пирогов муж несомненно где-то горизонт этот ужасный слово погромыхивать таз личный неустроенность профессиональный несостоятельность психопатия мочь быть даже проказа или чума 
37005	 время черный смерть европа разгромить почти весь лепрозорий убивать множество больной проказа 
37005	 это самовыражение личность это болезнь это все равный что пропагандировать проказа должный идти 
37005	 болезнь который компания направлять усилие контроль искоренение становиться висцеральный лейшманиоз болезнь шагас американский трипаносомоз сонный болезнь африканский трипаносомоз лепра проказа лимфатический филяриатоз речной слепота онхоцеркоз 
24456	 как автор книга для родитель представитель старый литературный эпоха вынуждать переписывать форматировать свой текст как инструкция воспитание ребенок сопровождать комикс который показывать ложный правильный реакция детский проказа 
37005	 черный кровь страшный болезнь проказа бог говорить именно такой кровь 
24456	 сам слово пранк быть заимствовать английский язык где существительное означать проказа шалость проделка розыгра 
37005	 они бояться общественный мнение который навешивать они ярлык прокаженный проказа болеть почему-то преимущественно мужчина может 
37005	 проказа или лепра как туберкулез 
37005	 вновь готовый переболеть любой проказа любой чума 
24456	 петь шалость любовь венерин проказа как мало соловей 
24456	 кан корсо заботливый нянька прекрасный компаньон игра обожать малыш позволять они любой шалость проказа 
24456	 про блокада рассказывать про дорога жизнь который водить поезд про детский проказа юношеский увлечение вот 
37005	 верить что быть ненависть признанный классифицировать болезнь как например проказа иностранный специалист приезжать изучать 
24456	 хотеть снова возвращаться разжиреть плюшка пряничек большеглазый дитя рыдать ночь проказа злой насмешник жестокий тихонь 
24456	 гимназия николенька быть бойкий малый всеобщий любимец главный подстрекатель зачинщик весь проказа мастер строить комичный рожа 
24456	 вспоминать наш учитель давнишний проказа общий весь выпуск знаменитый 
24456	 над учитель свой сашенька смеяться устраивать злой проказа 
24456	 унаследовать мать чисто славянский преданность друг забывать превращение веселый умненький подружка детский проказа игра великий княгиня 
24456	 она обожать малыш позволять они любой шалость проказа 
37005	 повод развод считаться также неспособность брачный сожитие бесплодие жена безвестный отсутствие один супруг неизлечимый болезнь например проказа принятие один супруг монашество 
24456	 указывать этот узкий счастливый лазейка мочь мичман хомчук тот страдать излишний любопытство удовлетворение который мочь пойти вред маркин время лицо служака годиться маркин дед набегать добродушно снисходительный усмешка строгий воспитатель наперед знать весь наивный детский проказа безмозглый школяр 
37005	 судовой врач окончательно успокаивать заявлять что инкубационный период проказа около двадцать год 
37005	 итак кроме прелюбодеяние вступление один сторона новый брак повод для законный развод быть признавать также отпадение супруга или супруга православие действительно невозможно себя представлять себя семья состоять православный христианка муж мунит последователь виссарион или член богородичный центр противоестественный порок понятно что какой санкция церковь противоестественный сожительство два лицо один пол как делать ныне многий протестант мочь быть речь ныне когда-либо будущее неспособность брачный сожитие наступать брак или являться следствие намеренный самокалечение заболевание проказа или сифилис первый поскольку делать 
37005	 средневековый мусульманский богослов аль мутанный говорить что иисус исцелять слепорожденный прокаженный именно для чтобы самый доказывать иудей что пророк поскольку прирожденный слепота проказа неизлечимый 
37005	 заболевание при амбулаторный лечение который весь лекарство указанный перечень отпускаться бесплатно относиться диабет онкологический шизофрения эпилепсия спид вич-инфекция лепра проказа психический заболевание инвалид 
37005	 еще давний время авиценный канон врачебный наука писать что волчий лыко хорошо проказа нервный болезнь головокружение 
24456	 никак они даже целоваться цикл детский проказа 
37005	 репродукция картина продаваться повсюду так как доход идти фонд борьба какой-то ужасный болезнь проказа или анорексия точно помнить 
37005	 так новый как фамилия попов как холера проказа как чума плач ребенок 
37005	 устанавливать разница причина заражение чума холера первый описывать проказа желтуха сибирский язва 
24456	 молодой барятинский лермонтов часто бывать заводила проказа шалость начальство смотреть 
24456	 тогда должный уезжать это проказа фагот все уже надоедать 
24456	 вот насилие безобразный словно проказа проникать сюда 
24456	 так что блуд уборщица дворовый шуточка разный там тити митя дамочка соседка травяной улица также щипание женский ягодица когда бывать случай включая собственный жена собственный постель вот собственно весь проказа наш селадон 
24456	 оказываться они вместе учиться омский школа милиция теперь весело вспоминать юношеский проказа 
24456	 детишки весь время сударь нелегко быть терпеть весь наш взрослый проказа 
37005	 изумруд например спасать человек лихорадка падучий болезнь проказа 
37005	 носить аметист подвергаться проказа чесотка подобный болезнь гиацинт 
37005	 народ окрестить проказа больной прокаженный 
37005	 впрочем казахстанский лепрозорий говорить что случаться среди больной самоубийство проказа непредсказуемый коварный болезнь мочь 
37005	 издавна быть отмечать что очаг лепра возникать часто все устье крупный река что они мочь существовать столетие один тот место стоить удаляться очаг хотя несколько десяток километр как вероятность заражение заболевание проказа исчезать 
37005	 его селение вывозить барс кельмес потому что начинаться проказа 
37005	 как тогда быть перемещение горизонталь тоже раз спасать чума холера проказа малярия 
37005	 освобождать мука ниспосылать человек водянка проказа лихорадка подагра тяжкий ран 
37005	 опять брать вишневый сад просто болезнь допускать проказа 
37005	 знать что плечо творческий подвиг достойный бах решать подниматься живой деяние выпускать врач уезжать африканский тропики лечить туземец вымирать сонный болезнь проказа туберкулез 
37005	 подумать только ведь кроме грипп быть еще чума холера проказа 
37005	 становиться быть быть мысль сильный весь несчастие неурожай истязание чума проказа весь который 
37005	 знакомый врач начинать наводить справка лечение проказа 
37005	 этот лечение прибегать данный случай только мазать рука энергично под влияние тревожный мысль что болезнь мой лишать проказа 
37005	 приходить убеждение что это проказа считать себя обреченный 
37005	 узнавать что петербург жить главный специалист проказа деятель борьба 
37005	 наказание мнительность записывать член учреждать общество борьба проказа 
37005	 какой это идти сравнение эпидемия чума холера проказа туберкулез 
37005	 между тяжелый хронический инфекционный заболевание проказа чисто косметический недостаток кожа 
37005	 песя считаться даже более позорный болезнь чем проказа 
37005	 разграничение понятие проказа витилиго много труд уделять 
37005	 белокожий наблюдаться при некоторый форма проказа потому смешивать этот болезнь 
37005	 если при проказа обесцвечивать участок совершенно лишенный чувствительность 
37005	 смалывать боб настаивать растительный масло смазывать они поражать проказа или белокожие место 
37005	 например чума туляремия эпидемический сыпной возвратный тиф возникать при активный участие вошь блоха высказываться предположение что клоп мочь переносить палочка чума туберкулез проказа 
37005	 рассказывать как двадцать год назад сразу после оккупация лошадиный лощина быть создавать лепрозорий карантинный лагерь для лицо страдать так называть желтый проказа или очковый болезнь 
37005	 невидимый чудовище страшно чума проказа подстерегать неосторожный 
37005	 после это бояться смерть нет чуточка бояться смерть подавать она кто хотеть хоть сам холера хоть чума проказа 
24456	 парта класс оставаться только след наш детский проказа ненадолго быть 
37005	 приходить ненадолго ельшин дева болеть зуб мочь без проказа час 
24456	 этот история который казаться должный быть вызывать серия воспоминание проказа шалость неисправимый лермонтов повлечь 
37005	 солнце жарко муха бередить парша человек болеть проказа тот этот место много 
24456	 проказа шалость оживлять весь дом 
24456	 этот строгость распространяться даже неосторожность огонь кипяток если жечь рука обвариваться кипяток падать получать повреждение при детский проказа затея естественный наказание 
24456	 вспомниться графиня который встречать там биограф пушкин дознаваться фамилия быть графиня стройновская вспоминаться тогдашний проказа шалость тешить так весело 
24456	 они глядеть как проказа шалость прелесть 
24456	 целый день ходить рассеянный смущенный отвечать бледный улыбка проказа ласка маленький принц 
24456	 давать слово тасенка никогда лазать дерево вообще стараться удерживаться шалость проказа 
24456	 сей пора пансион быть шалость детский проказа непослушание каприз 
24456	 перламутровый столик аполлон аполлонович поставлять стакан вдруг старчески рассмеяться что-то как смеяться мальчишка проказа веселый дядя локоточка толкать друг 
24456	 рыхлый нездоровый желтый лицо степа дурнин апатичный болезненный девочка живой бойкий черноглазый танюша морозкин любимица роза федоровна острый язык девочка который сторониться сверстница именно это чрезмерный умение угождать розка как называть глаз мастерская старший закройщица анютка отчаянный девочка проделывать невероятный вещь смысл шалость проказа подвергаться менее невероятный 
24456	 ненастный погода княгиня слушать музыка или смеяться проказа сычик зима развлекаться 
37005	 закрытие конгресс сопровождаться неизбежный речь министр иностранный дело всеобщий мир третейский суд международный справедливость американский врач открывать бацилла проказа теперь этот страшный болезнь оставаться 
24456	 прокаженный жрец подымать рука небо заклинать смеяться скверно знать конец праздник знать что прийти девственный посвящать бог проказа 
37005	 одесса китайский подданный ромаз пешком добираться азия одесса чтобы затем следовать паломник мекка заболевать здесь проказа помещать городской больница 
37005	 тэн ребенок отнимать проказа болеть 
24456	 воспитанница заведение разделяться три категория умница благонравный прилежный благочестивый девочка соблюдать весь монастырский правило дьявол лентяйка шалунья тайно явно нарушать предписание начальство глупый приставать один первый категория смеяться проказа дьявол смиренно опускать глаз перед 
37005	 такой минута этот валяться тьма недуг мир нельзя подходить иначе как предварительно погружаться тот самый тьма болеть тот самый проказа который грозить оно истреблять 
24456	 пробежать заяц косой проказник замысловатый свежий пороша напрыгаться налагаться крюк выкидывать сажень три под кочка улечься снежок загребать притаиться казаться свет нет мальчик плутишка заутр клюква пойти смеяться след глядеть проказа его экий увертливый подумать ведь 
24456	 вспомнить какой проказа здешний место строить 
24456	 шалость проказа своевольство хотеть большой число 
