15899	-ориентированное программное обеспечение похоже на автомобиль капот которого нельзя открыть  
15899	Если окраске подлежит весь борт капот или передние крылья автомобиля то 
15899	Выйти из автомобилей  Руки на капот   Жигули и Волга остановились  
15899	На это было страшно смотреть автомобиль Владимира выдвигается на перекресток и тут слева на большой скорости летит машина с длинным капот и ударяет в дверцу за 
15899	Конечно ее кар был классом выше мерседес -родстер насколько я помню с тремя сотнями конских сил под капот  
15899	Выхожу    Откройте капот   Наклоняюсь дёргаю чего надо  вуаля 
15899	Наклоняюсь дёргаю чего надо  вуаля  вот вам Бырым мой капот  
15899	Открыла капот подёргала за волшебные пимпочки что 
15899	Под капот кабриолета устанавливаются три типа бензиновых 
15899	Полиция застала г-на Бегбедера и его друга нюхающими порошок прямо с капот автомобиля  
15899	Автомобиль на педальном ходу мои ножки в лёгких чешках вращают двигатель в одну детскую силу под капот  
15899	Николай Михайлович засуетился включая свет в гараже открывая капот объяснял оправдывающимся тоном что вот 
15899	И комаров как раз туча просто была  Николай копался под капот а она махала над ним 
15899	Николай подзарядил аккумулятор долго копался под капот а потом заявил  
15899	капот приоткрыт на лобовом стекле чего-то 
15899	капот приоткрыт на лобовом стекле чего-то 
15899	Текущая экономическая политика в условиях высоких цен на нефть и природный газ неизбежно ведет Россию к непредсказуемому политическому социальному и экономическому кризису   История на капот   С каждым годом автомобилей становится 
15899	Каждое десятилетие на дорогах появляются если не близнецы то близкие родственники отличить которые можно только по эмблеме на радиаторе или капот автомобиля  
15899	Автомобиль уткнувшись капот в слежавшийся снег плотно застрял 
15899	Мы отправились в Киево-Печерскую лавру и не на чем-нибудь а на Линкольне цвета кофе с молоком с борзой собакой на капот скачущей на шаг впереди автомобиля 
15899	Под капот система пожаротушения  на всякий пожарный 
15899	Под капот подобающий такому автомобилю -сильный 
15899	Кузов авто массой  фунтов около  кг выстукивали на коленке под капот  -литровый двигатель Форд 
15899	В один миг хозяин вылетел из машины поднял капот отвинтил гайку минусовой клеммы аккумулятора 
15899	Самым главным из них стал капот получивший на своих боковинах двадцать 
15899	Забелинский БМВ въехал внутрь и почти уткнулся как обычно капот в заваленное снегом столетнее канатное 
15899	Якунины вели вполне обеспеченную жизнь имели хорошую квартиру дачу потом уже в шестидесятых купили Волгу бело-серую с серебристым оленем на капот  
15899	Еще раз поставишь автомобиль на тротуар мы тебе на капот кирпич сбросим  
15899	Изгиб крыльев и стоек крыши задние фонари капот фары бамперы решетка радиатора и 
15899	Если в Узбекистане сумеют наладить сборку этого автомобиля и главное снизить его цену то наши улицы вскоре украсят свежие образцы итальянского дизайна со знакомой эмблемой Дэу на капот  
15899	С механиками это обычное дело  стоит им заглянуть под капот вашего автомобиля как в нем 
15899	Недолго думая он откинул крышку капот и с локтями погрузился в 
15899	Беглец подскочил вверх левым боком упал на красный капот Тойоты был откинут и мешком 
15899	Пакетика в  мл должно хватить на полную обработку автомобиля средних размеров  у нас получилось что ВАЗ-  автомобиль гигантский пакетика с Карнаубой хватило только на капот и половину крыши фото  
15899	На даче пока выдалась свободная минутка я решил немного изучить матчасть открыть капот заглянуть под машину  
15899	Есть такой способ если вы видите через лобовое стекло и капот вашего автомобиля задние колеса машины 
13120	Мама у нас же есть  бормочет Ленька дергая мать за рукав капот  
13120	Невысокая дама повернула голову в меховом капот  
13120	Мы прошли через зал в кабинет к инспектору Бодянскому  тучному человеку в просторном как дамский капот форменном сюртуке  
13120	За дверью упал тяжелый болт дверь распахнулась взметнулись старческие руки в отпашных рукавах капот  
13120	И вспомнил каким весом прошла Груня в желтом капот  
13120	Вышла морщилась на свет опять в этом желтом капот шаркала незастегнутыми ботинками села напротив 
13120	С плеча спускается на белый атласный капот турецкая шаль  
13120	Для пошивки обуви матросам пришлось покупать кожи и устраивать на судах сапожные мастерские а матросские куртки выкраивать из греческих капот  
13120	Перегнувшись с него маленький вихрастый Валька Чердаков швырнул две лимонки  ручные гранаты  одну прямо в капот великолепного фиата другую около  
13120	В это время входит в залу Борецкая в капот со свечкой в руке и 
13120	Она встает с позолоченного ложа оправляет пред зеркалом чепец и накинув сиреневый кружевной капот подходит к открытому окну  
13120	В шелковом перетянутом опояскою капот без фижм и кринолинов парадных 
13120	В коридоре было темно и когда няня поравнялась с комнатой Володи он заметил что на ней был только легкий капот  
13120	Он видел ее белое тело у шеи где сходились полы капот и руки  рукава Жермен были 
13120	Он поднял ее на руки капот опустился и повис открыв все 
13120	Тогда Семен взял с табуретки материно платье капот и надел его на себя 
13120	Захарка ступай на двор покатай в тележке Петьку с Нюшкой чтоб они есть не просили  сказал Семен в материнском капот  
13120	Здесь продавали старую одежду девятнадцатого века пропитанную порошком сбереженную десятилетиями на осторожном теле здесь были шубы прошедшие за время революции столько рук что меридиан земного шара мал для измерения их пути между людьми в толпе торговали еще и такими вещами которые потеряли свой смысл жизни  вроде капот каких-то чрезвычайных женщин поповских ряс 
13120	Но тут вбегает низенькая женщина в красивом шелковом японском капот расшитом золотыми павлинами  
13120	А эта мадам Тюнтина в павлиньем капот  
13120	Лысый смотрит на меня с изумлением и повернувшись к старухе в пунцовом капот показывает ей на меня  
13120	Милославский Жорж муж    Надевай скорей царский капот а то пропадем  
13120	Горшкова жила при училище  В красном капот она отворила нам  Стены передней 
13120	Костлявая в коричневом капот с желтыми цветочками и желтым 
13120	Судя по большим зачерствелым ногам Гюльчатай жила всегда босой одежда ее состояла из одной темной юбки продолженной до шеи в виде капот залатанной разнообразными кусками материи вплоть 
13120	Но Чагатаев ей тоже купил новую узбекскую одежду и переодел ее в вагоне во все новое а ветхий капот ее спрятал зачем-то к себе 
13120	А вечером надев желтый капот энергично ходила по комнатам желая 
13120	Пришлось согласиться и на это и ограничиться тем чтобы завернуть в газетную бумагу мою ночную рубашку женин тоненький шелковый капот две зубные щетки кусок мыла 
13120	Он уперся ладонями в ее крутые плечи она вся тянулась к его губам широкие рукава капот высоко загнулись голые розово-белые 
