17836	Он еле дождался пока я доковыряюсь ключ в замке и не снимая 
17836	И было от этого замка три ключ  
35285	Программа скрывает веб-контент в графических файлах  с применением технологии шифрования на основе метода называемого стеганографией с -битным ключ  
20503	Обычную с виду воду которая бьёт ключ рядом с французским городом Авен 
17836	Мать резким движением захлопнула ящик повернула в замке ключ сунула его себе в карман 
17836	Входные двери без замков  должно быть потому что вечно теряются проклятые ключ с расколотыми косяками с большими 
17836	Полез в ящик нашёл старый врезной замок пощелкал ключ туда-сюда  
17836	Я отцепил от связки один ключ чтобы оставить себе а другие 
14507	Это были Гигантские шаги Ролстона и Таня сразу же узнала эту продвигающуюся по большим терциям напряжённую музыку до ми фа диез и ключ менялся в течение темы трижды 
27790	Однако побывав в этом центре понимаешь почему на Северном флоте не оказалось водолазов а норвежцам пришлось самим делать гаечный ключ чтобы отворить люк затонувшей русской 
27790	Неожиданное препятствие у дверей квартиры маялся служивый человек сантехник  чемоданчик в руке в другой  разводной гаечный ключ моток проволоки  
17836	Какое событие провернёт ключ в заржавевшем замке  
17836	Взяла ключ спустилась в подвал отомкнула комнату 
17836	Клёкотов уже и ключ в замке ковыряет и войдёт 
17836	Гробовая тишина царила в квартире когда он открыл дверь своим ключ и вошёл  
17836	Встретились они на квартире у бабушкиной подруги Ляльки которая оставила свой ключ на время переселившись в Тамбов 
17836	Не веря себе он вдруг обнаружил что все ящики Марининых шкафов письменного стола знаменитая Людина шкатулка с драгоценностями  всё закрыто на ключ  
27790	Андрей узнал своего соседа по столику в ресторане  только теперь он был в фуражке а его китель с петлицами на которых серебрились какие-то скрещённые молотки или разводные ключ был расстёгнут на выпуклом животе 
14507	Эстрадная певица Журавлева воспроизводила скрипичный ключ напоминавший ухо  
17836	Для этого сначала откройте замки крышки затем снимите крышку после чего вращая ключ против часовой стрелки отверните тёрку 
17836	Он открывал глаза и было уже утро часовой обходил камеры стучал в железную обивку ключ Подъём подъём  
17836	Я ужаснулся мой родной брат мальчик из интеллигентной семьи сын преподавателя серебряного медалиста Новороссийского университета внук генерал-майора и вятского соборного протоиерея правнук героя Отечественной войны двенадцатого года служившего в войсках Кутузова Багратиона Ланжерона атамана Платова получившего четырнадцать ранений при взятии Дрездена и Гамбурга  этот юноша почти ещё мальчик должен будет за двадцать рублей в месяц служить в Бутырках открывая ключ больничные камеры и носить  на 
27790	Склонился выбрал гаечный ключ не такой здоровый а поаккуратней 
14507	Встречались нам дачники с собаками  с ирландскими сеттерами или борзыми изогнутыми как скрипичный ключ  
20503	Вода здесь была чистой и тёплой всегда градуса на два теплее чем в реке  Наверное тут был где-то тёплый ключ  Рите уже запрещали помногу плавать 
17836	Татьяна Васильевна поднялась по лестнице открыла сначала общую дверь одним ключ потом свою собственную  другим  
17836	Он достал из кармана ключ и отпер шкаф в комнате 
17836	Когда он открыл дверь своим ключ и вошёл в квартиру была 
17836	Он открыл дверь своим ключ и внезапно появился на кухне 
17836	Отворилось маленькое круглое окошечко на двери и сейчас же захлопнулось  Потом загремели ключ    Это за вами  быстро сказал 
17836	Звонить не стали Азазелло бесшумно открыл дверь своим ключ  
17836	Повернулся ключ в двери Аннушкин нос высунулся 
17836	Он открыл её своим ключ закрылся в ней вынул из 
17836	Тотчас за дверью послышался звук снимаемой цепи потом повернулся ключ в дверях и выглянула женщина 
17836	А у дверей ведущих в кабинет дирекции стояла Менажраки в зелёном джемпере с бриллиантовым крестиком на шее и с большой связкой блестящих ключ на кожаном лакированном поясе  
20503	Щи в котле каравай на столе вода в ключ а голова на плечах  
20503	Кроме того когда вода запертая шлюзами чуть поднялась в реке то подземные ключ перестали биться  
17836	Слышали как он затворил дверь на ключ и опустил шторы  
17836	Пан Понятский отпер своим ключ дверь купе и сказал  
17836	Открыли окно в сорок третьем номере  оно выходило в угол сада где под высокой каменной стеной утыканной по гребню битым стеклом рос чахлый банан  потушили электричество заперли дверь на ключ и ушли  
17836	Пройдя её и ещё какую-то сумрачную комнату с лежанкой молодой человек остановился возле низенькой двери и вынул из кармана брюк большой ключ  
20503	Раскрыл Медведь вторую клеть а в ней живая вода ключ бьёт  
17836	А по лестнице шлёпала-топала старуха Буроба с огромным мешком за плечами шарила в потёмках Буроба метила в башенку подымалась на пальчики подступала тихонько к двери отмыкала волшебным ключ тяжёлый засов приотворяла дверь  
17836	семью  дверьми железными за семью замками немецкими и ведут к тому терему ступеней три тысячи и на каждой ступени стоит по воину персидскому и день и ночь с саблею наголо булатною и ключ от тех дверей железныих носит 
20503	Гуляет он и любуется на деревьях висят плоды спелые румяные сами в рот так и просятся инда глядя на них слюнки текут цветы цветут распрекрасные махровые пахучие всякими красками расписанные птицы летают невиданные словно по бархату зелёному и пунцовому золотом и серебром выложенные песни поют райские фонтаны воды бьют высокие инда глядеть на их вышину  голова запрокидывается и бегут и шумят ключ родниковые по  колодам хрустальныим  
20503	цветы  замахали своими верхушками и ровно перед ней преклонилися выше забили фонтаны воды и громче зашумели ключ родниковые и нашла она то 
20503	Ни ответа ни привета не было тишина стояла мёртвая в зелёных садах птицы не пели песни райские не били фонтаны воды и не шумели ключ родниковые не играла музыка во 
20503	Погребён и засорён животный источник в том сердце в коем отворился ключ мёртвых вод и фонтан денно 
20503	Так из источника на территории популярного в Сибири санатория Рассветы над Бией мы производим воду Серебряный ключ  
20503	Про скот в наши дни мало кто вспоминает а вот веселье бьет ключ в чем пришлось убедиться и 
20503	К этому часу жизнь во дворе бьет ключ  
27790	Из них торчали гаечные ключ пассатижи отвертки  
20503	СО На первый взгляд здесь жизнь бьет ключ  
20503	Утомившись от ходьбы примоститься на скамеечке у фонтана фонтаны и фонтанчики шумели повсюду подремать под грустное журчание воды и опять бесцельно брести куда-то Ночная жизнь в городе била ключ но меня она как будто 
20503	Из Вас так и бьёт ключ горячий  
14507	И еще жив стол под который я ходила пешком и на котором запечатлела пять линеек скрипичный ключ и все ноты от самых 
14507	Я складываю неведомое в синюю папку из спрессованного картона с тиснёным скрипичным ключ и белыми канатиками-петельками и 
27790	Требования требования  кмс по боксу или дзюдо  разряд по стрельбе и метанию молота опыт боя на гаечных ключ  
20503	На дне Мертвого моря жизнь бьет ключ  
27790	Лишь изредка промелькнет какой-нибудь шустрый делец к трубопроводному крану с большим разводным ключ крадучись пробежит олигарх по направлению 
14507	Там ведь не только музыкальная муштра скрипичные ключ экзерсисы этюды  
20503	В середине  века художественная жизнь в Росси била ключ выставки открывались одна за другой 
27790	С присущим любой юности легкомыслием автор  тогда ещё молодая и красивая  выскочила на обочину и стала размахивать руками с целью затормозить кого-нибудь владеющего искусством применения домкрата гаечного ключ и мистической бениной мамы  
27790	С пола подберите гаечный ключ валяющийся среди инструментов  
14507	За адвокатские золотые дедушкины часы бриллиантовое Ленусино кольцо и запонки в виде скрипичного ключ с рубинами тетя Ксана как 
14507	Большая лохматая голова в кудрях с проседью длинный нос сам очень высокого роста и особая примета  черная нотная папка со скрипичным ключ на потертом коленкоровом боку  
20503	Придет итальянка  сразу видно жизнь бьет ключ личный массажист карточный клуб и 
27790	какие-то предметы   не-гаечный-ключ не-ложка  блестящие приметы боли 
27790	Минут пятнадцать искали гаечный ключ которого не оказалось в ящике 
20503	Под землею тела в старину умерших людей  что сокрылись сокрылись в бесконечно длинной ночи и почили во мгле  там где жёлтые бьют ключ  где за тысячу лет не 
27790	Затягивая или раскручивая гайки располагайтесь так чтобы не толкать рукоятку гаечного ключ а тянуть её на себя 
20503	Но еще пуще берегли водные источники  родники ключ  
20503	Именно те места где были густые лесные дубравы журчали ключ и били родники питали своей 
20503	Между Шунутом и скалами Старик-камень бьёт ключ Платонида  священное место уральских раскольников 
20503	По преданию на этот ключ ушла жить девушка Платонида  
20503	Она каждый день умывалась из ключ в котором отражался крест и 
20503	Название Чизмы происходит от татарского слова чишме что значит ключ родник речка с подземным истоком 
20503	В  км ниже Самаринского острова начинается осиновое изобилие  остров Осиновый камень Осиновый на правом берегу -й км слева  устье речки Осиновой а справа  Устье ручья ключ который на некоторых картах тоже 
20503	Возможно название речки происходит от татарских слов кум  песок и чишмы  родник ключ небольшая речка вытекающая из-под земли 
20503	Есть версия происхождения названия реки от древнепермских слов пон  конец и ыш или аши ошмос  ключ родник то есть поныш  конец 
27790	В месте назначения оказалось что все эти огромные детали намагничены да так сильно что работать с ними невозможно гаечные ключ и прочие инструменты намертво прилипали 
14507	Тысячи тюльпанов образуют на клумбе затейливый узор в виде огромного скрипичного ключ  
27790	Обычные инструменты  вроде шарнирных кусачек отверток разной длины гаечных ключ и ручной ножовки  он брал 
27790	В мини-авоську уже не поместятся абсолютно лишние вещи вроде гаечных ключ и отвалившихся набоек  
27790	Единственный гаечный ключ который бесплатно придают любому автомобилю 
27790	Единственный гаечный ключ который бесплатно придают любому автомобилю 
27790	Правда дверные проемы маловаты и о выигрыше по высоте на водительском месте можно будет говорить только после того как вы переставите кресло в нижнее положение кто не знает  у Волги сиденье регулируется по высоте с помощью гаечного ключ  
27790	А толпа уже понесла его дальше мимо детских колготок туфель со стоптанными каблуками мимо битых будильников и новеньких гаечных ключ пачкающих подстеленные газеты янтарным маслом 
27790	Эквинет предлагает ручной инструмент  гаечные ключ трещотки отвертки усилители крутящего момента 
27790	Эх паяльник для меня  слишком изысканный инструмент А вот если желаете разводной ключ  
14507	То есть изучить альтовый ключ освоить сам инструмент  
