28796	В последнее время от шах закрываются слоном  
28796	Мотивы ненависти Фишера к США которые он как говорится и шах и матом совершенно понятны  
13377	Это персидский шах и его младшие жены  сказала 
13377	Конечно большую помощь оказали монастыри не поскупились и богачи вроде Строгановых но часть средств пришлось занять у персидского шах  
28796	Но когда подошел мальчуган и сказал что про него уже в газете писали поскольку он в городском шахматном турнире участвовал поняла этому классу не нужно объяснять что такое шах мат и ход конем  
28796	Завтра будет такой же совершенно обычный день как и все дни до этого  шах и мат  
13377	Знаменитый сапфир Глаз Аллаха украшал трон персидского шах Надира этот камень отличается необыкновенной 
13377	Это персидский шах и его младшие жены  сказала 
28796	Однако Камский действовал хладнокровно отразил все угрозы и дело кончилось вечным шах      
13377	Его доставили в подарок царскому двору от персидского шах  
13377	Для этого заранее в Москву из столицы были посланы два слоновщика приехавшие из Персии в Россию ещё в  году с подобным же подарком персидского шах  
13377	В конце царствования Анны Иоанновны слонов содержали при дворе в Петербурге а при Елизавете Петровне в  году на набережной Фонтанки были построены специальные слоновьи дворы где содержались животные присланные персидским шах Надиром  
28796	Впрочем Костенюк пощадила девочку не стала искать мат а ограничилась вечным шах      
28796	Но два странных поражения от Карлсена лишили Топалова честолюбивых надежд  в первом круге он умудрился проиграть белыми в безобидной защите Алёхина во втором не сумел реализовать три лишние пешки но вместо того чтобы форсировать вечный шах зевнул мат  
28796	Ложный же след иллюзорная комбинация пешка идет на  и превращается в коня после чего белые тремя разными очаровательными матами отвечают на три по-разному раскрытых шах черных но черные разрушают всю 
28796	Красота превращения пешки в коня и бесстрашие перед шах та самая красота которая устанавливает 
28796	И лишь соблазнившись и уже увидев шахматист замечает что таким способом задача не решается что у черных есть еще ход кроме шах причем что показательно один-единственный 
28796	Морозевич обыграл Свидлера три партии закончились вничью причем редким финалом Ананд  Крамник  пат Грищук  Аронян  повторение ходов Леко  Гельфанд  вечный шах  
28796	В очередном цейтноте Грищук упустил победу и бурная схватка завершилась вечным шах  
28796	Теперь он умоляет Ольгу простить его неловкость берет назад ход шахматный ход и объявляет удивленной барышне шах и мат шахматный ход  
28796	Например предположение что Ленский взял на  своего ферзя а не ладью означало бы что Ольга тоже играла рассеянно  иначе невозможно объяснить почему черный король отправился под шах  
28796	Время останавливается   шах и мат  произносит Феншэ  Компьютер 
28796	Конечно предполагается что все необходимые поля свободны и после рокировки король не попадает под шах ладья конечно может встать под 
13377	Так приставы Великих послов из Стокгольма прибывших весной  года должны были сообщить им о многой казне присланной от персидского шах Аббаса на помощь против его 
13377	С дворцовой террасы шах увлеченно следил за двумя командами 
13377	Но наивысший расцвет исламской архитектуры искусства отделки куполов и фасадов изразцовой мозаикой наступает в  веках в годы правления шах Аббаса  
13377	шах Аббас переселил в окрестности Исфахана 
13377	шах Аббас действительно торопил своего архитектора 
13377	Или напротив как остаюсь здесь в кишлаке учителем физики и стараюсь всеми силами стать достойным звания горца подобно тому как ренегаты из астраханских казаков без посула мучимые видениями гаремов уходили в услужение к персидскому шах  
13377	Даже американцы которые поддерживали скажем режим шах не пытались создать в Иране 
13377	лет назад  марта  года Ираклий  византийский император армянского происхождения двумя годами ранее разгромивший персидского шах Хосрова  прибыл в Иерусалим 
28796	Они обязаны перебросить ладью в тыл неприятельскому королю     и затем шах форсировать ничью  Эта система защиты 
28796	ничего другого нет на взятие ладьи белые дают шах на    
28796	черные могут ответить  и выигрыша нет  только вечный шах   
28796	у черных уже нет ничего лучшего чем  допуская вечный шах  
28796	Вовсе не обязан был проигрывать Морозевич  практически до самого конца в партии с Иванчуком он удерживал ничью но не форсировал вечный шах  
28796	Я в свою очередь научила играть всех друзей причем играли до последней пешки и королей съедали не знали толком правил что нужно шах мат давать как ходят фигуры 
28796	Опыт показывает что довольно легко упустить скрытые защиты основанные на шах белому королю и связке белых 
28796	соль замысла черных  на     слон берется с шах     
28796	Черные в шаге от победы но белых выручает нестандартный механизм вечного шах   
28796	и у белых только вечный шах Юсупов Дворецкий  
28796	Теперь в случае отступления слона шах ферзем полностью оправдывается но слон 
28796	Конечно шах на с неприятен жалко пешку 
28796	с вечным шах    белые съедали опасную 
28796	но тогда белые провели бы ту же комбинацию что и в партии и черные не успевали разжиться качеством так как король ушел от шах с   
28796	с этого момента любой перерыв в шах будет означать для белых еще 
28796	грозит  и - а на взятие пешки  следует шах с    
28796	после которого у белых нет ничего лучшего чем вечный шах   
28796	по шаблону король должен уходить от вскрытых шах  
28796	и здесь легко видно что черные уходят от шах распатовывая белого короля  
28796	Под боем ладья и грозит шах с а  
28796	В действительности Звягинцев конечно сделал второй ход померещилось что уже дал шах с  заставил черного короля 
28796	Если проявить еще немного последовательности то можно побить на  получить в промежутке взятие на  с шах и покинуть турнир  
28796	Конечно черные могут отыграть ладью шах с  но у белых 
28796	При атаке черного короля звучали слова шах или мат  
28796	и после -- белый король попадет под смертельную атаку     это только шах    как показали события в партии 
28796	с вечным шах   Пожалуй больше шансов оставлял немедленный 
28796	а могут и позволить сопернику соорудить вечный шах    
13377	Когда персидский шах Ага-Мохамед захватил Тифлис его 
13377	В  г маркиз ДАрканг устраивает в большой ротонде отеля незабываемый Бал  Империи с участием короля Альфонса  и персидского шах  
28796	В состоянии страшного возбуждения он опустился на колени и закричал срывающимся голосом Конь Харитон шесть о какая красота и потом шах ладьей  
28796	Имел большой перевес с Лотье но пропустил красивый удар форсирующий вечный шах а с Онищуком и Рублевским 
28796	Геркенс писал что недалеко от Почтового двора находился Слоновый двор в нем крупный красивый слон подаренный его царскому величеству персидским шах  
13377	Такое представление я не променял бы на пенсию в тысячу золотых от самого персидского шах  
13377	И это в условиях активизации талибов наседавших на Северный альянс Ахмад-шах Масуда  
13377	И это в условиях активизации талибов наседавших на Северный альянс Ахмад-шах Масуда  
28796	Если вы настаиваете на рокировке то вам шах на С слоном  
13377	Бывшая шахиня Ирана  Сорайя в - гг супруга шах Ирана Мухаммада Реза Пехлеви неизменный 
13377	И начинались разговоры воспоминания Гахама о персидском шах и о его сыне который 
13377	Хаджи Серая Хан Шапхал  - востоковед воспитатель наследника шах Персидского в Тебризе чиновник российского 
13377	Как вспоминал позже Давид Иври накануне исламской революции шах Ирана один из ключевых союзников 
13377	Можно сказать совсем недавно в  году Дели разграбил персидский шах Надир а в   правитель 
13377	Впервые я попал в Иран еще при шах сопровождал нашего тогдашнего главу государства 
13377	На дворцовом приеме меня познакомили с младшим сыном шах  
13377	Как специалист по национальной культуре сын шах настоятельно рекомендовал мне побывать в 
13377	Он особенно прославился с тех пор как в конце  века шах Аббас  сделал его своей 
13377	Пожалуй именно здесь можно понять своеобразную смесь жестокости и утонченности варварства и просвещения характерную для эпохи шах Аббаса  
13377	С дворцовой террасы шах увлеченно следил за двумя командами 
13377	Но наивысший расцвет исламской архитектуры искусства отделки куполов и фасадов изразцовой мозаикой наступает в  веках в годы правления шах Аббаса  
13377	шах Аббас переселил в окрестности Исфахана 
13377	шах Аббас действительно торопил своего архитектора 
13377	Поэтому иранские азербайджанцы-бизнесмены были верной опорой шах Реза Пехлеви  
13377	Или Ахмад-шах Масуд Панджшерский лев самый ненавистный 
13377	Петрович в других воплощениях  Строптивый Софрон-Кулустуур Алексей Максимович Парщиков Раиса Лигачева Алла Веске Аммоний Лысенко Н Николайчик Джон Ницше Бер-Му-Бей Супьянат Смородина Червенко Кант Артюр Марков Баба-шах Ути-Пути Го Мо Ро 
13377	усвоив в армии что  ничего хорошего даром я промолчал шах помогал много мы были чуть 
13377	шах хвалил свои новые приобретения и 
13377	шах хвалил свои новые приобретения и 
13377	Хотя Шахиджанян  подробнейшая еврейская внешность еврей-образец из учебного пособия общества Память он настаивал на армянской родословной но в разговорах не давал покоя антисемитам  на видном месте держал старинные фотографии армянской родни произносил несколько непонятных слов утверждая это единственная фраза на родном языке которую он знает слова каждый раз звучали по-разному на публичные выступления шах он читал лекции об интимной 
28796	Руслан же героически сопротивлялся до -го хода когда шансы на спасение стали равны нулю  белая ладья Адамса объявила смертельный шах черному королю Пономарева  
28796	Шахматы нарды бридж уно замок призраков табу отель книга джунглей шах и дама домино победители  открыли 
13377	Цена на нефть сначала повышается на   а в конце года  еще более чем вдвое о чем с удовольствием сообщил всему миру шах Ирана Реза Пехлеви  
13377	Тридцать восьмой год правления шах Ирана Мохаммеда Реза Пехлеви оказался 
13377	Тридцать восьмой год правления шах Ирана Мохаммеда Реза Пехлеви оказался 
13377	В Камбодже играл в теннис с Сиануком того свергли потом в Иране  с шах и тоже накаркал изгнание  
13377	Но ещё шах Ирана заключил с западными фирмами 
28796	Но мастер есть мастер он нашел вариант защиты он нашел угрозу вечного шах и патовые положения партия затянулась 
13377	Он написал две оперы  шах Исмаил и Наргиз  
13377	И сын вполголоса ответил  Лежит он не в чужой земле   Коммунизм от шах   Шахиня Фаррах была ослепительна точеные 
13377	Но через какое-то время я получаю приглашение принять участие в праздновании годовщины коронации шах Ирана  
13377	Иран  говорил он  благодаря замечательному руководству шах является островком стабильности в одном 
13377	Да и стоит ли обращать внимание на мелочное брюзжание когда по замыслу шах Иран совершает прыжок через столетия 
13377	Поэтому для президента США полной неожиданностью явилось сообщение о беспорядках в Иране начавшихся всего полгода спустя после того как он поднял тост за мудрое руководство шах  
13377	Весь Иран был убежден что это дело рук службы безопасности шах САВАК заподозрившей что в кинотеатре 
13377	Колыванова будет отец-шах я шахиня а они дочери 
13377	На следующий день беседуя с нашим министром я как бы невзначай завел разговор о Тегеранской конференции и сказал Между прочим Рузвельт и Черчилль принимали шах Ирана в своей резиденции а 
13377	Родился он в Иране но не поладив с режимом шах бежал в Германию где получил 
13377	Начальник Управления Оганесян долгое время служил при посольстве в Иране по линии КГБ и добывая один из секретов шах ин-
28796	Это был решающий момент к которому Оборин тщательно подготовился шах белому королю можно было объявить 
28796	Зевака муж   Они играют в шахматы  Юнона жен   шах  Даниил муж   Закрылся  
28796	Супружеская жизнь и шахматы  в них так много схожего развитие комбинации жертвы безвыходные позиции шах и мат  
28796	Кстати Открывшаяся еще в ноябре  сессия Октябрьского райсовета столицы напоминает вечный шах  
28796	Помню что сам мирный договор мной и наверное многими моими сверстниками воспринимался как некий политический шахматный ход мы уже играли в шахматы с некоторой потерей качества для будущей грандиозной комбинации с шах и матом всему капиталистическому миру 
28796	Вскоре по моем приезде издох один из слонов присланных в подарок императрице Елизавете Надир-шах и я слышал что при 
28796	Сколько можно держать девушку под вечным шах  
28796	Он располнел посолиднел обзавелся женой и детьми но продолжает писать роман держа под вечным шах нашу литературу  
13377	Царь погладил ногу коня и она вдруг ожила в его руках сначала согнулась в колене а затем свободно вытянулась налитая силой так как слово шах было истиной   
13377	В альбоме с марками его привлекли портреты царей шах султанов магараджей президентов и прочих 
28796	тона   или допустим определить характер по типу лица или если нужно пояснить что улица Толмачева раньше носила название Караванной ввиду того что там квартировал караван слонов подаренных иранским шах императрице Анне Иоанновне  
13377	Но вот фанатики убили в Тегеране русского посла Александра Грибоедова и желая задобрить рассерженного царя персидский шах подарил ему свой алмаз  
28796	Противники разменяли еще по паре пешек Ботвинник дал зачем-то на последнем перед контролем времени сороковом ходу шах ладьей и на огромной доске 
28796	Но тут Ботвинник неожиданно двинул пешку на черного короля   шах машинально подумала Инга   В зале 
28796	Тогда все еще не очень уверенно Юра протянул руку к ферзю на доске    шах   Ничего не заметивший всецело погруженный 
28796	Бруно торжествующе объявил двигая фигуру на шахматной доске    Вот вам вечный шах   И потирая руки заметил ехидно 
13377	Однажды шах молвил ювелир  О царь царей 
13377	Ты покорил весь мир  Ты всех владык величьем превзошел  Достойным должен быть и твой престол   О шах  Твой лик  счастливый лик зари 
13377	Пусть прочие владыки и цари Довольствуются деревом простым  Но твой престол  да будет золотым    Всем сердцем принял шах такой совет   О светоч знаний 
13377	О его приближении возвещают четыре горы-одиночки Юрак-Тау  Сердце-гора Куш-Тау  Долгая Тра-Тау  Шихан и шах Тау  Царь-гора  
28796	Вы своими молниеносными репликами неопровержимыми доводами приперли суд к стенке сделали как мы шахматисты говорим шах и мат  
13377	А вы кроме шах и шахини ничего там не 
