13377	Среди них  шапка Мономаха алмазный трон алмазный венец с тысячью алмазов предметы большого наряда царя Михаила Федоровича престол Бориса Годунова в  году полученный в дар от персидского шах Аббаса лицевая сторона престола инкрустирована 
13377	Слышал я такую легенду будто в незапамятные времена то ли царь то ли шах выписал с запада франков-ремесленников 
28796	На -м ходу Д Бронштейн отказался от ничьей вечным шах и пошел на риск не 
28796	Мы все видали лицо знаменитого гроссмейстера вдруг подставившего ферзя местному любителю Борису Исидоровичу шах  
28796	Ложный же след иллюзорная комбинация пешка идет на  и превращается в коня после чего белые тремя разными очаровательными матами отвечают на три по-разному раскрытых шах черных но черные разрушают всю 
13377	Балдахин над троном был тоже украшен драгоценными камнями причем со стороны обращенной ко двору к приближенным висело украшение в котором был подвешен алмаз весом от  до  каратов окруженный рубинами и изумрудами так что когда властелин сидел на троне он видел камень непосредственно перед собой   Это был знаменитый камень шах   К двум старым надписям присоединилась 
13377	Камень перешел в Персию и почти через сто лет на нем была выгравирована третья также художественно сделанная надпись Владыка Каджар-Фатх али-шах Султан  
13377	Персия должна умилостивить белого царя и с особой депутацией в Петербург отправляется сын шах принц Хосрев-Мирза который в 
28796	Партнер не принял гамбита и ферзем объявил шах  
13377	или Когда я был в Персии то мне говорил персидский шах  
13377	По словам Карикозова он приехал из Персии где был лейб-медиком его величества шах Персидского  
28796	Он двинул несколько раз туда и сюда ферзем как двигаешь рычагом испортившейся машины и повторил Ничья  Вечный шах  Лужин попробовал тоже не действует 
28796	Тут надо не забывать что на белые поля ему становиться опасно потому что черный слон  ценой самопожертвования дает шах черная пешка  превращается в 
13377	Я в Персию не поеду  лениво сказал Грибоедов  в Персии у меня враг Алаяр-хан он зять шах  
28796	Вы обыграли меня в шахматы зато какой великолепный шах и мат устроил я вам 
28796	Но коварная ферзь противника внезапно находит путь откуда-то сбоку проходит в тыл и начинает бить по тылам пешки и коней и объявляет страшные шах а за ферзем приходит стремительный 
28796	Генерал взял конем двух пешек  шах королю  
13377	Персия привычно страдала   Власть шах ничтожна в Персии  Он раздает 
13377	Правда в Персии были персидские казаки части на службе шах рекрутируемые из персов под командой 
13377	Кабинет принца Ферман-Ферма в Персии подал в отставку которая принята шах поручившим составление кабинета Сепехдару  
13377	Русский посланник в Персии вручил шах свои верительные грамоты  
13377	На совещании С Д Сазонова с сэром Эдуардом Греем решен в отрицательном смысле вопрос о возвращении экс-шах в Персию и в положительном 
13377	Представители всего населения Тавриза послали телеграмму Государю императору английскому королю русской и английской миссиям в Тегеран и персидскому кабинету министров о возвращении в Персию Мохамед-Али-шах  
13377	Передают что на это уже последовало согласие сфер которые Магомет-Али уверил что впредь не будет делать попыток к новому выступлению против Персии   Живет экс-шах очень скромно  Никого положительно не 
13377	По сведениям из Тегерана Магомет-Али-шах перед выездом из Персии получил 
13377	Известие об отбытии из Персии Мохамеда-Али-шах произвело среди его сторонников удручающее 
13377	Из слов Асквита и лорда Крью во время прений по поводу тронной речи выяснилось что экс-шах будет удален из Персии и 
13377	Персия  Конец авантюры экс-шах   Тегеран     
13377	Русский консул в Астрабаде по предписанию тегеранской миссии отправился в Гюмиш-тепе к Магомету-Али с миссией сообщить последнему решение русского английского и персидского правительства которым экс-шах предлагается получить назначенную ему пенсию 
13377	Эти воины возвращаются домой потому что шах не платит им жалованья  
13377	Остается только один уголовный элемент у которого только два выхода или защищать дело экс-шах или садиться в тюрьму  
13377	По сообщению из Одессы женою ех-шах получены от супруга из Персии 
13377	В заключение ех-шах говорит что он радуется предстоящей 
13377	По сведениям министерства иностранных дел бывший персидский шах Магомет-Али находится в данный 
13377	По полученным в Петербурге сведениям резиденция б шах на юго-восточном побережье Каспийского моря 
28796	Мишка думал о шахматах неуловимо тонкая ажурная сеть комбинаций плелась перед его глазами он тоже смотрел на звезды и машинально соображал что будет если той крупной синей звездой дать шах крайней звездочке из созвездия Большой 
13377	Сын который воюет с отцом   -летний шах Персии Ахмет  От его имени 
13377	От его имени меджелис назначил крупную цену за голову экс-шах  
13377	А между тем юный шах Ахмет горячо любит своего отца 
13377	Одесса   Сегодня вечером неожиданно выехал из Одессы за границу в Австрию бывший шах шахиня и придворные  
13377	Одесса   Сегодня вечером неожиданно выехал из Одессы за границу в Австрию бывший шах шахиня и придворные  
13377	В Одессу вернулся бывший персидский шах Магомед-Али с семьей  
13377	Ваш корреспондент узнал из достоверных источников что завтра вместе с шахиней уезжает за границу и бывший шах  
13377	Бывших шах и шахиню сопровождают их дети 
28796	После шести первых ходов во время которых Антон Антоныч взял пешку и успел сказать шах королю черный медленно проговорил  
28796	Темнело    шах и мат   густо крикнул гость 
28796	С четвертого хода потерял ферзя    шах королеве  -сказал Брюс  
28796	Если бы Привалов уехал нынче в Петербург все бы дело наше вышло швах и мне и Ляховскому и дядюшке  шах и мат был бы  
28796	Одним словом сделаем полнейший шах и мат  
28796	Да ведь избрание его  это такой страшный шах и мат сделанный им России 
28796	Горданов дает шах и мат Иосафу Висленеву  
28796	Продолжение о том как Горданов дал шах и мат Иосафу Висленеву  
28796	Читатель может подумать что автор не сдержал своего слова и обещав показать в предшествовавшей главе как Павел Николаевич Горданов даст шах и мат другу своему Иосафу 
28796	Да дело это нельзя делать шах мат дворянинишку с ветра взять 
28796	Нужды нет что это быдло не будет с нами нам его и не нужно оно будет само по себе и само за себя лишь бы поднялось одновременно с нами  и тогда дело наше выиграно  Мы разом дадим шах и мат  Они для нас 
28796	Во время Людвига-Филиппа ищущий и искомый играли мастерски свою партию каждый ход был рассчитан теперь это не нужно полиция по-русски вперед говорит шах и мат но ведь время 
28796	Нынешние молодые люди считают нелепым фарсом даже удачу этого рода они хотят вести правильную серьезную игру и потому считают вовсе не нужным с первого же разу выводить слона и ферязь чтобы на третьем ходе дать шах и мат королю  
28796	Они также добьются своего шах и мата но их образ 
28796	Но увы все труды все старания рано или поздно кончаются неизбежным шах и матом  
28796	Они называли его вместо Шихматов  Шахматов и говорили что с назначением его и министерству и самому просвещению в России дан не только шах но и мат  
28796	Это было бы тем что в шахматной игре называется шах и мат  
28796	Меж тем Андрей Алексеевич подошел к двум господам которые играли в шахматы один из них замечательный по своей необычайной худобе и быстрым лукавым глазам играл по-видимому гораздо бойчее своего соперника человека пожилых лет в огромном парике с длинными кудрями и немецком светло-голубом кафтане    шах и мат   возгласил торжественно первый 
28796	Не беспокойтесь Аркадий Тимофеевич шах или мат  
28796	Так вы мне делаете шах и мат пешкою  
28796	Да не прогневайтесь иногда простая пешка задаст такого шах что и визирь не очнется 
