41363	 рисуночный методика дом дерево человек быть использовать для получение информация личность ребенок его взаимоотношение окружающий среда целое конкретный человек 
41363	 лола жена она вдвойне вредный потому что большинство хозяйка ввиду большой занятость или просто догадываться что нужно очень тщательно смывать среда мытье посуда порошок как они загрязнять окр среда нужно конечно отказываться полностью 
41363	 катерина лазаррек жена сейчас энтузиазм сохранение улучшение окружающий среда смочь это попробовать 
14872	 уральский ита форум давать понимать гость москва регион создавать свой среда конкурировать который быть непросто 
14872	 форум как считать организатор реально продемонстрировать конкурент оба столица что урал быть свой деловой среда 
41363	 уславливаться также ускорять процесс ратификация рамочный конвенция сохранение окружающий среда каспий который уже подписывать 
41363	 этот точка зрение следовать по-новому взглядывать возможность случайный заражение чужеродный генетический материал через окружающий среда 
41363	 насыщенный комплекс натуральный масло специально разрабатывать для чувствительный кожа также витамин обеспечивать интенсивный увлажнение кожа защита потеря влага агрессивный воздействие окружающий среда предотвращать преждевременный старение кожа 
41363	 являться ошибка приписывать компьютерный устройство человеческий способность осмысливать получать сведение включая тот который оформлять сообщение восприниматься лишь как сигнал излучать окружающий среда являться что иной 
37772	 продемонстрировать периодичность изменение полидисперсность частица наноалмаз водный среда при наложение поле ультразвук 
41363	 основной воздействие природный среда оказывать выброс атмосфера загрязнять 
37772	 многообразный загрязнять вещество попадать водный среда мочь претерпевать она различный 
37772	 результат определение токсичность водный среда следовать что вода 
41363	 биоиндикация это метод который позволять судить состояние окружающий среда факт встреча отсутствие особенность 
41363	 мировой опыт показывать что государство должно оставлять себя только норма связывать безопасность человек окружающий среда 
41363	 совершать колебание одинаковый фаза возбуждать окружающий среда волна длина 
41363	 нужно иметь вид что кроме решение чисто научно-технический задача обеспечение гарантированный безопасность для окружающий среда конкурентоспособность традиционный судоходство 
41363	 случай расплавление активный зона реактор должный быть предусматривать пассивный защитный средство барьер реактор или его предел который должный гарантированный исключать воздействие радиация окружающий среда 
41363	 высокий степень эволюционный успех теория превращение она что дюркгейм еще конец век называть социальный факт иметь вид что человек воспринимать объективировать форма такой теория как неотъемлемый несомненный часть окружающий среда видеть она часть природа 
27906	 рассмотрение второй чтение сначала планироваться среда март затем быть перенести 
14872	 что говорить это наш общий беда связывать отсутствие конкурентный среда воля реальный борьба 
41363	 иметься единичный стандарт фрагментарно отражать технологический операция геологический изучение недра более полно представлять нормативно-технический документ область гидрологический исследование лесной хозяйство охрана окружающий среда 
41363	 основной процесс ведение природоресурсный природоохранный деятельность составлять технология получение сбор обработка информация природный объект результат деятельность представлять продукция информационный ресурс для оценка состояние недра водный объект лес окружающий среда прогноз изменение под 
41363	 рекомендация содержать правило отношение любой неопределенность связывать землевладение право разработка полезный ископаемое вопрос связанный законодательство охрана окружающий среда политический юридический аспект недропользование 
41363	 область природопользование охрана окружающий среда иметься ряд международный стандарт 
41363	 охрана природа раздел гидросфера атмосфера почва земля охрана защита лес флора ландшафт гостр управление окружающий среда 
41363	 исходить цель задача возлагать россия общий анализ можно сказать что стандартизация сфера природопользование современный условие иметь большой значение должный охватывать весь комплекс работа связывать изучение воспроизводство использование охрана природный ресурс окружающий среда включая взаимоотношение субъект участвовать 
41363	 особый актуальность работа стандартизация приобретать связь создание единый информационный аналитический система природопользование охрана окружающий среда еисп 
41363	 научно-технический информационный ресурс соответствующий направление природопользование мочь быть структурировать вид исследование природный объект информационный описание уровень получение обработка использование информационный продукция начинать фактографический данные свойство объект модель объект необходимый для оценка состояние недра водный объект лес растительный мир охрана окружающий среда прогноз изменение под 
41363	 стандарт регламентировать состав структура представление информация природный ресурс охрана окружающий среда 
41363	 для каждый уровень представляться целесообразный иметь стандарт определять состав структура форма представление информация различный направление природопользование охрана окружающий среда 
27906	 посмотреть расписание владимир владимирович понедельник оперативка весь министр вторник встреча каждый отдельность среда другой четверг выяснение 
41363	 все из-за так называть фитонцид который выделять окружающий среда реликтовый древовидный можжевельник 
41363	 сообщение загрязнение окружающий среда новый болезнь домашний животное 
41363	 улучшение здоровье население европа путем повышение качество продукт питание усиление контроль над производство оздоровление окружающий среда требовать совместный усилие только 
41363	 угроза здоровье человек сторона окружающий среда 
41363	 получение безопасный продукт высокий качество учет особенность воздействие они фактор окружающий среда 
41363	 из-за вредность для климат первый вещество управление охрана окружающий среда сша поставлять этот устройство 
41363	 мониторинговый программа основное выполняться лаборатория министерство водный ресурс ирригация орошение министерство здравоохранение королевский научный общество общий корпорация защита окружающий среда 
41363	 организация общий система региональный геоэкологический мониторинг режимный наблюдение состояние подземный вода являться один наиболее актуальный задача при решение общий проблема охрана окружающий среда связывать изучение изменение геологический 
41363	 налогоплательщик вносить бюджет плата загрязнение окружающий среда квартал 
41363	 позволять определять инфекционный агент окружающий среда можно проверять вода воздух почва 
27906	 демин алексей среда суббота подвиг для попадание 
27906	 поздно вечер среда состояться совет директор зао шестой 
14872	 сталкиваться идея понятие политический среда жесткий конкуренция 
27906	 значит надежда чудо иметь право жизнь вечер среда 
41363	 изменять ход событие рыночный среда так-то просто 
14872	 интернет быстро превращаться полноценный профессиональный среда вирусописатель все часто пытаться 
27906	 как-то утро это быть среда июнь элис провожать муж 
27906	 глаз она бросаться последний запись элис среда июнь 
37772	 поливинилацетатный дисперсия гост представлять себя вязкий белый однородный жидкость являться продукт полимеризация винилацетат водный среда присутствие эмульгатор инициатор 
14872	 казаться вот после лагерь заточить ссылка глушь изолировать академический институтский ученый среда что получаться 
27906	 май председатель райисполком богомолов сообщать что следующий среда непременно заниматься этот вопрос 
14872	 вот неудобнов говорить напрасно товарищ новиков который советский народ товарищ сталин оказывать высокий доверие связывать свой личный жизнь человек неясный социально-политический среда 
37772	 различный вариант захват солнце газопылевой межзвездный среда выдвигаться шмидт 
27906	 второй жилец исчезать помниться понедельник среда как сквозь земля проваливаться беломут 
27906	 золотоноша семья жить так ленивый прислуга налаживаться каждый божий день жарить драник лучок весь драник драник понедельник драник вторник драник среда 
27906	 рамка фестиваль уже этот понедельник кинотеатр пионер состояться премьерный показ фильм греческий режиссер алексис алексиу среда 
14872	 мэнни роуман глава крупный хедж фонд британия заявлять что ясный результат выборы являться положительный для британский экономика приводить формирование деловой среда более дружелюбный бизнес 
27906	 крупный застройщик вторник среда продажа вырастать практически десять 
14872	 начинать надо хотя разработка трехлетний программа ограничение тарифный ставка естественный монополия олигархический структура переход режим строгий экономия госкорпорация развитие конкурентный среда народный хозяйство 
41363	 давать такой случай постараться использовать ограниченный ресурс экономика для противодействие неограниченный количество угроза хотя путем повышение эффективность прозрачность использование например осуществлять прямой дотация федеральный бюджет адрес производитель тот продукция который чисто рыночный среда иметь смысл 
27906	 данные отчетный неделя завершаться среда март нетто приток капитал 
41363	 александр гогленков начальник управление стратегический проект осао ингосстрах прошедший год являться для россия целое для страховой сообщество частность время динамичный изменение как благоприятный так неблагоприятный потребовать весь участник страховой рынок напряженный работа оперативный реагирование нестабильность внешний рыночный среда 
14872	 инициировать минэнерго реформа рынок тепловой энергия создавать отрасль по-настоящему конкурентный среда приводить системный энерго 
14872	 критик программа реформа утверждать что предлагать модель только усиливать позиция территориальный генерировать компания тот дескать спать видеть как увеличивать тариф отпуск тепло потребитель убивать при это конкурентный среда обижать владелец котельная 
27906	 мало через два неделя среда апрель спецподразделение итальянский карабинер 
14872	 иначе говорить запад складываться конкурентный среда одновременно сформировываться около десяток 
14872	 компания некогда лидер среди супермаркет британия сталкиваться снижение доля рынок доход суметь адаптироваться более сложный конкурентный среда 
14872	 переход налогообложение экономический результат влечь себя целый цепочка институциональный новация система мониторинг технический регулирование конкурентный среда научно-технический уровень отчет 
14872	 инструментарий взаимодействие государство ресурсный компания известный это лицензионный соглашение регламент условие участие конкурентный среда 
14872	 вообще соединенный штат конкурентный среда очень развитый рыночный сила мощный 
14872	 изначальный задача агентство находить вакансия авторитетный свой профессиональный среда человек 
14872	 его воображение удовольствие переноситься этот двусмысленный культурный среда пользоваться исторический наследие 
14872	 должный сформировываться матричный организация который вертикаль головной разработчик интегратор комплекс ответственный крупный государственный проект горизонталь поставщик технология комплектующий услуга контрактный производство разработка среди который должный быть государственный частный компания функционировать общий конкурентный среда 
14872	 они напоминать что госполитика область культура можно только говорить она еще можно увидеть воочию эфир контролируемый государство большой телеканал без сравнение главный страна инструмент формирование культурный среда 
27906	 провожать понедельник потом вторник среда потом четверг 
14872	 плотность культурный среда определяться помимо прочее насыщенность 
27906	 именно сегодня последний среда месяц когда библиотека санитарный 
27906	 ждать следующий среда герман подниматься тут 
27906	 представлять как приходить следующий среда отрывать вот этот самый дверь 
27906	 сходить прежде чем герман успевать договаривать дверь захлопываться итак следующий среда подытоживать агент приглашать если 
27906	 приходить встреча агент намереваться сказать твердый только когда зайти вестибюль осознавать что сегодня среда вторник 
14872	 олег кондрашов муж помимо это быть еще культурный среда который формироваться отношение человек 
14872	 другой сторона необходимый поддержка государство его заинтересованность борьба страховой мошенничество который создавать благоприятный среда для коррупция злоупотребление 
14872	 вырастать конкурентный среда правильно угадывать направление движение 
14872	 для создание конкурентный среда развитие сектор независимый нефтяной 
27906	 понедельник среда фон непрерывный падение рубль 
27906	 среда валютный рынок сохраняться статус-кво 
27906	 вторник среда фон стабилизация валютный 
14872	 муж выбираться площадь перед московский вокзал сталкиваться убогий мрачный среда перегружать трафик 
14872	 этот конкурс похоже как футбольный матч который как известно состояться любой погода проводить несмотря невысокий активность профессиональный среда 
27906	 подводить итог совещание который первый заместитель губернатор вероника минин рассказывать ликвидация очередь детский сад переселение новгородец аварийный жилье дефицит бюджетный средство повышение зарплата бюджетник прочее владимир булавин заявлять что целое удовлетворять исполнение указ территория новгородский область среда май центральный стадион 
27906	 разработчик документ областной комитет жкх тэк все рассчитывать принятие закон целое уже среда май 
27906	 накануне конкурсный программа парк летие октябрь проходить памятный посадка дерево приурочивать национальный день посадка лес среда май новгородец отмечать международный 
27906	 надо отмечать что апрель рамка акция марш парк проходить ряд мероприятие ход который подрастать поколение приобщаться актуальный тема охрана окружающий среда 
27906	 общий цель проведение семинар становиться обсуждение вопрос связывать развитие сельский туризм новгородский область среда апрель рамка проект 
