27747	 что мочь быть хороший горячий булочка завтрак или большой сытный пирог обед красивый сладкий выпечка ужин 
27747	 вот несколько рецепт завтрак обед или ужин использование тесто 
27747	 ваш завтрак готовый без хлопоты курник или закрытый пирог обед слоеный тесто мастерица 
27747	 быть первый половина день школа после обед универ 
27747	 есть школа завтрак обед перед школа только кофе 
27747	 студент обычно недовольный еда столовая сам все равный готовить крайне редко более что обычно студент жить кампус просто обязывать заключать договор столовая оплачивать сразу весь свой обед завтрак ужин пол 
20613	 приходить время обед окно высовываться мама 
27747	 глядеть раздраженно статуя опускать рука институт насупливаться буркнуть голубчик быть еще работа подавать офицерский палата завтрак обед ужин уносить грязный посуда 
27747	 они она готовить завтрак обед ужин 
32048	 дружок отзываться грубовато недовольно перерыв обед пойти никуда 
27747	 даже слишком плотный завтрак ослаблять внутривидение так что павел алексеевич усваивать привычка обходиться без завтрак первый раз есть обед или если второй половина 
27747	 кормить санаторий преизобильно как-то оскорбительный для василиса так что чуть осваиваться она отказываться ходить завтрак обед приходить семья только 
20613	 время обед тянуться еще вода 
27747	 завтрак это быть поздний ранний обед сидеть стол долго 
27747	 так как все жить один гостиница поневоле оказываться один стол завтрак обед 
20613	 рано железный военный ряд выходить думать виталя кукин возобновлять воспитовать беседа обязывать все прежде все вновь прибывать сортировщик время обед иль после работа обязательный 
20613	 время обед вадим петрович предостерегать чтоб 
27747	 сколько добрый дело можно быть совершать если отвлекаться завтрак обед ужин 
27747	 один только изменяться иногда обед мама готовить мясо конина 
32048	 целый день восемь час утро этот час кабинет быть уже много солнце старый тополь под окно шуметь как морской пена соседний детский парк вовсю заливаться птица кричать иволга легкий ветерок гулять бумага часовой перерыв обед они следователь сидеть 
20613	 время обед старик сташенок сидеть угол 
27747	 обычно завтрак обед съедать все ужин доставаться 
20613	 иногда замечать это время обед когда чересчур медлительно как 
27747	 зато лагерь мясо обед сливочный масло утро 
27747	 тема этот очень ясный год двадцать назад когда любой пионер даша тот число быть надежно известно что семейный кухня скорый время отмирать домашний очаг погасать раскрепощать женщина быть получать завтрак обед фабрика кухня тема этот 
20613	 здешний столовая время обед кончаться время ужин еще 
27747	 прежде все зайти столовая где завтрак кончаться обед начинаться разумеется симочка 
20613	 надо подставлять сковородка под шипеть масло потом время обед этот вкусный жир поливать мамалыга 
27747	 представляться как сюда носить обед ужин завтрак все 
20613	 видно что теперь сам рад потому что черника уже успевать съедать время обед приближаться 
27747	 отношение обед завтрак чуткость белецкий 
20613	 приходить время обед вести они 
27747	 например много время тратить приготовление пища завтрак обед ужин это все вычитываться 
27747	 считать сон лагерник жить для себя только утро десять минута завтрак обед пять пять ужин 
27747	 шлиссельбуржец происходить обратный его тюремный двадцать пять год складываться томительно длинный отдельный промежуток время утренний поверка вечерний завтрак обед 
27747	 что день известие полный быть важный сообщение банкет обед завтрак 
20613	 после обед пятница квартира его 
20613	 после обед высылать вон дежурный при 
20613	 после обед часть общество переходить уютный 
20613	 после обед картошина жена его мура 
20613	 после обед анна осиповна подходить адольф 
20613	 лязг когда быть вдвоем кабинет откровенно рассказывать что этот день проводить довольно беспутно одесса приезжать знакомый француженка кафешантанный певица который обедать контан кабинет после обед кататься автомобиль потом 
42118	 город приходиться тратиться большой парадный обед пожалуй даже бал 
20613	 когда шеин или фриесса собираться близкий знакомый после обед обыкновенно играть покер так 
20613	 лето пыльный после обед время площадка вагон 
42118	 хороший бывать вячеслав илларионович большой званый обед давать помещик честь губернатор 
42118	 это все равный что учить книга как вести себя похороны как держать себя свадьба как обращаться бал как разговаривать званый обед 
27747	 минута как его пленник приступать завтрак обед или ужин должный быть 
42118	 общий обед который участвовать капитон иметь 
27747	 далеко много школа быть готовить прохождение обязательный санитарный эпидемиологический обследование урожай оборудовать хранилище территория учебный заведение чтобы можно быть использовать выращивать продукция для приготовление школьный завтрак обед 
27747	 шнурок рваться девица отказываться обед ужин 
27747	 ресторан вагенэнд быть для леон своеобразный талисман здесь они филипп раз три проводить редкость удачный деловой обед ужин человек 
27747	 блондинка вернуться бассейн быть завтрак спортзал обед прогулка сон ужин бассейн любовь 
27747	 считаться что раб подворовывать хозяин черный фасоль предназначаться корм скот добавлять она обрезок мясо оставаться господский обед 
32048	 запоминать один совершенно сумасшедший типично физтеховский день когда занятие начинаться девять час утро заканчиваться восемь вечер перерыв обед это быть второй или 
32048	 распорядок день заведующая фап таков восемь утро двенадцать час идти прием больной далее после перерыв обед приходиться обслуживать вызов 
27747	 бывало между обед ужин чай печение 
27747	 вкрутую всмятку мешочек перец соль майонез если быть вид яичница обычный вид яичница глазунья как омлет как гоголь-моголь еще даже помнить как завтрак обед ужин первый второй 
27747	 быть уже поздний вечер похоже пропускать обед ужин 
27747	 завтрак обед ужин елизавета романовна иначе 
27747	 ольга моисеенко жена надо генераливать квартира каждый выходной готовить завтрак обед ужин 
27747	 этот слово вспоминаться ежедневно обед ужин состоять рис 
42118	 званый обед вытаскивать карман вилка 
27747	 видимо только что выходить мой любимый где евро накормить такой обед что ужин 
27747	 диетолог советовать хотя один раз неделя употреблять пицца обед или ужин потому что обычный 
42118	 ноябрь тот год гильдия купец тюфин быть организовывать обед бал городской общество 
42118	 завершаться хлопотный день обед бал данные избранный общество 
42118	 вот сегодня этот чудесный солнечный день организовывать танец бесплатный обед под открытый небо который 
42118	 этот дурацкий чудовищный встреча этот безумный семейный обед становиться для она последний капля 
42118	 светский развлечение обед увеселение бал танец концерт 
42118	 свой блог накануне открытие денис обещать стихийный еженедельный событие какой происходить пора квартира хороший друг танец пение семейный обед разжигание камин старый советский 
42118	 жена это век время бал дуэль торжественный обед 
27747	 кухня работать сразу три человек обычно быть даже выбор овсяный каша оставаться ужин картошка мясо или оставаться обед харчо 
32048	 немец народ настолько приучать порядок что выкручиваться прорываться они быть наука обязательный перерыв обед 
27747	 она собирать обед раскладывать кулечек мясо 
42118	 особенно многолюдный быть званый обед январь стена художественный 
27747	 жена если кто-то посоветовать съедать завтрак листок салат обед треть яичный белок 
27747	 жена муж завтрак обед иногда вместе ужин 
27747	 жена это второй завтрак обед полдник 
27747	 жена весь разница что обед приходиться есть холодный 
27747	 жена мочь зайти макдональдс взять салат куриный грудка чем диетический обед 
27747	 жена вот контейнер готовый завтрак обед ужин уже проблематичный брать 
27747	 жена свет этот обстоятельство решать достигать объем останавливаться поэтому продолжать питаться общий согласно диета протасов молочный кислый продукт жирный сырой овощ один раз день вареный или тушеный мясо позволять себя некоторый отступление тип сухофрукты кусочек шоколад чай пара ложка гречка обед 
32048	 час без выходной перерыв обед 
27747	 повод начало событие становиться готовиться для обед команда борщ недоброкачественный мясо 
42118	 крикнуть они вслед коновяз предстоять сейчас общий обед лецкий печально махнуть рука 
32048	 час день быть объявлять перерыв обед отправляться обедать 
32048	 соблюдать закон восьмичасовой рабочий день включая перерыв обед 
32048	 бывший страна побеждать социализм восемь рабочий час включать перерыв обед 
27747	 свой время кто-то исследователь подсчитывать что рыцарь обед съедать столько мясо птица рыба 
32048	 может проходить уже сказать пенсионер перерыв обед успевать спрашивать 
32048	 предлагать воспользоваться перерыв обед тоже пообедать 
32048	 все хорошо только перерыв они обед быть ждать сказать тут 
32048	 час без выходной перерыв обед 
32048	 время перерыв обед купить буфет булочка 
32048	 когда быть перерыв обед ларион возвещать казак что являться 
27747	 таис такой вредный разводный каша суп есть совсем давать консервы фруктовый пюре фрутой няня сейчас уже редко мясо меню такой завтрак каша пшенный гречневый злак для варка овсяный пшеничный редко рисовый обед суп обычный как для взрослый 
42118	 принц уильям его подруга кейт миддлтон иметь официальный статус невеста быть приглашать семейный обед королева 
27747	 все удовольствие если быть обед мясо 
42118	 быть день рождение папа они еще вчерашний вечер сговариваться няня нарывать огромный букет васильков чтобы машенька преподносить они время торжественный семейный обед 
32048	 думать господин провозглашать после перерыв обед или ужин после пара кружка 
42118	 приходить ток семейный обед никто ничто спрашивать зато 
42118	 все включать проезд поезд гостиница карелия завтрак обед экскурсийновогодний бал 
42118	 тут раритетный предмет кухонный инвентарь старинный меню званый обед фотография ресторан начало прошлый век 
42118	 сегодня нужно через три час быть званый обед 
42118	 уже увидеть весь римин семейный эпопея воочию понимать почему сказать время наш семейный обед дача забывать 
27747	 май год кардинал ришелье вдруг замечать что один приглашать они обед дворянин кусать мясо накалывать 
42118	 мансарда где главный предмет обстановка старый бильярд возле желтый диван фирма абит иметься лев журнальница помещение для званый обед расцвечивать контрастный игра синий 
27747	 мясо вспоминать евдокия ивановна земский больница она давать обед свежий арнаутский хлеб густой 
42118	 званый обед смотреть самый начало подавать 
27747	 обед жареный курица картошка мясо 
42118	 диана гиннесса тот мосль впервые встречаться званый обед февраль год 
42118	 поздно прочитывать что надежда александровна блистать многий званый обед без ирония звать себя 
42118	 если натирать пол перед званый обед или вечеринка просто намеренно 
42118	 одеваться как званый обед выглядеть белый ворона 
42118	 там парад костюм белозубый улыбка званый обед стрекот кинокамера 
