25098	 просто потому что учитель первый категория работать гимназия повышенный оклад два ставка получать 
25098	 восьмой разряд мой коллега надбавка молодой специалист это оклад премия получать около 
25098	 базовый оклад премьер спикер госдума совет 
25098	 базовый оклад министр парламентарий оба палата возрастать 
25098	 правильно лицо президент великий страна член правительство министр давать низкий оклад 
25098	 стоить подымать оклад депутат сенатор как они тут 
25098	 решать свой денежный доход парламентарий поставлять вопрос повышение два раз оклад свой многочисленный помощник 
25098	 вот уже депутат архангельский областной дума решать прибавлять себя зарплата оклад теперь равный рубль помимо 
25098	 ставка оклад быть меняться зависимость 
29484	 иногда гость автозаводский приезжать богатый благополучный бабушкин кузина тетя вера который никогда работать болеть знать нужда жить добротный профессорский квартира чистый пруд ходить соседний храм архангел гавриил завещать отдавать самый высокий московский церковь глаголить меньшикова башня старинный образ серебряный оклад драгоценность 
25098	 теперь сидеть машина людмила вернуться через полчаса зареванный сказать что все порядок суббота грузовик автобус зарплата последний два месяц еще размер два оклад похороны 
29484	 освещение храм быть самый что быть театральный полумрак разрубать толстый столб солнечный свет падать довольно высоко располагать окно попадать этот световой поток икона сиять отчищать оклад гореть медный подсвечник куда 
25098	 правда чтобы смягчать демобилизовать офицер впечатление гражданский жизнь они еще двенадцать месяц после возвращение платить оклад воинский звание зарплата 
29484	 один суздальский картина залеплять чистый бревенчатый стена угол перед тяжелый образ серебряный оклад теплиться лампадка липовый стол недавно 
29484	 тихо теплиться лампада перед стекляный кивот кой блистать золотой серебряный оклад наследственный икона 
25098	 при это сайт преобладать позиция указание зарплата договоренность попадаться оклад тыс рубль месяц 
25098	 если выполнять мало зарплата маленький менее старый оклад если перевыполнять зарплата 
25098	 без сомнение покидать родной коллектив если где-то обнаруживаться место более высокий оклад 
25098	 оклад главное переменный часть зарплата 
25098	 отчасти так происходить потому что зарплата зависеть объем продажа составлять фиксированный оклад 
29484	 выкладывать оклад многий икона евангелие храниться 
29484	 металлический оклад оплавляться сам икона 
29484	 век жемчужный белый шитье украшать кокошник парадный одежда оклад икона 
29484	 когда молиться она перед икона лицо излучать свет более светлый казаться чем золотой оклад лампада 
25098	 среди увеличивать зарплата высокий руководство американский удваивать базовый оклад управляющий директор еще июль 
25098	 источник близкий сообщать декабрь что британский банк также планировать увеличивать фиксировать оклад топ-менеджер 
25098	 ведь если хотеть большой зарплата оплачивать курсы повышение квалификация тратить время приобретение дополнительный навык только потом надеяться что ваш оклад благодаря это вырастать 
29484	 кинг привозить себя небольшой книжечка серебряный оклад гравировать надпись 
29484	 скрипина жалеть жемчуг самоцвет для оклад икона церковный утварь 
29484	 пожарский дарить обитель свой земля село богатый риза икона тонкий работа драгоценный оклад 
29484	 входить внутрь задвигать дверь засов простой брутальный железный штырь манер средневековый сработанный один мастерский старый город где хитроумный умелец лудить паять древний монета время второй храм оправлять серебряный оклад щепочка подлинный святой распятие 
20522	 предписываться человек вступать старообрядчество отказываться после увещевание синод или его орган брать уже двойной четверной подушный оклад быть вдвое сравнение 
29484	 каждый изба красный угол шесть икона кружевной подзор широкий оклад 
20522	 поскольку подушный налог примерно процент превышать денежный часть прежний налог понижение общий налоговый бремя мочь происходить благодаря отмена тяжелый натуральный сбор который возможно даже превышать денежный оклад 
29484	 уверять что савин быть адъютант николай константинович участвовать кутеж фанни лира что чуть лично выламывать камень оклад икона заниматься реализация 
29484	 как войско идти воин они сопровождать наиболее почитать икона драгоценный оклад образ древний писание обкладывать золото 
29484	 богато отделывать бисер стеклярус оклад икона народный украшение сумочка 
29484	 серебряный оклад быть пустой как глазница череп 
29484	 итак каравай нести дом вот парадный икона заказывать свадьба глядеть кипарис серебряный оклад самый дорогой взять шептаться зрительница 
25098	 размер годовой окладной ставка приказный человек колебаться очень широкий диапазон даже относительно высокий оклад зачастую удовлетворять притязание 
25098	 известный автор документ позволять говорить что дьячество местный учреждение как правило служить рублевый оклад ряд случай этот ставка 
29484	 кузм тот ево упрощение благословлять икона написать святый кир полагать серебреный оклад 
29484	 здесь икона украшать богатый риза вставлять оклад 
29484	 разворачивать несколько икона нож поддевать один оклад 
29484	 дешевый икона оклад латунь надо навещать пункт сбор 
25098	 соответственно середина четырежды осуществляться централизованный мероприятие повышение минимум заработный плата также ставка оклад низко среднеоплачиваемый категория работник 
25098	 государство централизованно устанавливать минимальный ставка оклад повышать заработный плата низкооплачиваемый категория 
29484	 увлекать другой занятие делать деревянный ларец оклад для икона крест 
29484	 память совместный служение его святейшество подарить молитвенный память блаженный папа патриарх александрийский весь африка петр владимирский икона божий мать изукрашивать оклад 
29484	 наконец какой цель сам чудотворный икона который без легко потерять обрамление сиять оклад драгоценный камень лампада занавесь раз 
29484	 автор разыскивать опубликовывать акт комиссия помгол изъятие собор год пуд серебряный оклад икона утварь 
25098	 состав показатель обследование заработный плата профессия должность позволять анализировать структура заработный плата основной вид выплата оплата тарифный ставка должностной оклад премия вознаграждение 
25098	 мнение александр починка предлагать правительство система оплата труд позволять наиболее справедливо рассчитать зарплата любой бюджетник помимо твердый оклад законопроект предусматривать сохранение выплата над 
25098	 например оклад учитель общеобразовательный школа диплом 
25098	 оклад декан дневной отделение вуз 
25098	 сентябрь школьный преподаватель подымать оклад процент средний 
29484	 быть случай находить никола угодник век серебряный оклад два старопечатный книга 
29484	 набор серебряный столовый прибор швейцарский часы мозер образ николай угодник серебряный оклад граммофон денарий александр 
29484	 сколько быть продавать десять икона середина век серебряный позолотить оклад украшать изумрудный аметистовый кабошон 
25098	 доводить размер средний ставка должностной оклад уровень профессорско-преподавательский состав высокий 
25098	 пояснять никакой фиксировать или минимальный размер тарифный ставка должностной оклад бюджетник как это устанавливать сейчас 
25098	 сверху федеральный закон или постановление правительство быть устанавливать лишь рекомендательный значение ставка оклад конкретный размер 
25098	 рекомендация который практически единодушно принимать слушание говориться что необходимо закреплять федеральный закон следующий принцип тот ставка оклад бюджетник который устанавливать организация 
25098	 предполагаться что тарифный часть заработный плата оклад ставка увеличиваться больший 
25098	 ставка оклад работник бюджетный сфера федеральный 
25098	 конкретный значение ставка оклад также размер надбавка становиться 
29484	 время последний вторжение оклад икона приходиться продавать чтобы купить 
29484	 кирилловый белозерская обитель вологодский область мастер изготовлять резной оклад для икона крест знаменитый 
25098	 минфин выделять средство установленный численность госслужащий действующий ставка должностной оклад 
25098	 дело только что момент для реализация выбирать самый удачный один прибайкалье задолженность зарплата составлять сотня миллион рубль педагог возмущать отказ государственный регулирование оплата труд передача полномочие определение индексация размер оклад ставка региональный 
25098	 повышать бюджетник декабрь год ставка оклад раз 
25098	 закон тарифный ставка оклад первый разряд единый тарифный сетка 
29484	 последний четверть век сольвычегодский эмальер мастер другой город становиться применять роспись эмаль особенно изысканно украшаться оклад для икона характер нанесение 
25098	 основной часть зарплата становиться все-таки оклад или ставка результат заработок 
25098	 прошлый неделя она принимать постановление который указывать что при доработка правительственный проект должный быть предусматривать правовой финансовый гарантия минимальный размер ставка оклад тарифный надтарифный фонд оплата 
29484	 стенной шкаф деревянный панель находить икона рублевский школа золотой серебряный оклад старинный алтарь металл 
25098	 проект концепция реформирование система оплата труд работник организация бюджетный сфера предусматривать передача полномочие определение размер ставка оклад бюджетник срок порядок они 
25098	 оплата процесс труд его конечный результат соответствие тарифный ставка должностной оклад работник учет доплата надбавка 
25098	 оплата труд работник занимать тяжелый работа работа вредный или опасный иной особый условие труд устанавливаться повышенный размер сравнение тарифный ставка оклад устанавливать для различный вид работа 
25098	 многие тот кто все подписывать контракт уже готовый расторгать как следовать документ они устраивать низкий оклад условие жизнь псковский 
25098	 при повременный система оплата труд зарплата молодой работник выплачиваться основание установленный тарифный ставка должностной оклад пропорционально отработанный время или 
25098	 весь решение размер ставка оклад предлагаться отдавать уровень регион 
25098	 это разумеется потребовать увеличение крайний мера раз фонд заработный плата чтобы как полагать счет государственный средство подымать оклад надбавка общий уровень материальный 
25098	 должностной оклад тарифный ставка соответствие 
25098	 индексация или повышение размер должностной оклад тарифный ставка работник осуществляться 
25098	 требовать сохранять федеральный гарантия весь ставка оклад оплата труд образование 
25098	 своевременный выплата гарантированный уровень ставка оклад педагог весь регион 
29484	 вещь экспозиция представлять роскошный золотой оклад старинный икона украшать жемчуг 
29484	 вот вот платье дева мария словно иконка золотой оклад 
25098	 менее кабинет министр обещать существенно подымать оклад бюджетник 
25098	 все это сочетание традиционно низкий оклад делать работа октябрьский ровд 
25098	 музыкант давать высокий ставка оркестрант обрадоваться оклад хорошо бывать двести шестьдесят 
25098	 все-таки только высокий оклад бесплатный дорога потянуть 
25098	 быть директор крупный завод отец получать оклад два раз маленький 
25098	 проверка показывать что руководитель многий предприятие особенно заботиться рачительный рациональный использование финансовый возможность предприятие отдельный они много занятый обустройство собственный благополучие устанавливать себя свой окружение неимоверно высокий оклад 
25098	 между без всякий финансовый экономический обоснование попов самовольный утверждать текущий год новый штатный расписание устанавливать себя другой работник аппарат чрезмерно 
25098	 несколько раз превышать 
29484	 когда молиться она перед икона лицо излучать свет более светлый казаться чем золотой оклад лампада 
25098	 что еще действовать проверять как красный ткань бык так это высокий оклад сотрудник ант премия начислять 
25098	 служащий ипать получать советский мерка высокий оклад валюта генконсультант кузенков 
29484	 золотой оклад сгибать закатывать ковер 
25098	 последний год они как рассказывать серафима повадиться она шанежка нести пирог горячий рыба малосола она нуждаться приношение пенсия она быть заслуга персональный самый высокий оклад два орден пять медаль 
29484	 граве подымать глаз огромный золотой оклад икона 
25098	 просто тут никакой высокий оклад хватить жена василий 
25098	 чтобы бороться воровство витта давать служащий винный монополия сравнительно высокий оклад чем привлекать несколько хороший состав 
25098	 нет быть честолюбец карьерист гнаться высокий оклад хотеться лишь скоро уходить 
25098	 после бурный протест против поощряться начальство доносительство быть переводить низкий оклад замостье где находиться тогда 
20522	 приказ император родственник ломоносов быть исключать подушный оклад забытый поэт опять 
29484	 старинный письмо драгоценный серебряный золотой оклад беда беда большой 
25098	 сто девяносто это только оклад пояснять далеко парень именовать василий 
25098	 иметь научный степень главное печатный труд специальность мочь конечно получать здесь при университет ничто кроме доцентура весьма низкий оклад лев 
29484	 красноватый сумрак под свод потрескивание восковой свеча поблескнвание золотой оклад икона запах кадильный дым 
25098	 результат баталер быть только смещать время низкий оклад пользование ремингтон 
25098	 петров переводить низкий оклад увольнять 
29484	 для глаз привыкать только хлеб трава проселок дегтярный телега курной изба лапоть посконный рубаха для ухо привыкать тишина пение жаворонок писк цыпленок кудахтанье курица глубокий купол грозный седовласый саваоф простереть длань над сиреневый клуб облако над свой волнистый веять риза золотой иконостас образ золотой оклад жарко пылать светлый золотой костер 
