36483	рок певица шерить кроу проводить май уникальный концерт она быть выступать борт 
36483	этот концерт рекламный акция новый услуга 
36483	так давно состояться прекрасный концерт казарновская бартолини всякий 
36483	особенно какой-нибудь концерт город большой один ночь 
36483	юбилейный концерт быть благотворительный декабрь 
36483	декабрь республиканский дворец культура состояться юбилейный концерт сборный команда квн 
36483	зритель мочь приносить концерт подарок сувенир 
36483	концерт коллектив зритель предоставляться возможность петь 
36483	зритель быть мой концерт быть кайф 
36483	гитарист юрий матвеев скрипач артем якушенко приправлять звук свой инструмент изрядный спецэффект устраивать сцена форменный музыкальный камлание их концерт завораживать зритель бывать некогда 
36483	этот цель проводиться различный мероприятие конференция выставка юбилейный концерт 
36483	природа волноваться приход ночь зритель концерт клуб 
36483	сразу новый год сказать лева мы быть концерт студент второй курс 
36483	тогда вы мочь понимать он отличаться любой наш концерт 
36483	концерт кончаться мы выходить улица 
36483	передавать концерт легкий инструментальный музыка сказать дикторша 
36483	рок-музыка новый имя давно появляться тот кто становиться известный двадцать год назад сей пора успешно ездить концерт иметь серьезный медийный поддержка 
36483	кстати музыка любить все отовсюду нестись обрывок песня марш оперный опереточный ария концерт заявка радиослушатель 
36483	концерт французский композитор автор музыка к 
36483	библиотека появляться лаборатория терменвокс где быть проводиться концерт лекция история музыка 
36483	московский международный дом музыка этот день состояться концерт ансамбль виртуоз тель-авив 
36483	городской дворец культура биробиджан проводить пуримшпиль ребенок игра конкурс праздничный концерт 
36483	день металлург липецк отмечать фестиваль липецкий городище концерт праздничный салют 
36483	наконец мы проходить музыкальный вечер концерт фестиваль они библиотека бывать 
36483	шарль азнавур план будущее свой концерт москва который состояться 
36483	юбилейный концерт реченька сам хозяин выступать 
36483	книга исаак давыдович гликман мейерхольд музыкальный театр я взять себя мюнхен милан где мы быть юбилейный концерт посвящать пичайковский 
36483	юбилейный концерт столетие оркестр который 
36483	решать быть юбилей концерт состояться 
36483	первый отделение юбилейный концерт более все поражать время 
36483	ведущая концерт наталья желявская напоминать зритель что 
36483	я получать сегодня незабываемый впечатление ваш концерт 
36483	во-вторых среда четверг оперный театр всегда давать концерт классический музыка 
36483	входить взять буфет баночка джин-тоник тримурти пакет чипсы амитаба садиться начинаться концерт солянка занафталиненный поп дива 
36483	гаснуть свет зал трансформироваться сцена сцена зал зритель музыкант сбросить телесный хитиновый оболочка обнимка неспешно отправляться путешествие восток ледяной ветер нечеловеческий музыка виленин который оказываться сам себя продуцировать концерт оканчивать далеко все 
36483	никто сомневаться она супруг бандит это мешать цеце собирать десяток тысяча зритель каждый концерт 
36483	тогда по-настоящему мы забивать тревога собирать спектакль концерт зритель это принимать 
31612	шумный скандал газетный пасквиль который сопровождаться премьера почти весь его сочинение период сочинение премьера песня гурре консервативный венский публика устраивать автор настоящий овация что шенберг отреагировать довольно своеобразный концерт он буквально сила выталкивать 
