36977	 рассказывать невероятный художественный остроумие мимикрия который объяснимый борьба жизнь грубый спешка чернорабочий сила эволюция излишне изысканный для обман случайный враг пернатое чешуйчатый прочий малоразборчивый столь бабочка лакомый словно придумывать забавник живописец для умный глаз человек догадка который мочь далеко уводить эволюционист наблюдать питаться бабочка обезьяна рассказывать этот магический маска мимикрия громадный ночница состояние покой принимать образ глядеть змея один тропический пяденица окрашивать точный подобие определенный вид денница бесконечно она отдаленный система природа причем ради смех иллюзия оранжевый брюшко иметься один складываться другой оранжевый паховый нижний крыло своеобразный гарем знаменитый 
19801	 вообще-то журавль мочь спать стоя засовывать при это голова под крыло 
36977	 бедный пичуга пытаться удерживать равновесие помощь правый крыло левый видимо быть вывихивать или 
0	 хотеть чтобы она повреждать крыло еще большой потому стараться 
36977	 первый время бояться что овсянка расшибать себя лоб или повреждать крыло 
0	 круто свертывать вниз окраина деревушка слагать гудеть крыло становиться внюхиваться эфир 
29548	 заунывный вой нагреваться башка крыло сновать мурашки зоб спирать 
36977	 человечек молча наблюдать его работа переставать танцевать пламень горн вокруг даже казаться крыло радуга 
0	 брат еще только расправлять криминальный крыло помалу осваивать нехитрый искусство шантаж 
29548	 сплав находить свой место для верхний поверхность крыло изготавливать прессованный панель 
36977	 если верх крыло работать основной сжатие 
36977	 такой материал впервые изготавливать верхний часть обшивка фюзеляж аэробус наиболее ответственный место перед крыло после 
36977	 однако все равный большой разница размер килограммовый лось тысяча раз большой граммовый землеройка птичка желтоголовый королек мало стрекоза коромысло орел беркут размах крыло много два метр 
0	 тайна чусовой обретение свой род племя вдруг начинать воочию видеть хмурый скала быстрый тень железный караван когда-то пронестись мимо разлет облако вдруг узнавать размах крыло лебедь ермак вечно плыть 
19801	 голубь гулить дудеть наскакивать друг дружка хлопотать спать подсовывать под крыло голова 
20531	 покричать она слетать захлопать один крыло земля 
0	 тронутый выстрел полотнище стая тут там подниматься качнуться вспыхивать пойти над корявый муть залив пятно небо горб крыло тронуть тростник отзываться шторм вздох 
0	 утка гусь полоскать крыло ряпать клюв мелкий зерцало залив 
0	 стая стрепетов заслонять прыткий свет мельтешить метель крыло сечь посвист тугой воздух 
20531	 например сделать вздыбливать волк кабаний голова выдумывать бесхвостый шакал насаждать голова камышовый кот прилаживать окрашивать пепел лебединый крыло 
29548	 совсем жутко выходить трехголовый косуля оснащать веер пеликаний крыло рог налаживать зобастый 
19801	 представитель один обычный вид коромысло голубой иметь длина тело размах крыло 
0	 всегда тепло уютно она укрывать пух обнимать крыло рассказывать сказка 
31524	 огромный голубой глаз крыло золото просвечивать 
0	 знать сколько взмах крыло секунда делать колибри когда 
36977	 центральный часть дом отодвигать вглубь боковой крыло соединять центр высокий башня 
0	 взмахивать крыло полететь над лес 
0	 засыпать потому что охлаждать сердце биться редко крыло мочь складываться так 
31524	 уставать стоять слагать спина крыло садиться пол 
0	 трава доноситься пронзительный стон большой высокий человеческий рост крыло черно-синий перистый ткань ударять 
0	 ворон резануть воздух крыло нападающий отбрасывать успевать 
0	 старик большой тяжелый очки наклоняться чуть заметный движение расправлять крыло 
36977	 пассажирский салон быть шестиметровый ширина крыло иметь корневой часть очень 
29548	 вставать обида сила дажьбожа внук вступать дева земля трояня въсплескать лебединым крыло синий море дон 
20531	 как ученый понимать что крыло космос улетать поэтому 
31524	 посмотреть крыло муха освещать солнечный свет говорить 
36977	 слепой ласточка чертог тень вернуться крыло срезать прозрачный играть 
36977	 двойной наращивание ноэс смысл один словосочетание строчка мандельштам слепой ласточка чертог тень вернуться крыло срезать прозрачный играть 
36977	 слепой ласточка чертог тень вернуться крыло срезать прозрачный играть 
36977	 слепой ласточка чертог тень вернуться крыло срезать прозрачный играть 
0	 приближаться вагончик прибавлять темп лицо его твердеть большой палец снимать предохранитель скатываться изложина опушка отталкиваться переворот выстрел разворачиваться колено другой вагончик выстрел тугой гулкий хлопок пробивать лесной пустошь просыпаться птица вынимать клюв из-под крыло шарахаться сова человек очнуться садиться 
31524	 бабочка самый яркий блеск крыло относиться тропический южноамериканский семейство 
0	 насыщаться валькирия тяжело взмахивать крыло улетать 
0	 парить небо орел двухметровый размах крыло 
36977	 крикнуть повертываться летчик каждый рисунок быть показывать конец крыло сначала правый потом левый 
36977	 это плагиирование вознесение крыло точный мощный мысль 
0	 муха лежать маленький белый лужица слипаться крыло 
19801	 однажды зима бекетовка под сталинград нависать туча вдруг вывалиться двухмоторный мессершмитт крест крыло все бросаться врассыпную через 
31524	 мать располнеть огрузнуть волос красить цвет воронов крыло рысий светлый глаз 
29548	 юго-восточный крыло оставаться сын татищев сергей иванович 
36977	 если этот деталь появляться трещина крыло отваливаться 
20531	 испытатель замечать появление трещина успевать добегать пульт чтобы прекращать испытание как крыло треснуть 
36977	 наш день все много появляться вездеход снегоход современный охота использоваться вертолет спасать нога крыло 
29548	 пользоваться право авторский своеволие постараться представлять перед уважаемый читатель картина что бормотать стенли корб его странный молитва перед операция хирургический крыло вашингтонский католический госпиталь 
0	 весь выходной проторчать голубь замучивать они голова под конец гудеть шумный случка кудахтать гулить ворковать молотить крыло сила нет чердак 
0	 кругом крыло молотить подпрыгивать волос рвать 
0	 шагнуть вглядываться веер струя высокий давление рубануть воздух пойти гром тесать короста грязь колпак коврик крыло мой пассат 
29548	 наполеон рано утро докладывать что войско противник собираться против южный крыло французский войско 
20531	 они услышать они увидеть самолет покачать крыло подтвердить такой образ что засека 
0	 высоко высоко небо пилот еще раз покачать крыло ждать 
20531	 запоминать дядька который палка толкать вперед большой бабочка она хлопать крыло двигаться пол 
20531	 как крыло опять подруга уже 
31524	 длинный глубокий складка вдоль крыло нос 
36977	 если два поставлять крыло лето поколение уцелеть хоть 
36977	 действительно муха дрозофила быть мутация при который муха приобретать лишний пара крыло 
29548	 деформация существовать крыло что подтверждать сам автор игра 
20531	 почему они тогда создавать имитация деформация крыло другой обекты ведь 
36977	 мысль конечно интересный слик имхо принимать весь вот крыло 
29548	 деформация существовать крыло что подтверждать сам автор игра 
20531	 почему они тогда создавать имитация деформация крыло другой обекты ведь 
36977	 пользоваться метронидазол немного помогать постоянно область рот крыло нос этот клещ вылазить 
36977	 добавлять спустя минута секунда ужас крыло ночь писать 
36977	 кароче хватить тут чудик всякий там мутить тема менять про ужассс крыло ночь 
29548	 гаджиев оставаться крыло барановский бабла загнать немерено 
35257	 локомотив рубин динамо сатурн цска крыло совет амкара москва 
35257	 наконец главный сенсация футбол или зенит держать марка крыло совет зенит 
35257	 спартак крыло совет кажеться что это 
36977	 это предопределять довольно значительный угол залегание пласт около западный восточный крыло 
36977	 следовать также отмечать что рамка программа модернизация лазерный уаб тип начало более они снабжать боевой часть кроме для повышение дальность бомбометание величина относ боеприпас проводиться работа оборудование уаб складываться крыло чтобы можно быть поражать цель 
31524	 ромбовидный крыло иметь крылатый ракета треугольный 
29548	 применение оптимальный крыло пассажирский военный авиация 
29548	 теоретический разработка струминский гидродинамика можно уверенно разделять четыре группа аэродинамика крыло теория пограничный слой теория гиперзвуковой 
29548	 теоретический разработка струминский гидродинамика можно уверенно разделять четыре группа аэродинамика крыло теория пограничный слой теория гиперзвуковой 
19801	 казаться нарастание пограничный слой размах крыло позволять усомниться это 
29548	 для повышение дальность бомбометание поражение цель находиться большой угловой отклонение курс носитель вестись работа оборудование уаб модуль содержать крыло обеспечивать механизм 
36977	 пока клетка раздаваться охи ахи вздох другой крыло компания мэри кэй фаберлик 
20531	 движение очень ограниченный только поворот голова рука подымать крыло 
19801	 отличие масса другой интернет сайт создавать непонятный пора увы совершенно понятный цель прокламировать качество чуть ценный ресурс для российский менеджер совершенно открыто существовать развиваться под крыло один самый авторитетный компания 
20531	 потому так расстраиваться когда стоянка какой-то чайник парковаться немного помять крыло его ласточка 
36977	 что жизнь признаваться венька когда николай крючков этот фильм начинать петь махнуть серебряный крыло спина всегда 
0	 это благодаря она наш прежний вождь появляться трибуна усыпальница перед толпа словно мановение волшебный палочка весь собираться красный площадь смотреть сторона спасский ворота руководитель страна будто черт табакерка неведомый как вдруг появляться крыло мавзолей 
36977	 центральный фасад дворец быть затягивать запылить сетка вот несколько год банк мочь изыскивать деньги чтобы начинать ремонт функционировать двухэтажный левый крыло бывший людской здесь располагаться 
20531	 соловей оразбойник интерес наблюдать дракон оценивать сила скорость который они кувыркаться воздух обмениваться сильный удар крыло 
36977	 рев сливаться лязг металлический стена ангар дракон хлестнуть гибкий хвост взметываться расправляться опадать кожистый крыло сбивать нога резкий порыв 
0	 гоярын разбегаться раскидывать крыло тяжело взлетать 
0	 лежать контрабас почти распластываться над спина гоярын между мерно подниматься опахало крыло таня пронестись сквозь гардарик одновременно 
36977	 безголовый воробей еще поерзать крыло сокращаться сдавать еще два алый 
35257	 как сотня год назад шуметь переливаться седой ковыль одиноко вечный сон дремать курган подернуть синеватый марья все так кружить над дикий равнина отрешенный ото все степной орел под крыло который проходить столетие 
29548	 поэтому некоторый оценочный фирма работать схема когда каждый позиция повреждение крыло разбитый радиатор лопнуть ветровой стекло 
36977	 галочка предлагать сотрудница компания кэролин джексон символический изображение крыло ведь собственно это английский 
36977	 вроде обычный если приглядываться правый крыло трехэтажный левый только два 
31524	 следующий мгновение неподалеку как крыло стрекоза распахиваться стеклянный дверь носильщик 
36977	 крыло распахиваться хлестать воздух этот 
36977	 хорошо все это сказать поэт геннадий шпаликов бывать крыло художник портной железнодорожник 
19801	 они можно относить компоновка хвостовой часть самолет высокоэффективный механизация крыло многоколесный шасси топливный система система 
20531	 большинство вид птица линять постепенно маховой перо один или два симметрично выпадать правый левый крыло заменяться новый 
0	 почему удивленно слагать крыло нервно восклицать рома асанов 
20531	 бабочка грудь трепетать затихать снова бессильно взмахивать крыло такт дыхание пока 
29548	 ход испытание проводить центральный аэрогидродинамический институт удаваться устанавливать что вредный примесь железо кремний сильно снижать конструктивный прочность крыло 
20531	 побрести вниз точно серый бабочка надрывать крыло 
20531	 так стоять откинуть голова расправлять плечо рослый человек пятнистый армейский штаны шнуровать ботинок колено лосниться обнаженный торс два огромный крыло 
31524	 ладно шутка сторона хозяин слагать крыло теперь становиться значительно высокий 
0	 ангел преклонять колено прикладывать палец губа распростирать крыло 
36977	 останавливаться оглядеться победоносный вид пиф вдруг замечать что перо крыло ангел хранитель быть окрашивать 
31524	 весь мир полный стрекозиный крыло синий изразец ассирия 
0	 человек охватывать паника бежать бежать топтать стрекозиный тело ломать синий крыло оскальзываться падать лицо 
31524	 два вместо четыре боковой дверь открываться наверх крыло чайка 
20531	 убегать страус отрываться далеко вперед пользоваться время бега нога крыло подымать как парус 
36977	 утешение публика объявлять что билет действительный для новый демонстрация через несколько день когда починять винт крыло 
29548	 для путевой устойчивость качество руль направление задействоваться концевой поверхность крыло 
29548	 конец март московский международный дом музыка состояться торжественный церемония вручение национальный авиационный премия крыло россия 
29548	 конец март московский международный дом музыка состояться торжественный церемония вручение национальный авиационный премия крыло россия 
29548	 победитель лауреат премия крыло россия становиться 
0	 точно так отказываться забросить малолетка брать они под свой крыло инструктор взрывник старший лейтенант алексей 
36977	 это несколько вещь фибрагимов красивый выразительный крыло перекликаться античность ника 
19801	 этот аппарат создавать схема тип летать крыло иметь размах 
29548	 плавный сочленение крыло фюзеляж позволять обеспечивать создание 
36977	 станция активный помеха устанавливать два контейнер конец крыло эффективно подавлять радиоэлектронный система управление 
29548	 тиран состоять авиационный крыло куда входить истребительный бомбардировочный истребительный 
36977	 этот период асра насчитывать человек иметь свой состав два армейский корпус шесть отдельный бригада территориальный оборона корпус ввс пво четыре авиационный крыло три зенитный бригада 
36977	 состав авиационный крыло входить два эскадрилья боевой авиация 
