36977	 надо быть частично разбирать снимать оперение тот число консоль крыло 
20531	 наина птица наш белый крыло два ряд спина 
19801	 москва лицей тема работа история развитие самолет дисковый крыло 
35257	 заявление лидер политический крыло тигр освобождение тамил илам тоть 
19801	 опыт продажа подобный недвижимость быть кто-то еще рассказывать андрей патрушев глава пресс-служба компания выходить из-под крыло 
31524	 оба сторона задний часть фюзеляж располагать плоский обтекатель являться продолжение сочленение крыло фюзеляж который крепиться 
19801	 самолет иметься узел наружный подвеска три они топливный коммуникация шесть под крыло один осевой линия фюзеляж 
36977	 дом кроме уже упоминать четыре секция иметься два этажный крыло так что быть мини 
19801	 это необходимый для чтобы облегчать переход училище колледж из-под крыло минобразование наука под 
20531	 больной птица отмечаться тело наличие оголять место поломать выворачивать несимметричный перо крыло 
19801	 авиационный крыло человек насчитывать пять самолет 
19801	 особенность структура воздушный сила тихоокеанский флот являться что состав акр рэб самолет выделяться эскадрилья состав авианосный крыло для несение боевой служба 
19801	 шесть патрульный эскадрилья самолет эскадрилья ртр рэп самолет отдельный патрульный самолет выполнять тот задача что атлантика состав патрульный разведывательный сила тихоокеанский флот организационно сводить два патрульный разведывательный крыло базирование канеох 
20531	 мясо сельскохозяйственный животное мочь храниться домашний холодильник без заметный признак порча более день тогда как поверхность тушка птица после день хранение почти всегда появляться слизь полость под крыло посторонний запах 
19801	 перспектива смочь конкурировать кроме боинг предлагать проект самолет поворотный крыло супер фрог также класс 
19801	 декабрь год начинаться пропагандистский тело радиовещание ирак борт самолет зоя коммандо соло состав авиационный крыло командование сила специальный операция ввс 
19801	 тогда попробовать взлетать мама полагать под крыло уснуть 
19801	 усталый садиться бревно под три большой дерево раздумье отвлекать свист крыло всматриваться из-под ладонь 
19801	 длина самолет высота размах крыло площадь 
31524	 размах крыло один крупный бабочка агриппина 
20531	 чувствовать себя свободно как птица который давать крыло 
36977	 уверенность что несмотря недуг этот крыло быть служить тот пора 
35257	 нынешний реальный оппозиция капитал это прежде все компартия под она крыло входить народный патриотический союз 
19801	 взять под крыло сдаваться милость побеждать 
29548	 зафиксировать повышение температура шахта для шасси левый крыло челнок перед катастрофа составлять 
19801	 работать центральный аэрогидродинамический институт цаги находить математический решение важный практический задача смертельно опасный разрушительный колебание крыло шасси самолет флаттер 
20531	 огромный черный птица странноватый перепончатый крыло 
35257	 массовый акция идти привлекать внимание большинство сми многие полагать что такой путь формироваться молодежный крыло партия власть должное обеспечивать она 
20531	 раскрывать над они крыло мотопланер защищать любой охотник 
20531	 колотить крыло воздух они учиться аэродинамика 
19801	 пока оставаться под крыло государство гарантировать максимальный сохранность 
20531	 почувствовать как нечто важный стремительный птица шмыгнуть мозг зацеплять крыло какой-то потаенный уголок мой забросить 
19801	 знать что под крыло профком пермнефтеоргсинтез под руководство опытный 
19801	 шестидесятый год мода песня джони бой под крыло самолет глядеть она вслед 
20531	 многофакторный анализ почему все получаться внимательный читатель наверное замечать над весь свершение г-н бернштам словно распростирать свой крыло птица цвет аквамарин госпожа удача 
35257	 скоро все нынешний квартет аутсайдер спартак мечесть крыло совет молот прикамье оставаться 
20531	 они слегка раскачивать ива слово звучать такт качание куртка укрывать они крыло вздыматься темнота опускаться 
19801	 нарисовать самолет что видеть крестообразный большой крыло небольшой закрылок это сообщать 
19801	 максимальный скорость дальность полет взлетный вес размах крыло около длина самолет 
19801	 под крыло быть ядерный полигон 
19801	 гусев потом рассказывать что самолет карчевский внезапно потерять скорость начинать валиться крыло двигатель казаться срезать 
35257	 цель добиваться отстранение власть ссср умеренный крыло большевистский партия глава 
20531	 темнота распахиваться перепончатый крыло покрывать неряшливый письмо будто они 
20531	 раненый птица ошалело колотить земля крыло 
31524	 жилкование оба пара крыло сходный задний 
31524	 костальный жилка простой образующая передний край крыло субкостальный почти прямой 
31524	 подбрасывать вверх потом ломать крыло лапа 
19801	 самолет ставить крыло наезжать танк 
19801	 мать ждать освобождаться под крыло вернуться непутевый 
19801	 дело что главный источник аэродинамический сопротивление самолет являться крыло 
19801	 если хотеть давать самолет больший маневренность крыло нужно сделать большой 
19801	 природный функциональный робот заточить клешня зуб прочий крыло под конкретный функция 
19801	 существование под крыло богатый родственник идиллия нисколько 
20531	 думать что после длительный заточение птица ослабевать смочь взлетать однако голубь удивление бодро подниматься крыло упархивать синий даль 
36977	 вырезать цыпленок хребет отрезать уровень второй сустав крыло порезать четыре часть 
19801	 поздно под крыло быть выпускать версия 
20531	 изо весь сила они махать крыло казаться вот-вот упасть 
36977	 явлинский если кто мочь отбирать избиратель так это коммунист правый глазьевский крыло что разумеется полезный для все 
35257	 так представитель кпрф сводный брат леворадикальный крыло сей пора использовать примелькаться 
35257	 однако команда мамут переставать интересоваться российский футбол конец август пойти слух что мамут вести переговоры приобретение контрольный пакет акция питерский зенит затем короман оказываться самарский крыло совет 
20531	 географический положение санкт-петербург самара также футбольный традиция зенит крыло совет давать они право 
35257	 если компания александр мамут приобретать зенит крыло совет тарханов скоро все 
31524	 причем спс более радикальный крыло 
36977	 отбортовка панель хоть там предусматривать сливной отверстие длительный время мочь находиться вода проникать туда тот число через щель между крыло резиновый чехол заливной горловина 
20531	 пружинный механизм махолета распахнуть как ангел крыло согласно инструкция винчи может 
36977	 она понимать что она ничто светить часть любовь надо жить ради ребенок ставить они крыло 
35257	 крыло совет самарский клуб камень 
36977	 тот вечер самара главный тема для обсуждение быть разгромный победа крыло даже восхождение любимый 
35257	 крыло совет самара анжи махачкала 
36977	 следующий день быть матч крыло совет зенит 
35257	 крыло совет самара шинник ярославль 
36977	 слеза что быть недаром ведь проливать крыло который бог давать 
20531	 помнить как цветаева спаять блаженно тепло как правый левый крыло 
19801	 авторский кукольный театр екатерина трубицина игрушка получать звание народный взять под крыло хостинский районный дом культура 
20531	 жертва трепетать белый крыло шикарный стерва обольстительница 
31524	 потом неделя весь квартира пуговица крыло подбирать 
20531	 думать триумфатор после спасать они одиночка матч летать крыло приглашать друг праздничный 
35257	 черноморец новороссийск крыло совет самара 
36977	 быть какой-то закономерность что оказываться крыло другой российский 
36977	 быть готовый идти крыло играть хоть забесплатно 
36977	 сейчас понимать что треть сегодняшний сила крыло это тихонов 
20531	 вдруг над самый голова данила услышать шелест крыло иной гусь скользить полет 
31524	 при весь разногласие постоянно вылезать как шило бездонный мешок многолетний разговор один павел алексеевич илья иосифович безусловно совпадать ясный ощущение иерархичность знание где самый низ самый основа лежать конкретика вес форма цвет количество хромосома или ножка или жилка крыло 
36977	 когда окончательно созревать желание уходить монопольный система союзгосцирк весь чиновник быть наплевать никто возражать прежде все потому что мой судьба артист они вовсе занимать это знать просить они только один давать уходить под крыло мильруд 
36977	 май набирать крыло уже плыть над земля 
20531	 далее перебираться через ерик яков словно крыло лететь 
20531	 страшно кричать ребенок понимать что они страшно приятно делать вид что страшно чтобы потереться материнский крыло напоминать себя она что 
20531	 никак мочь разглядеть они крыло спина 
20531	 один они тяжко хлопать крыло перелетать через улица село 
20531	 нина константиновна писать как курица крыло хлопать куда таха таха как так 
36977	 еще быть живой обменять драгоценный зловонный груз тарелка горячий борщ подержать крыло который вернуть 
36977	 самый дело развертывать вбок крыло быть 
20531	 весь жизнь повертываться ветер как просто как удобно крыло ангел 
36977	 тогда молодость вырабатывать свой подпись фазан затейливый росчерк птичий крыло вольно раскидывать перо 
31524	 нет так пылко любить подскакивать потрескивать шипеть быстро вертеться под игла вера васильевна шипение треск кружение завиваться черный воронка расширяться граммофонный труба торжествовать победа над симеонов нестись фестончатый орхидея божественный темный низкий сначала кружевной пыльный потом набухать подводный напор восставать глубина преображаться огонь вода колыхаться парус надуваться голос все громко обрывать канат неудержимо нестись каравелла брызгать огонь ночной вода все сильно расправлять крыло набирать скорость плавно отрываться 
36977	 поцелуй заводить граммофон слышный быть дивный нарастать грозовой голос восставать глубина расправлять крыло взмывать над мир над распаривать 
20531	 бесшумно совиный махать крыло платок облетелый голый стена черный 
36977	 наш крыльцо быть потихоньку отрастать крыло 
20531	 как грустно вздыхать аист погладить медвежонок крыло 
20531	 сам девушка тоненький тоненький рука как крыло 
20531	 как являться архангел херувим серафим как это петься стальной рука крыло вместо сердце пламенный мотор 
20531	 передний часть голова ярко красный цвет темя затылок черный щека белый крыло желтоватый черный белый 
36977	 осень этот стайка постепенно передвигаться многие они оставаться зимовать там где обретать крыло 
31524	 крыло чиж черный полоса нижний 
36977	 момент пение птичка приподымать хвост опускать крыло почти непрерывно находиться 
20531	 помнить маленький церквушка флора лавр она шатровый колокольня как прижиматься ампирный колонна полукруглый крыло вхутемаса 
36977	 хрупкий письменный столик образцовый порядок быть раскладывать толстый словарь прилежный курсистка освещать трепещущий крыло отсвет пламень сжигать пачка наш 
20531	 мочь быть действительно быть падший ангел сваливаться небо черный пепел сгорать крыло 
36977	 пюпитр бехштейновский рояль подымать крышка что делать похожий черный лакированный подымать крыло пегас который несомненно ездить 
36977	 оно быть выходец мой детство когда впервые вместе покойный папа покойный братец вступать площадь святой марк окружать стая грифельный серый голубь хлопать крыло вокруг высота 
20531	 проходить пять минута как они уже висеть над бездонный каньон медленно набирать высота покачивать прощание серебристый крыло 
36977	 по-прежнему быть труп стервятник быть жалкий его глубоко рассекать волочиться земля крыло казаться тратить моль 
20531	 как будто большой крыло всплескивать ударять маленький 
36977	 перед бетонный стена закон беспомощный женщина ходить как перед четырехростовой стена бутырки взлетать перепархивать через она быть крыло оставаться кланяться каждый открываться калиточка 
31524	 ранний солнце ярко отсвечивать скашивать крыло 
36977	 когда газик приближаться орел развертывать крыло неторопливо полететь степь 
36977	 миска еще много быть курятина один ножка один мясистый крыло еще несколько бескостный кусок 
20531	 когда входить лес старый ворона нехотя крик похожий оханье слетать ветка дуб тяжело проковылять воздух опираться крыло как костыль 
36977	 кажется что два мощный сизый крыло распахиваться над город держать 
36977	 тот далекий утро сизый этот крыло казаться только снизу там 
20531	 его панцирь распростирать как крыло дракон или гигантский летучий мышь 
20531	 самый спина каменный бегемот лицо вниз так что быть видный только загорелый спина острый крыло лопатка лежать человек черный 
36977	 передо быть железный дверь даже сумерки понимать как она походить крыло дракон зеленый тонкий перепончатый злой 
36977	 огонь его крыло быть видный отчетливо слабо 
36977	 два голубь трепетать крыло повисать над его колено 
31524	 утро они увидеть под себя лес потом река пароход она кое-где белый пятно одинокий льдина потом сразу возникать хорошо расчерчивать пригород вот уже мелькнуть уровень крыло обшарпывать ель потом аэродромный постройка 
20531	 пока подбегать курица клевать находка успевать несколько раз обходить она напыщенно волочить крыло как захлебываться 
31524	 сделать мощный пружинистый рывок удар крыло лицо оглушать 
20531	 тело петух запрыгать забиваться крыло судорожно трепыхаться выгибаться как будто 
29548	 тут бур левый рука линейка каменный два крыло 
36977	 второй крыло этот осень достраивать один 
31524	 старичок взять курица рука становиться бормотать курица доверчиво кудахтнуть потом старик сделать что-то очень быстрый незаметный видимо ужасный швырнуть курица через плечо она вскрикивать побежать хлопать крыло мальчик увидеть что 
20531	 увидеть какой синева гореть черный крыло селезень сколько веселый насмешливость 
20531	 человек подымать воротник как-то странно особый это видно быть сторона поводить плечо оглянуться направо налево становиться большой высокий вдруг легко прыгнуть словно расправлять крыло ударять кулак лицо эсэсовский 
36977	 вилять тяжелый полный шелковый волос хвост побежать лисица заяц бежать она вслед она подниматься воздух маша тяжелый крыло соединять быть мочь впервые вместе 
36977	 так склонный некоторый называть переоценка конечно противоположный знак тот кто подобно орел сладко чувствовать сила свой крыло парить над скованный беспомощный жертва 
36977	 быть уже совсем темно чистый фиолетовый небо прозрачный кристаллический звезда смотреть окно снегирь спать подтыкать голова под крыло когда уводить сказать ганка 
