36977	 технологический усовершенствование быть столь значительный что появляться фактически новый материал сплав который настоящий время успешно использоваться нижний обшивка крыло всего фюзеляж 
36977	 над сиять быть вечно подвижный эфир полный ангельский крыло создавать пространство пламень 
20531	 казаться усталый плащ свисать плечо как подбивать крыло все замедлять замедлять 
20531	 они оказываться отдельно вынести пристройка когда-то причудливый убирать стена быть расписывать пол выкладывать мозаика ложа украшать морда крыло хвост невиданный зверь 
31524	 сразу боец курочка похожий курица встопорщивать крыло 
36977	 местный предание этот галаня построить береста крыло попробовать летать упасть 
20531	 можно даже называть три образцовый иконографический сюжет пермский звериный стиль это птица распростирать крыло человеческий личина грудь 
36977	 этот небольшой сказ словно светиться изнутри чистота лебединый крыло 
36977	 это особенно ясно понимать чусовая где всегда чудиться что вот-вот мелькнуть дальний поворот снежный отблеск лебединый крыло 
20531	 чтобы осваивать щедрый средство они подтягивать себя нитка железный дорога волей-неволей модернизировать печь приспосабливаться каменный уголь вместо дрова закупать паровой машина сам замечать они один другой терять перо орлиный крыло прадедовский герб 
31524	 можно представлять что чусовая частый крутой поворот полный скорость плотный компактный группа нестись или даже современный теплоход подводный крыло тип ракета или метеор 
19801	 для жизнь под крыло нквд большой подходить тот часть 
20531	 яйцо жеребец тускнеть черный крыло пах 
31524	 носить аккуратный шевелюра абрис выразительный угол крыло нос широкий рот особенный 
36977	 она садиться крепкий ветка расти правый висок хрипло вздыхать подтягивать перебивать крыло 
20531	 хлопание крыло борозда волна звенеть как опрокидываться 
36977	 невидимый дятел один сосна несколько мгновение замолчать возобновлять свой работа тут мальчик удаваться замечать метр двадцать наверху красный перышко крыло белый хохолок 
19801	 последний весить около два тонна иметь размах крыло много метр 
36977	 пока она мало походить стрекоза который привыкать видеть полет крыло сморщенный тельце полупрозрачный 
36977	 взмахивать теперь уже окрепнуть крыло стрекоза перелетать несколько метр 
20531	 пока лиходеевич суетиться возле мальчик ложечка выпаивать отвар зверобой мелисса замечать что глаз его кровиночка странный невидящий будто черный крыло лебедь заслонять белый 
20531	 маленький кикимора при вид тут сваливаться обморок рассчитывать щедрый чаевые демонстрация восхищение аспид только протаскивать мимо свой длинный тело слагать крыло больно отдавливать девушка голова 
36977	 договариваться что быть умирать медленный смерть голод качка противный сумка обида выпрастывать рюкзак атласный перелив крыло охать вылезать сам приниматься 
20531	 где-то высоко над они будто проплывать два огромный безмолвный рыба только потом холодный щека тима настороженный ветка елей скатиться шорох тяжелый крыло 
36977	 заволноваться лебедь хлопать крыло это только казаться бедный 
36977	 когда вернуться обида она уже спать сказать она сладко потягивать крыло разбудить какой-то ненормальный петух 
36977	 подрезать крыло первый для самоутверждение второй 
36977	 вот тот утро когда велька выходить двор она уже греметь ведро птичник курица суматошно галдеть пихаться крыло кормушка 
36977	 быть надежный защита теплый крыло феминистический идея ценность принимать 
36977	 необычайно длинный иногда доходить два метр рукав праздничный костюм тоже должный быть напоминать взмах птичий крыло 
20531	 они двигаться взмахивать крыло который быть что иной 
36977	 если появляться крыло быть первый 
20531	 замечать она немного расправлять крыло распускать веер хвост 
36977	 подъять спор человек два дух мощный один эдемский дверь властелин вечный страж век другой все величие зло владыка сумрачный мир над огненный его порфира гореть два огненный крыло 
29548	 левый крыло оппозиция возглавлять василий прелый 
31524	 слагать крыло садиться краешек крыша 
31524	 слагать крыло садиться краешек крыша 
20531	 уходить помогать кричать кто-то паря опираться воздух мой распростирать большой крыло 
20531	 так любить этот мой крыло потому что они всегда расправляться 
20531	 его винт как крыло стрекоза слагать его железный 
20531	 это значить что самый природа век век ставиться жесткий селекционный опыт если существовать как гласить дарвинизм вариация весь свойство среди они обязательно должный быть вариация снижать съедобность широкий смысл крепкий крыло колючий покров ядовитость отпугивать запах 
20531	 лебедь почуять неладный когда быть уже поздно обвисать грязный сосулька крыло мочь подымать они 
20531	 почему-то перед глаз появляться девочка год уже десять белый платьице махать рука как крыло 
31524	 хозяин неловко разворачиваться задевать острый кромка крыло мой свитер улетать 
20531	 расправлять свой крыло зов господин лететь 
36977	 поскольку птичка быть крыло наверху решать передавать разработка 
20531	 если утро спешивать сейчас случаться какой-то переключение хотеться лететь очередной цель как крыло 
36977	 гранник макс муж быть как-то разговор территория вокруг общага каждый крыло думать что это реальный 
31524	 например наиболее правильный считаться лицо который соотношение параметр верхний нижний губа составлять расстояние линия смыкание губа крыло нос нижний точка 
19801	 зонд представлять себя сигара углепластика длина диаметр горизонтальный руль форма крыло размах 
29548	 дальнейший развертывание наступление быть затруднять левый крыло который первоначальный план должно 
36977	 вот отрывок другой источник более древний велесова книга бить крыло мать сва слава петь тот 
36977	 бесить реклама какой-то творожок что где мужик крыло мотылек 
35257	 конец год воронеж кремлевец проводить очередной пиар акция съезд молодежный крыло путинский единый россия 
36977	 так что как выглядеть муха знать весь размер миллиметр длина серый хитиновый тельце два большой глаз голова хоботок конечно два пара крыло шесть лапка вот собственно 
31524	 зато оставаться пара крыло муха мочь делать четыреста 
19801	 феска чалма дворец опахало джинн балдахин узор тахта шелест тафта подушка ковер кальян фонтан ванна где слуга вино пьяный где править султан где греметь барабан сгонять челядь мечеть под крыло шах знамя аллах 
36977	 слепой ласточка чертог тень вернуться крыло срезать прозрачный играть это 
36977	 далее там быть петух павлин золотой крыло аист журавль утка гусь 
36977	 каждый сторона балдахин стоять серебряный орел распростирать крыло 
20531	 как весь бабочка этот род самец значительно мелкий размах крыло однако 
31524	 южноамериканский тропический совок агриппина безусловно чемпион размах крыло 
36977	 что человек иной раз так забавно приподниматься крыло нос когда улыбаться что 
31524	 как правило разгадка видовой принадлежность скрываться нижний сторона крыло 
20531	 бабочка становиться долго испытывать мой терпение подымать крыло 
36977	 также три новый сборник стихотворение поникать крыло рубеж симфония моль 
20531	 этот чуть по-другому устраивать крыло поэтому человеческий ухо они 
36977	 количество перо каждый крыло хвост 
36977	 оставаться либо предполагать что афанасий быть первоклассный скалолаз либо поверять предание что возноситься туда крыло орел 
20531	 как раз там где перед старинный крыло дворец сходиться улица резиденцштрасса 
36977	 этот легенда видеться образ народ который вынести трехвековой колониальный иго изведывать интервенция из-за рио гранд теперь наконец расправлять крыло 
20531	 лететь теперь подымать один крыло небо другой круто 
20531	 гусь жадно бросаться что упасть тянуть клюв что-то длинный широко развевать свой белый крыло гоготать 
36977	 грозный гусеничный крепость который вращаться броневой башня башня торчать пушечный ствол внушительный калибр люк высматривать наземный цель пулемет другой пулемет спаривать этот время обшаривать небо нет там чужой залетный крыло 
36977	 грозный гусеничный крепость который вращаться броневой башня башня торчать пушечный ствол внушительный калибр люк высматривать наземный цель пулемет другой пулемет спаривать этот время обшаривать небо нет там чужой залетный крыло нет весь 
36977	 первый фотография овал быть запечатлевать старший дочь ольга белоснежный косынка крыло ниспадать плечо крестик 
20531	 как неповторимый движение рука изображать волнообразный полетный мах лебединый крыло 
20531	 она всегда почему-то одеваться черный короткий волос черный крыло перечеркивать лицо когда она медленно 
31524	 дядя валя спускать очки крыло нос подносить глаз 
36977	 зинаида антоновна выпивать пробка бутылка быть фигурка серебряный ангел грустно слагать крыло 
19801	 нестеров жить один жизнь россия конец свой день мочь повторять слово анна ахматова под чуждый небосвод под защита чуждый крыло быть тогда мой 
19801	 рядом быть ромадин сын высокопоставленный живописец лауреат ленинский сталинский премия процветать под крыло папочка процветать достойно 
19801	 однажды лежать крым под крыло стратегический бомбардировщик разговаривать 
36977	 что быть похожий хвост оказываться крыло 
36977	 царить нехороший истерический анархия который стоять темный стена россия махнуть вдруг смертоносный крыло над международный пассажирский трасса ромео 
20531	 хотеться расправлять крыло вслед они 
36977	 юра стоять рядом сидеть оля сверху смотреть тоненький пробор разделять волос два темный крыло 
36977	 это сходство еще усиливаться оттого что она быть широкий отделывать какой-то серебристый мех накидка солнце похожий теперь когда нина плакать опадать крыло 
36977	 шанс спасение она быть описывать еще один круг высота несколько десяток метр чудище слагать свой громадный кожистый крыло обрушиваться жертва 
20531	 вслушиваться бояться каждый утро только один услышать легкий как взмах крыло бабочка дыхание 
36977	 она никогда постареть отлетать молодой позолотить второй уже вечный рождение быть трепетать юный свой свежесть ворковать ничто требовать другой слюдяной стрекозий крыло юный душа 
36977	 лишь через определенный количество время казаться прямо над хлопать жестяной крыло петух день прийти день все-таки 
20531	 становиться слышно как ратуша расправлять свой жестяной крыло петух 
20531	 атласный расшивать ткань топорщиться плечо шея как полусложенный крыло 
36977	 этот тропа редко кто пользоваться так как вести она непростой место водомоина переходить двухступенчатый отвесный колодец грохотать весна талый вода выпускать разный уровень крыло два покачиваться ветер радуга 
36977	 вот выпрыгивать спускной трап это гусь лебедь неуклюже вразвалку покачивать крыло подруливать дебаркадер сердито расталкивать 
19801	 однако глянуть сам иллюминатор там натурально рука подавать под крыло самый крест увивать клок туча 
20531	 как мысль самоубийца дряблый зонд висеть над пляж трос держать невод метеоцентр немой плыть погода все ждать как баба гром перевод рыба свет штиль серебро крыло тень шторм свинец 
36977	 прадед военком армия шаровой молния плыть кабинет сиять лысина что-то приветливо говорить сердитый поэт после чай вести набережная они пить айран лоток причал общество кавказ меркурий смотреть колыхаться волна флотилия арбузный корка чаек распекать мусорный ящик долго долго безупречный линия горизонт взять небо серый крыло бухта 
19801	 серир по-русски галька действительно поплыть под крыло совсем скоро душа 
31524	 затрещать стойка крыло вдруг все заканчиваться 
36977	 конечно создание такой крепкий инновационный пояс дополнение тот образовательный крыло который неплохо вообще 
36977	 ангел ничто похожий тот без крыло 
36977	 весь западный литература немного потускнеть она быть слишком человечный реветь она осознание бессилие почуять плечо еще появляться крыло как тварь скользкий стих 
19801	 напоследок вот что сказать пусть твой студент молиться что под твой крыло попадать 
36977	 темно-вишневый вольво правый крыло разбивать нахальный ментовский номер 
31524	 ага мощность рассчитать три раз подряд дважды прикладываться мой бампер последний раз крыло 
36977	 ведь это признак отряд количество крыло 
19801	 наверное будущий это батюшка матушка яблоко грызть три движение цапать сразу еще один глотать горло из-под китель выталкивать снежный подворотничок зажмуриваться весь мой паршивый солдатчина мазнуть щека зеленый крашеный крыло 
20531	 хранить как зеница око тень крыло твой укрывать враг 
36977	 когда гена скорбеть что сокил становиться размахивать крыло наш обвиняемый сжалиться надо 
36977	 эволюционист морфолог который думать отбор примерно столько сколько эволюционист генетика структура быть понятие гомология означать что орган несмотря весь его отличие можно считать тот самый орган крыло конечность позвоночный животное 
36977	 официальный сайт игра кто хорошо знакомый быть очень легко разбираться интерфейс игра убеждаться что это все тот только один крыло сзади 
31524	 вслед предложение радикальный изменение задний крыло последовать другой который должный серьезно 
36977	 рано расширенный пора быть только крыло нос потом они постепенно расползаться 
36977	 судя описание это точно ужас лететь крыло ночь 
36977	 кто надо тот всегда замечать ужас крыло ночь окт 
35257	 главный тренер самарский клуб крыло совет гаджа гаджиев мочь 
35257	 крыло совет самара алания владикавказ 
35257	 гол рони булыкин домингес торпедо крыло совет панов 
35257	 алания владикавказ крыло совет самара 
35257	 последний трасферный новость наш футбол зенит подписывать контракт анюков короман футболист самарский крыло совет александр анюков огненный 
35257	 лужники шинник крыло совет гол лагевка 
35257	 все помнить что происходить футбольный крыло совет самара когда владелец 
36977	 прикладывать этот жгутик грудь завязывать узел сзади получаться рука расправлять крыло рис 
36977	 быть комната полуподвал крыло где размещаться лаборатория 
36977	 уборная вода надо быть ходить другой крыло административный длиннющий коридор мимо 
36977	 быть комната полуподвал крыло где размещаться лаборатория 
36977	 быть комната полуподвал крыло где размещаться лаборатория 
36977	 быть комната полуподвал крыло где размещаться лаборатория 
36977	 уборная вода надо быть ходить другой крыло административный длиннющий коридор мимо 
36977	 западный крыло быть сосредоточивать весь натуралия 
36977	 однако главный его достижение этот создание первый страна самолет стреловидный крыло преодоление они звуковой барьер 
